,product_id,date_posted,review_title,review_text,scores,compound,sentiment
0,103183,2024-09-17,Keeps me asleep longer,"I don’t necessarily fall asleep faster using Force Factor, Somnapure, but I definitely stay asleep better throughout the night. The ingredients include valerian root, which makes them really stinky, so don’t hold it in your hand too long and swallow quickly. The benefit far outweighs the taste. I believe the recommended dosage is 2 tablets but I sometimes only take 1.","{'neg': 0.052, 'neu': 0.698, 'pos': 0.25, 'compound': 0.935}",0.935,pos
1,103183,2024-05-04,Effective,"Quality is good
Ingredient is from natural herbs
The size is appropriate comparing to price.
Dosage is easy to take.
Effective benefit as advertised
No taste much easy to consume.
I would recommended this product for anybody who needs to have good quality time for sleep.
It safe and sound. 
","{'neg': 0.033, 'neu': 0.59, 'pos': 0.377, 'compound': 0.967}",0.967,pos
2,103183,2024-01-28,A Great Natural Sleep Aid,"I have been using natural sleeping pills for years.  I decided to try Somnapure and it works very well and keeps me asleep.  There is another brand I use but even using those I seem to wake up in the middle of the night but this brand seems to keep me in a sounder and longer sleep,","{'neg': 0.0, 'neu': 0.936, 'pos': 0.064, 'compound': 0.3499}",0.3499,pos
3,103183,2024-01-25,Sleep easily,"This is the best sleep support I have ever tried and I have tried quite a few.  I usually take it when I wake in the early hours and am assured of at least another four hours of sound sleep. The tablets are rather large but slide down with a big glass of water. Two tablets are ample at least for me. I have ordered more.

","{'neg': 0.0, 'neu': 0.9, 'pos': 0.1, 'compound': 0.6369}",0.6369,pos
4,103183,2024-07-14,Sleep well,"I bought these sleep aid tablets for my mom, who occasionally struggles to fall asleep. She's found them helpful, though thankfully she doesn't need to use them very often. They seem to work well when she does.","{'neg': 0.053, 'neu': 0.764, 'pos': 0.184, 'compound': 0.6697}",0.6697,pos
5,103183,2024-03-17,Прекрасно!,"Thank you very much for this product, it suited me, I like the packaging, comfortable and stylish, I will order more of these products, and recommend them to all my friends and relatives! good!!
","{'neg': 0.0, 'neu': 0.595, 'pos': 0.405, 'compound': 0.9491}",0.9491,pos
6,103183,2024-02-17,,This is a wonderful product! Good to help with a good nights sleep . Other health benefits as well. We trust the ingredients and the quality is very good. ,"{'neg': 0.0, 'neu': 0.435, 'pos': 0.565, 'compound': 0.9698}",0.9698,pos
7,103183,2023-12-28,Great, This product promises to be the safe and effective solution to sleep issues.  The label lists herbs and supplements which contain only non-habit-forming ingredients that won't lead to feeling groggy in the morning. ,"{'neg': 0.034, 'neu': 0.695, 'pos': 0.271, 'compound': 0.8601}",0.8601,pos
8,103183,2023-01-27,,"I purchased this product for my father who has sleep problems. He was looking for something natural and different than melatonin he has been using for sometime. Overall, he is very happy with this product and I am happy to be able find a product that helps my father's sleepless nights. ","{'neg': 0.046, 'neu': 0.731, 'pos': 0.223, 'compound': 0.8856}",0.8856,pos
9,103183,2023-10-07,the title accurately describes the product. ,"This product really works. I can say this as I have been a user for many years. The formula really works for me. It really helps me sleep and stay asleep. I take it one-hour before bedtime, and I am asleep in an hour. I highly recommend this product. ","{'neg': 0.0, 'neu': 0.878, 'pos': 0.122, 'compound': 0.6894}",0.6894,pos
10,103183,2024-10-14,I like it!,I just started to use this formula for better sleep and it helps me to fell a sleep.,"{'neg': 0.0, 'neu': 0.718, 'pos': 0.282, 'compound': 0.6705}",0.6705,pos
11,103183,2024-08-14,,"Great supplement, my family liked it, great value for money ","{'neg': 0.0, 'neu': 0.309, 'pos': 0.691, 'compound': 0.9246}",0.9246,pos
12,103183,2024-06-22,really appreciate,high quality and clean ingredients no soure taste even with two dosage ,"{'neg': 0.148, 'neu': 0.671, 'pos': 0.181, 'compound': 0.128}",0.128,pos
13,103183,2024-03-22,,"Great supplement, my family liked it, great value for money ","{'neg': 0.0, 'neu': 0.309, 'pos': 0.691, 'compound': 0.9246}",0.9246,pos
14,103183,2024-02-21,nice,I'm taking it when I have trouble sleeping. It works for me and doesn't invite addiction ,"{'neg': 0.242, 'neu': 0.758, 'pos': 0.0, 'compound': -0.4843}",-0.4843,neg
15,103183,2024-01-22,Fantastic ,Very happy with the quality of the product and packaging. I trust the brand,"{'neg': 0.0, 'neu': 0.601, 'pos': 0.399, 'compound': 0.807}",0.807,pos
16,103183,2023-11-24,Effectiveness ,It works really well. I'm using from one week and it works,"{'neg': 0.0, 'neu': 0.821, 'pos': 0.179, 'compound': 0.3384}",0.3384,pos
17,103183,2023-10-27,Slumber,Great supplement and it works well. It gives a relaxing feeling once taken before bed.,"{'neg': 0.0, 'neu': 0.478, 'pos': 0.522, 'compound': 0.872}",0.872,pos
18,103183,2023-10-03,Wonderful Product,"Somnapure helped me get off ambien, a prescription sleep aid medication.
I love that I can now fall asleep naturally. I love that only one capsule makes me drowsy and helps me sleep through the night.","{'neg': 0.0, 'neu': 0.725, 'pos': 0.275, 'compound': 0.9001}",0.9001,pos
19,103183,2024-07-07,,As I suffer from insomnia it helps me having a better sleep.,"{'neg': 0.219, 'neu': 0.438, 'pos': 0.344, 'compound': 0.25}",0.25,pos
20,103183,2024-05-03,Relaxes!!,Great for relaxation before sleep.   Easy to swallow.  Helps me stay asleep through the night ,"{'neg': 0.0, 'neu': 0.458, 'pos': 0.542, 'compound': 0.9186}",0.9186,pos
21,103183,2023-10-27,Best natural sleep,"all good with this one, no issues, just the taste it's a bit strong, other than that, works well for me ","{'neg': 0.083, 'neu': 0.604, 'pos': 0.313, 'compound': 0.7269}",0.7269,pos
22,103183,2023-07-12,,"this is powerful sleep formula, it is so helpful for those who have trouble with their sleep just like me, they include some others nutrient to maximize the benefit of this product.","{'neg': 0.065, 'neu': 0.649, 'pos': 0.286, 'compound': 0.8487}",0.8487,pos
23,103183,2023-07-09,Two a night sleep tight!,The dosage is just right. Quality of the product is superb. The size of the pills are easy to swallow. All of the ingredients work very well together to give you a great night's sleep.,"{'neg': 0.0, 'neu': 0.69, 'pos': 0.31, 'compound': 0.9259}",0.9259,pos
24,103183,2023-06-23,,"high dosage of melatonin which is works for me, i have been having trouble with sleep in recent years but after using this, i have slowly improve the quality of my sleep.","{'neg': 0.055, 'neu': 0.831, 'pos': 0.114, 'compound': 0.4588}",0.4588,pos
25,103183,2023-06-21,,"Works great,excellent quality extremely beneficial  best combination of natural ingredients ,perfect size and value for money,the best thing you like about it that it goes to work under an hour fora good night sleep.","{'neg': 0.0, 'neu': 0.499, 'pos': 0.501, 'compound': 0.978}",0.978,pos
26,103183,2023-06-04,i'm satisfied with it,"I can confirm that it does have a calming effect in addition to the effect of the melatonin, which helps me fall asleep quickly + stay asleep. the taste is ok however some people may find the tablets big for them","{'neg': 0.0, 'neu': 0.824, 'pos': 0.176, 'compound': 0.7579}",0.7579,pos
27,103183,2023-05-20,,"thank you very much for the product, it is really good. iherb is a very strong shop, it promotes health and that is really its strong point, thank you","{'neg': 0.0, 'neu': 0.553, 'pos': 0.447, 'compound': 0.95}",0.95,pos
28,103183,2022-12-05,,"I have issues with sleeping and they do help me as well, I am trying to use them not every night but only one pill does the trick, really good, but the size could be smaller, still good to swollow","{'neg': 0.028, 'neu': 0.713, 'pos': 0.259, 'compound': 0.8929}",0.8929,pos
29,103183,2023-10-05,helpful,"I got these to help with jetlag. I'd never taken melatonin before and was a little anxious about using something to aid with sleep, but I don't actually feel like I'm taking an aid. I don't get ""hit"" by a sudden drowsy or heavy feeling but the sleep comes gradually. I can't say I don't wake up groggy either, but I still do have jet lag :)","{'neg': 0.105, 'neu': 0.783, 'pos': 0.112, 'compound': 0.1234}",0.1234,pos
30,103183,2024-08-27,,This didn't work for me. I used it as directed.,"{'neg': 0.0, 'neu': 1.0, 'pos': 0.0, 'compound': 0.0}",0.0,neu
31,103183,2024-04-03,Sleep aid,"might be working  for some, didn't feel much.
Will stick to melatonin.","{'neg': 0.0, 'neu': 1.0, 'pos': 0.0, 'compound': 0.0}",0.0,neu
32,103183,2023-11-14,good,good size  good ingredient easy to take good taste beneficisl ,"{'neg': 0.0, 'neu': 0.341, 'pos': 0.659, 'compound': 0.891}",0.891,pos
33,103183,2023-10-10,Sleep aid,"Very good product, eat 2 pills before sleep (half hr). can sleep quickly.","{'neg': 0.0, 'neu': 0.775, 'pos': 0.225, 'compound': 0.4927}",0.4927,pos
34,103183,2023-10-15,Прекрасно!,"excellent product,good and strong packaging , the quality matches the description, I will still recommend ordering to everyone!!! okay
","{'neg': 0.0, 'neu': 0.514, 'pos': 0.486, 'compound': 0.9057}",0.9057,pos
35,103183,2023-10-10,,"Very nice product, Thank you. Would buy it more
Would recommend to friends
","{'neg': 0.0, 'neu': 0.434, 'pos': 0.566, 'compound': 0.8942}",0.8942,pos
36,103183,2023-10-01,,"i find it very hard to fall asleep, these tablets have certainly helped with that!!!","{'neg': 0.1, 'neu': 0.707, 'pos': 0.193, 'compound': 0.3783}",0.3783,pos
37,103183,2023-07-14,Excellent! For those nights when sleep is difficult to come by,I usually take these on nights when I am too buzzed to fall asleep. It works a treat when it come to promoting drowsiness ,"{'neg': 0.0, 'neu': 0.785, 'pos': 0.215, 'compound': 0.6369}",0.6369,pos
38,103183,2023-07-11,,Benefit It knocks you out within 2 hours of taking the serving. Taste is tolerable and stacks well with some ZMA before bedtime 🤤,"{'neg': 0.0, 'neu': 0.797, 'pos': 0.203, 'compound': 0.6249}",0.6249,pos
39,103183,2023-07-10,,"good quality sleep formula, it got the melatonin as well others supporting ingredients that aid a restful sleep.","{'neg': 0.0, 'neu': 0.556, 'pos': 0.444, 'compound': 0.8555}",0.8555,pos
40,103183,2023-06-22,,"excellent quality, its dosage fits me, i no longer have sleep problem, i just take this 30 minutes before bed and work effectively 👍.","{'neg': 0.166, 'neu': 0.61, 'pos': 0.224, 'compound': 0.4019}",0.4019,pos
41,103183,2023-05-17,Прекрасно!,was very pleased! thank you very much for your order! I recommend to everyone! THX iHerb Team!,"{'neg': 0.0, 'neu': 0.482, 'pos': 0.518, 'compound': 0.9165}",0.9165,pos
42,103183,2023-05-08,Somapure,This is my first purchase of this product and it helps me to sleep.,"{'neg': 0.0, 'neu': 0.833, 'pos': 0.167, 'compound': 0.3818}",0.3818,pos
43,103183,2023-03-19,,these are the best sleeping tablets I've found easy to swallow and so calming,"{'neg': 0.0, 'neu': 0.509, 'pos': 0.491, 'compound': 0.8908}",0.8908,pos
44,103183,2023-01-24,,Great product easy to swallow bit smelly but hold my breath.work very quickly not groggy in the morning ,"{'neg': 0.0, 'neu': 0.78, 'pos': 0.22, 'compound': 0.5423}",0.5423,pos
45,103183,2024-05-19,Worthless ,"I used to take two tablets to fall asleep and it keeps me awake all night , waste of money I don’t recommend it ","{'neg': 0.115, 'neu': 0.782, 'pos': 0.103, 'compound': -0.0772}",-0.0772,neg
46,103183,2022-06-13,,"First night I took this? Slept like a baby. Been having decent success with it for at least a month. It has kind of a funky taste, not completely unexpected with sleep supplements. Also, doesn't interact with my SSRI's and ADHD meds, so that's cool too.","{'neg': 0.035, 'neu': 0.784, 'pos': 0.181, 'compound': 0.7956}",0.7956,pos
47,103183,2022-06-06,,"It really works! Perfect quality and very convenient size and dosage. Just one pill and you sleep like baby! Natural ingredients and really neural taste. Strongly recommend it, really helpful herbal guys 😉","{'neg': 0.0, 'neu': 0.597, 'pos': 0.403, 'compound': 0.9479}",0.9479,pos
48,103183,2021-11-09,Not bad ,"While this isn't like taking an Ambien, they work fairly well at making you feel sleepy and then staying asleep.  The pills are large and can be difficult to swallow.  Give them about an hour to work.  No grogginess the next day.  ","{'neg': 0.145, 'neu': 0.81, 'pos': 0.045, 'compound': -0.5733}",-0.5733,neg
49,103183,2023-08-14,好的, taste is not bad but it's effect is mild,"{'neg': 0.0, 'neu': 0.806, 'pos': 0.194, 'compound': 0.2323}",0.2323,pos
50,103183,2023-07-25,,cheap after discount but unsure if as good as others?,"{'neg': 0.174, 'neu': 0.557, 'pos': 0.268, 'compound': 0.3291}",0.3291,pos
51,103183,2023-01-29,Not for me,Not working for me. Tried it for a couple of months with no results.,"{'neg': 0.155, 'neu': 0.845, 'pos': 0.0, 'compound': -0.296}",-0.296,neg
52,103183,2023-03-28,somnapure,haven't noticed much change in sleeping pattern after taking for a week.  Pill size is massive with a rather strong odor.  I have to cut them in half in order to swallow it.,"{'neg': 0.063, 'neu': 0.838, 'pos': 0.099, 'compound': 0.296}",0.296,pos
53,103183,2022-10-29,,These ingredients are definitely not as effective as the old brand sompnapure. It’s too bad they changed company and made it different. I wish they would use the same ingredients as the old brand. It does not work for me. ,"{'neg': 0.13, 'neu': 0.753, 'pos': 0.116, 'compound': -0.1665}",-0.1665,neg
54,103183,2023-09-16,,"The formula combines melatonin with natural botanicals, looks promising. I have positive expectations for its potential to support better sleep.","{'neg': 0.0, 'neu': 0.493, 'pos': 0.507, 'compound': 0.9246}",0.9246,pos
55,103183,2023-09-03,,"Helpful with others drugs like melatonin. 
I recommend this product ","{'neg': 0.0, 'neu': 0.435, 'pos': 0.565, 'compound': 0.7783}",0.7783,pos
56,103183,2022-09-24,,These did not work as well as the same product did in the past . Perhaps their dosage has changed. I did not get the same benefit from the product ,"{'neg': 0.059, 'neu': 0.844, 'pos': 0.097, 'compound': 0.2928}",0.2928,pos
57,103183,2022-05-27,Average,"This seems a very comprehensive combination to promote restful sleep. Unfortunately for me personally, it seems a hit or miss.  I hope to find some other sleep aids which may suit my condition better.","{'neg': 0.097, 'neu': 0.583, 'pos': 0.32, 'compound': 0.8479}",0.8479,pos
58,103183,2021-04-29,,"I only want to use natural products to fight my insomnia, but not all of them really help. I can finaly sleep well with Somnapure. No more sleepless nights","{'neg': 0.131, 'neu': 0.598, 'pos': 0.271, 'compound': 0.6046}",0.6046,pos
59,103183,2021-01-03,,"I had used Somnapure some years ago and found it to be an effective sleep aid. So when my sleeping problems returned recently, I tried the product again and found it to be just as effective in helping me sleep through the night.","{'neg': 0.056, 'neu': 0.769, 'pos': 0.175, 'compound': 0.6908}",0.6908,pos
60,103183,2021-07-31,mmmm,Its nice to feel deeply asleep then awake feeling alert knowing I am well rested. Its also good to calm the brain with the natural herbs in Somnapure.,"{'neg': 0.0, 'neu': 0.551, 'pos': 0.449, 'compound': 0.9231}",0.9231,pos
61,103183,2021-02-15,,"I take this product about an hour before bed and while it does not help me to sleep I am more relaxed and don’t have as many thoughts racing through my head. I have only been taking it for a week, so maybe when I have been on it longer I may see more benefit.","{'neg': 0.041, 'neu': 0.836, 'pos': 0.123, 'compound': 0.6734}",0.6734,pos
62,103183,2022-04-18,Eeewww,"I don't know if they actually work.  The smell of them made me start gagging so badly I couldn't take them.  The smell is that pungent, it permeated the skin on my hands and could be still smelt after using sanitiser.","{'neg': 0.095, 'neu': 0.905, 'pos': 0.0, 'compound': -0.6113}",-0.6113,neg
63,103183,2021-03-27,,I am grateful for this herbal remedy as its a non-addictive and can contribute towards a relaxing state.,"{'neg': 0.0, 'neu': 0.677, 'pos': 0.323, 'compound': 0.7351}",0.7351,pos
64,103183,2022-01-21,,"i like it 
it is good for me","{'neg': 0.0, 'neu': 0.481, 'pos': 0.519, 'compound': 0.6597}",0.6597,pos
65,103183,2021-09-18,,"I like the product, helps ease the nerves and sleep.
Doesn't give a drowsy feel the next day","{'neg': 0.067, 'neu': 0.571, 'pos': 0.362, 'compound': 0.7351}",0.7351,pos
66,103183,2021-06-15,Really works!!,"I was suffering from insomnia since months, and taking this has helped me get off from my sleep medications! Really recommend it!","{'neg': 0.145, 'neu': 0.746, 'pos': 0.11, 'compound': -0.2242}",-0.2242,neg
67,103183,2021-06-06,"Best for sleeping
Great for sleeping",If u having sleeping issues u can take this result can be seen after some weeks,"{'neg': 0.0, 'neu': 1.0, 'pos': 0.0, 'compound': 0.0}",0.0,neu
68,103183,2021-02-13,,"along the Hyland's, valerian root and melatonin I take this as well and it's pretty good.","{'neg': 0.0, 'neu': 0.594, 'pos': 0.406, 'compound': 0.802}",0.802,pos
69,103183,2022-07-21,,I love this product and recommend it ,"{'neg': 0.0, 'neu': 0.374, 'pos': 0.626, 'compound': 0.7717}",0.7717,pos
70,103183,2021-11-03,Bien,not yet used ! hope it will help ,"{'neg': 0.231, 'neu': 0.481, 'pos': 0.288, 'compound': 0.1496}",0.1496,pos
71,103183,2021-11-02,,I sleep like a little angel,"{'neg': 0.0, 'neu': 0.545, 'pos': 0.455, 'compound': 0.3612}",0.3612,pos
72,103183,2021-01-31,,I take this together with 3mg melatonin and I manage to get a good night's rest. The melatonin by itself was not enough,"{'neg': 0.0, 'neu': 0.868, 'pos': 0.132, 'compound': 0.4404}",0.4404,pos
73,103183,2022-02-23,,Its work!,"{'neg': 0.0, 'neu': 1.0, 'pos': 0.0, 'compound': 0.0}",0.0,neu
74,103183,2022-02-22,,Good one,"{'neg': 0.0, 'neu': 0.256, 'pos': 0.744, 'compound': 0.4404}",0.4404,pos
75,103183,2021-03-20,Somnapure,My husband has trouble sleeping and he takes this to help him sleep and he says it definitely helps him to stay asleep,"{'neg': 0.091, 'neu': 0.64, 'pos': 0.269, 'compound': 0.6486}",0.6486,pos
76,103183,2021-08-22,,Best product that I have used from my insomnia. ,"{'neg': 0.0, 'neu': 0.625, 'pos': 0.375, 'compound': 0.6369}",0.6369,pos
77,103183,2021-06-06,Excelente!,very good this product thank you ,"{'neg': 0.0, 'neu': 0.413, 'pos': 0.587, 'compound': 0.6901}",0.6901,pos
78,103183,2021-02-13,,Somnapure does help with sleep.,"{'neg': 0.0, 'neu': 0.597, 'pos': 0.403, 'compound': 0.4019}",0.4019,pos
79,103183,2021-04-02,,Thank,"{'neg': 0.0, 'neu': 0.0, 'pos': 1.0, 'compound': 0.3612}",0.3612,pos
80,103183,2024-05-24,Try taking one tablet first ,"Yesterday night I took 2 tablets as indicated on the package. I slept for 10 hours and my head is still heavy and there is a slight headache. Before that I drank melatonin periodically and there was no such reaction. I think for my weight of 45 kg you need to take one tablet at a time. So that be careful. Also, due to the content of valerian and other herbs, the tablets have an odor, keep in mind.","{'neg': 0.03, 'neu': 0.945, 'pos': 0.025, 'compound': -0.0865}",-0.0865,neg
81,103183,2024-10-14,good,"Good quality and ingredients, helps me fall asleep easier, sleep well. I take only 1 pill, the size is good. The vitamin has a mild herbal taste and smell, but it is not a problem for me. There are some nights when I wake up in the middle of the night and have trouble falling back asleep. Sometimes I add 5HTP and L-Theanine.","{'neg': 0.081, 'neu': 0.715, 'pos': 0.203, 'compound': 0.6354}",0.6354,pos
82,103183,2024-09-20,Perfect composition of ingredients!,"Great product with great quality! You can start with just 1 capsule, as melatonin only helps you fall asleep :-) Valerian and theanine take care of the rest! A product that will definitely help you fall asleep and, above all, sleep through the night!! (The taste takes some getting used to, as valerian doesn't smell particularly good ;-) )","{'neg': 0.035, 'neu': 0.629, 'pos': 0.336, 'compound': 0.9703}",0.9703,pos
83,103183,2024-07-20,,"A good combination of natural ingredients and melatonin. Ordered for the first time, very satisfied with the quality. One tablet before bed is enough for me, I add another 5 mg of melatonin and I sleep until morning without waking up. The size of the tablet is normal for me, the tablet has a pleasant herbal smell and taste, the quality for the price of this brand is quite satisfactory to me. I will take a large package so that it will last longer, because I may have to double the dose due to the very difficult life in the front-line region of Ukraine. Glory to Ukraine!","{'neg': 0.025, 'neu': 0.813, 'pos': 0.162, 'compound': 0.9391}",0.9391,pos
84,103183,2024-05-12,Excellent!,"I bought chewable melatonin from this manufacturer several times and was very pleased with both the effect and the taste. Therefore, without hesitation, I ordered this melatonin. The good thing is that the dosage can be adjusted to suit your needs. Supplementing with herbs and theanine enhances the benefits of taking it. Chamomile, hops, mint are good for relaxation and relieve spasms. Moreover, each ingredient works in a slightly different way. Overall this is a good buy.","{'neg': 0.0, 'neu': 0.745, 'pos': 0.255, 'compound': 0.9648}",0.9648,pos
85,103183,2024-01-08,Excellent!,"I consume this supplement in 30 min. it's already the 4th day before bedtime, and I can safely say that it has significantly improved the strength and quality of my sleep. I recommend it to everyone who has problems sleeping and who wants to wake up in the morning rested and refreshed! The ingredients and quality are super!","{'neg': 0.04, 'neu': 0.719, 'pos': 0.242, 'compound': 0.9298}",0.9298,pos
86,103183,2023-12-25,Excellent!,"I ordered it for the first time, there is a result, my sleep has improved and the most important thing is that waking up is easy, there is no heaviness in the head. The drug is of high quality and the dosage is well chosen, I hope that I will continue to use it in the future.","{'neg': 0.035, 'neu': 0.754, 'pos': 0.21, 'compound': 0.8718}",0.8718,pos
87,103183,2024-05-10,,"I will order again, this is the second time. The drug worked for me and really helps me fall asleep. I sleep peacefully and wake up easily. I took melatonin for a long time, this complex helped me get away from melatonin. I recommend ","{'neg': 0.0, 'neu': 0.758, 'pos': 0.242, 'compound': 0.8805}",0.8805,pos
88,103183,2024-05-24,"It works, but I'd like to try other supplements.","I bought it because a friend recommended it. The smell is quite strong, so I wash my hands after touching it. The pills are also quite large, so I drink plenty of water. My husband said it was very effective and he slept soundly. I felt like I was able to sleep, but I started having a lot of dreams and felt tired in a different way. It's not bad, but I can't live without it! I'd like to try other products.","{'neg': 0.044, 'neu': 0.72, 'pos': 0.236, 'compound': 0.9295}",0.9295,pos
89,103183,2024-06-28,Can,"I took it with a trial attitude. The particles were a bit big, but it wasn't a problem for me. The smell was unpleasant to me when I first took it, but after I got used to it, I had no problem. I take two pills every night before going to bed. Sometimes it is effective, sometimes it is not, but I always find it helpful to fall asleep. I will stick to it for a while.","{'neg': 0.086, 'neu': 0.745, 'pos': 0.169, 'compound': 0.77}",0.77,pos
90,103183,2024-04-09,A mini dose of melatonin,"I was looking for a sedative with a minimum dose of melatonin, because chemistry affects the body in different ways. In the morning there is drowsiness, there is no cheerfulness. The manufacturer recommends a dose of 2 tablets before going to bed, I will reduce the dose and see.","{'neg': 0.047, 'neu': 0.847, 'pos': 0.106, 'compound': 0.4215}",0.4215,pos
91,103183,2024-03-07,Prominent,"Finally, I advise you to the master of treatments, which is charity, with the intention of reward and healing. Be patient with me so that nothing decreases your reward. May God reward you with all goodness, Paradise, and your parents ❤️❤️💕🌷","{'neg': 0.0, 'neu': 0.587, 'pos': 0.413, 'compound': 0.9726}",0.9726,pos
92,103183,2024-10-12,Ingredients: Natural,I eat half an hour earlier at night and feel that it is easier to fall asleep and I won't feel groggy in the morning.,"{'neg': 0.0, 'neu': 0.887, 'pos': 0.113, 'compound': 0.4215}",0.4215,pos
93,103183,2024-08-31,,"I order for my husband, it works instantly, we took it on the recommendation of a doctor. True, the dosage is large, it helps well when there are problems and stress","{'neg': 0.149, 'neu': 0.649, 'pos': 0.203, 'compound': 0.25}",0.25,pos
94,103183,2024-08-30,,This product promises to be a safe and effective solution to sleep problems. The label lists herbs and supplements that only contain ingredients that are non-addictive and won't make you feel drowsy in the morning.,"{'neg': 0.063, 'neu': 0.681, 'pos': 0.256, 'compound': 0.802}",0.802,pos
95,103183,2024-07-29,good,"I have trouble sleeping The benefits of this product made me sleep well. The quality of each component is good. Just the right amount of medicine. It has no taste, but has a slightly pungent smell. no problem for me","{'neg': 0.213, 'neu': 0.672, 'pos': 0.115, 'compound': -0.6705}",-0.6705,neg
