,product_id,date_posted,review_title,review_text,scores,compound,sentiment
184,103183,2023-09-11,,I really liked this drug. The composition is excellent. Convenient packaging. I feel good. Has all the declared properties. I recommend you to buy,"{'neg': 0.0, 'neu': 0.582, 'pos': 0.418, 'compound': 0.9041}",0.9041,pos
185,103183,2023-08-22,,Excellent quality! Helps to fall asleep faster. Allows you to sleep longer. Helps to wake up rested. Capsules are not large.,"{'neg': 0.0, 'neu': 0.662, 'pos': 0.338, 'compound': 0.8478}",0.8478,pos
186,103183,2023-08-12,,Natural ingredients from a quality manufacturer will provide the desired result and benefit the body,"{'neg': 0.0, 'neu': 0.591, 'pos': 0.409, 'compound': 0.765}",0.765,pos
187,103183,2023-07-26,,An excellent tool for a sound and long sleep. I recommend for use.,"{'neg': 0.0, 'neu': 0.592, 'pos': 0.408, 'compound': 0.7351}",0.7351,pos
188,103183,2023-07-16,Efficient!,"A wonderful natural complex for sleep. In my case, it contributed to a deep and sound sleep without night awakenings. I really liked it!","{'neg': 0.0, 'neu': 0.653, 'pos': 0.347, 'compound': 0.862}",0.862,pos
189,103183,2023-07-13,,"A great supplement that has a good hypnotic effect. I really liked the composition, it is completely natural.","{'neg': 0.0, 'neu': 0.461, 'pos': 0.539, 'compound': 0.9167}",0.9167,pos
190,103183,2023-06-20,,"It's 3mm, so I feel like I should drink 3","{'neg': 0.0, 'neu': 0.683, 'pos': 0.317, 'compound': 0.4173}",0.4173,pos
191,103183,2023-06-17,,"This effect is good, buy some more, this effect is good, then buy some","{'neg': 0.0, 'neu': 0.674, 'pos': 0.326, 'compound': 0.7003}",0.7003,pos
192,103183,2023-05-31,Excellent!,Helps to sleep well. I wake up feeling sleepy and it makes me very happy. A good product!,"{'neg': 0.0, 'neu': 0.446, 'pos': 0.554, 'compound': 0.9129}",0.9129,pos
193,103183,2023-05-14,,"Very high quality, every ingredient is high quality and important for continuous sleep, medium size is suitable for about a month.","{'neg': 0.0, 'neu': 0.913, 'pos': 0.087, 'compound': 0.2023}",0.2023,pos
194,103183,2023-05-12,,Quality and ingredients without taste. Dosage and benefits for your body,"{'neg': 0.0, 'neu': 0.794, 'pos': 0.206, 'compound': 0.3818}",0.3818,pos
195,103183,2023-03-11,,"I bought several sleep aids at once, but this one has not been tried yet","{'neg': 0.0, 'neu': 1.0, 'pos': 0.0, 'compound': 0.0}",0.0,neu
196,103183,2024-04-25,,Very satisfied. I also ordered for my girlfriend. She is also very satisfied.,"{'neg': 0.0, 'neu': 0.618, 'pos': 0.382, 'compound': 0.734}",0.734,pos
197,103183,2024-04-04,Great!,Great! Great! Very satisfied,"{'neg': 0.0, 'neu': 0.078, 'pos': 0.922, 'compound': 0.9166}",0.9166,pos
198,103183,2022-09-03,,Many of us find it difficult to get the quality sleep we deserve. Somnapure® is a safe and effective solution that has been trusted by countless men and women for almost a decade. This premium formula contains only non-addictive ingredients that won't make you feel sleepy.,"{'neg': 0.047, 'neu': 0.737, 'pos': 0.216, 'compound': 0.836}",0.836,pos
199,103183,2023-10-18,,"The tablets are larger than average, the ingredients are high quality, the dosage is appropriate, the taste is normal, I hope they help","{'neg': 0.0, 'neu': 0.781, 'pos': 0.219, 'compound': 0.6808}",0.6808,pos
200,103183,2023-07-03,,Do not take more than 2 tablets in 24 hours.,"{'neg': 0.0, 'neu': 1.0, 'pos': 0.0, 'compound': 0.0}",0.0,neu
201,103183,2023-03-31,,The taste is a bit strong! But it helps with sleep! already repurchased,"{'neg': 0.0, 'neu': 0.62, 'pos': 0.38, 'compound': 0.7298}",0.7298,pos
202,103183,2022-12-20,,"Good in terms of ingredients, the quantity is appropriate, and the package is well closed. I hope to get the desired benefit, thank you","{'neg': 0.0, 'neu': 0.523, 'pos': 0.477, 'compound': 0.926}",0.926,pos
203,103183,2023-10-18,I'm concerned about the smell,"It has quite a smell. Because of that, it was difficult for me to continue. I tried a bottle, but it didn't help me sleep. If the gummy type doesn't suit you, that might be better.","{'neg': 0.12, 'neu': 0.779, 'pos': 0.1, 'compound': 0.0549}",0.0549,pos
204,103183,2023-07-17,,I didn't use it I took it to my cousin and I don't know how much it affects him,"{'neg': 0.0, 'neu': 1.0, 'pos': 0.0, 'compound': 0.0}",0.0,neu
205,103183,2023-05-15,,"It's hard to swallow because one grain is big. Otherwise, I think it's a good product.","{'neg': 0.086, 'neu': 0.736, 'pos': 0.178, 'compound': 0.3612}",0.3612,pos
206,103183,2023-08-24,Great! Great! Bought too much,Great! Great! Bought too much,"{'neg': 0.0, 'neu': 0.255, 'pos': 0.745, 'compound': 0.8684}",0.8684,pos
207,103183,2023-06-08,,"Help improve sleep quality, feel smooth stool","{'neg': 0.0, 'neu': 0.472, 'pos': 0.528, 'compound': 0.6808}",0.6808,pos
208,103183,2023-02-22,,Great! Made multiple purchases Great! Made multiple purchases,"{'neg': 0.0, 'neu': 0.406, 'pos': 0.594, 'compound': 0.8684}",0.8684,pos
209,103183,2021-11-26,,"I can't say that this product helped me a lot, as I woke up several times at night, and continued to wake up, the only thing, I fell asleep faster, maybe this is age-related and will help someone sleep all night, but I won't order again","{'neg': 0.0, 'neu': 0.956, 'pos': 0.044, 'compound': 0.2144}",0.2144,pos
210,103183,2021-04-01,,"I work in 2 shifts, one week is during the day and the other at night. I have difficulty sleeping. I started taking it and now I sleep much better. I'll buy more.","{'neg': 0.077, 'neu': 0.831, 'pos': 0.093, 'compound': 0.128}",0.128,pos
211,103183,2022-09-11,,"Great product! Great product! The drug works, the quality of sleep has improved. Great product. Remarkable quality. Sleep has improved significantly.","{'neg': 0.0, 'neu': 0.398, 'pos': 0.602, 'compound': 0.9741}",0.9741,pos
212,103183,2022-01-26,Very effective!,Recently I have been having difficulty falling asleep and the product is very very helpful to me when needed. Highly recommend,"{'neg': 0.153, 'neu': 0.612, 'pos': 0.236, 'compound': 0.4878}",0.4878,pos
213,103183,2022-11-10,,Started sleeping well after a week of service,"{'neg': 0.0, 'neu': 0.741, 'pos': 0.259, 'compound': 0.2732}",0.2732,pos
214,103183,2022-09-07,,I think it helps me sleep but only if I take it a few hours before bed,"{'neg': 0.0, 'neu': 0.878, 'pos': 0.122, 'compound': 0.2023}",0.2023,pos
215,103183,2022-04-19,,From the experience of a friend that this product is good and I will try it,"{'neg': 0.0, 'neu': 0.663, 'pos': 0.337, 'compound': 0.7269}",0.7269,pos
216,103183,2022-01-17,Very effective and amazing. I have tried many related products and this one is my first choice.,"Can be flat better, more expensive","{'neg': 0.0, 'neu': 0.633, 'pos': 0.367, 'compound': 0.4404}",0.4404,pos
217,103183,2021-08-05,,"I also tried it after seeing everyone’s praise. It really helps sleep, falling asleep faster and sleeping soundly, but the pill has a very strong smell, it should be said that it is a bit smelly, which is a point of deduction.","{'neg': 0.032, 'neu': 0.763, 'pos': 0.205, 'compound': 0.8273}",0.8273,pos
218,103183,2022-08-09,,"Effective, quality ingredients. However the stamps are too big","{'neg': 0.0, 'neu': 0.721, 'pos': 0.279, 'compound': 0.4767}",0.4767,pos
219,103183,2021-12-02,,It's great and I found it useful,"{'neg': 0.0, 'neu': 0.364, 'pos': 0.636, 'compound': 0.7906}",0.7906,pos
220,103183,2021-11-25,,I ordered it for my client,"{'neg': 0.0, 'neu': 1.0, 'pos': 0.0, 'compound': 0.0}",0.0,neu
221,103183,2022-08-12,,I couldn't sleep well I didn't use it and threw the box,"{'neg': 0.168, 'neu': 0.832, 'pos': 0.0, 'compound': -0.2057}",-0.2057,neg
222,103183,2022-05-01,,Excellent sleep aid,"{'neg': 0.0, 'neu': 0.351, 'pos': 0.649, 'compound': 0.5719}",0.5719,pos
223,103183,2022-02-18,,Works for me,"{'neg': 0.0, 'neu': 1.0, 'pos': 0.0, 'compound': 0.0}",0.0,neu
224,103183,2022-01-16,,My customer's request,"{'neg': 0.0, 'neu': 1.0, 'pos': 0.0, 'compound': 0.0}",0.0,neu
225,103183,2021-03-22,,Good helps to sleep deeply.,"{'neg': 0.0, 'neu': 0.353, 'pos': 0.647, 'compound': 0.6705}",0.6705,pos
226,103183,2021-10-23,,My customer's request,"{'neg': 0.0, 'neu': 1.0, 'pos': 0.0, 'compound': 0.0}",0.0,neu
227,103183,2021-06-16,,Excellent,"{'neg': 0.0, 'neu': 0.0, 'pos': 1.0, 'compound': 0.5719}",0.5719,pos
228,103183,2021-03-14,,good,"{'neg': 0.0, 'neu': 0.0, 'pos': 1.0, 'compound': 0.4404}",0.4404,pos
229,103183,2021-02-01,,I loved it,"{'neg': 0.0, 'neu': 0.204, 'pos': 0.796, 'compound': 0.5994}",0.5994,pos
