,product_id,date_posted,review_title,review_text,scores,compound,sentiment
96,103183,2024-06-26,,"The hormone reduces anxiety and improves emotional state. When stressed, it reduces the level of adrenaline and some other hormones, exhibiting an anti-stress effect. Increases the level of serotonin, without which depressive states develop.","{'neg': 0.103, 'neu': 0.731, 'pos': 0.166, 'compound': 0.3578}",0.3578,pos
97,103183,2024-05-20,Help for sleep!!!,"This composition of ingredients is ideal for good support to improve the quality of sleep that will bring benefit to your life, it does not leave a taste, the dose is indicated","{'neg': 0.0, 'neu': 0.609, 'pos': 0.391, 'compound': 0.9331}",0.9331,pos
98,103183,2024-04-10,Sleep better,"It's very good. My son was a total shut-in and had reversed his day and night routine, but now he's back to normal.","{'neg': 0.0, 'neu': 0.909, 'pos': 0.091, 'compound': 0.2724}",0.2724,pos
99,103183,2024-02-18,,Perfect quality. The size of the balls is large. Dosage: take one half an hour before bedtime. Advantages: really anesthetizes. Disgusting taste but even so it doesn't stay in the mouth.,"{'neg': 0.068, 'neu': 0.813, 'pos': 0.119, 'compound': 0.1928}",0.1928,pos
100,103183,2024-01-30,At night,"Since I started drinking, I no longer wake up at night. You can sleep soundly until morning. The downside is the smell, but if you put up with it only when drinking it, it won't bother you.","{'neg': 0.082, 'neu': 0.85, 'pos': 0.068, 'compound': 0.1164}",0.1164,pos
101,103183,2023-12-10,Great,"High quality natural ingredients - herbs and amino acids, which I select separately for myself, are brought together in an excellent dosage! Taste doesn't matter, the main thing is the benefits. The size is convenient for swallowing.","{'neg': 0.026, 'neu': 0.753, 'pos': 0.221, 'compound': 0.8409}",0.8409,pos
102,103183,2023-11-11,deep sleep,"I don't think the amount of time I sleep has changed that much, but I fall asleep faster and feel refreshed when I wake up, so my daily life has become easier.","{'neg': 0.0, 'neu': 0.879, 'pos': 0.121, 'compound': 0.5719}",0.5719,pos
103,103183,2023-11-05,For Women!,"It's a light supplement with just the right size and ingredients for women, and I don't really mind the taste, and I like the cute packaging.","{'neg': 0.0, 'neu': 0.792, 'pos': 0.208, 'compound': 0.6705}",0.6705,pos
104,103183,2023-10-26,,I bought it for my hypertensive mother. Very cool natural composition. The effect of relaxation before sleep is noticeable. Magnesium and glycine worked best for her.,"{'neg': 0.0, 'neu': 0.618, 'pos': 0.382, 'compound': 0.9181}",0.9181,pos
105,103183,2024-09-19,"The effect is good, but the smell is repulsive","I bought it to calm my nerves a little in the evening and improve my sleep. I took one tablet, it works gently, there is no feeling of fatigue in the morning.","{'neg': 0.15, 'neu': 0.59, 'pos': 0.26, 'compound': 0.6249}",0.6249,pos
106,103183,2024-09-08,Favorable,"Fall asleep quickly. We sleep longer in a peaceful way and we are in great shape in the morning, invigorated when we wake up. Interesting percentage of melatonin (3mg)","{'neg': 0.0, 'neu': 0.67, 'pos': 0.33, 'compound': 0.8957}",0.8957,pos
107,103183,2024-08-30,effective,"effective supplement to sleep easily, the mixture of different plants with melatonin is very effective, since I take it I sleep easily until the morning I am happy ","{'neg': 0.0, 'neu': 0.576, 'pos': 0.424, 'compound': 0.9287}",0.9287,pos
108,103183,2024-08-03,Melatonin is combined with various ingredients that have a sleep-inducing effect to induce natural sleep.,"I started taking melatonin with gummies, and have taken it in various forms such as capsules, tablets, quick-dissolving tablets, and liquid. I have it in all dosages: 3mg, 5mg, 7mg, and 10mg, and I choose and combine it depending on my condition that day. For me, the good thing about melatonin is that it doesn't have as strong an effect as sleeping pills, it helps me fall asleep naturally, and I wake up refreshed without feeling sluggish or sleepy. (I think this depends on the compatibility, so some people may feel that way...) Sleeping pills don't leave me feeling refreshed, so on days when I feel a little sleepy, I can sometimes fall asleep with just melatonin. Now, in addition to melatonin, this supplement contains ingredients and herbs that have a tranquilizing effect, such as L-theanine, hop extract, passionflower, chamomile, and lemon balm, which I feel enhance the effect of falling asleep. However, the amount of melatonin at 3mg seems too weak for me. I don't get very sleepy unless I take this with 3mg of melatonin alone or combine it with half a tablet of Belsomra prescribed by my psychiatrist. If you don't have as severe a sleep disorder as I do, I think this alone will help you fall asleep.","{'neg': 0.085, 'neu': 0.845, 'pos': 0.07, 'compound': -0.2621}",-0.2621,neg
109,103183,2024-08-01,the composition is good,"the ingredients are good, the size is large, but you can swallow it. the effect is there, but maybe I expected more. falls asleep not immediately after use, but definitely better than without them","{'neg': 0.0, 'neu': 0.762, 'pos': 0.238, 'compound': 0.8537}",0.8537,pos
110,103183,2024-05-22,There is no effect,"Decent composition, good quality. But after 2 weeks of taking it, I did not see any effect on sleep. Maybe you need to take it longer. ","{'neg': 0.0, 'neu': 0.922, 'pos': 0.078, 'compound': 0.2382}",0.2382,pos
111,103183,2024-02-18,insomnia,"It has a strange smell, but I've gotten used to it. I drink it before going to bed. I can sometimes sleep or not depending on my physical condition, so I take it along with other supplements.","{'neg': 0.042, 'neu': 0.958, 'pos': 0.0, 'compound': -0.1027}",-0.1027,neg
112,103183,2024-01-09,,"Bought this supplement to help with sleep problems. A good composition that has a calming effect. Neutral taste. The package should be enough for a month, during this time, I think, the benefit should be felt.","{'neg': 0.066, 'neu': 0.659, 'pos': 0.276, 'compound': 0.8225}",0.8225,pos
113,103183,2024-09-15,perfect for relaxing before bed,"An excellent sleep inducer, natural ingredients, and they do not have a strong taste, I take two 3 hours before bedtime ","{'neg': 0.113, 'neu': 0.628, 'pos': 0.259, 'compound': 0.542}",0.542,pos
114,103183,2024-01-07,Somnapure sleep aid,"I've been using it for about a month, I ordered 3 more jars. I don’t have any illnesses, I sleep well.","{'neg': 0.166, 'neu': 0.725, 'pos': 0.109, 'compound': -0.2732}",-0.2732,neg
115,103183,2023-10-01,Comfortable sleep,"Ternana officinalis This herb in the mint family is used to promote sleep through relaxation. Chamomile Chamomile, similar to the daisy, is known for its calming effect and use in herbal teas. Passionflower This plant is traditionally used to promote sleep, and has been harvested as a medicine for centuries. L-80 Soothing Green Tea is rich in this amino acid, which has a gentle relaxing effect. Hops This floral group helps increase alpha waves in the brain, which speeds up the onset of sleep. Melatonin This vital hormone, naturally secreted by the pituitary gland, helps regulate sleep patterns. Narine This perennial herb is used around the world to promote relaxation and help calm the mind.","{'neg': 0.0, 'neu': 0.671, 'pos': 0.329, 'compound': 0.991}",0.991,pos
116,103183,2023-06-26,Melatonin supplement support,"It contains herbs with the potential to improve sleep quality, along with theanine and melatonin. You can take a lot of herbs with one grain. Especially valerian and lemon balm are abundant. One tablet contains 100mg of theanine, which is a sufficient amount. One tablet contains 1.5 mg of melatonin. I don't think this is a lot. The standard amount is 2 capsules per time, but if I were you, I would add 1 capsule of this supplement to the single melatonin supplement to aim for a deeper sleep. I use it as the main support role, not the main sleep supplement.","{'neg': 0.0, 'neu': 0.942, 'pos': 0.058, 'compound': 0.6705}",0.6705,pos
117,103183,2023-09-19,excellent!,"A wonderful and gentle sedative for sleep. I love this brand, always a quality product. It became easier to fall asleep. Aroma of herbs, easy to drink. If the review was useful - 👍","{'neg': 0.0, 'neu': 0.542, 'pos': 0.458, 'compound': 0.9607}",0.9607,pos
118,103183,2024-08-09,,"not a bad composition, but I won't say that there was a noticeable effect, at least not an obvious one. it was at a big discount, so I bought it","{'neg': 0.0, 'neu': 0.926, 'pos': 0.074, 'compound': 0.2323}",0.2323,pos
119,103183,2023-08-23,sleeping well,"I was prescribed sleeping pills, but I tried this because I was afraid of becoming dependent on it. The grains are a little large and it was difficult to drink at first, but there is no problem once you get used to it. I also improved my habits by myself, such as not looking at my smartphone right before going to bed, but I feel like I can fall asleep smoothly.","{'neg': 0.126, 'neu': 0.776, 'pos': 0.097, 'compound': -0.296}",-0.296,neg
120,103183,2023-07-12,,"I couldn't sleep every day due to sleep disorders, but I took one tablet to try this. I was surprised to be able to sleep without waking up until morning! I got a good night's sleep, and my depression eased. I would like to continue. The size of the capsules is too big for me to swallow, but I think they are sized to prevent children from swallowing them by mistake. The smell of the herb valerian is unique, but it's better than coating the smell with unnecessary chemicals, so I'm okay with it. I wish I had taken it sooner!","{'neg': 0.071, 'neu': 0.717, 'pos': 0.211, 'compound': 0.9325}",0.9325,pos
121,103183,2024-10-15,,"High quality, clean ingredients, excellent package size, tolerable taste, good for health and improving body odor, excellent formula and great benefit","{'neg': 0.0, 'neu': 0.379, 'pos': 0.621, 'compound': 0.9716}",0.9716,pos
122,103183,2024-10-08,I recommend ,"High quality, balanced selected ingredients, medium size capsules, neutral in taste, there is a noticeable smell","{'neg': 0.0, 'neu': 1.0, 'pos': 0.0, 'compound': 0.0}",0.0,neu
123,103183,2024-10-05,,"Excellent for anxiety and insomnia, with no side effects. Take one or two pills and you will sleep like a baby 👼🏻","{'neg': 0.144, 'neu': 0.627, 'pos': 0.229, 'compound': 0.5106}",0.5106,pos
124,103183,2024-09-21,,"prone to sleep disorders, supplement that really helps me relax and fall asleep easily suits me perfectly ","{'neg': 0.0, 'neu': 0.507, 'pos': 0.493, 'compound': 0.9128}",0.9128,pos
125,103183,2024-09-18,Melatonin ,"The quality is excellent, the ingredient is natural, the size and dose are convenient, the taste is normal, ","{'neg': 0.0, 'neu': 0.721, 'pos': 0.279, 'compound': 0.7351}",0.7351,pos
126,103183,2024-09-02,,"Excellent quality, good ingredients, suitable age, excellent ginseng, good packaging, excellent benefit, gives energy, increases effort, gives immunity 

","{'neg': 0.0, 'neu': 0.333, 'pos': 0.667, 'compound': 0.9682}",0.9682,pos
127,103183,2024-07-24,Class,The quality and ingredients are super! I like it! I order for training I like it super ,"{'neg': 0.0, 'neu': 0.428, 'pos': 0.572, 'compound': 0.9244}",0.9244,pos
128,103183,2024-07-03,Www,Excellent dosage. The composition is great. The packaging size is super. The ingredients are great. Healthy,"{'neg': 0.0, 'neu': 0.373, 'pos': 0.627, 'compound': 0.9612}",0.9612,pos
129,103183,2024-06-25,,"I had insomnia and after discovering this supplement, my sleep improved a lot! I will buy again","{'neg': 0.0, 'neu': 0.793, 'pos': 0.207, 'compound': 0.5255}",0.5255,pos
130,103183,2024-06-15,Top quality,An excellent product that meets all my expectations. I would happily recommend him to others,"{'neg': 0.0, 'neu': 0.529, 'pos': 0.471, 'compound': 0.8689}",0.8689,pos
131,103183,2024-06-07,Class,"I liked the quality and ingredients, composition and taste! The packaging is convenient! ","{'neg': 0.0, 'neu': 0.765, 'pos': 0.235, 'compound': 0.5242}",0.5242,pos
132,103183,2024-05-26,promotes sleep,"Good quality, helped me sleep, good size, dosage just fine, no aftertaste","{'neg': 0.124, 'neu': 0.449, 'pos': 0.427, 'compound': 0.6597}",0.6597,pos
133,103183,2024-04-25,Top for sleep,"The quality is high, the ingredient is good, the size, the advantage in simple use, the taste is neutral, I recommend it for purchase","{'neg': 0.0, 'neu': 0.73, 'pos': 0.27, 'compound': 0.7506}",0.7506,pos
134,103183,2024-04-22,,A very effective means of relaxation before going to bed. Helps to fall asleep faster and sleep longer.,"{'neg': 0.0, 'neu': 0.598, 'pos': 0.402, 'compound': 0.8553}",0.8553,pos
135,103183,2024-04-05,,Bought for a girlfriend. She really liked this complex - it solved the problem of poor sleep. ,"{'neg': 0.264, 'neu': 0.5, 'pos': 0.236, 'compound': -0.1548}",-0.1548,neg
136,103183,2024-03-22,Class,I liked the super composition. The size of the package and the benefits all really correspond to the price! ,"{'neg': 0.0, 'neu': 0.61, 'pos': 0.39, 'compound': 0.8622}",0.8622,pos
137,103183,2024-03-10,Effective sleep aid,Great product that helped my son sleep. Good value for money! ,"{'neg': 0.0, 'neu': 0.452, 'pos': 0.548, 'compound': 0.8655}",0.8655,pos
138,103183,2024-02-17,Prominent,A great sleep aid that helps you relax and wake up easily ,"{'neg': 0.0, 'neu': 0.368, 'pos': 0.632, 'compound': 0.9001}",0.9001,pos
139,103183,2024-02-04,Dream,The quality is excellent. The size and packaging correspond. The taste is neutral. I will buy more.,"{'neg': 0.0, 'neu': 0.802, 'pos': 0.198, 'compound': 0.5719}",0.5719,pos
140,103183,2024-01-19,Moisturize,It feels good because it has a thick texture and a high degree of adhesion. I think the cost performance is good.,"{'neg': 0.0, 'neu': 0.746, 'pos': 0.254, 'compound': 0.7003}",0.7003,pos
141,103183,2024-01-05,great,good quality. suitable ingredients. good size. lots of benefits. good taste,"{'neg': 0.0, 'neu': 0.383, 'pos': 0.617, 'compound': 0.8834}",0.8834,pos
142,103183,2023-11-07,,"The supplement has a very good effect on sleep processes. I take it regularly, I recommend it!","{'neg': 0.0, 'neu': 0.667, 'pos': 0.333, 'compound': 0.7171}",0.7171,pos
143,103183,2023-08-02,,Top quality superb ingredients of good size with a very good dosage which makes you feel the benefit from the first use. The capsules are tasteless which makes them easy to take. I fall asleep more easily and waking up less night. There are only beneficial products.,"{'neg': 0.0, 'neu': 0.615, 'pos': 0.385, 'compound': 0.969}",0.969,pos
144,103183,2023-05-13,,"It is the safe and effective solution that has been trusted by a very large number of men and women for nearly a decade. This unique formula contains ingredients that do not cause addiction and will not make you feel groggy. Increase your prayers upon the Prophet and say before each use of it and to others: Oh God, give me its goodness and keep its evil away from me before each use, and may God make it easy for you.","{'neg': 0.045, 'neu': 0.695, 'pos': 0.26, 'compound': 0.9515}",0.9515,pos
145,103183,2023-10-15,,"A cool natural complex that promotes relaxation before bed, quick falling asleep and deeper sleep. You wake up in the morning cheerful. It is especially suitable for those who had a hard day and their nervous system is overloaded.","{'neg': 0.106, 'neu': 0.602, 'pos': 0.293, 'compound': 0.875}",0.875,pos
146,103183,2023-08-11,,"Unfortunately, I exaggerated my expectations from conventional herbal pills. By the age of 62, I acquired chronic insomnia, which is already difficult to get rid of without sleeping pills. But, nevertheless, there is some effect. If it is possible to fall asleep relatively easily, the dream turns out to be longer, without frequent waking up. And then in the morning a completely different mood of a rested person.","{'neg': 0.067, 'neu': 0.852, 'pos': 0.081, 'compound': 0.4497}",0.4497,pos
147,103183,2023-05-21,,"Bought for family use, you will have to try it for a few more days before you know if it is suitable. The size is okay, and the taste is not strong, and the quality is yet to be determined. The original benefit is of course that I hope it can give my wife a deep sleep quality.","{'neg': 0.042, 'neu': 0.763, 'pos': 0.195, 'compound': 0.8315}",0.8315,pos
148,103183,2023-01-29,I feel that my sleep quality has improved,"I bought this because I wanted to improve the situation where I couldn't sleep when I woke up in the middle of the night. After taking one tablet, I was no longer awakened in the middle of the night and was able to sleep until morning. I get sleepy and unmotivated when I'm busy preparing dinner and doing housework, so I stopped taking it on weekdays.","{'neg': 0.109, 'neu': 0.846, 'pos': 0.045, 'compound': -0.4924}",-0.4924,neg
149,103183,2024-10-17,Didn't fit,"The ingredients are ideal, but it didn't suit me.","{'neg': 0.0, 'neu': 0.784, 'pos': 0.216, 'compound': 0.296}",0.296,pos
150,103183,2024-09-21,,"quality ingredients, standard tablet size, normal dosage, hopefully it will be beneficial","{'neg': 0.0, 'neu': 0.641, 'pos': 0.359, 'compound': 0.6808}",0.6808,pos
151,103183,2024-08-16,,"Very good product helps sleep I take it before bed when I'm awake great for flights
","{'neg': 0.0, 'neu': 0.542, 'pos': 0.458, 'compound': 0.8795}",0.8795,pos
152,103183,2024-08-11,,The sleep aid effect is average. I need to combine it with melatonin to improve my sleep quality.,"{'neg': 0.0, 'neu': 0.847, 'pos': 0.153, 'compound': 0.4404}",0.4404,pos
153,103183,2024-08-06,,"Good product helps with sleep convenient packaging good price when you sleep the world looks better 
","{'neg': 0.0, 'neu': 0.515, 'pos': 0.485, 'compound': 0.8834}",0.8834,pos
154,103183,2024-04-05,Good,"very large capsules, inconvenient to use. the dosage is high. the quality is satisfactory. ","{'neg': 0.155, 'neu': 0.699, 'pos': 0.146, 'compound': -0.0422}",-0.0422,neu
155,103183,2023-11-26,effective,effective products satisfied with my purchase nothing else to say,"{'neg': 0.0, 'neu': 0.576, 'pos': 0.424, 'compound': 0.7096}",0.7096,pos
156,103183,2023-11-19,Beneficial for sleep problems.,"Good quality, neutral in taste, easy to take in size.","{'neg': 0.0, 'neu': 0.58, 'pos': 0.42, 'compound': 0.7003}",0.7003,pos
157,103183,2023-07-28,very good,"This is the second repurchase. Before, I often suffered from insomnia. After eating this product, it can help relieve insomnia and sleep quality. The ingredients are natural and the taste is normal","{'neg': 0.084, 'neu': 0.712, 'pos': 0.203, 'compound': 0.5423}",0.5423,pos
158,103183,2023-10-07,,"I bought it on the recommendation of a friend. Impressed by the rich and natural composition. This premium formula contains only non-addictive ingredients. The complex, which promotes natural relaxation before sleep and obtaining quality sleep, helps to wake up refreshed. Great supplement, I recommend it!","{'neg': 0.0, 'neu': 0.515, 'pos': 0.485, 'compound': 0.9821}",0.9821,pos
159,103183,2023-09-10,Perfectly,"A very good supplement for improving sleep. The quality is excellent. The dosage is satisfactory, the size is not large and it is easy to swallow. The dose is good. I don't taste it because I swallow it right away. Good quality ingredient.","{'neg': 0.0, 'neu': 0.609, 'pos': 0.391, 'compound': 0.9647}",0.9647,pos
160,103183,2023-08-31,,"A very good product and it does not affect when you do not eat it. If you support regulating your sleep, I recommend using it","{'neg': 0.0, 'neu': 0.704, 'pos': 0.296, 'compound': 0.8122}",0.8122,pos
161,103183,2023-08-06,,"Grandmother started taking this drug one capsule at a time, she was very aching, and there was no sleep - perhaps the dose was small for her in one tablet, as she was very used to sleeping pills","{'neg': 0.143, 'neu': 0.857, 'pos': 0.0, 'compound': -0.6901}",-0.6901,neg
162,103183,2023-07-31,good composition,"A good composition, but I recommend not taking additional melatonin with this complex and I would like the supplement to be released in a capsule with powder, since without food it is not very pleasant to swallow such a capsule before going to bed","{'neg': 0.082, 'neu': 0.74, 'pos': 0.179, 'compound': 0.5532}",0.5532,pos
163,103183,2023-07-27,,"Nice product like everything else on iherb. The quality is at the highest level, I am satisfied. The advantage of iherb is obvious. Delivered for free. Sincerely grateful!","{'neg': 0.0, 'neu': 0.503, 'pos': 0.497, 'compound': 0.9571}",0.9571,pos
164,103183,2023-07-27,,"Nice product like everything else on iherb. The quality is at the highest level, I am satisfied. The advantage of iherb is obvious. Delivered for free. Sincerely grateful!","{'neg': 0.0, 'neu': 0.503, 'pos': 0.497, 'compound': 0.9571}",0.9571,pos
165,103183,2023-07-14,Great supplement!,An excellent supplement with a rich composition. All ingredients are high quality and natural. Capsule size is convenient to take. benefits and results. I liked it very much,"{'neg': 0.0, 'neu': 0.58, 'pos': 0.42, 'compound': 0.9349}",0.9349,pos
166,103183,2023-07-11,,"The dosage is just right, the packaging is intact, and the taste is acceptable. I took one tablet before going to bed last night, and fell asleep quickly, highly recommended!","{'neg': 0.0, 'neu': 0.8, 'pos': 0.2, 'compound': 0.6689}",0.6689,pos
167,103183,2023-07-07,,"This is not the first time I take this product, because its quality is domestically high, as is the composition of the ingredients. Prompt and understandable dose of application.","{'neg': 0.0, 'neu': 1.0, 'pos': 0.0, 'compound': 0.0}",0.0,neu
168,103183,2023-04-20,,"It works, I fall asleep well. I feel a little nauseous in the morning, but this is the norm for melatonin, at least for me.","{'neg': 0.0, 'neu': 0.931, 'pos': 0.069, 'compound': 0.1406}",0.1406,pos
169,103183,2022-11-17,,"At first, I thought the smell was strong, but it worked great for me. I've tried various sleeping pills, but this one is the most relaxing and makes me sleepy right away. It is also comfortable.","{'neg': 0.0, 'neu': 0.646, 'pos': 0.354, 'compound': 0.9583}",0.9583,pos
170,103183,2024-09-29,good ,"Good effect helped me sleep, but the smell is very strong and unbearable ","{'neg': 0.0, 'neu': 0.617, 'pos': 0.383, 'compound': 0.7808}",0.7808,pos
171,103183,2023-09-14,,"The taste or flavor of this supplement is unique, and I think people's tastes are divided. Also, the size of each pill is large, so it may be difficult to swallow. If you don't really care about such things, I think it's worth buying.","{'neg': 0.116, 'neu': 0.843, 'pos': 0.041, 'compound': -0.5338}",-0.5338,neg
172,103183,2023-07-09,,"It has a high content of valerian, lemon balm, and theanine, which have a calming effect. Since 3mg of melatonin is relatively low, I use 3mg of other melatonin or 5mg of time-release melatonin. It smells strong and smells like chamomile.","{'neg': 0.047, 'neu': 0.762, 'pos': 0.191, 'compound': 0.7506}",0.7506,pos
173,103183,2024-09-27,,"Very good quality, effective. Very good ingredients, effective.","{'neg': 0.0, 'neu': 0.234, 'pos': 0.766, 'compound': 0.9203}",0.9203,pos
174,103183,2024-01-02,Great!,"Great! This is good. Oh, great! This is good.","{'neg': 0.0, 'neu': 0.255, 'pos': 0.745, 'compound': 0.9391}",0.9391,pos
175,103183,2023-04-09,Excellent!,"Good food, will be ordering more. larger size Good quality, good ingredients, all useful.","{'neg': 0.0, 'neu': 0.463, 'pos': 0.537, 'compound': 0.891}",0.891,pos
176,103183,2022-09-19,,"This melatonin was taken to my husband and he sleeps soundly! Improves mood and sleep! The ingredients are natural and pure! The dosage is good, you need to drink two tablets, which is very convenient. You can divide the dose and drink one at a time because it is very effective.","{'neg': 0.0, 'neu': 0.787, 'pos': 0.213, 'compound': 0.9094}",0.9094,pos
177,103183,2022-09-12,"If you have trouble with insomnia, you can try this","I myself often suffer from insomnia, but I don’t want to take melatonin to cause addiction, so I just wanted to try this one at a special price… First of all, this smell is really stinky and stinky, and it’s a bit big, It may make people feel difficult to swallow... But if you can overcome the taste and swallow it, the effect of falling asleep is very good, and it can effectively help me fall asleep. I personally think it is worth recommending, because I have repurchased it again.","{'neg': 0.14, 'neu': 0.68, 'pos': 0.18, 'compound': 0.644}",0.644,pos
178,103183,2023-08-16,Ok,"I did not see any result from it, frankly, I tried more than one type of supplement that helps sleep or relieves stress, and I feel something more psychological than my reality. Chamomile tea relaxes my nerves more than it does.","{'neg': 0.094, 'neu': 0.737, 'pos': 0.17, 'compound': 0.5267}",0.5267,pos
179,103183,2023-05-10,,"The smell is strong and it's painful to drink, but I think I'm going to sleep better and the price is reasonable, so I'll continue to use it for a while.","{'neg': 0.057, 'neu': 0.766, 'pos': 0.177, 'compound': 0.6187}",0.6187,pos
180,103183,2023-10-07,,"I really liked this drug! corresponds to the declared characteristics, health is good. Convenient packaging. I recommend you to buy","{'neg': 0.0, 'neu': 0.631, 'pos': 0.369, 'compound': 0.831}",0.831,pos
181,103183,2023-10-01,Fits the description as it helped sleep and feel rested.,"The product helped me sleep easily, and also helped me feel rested while sleeping.","{'neg': 0.0, 'neu': 0.844, 'pos': 0.156, 'compound': 0.34}",0.34,pos
182,103183,2023-09-23,,"Excellent quality and normal taste. Sleep has improved, the dosage suits me!","{'neg': 0.0, 'neu': 0.585, 'pos': 0.415, 'compound': 0.7959}",0.7959,pos
183,103183,2023-09-19,very good,"Contains sleep-improving herbs and melatonin, natural ingredients that make it easy to fall asleep","{'neg': 0.0, 'neu': 0.69, 'pos': 0.31, 'compound': 0.6597}",0.6597,pos
