,product_id,date_posted,review_title,review_text,scores,compound,sentiment
0,126003,2023-11-23,What a great mind calmer!,"All natural herbs to serve one unique function which is a relaxing more calmer clarifying mind, perfectly suited for afternoons and evenings. Quality is great, all green small sized capsule with the perfect ingredients. Lemon balm and lavender should be missing in this ingredient but maybe because of calmer and not sleeping mind is thought of.","{'neg': 0.024, 'neu': 0.717, 'pos': 0.258, 'compound': 0.9237}",0.9237,pos
1,126003,2024-05-29,One of the greatest supplements ever to combat stress and anxiety! I totally recommend it. ,"The quality is top 100% organic 
The herbal formula (the ingredients) is great 
You ll feel the benefits after 2 days of use gradually building up as you use it regularly. ","{'neg': 0.0, 'neu': 0.761, 'pos': 0.239, 'compound': 0.8176}",0.8176,pos
2,126003,2024-03-04,Peace of Mind,My blood pressure is lower and sleep is so much better,"{'neg': 0.282, 'neu': 0.514, 'pos': 0.204, 'compound': -0.0571}",-0.0571,neg
3,126003,2024-01-05,Good product ,I like this supplement.. i saw a good result from the first use.. I recommend it to anyone who wants to calm down naturally ,"{'neg': 0.0, 'neu': 0.611, 'pos': 0.389, 'compound': 0.8481}",0.8481,pos
4,126003,2023-09-25,Perfectly,A great supplement from a well-known brand at the best price. Quality at the height.,"{'neg': 0.0, 'neu': 0.57, 'pos': 0.43, 'compound': 0.8519}",0.8519,pos
