,product_id,date_posted,review_title,review_text,scores,compound,sentiment
0,130782,2024-06-03,Love love love,Ive been taking this for a few months it's helped me so much I'm thinking clearer feeling better side bonus have slowed down my hot flashes.,"{'neg': 0.0, 'neu': 0.736, 'pos': 0.264, 'compound': 0.7845}",0.7845,pos
1,130782,2024-06-26,Bien,"good quality , size is easily swallowed, for all ages , and ut has lots of benefits , , easily inserted into your diet","{'neg': 0.0, 'neu': 0.608, 'pos': 0.392, 'compound': 0.8519}",0.8519,pos
2,130782,2024-10-06,Excellent!,This is not the first time I have taken this supplement to relieve stress. Raises the mood.,"{'neg': 0.145, 'neu': 0.725, 'pos': 0.13, 'compound': -0.0772}",-0.0772,neg
3,130782,2024-08-05,lifts the mood,Very high quality ingredients that stimulate and encourage the mood Reasonable capsule size Reasonable dosage 2 a day ,"{'neg': 0.0, 'neu': 0.729, 'pos': 0.271, 'compound': 0.6369}",0.6369,pos
4,130782,2024-06-29,,"quality of ingredients, convenient size, proper dosage, benefits for falling asleep, good taste, familiar additives, bought according to indications.","{'neg': 0.069, 'neu': 0.693, 'pos': 0.238, 'compound': 0.5994}",0.5994,pos
5,130782,2024-04-16,neutral,The effect is not clear. I did not feel much difference during use. Its price is high ,"{'neg': 0.127, 'neu': 0.873, 'pos': 0.0, 'compound': -0.2924}",-0.2924,neg
