,product_id,date_posted,review_title,review_text
0,117069,2024-09-17,Keeps me asleep longer,"I don’t necessarily fall asleep faster using Force Factor, Somnapure, but I definitely stay asleep better throughout the night. The ingredients include valerian root, which makes them really stinky, so don’t hold it in your hand too long and swallow quickly. The benefit far outweighs the taste. I believe the recommended dosage is 2 tablets but I sometimes only take 1."
1,117069,2024-05-04,Effective,"Quality is good
Ingredient is from natural herbs
The size is appropriate comparing to price.
Dosage is easy to take.
Effective benefit as advertised
No taste much easy to consume.
I would recommended this product for anybody who needs to have good quality time for sleep.
It safe and sound. 
"
2,117069,2024-01-28,A Great Natural Sleep Aid,"I have been using natural sleeping pills for years.  I decided to try Somnapure and it works very well and keeps me asleep.  There is another brand I use but even using those I seem to wake up in the middle of the night but this brand seems to keep me in a sounder and longer sleep,"
3,117069,2024-01-25,Sleep easily,"This is the best sleep support I have ever tried and I have tried quite a few.  I usually take it when I wake in the early hours and am assured of at least another four hours of sound sleep. The tablets are rather large but slide down with a big glass of water. Two tablets are ample at least for me. I have ordered more.

"
4,117069,2024-07-14,Sleep well,"I bought these sleep aid tablets for my mom, who occasionally struggles to fall asleep. She's found them helpful, though thankfully she doesn't need to use them very often. They seem to work well when she does."
5,117069,2024-03-17,Прекрасно!,"Thank you very much for this product, it suited me, I like the packaging, comfortable and stylish, I will order more of these products, and recommend them to all my friends and relatives! good!!
"
6,117069,2024-02-17,,This is a wonderful product! Good to help with a good nights sleep . Other health benefits as well. We trust the ingredients and the quality is very good. 
7,117069,2023-12-28,Great, This product promises to be the safe and effective solution to sleep issues.  The label lists herbs and supplements which contain only non-habit-forming ingredients that won't lead to feeling groggy in the morning. 
8,117069,2023-01-27,,"I purchased this product for my father who has sleep problems. He was looking for something natural and different than melatonin he has been using for sometime. Overall, he is very happy with this product and I am happy to be able find a product that helps my father's sleepless nights. "
9,117069,2023-10-07,the title accurately describes the product. ,"This product really works. I can say this as I have been a user for many years. The formula really works for me. It really helps me sleep and stay asleep. I take it one-hour before bedtime, and I am asleep in an hour. I highly recommend this product. "
10,117069,2024-10-14,I like it!,I just started to use this formula for better sleep and it helps me to fell a sleep.
11,117069,2024-08-14,,"Great supplement, my family liked it, great value for money "
12,117069,2024-06-22,really appreciate,high quality and clean ingredients no soure taste even with two dosage 
13,117069,2024-03-22,,"Great supplement, my family liked it, great value for money "
14,117069,2024-02-21,nice,I'm taking it when I have trouble sleeping. It works for me and doesn't invite addiction 
15,117069,2024-01-22,Fantastic ,Very happy with the quality of the product and packaging. I trust the brand
16,117069,2023-11-24,Effectiveness ,It works really well. I'm using from one week and it works
17,117069,2023-10-27,Slumber,Great supplement and it works well. It gives a relaxing feeling once taken before bed.
18,117069,2023-10-03,Wonderful Product,"Somnapure helped me get off ambien, a prescription sleep aid medication.
I love that I can now fall asleep naturally. I love that only one capsule makes me drowsy and helps me sleep through the night."
19,117069,2024-07-07,,As I suffer from insomnia it helps me having a better sleep.
20,117069,2024-05-03,Relaxes!!,Great for relaxation before sleep.   Easy to swallow.  Helps me stay asleep through the night 
21,117069,2023-10-27,Best natural sleep,"all good with this one, no issues, just the taste it's a bit strong, other than that, works well for me "
22,117069,2023-07-12,,"this is powerful sleep formula, it is so helpful for those who have trouble with their sleep just like me, they include some others nutrient to maximize the benefit of this product."
23,117069,2023-07-09,Two a night sleep tight!,The dosage is just right. Quality of the product is superb. The size of the pills are easy to swallow. All of the ingredients work very well together to give you a great night's sleep.
24,117069,2023-06-23,,"high dosage of melatonin which is works for me, i have been having trouble with sleep in recent years but after using this, i have slowly improve the quality of my sleep."
25,117069,2023-06-21,,"Works great,excellent quality extremely beneficial  best combination of natural ingredients ,perfect size and value for money,the best thing you like about it that it goes to work under an hour fora good night sleep."
26,117069,2023-06-04,i'm satisfied with it,"I can confirm that it does have a calming effect in addition to the effect of the melatonin, which helps me fall asleep quickly + stay asleep. the taste is ok however some people may find the tablets big for them"
27,117069,2023-05-20,,"thank you very much for the product, it is really good. iherb is a very strong shop, it promotes health and that is really its strong point, thank you"
28,117069,2022-12-05,,"I have issues with sleeping and they do help me as well, I am trying to use them not every night but only one pill does the trick, really good, but the size could be smaller, still good to swollow"
29,117069,2023-10-05,helpful,"I got these to help with jetlag. I'd never taken melatonin before and was a little anxious about using something to aid with sleep, but I don't actually feel like I'm taking an aid. I don't get ""hit"" by a sudden drowsy or heavy feeling but the sleep comes gradually. I can't say I don't wake up groggy either, but I still do have jet lag :)"
30,117069,2024-08-27,,This didn't work for me. I used it as directed.
31,117069,2024-04-03,Sleep aid,"might be working  for some, didn't feel much.
Will stick to melatonin."
32,117069,2023-11-14,good,good size  good ingredient easy to take good taste beneficisl 
33,117069,2023-10-10,Sleep aid,"Very good product, eat 2 pills before sleep (half hr). can sleep quickly."
34,117069,2023-10-15,Прекрасно!,"excellent product,good and strong packaging , the quality matches the description, I will still recommend ordering to everyone!!! okay
"
35,117069,2023-10-10,,"Very nice product, Thank you. Would buy it more
Would recommend to friends
"
36,117069,2023-10-01,,"i find it very hard to fall asleep, these tablets have certainly helped with that!!!"
37,117069,2023-07-14,Excellent! For those nights when sleep is difficult to come by,I usually take these on nights when I am too buzzed to fall asleep. It works a treat when it come to promoting drowsiness 
38,117069,2023-07-11,,Benefit It knocks you out within 2 hours of taking the serving. Taste is tolerable and stacks well with some ZMA before bedtime 🤤
39,117069,2023-07-10,,"good quality sleep formula, it got the melatonin as well others supporting ingredients that aid a restful sleep."
40,117069,2023-06-22,,"excellent quality, its dosage fits me, i no longer have sleep problem, i just take this 30 minutes before bed and work effectively 👍."
41,117069,2023-05-17,Прекрасно!,was very pleased! thank you very much for your order! I recommend to everyone! THX iHerb Team!
42,117069,2023-05-08,Somapure,This is my first purchase of this product and it helps me to sleep.
43,117069,2023-03-19,,these are the best sleeping tablets I've found easy to swallow and so calming
44,117069,2023-01-24,,Great product easy to swallow bit smelly but hold my breath.work very quickly not groggy in the morning 
45,117069,2024-05-19,Worthless ,"I used to take two tablets to fall asleep and it keeps me awake all night , waste of money I don’t recommend it "
46,117069,2022-06-13,,"First night I took this? Slept like a baby. Been having decent success with it for at least a month. It has kind of a funky taste, not completely unexpected with sleep supplements. Also, doesn't interact with my SSRI's and ADHD meds, so that's cool too."
47,117069,2022-06-06,,"It really works! Perfect quality and very convenient size and dosage. Just one pill and you sleep like baby! Natural ingredients and really neural taste. Strongly recommend it, really helpful herbal guys 😉"
48,117069,2021-11-09,Not bad ,"While this isn't like taking an Ambien, they work fairly well at making you feel sleepy and then staying asleep.  The pills are large and can be difficult to swallow.  Give them about an hour to work.  No grogginess the next day.  "
49,117069,2023-08-14,好的, taste is not bad but it's effect is mild
50,117069,2023-07-25,,cheap after discount but unsure if as good as others?
51,117069,2023-01-29,Not for me,Not working for me. Tried it for a couple of months with no results.
52,117069,2023-03-28,somnapure,haven't noticed much change in sleeping pattern after taking for a week.  Pill size is massive with a rather strong odor.  I have to cut them in half in order to swallow it.
53,117069,2022-10-29,,These ingredients are definitely not as effective as the old brand sompnapure. It’s too bad they changed company and made it different. I wish they would use the same ingredients as the old brand. It does not work for me. 
54,117069,2023-09-16,,"The formula combines melatonin with natural botanicals, looks promising. I have positive expectations for its potential to support better sleep."
55,117069,2023-09-03,,"Helpful with others drugs like melatonin. 
I recommend this product "
56,117069,2022-09-24,,These did not work as well as the same product did in the past . Perhaps their dosage has changed. I did not get the same benefit from the product 
57,117069,2022-05-27,Average,"This seems a very comprehensive combination to promote restful sleep. Unfortunately for me personally, it seems a hit or miss.  I hope to find some other sleep aids which may suit my condition better."
58,117069,2021-04-29,,"I only want to use natural products to fight my insomnia, but not all of them really help. I can finaly sleep well with Somnapure. No more sleepless nights"
59,117069,2021-01-03,,"I had used Somnapure some years ago and found it to be an effective sleep aid. So when my sleeping problems returned recently, I tried the product again and found it to be just as effective in helping me sleep through the night."
60,117069,2021-07-31,mmmm,Its nice to feel deeply asleep then awake feeling alert knowing I am well rested. Its also good to calm the brain with the natural herbs in Somnapure.
61,117069,2021-02-15,,"I take this product about an hour before bed and while it does not help me to sleep I am more relaxed and don’t have as many thoughts racing through my head. I have only been taking it for a week, so maybe when I have been on it longer I may see more benefit."
62,117069,2022-04-18,Eeewww,"I don't know if they actually work.  The smell of them made me start gagging so badly I couldn't take them.  The smell is that pungent, it permeated the skin on my hands and could be still smelt after using sanitiser."
63,117069,2021-03-27,,I am grateful for this herbal remedy as its a non-addictive and can contribute towards a relaxing state.
64,117069,2022-01-21,,"i like it 
it is good for me"
65,117069,2021-09-18,,"I like the product, helps ease the nerves and sleep.
Doesn't give a drowsy feel the next day"
66,117069,2021-06-15,Really works!!,"I was suffering from insomnia since months, and taking this has helped me get off from my sleep medications! Really recommend it!"
67,117069,2021-06-06,"Best for sleeping
Great for sleeping",If u having sleeping issues u can take this result can be seen after some weeks
68,117069,2021-02-13,,"along the Hyland's, valerian root and melatonin I take this as well and it's pretty good."
69,117069,2022-07-21,,I love this product and recommend it 
70,117069,2021-11-03,Bien,not yet used ! hope it will help 
71,117069,2021-11-02,,I sleep like a little angel
72,117069,2021-01-31,,I take this together with 3mg melatonin and I manage to get a good night's rest. The melatonin by itself was not enough
73,117069,2022-02-23,,Its work!
74,117069,2022-02-22,,Good one
75,117069,2021-03-20,Somnapure,My husband has trouble sleeping and he takes this to help him sleep and he says it definitely helps him to stay asleep
76,117069,2021-08-22,,Best product that I have used from my insomnia. 
77,117069,2021-06-06,Excelente!,very good this product thank you 
78,117069,2021-02-13,,Somnapure does help with sleep.
79,117069,2021-04-02,,Thank
80,117069,2024-05-24,Try taking one tablet first ,"Yesterday night I took 2 tablets as indicated on the package. I slept for 10 hours and my head is still heavy and there is a slight headache. Before that I drank melatonin periodically and there was no such reaction. I think for my weight of 45 kg you need to take one tablet at a time. So that be careful. Also, due to the content of valerian and other herbs, the tablets have an odor, keep in mind."
81,117069,2024-10-14,good,"Good quality and ingredients, helps me fall asleep easier, sleep well. I take only 1 pill, the size is good. The vitamin has a mild herbal taste and smell, but it is not a problem for me. There are some nights when I wake up in the middle of the night and have trouble falling back asleep. Sometimes I add 5HTP and L-Theanine."
82,117069,2024-09-20,Perfect composition of ingredients!,"Great product with great quality! You can start with just 1 capsule, as melatonin only helps you fall asleep :-) Valerian and theanine take care of the rest! A product that will definitely help you fall asleep and, above all, sleep through the night!! (The taste takes some getting used to, as valerian doesn't smell particularly good ;-) )"
83,117069,2024-07-20,,"A good combination of natural ingredients and melatonin. Ordered for the first time, very satisfied with the quality. One tablet before bed is enough for me, I add another 5 mg of melatonin and I sleep until morning without waking up. The size of the tablet is normal for me, the tablet has a pleasant herbal smell and taste, the quality for the price of this brand is quite satisfactory to me. I will take a large package so that it will last longer, because I may have to double the dose due to the very difficult life in the front-line region of Ukraine. Glory to Ukraine!"
84,117069,2024-05-12,Excellent!,"I bought chewable melatonin from this manufacturer several times and was very pleased with both the effect and the taste. Therefore, without hesitation, I ordered this melatonin. The good thing is that the dosage can be adjusted to suit your needs. Supplementing with herbs and theanine enhances the benefits of taking it. Chamomile, hops, mint are good for relaxation and relieve spasms. Moreover, each ingredient works in a slightly different way. Overall this is a good buy."
85,117069,2024-01-08,Excellent!,"I consume this supplement in 30 min. it's already the 4th day before bedtime, and I can safely say that it has significantly improved the strength and quality of my sleep. I recommend it to everyone who has problems sleeping and who wants to wake up in the morning rested and refreshed! The ingredients and quality are super!"
86,117069,2023-12-25,Excellent!,"I ordered it for the first time, there is a result, my sleep has improved and the most important thing is that waking up is easy, there is no heaviness in the head. The drug is of high quality and the dosage is well chosen, I hope that I will continue to use it in the future."
87,117069,2024-05-10,,"I will order again, this is the second time. The drug worked for me and really helps me fall asleep. I sleep peacefully and wake up easily. I took melatonin for a long time, this complex helped me get away from melatonin. I recommend "
88,117069,2024-05-24,"It works, but I'd like to try other supplements.","I bought it because a friend recommended it. The smell is quite strong, so I wash my hands after touching it. The pills are also quite large, so I drink plenty of water. My husband said it was very effective and he slept soundly. I felt like I was able to sleep, but I started having a lot of dreams and felt tired in a different way. It's not bad, but I can't live without it! I'd like to try other products."
89,117069,2024-06-28,Can,"I took it with a trial attitude. The particles were a bit big, but it wasn't a problem for me. The smell was unpleasant to me when I first took it, but after I got used to it, I had no problem. I take two pills every night before going to bed. Sometimes it is effective, sometimes it is not, but I always find it helpful to fall asleep. I will stick to it for a while."
90,117069,2024-04-09,A mini dose of melatonin,"I was looking for a sedative with a minimum dose of melatonin, because chemistry affects the body in different ways. In the morning there is drowsiness, there is no cheerfulness. The manufacturer recommends a dose of 2 tablets before going to bed, I will reduce the dose and see."
91,117069,2024-03-07,Prominent,"Finally, I advise you to the master of treatments, which is charity, with the intention of reward and healing. Be patient with me so that nothing decreases your reward. May God reward you with all goodness, Paradise, and your parents ❤️❤️💕🌷"
92,117069,2024-10-12,Ingredients: Natural,I eat half an hour earlier at night and feel that it is easier to fall asleep and I won't feel groggy in the morning.
93,117069,2024-08-31,,"I order for my husband, it works instantly, we took it on the recommendation of a doctor. True, the dosage is large, it helps well when there are problems and stress"
94,117069,2024-08-30,,This product promises to be a safe and effective solution to sleep problems. The label lists herbs and supplements that only contain ingredients that are non-addictive and won't make you feel drowsy in the morning.
95,117069,2024-07-29,good,"I have trouble sleeping The benefits of this product made me sleep well. The quality of each component is good. Just the right amount of medicine. It has no taste, but has a slightly pungent smell. no problem for me"
96,117069,2024-06-26,,"The hormone reduces anxiety and improves emotional state. When stressed, it reduces the level of adrenaline and some other hormones, exhibiting an anti-stress effect. Increases the level of serotonin, without which depressive states develop."
97,117069,2024-05-20,Help for sleep!!!,"This composition of ingredients is ideal for good support to improve the quality of sleep that will bring benefit to your life, it does not leave a taste, the dose is indicated"
98,117069,2024-04-10,Sleep better,"It's very good. My son was a total shut-in and had reversed his day and night routine, but now he's back to normal."
99,117069,2024-02-18,,Perfect quality. The size of the balls is large. Dosage: take one half an hour before bedtime. Advantages: really anesthetizes. Disgusting taste but even so it doesn't stay in the mouth.
100,117069,2024-01-30,At night,"Since I started drinking, I no longer wake up at night. You can sleep soundly until morning. The downside is the smell, but if you put up with it only when drinking it, it won't bother you."
101,117069,2023-12-10,Great,"High quality natural ingredients - herbs and amino acids, which I select separately for myself, are brought together in an excellent dosage! Taste doesn't matter, the main thing is the benefits. The size is convenient for swallowing."
102,117069,2023-11-11,deep sleep,"I don't think the amount of time I sleep has changed that much, but I fall asleep faster and feel refreshed when I wake up, so my daily life has become easier."
103,117069,2023-11-05,For Women!,"It's a light supplement with just the right size and ingredients for women, and I don't really mind the taste, and I like the cute packaging."
104,117069,2023-10-26,,I bought it for my hypertensive mother. Very cool natural composition. The effect of relaxation before sleep is noticeable. Magnesium and glycine worked best for her.
105,117069,2024-09-19,"The effect is good, but the smell is repulsive","I bought it to calm my nerves a little in the evening and improve my sleep. I took one tablet, it works gently, there is no feeling of fatigue in the morning."
106,117069,2024-09-08,Favorable,"Fall asleep quickly. We sleep longer in a peaceful way and we are in great shape in the morning, invigorated when we wake up. Interesting percentage of melatonin (3mg)"
107,117069,2024-08-30,effective,"effective supplement to sleep easily, the mixture of different plants with melatonin is very effective, since I take it I sleep easily until the morning I am happy "
108,117069,2024-08-03,Melatonin is combined with various ingredients that have a sleep-inducing effect to induce natural sleep.,"I started taking melatonin with gummies, and have taken it in various forms such as capsules, tablets, quick-dissolving tablets, and liquid. I have it in all dosages: 3mg, 5mg, 7mg, and 10mg, and I choose and combine it depending on my condition that day. For me, the good thing about melatonin is that it doesn't have as strong an effect as sleeping pills, it helps me fall asleep naturally, and I wake up refreshed without feeling sluggish or sleepy. (I think this depends on the compatibility, so some people may feel that way...) Sleeping pills don't leave me feeling refreshed, so on days when I feel a little sleepy, I can sometimes fall asleep with just melatonin. Now, in addition to melatonin, this supplement contains ingredients and herbs that have a tranquilizing effect, such as L-theanine, hop extract, passionflower, chamomile, and lemon balm, which I feel enhance the effect of falling asleep. However, the amount of melatonin at 3mg seems too weak for me. I don't get very sleepy unless I take this with 3mg of melatonin alone or combine it with half a tablet of Belsomra prescribed by my psychiatrist. If you don't have as severe a sleep disorder as I do, I think this alone will help you fall asleep."
109,117069,2024-08-01,the composition is good,"the ingredients are good, the size is large, but you can swallow it. the effect is there, but maybe I expected more. falls asleep not immediately after use, but definitely better than without them"
110,117069,2024-05-22,There is no effect,"Decent composition, good quality. But after 2 weeks of taking it, I did not see any effect on sleep. Maybe you need to take it longer. "
111,117069,2024-02-18,insomnia,"It has a strange smell, but I've gotten used to it. I drink it before going to bed. I can sometimes sleep or not depending on my physical condition, so I take it along with other supplements."
112,117069,2024-01-09,,"Bought this supplement to help with sleep problems. A good composition that has a calming effect. Neutral taste. The package should be enough for a month, during this time, I think, the benefit should be felt."
113,117069,2024-09-15,perfect for relaxing before bed,"An excellent sleep inducer, natural ingredients, and they do not have a strong taste, I take two 3 hours before bedtime "
114,117069,2024-01-07,Somnapure sleep aid,"I've been using it for about a month, I ordered 3 more jars. I don’t have any illnesses, I sleep well."
115,117069,2023-10-01,Comfortable sleep,"Ternana officinalis This herb in the mint family is used to promote sleep through relaxation. Chamomile Chamomile, similar to the daisy, is known for its calming effect and use in herbal teas. Passionflower This plant is traditionally used to promote sleep, and has been harvested as a medicine for centuries. L-80 Soothing Green Tea is rich in this amino acid, which has a gentle relaxing effect. Hops This floral group helps increase alpha waves in the brain, which speeds up the onset of sleep. Melatonin This vital hormone, naturally secreted by the pituitary gland, helps regulate sleep patterns. Narine This perennial herb is used around the world to promote relaxation and help calm the mind."
116,117069,2023-06-26,Melatonin supplement support,"It contains herbs with the potential to improve sleep quality, along with theanine and melatonin. You can take a lot of herbs with one grain. Especially valerian and lemon balm are abundant. One tablet contains 100mg of theanine, which is a sufficient amount. One tablet contains 1.5 mg of melatonin. I don't think this is a lot. The standard amount is 2 capsules per time, but if I were you, I would add 1 capsule of this supplement to the single melatonin supplement to aim for a deeper sleep. I use it as the main support role, not the main sleep supplement."
117,117069,2023-09-19,excellent!,"A wonderful and gentle sedative for sleep. I love this brand, always a quality product. It became easier to fall asleep. Aroma of herbs, easy to drink. If the review was useful - 👍"
118,117069,2024-08-09,,"not a bad composition, but I won't say that there was a noticeable effect, at least not an obvious one. it was at a big discount, so I bought it"
119,117069,2023-08-23,sleeping well,"I was prescribed sleeping pills, but I tried this because I was afraid of becoming dependent on it. The grains are a little large and it was difficult to drink at first, but there is no problem once you get used to it. I also improved my habits by myself, such as not looking at my smartphone right before going to bed, but I feel like I can fall asleep smoothly."
