,product_id,date_posted,review_title,review_text
120,117069,2023-07-12,,"I couldn't sleep every day due to sleep disorders, but I took one tablet to try this. I was surprised to be able to sleep without waking up until morning! I got a good night's sleep, and my depression eased. I would like to continue. The size of the capsules is too big for me to swallow, but I think they are sized to prevent children from swallowing them by mistake. The smell of the herb valerian is unique, but it's better than coating the smell with unnecessary chemicals, so I'm okay with it. I wish I had taken it sooner!"
121,117069,2024-10-15,,"High quality, clean ingredients, excellent package size, tolerable taste, good for health and improving body odor, excellent formula and great benefit"
122,117069,2024-10-08,I recommend ,"High quality, balanced selected ingredients, medium size capsules, neutral in taste, there is a noticeable smell"
123,117069,2024-10-05,,"Excellent for anxiety and insomnia, with no side effects. Take one or two pills and you will sleep like a baby 👼🏻"
124,117069,2024-09-21,,"prone to sleep disorders, supplement that really helps me relax and fall asleep easily suits me perfectly "
125,117069,2024-09-18,Melatonin ,"The quality is excellent, the ingredient is natural, the size and dose are convenient, the taste is normal, "
126,117069,2024-09-02,,"Excellent quality, good ingredients, suitable age, excellent ginseng, good packaging, excellent benefit, gives energy, increases effort, gives immunity 

"
127,117069,2024-07-24,Class,The quality and ingredients are super! I like it! I order for training I like it super 
128,117069,2024-07-03,Www,Excellent dosage. The composition is great. The packaging size is super. The ingredients are great. Healthy
129,117069,2024-06-25,,"I had insomnia and after discovering this supplement, my sleep improved a lot! I will buy again"
130,117069,2024-06-15,Top quality,An excellent product that meets all my expectations. I would happily recommend him to others
131,117069,2024-06-07,Class,"I liked the quality and ingredients, composition and taste! The packaging is convenient! "
132,117069,2024-05-26,promotes sleep,"Good quality, helped me sleep, good size, dosage just fine, no aftertaste"
133,117069,2024-04-25,Top for sleep,"The quality is high, the ingredient is good, the size, the advantage in simple use, the taste is neutral, I recommend it for purchase"
134,117069,2024-04-22,,A very effective means of relaxation before going to bed. Helps to fall asleep faster and sleep longer.
135,117069,2024-04-05,,Bought for a girlfriend. She really liked this complex - it solved the problem of poor sleep. 
136,117069,2024-03-22,Class,I liked the super composition. The size of the package and the benefits all really correspond to the price! 
137,117069,2024-03-10,Effective sleep aid,Great product that helped my son sleep. Good value for money! 
138,117069,2024-02-17,Prominent,A great sleep aid that helps you relax and wake up easily 
139,117069,2024-02-04,Dream,The quality is excellent. The size and packaging correspond. The taste is neutral. I will buy more.
140,117069,2024-01-19,Moisturize,It feels good because it has a thick texture and a high degree of adhesion. I think the cost performance is good.
141,117069,2024-01-05,great,good quality. suitable ingredients. good size. lots of benefits. good taste
142,117069,2023-11-07,,"The supplement has a very good effect on sleep processes. I take it regularly, I recommend it!"
143,117069,2023-08-02,,Top quality superb ingredients of good size with a very good dosage which makes you feel the benefit from the first use. The capsules are tasteless which makes them easy to take. I fall asleep more easily and waking up less night. There are only beneficial products.
144,117069,2023-05-13,,"It is the safe and effective solution that has been trusted by a very large number of men and women for nearly a decade. This unique formula contains ingredients that do not cause addiction and will not make you feel groggy. Increase your prayers upon the Prophet and say before each use of it and to others: Oh God, give me its goodness and keep its evil away from me before each use, and may God make it easy for you."
145,117069,2023-10-15,,"A cool natural complex that promotes relaxation before bed, quick falling asleep and deeper sleep. You wake up in the morning cheerful. It is especially suitable for those who had a hard day and their nervous system is overloaded."
146,117069,2023-08-11,,"Unfortunately, I exaggerated my expectations from conventional herbal pills. By the age of 62, I acquired chronic insomnia, which is already difficult to get rid of without sleeping pills. But, nevertheless, there is some effect. If it is possible to fall asleep relatively easily, the dream turns out to be longer, without frequent waking up. And then in the morning a completely different mood of a rested person."
147,117069,2023-05-21,,"Bought for family use, you will have to try it for a few more days before you know if it is suitable. The size is okay, and the taste is not strong, and the quality is yet to be determined. The original benefit is of course that I hope it can give my wife a deep sleep quality."
148,117069,2023-01-29,I feel that my sleep quality has improved,"I bought this because I wanted to improve the situation where I couldn't sleep when I woke up in the middle of the night. After taking one tablet, I was no longer awakened in the middle of the night and was able to sleep until morning. I get sleepy and unmotivated when I'm busy preparing dinner and doing housework, so I stopped taking it on weekdays."
149,117069,2024-10-17,Didn't fit,"The ingredients are ideal, but it didn't suit me."
150,117069,2024-09-21,,"quality ingredients, standard tablet size, normal dosage, hopefully it will be beneficial"
151,117069,2024-08-16,,"Very good product helps sleep I take it before bed when I'm awake great for flights
"
152,117069,2024-08-11,,The sleep aid effect is average. I need to combine it with melatonin to improve my sleep quality.
153,117069,2024-08-06,,"Good product helps with sleep convenient packaging good price when you sleep the world looks better 
"
154,117069,2024-04-05,Good,"very large capsules, inconvenient to use. the dosage is high. the quality is satisfactory. "
155,117069,2023-11-26,effective,effective products satisfied with my purchase nothing else to say
156,117069,2023-11-19,Beneficial for sleep problems.,"Good quality, neutral in taste, easy to take in size."
157,117069,2023-07-28,very good,"This is the second repurchase. Before, I often suffered from insomnia. After eating this product, it can help relieve insomnia and sleep quality. The ingredients are natural and the taste is normal"
158,117069,2023-10-07,,"I bought it on the recommendation of a friend. Impressed by the rich and natural composition. This premium formula contains only non-addictive ingredients. The complex, which promotes natural relaxation before sleep and obtaining quality sleep, helps to wake up refreshed. Great supplement, I recommend it!"
159,117069,2023-09-10,Perfectly,"A very good supplement for improving sleep. The quality is excellent. The dosage is satisfactory, the size is not large and it is easy to swallow. The dose is good. I don't taste it because I swallow it right away. Good quality ingredient."
160,117069,2023-08-31,,"A very good product and it does not affect when you do not eat it. If you support regulating your sleep, I recommend using it"
161,117069,2023-08-06,,"Grandmother started taking this drug one capsule at a time, she was very aching, and there was no sleep - perhaps the dose was small for her in one tablet, as she was very used to sleeping pills"
162,117069,2023-07-31,good composition,"A good composition, but I recommend not taking additional melatonin with this complex and I would like the supplement to be released in a capsule with powder, since without food it is not very pleasant to swallow such a capsule before going to bed"
163,117069,2023-07-27,,"Nice product like everything else on iherb. The quality is at the highest level, I am satisfied. The advantage of iherb is obvious. Delivered for free. Sincerely grateful!"
164,117069,2023-07-27,,"Nice product like everything else on iherb. The quality is at the highest level, I am satisfied. The advantage of iherb is obvious. Delivered for free. Sincerely grateful!"
165,117069,2023-07-14,Great supplement!,An excellent supplement with a rich composition. All ingredients are high quality and natural. Capsule size is convenient to take. benefits and results. I liked it very much
166,117069,2023-07-11,,"The dosage is just right, the packaging is intact, and the taste is acceptable. I took one tablet before going to bed last night, and fell asleep quickly, highly recommended!"
167,117069,2023-07-07,,"This is not the first time I take this product, because its quality is domestically high, as is the composition of the ingredients. Prompt and understandable dose of application."
168,117069,2023-04-20,,"It works, I fall asleep well. I feel a little nauseous in the morning, but this is the norm for melatonin, at least for me."
169,117069,2022-11-17,,"At first, I thought the smell was strong, but it worked great for me. I've tried various sleeping pills, but this one is the most relaxing and makes me sleepy right away. It is also comfortable."
170,117069,2024-09-29,good ,"Good effect helped me sleep, but the smell is very strong and unbearable "
171,117069,2023-09-14,,"The taste or flavor of this supplement is unique, and I think people's tastes are divided. Also, the size of each pill is large, so it may be difficult to swallow. If you don't really care about such things, I think it's worth buying."
172,117069,2023-07-09,,"It has a high content of valerian, lemon balm, and theanine, which have a calming effect. Since 3mg of melatonin is relatively low, I use 3mg of other melatonin or 5mg of time-release melatonin. It smells strong and smells like chamomile."
173,117069,2024-09-27,,"Very good quality, effective. Very good ingredients, effective."
174,117069,2024-01-02,Great!,"Great! This is good. Oh, great! This is good."
175,117069,2023-04-09,Excellent!,"Good food, will be ordering more. larger size Good quality, good ingredients, all useful."
176,117069,2022-09-19,,"This melatonin was taken to my husband and he sleeps soundly! Improves mood and sleep! The ingredients are natural and pure! The dosage is good, you need to drink two tablets, which is very convenient. You can divide the dose and drink one at a time because it is very effective."
177,117069,2022-09-12,"If you have trouble with insomnia, you can try this","I myself often suffer from insomnia, but I don’t want to take melatonin to cause addiction, so I just wanted to try this one at a special price… First of all, this smell is really stinky and stinky, and it’s a bit big, It may make people feel difficult to swallow... But if you can overcome the taste and swallow it, the effect of falling asleep is very good, and it can effectively help me fall asleep. I personally think it is worth recommending, because I have repurchased it again."
178,117069,2023-08-16,Ok,"I did not see any result from it, frankly, I tried more than one type of supplement that helps sleep or relieves stress, and I feel something more psychological than my reality. Chamomile tea relaxes my nerves more than it does."
179,117069,2023-05-10,,"The smell is strong and it's painful to drink, but I think I'm going to sleep better and the price is reasonable, so I'll continue to use it for a while."
180,117069,2023-10-07,,"I really liked this drug! corresponds to the declared characteristics, health is good. Convenient packaging. I recommend you to buy"
181,117069,2023-10-01,Fits the description as it helped sleep and feel rested.,"The product helped me sleep easily, and also helped me feel rested while sleeping."
182,117069,2023-09-23,,"Excellent quality and normal taste. Sleep has improved, the dosage suits me!"
183,117069,2023-09-19,very good,"Contains sleep-improving herbs and melatonin, natural ingredients that make it easy to fall asleep"
184,117069,2023-09-11,,I really liked this drug. The composition is excellent. Convenient packaging. I feel good. Has all the declared properties. I recommend you to buy
185,117069,2023-08-22,,Excellent quality! Helps to fall asleep faster. Allows you to sleep longer. Helps to wake up rested. Capsules are not large.
186,117069,2023-08-12,,Natural ingredients from a quality manufacturer will provide the desired result and benefit the body
187,117069,2023-07-26,,An excellent tool for a sound and long sleep. I recommend for use.
188,117069,2023-07-16,Efficient!,"A wonderful natural complex for sleep. In my case, it contributed to a deep and sound sleep without night awakenings. I really liked it!"
189,117069,2023-07-13,,"A great supplement that has a good hypnotic effect. I really liked the composition, it is completely natural."
190,117069,2023-06-20,,"It's 3mm, so I feel like I should drink 3"
191,117069,2023-06-17,,"This effect is good, buy some more, this effect is good, then buy some"
192,117069,2023-05-31,Excellent!,Helps to sleep well. I wake up feeling sleepy and it makes me very happy. A good product!
193,117069,2023-05-14,,"Very high quality, every ingredient is high quality and important for continuous sleep, medium size is suitable for about a month."
194,117069,2023-05-12,,Quality and ingredients without taste. Dosage and benefits for your body
195,117069,2023-03-11,,"I bought several sleep aids at once, but this one has not been tried yet"
196,117069,2024-04-25,,Very satisfied. I also ordered for my girlfriend. She is also very satisfied.
197,117069,2024-04-04,Great!,Great! Great! Very satisfied
198,117069,2022-09-03,,Many of us find it difficult to get the quality sleep we deserve. Somnapure® is a safe and effective solution that has been trusted by countless men and women for almost a decade. This premium formula contains only non-addictive ingredients that won't make you feel sleepy.
199,117069,2023-10-18,,"The tablets are larger than average, the ingredients are high quality, the dosage is appropriate, the taste is normal, I hope they help"
200,117069,2023-07-03,,Do not take more than 2 tablets in 24 hours.
201,117069,2023-03-31,,The taste is a bit strong! But it helps with sleep! already repurchased
202,117069,2022-12-20,,"Good in terms of ingredients, the quantity is appropriate, and the package is well closed. I hope to get the desired benefit, thank you"
203,117069,2023-10-18,I'm concerned about the smell,"It has quite a smell. Because of that, it was difficult for me to continue. I tried a bottle, but it didn't help me sleep. If the gummy type doesn't suit you, that might be better."
204,117069,2023-07-17,,I didn't use it I took it to my cousin and I don't know how much it affects him
205,117069,2023-05-15,,"It's hard to swallow because one grain is big. Otherwise, I think it's a good product."
206,117069,2023-08-24,Great! Great! Bought too much,Great! Great! Bought too much
207,117069,2023-06-08,,"Help improve sleep quality, feel smooth stool"
208,117069,2023-02-22,,Great! Made multiple purchases Great! Made multiple purchases
209,117069,2021-11-26,,"I can't say that this product helped me a lot, as I woke up several times at night, and continued to wake up, the only thing, I fell asleep faster, maybe this is age-related and will help someone sleep all night, but I won't order again"
210,117069,2021-04-01,,"I work in 2 shifts, one week is during the day and the other at night. I have difficulty sleeping. I started taking it and now I sleep much better. I'll buy more."
211,117069,2022-09-11,,"Great product! Great product! The drug works, the quality of sleep has improved. Great product. Remarkable quality. Sleep has improved significantly."
212,117069,2022-01-26,Very effective!,Recently I have been having difficulty falling asleep and the product is very very helpful to me when needed. Highly recommend
213,117069,2022-11-10,,Started sleeping well after a week of service
214,117069,2022-09-07,,I think it helps me sleep but only if I take it a few hours before bed
215,117069,2022-04-19,,From the experience of a friend that this product is good and I will try it
216,117069,2022-01-17,Very effective and amazing. I have tried many related products and this one is my first choice.,"Can be flat better, more expensive"
217,117069,2021-08-05,,"I also tried it after seeing everyone’s praise. It really helps sleep, falling asleep faster and sleeping soundly, but the pill has a very strong smell, it should be said that it is a bit smelly, which is a point of deduction."
218,117069,2022-08-09,,"Effective, quality ingredients. However the stamps are too big"
219,117069,2021-12-02,,It's great and I found it useful
220,117069,2021-11-25,,I ordered it for my client
221,117069,2022-08-12,,I couldn't sleep well I didn't use it and threw the box
222,117069,2022-05-01,,Excellent sleep aid
223,117069,2022-02-18,,Works for me
224,117069,2022-01-16,,My customer's request
225,117069,2021-03-22,,Good helps to sleep deeply.
226,117069,2021-10-23,,My customer's request
227,117069,2021-06-16,,Excellent
228,117069,2021-03-14,,good
229,117069,2021-02-01,,I loved it
