,product_id,date_posted,review_title,review_text
0,122463,2024-09-20,Good,"I've chosen this supplement, because it's natural, it has a lot of high quality ingredients which should calm my sensitive golden retriever girl. She's 7 now and we haven't found the one supplement which could help with her anxiety while going on a car rides or through a storm or fireworks. Since it has a lot of natural calming herbs, I hope they will work for her nervous system to calm down. It also has L-Tryptofan, which i've noticed helps her a little bit (in other supplements that she taken), so my hopes are high for this one. Valerian, chamomile and passion flower all have calming effects on people, so it should work for her also :)) Thiamine is B1 vitamin, which gets depleted when a body is in a stressful state, so we'll see how it affects her. 
We also chose it because of a very good price with a discount. The packaging is big and we're gonna be using it for a long time"
1,122463,2024-07-06,Прекрасно!,"Dog supplements oil provides high-quality nutrition, promoting a healthy coat and overall wellness. The size of the bottle is convenient for regular use, and it comes at a good price for its benefits"
2,122463,2023-10-22,Great product ,"My dog is so much more relaxed than usual, she likes the taste and with each use she is more calm."
3,122463,2024-05-15,,Works on most of my dogs but not all. But nonetheless works
4,122463,2024-08-21,Relaxation for dogs 😊,"The packaging is very convenient to use, my dog is small, so it's important to me to have control over the amount of oil in each use. I added it to her dry food and she ate enthusiastically. I'm not sure it calmed her down, she's very orthodox, I'll wait for the winter and the thunder, in any case this supplement made her very happy"
5,122463,2024-06-19,,Excellent product. Suitable for any age. Natural composition and high-quality ingredients. I recommend it to everyone.
6,122463,2023-12-25,Excellent!,"the size of the package is large, so it lasts for a long time. the quality is excellent. I will order more"
