,product_id,date_posted,review_title,review_text
120,1236,2022-12-14,Ok,"I don't know why, but I don't like this brand. the quality may be normal, but in my opinion, the price is overpriced. iHerb has enough other quality brands with a more affordable price. Thanks for the like! Glory to Ukraine!"
121,1236,2023-06-29,,"I'm glad I snatched it up! I love this brand, all effective supplements"
122,1236,2018-04-21,VITAMINS WORK.,"Ordered these vitamins to reduce nervousness in a stressful period. I took one capsule a day. About a week later he noticed that he became calmer. They work gently - no drowsiness, no pressure on the brain. Now I sometimes use as usual multivitamins weekly courses of one capsule per day, regardless of food intake. Overall satisfied. If the feedback is useful, click YES."
123,1236,2023-10-08,,"The composition is excellent, the quality is high. I really love this brand. natural ingredients"
124,1236,2023-10-06,good,"Good quantity, good use, good quality, normal size, good packaging"
125,1236,2023-08-07,,Very good like all source natural supplements suitable for daily intake soothes and allows better use of cognitive abilities
126,1236,2023-08-04,,"b plus c is needed by everyone every day, it can strengthen the resistance and antioxidant capacity."
127,1236,2023-07-02,,"If you drink it when you are stressed, you can feel the effect. It would be helpful if there was a little more capacity."
128,1236,2023-06-03,,"An excellent complex for calmness, calms nerves and improves health! Cool and cool, I will take more"
129,1236,2023-05-10,,"The packaging is good, the ingredients are good, the dosage is suitable, the size is good ordered received"
130,1236,2022-12-04,Excellent!,The quality is excellent. The composition is effective for combating stress. Improves the work of the nervous system.
131,1236,2023-09-13,,One of the best vitamins on the site Helps cope well with stress Improves overall condition Good price I recommend
132,1236,2023-07-05,Good,"I like such supplements. I periodically take these vitamins, especially at the beginning of a depressive autumn"
133,1236,2021-07-20,Good bought.,"I have been looking for vitamins for a long time that can only bring benefits and no harm. Source Naturals, Hi-Stress B & C - suited me very much, no one has ever seen me so energetic, these vitamins add strength, improve metabolism, normalize stool. No cons were found. 120 tablets were enough for a month of use, I will take a break and drink them again. The composition is very interesting, whoever reads it will understand, nothing superfluous, only natural ingredients, herbs. I am very pleased."
134,1236,2021-06-14,,"This is a godsend for me! I will definitely order more! With the current stress level, this is my peace of mind)) Excellent composition, dosage, proven brand. The effect is felt immediately! 2-4 things a day, depending on your emotional state. I drink 2 after breakfast and 2 at night, it does not cause drowsiness, it just becomes calm and external stimuli do not make me lose my temper."
135,1236,2021-05-04,,"I bought it for my husband to restore the nervous system and sleep. Sleep was disturbed due to stress. He drinks 3 times a day. Less nervous. The composition is cool! Helps to be less nervous. Sleep has not yet returned to normal, but so far it takes only a week, continues to take. Then I'll write"
136,1236,2019-03-06,Excellent between periods,Use it at the end of the day after the stress makes you very calm and continue to impact until the next day with clarity in the vision and lack of desire to do something .. Men may affect the erection I do not know .. Do not use it on a daily basis may give a result is not good .. The size of the big love This is not Drink lots of water.
137,1236,2014-05-06,"It helped, and how!","I often have headaches which are not removed analgesics. We had to drink 2-3 tablets, and it almost every day. The doctor advised to go to yoga. She brought me temporary relief. And that's when I really lost hope that my headaches will pass, opened the fridge and saw the jar. I ordered it for my husband from the stress at work, but she had, for some reason did not go. I)), lo! After drinking the recommended dose of 4 tablets, let me go)) probably my pain was intense pain. And when relaxed muscles and the brain, head and passed)) for me it is a great happiness!"
138,1236,2014-03-23,Look for those who need B vitamins,"In composition, balanced product, adding a little bit of vitamin A, C and D. Plus minerals every day, too, not much, just a part of her herbs and valerian tablets reek. For me as 4 tablets a day is a lot here at the most 2 times (morning and evening), the amount of B vitamins in one tablet optimized, more and not have to because they are rapidly cleared. I replaced the multivitamin complex. Separately ordered selenium, alpha-lipoic acid and Q10. I recommend to try this combination have problems with the liver and pressure!"
139,1236,2021-12-02,,"A convenient blend of soothing herbs and vitamins for irritability. But with nervous work, for example, it should be taken regularly. Unfortunately, there is no cumulative effect. Does not cause drowsiness."
140,1236,2021-05-30,,"Good composition. Everything is balanced here. Everything to strengthen the body during stress. Each person has their own stress level, so it helps everyone in different ways. One tablet is enough for me in the morning after meals and in the afternoon for three weeks. Sometimes, according to health, one tablet in the morning is enough. I don’t take these pills at night because it can cheer me up. Then a break, tk. the body must produce some of the components of these pills by itself, otherwise it will completely lose the habit."
141,1236,2012-09-13,stress....,"Daughter of the college entrance examination preparation'm good because when we've looked at four in mind just in case my daughter ... taking medication to the test in the morning and get stressed at home, go to school there was a second pill do I ate effect Constant Heart the light was good ... Map containing ingredients and have more confidence and reduces the heart is also an affordable price .... ^^"
142,1236,2019-09-24,"Whenever we see iHerb products, we are quick to buy our trust in the company's credibility,","IHerb's credibility drives us to buy, especially as it provides us with a lot, but we should not take any supplements on our own."
143,1236,2021-07-27,Super composition!,"For the first time I meet a complex with everything necessary for the nervous system and sleep. A combination of herbs, magnesium and vitamins. Great product. Drink as needed."
144,1236,2021-04-11,Helps Deal With Stress!,"A very good supplement to combat stress. In addition to important vitamins of group B and others, it contains useful herbs that have a beneficial effect on the nervous system."
145,1236,2021-03-02,,"A very good preparation for the nervous system. It really works, but since there is a large amount of vitamins in the composition, I noticed that I was gaining weight."
146,1236,2021-01-23,Bomb!,"This is a really bomb-like stress reliever! Excellent working complex, quality product, reliable manufacturer! Recommend! I would be grateful if you click ""yes""."
147,1236,2021-01-21,Helps Fall Asleep Quickly!),"Usually I do not sleep well, and I fall asleep for a long time, and I also sleep lightly all night. I decided to fight this and bought these vitamins, they help me fall asleep very quickly, and worry less throughout the day."
148,1236,2020-10-05,,"I really love this product. Under stress I drink two pills at once, with prolonged stress I start with 4 pills a day and gradually reduce the number of pills a day to 1. So I drink for about a month. The disadvantages are the size and taste of the tablets, but this is not a problem for those who can swallow them, as the taste is not felt. For those who do not have serious illnesses, half a stress pill is enough, which literally brings relief in half an hour."
149,1236,2019-05-12,Good soothing,"I often have anxiety attacks. And so far these are the best pills that I drank to move away from this state. There are also some problems with sleep, saw at night and a healthy, sound sleep you provide."
150,1236,2018-05-22,Hi-Stress,"A wonderful product. Corresponds to the description. I drink 2 months to restore the work of the nervous system. During this period, there are no stressful situations. I will order more. I really liked it. I recommend."
151,1236,2024-10-13,,I bought this medicine after reading reviews. 
152,1236,2022-05-09,,"Excellent complex to improve the state of the nervous system Has soothing properties, due to the various herbs in the composition I recommend!"
153,1236,2022-04-05,,Very helpful and improves mood Why is it missing in stock?
154,1236,2021-11-29,,"Works great, after 2-3 days of taking you feel the result of taking the drug"
155,1236,2021-04-07,Quite,"I've been trying various multi-minerals, but I started to think that it would be good to use the main vitamin B group, so I bought this one this time. No change in physical condition for 2 weeks in a row, good or bad. I prefer B12 to be methylcobalamin and more biotin, so it's delicate to repeat."
156,1236,2021-01-19,,"I ordered this supplement in the hope that it will help me to put my nerves in order a little during times of stress and nervous tension. But I didn't see much of a result. The pills are huge, they swallow with difficulty, I won't take any more"
157,1236,2019-01-23,"Complex B and C, but did not help with stress","Rich composition: vitamins B, C and valerian. The pills are large and worst of all are long (is it really difficult to make small round pills in the 21st century ???), and due to the fact that it is long, I was unlucky once and the tablet got stuck in the esophagus near the throat, stood across and didn’t want to go in any way, I wouldn’t wish anyone to get into such a situation. After several minutes of torment, in the end everything worked out thanks to the gag reflex. So I advise you to chew. But all this would not be so important if the tablets solved the problem for which they were bought, but alas, I do not feel any reduction in stress (anxiety). I drank 4 at first after eating - I did not feel the effect, continued to drink further 2 at a time 2 times a day - also nothing. I can advise only as a pure vitamin complex."
158,1236,2021-08-26,,"I already buy the 2nd can, I drink in cases when I need to calm down, sometimes after the gym I can't fall asleep for a long time, an excellent remedy."
159,1236,2021-07-14,comprehend zen,"after giving birth, my nervous system just flew off the coils, unless the foam came from my mouth 😄. helped me a lot to put things right, life takes on colors. I drink with omega"
160,1236,2021-06-13,,"Literally from the second day of administration, the effect of the drug was felt. I took from 1 to 2 a day, depending on the stressful situation."
161,1236,2021-04-10,,"I liked this vitamin. I have been drinking for less than a month, but the result appeared very quickly. I drink 3 tablets a day after meals. I wash it down with a glass of water. If you take less water, it can hurt your stomach."
162,1236,2021-04-06,Good remedy.,"It helped a lot in a very stressful situation. Already in a week of admission, the twitching of the eyelid has been removed and sleep has slightly improved. I will take it further. I recommend."
163,1236,2019-11-11,"It works, but","Too tired when you eat one or two grains are a little ... The novelty, but the smell is beyond imagination ..... The size is too big .... Sensitive people may get stressed while eating"
164,1236,2021-10-20,"The taste, smell and size were not good","The theme of the supplement, which is to supplement the nutrients that are deficient due to stress, was very good, but I gave up because the tablets were quite large, smelly and unpleasant. I was drinking a fairly large tablet now, and I thought it was about that, but it was even thicker than that. I got caught in my throat and coughed up. It's very painful and painful, the taste melts away, it makes me feel uncomfortable, and I failed it several times, so I'm sorry to give up. I would like to have a non-herb product on this theme."
165,1236,2018-12-26,Larger (over 2 cm × 1 cm),"One more than 2 cm × 1 cm, it was too big for me. As I drank it, I was bitterly torn apart for a while, so I drink it. There are a few smells, but it is not enough to make you feel uncomfortable. Since I started drinking, I still do not know the effect, but I am expecting that it contains VB and VC and various others."
166,1236,2021-09-28,"Not an anti-stress, but a sleeping pill","I didn’t get any less nervous, but I didn’t count on such an effect. 2-3 tablets before bedtime help to fall asleep quickly and not wake up at night. The vaunted melatonin doesn't work that way. The size is, of course, gigantic."
167,1236,2023-04-23,,"Honestly, I haven't noticed any effects. I do not advise anyone"
168,1236,2021-05-18,,"So far, I can not write anything about this drug. I took it to my sister, as she complained of stress and fatigue. I will definitely update my review."
169,1236,2023-02-25,,"Unfortunately, no significant effect was seen."
170,1236,2021-06-18,,"It's just something magical, an amazing composition. Everything you need to calm down. If you have depression, anxiety, this is for you."
171,1236,2021-06-01,,"The only pills that work as expected. The mood improved, the cases of panic disappeared, 2 tablets a day. No lethargy, no side effects."
172,1236,2021-02-24,,The drug was prescribed by a doctor and met all expectations!
173,1236,2021-02-04,,"an excellent complex, it is a pity that they quickly disassemble! it suited me very much"
174,1236,2021-01-29,,"Found this remedy in search of the perfect sedative. They fit perfectly for me, I drink a course in a stressful period"
175,1236,2021-01-27,,"Herbal preparation with a rich composition to normalize sleep, relieve tension and nervousness, to support the nervous system."
176,1236,2021-01-26,,Great complex. Relieves anxiety immediately. I drink myself and give to my daughter (10 years old) in stressful situations
177,1236,2021-01-25,Excellent,Very cool natural vitamins for stress. Life becomes much easier. Better than any antidepressant
178,1236,2021-01-25,,One of the most effective supplements my husband tried due to stressful work. No side effects were noticed.
179,1236,2021-01-22,Fine,"A very good work complex for stress. Rich composition, good group B. Take courses."
180,1236,2021-01-20,,"Very large pills, I had to bite through to pay. They have a good composition of vitamins and calm the nerves."
181,1236,2021-01-20,Helps,"I took it for my husband, there is an effect! Sleep improved, anxiety decreased. I recommend those who have nervous work and fatigue."
182,1236,2020-02-25,Unable to swallow capsule,"I put 1 star because of the size of the capsules. It is impossible to swallow. You can easily choke. You can chew, but I'm not sure that this is the right method of reception. Tart when chewed. I threw half the can, realizing that I can no longer suffer so. No more ordering."
183,1236,2018-03-14,A great tool to stay in harmony with yourself and others.,"Perfectly helps to be calm, erases anxiety and sad thoughts. I recommend."
184,1236,2018-03-06,Relax,"The cumulative system, noticed that it became calmer after a week of intake"
185,1236,2016-08-01,good,"Whenever I feel stress, I eat one at a time."
186,1236,2015-10-25,Works great,A perfectly balanced hi-stress tablet. Helps with stresses. Perfectly balanced composition of tablets. An excellent product that helps manage stress. L.
187,1236,2022-06-19,,A good natural stress reliever
188,1236,2022-02-21,,Copes with stress and bad mood
189,1236,2021-10-14,,"An excellent complex for dealing with stress, I bought it for my husband, the result became noticeable after a week of taking"
190,1236,2021-09-21,Excellent!,"Good ones. Calm down. I don't feel sleepy after taking it, but I sleep better at night."
191,1236,2021-08-13,,"After eating, the spirit is good, the inflammation is reduced, and the complexion is bright."
192,1236,2021-08-05,,"Working drug! Good composition, helps to calm down, relax, look at everything from the positive side) vitamins necessary for the body!"
193,1236,2021-08-03,A rare combination!,"I liked the composition very much. Includes vitamins, magnesium, and herbs to calm the nervous system. Satisfied!"
194,1236,2021-06-26,,"An excellent preparation for peace of mind, we drink with the whole family !!! 1 tablet an hour before bedtime and no problem falling asleep"
195,1236,2021-06-12,,Began to take after stress .. take at night. While it seems to help
196,1236,2021-06-04,,"A good pleasant product, there is a result., It is necessary to take for a long time."
197,1236,2021-06-01,,"The product is excellent, very satisfied! I began to feel much better. The nervous system slowly began to recover. Night sleep improved. Recommend."
198,1236,2021-05-26,Excellent!,A good complex of B vitamins to restore vitality and the nervous system!
199,1236,2021-05-12,,"I drink 1 tablet an hour before bedtime, it helps to fall asleep quickly. Previously, she slept anxiously, often woke up."
200,1236,2021-04-21,Excellent,Good anti-anxiety pills. The only negative is they are big. Inconvenient to drink!
201,1236,2021-04-10,,"I like it. I will not say that it directly tends to sleep, but it became easier to fall asleep."
202,1236,2021-04-08,Excellent!,"I ordered this complex for a nervous husband on the advice of a doctor of preventive medicine)) very rich composition, the effect is noticeable 👏"
203,1236,2021-04-06,A bomb,I drink 2 tabs in the morning and I can't get through. Really became calmer and more balanced
204,1236,2021-04-02,,Nice complex. The soothing effect is mild. The effect is noticeable only after a week.
205,1236,2021-03-23,,The drug that helped to cope with stress and fatigue. I'm happy with the result.
206,1236,2021-03-07,Fine,A good anti-stress supplement! The composition is just a bomb! Many things that have a positive effect on the nervous system
207,1236,2021-03-01,,"drank and calm, I advise everyone whose nerves are not in order"
208,1236,2021-01-25,,A good complex of B vitamins plus vitamin C. Recommend
209,1236,2021-01-24,,I really like these pills. They have a cumulative effect. We take a course twice a year.
210,1236,2021-01-21,,"did not understand the action, but I hope that everything that is needed, the body has learned"
211,1236,2021-01-19,Good nutritional supplements,I chose it for myself because of high stress. A nutritional supplement that supports me. Energy is created by vitamin B. Thank you.
212,1236,2021-01-01,,"The taste of valerian is strong. Whether they help or not, I can't say with certainty, it's individual for everyone."
213,1236,2020-10-27,,only with these pills I save myself during reports and in very stressful situations
214,1236,2016-10-22,Is there an effect,I bought it when I heard that it would lower the stress level.
215,1236,2022-01-11,,It is good because it contains herbs.
216,1236,2021-06-17,"it's okay, but…","The ingredients probably matched. But the grains were so big that I couldn't drink unless I chewed them. When I chew it, I really don't like the unique taste, so I give up on it ..."
217,1236,2021-04-25,,"It is a very good product, but it has a long-term effect. Say I stay tired the next day"
218,1236,2021-04-16,,"I take it only during stress, dulls a little, it seems ..."
219,1236,2020-12-10,,"A good selection of B vitamins and an anti-stress complex. Working version, I recommend."
220,1236,2022-08-22,,good when stressed
221,1236,2021-12-05,,Relieve stress
222,1236,2021-01-19,,"I bought it because it is a lot of stress. It contains vitamins B and C, so you can eat it casually."
223,1236,2022-01-11,,I don't know the effect right now.
224,1236,2021-06-03,,"Excellent complex of vitamins with herbs, really liked"
225,1236,2021-02-14,Sedative,"Relieves stress, the composition is gorgeous!"
226,1236,2021-01-26,,"Very effective remedy, works great, I sincerely recommend it!"
227,1236,2021-01-21,,"Sleep sound quality, decent composition."
228,1236,2019-01-01,The smell is really nasty.,"When I eat it, it smells bad enough to get out of my mouth. Even if I pick it up for a while, I smell it in my hand. And no effect on stress. No repurchase."
229,1236,2019-11-12,I did not notice the effect,"She had too high hopes for this drug. Its action is too overestimated by users, or simply not suitable for everyone."
230,1236,2021-05-03,,Great stress reliever. I take it before bed.
231,1236,2021-04-12,,The best non-addictive stress reliever for me
232,1236,2021-02-13,,"Super complex, everything is profitable and works"
233,1236,2021-02-11,,excellent supplement for stress relief.
234,1236,2021-01-23,,Eating it seems to soften my mind a little.
235,1236,2020-12-10,Excellent!,They really calm down and treat insomnia.
236,1236,2017-09-02,Excellent,"Use it from time to time
Relieves nerves"
237,1236,2021-06-25,Super,Very soothing
238,1236,2021-06-16,,good stress complex
239,1236,2021-05-10,,"Works great, good sleep"
240,1236,2021-04-17,,Recommend!!!
241,1236,2021-01-31,Good Composition,Husband drank at work
242,1236,2021-01-27,,Quality product.
243,1236,2021-01-21,Herbal Composition,Helps with stress!
244,1236,2020-03-18,No feeling,The particles are too big and not suitable for Asians to swallow
245,1236,2021-08-27,,Not that much... it's a rip off.
246,1236,2021-04-20,,Contains a lot of herbs
