,product_id,date_posted,review_title,review_text
0,130782,2024-06-03,Love love love,Ive been taking this for a few months it's helped me so much I'm thinking clearer feeling better side bonus have slowed down my hot flashes.
1,130782,2024-06-26,Bien,"good quality , size is easily swallowed, for all ages , and ut has lots of benefits , , easily inserted into your diet"
2,130782,2024-10-06,Excellent!,This is not the first time I have taken this supplement to relieve stress. Raises the mood.
3,130782,2024-08-05,lifts the mood,Very high quality ingredients that stimulate and encourage the mood Reasonable capsule size Reasonable dosage 2 a day 
4,130782,2024-06-29,,"quality of ingredients, convenient size, proper dosage, benefits for falling asleep, good taste, familiar additives, bought according to indications."
5,130782,2024-04-16,neutral,The effect is not clear. I did not feel much difference during use. Its price is high 
