,product_id,date_posted,review_title,review_text
0,30819,2024-01-24,,"Passion Flower herb arrived in a large, fragrant bag, offering an incredible, fresh aroma. Whether enjoyed on its own or blended with other teas, the taste is delightful. It's my go-to tea evening tea for a calming evening, and the generous size provides excellent value. The quality is noteworthy, and I plan to repurchase again due to its great taste, benefits, versatility in blending, and the soothing experience it brings to my daily routine. The absence of caffeine adds to its appeal as an ideal choice for my evening routine. "
1,30819,2023-12-01,Chillax and rest easy,"This is such an effective tea to settle me down and really bring things down to earth. It’s a great fog lifter from the stress of the day and a nice way to really mellow me out. The flavor by itself is something to get used to, but I’ve found most things like this just become its own thing after a while. It’s like once you start drinking black coffee no sugar. Once you get over the hump, you can start to appreciate other flavors you never noticed before. Some of the foreign flavors in Passion Flower are ok once you get to know them. Also, I mix it with something I enjoy too. It all depends. Good stuff!"
2,30819,2024-10-01,Love This One,"I’ve been enjoying Frontier Co-op’s Cut & Sifted Passion Flower Herb! The calming properties make it perfect for winding down in the evening. I love brewing it into a soothing tea that helps relieve stress and promote relaxation. The 16 oz bag is generous and lasts a long time, allowing me to incorporate it into my nightly routine. It’s a delightful addition to my herbal collection, and I appreciate the quality that Frontier Co-op provides!"
3,30819,2024-03-30,Great Value.,The size of these bags is great. How much of the quality ingredients you get at once..  buying your tea ingredients in bulk is just 100% the way to go. We add about 2 tablespoons per serving to our nightly tea blends for that relaxing benefit. Definitely caffeine free! Not a resealable package. 
4,30819,2024-03-12,Helps me sleep,"My doctor suggested using passion flower to help me stay asleep, which I've been having issues with for years.   This definitely helped!  The flavor isn't the greatest, so I may mix it with other teas that I usually have in the evenings.  Highly recommend it for those who like tea and are having perimenopausal sleep disturbances.  "
5,30819,2024-01-04,Must have for anxiety ,This herb is a must have for anxiety. It is very calming. It has a very earthy taste so it’s best to mix with something like chamomile or peppermint when using as a tea. We use as teas and tinctures mixed with other herbs and it is absolutely amazing. Has great benefits. Will definitely purchase again. 
6,30819,2023-12-18,Passionflower,Love love love this product! Fabulous for stress and anxiety.  Don't know what I'd do without it.  I smoke it and eat it. Quality is fantastic along with the price. Supplements of this nature are superb in that it's actually the plant and flowers cut and sifted for quality.
7,30819,2023-10-26,Quality raw herb for stress,"The taste is not great but goes well with lemon and honey for our night cuppa.
The size of the package is HUGE so you might want to share it with someone else.
It benefits the nervous system having a calming effect.
This tea is caffeine free and you can use it to create your unique relaxation blend by using a few different herbs in it."
8,30819,2024-04-21,Great blend addition to the tea.,"It has good herbs quality, I like package and serving.
The smell and taste are specific, has strong grass smell. Recommends to use it as addition to the tea.
Anyway, it has good nature quality. And size of the package is big, enough for a long time."
9,30819,2024-03-26,A favorite for evenings! ,"Great quality. The taste is earthy, but I typically blend it with other herbs. I frequently brew this in the evenings because of how it benefits the nervous system by calming and soothing. It also acts as a sedative tea. Naturally no caffeine. "
10,30819,2023-12-27,passion flower herbal tea,big size package of dried passion flower herb. value for money. used for brewing tea in the evenings to wind down and calm the nerves. has earthy and flowery body taste. good option to serve guests in the evening as non-caffeine option. quality of ingredients is not bad. alternative to camomile tea. 
11,30819,2024-07-09,Excellent,"I like this herbs sooo much, the Quality is good,, taste is is so good, i use it before sleep to relax my mood and help my with stress, thank you"
12,30819,2024-06-15,Passionflower Bulk Herb,I always buy in this convenient 1 lb size due to the large amounts of tea I make. There is no caffeine in this herbal tea and it is great to help me relax. I use it twice a day for my anxiety.
13,30819,2024-05-18,Relaxing herbal tea or DIY tincture,This is great quality dried Passionflower at a great price! I blend it with Valerian for a night- time relaxing tea for a good sleep. Also good for anxiety. I use this herb as a tea alone or blended with other herbs + I make my own tincture.
14,30819,2024-03-14,Stinks but works,Make my own calm tea using this and lemon balm every night. Huge bag given how little you need. Packaging sucks since can’t reseal it 
15,30819,2024-02-07,Best Quality,"I love drinking passion flower tea, its have a calming effect and the taste is good. i love to mix it and make a tea blend for relaxation. "
16,30819,2024-01-14,Very Happy,The quality is very good and I am very happy with this product as the herb is very potent. It also is a very poor tasting tea and quite bitter. 
17,30819,2023-12-28,Very calming,I love these teas because they come in very generous packages at a fair price. This one is no exception. Very soothing and calming. I have eat every evening mixed with raspberry leaf tea hoping for some health benefits. 
18,30819,2023-12-08,,The quality was great and served the purpose. It was fresh and did not look like sweepings like some products that claim to be leaves
19,30819,2023-11-19,Прекрасно!,"Thank you very much for this product, it suited me, I like the packaging, comfortable and stylish, I will order more of these products, and recommend them to all my friends and relatives! good!!"
20,30819,2023-11-17,Great value for money,"Quality is great as always, when buying Frontier... Bought it for a gift for my wife, but I´ve been enjoying it also, so not only a lady´s tea. "
21,30819,2023-11-11,Natures relaxer ,"I LOVE passionflower. If you need a little nervous system soothing, this is a fabulous herb to add to your herbal tea mix. Huge bag and amazing quality. Highly recommend. "
22,30819,2023-12-09,Supposed to make one drowsy,Passion flower tea is supposed to help relax you and make you drowsy. I bought this to aid my night time before bed sleep ritual so I can have a more restful slumber without resorting to pills. Can't say I noticed any difference whether I take this or not. 
23,30819,2024-06-10,Recommended ,Good quality herbs. I use it on its own or as a blend with other herbs. I just haven’t had and noticeable calming results.
24,30819,2024-06-08,effective in some sort,"I felt some relaxation after one week use but not much effective in my sleep, no side effects except some feeling of burn in the stomach. "
25,30819,2023-02-19,,"I like passionflower for its relaxing effect to help me get to sleep when I find it hard to relax, especially during pregnancy. Frontier has the best quality of herbs I’ve found. I am pleased with the taste and the huge amount. It’s awesome that it’s a safe ingredient for pregnancy! I share it with all my pregnant friends to use. "
26,30819,2022-11-06,,"I like to use this product in the evening to wind down and relax ready for bed.  There is no caffeine in this tea and the serving size is great.  Really big package size.  taste is hard to explain, but it definitely helps with anxiety and stress.  I have it straight on a daily basis, not part of a blend.  "
27,30819,2024-07-30,not a fan,does not seem to help with sleep   I have shared with a few others to make sure it wasn't me.  We all agreed it did nothing  to help us sleep.  In fact I was up all night 
28,30819,2023-09-23,Makes delicious tea,"I am not going to rave about Frontier, their product is always exceptional quality. This one is not an exception. The bag is big and flowers are not over dry. I was taken aback first, because I expected flowers, but it is more like sifted grass.  The tea has mild taste and relaxing. I like it a lot. "
29,30819,2023-06-27,מצוין!,"The taste is familiar which I dont like a lot. but that is how my taste is for this plant.

the effect are really well.
 I like all the frontier products Iv'e tried so far.

next bag will be taken soon.
I will try more flowers products from the company"
30,30819,2023-02-22,,I came across this by accident from a friend who was drinking this and tried it and I liked it. I immediately ordered it once i researched a little about this product. Do your research and you might be intrigued. The taste is good but when I add a few drops of stevia it brings out the taste even more. The best thing is it's natural and good for you. The ingredients and quality of this product are great! I strongly recommend it !
31,30819,2024-09-29,Great quality!,"This only thing is that its not organic, I dont mind paying more for organic option, but quality is good!"
32,30819,2024-09-28,,"Great product, really helpful product to take for my health"
33,30819,2024-09-23,Good,Good quality passion flower herb from an excellent brand. I like that it's loose leaf so I can make my own infusions.
34,30819,2024-09-18,,Good quality good ingredients good taste easy use great benefits comes in good packaging
35,30819,2024-09-14,Lovely!,You will get a generous amount for the price of this herb. Excellent for sleep!
36,30819,2024-09-14,,Not yet used but i love the size and packaging.. i like the benefits also 
37,30819,2024-08-28,Great ,"Great quality, taste herbal easy to use. Plastic bag package sizes decent. I drink it as a tea"
38,30819,2024-08-27,Huge bag!,Huge bag of quality leaves! Very happy customer. Thank you!
39,30819,2024-08-25,Nice!,Huge back of passionflower. It is decent quality and a good price. Drink it as a tea to help with sleep.
40,30819,2024-08-18,Love it ,"This stuff is great. Tastes really nice, the bag is hugggeee and it makes me feel calm and relaxed. Would repurchase. "
41,30819,2024-08-15,Good Quality Passion Flower,Frontier Co-op Cut & Sifted Passion Flower is an easy way to add passion flower tea as needed. 
42,30819,2024-06-25,,very good herbal tea ingredient large amount for the price .
43,30819,2024-06-21,Good quality ,"Large quantity, fresh and strong. No impurities.  Will last long time. Good packaging. "
44,30819,2024-06-19,Good price,Better price than some places and seemed fresh and had good small. Use for tea and bath products
45,30819,2024-06-09,Great!,A lot bigger than I expected! probably will expire before I even finish it
46,30819,2024-05-27,Great herbal tea,Love this passion flower herbal tea. I mix it with other relaxing herbs for a great nights sleep!
47,30819,2024-05-27,,I love making homemade tea blends and this was the perfect addition! The brand is great quality!
48,30819,2024-05-26,Good quality,I use it for my stress blends and also my immune blends.
49,30819,2024-04-29,Fantastic sleeping aid,"Loved it. Helps me to fall asleep and gives me a gentle relaxed feeling.

"
50,30819,2024-04-28,For sleep,"This product is amazing, way better than melatonin or chamomile, highly recommended."
51,30819,2024-04-14,One of my favorite nighttime teas with great benefits. ,Good caffeine free blend and an alternative to drinking strong teas before sleeping.
52,30819,2024-03-31,Great herb for relaxation ,"Great purchase! Large amount, fast delivery and very good quality of the herb! Recommend "
53,30819,2024-03-22,Love it,Great quality herb and excellent bang for your buck! Frontier is a supplier I trust
54,30819,2024-03-21,,"Loved this mixed with the mint family, makes a great glycerite! "
55,30819,2024-03-19,Great brand,I recommend all herbs from this brand. They are quality.
56,30819,2024-03-19,Great Tea! ,"I drink this every night. I make a mix with nettles, chamomile, lemon balm and lemon grass. So good! "
57,30819,2024-03-15,,"Helps me sleep, it doesn’t taste the best bit it’s still useful and the size is huge"
58,30819,2024-03-09,,"It helps me to sleep well, to relax. Its a good quality and a big package!"
59,30819,2024-03-09,Bought to help with adhd,"Bought this as one of the many herbs to help with my son's ADHD. Needless to say, he wouldn't take the capsules."
60,30819,2024-02-28,sleepy time tea,"A wonderful night tea to help for a more peaceful rest.  Fruity and fragrant . A BIG bag of fresh, quality herbs."
61,30819,2024-02-21,Excellent Quality,"This is an incredible deal for passionflower. I usually use this herb fresh, but for tea I use it dried. "
62,30819,2024-02-19,,I am pleased with the large amount and clean herb.
63,30819,2024-02-06,It helps sleeping  problems ,"It helps my sleeping problems, I will buy it again "
64,30819,2024-01-27,,"I use this product to calm my horses who are stressed due to illness. It is very effective. 
"
65,30819,2024-01-20,great product,Impressed with the quality of this product. Highly recommend to others of like mind. 
66,30819,2024-01-13,grear,I tried it as tea and mixed it with lavendar chamomille and verbena.
67,30819,2024-01-12,Great ,"Good quality herbs, no taste, easy to use, big package size, thank you "
68,30819,2023-12-29,Passion Flower,I heard great review about this herb for energy and stress relief. 
69,30819,2023-12-28,Passion Flower herb for tea,"I make a tea blend with chamomile, passionflower and lemongrass.   The tea puts me at ease and helps with sleep."
70,30819,2023-12-26,,Passion flower tea is really helpful for relaxation and to help you fall asleep. I like that it’s caffeine free. 
71,30819,2023-12-13,Large bag,Large bag for a great price.  Seems to be good quality.
72,30819,2023-11-26,Perfect,Absolutely no complaints. Quality is excellent. The speed of shipping was great. The price is the best I have found.  
73,30819,2023-11-11,Another Frontier Co-op great product !,"Tasty, excellent quality, not irradiated. So, I got the best! Thanks Frontier and IHerb to make that product available."
74,30819,2023-11-06,,Bought to use as night time tea to aide sleep. Have tried other brands too. This is good quality and does support better sleep. 
75,30819,2023-10-30,Excellent Quality,I love this Passion Flower herb that I use in my own tea blends. Frontier has excellent quality herbs. 
76,30819,2024-07-06,OK,I don't really like it's taste but it's good for relaxing from anxiety so I add it to my tea blends. 
77,30819,2024-06-28,Curious flavor ,"I was surprised by the spicy flavor. Pairs well with the nettle, oat straw grass and green tea."
78,30819,2024-04-30,,not the best tea flavor but i still enjoy it in the evening with other herbs 
79,30819,2024-03-26,Looks fresh,"I was hoping to see some flowers, but mainly leaves, it looks fresh and clean."
80,30819,2024-02-12,,Trying for first time in tea form for relaxation/sleep aid in evening.  Helps to add a bit of fresh lemon juice.
81,30819,2024-02-10,Not organic ,I put 4 stars because it is not organic. That’s means it has pesticides
82,30819,2024-01-21,High quality passion flower,Very high quality ingredients easy to use and nice package 
83,30819,2023-09-06,Great in sleep tea blend,Love making my own sleep tea blend and having so many bulk options on iHerb makes this both flexible and better value than buying pre-mixed tea bags. 
84,30819,2023-07-30,,"delicious, it is relaxing and refreshing at the same time, especially in the afternoon, it is highly recommended, especially after work hours and before the evening walk"
85,30819,2023-07-18,,great. I actually use it as sleep aid? but doesn't really work for me. but this bag of flower from frontier is still of good quality. 
86,30819,2023-05-17,,Doesn't smell like much but brew it as a tea and serve with lemon and a lil stevia. Gorgeous pink color and nice floral flavor.
87,30819,2023-03-13,,This came packaged perfectly. Great price. It will be made into a blend sleeping tea I can’t wait. Iherb is the BEST!! Highly recommend 
88,30819,2023-02-16,Bedtime tea,I use this in combination with other relaxing herbs for an evening tea blend. The big bag will last a good while even though I use more than the recommended serving size. 
89,30819,2022-12-03,,"I received 1 lb of passionflower in no time and I am so pleased with the ingredient, quality and taste . 
Thank you IHerb , Edward Grossman "
90,30819,2024-06-03,Low quality,"I should have gone with a higher quality tea but I was looking to make strong brews. This was not it for me. Despite the size and great pricing, the taste was sub par."
91,30819,2022-08-30,Quality tea,"Super relaxing. I add some to my yerba mate to help keep me mellowed out. Makes for a great swimming sesh. Relaxation aside, I’m ultimately trying to lower my estrogen with this product, and I have confidence in its potency. Time will tell, but so far so good! Super fresh, about to buy some raspberry leaf tea from the same company."
92,30819,2023-12-24,,Bought this for a friend. The foil bag it came in  is quite large.
93,30819,2023-12-04,一般,This product is so far so good and I have to try more .I like 
94,30819,2023-07-29,Seems ok but too large a quantity,I don't see why they can't sell smaller quantities.  There's no need for this much and it will likely spoil before I can make use of it.
95,30819,2023-06-25,,"This is a great dried passion flower, but I just didn't end up liking it as much as I had hoped. The size is a great value, but it will take forever to use this much."
96,30819,2023-10-03,,Great for stress relief. Fresh and good amount in the bag. 
97,30819,2023-10-01,Great Product,I have used it myself and my quality of sleep has increased greatly and more calm and less anxious. thank you
98,30819,2023-09-28,Great product ,I am satisfied with the product. A clean product that met my expectations. The package arrived quickly and intact.
99,30819,2023-09-17,Good!,Great alternative to black tea! Mix it with other herbal teas!
100,30819,2023-09-01,Enjoyable ! ,"Great product, fresh, and enjoyable. We relax anytime with this tea, day or night."
101,30819,2023-08-20,,Impressive product! Exceeded expectations with its quality and performance. Highly recommend for anyone in need! 
102,30819,2023-08-04,Helps to relax and sleep,Trying this as an alternative to prescription medication. It does help when taking it consistently over a few nights.
103,30819,2023-07-26,Good quality,Good quality tea as it is in fresh bag and there is no dirt/dust 
104,30819,2023-06-14,,"So good soft taste Tea and calming. I like it, just straight or whit almond milk"
105,30819,2023-06-08,,"this tea is one of the bast i  taste, love it"
106,30819,2023-06-02,,The quality is great and the bag is so big! It will last me months. 
107,30819,2023-04-23,,"Seems high quality, love adding it to my infusions, very relaxing and great for stress and anxiety."
108,30819,2023-04-02,,Good product quick delivery satisfied great packing amazing customer service
109,30819,2023-03-17,,"Excellent quality, this is one of the ingredients in my night time blend tea for an amazing sleep"
110,30819,2023-03-10,,I love it I mix it with mint and rooibos tea 
111,30819,2022-11-18,,"Very relaxing tea and help sleep, but it depends on how much anxious you’re. Very good amount. Taste good."
112,30819,2024-05-18,,"there are no flowers there, just cut leaves and stocks. There were some cut insects inside too. It is not as strong as capsules. "
113,30819,2022-06-11,It works for me., The product inside the package look just like what is pictured in the description. Tastes like it should and is part of a calming tea which works. I’m happy with the purchase. Thx 
114,30819,2022-05-28,,It came very quickly first and it was very important to get sooner because I need to make tea with this.  The quality is good and it would last for long time for me. 
115,30819,2022-05-23,,it is working! i brew some before sleep and it is helping me having a quality sleep. It s a huge amount by the way . The taste is quite pleasant and herby.
116,30819,2022-04-22,,"it help relieve and fight infection. i usually drink ginger water and apply water melon powder for my ulcers, My ulcers and sore throat got better faster thn only apply the water melon powder. Highly recommended this product.  "
117,30819,2022-03-16," Vivid, sexy dreams!",The product inside the package look just like what is pictured in the description. Tastes like it should and is part of a calming tea which works. I’m happy with the purchase. Thx
118,30819,2022-03-06,Good for stress,"This is one of my favorite herbs to benefit stress relief. The product comes in a large package and I use it as a tea in the morning and evening. The taste is not bad, but not pleasant. I can feel the effects shortly after drinking!"
119,30819,2021-12-09,,"Wonderful value, great quality. Really helps my whole family unwind each evening. I save so much money not buying tea bags, considering how much herbal and regular hot tea we drink throughout the fall and winter."
120,30819,2023-08-25,,I brew this flower with valerian and camomile to make my own sleepy time tea. yummy. 
121,30819,2023-06-27,Good Quality,"Frontier is a good Quality, I will always get these flowers."
122,30819,2023-06-20,,Smells and taste fresh. Enjoy drinking this tea every night.
123,30819,2023-06-12,,"Healthy tea  blend that makes falling asleep easier. I use it frequently, and it tastes quite nice. "
124,30819,2023-04-12,,Wanted this herb to sell in spell kits...  Haven't had any reports of it not working exactly as it was meant to....
125,30819,2021-04-07,,"Excellent as a tea, but i find the recommended dose is so low, i usually strain 4g of the dried herb in 250ml boiling water and leave it for 15 mins, take it 60 minutes before bed for improving my sleep. it really works but need several days to notice the effect "
126,30819,2020-04-11,Bulk passionflower herb rocks!,"I find passionflower tea helps immensely with sleep, and teabags with pure passionflower are hard to find, and often sold out. So I took a chance on bulk passion flower herb by Frontier and it is great! Fresh flavor, easy to use - just get a loose tea infuser that holds a teaspoon, and it is same amount as in 1 teabag.  Plus, the bag is HUGE, and price unbelievably low for the amount. Expiration date is so far ahead, I will be able to use this tea for many months without restocking.   I can't praise it  enough! Thanks, Frontier and iherb!"
127,30819,2019-01-12,Excellent quality dried herb,"I use this for my relaxing tea mix. I grow my own lemon balm and chamomile in the summer and add passionflower as I can’t buy the seeds to grow it here in New Zealand, plus the weather doesn’t support it. I’ve been using this herb for a couple of years now and very happy with it. "
128,30819,2021-01-24,"Has a grassy, natural taste. Helps a bit for sleep.","I thought it was fine, it did help a bit for relaxation and sleep but to be honest I have a couple boxed teas (the sleepy bear and another with oat straw, passionflower and hops) that help just as much.  It might just be the ritual of drinking warm tea in the evening that makes me sleepy.  
I do like that loose tea has less packaging and I think it is nice quality."
129,30819,2020-02-21,Product and price...,"Searched everywhere, I'm kinda a geek like that. Best bang for your buck right here. Been buying from iHerb before Amazon was around. I heard from the guy who wrote the book on natural healing, Dr Michael Murray, says a strong cup of this before bed will help sleep."
130,30819,2022-03-08,Absolutely great,I bought a pound. Do you know a pound will probably fill a gallon jar. Thad a lot of Passion flower.
131,30819,2022-02-10,Great Product,good company. 5 stars for the flavour and the price. value for money
132,30819,2011-08-15,Best for quality,"I used to buy Passion Flower tea bags and decided to give the bulk tea a try. What a difference! It's much fresher and knowing the quality that goes into growing and harvesting from the Frontier website, I feel good about brewing a cup of tea! "
133,30819,2022-10-16,Great herb,This is a wonderful herb for sleep and I’ve mixed it with many other herbs for a sleepy tea
134,30819,2022-09-14,,"GOOD PRODUCT, GOOD FOR MY HIGH BLOOD PRESSURE.   
I HAVE BEEN VERY PLEASED WITH iHERBS  PRODUCTS AND DELIVERY TIMES."
135,30819,2022-09-09,,Great product.. Highly recommend this passion flower tea.. Dependable company.
136,30819,2022-08-21,,Product was readily available & shipped in a short time & the quantity was perfect 
137,30819,2022-06-26,,"I take this tea to make me calm after a busy day, as well to relax "
138,30819,2022-06-01,,"great quality, love this brand. I wish the packaging had a zipper tho. Love making a tea with this"
139,30819,2022-03-27,,"The quality is good, very useful, and the pack is big enough.
So far the taste is also good."
140,30819,2022-03-04,,Great herb and so fresh; Makes a great tea. Thanks for the great price iherb:-)
141,30819,2022-01-29,Good addition to nightly sleep tea,"Good quality, relaxing tea. Accidentally bought the powder last time but prefer this type."
142,30819,2022-01-19,,passion flower tea make me relax.. i've been waiting this herb passion flower 😍
