,product_id,date_posted,review_title,review_text
268,30819,2022-08-19,For a good night's sleep. Very economical.,"I've had trouble falling asleep, had many nightmares, and clenched my teeth while falling asleep, causing my teeth to chip. Until now, I was drinking tea bag type sleep tea from other companies, but I got tired of the taste, so in my case, I drink it every day, so I bought this one because it is economical and has a large capacity. About 60 to 70% of this passiflora is mixed with lavender, chamomile, mint, etc. according to the mood. I take 1 to 1.5 teaspoons in a teacup 30 minutes before going to bed. When you want to make the taste stronger, you can adjust it without hesitation because there are many. I've been drinking it almost every day for more than two months, and it's just as easy to fall asleep as the sleep tea I've been drinking so far, and I'm sleeping better than when I don't drink it. I also grind my teeth less. Passionflower itself has a unique scent. I personally feel that it has a fragrant grassy scent that makes me feel nostalgic. You may love it or hate it. I personally liked the scent and taste. The quantity is quite large. If you don't use it right away, put it in a large aluminum zip with a small desiccant and store it. It is necessary to secure a storage place, but it is very economical and recommended."
269,30819,2022-04-08,I bought it for the benefit,"I bought it because it helped him relax and help him sleep.. Sweet and clean once and its quantity is very bitter, but unfortunately its taste I did not like a lot.. Mix it with chamomile and lavender"
270,30819,2022-03-12,Good,"I experienced insomnia from an early age and couldn't sleep in earnest in my twenties, and I was cured over a long period of time without medicine, but even now I can't sleep with a little stress. So I have a lot of them, but I've always tried various herbal teas as my favorite. The taste is neither good nor bad personally. It has a unique aftertaste, like bean-based or wheat-based tea rather than herbs. Personally, I'm tired of this alone, so if I add it to other blended herbal teas, I can drink it every day. I bought it for the purpose of relaxing, so it's a perfect score in that respect! I drink it every day, so I'm glad that it has a large capacity."
271,30819,2017-05-04,"Passionflower or passionflower - helps to fall asleep, regulates pressure and pulse, soothes","I started taking it as a tincture, then I ordered it in the form of grass. I drink tea an hour before sleep, then cuts down. Problems with sleep (woke up at night and could not fall asleep) were gone. I add chamomile, valerian, mint on mood. I highly recommend those who struggle with insomnia. Now I have a clear sleep regime, in the evening you want, you do not want to go to bed at the same time, I wake up too. Passionflower helped me."
272,30819,2016-11-04,"Anxiety, panic disorder very effective","Passion flower calms the central nervous system of the brain and suppresses wasteful consumption of serotonin, so it is very effective for anxiety, panic disorder, depression and epilepsy. If you drink before going to sleep, you will not get sleeping pills and you will only be able to take a deep sleep naturally and it is handy. Actually, since I started drinking passion flower, my depression has almost disappeared, and my anticipatory anxiety is suppressed by about 60%. I am thankful that it is expensive in Japan."
273,30819,2023-10-16,Excellent,"Great product, very good, really gives results in a short time"
274,30819,2023-10-03,great,"After drinking it at night, you can sleep until morning, which is very good."
275,30819,2023-08-20,Excellent!,Excellent product! Fully complies with the described criteria and qualities indicated on the label!
276,30819,2023-07-06,Excellent!,"Its size is larger than expected, but it is sufficient, effective, and has a reasonable price. It is used as a tea"
277,30819,2023-07-01,,"An important plant, excellent quality, a good ingredient for health, excellent taste, use according to knowledge only"
278,30819,2023-06-26,under trial,"Easy to use, does not contain caffeine, the size and quantity are great, the quality is great"
279,30819,2023-04-10,Excellent ! Calm the nervous system,Indispensable with lemon balm and chamomile to calm the nervous system The products of this company are excellent
280,30819,2023-03-12,,"It has a medicinal taste, but it tastes very sweet. But after eating, I obviously feel heart pain, which is not suitable for me."
281,30819,2023-02-19,,"Promote sleep, improve mood, and make tea with a good fragrance"
282,30819,2023-01-13,,This is a very useful thing for sleep and emotional soothing
283,30819,2022-06-16,,"This product has good quality and ingredients, and I eat it regularly. The delivery is fast and the size is just right. The packaging is also meticulous. I plan to purchase it again."
284,30819,2022-02-23,,It tastes delicious and helps to relax and sleep deeply. I drink it about an hour before I sleep and thank God my sleep becomes deep and continuous.
285,30819,2021-12-27,,The tutu is large. But I did not notice the sleeping pill effect. The taste is specific with a slight sourness. Didn't make me want to drink ... except to try it with honey ...
286,30819,2023-04-14,,"It feels like it has a unique peculiarity, but once you get used to it, it tastes like green tea."
287,30819,2021-03-03,Wonderful herb!,"I bought passionflower. The packaging is neat, the grass is fresh. Since it is very light, quite a lot of herb is included in the package. We use passionflower as part of evening tea gatherings (we do it ourselves). This herb calms, relaxes, relieves stress, and promotes good sleep. I would not advise drinking it in the daytime, when increased concentration is required. In addition to teas, you can make infusions and infusions with passionflower. It is not advised to use passionflower for atherosclerosis of the vessels of the heart muscle and brain, myocardial infarction, angina pectoris. We personally really like this healthy herb!"
288,30819,2018-04-18,Amount of surprise,"Amazing, a lot of it was in! Purchased for things that are good for insomnia. At first we can not open smell, we have a strong habit of drinking ... so how many do I do? I was thinking but I got used to it from second to third times and now I am drinking every night. On the contrary, I could not sleep well unless I drank w. After that I drank this slightly higher blood pressure of about 150 - 98 became normal value of 100 - 60. I will repeat it again if it runs out."
289,30819,2020-10-16,My sister is not so much,"When I hear that I can get a good night's sleep, I take a blend of lavender and chamomile before going to bed. When I had my sister who had trouble falling asleep drink it, she said she was lazy the next day. I usually drink only chamomile and lavender, so when the days went by, I asked them to drink it again. The next day, my body was still sluggish. Some people may be too strong, so make your own judgment. I'm kind of sound, so 4 stars ☆"
290,30819,2023-06-09,,Purchased for good sleep Pretty good
291,30819,2023-04-07,,"Good stuff, first-class quality, special price"
292,30819,2020-12-10,Excellent passionflower,"The quality is excellent, there are no rigid sticks. And the price is cheaper than in Israel. I make tea, put it in bags, bought right there and I'm very happy. Doesn't tear paper bags, I do"
293,30819,2017-06-07,Large package,"On volume it is a lot of - the three-liter bank has turned out, will suffice for a long time :) Later I shall add a response when I will distribute as a drink."
294,30819,2022-10-03,,Passionflower tea is relaxing. Reduces blood pressure and induces good sleep. Excellent quality of passion fruit
295,30819,2022-07-22,,"The quality is excellent, the ingredients are natural, the taste is acceptable"
296,30819,2022-04-02,,"Calm down the mood, easier to fall asleep, very good."
297,30819,2022-07-02,,I bought it as a blend of tea to drink before going to bed at night.
298,30819,2022-05-06,,"A good quantity. I ordered it for my friend, in addition to the mixes"
299,30819,2021-03-06,,"in the form of an extract works well, adding to herbal tea is not tasty. so only as a decoction for therapeutic purposes. not in the form of prevention."
300,30819,2020-12-10,Has completed.,It has a sedative effect. There were no side effects and the taste was fine. It has a very large capacity.
301,30819,2020-09-02,curry,"I couldn't add it as a curry scented tea. After leaving it for a while, the scent disappeared. Now, when I feel uneasy, I swallow it as it is. It works well for anxiety. Recommended because it seems to be lower than the hippopotamus. I'm a little sleepy."
302,30819,2020-05-07,Nice,"Once a beautiful time helps the drug numb its normal taste, drink the same tea without sugar"
303,30819,2020-12-31,Ok,"I don't feel the sleep-onset effect as I expected. It has a mixture of thin kuki parts, and you can't drink it unless you strain it with a tea strainer. The taste is delicious."
304,30819,2021-08-20,,"I drink passionflower to calm my nerves. Sleep became much better, background anxiety decreased. The drink tastes good."
305,30819,2021-01-30,Good,Passionflower perfectly soothes. I brew it with lemon balm and chamomile.
306,30819,2021-01-22,,"Very clean, fresh grass, excellent quality. I add to tea with other herbs, I really like it. Soothes well."
307,30819,2021-01-16,,"It came in good quality, pure passion flower without garbage, good grinding, brew and let it brew. Use to relieve anxiety and tension"
308,30819,2020-08-31,I relieved it,I felt that it relaxes me and helps to relax
309,30819,2016-06-23,It is a repeat,"Because it is a drinker every day, it is good that Cospa is nice. I purchase it for my insomnia 's mother."
310,30819,2022-04-10,,great tea
311,30819,2022-03-29,Excellent!,What have you tried?
312,30819,2021-07-20,,"Even if I want to continue drinking, I am sorry that it is out of stock for a long time."
313,30819,2021-01-06,From him I have cramped,"I don't understand why this happens, the doctor says that there should be no passion flower. I tried it twice, and twice experienced this nightmare, plus my blood pressure increased well to 170, although usually 130-140. I decided not to use it anymore."
314,30819,2020-09-14,,"Useful, bitter and tastes good"
315,30819,2019-07-17,Excellent,I am very satisfied very much promotes sleep.
316,30819,2022-04-06,,useful for self
317,30819,2020-04-10,I have not found a result yet,But the general weed needs patience to give the result of continuing it
318,30819,2021-01-24,Soothes,"I brew it before dreams, like a soothing tea."
319,30819,2020-08-16,I tried it,It is destined to judge her
320,30819,2020-01-26,SUSTAINABLE SEDED EFFECT,"SOFT RESISTANT SEDATIVE EFFECT. IN ANXIETY, Insomnia VERY HELP."
321,30819,2018-03-24,This product has excellent characteristics,This product has excellent characteristics
322,30819,2019-04-19,M reported,I heard that he was relieving tension and sleep better. I used him for two months but noticed no change
323,30819,2018-03-29,Delicious,Delicious
324,30819,2021-01-23,Excellent!,Delicious tea
325,30819,2021-01-16,Excellent!,Herbs
326,30819,2020-12-22,,very nice
327,30819,2021-02-02,relaxation,I think the least effect is chamomile
