,product_id,date_posted,review_title,review_text
143,30819,2017-10-29,Passion Flower Tea,"Could only drink it with lemon juice as it’s not that great flavour wise. Tried it a couple of times, not sure it it worked as I couldn’t take it for long enough to find out. This was because I had to get up around 4-5 times in the night as it made me want to pee all the time. I take it it’s a diuretic.

"
144,30819,2021-06-15,"Excellent! Great tea for relaxation, before bed time, etc.",I take a cup of this after dinner with my teenager and we both find that it relaxes us and lets us get to sleep more easily.
145,30819,2021-03-17,,"Helps me sleep, with no downsides. Tastes a bit like grass but brewed with some other strong tasting herb like mint it is quite palatable. I can't tell you how this compares to other brands as this is the only brand I have tried. "
146,30819,2021-03-07,,Love the loose herb to make tea with I use 2tea and it helps me sleep like a baby. If you have insomnia or sleeping problems this will solve it
147,30819,2021-02-12,,A nice quality product at a great price. Used in small batch tinctures and salves that came out beautifully. Will be purchasing again for certain.
148,30819,2020-12-07,"great herb, smoking blend","i make a sleeping dream herb with passion flower as a smoking blend, or mix with other dried flowers to make tea.
taste herby rather than flowery. good stuff for sleep"
149,30819,2014-03-13,very calming,Tea arrived very quickly and I was amazed by the freshness. The prize value is great. I use tea for the calming effect in the evening. One cup is enough to have a good night sleep. 
150,30819,2022-09-15,,"Drinking it before bedtime, helps to relax. Good quality herb."
151,30819,2022-09-15,,was looking for the tea without caffeine. big pack with good price to last 
152,30819,2022-07-10,,It helps calm me down ~! Has a herby and grounding flavour! 100% recommend!
153,30819,2017-06-21,Not as good as I remember,"I bought this same packet about 3 or 4 years ago and used it for both smoking and tea - and had better results and tastes than this batch. Maybe it's my new strainer, maybe I'm just brewing it wrong, but it's definitely not as great as I recall. The taste was quite dirty, even adding cinnamon sugar and/or milk to the tea. That said, I do still believe this tea helps with anxiety and sleep issues. Not amazingly mind, but a nice little boost if nothing else. Just be aware it is very, very raw, and might come with a dirty taste if brewed wrong."
154,30819,2023-04-12,Tastes Like Hay,What a bummer! It looks and tastes like hay and now my throat hurts from one sip. Do not buy this product. 
155,30819,2023-02-17,,"To much of plant, other than the flower!!!!!!!!!!!!!!!!!!!!!!!!!! 
No other details are necessary "
156,30819,2022-09-19,,"Not what I expected. I wanted to enjoy my new tea, but the smell and taste were awful. I think the grass would taste better. I don't notice any calming effect. "
157,30819,2019-10-24,Good tea,I am using it together with camomile and linden flowers
158,30819,2018-07-19,love this tea,i love this tea. it's very calming and has a soft and subtle flavour
159,30819,2012-06-07,excellent quality!,Thank you for providing high quality herbs- the passion flower has a good vibration. One of the best facilitators for dream herbs!
160,30819,2022-08-29,,I lovet fresh work perfect storage i love it 
161,30819,2022-06-16,很好！,Good good good taste and quality
162,30819,2022-04-13,,Good product and packaging- happy with the company 
163,30819,2022-03-13,good ,"fresh quality , packaged in bag "
164,30819,2021-09-28,!luxurious,"Large package size, very nice taste. Health benefits of a high quality herbal mixture."
165,30819,2021-04-08,Life Saver,"Absolutely love this product...It’s in bulk, and it really helps with my anxiety, sleep, and manic episodes. "
166,30819,2021-03-02,,good stuff I think it's working for relaxation but have to try it a few more times
167,30819,2021-03-01,,"Whilst not organic this is a high grade, reliable ingredient for tissanes and for smoking. It delivers!"
168,30819,2020-12-27,For relaxing,"Great product to help relax, also gives alot of virility!"
169,30819,2020-12-14,,"Nice relaxing tea, great as a natural way to reduce depression too!"
170,30819,2020-12-13,,Love this tea .... drink a cup before bed and helps me sleep through the night Big bag for the reasonable price paid
171,30819,2020-12-10,Sleep helper,This is a good tea before bed. This brand is great quality.
172,30819,2020-04-06,Passion flower great for a good sleep,"Initially taste is a bit grassy, but will get use after few times"
173,30819,2019-10-21,Perfection,"Fabulous quality and amount for an amazing price, will be re-purchasing! "
174,30819,2019-08-10,smells nice and tastes good and you get a large quantity,smells nice and tastes good and you get a large quantity
175,30819,2011-05-01,Mild seditive,"Good mild seditive, helped me get to sleep when I needed only a slight push"
176,30819,2020-12-11,,I live too far north to grow passion flowers so this is a nice alternative. 
177,30819,2013-05-28,Was hoping to be relaxed,"I have read reviews that this tea is suppose to work as well as an anxiety medication to help one relax, but I can't say I have felt that. 
Also, less is more with this product. I recommend using sugar to cut down on the taste."
178,30819,2022-04-15,,Great quality no fillers
179,30819,2022-01-16,,Great price great product 
180,30819,2011-07-18,not sure,it is my first passion flower herb and it doesn`t seem to have much flavor or taste.
181,30819,2022-03-20,אישור,too much fine powder ' gets through the 
182,30819,2021-03-08,,perfect for my herbal teas
183,30819,2021-01-15,,"My wife loves it, so it's a must:)"
184,30819,2020-12-04,,Helps dealing with anxiety. I recommend combining with valeriana.
185,30819,2021-06-07,,great value
186,30819,2021-05-03,,Good quality.
187,30819,2021-04-14,,Reasonably priced
188,30819,2021-03-19,,Great quality and freshness! 
189,30819,2021-03-15,,wow healthy and calming 
190,30819,2021-02-11,,Make tea with camomile give calming effect. 
191,30819,2019-02-19,Well Boxed Up,Fast and efficient thank you 
192,30819,2021-03-30,,Bought third times.
193,30819,2011-12-07,Doesn't work for me,Simply doesn't seem to help me sleep better.
194,30819,2024-01-21,It tastes like plants.,"The scent isn't particularly distinctive either. I blend 2 tablespoons of mint tea, 1 tablespoon of orange peel, and 1 tablespoon of passion flower in 600ml of hot water and drink it. It seems to be good for insomnia, but I haven't really noticed much of an effect. I'm looking forward to what's to come."
195,30819,2024-06-24,I recommend it to everyone as a top tool ,"The quality is one of the best on the market, easy to use, I recommend it to everyone, the size is convenient for both use and storage anywhere at home, the packaging is reliable and one of the best, the advantage for me is a good ratio of price to product quality "
196,30819,2024-05-23,Excellent,"Passion flower leaf is a commonly used raw material for herbal tea. This product has a single ingredient, is of good quality, and has sufficient portion. The packaging is reusable. It can be used as scented tea. It has a mild taste. It can be mixed with other scented teas to make different formulas. It does not contain caffeine. You can drink it as needed, as long as it is combined with a proper diet, it will be of great help to the body!"
197,30819,2024-05-08,Awesome with chamomile tea in the evening ,"It does not contain caffeine or any stimulant substances, and I noticed the benefit in the ease of relaxation and restful sleep after drinking a cup in the evening, with the necessity of surrendering to relaxation. Do not resist drowsiness after drinking it, surrender to sleep in the evening. In fact, I became addicted to it instead of evening coffee. 
"
198,30819,2024-02-16,,"A blend of six herbs: German chamomile, passionflower, lemon balm, valerian, peppermint, linden flower and leaf. One cup every night, a new bedtime routine! Stress, irregular lifestyles and age-related anxiety keep our bodies and minds on edge. So we need to not only sleep more, but also rest well, relax our bodies and minds, and release tension. The power of herbs is amazing. A blend of 6 herbs, including valerian for tranquility, chamomile for relaxation, and passionflower for relaxation. Drink it as a good night drink, you will be well rested and wake up in the morning to the power of nature. Thanks to iherb for providing high-quality herbs at a reasonable price!
"
199,30819,2023-12-03,,"Great product!!! I'm really satisfied :) Simply excellent that works wonders in the body Benefits: Stimulating, cleansing, nourishing, strong and good antioxidant! Take in the morning and have a great day :) Good size, excellent quality, convenient packaging, relaxing, good ingredients, high quality, without unnecessary additives, completely natural and relatively cheap, which is important. Waking up in the morning! Excellent, not high quality, I love it!! I highly recommend him. He is really good, a good quality company. And the price is really worth it. Super successful purchase. Please like my comment if I helped you, thanks! ♥️♥️"
200,30819,2024-04-26,Very good,"Great quality, reasonable flavor, I didn't feel caffeine, easy to use, super pleasant, large quantity, quick effect, helped me sleep, greater than I imagined, I will recommend it to more people, very natural, "
201,30819,2024-09-06,,"Frontier Co-op's Passion Flower Powder is a quality product for making calming teas and infusions. The 16-ounce (453 g) container provides long-lasting use, and the product is ideal for those looking for a natural way to relax and reduce stress. Passion flower helps to relax the nervous system and improve sleep. The only downside is that the powder form may require a little more effort to prepare than capsules or liquid extracts."
202,30819,2024-02-16,Expect unique scent and active ingredients♪,"It has a slightly unique aroma, but it won't bother you as long as you don't boil it too much. This can be said about herbs in general, but it seems best to be patient with a slightly smaller amount. If you blend it with other herbs, the scent won't be noticeable, so if you blend it with fragrant rooibos, you can drink it."
203,30819,2024-01-10,Calming taste,"I drink it as a tea. Unlike the familiar taste of Japanese tea, it has a rush-like taste that permeates through your body. In everyone's reviews, there were many people who loved drinking it as a pre-bedtime tea, so I was expecting it to make me sleepy, but I didn't really feel that way. So, I use it as a daily tea."
204,30819,2023-12-19,I feel calm,"As mentioned in other people's reviews, I feel sleepy while drinking this tea. That's not the case with me. I just feel like my brain is calming down. I can fall asleep easily, but I also take melatonin. I don't think it will work on waking up in the middle of the day. The tea smells like grass. The taste is grassy with a slight sweetness. I think there are some people who are not good at it. I'm pretty good at pretty much anything. It's a large quantity so it lasts quite a while. I'll add more if I find other uses. As you pour tea leaves and hot water into a cup and do some errands, the ingredients will come out, so if you're not careful, it will get thicker. Sometimes my brain gets so excited that I can't sleep, so I'll report back if I can drink this tea and sleep."
205,30819,2024-09-24,,"I drink it to improve sleep. The taste is so-so. I brew it in a thermos. A very useful herb, also known as passion fruit. I recommend it. It is effective only with continuous use over a long period of time."
206,30819,2024-08-27,Frontier that you can trust and eat~,"Although it is a bit much, I am grateful to be able to drink organic tea. I drink passion flower for sleep and hormonal cycle. "
207,30819,2024-05-22,Large capacity and great value,It's a natural tranquilizer. The scent is fresh and the cut size makes it easy to put in a pot. Drinking it when you're feeling anxious or uneasy can help you relax.
208,30819,2024-05-16,,"I recommend it, and its taste is somewhat similar to yerba mate, which is a popular drink in Argentina. It is considered a popular drink. I think I will repeat it."
209,30819,2024-05-14,sweet,It is still being tested and I don't feel the taste of it. The size is large and it stays for a very long time
210,30819,2024-05-07,Excellent,The herb needs no introduction. I found every herbal tea I bought containing this herb. I said I would buy it alone and mix with it my herbs that I love in general. I love herbs and I like to try all types. 
211,30819,2024-03-28,,This herb is useful for relaxation and reduces the level of cortisone in the blood. It treats mood swings. It is used in the form of tea in water. The size is very suitable. It is free of caffeine. 
212,30819,2024-03-02,,"Top, good quality ingredients with good taste Use for tea blends. Good size and packaging. One serving per daily frequency increases the benefits. I don't know if there is caffeine "
213,30819,2024-02-22,good herb for sleep and mood,"It’s a very good herb for sleep. It’s clean, dry and fragrant. I drink it at night. It makes me sleep very well. During the day, it lifts my mood and relieves anxiety."
214,30819,2024-02-05,Surprised by the large capacity,Fresh herbs arrive in large bags. The cost performance is quite good. I blend it with chamomile and drink it before bed. It's easy to drink and helps me sleep better. I would like to continue consuming it by mixing it with various herbs.
215,30819,2023-11-07,Recommendation by Reem Al-Anazi,"The quality is good, the ingredients are clean, the taste is somewhat acceptable. Use before bed for deep sleep and without insomnia. The size is large. The box is a tea bag without caffeine"
216,30819,2023-11-05,Perfect for night blending,"I definitely felt a relaxing effect. It didn't have a strong taste, so it was delicious to drink. I made a lot of tea bags with mint, elderberry, stevia, and passion fruit leaf. I am satisfied with both the natural look and size."
217,30819,2024-02-23,,"I had insomnia and wanted to sleep without using medicine as much as possible, so I researched herbs and purchased this. The effect is gradual and makes you feel sleepy? That's what it feels like. Although they are not as clearly effective as prescription drugs, they are safer to take. I think it's like a natural stabilizer. I drink it at night before going to bed if possible. Once I had a few drinks during the day, I felt groggy during the day, so I think it has a sedative effect. I think it's due to my constitution, but once I get used to it, I develop a tolerance to it, so I try to drink it at regular intervals."
218,30819,2024-09-07,Good,"Use as a tea with valerian roots. The taste is not good, but the benefit is good, so I will continue drinking it. The size is large. The serving is a tablespoon with a tablespoon of valerian roots."
219,30819,2023-02-23,,"I drank it as soon as it arrived today! The taste was not peculiar and it was very easy to drink (* ^^ *) It has a large capacity and is the best value for money ☆ I thought about buying a blended product for menstruation and headaches, but it was expensive and I refused. However, I decided to make a favorite blend by making a note of the herbs that I wanted for myself on YouTube. The flavor is not too strong, so you can enjoy various combinations♪ Repeat decision."
220,30819,2023-01-11,,"Its quantity is worth its price for safety 👏🏻 Its taste is not bitter, it means a little strange, but acceptable, it is useful for anxiety, but do not make my mistake and take a large dose. Start with the text of a small spoon with a cup of boiling water and cover it to rest for 5-10 minutes and drink it 🥹 because it gets dizzy again, take it gradually and see that it answers sleep and drowsiness And it really reduces the symptoms of stress, but take it in the right way 💗💗 And do not take it at the beginning of your day because you will be sleepy, and do not take it while driving or when you want to study ⭕️"
221,30819,2023-09-09,"I thought it was a lie, but I started getting sleepy while drinking it.","Put passionflower herb and peppermint tea in a tea pack, pour boiling water and wait for 7 minutes. It has a nice color to it, so drink it little by little even though it's still hot. 20 minutes until it becomes human skin. If you drink a few sips, you will feel sleepy by the time you finish drinking. I thought it was a lie when the review said it made me sleepy, but I tried it a few times and still had the same problem. It has a grassy scent, so I drink it with peppermint that I bought at iherb. >I have already mentioned the scent. What about the ingredients? You won't know unless you do a component analysis at a specialized institution, so please do it at iHerb."
222,30819,2023-11-26,,Quality product made from natural ingredients. Suitable for any age. Daily use. High efficiency.
223,30819,2023-05-19,,"O Allah, grant me the happiness of the two homes in this world and the Hereafter. My Lord, forgive me and grant me a kingdom that no one should have after me. The companions and female companions sit, and I will be next to you, O God"
224,30819,2023-10-07,Prominent,"I took it for insomnia. It is excellent for relief, but I drink it. I sit for half an hour and sleep. How to use: Take a small spoonful in a cup of boiling water, leave it for ten minutes and drink it after filtering it. The size is large, the quantity is good, and the taste is unpalatable, but with time you get used to it."
225,30819,2023-08-21,,"The tea smells like grass and tastes like grass, but if you blend it with other herbs such as mint or rosemary, you won't mind. I bought it because I wanted good quality sleep as an effect of the ingredients. If you drink one cup before going to bed, you will be surprised at the effect from the first day!"
226,30819,2023-08-18,,"excellent . I asked her to make tea from her while applying the detox. A wonderful mixture without caffeine. I repeat the purchase. It gives calmness. The quality is excellent. Ingredients: Passionflower herb.. The taste. Usage: I use it as a tea twice a day, once in the afternoon and once before bed.. Size: suitable and comfortable. Box: airtight bag .. Benefit: It gives relaxation and calmness to the nerves and helps to sleep with the days. I loved it .. I hope you like it. Thank you"
227,30819,2022-10-24,,"Nice quality The ingredients are pure The taste is acceptable to use Passion flower tea I like to drink hot drinks before bed and I prefer to replace caffeine with these calm drinks and their size is large, about half a kilo, without caffeine. I recommend herbal drinks and relief from tea and coffee ❤️ 🔥❤️ 🔥 Relieves insomnia and helps a deep sleep"
228,30819,2024-10-13,"Healthy, big packaging size, delicious taste, delicious tea","Healthy, big packaging size, delicious taste, delicious tea, good quality"
229,30819,2024-09-13,,"The leaves are very clean. I bought them to help me sleep, and they are quite effective."
230,30819,2024-08-23,Mumtaz,"The quality is excellent, the taste is acceptable, it is used for sleeping and relaxing muscles, and the quantity is excellent."
231,30819,2024-07-31,Prominent,"This company's products are excellent and organic. The herbs are taken for the benefits mentioned, and the quantity is excellent and large "
232,30819,2024-06-26,Excellent for sleeping,"Good evening, the herb is excellent for deep sleep and is very distinctive. Thank you "
233,30819,2024-06-22,Cheap,This is the weight and price after drying. It's a great deal.
234,30819,2024-06-04,Excellent ,quality and ingredient and taste too good and use and professional size and professional packaging and benefit like the mixture and like caffeine
235,30819,2024-05-31,Relax herbs,"The quality is good, the ingredients are clean, the taste is acceptable for daily use, the size is of high benefit "
236,30819,2024-05-12,,"I took it on a doctor’s prescription to drink it before bed, which helps people with insomnia"
237,30819,2024-05-01,,"One of the best products I have purchased, very good quality and use was very good

"
238,30819,2024-02-22,The quality is very good hahaha,The quality is very good hahaha the quality is very good hahaha
239,30819,2024-02-01,Great ,"High-quality tea, good for the intestines. The taste is good, the effect is visible. Suitable for any age "
240,30819,2023-04-22,,"I get so sleepy that I can't sit still. Drinking it every day will get you used to it, so once in a while is recommended."
241,30819,2023-04-07,I'm falling asleep,"I bought it for sleep. A relaxing herbal tea is a good way to end the evening. I gifted it to an acquaintance who has insomnia, and he was interested in saying that it worked. There is definitely a feeling of relaxation. The quantity is very large, so it is good to give as a gift."
242,30819,2024-08-14,I bought it for emergency purposes,I bought it as a first aid kit and I'm trying to figure out how to use it.
243,30819,2024-03-03,Good,"High price, very high quality, organic and from the best companies"
244,30819,2023-12-19,Effective for sleep,"An effective herb for anyone who suffers from insomnia and sleep difficulties, but it would be better if it was organic"
245,30819,2023-11-09,Good,"The quality is excellent, the ingredients and taste are in use, the size is large, the box is good, and it is in use"
246,30819,2024-07-18,It's worth buying.,"It's worth buying, much cheaper than Taobao"
247,30819,2023-10-16,for a good night's sleep,"I am taking melatonin to further improve the quality of my sleep! Passion flower I think lotus is very effective for restful sleep. Of course, the effects will vary depending on your constitution. But it is recommended! Large capacity and much more affordable than buying in Japan."
248,30819,2023-10-05,Prominent,"The quality of the ingredients is great, the size of the box is large and appropriate, the tea is caffeine-free, the taste is good,"
249,30819,2023-09-26,,Quality Ingredients Quantity Dietary Supplement Very Good Excellent Size Good Size Good Age Suitable Benefit Package Composition Use Tea Mix Taste Good Serving Frequency Same
250,30819,2023-09-19,,"The quality is good, the ingredients are good, the taste is not unpleasant, it really helps with the stability of sleep, and I will continue to repurchase."
251,30819,2023-08-23,,"The taste is fragrant, the smell is strong, the quality is reasonable, the ingredients are simple, the packaging is simple, and it has been used for two days👍"
252,30819,2023-08-02,drink as a sedative,"I drink in the evening, it does not excite the mind, you smoothly go to sleep. A little strange aftertaste, I add lemon, I hope this does not neutralize the main effect."
253,30819,2023-07-21,,"It is good because it has a large capacity, and it is said that it is good for a good night's sleep, so I drink it steadily as a tea."
254,30819,2023-06-26,,"I like to make natural herbal tea by myself. I have bought several products from this manufacturer, and I think the quality is good so far. Drinking this passionflower tea before going to bed has the effect of stabilizing mood and helping sleep."
255,30819,2023-06-20,,"I have insomnia, so I bought it because I thought it would help even a little. It is good that the taste and aroma are not harsh and easy to drink. I've only used it a few times so far, but I can sleep well."
256,30819,2023-06-10,,"The herb has been tried once, and it is also being circulated that it has a great benefit that modifies the mood. Use put two spoons in a cup and put hot water over it. The taste is okay. You can drink it normally."
257,30819,2023-04-25,Excellent!,"Excellent really! I took it when my mother died, it helped me sleep and be calmer less anxious. It works as well as an anxiolytic, and without a prescription. The taste is not bad, not bitter, rather neutral and herbaceous. I recommend, it works directly!"
258,30819,2023-02-02,,"I bought it because I wanted to blend it myself. It seems to have a sleeping effect, so I wonder if I should drink it with my husband."
259,30819,2023-04-14,,"The quality is good, the ingredients are good, the size is good, the use is good, the benefit is good."
260,30819,2023-04-06,,"The quality is good and the ingredients as well as the taste did not reach me after use. Dr. Reem Al-Enezi prescribed it to me for insomnia, and the experiment is underway"
261,30819,2023-09-25,amazing,High quality and natural ingredients. It makes a healthy drink with a pleasant taste. Thank you very much and stay well.
262,30819,2023-09-23,,Quality goods. Suitable for any age. Convenient use according to instructions.
263,30819,2023-09-21,Purchased for relaxation,I bought this hoping for a relaxing effect. I don't feel the effect to be strong. I will continue to use it. The taste is ok.
264,30819,2023-08-28,No luck,"It is written about the benefits of passion flower that it helps to fall asleep and relieves stress, but I never noticed this thing even though I used it for about a month"
265,30819,2023-05-28,,"It may be a different type than the one you bought before. I don't know if it's good or bad, and the taste isn't the main thing."
266,30819,2023-05-02,,Very Awesome A Member Owned Company Since 1976 We Are Responsible To People's Health And To Protect The Planet Maracuya Crimson Kosher Non-Irradiated Herbal Dietary Supplement
267,30819,2023-03-06,,"Glory be to God, and praise be to Him, Glory be to God, the Great. Quality Ingredients Quantity Age Package Benefit Diet Radical Formula Taste"
