,product_id,date_posted,review_title,review_text
137,42971,2022-04-21,,"I felt a slight relaxation and had a good night's sleep, but I haven't been taking it for a month."
138,42971,2021-11-11,,"Good composition. I took it. I could not sleep because of stress, it helped and improved sleep."
139,42971,2016-08-21,It does not work.,"I ordered it because it was good, but it does not work for me. I've eaten twice but it feels like it's not stable and I feel like I'm sick."
140,42971,2021-11-24,,At night it doesn't bring me sleep and when I take it in the day it makes me feel calm
141,42971,2021-01-12,,"I liked the additive, I took it after reading the reviews, there were positive impressions"
142,42971,2022-06-04,,a healthy composition and has a calming effect
143,42971,2021-10-14,Deep sleep,An excellent herbal replacement for melatonin tablets. Vitamins come in a glass jar
144,42971,2021-10-05,Excellent!,"Sleep for a long time, you can fall asleep again after waking up"
145,42971,2021-07-22,Excellent!,"I eat one when I sleep, it's really good"
146,42971,2021-02-01,,It is a product that you trust and buy from a good company.
147,42971,2020-02-24,Adjust the concentration of your sleep,"It's not too much to sleep, so it's very modest."
148,42971,2021-03-14,,It helps sleep if I use other supplements along with it
149,42971,2021-01-12,Good,"If you eat an hour before bed and lie still, you can fall asleep naturally. It helps you sleep a lot."
150,42971,2021-08-24,,"The effect is a bit slow, and it takes about 1 hour to feel"
151,42971,2021-01-20,,Like Like Like Like Like
152,42971,2021-04-27,,"Not bad, I feel a slight sedative effect"
153,42971,2020-11-23,good,Good effect
154,42971,2020-08-14,,"It tastes bad, but it works well"
155,42971,2021-03-13,,"Natural, herbal. Work well"
156,42971,2018-03-25,Not really.,I have not seen the effect. Aaron is better.
157,42971,2021-10-04,,absolutely nothing ... quite the contrary .. generally a useless purchase
158,42971,2021-10-11,,Not that excellent
