,product_id,date_posted,review_title,review_text
0,46061,2023-11-08,Insomnia helper,"After trying high doses of Melatonin, which only helped for a couple day's at a time; I read about L- Theanine and how we insomniac's can benefit from it.

I could sleep like I haven't for years. And I took max 4 capsules a night. The important thing is, to go to bed as soon as you feel sleepy (and not trying to wait for more sleepiness, like me) so you don't miss your sleep window. Will definitely buy again 🙏"
1,46061,2024-08-23,Estatic! These work ,"Ive been taking 10mg melatonin for a few years. Typical go to brands are Now and Natrol. Although I think Now and Natrol are good, i was still only sleeping for 4 hours before waking and then every hour thereafter. So I recently swapped to this brand and I am getting at least 6 hours of solid sleep. Even at just 6 hours sleep Im waking feeling rested. So big game changer, Im ecstatic they are working. "
2,46061,2024-04-14,Excellent product ,I’ve tried lots of natural sleep aids and this one out performs all of them.  I still wake up but I don’t lay awake all night after the bathroom visit.  It also helps me to relax and fall asleep.  I don’t feel groggy in the morning like artificial sleeping pills do.
3,46061,2023-12-20,Works,"At first time it worked great. I slept really well only taking one dose of the capsule. The quality is good. Since it is a capsule, I don't taste anything.  Size is good for the price. The ingredients are good and safe to use. I like this because it does not additives."
4,46061,2024-01-11,very good,"i take 2 pills an hour before sleep. works well for me as I always have insomnia but taking these makes me able to fall asleep better and have a good night sleep. recommend to those who have problem falling asleep, somehow this combination works well for me"
5,46061,2023-09-14,My Garmin says I've been getting good quality of sleep since taking this.,"I've been having trouble sleeping for a sufficient amount of time for several days and decided to order this -- and it's one of the best decisions I've made. I've been sleeping longer and better, as the subject title of my review indicates. I intend to order this again and make sure I have it in ample supply all the time."
6,46061,2023-05-28,,"Slightly more expensive than other supplements. but it's one of the sleep supplements I've enjoyed the most. I'm so glad to meet this

a bit expensive. but it deserves its money. very very effective"
7,46061,2024-05-22,,I have headaches a bit when iI used it. But its made me easy to sleep. But i don’t like feeling when i use it .
8,46061,2024-01-04,"So so, ","I would say I´ve tried better.  I need to take this pill together with melatonin. Otherwise, I haven't found it very effective.  I will give it a 6 out of 10 "
9,46061,2023-08-08,Very Effective with an Added Bonus,"The first night I took Perfect Sleep I decided to take just one capsule, even though the dosage is stated as being two. And I'm glad I did, as one was definitely enough for me. It had an immediate positive impact on my sleep quality. 

But there was another unexpected result. The day after first taking Sleep Perfect I took my blood pressure, as part of my natural BP monitoring regimen, and was surprised to see it drop to 107/72 compared with the average of 118/79 I had been experiencing. This effect has been confirmed since continuing with Sleep Perfect."
10,46061,2023-07-24,Sleep Perfect is as in the name: It's Perfect,"I find this the best quality sleep blend on the market. I've tried other brands, but the herbal ingredients in the mix and the added magnesium, make this my favourite. Sleep Perfect is gentle and doesn't make you feel 'groggy' in the morning. At 1.5 mg per capsule it's good for teenagers too I reckon."
11,46061,2023-10-13,Great mixture for better 💤 sleep.,This product contains a mixture of quality ingredients. The capsule size is on the smaller side. If you want something more than melatonin then the Valerian Root and  L-theanine will help benefit the sleeping routine. There are other ingredients too. I generally switch between three different sleeping products.
12,46061,2024-05-13,,"Works well, and I like the combo of herbs with melatonin. "
13,46061,2023-08-31,It works for me!,"Update guys, it really  works on me ,I came back for more! Recommended! "
14,46061,2024-09-07,Average,"Sometimes it helped sometime it didn’t. 
Cannot say that it will help with sleep problems. "
15,46061,2022-05-04,Excellent! best ever combination really find it hard when out of stock,Amazing product I have not been able to find a natural product that has given me consisent sleep.  I have been using it for 6 months now and it is a life saver I have been able to come off my antidepressant !!! Have been on antidepressants for 30years..
16,46061,2023-10-10,,My friend has been using this to help her sleep and it works for her very well
17,46061,2023-07-12,,Perfect for a good night sleep. Good quality and also ships to New Zealand 
18,46061,2023-05-17,,"Excellent! quality, good ingredients, good size and dosage I got benefits It supports sleep "
19,46061,2023-04-10,,"Sleep support that worked well, subtle calming effect, would recomend"
20,46061,2022-12-24,,Great supplement; Taken before bedtime it will help you sleep ; it's got a calming effect...
21,46061,2024-05-11,,Unfortunately didn’t help with sleep. Took the whole bottle and didn’t really feel a difference
22,46061,2023-12-18,Didn't work for me,"the ingredients sounded really good, and have worked for me before, but even when I took 4 of these I didn't sleep."
23,46061,2021-11-17,Awesome melatonin product ,"Excellent quality, ingredients work really well. Love that they have magnesium in as well, really good combo with the melatonin. Very effective, always have a great sleep when using Sleep Perfect. Easy to swallow average size capsules, so no taste."
24,46061,2023-10-01,Good blend,This product has a nice blend of supplements and one.
25,46061,2023-09-29,Good sleep aid,I just discovered this product and find it a good combination of herbs and other sleep aids. Works well.
26,46061,2023-02-11,,"Pretty good. Does help with sleep so am less reliant on medication, ingredients and price point is good too"
27,46061,2020-09-13,Works Well,I do take two about 15 minutes before going to bed but I take it with Calcium & CBD. I usually sleep 8 hours & rarely wake up during the night.
28,46061,2019-10-17,No lingering feeling of being tired in the morning ,This product works very well for me.  I do not have any problems waking up and feeling drugged.  I use this product daily with no issues. In my opinion this is a superb product. 
29,46061,2022-10-06,Helps you get sleepy ,"Def helps get me to sleep, maybe not stay for entire night, but still a good product. Good combined supplemt "
30,46061,2022-01-09,,I bought to get the bonus of Valerien.  The effects last long so take it early.  Good ingredients and works well. 
31,46061,2021-10-31,,Good supplement to help with sleep. Sleep in important to keep in good health.
32,46061,2017-03-05,the right stuff for the wrong person?,"This product contains everything one could wish for in a sleeping potion. And as somebody with chronic recurrent insomnia I was very excited to find it.
However, even at 1.5 times the suggested dose it did nothing to assist me! (Or at the recommended dose, or half of it.)
Am I so wrong?
I gave my bottle to a friend and hope to have better news to report from her."
33,46061,2020-07-25,Sleep perfect,"The jury is still out on this one.
I thought it was working - then decided it wasn’t.
Seems no better than magnesium for sleep."
34,46061,2021-05-09,Awesome product,I take 2 capsules an hour before sleep and sleep great!
35,46061,2022-01-07,,Excellent supplement works really good highly recommended
36,46061,2021-09-28,,very pleased with product. nice ingredients and nice packaging. would buy again.
37,46061,2021-03-02,,really hard to tell what works the best as far as sleep goes. I like all the ingredients in it. 
38,46061,2020-12-29,,It helps my sleeping habit well especially when I’m stress 
39,46061,2016-10-01,Great product,Give me a good sleep . I have ordered four bottles.
40,46061,2020-03-16,Didn't work for me ,"Had to change brand as my melatonin wasn't available anymore, I tried this as it contained the same dose as my original melatonin. I found that on this I was back to my usual sleep problems straight away. Didn't do anything for me "
41,46061,2020-07-01,Taking this mineral will not help in sleeping ,These minerals in general dont have such a sleeping action
42,46061,2019-09-28,Not the best,Can't say it seems to give me any bettersleep than taking nothing.  Quite disappointed
43,46061,2021-05-10,,Great for relaxing before bed and falling asleep easily
44,46061,2021-01-24,,Like the combination melatonin and l-theanin!
45,46061,2022-01-17,,doesn't help much to improve sleeping
46,46061,2021-09-14,,Excellent Product! 
47,46061,2021-06-21,,great sleep product
48,46061,2021-05-31,,Excellent Product!
49,46061,2021-05-17,,Clients swear by it!
50,46061,2021-01-20,,Great product
51,46061,2020-12-19,,Very good stuff
52,46061,2019-12-06,Doesn't work ,This actually kept me awake instead of helping me fall asleep.  Wasted money. 
53,46061,2024-08-05,Quality.,"After prolonged severe stress, I stopped sleeping, slept for 3-4 hours of shallow sleep, no domestic drugs helped. I found this drug based on reviews. I tried it. Amazing. Deep sleep returned to me, as did rest. In the morning I feel rested, despite the fact that I get up early with an alarm clock. But... the effect occurs 4-5 days after taking it, there should probably be a cumulative effect. I ordered 1 more jar. I recommend ."
54,46061,2024-07-09,,"The quality of this product is simply the best on the market for this big +, the composition is no different from competitors’ products, but I had no questions about it, the packaging is good and reliable, everything arrived in one piece without any defects or damage, the advantage for me is a good price for such a quality product"
55,46061,2024-03-10,,"I bought it with some skepticism. This really works. I take one tablet before going to bed, and when I go to bed, I can fall asleep quickly."
56,46061,2024-01-14,Effective for sleep,"Perhaps because of my mood, I fell into a deep sleep after eating this. But my husband didn't react much. I guess it's different for each person. The size was just right to eat."
57,46061,2024-08-04,Sleep regained,"This food supplement allowed me to find sleep and good mood, to test. The Earth's Bounty brand produces good food supplements, you can trust it without worries. "
58,46061,2023-09-02,,"I bought it because I thought it would be better overall than just melatonin, as it also contains herbs. Capsule type. I'm a light sleeper, but I feel more refreshed in the morning than melatonin alone, so I think the other ingredients are also effective. It also contains magnesium citrate. It is a product that I would like to have because it fits."
59,46061,2022-11-07,It works !,"It works!! At first, I did not like this natural remedy for insomnia and I stopped taking it .... But then, after a while, I remembered Sleep Perfect and decided to try again. Instead of taking it before bed, I started taking it with dinner. By the time bedtime approaches, I become sleepy. I'm so glad I tried again! Perhaps my experience will be useful to someone: just try taking sleeping pills at a different time."
60,46061,2023-05-31,,"Thanks for the good delivery. I haven't been taking it for a long time, but good reviews and my own experience suggest that I'm halfway to the desired result! Glory to Ukraine! 💙💛"
61,46061,2024-08-24,very good product,The price is reasonable and the effect is good. I would recommend this product.
62,46061,2024-08-11,,It is very helpful in improving sleep quality and has been repurchased many times.
63,46061,2024-07-23,"Vitamins to take before bed Makes you sleep soundly, good quality","Vitamins to take before bed Makes you sleep soundly, good quality"
64,46061,2024-07-04,Feeling refreshed after sleeping.,I don't know if it helps you fall asleep or stay asleep longer. I feel refreshed after sleeping.
65,46061,2024-06-07,for sleep,"Nice quality, ingredients that I didn't know, good dosage, a little taste, a product of Ey Harab "
66,46061,2024-05-20,Excellent!,I really liked this good product. I took it as prescribed by the doctor. I am satisfied with the result.
67,46061,2024-02-26,ok,"The price is cheap, trustworthy and highly recommended. I have repurchased it many times."
68,46061,2024-01-19,,Take it together with mulberry and poria for better effect and helpful for sleep.
69,46061,2024-01-17,ok,"The price is cheap, trustworthy and highly recommended. I have repurchased it many times."
70,46061,2023-07-02,,The quality and the ingredients that make up the capsules are of high quality and bring a benefit immediately felt the size of the capsules is consistent and tasteless with a quality dosage all the necessary ingredients are presented without chemicals everything is natural and in more vegan.
71,46061,2023-08-06,I can sleep soundly⭐︎,"After I passed 40, I had trouble falling asleep and was prescribed Myslee. I'm so tired of going to the psychiatrist, so I'm glad I was able to easily purchase it here!"
72,46061,2023-07-14,,"I used to have trouble falling asleep after childbirth, but since I started taking this supplement, I've been able to sleep better! I think my sleep level has improved as well! Thanks to you, I can raise my children well every day! I would like to continue drinking."
73,46061,2023-03-26,,"The size is good and the quantity is very reasonable. A company that offers quality products, and I will update the evaluation as soon as the experiment is completed, God willing"
74,46061,2024-01-28,did not help,"Despite the expectations, the product did not help me with continuous and prolonged sleep. Comfortable size, fair price but does not fulfill the expectations and it's a shame."
75,46061,2023-09-23,Not bad,"A good synergistic composition of theanine, melatonin and herbs that have a calming effect. Helps you relax in the evening, is not addictive, although of course, it does not replace prescription drugs, if someone is already used to them."
76,46061,2022-09-20,,"I think it helps me a lot to sleep. I recommend. If you take 2 pills a day, it's a month's supply, so it's not cheap, but I think it's effective."
77,46061,2022-06-16,,"the best value for money, it makes you sleep you still have to take two or even three. in the morning we wake up with a normal head not in the polish like with sleeping pills"
78,46061,2023-09-09,,"Excellent, high quality. I will buy it next time and order it again. Hello, how are you?"
79,46061,2023-09-02,,I sleep well and wake up feeling refreshed the next morning.
80,46061,2023-07-07,,I feel like I slept deeply. It just feels like time doesn't change.
81,46061,2023-03-23,,"When I eat, I usually see the effect of sound sleep"
82,46061,2019-06-29,Work fine,"After prolonged severe stress, I stopped sleeping, I slept for 3-4 hours of shallow sleep, no domestic drugs helped. Found this drug on the reviews. I tried. Awesome Deep sleep returned to me, as did the rest. In the morning I feel rested, despite the fact that I get up early on the alarm clock. But ... the effect occurs 4-5 days after the adoption, probably there should be a cumulative effect. I ordered another 1 jar. Recommend ."
83,46061,2017-08-31,Magic tablets.,"Ordered for a friend (55 years old and all relevant to the female period problems). I learned by chance that she lives for a month on a serious sleeping pill, from which she can not ""jump off""! I rummaged for iHerb, offered to try this drug. She is now ""happy as an elephant""))) Sleeps perfectly, if she wakes up at night, then she falls asleep again. And instead of two capsules takes one! I'm glad for her and for myself put a tick that I'll use it if necessary."
84,46061,2013-03-18,Not yet realized.,"The first night decided to drink 1 capsule, instead of the recommended 2, did not feel at all. Then I tried 2, but in a weak effect. Decided can work with accumulation. But now prescribed other medicines, do not want to mix those suspended. Maybe later I change my review."
85,46061,2023-06-21,Ok,"I've just started, so I'm looking forward to continuing."
86,46061,2022-04-24,,"Super helped me with insomnia, all the ingredients contained in it promote an improvement in sleep"
87,46061,2019-07-03,This is the most effective sleeping nut ...,"I do not think I have a certain effect, but the cause and condition of my insomnia is unusual and severe, so I do not give a lasting and definite effect to me, but it seems to be more effective than other sleeping nutrients and sleep inducers. I think the yen will be heard well."
88,46061,2019-07-15,It's enough to eat just one,"After 15 minutes of eating, he was sleepy. 2 If you eat it, you will have a headache the next day. 1 If you eat it, you will not feel any side effects."
89,46061,2022-06-07,,Helps a little to sleep but not really as I expected but at least it's a natural and quality product
90,46061,2022-02-24,,"good, this one is better than taking medicine, dr"
91,46061,2022-01-26,,"I brought it to sleep, Lord, to sleep"
92,46061,2021-03-05,,It's hard to find anything that contains melatonin.
93,46061,2021-01-20,,I bought a product because I couldn't sleep. Those who have never had a prescription for sleeping pills will be helpful.
94,46061,2022-06-11,Excellent!,"Fast delivery, excellent quality product."
95,46061,2019-08-26,,"Eating two capsules will help you sleep comfortably, and it won't burden you when you wake up in the morning."
96,46061,2019-04-02,I have not eaten yet.,"Originally, I ate a tablet to eat, but I think it would be hard to eat it because I have to eat two eggs. I want to be effective. It is the only product that is not blocked, so if it is effective, I will buy it again."
97,46061,2021-01-22,,"I bought it for my insomniac mother, but she says she can sleep well."
98,46061,2019-08-17,Sleeping pills available on iHerb,It is one of the few products that contains melatonin.
99,46061,2019-05-02,됴 됴))))))))))))),I do not think I have to go to the peninsula. I do not think I have a problem with this.
100,46061,2021-01-20,,Like Like Like Like Like
101,46061,2019-12-04,Great product,"Great product, I recommend to all"
102,46061,2019-01-13,Good product,With this product I have a deeper Sclaf
103,46061,2021-01-26,,good
104,46061,2021-01-25,,Good satisfaction!
105,46061,2021-01-25,,Helps sleep
106,46061,2021-01-03,,very good
107,46061,2019-04-28,Improve sleep,Good for my sleep
108,46061,2019-07-01,Good,Eat 2 hours before eating seems to be effective
