,product_id,date_posted,review_title,review_text
130,57444,2017-01-30,Effect,"I drink this remedy for about a month, before going to sleep on 4 tablets. The effect is not felt."
131,57444,2021-10-01,Excellent rest,Great for relaxing and relaxing muscles
132,57444,2021-06-02,,Helps Relieve Muscle Pain and Tension
133,57444,2021-01-25,,Helps for mild muscle soreness
134,57444,2020-07-14,Somewhat useful,"Not comparable to drugs, but it really works"
135,57444,2021-07-29,,Really helps relieve muscles
136,57444,2021-01-24,"I only took one pill, and then my body got itchy, allergic and feeling bad","I only took one pill, and then my body got itchy, allergic and feeling bad"
137,57444,2018-12-26,Personal effects,It could not be said that it knew the effect
138,57444,2018-08-17,Good,Goog
139,57444,2021-07-01,,The effect is not obvious
140,57444,2021-01-25,,it works
141,57444,2021-01-24,Okay,Okay
142,57444,2018-11-28,no feelings,Eat no feeling muscle relaxation
