,product_id,date_posted,review_title,review_text
3426,6802,2022-06-26,,"I have been away from him for a long time, believe me, I feel insomnia, and after I drank it, I fell into a deep sleep."
3427,6802,2022-06-22,,"I bought it because the quality of sleep is poor. Contains passion flower, an herb that is said to be good for sleeping. It's easy to drink without any habit, so I'm repeating it."
3428,6802,2022-06-18,"Awesome, buy it a million times","It is delicious, the quality is great, the ingredients are light, and the taste is above delicious, the size is a little, I wished for more, the box is small, frankly, tea that appeals to nerves and there is no caffeine at all, I advise you to use it.."
3429,6802,2022-06-16,,"You should definitely not expect that you will drink a cup and sleep like a baby) But you will get relaxation. I drink during anxiety attacks. The taste of tea is quite pleasant, you can drink just like that. Natural ingredients, herbs. I brew 1 sachet for 15 minutes."
3430,6802,2022-06-16,,"I love it before bed, but it does not make you sleepy, but it gives you relaxation and calm, and I noticed the sleep after it is deep, frankly excellent"
3431,6802,2022-06-08,,very good quality. A quality and relaxing ingredient. Very good taste. Daily use. Standard packing size. A decaffeinated tea blend in each serving has many benefits. Need for high frequency. It is highly recommended
3432,6802,2022-06-05,,"Oh sweet tea, frankly, I used to drink it and enjoy it, I don't know if it helps me sleep or not, but it tastes good and delicious."
3433,6802,2022-06-02,,"I asked for it for my friend to help her relax, she says the taste is sweet as if the tea is not always the benefit"
3434,6802,2022-06-01,,"Sweet, tastes acceptable, gives relaxation, high quality, without caffeine, the size of the box is the same as the rest of the companies is useful"
3435,6802,2022-05-27,,"It tastes crazy, and I love it. You have to make me a cup every day, and I like it, and it also makes you fall into a deep sleep and wake up while you are active and comfortable."
3436,6802,2022-04-29,,"If the tea is bitter, it helps me. I am the type who used to suffer from insomnia, and after that, thank God, it tastes close to chamomile."
3437,6802,2022-04-26,,"The quality is good and the ingredients are nice. The taste is pleasant and receptive. Use often before bedtime to relax. The size and quantity are good. The benefit is doing a relaxation and calming the nerves, a useful tea."
3438,6802,2022-04-22,,"When I saw the box, I remembered its taste and smell 💔 I bought it in my breath and it brought me relaxation and a beautiful and natural sleep.. It tastes like mint, very light, acceptable"
3439,6802,2022-04-13,,"Wow, girls, this product is amazing, very frankly, I can't find a recipe!! As always, iHerb dazzles us with its collections, the quality is good and the formula is organic. Awe!! I like it and recommend it, very useful :) Mashallah"
3440,6802,2022-04-06,,"He did not reach me, but he praised him a lot. My friend in America always praises him for me and uses it when needed and says excellent"
3441,6802,2022-04-03,,"It's a nightie night, but I drink it when I want to relax in the morning or noon ^ ^ It's not a strong habit and it's easy to drink ^ ^"
3442,6802,2022-03-29,,Delicious..gentle..light..the effect is also light..I tried other companies and their effect was much stronger..but in general it is not shin
3443,6802,2022-03-29,,"It is easier to drink than dandelions and has a pleasant herbal aroma. I'm sleepless so I'm drinking at night. It won't heal completely, but I will definitely repeat it because I can relax. I also gave it to the people at work."
3444,6802,2022-03-28,,"Hey, yeah, yeah, yeah, yeah, yeah, yeah, yeah, yeah, yeah, yeah, yeah yeah yeah yeah yeah yeah yeah yeah yeah yeah yeah yeah yeah yeah yeah yeah yeah yeah yeah yeah yeah yeah yeah yeah yeah yeah yeah yeah yeah yeah yeah yeah yeah yeah up"
3445,6802,2022-03-19,,"It's nice, but you need to drink it like this once in order to improve its effect. The first time you drank it, you didn't feel anything"
3446,6802,2022-03-18,,"It tastes sweet and I always take it at different times. It didn't make me sleepy or sleep, but I liked that I drink it after eating 😀 My sister felt that her sleep had become deep, but"
3447,6802,2022-03-08,,"This caffeine free tea tastes delicious and is great quality to use before bed, I use it daily and I notice a lot of difference in my sleep"
3448,6802,2022-02-28,,"Its smell is not necessary. I did not feel it helps with sleep. The taste is bad. The size is large. It is easy to use. It is useful. I did not feel that it is tea. It does not contain caffeine.
"
3449,6802,2022-02-20,,It has been proven that passionflower has a good effect on the nervous system. I drink to calm down. Very rich taste. I like. The composition is very rich.
3450,6802,2022-02-18,Excellent!,"Great tea, very relaxing. I bought it for my parents for a test, as they complained that they fell asleep for a long time, or could not fall asleep at all. A cup of tea at night and a great sleep is guaranteed"
3451,6802,2022-02-09,Excellent! Awesome,"A Mahdi for the nerves, but not daily, only when needed, he sleeps and calms the nerves. I do not advise those who have low pressure"
3452,6802,2022-02-05,I was looking for a souvenir.,"The scent of herbs like mint is very calming. I put it in a mug and pour hot water as it is, but the taste is still strong. You can enjoy healing and refreshing feeling, so I will repeat it."
3453,6802,2022-01-27,,"Good tea, after I didn’t have the opportunity to buy ashwagandha .. periodically we try what can be bought and will also help. More or less the effect of passionflower. We take tea and just in the form of tablets."
3454,6802,2022-01-05,,"Excellent tea with good action, pleasant taste and aroma. Strong enough, 1 sachet is enough for a large teapot. We drink in the evening with the whole family. Would recommend and will be ordering again."
3455,6802,2022-01-01,,"I'm sorry, this thing does not sleep, but if you sleep, it gives you a relaxation and a deep sleep. You really helped me a lot after God."
3456,6802,2022-01-01,Delicious tea!!!,"I trust this manufacturer, the quality and taste are excellent. I order on an ongoing basis, I recommend it. I drink at night. I really like the taste."
3457,6802,2021-12-30,,Enjoy delicious and very relaxing without Valerian. There is a similar product with Valerian. This product is intended for those who are not used to the taste of Hollerian
3458,6802,2021-12-26,,"I sleep well if I drink this miracle in the evening! Great tea. When you want a seagull, but is very sensitive to theine, this is a direct way out!"
3459,6802,2021-12-26,,"Pleasant taste. After tea tends to sleep, the main thing is not to miss the moment and go to bed, since the effect is short-lived))"
3460,6802,2021-12-21,I liked its taste.,"To help sleep, its use is easy, each tea bag has a paper envelope, the quality of the ingredients is good, the carton box is good, knowing that there is a warning not to be given to children"
3461,6802,2021-12-13,,"The tea is excellent, and everything else has a diuretic effect ... maybe it will come in handy for someone)) I recommend everyone to try it. Be healthy and like!"
3462,6802,2021-12-11,,"It tastes crazy, but I don't know why I didn't sleep, even though many of the comments came with the effect of sleep, but it is sure from body to body that it differentiates"
3463,6802,2021-12-10,,"I liked this tea! Excellent composition, decaf, soothes and puts you to sleep. Pleasant herbal taste, I drink in the evening and then sleep well"
3464,6802,2021-11-20,Really soothes and tones you to sleep,A very pleasant and delicious tea before bed. Calms and gives the right mood. Would buy a bigger pack to last longer 😍 drinking this tea is a pleasant daily ceremony before bed
3465,6802,2021-11-17,,"It is nice to take it to drink before going to sleep, you sleep a calm and beautiful sleep, but the stomach must be empty of food, so do not drink it immediately after eating"
3466,6802,2021-11-14,,"Really cool tea for soothing and good sleep, it works! The composition contains passion flower, chamomile and my favorite linden, as well as mint, lemon verbena and other herbs. Herbal taste, unobtrusive, pleasant, refreshing. I am ordering again. Like."
3467,6802,2021-11-14,,"Delicious and soothing to the nerves, I have insomnia and tense sleep. I noticed a long sleep period of 4 continuous hours, usually only 2 hours"
3468,6802,2021-11-10,Nice tea!,"The tea tastes good with spicy notes. Gives calmness in the evenings, helps to tune in to sleep. In my opinion, it does not have a strong hypnotic effect. Passionflower is usually prescribed as a sedative, relieves irritability, normalizes sleep, and reduces heart palpitations. I recommend buying tea."
3469,6802,2021-11-06,,"Organic herbal tea with passion flower, chamomile, linden, mint. The power of herbs promotes restful sleep. Passionflower helps to relax and has a calming effect. Taste of tea with sourness, with spicy notes."
3470,6802,2021-10-23,,Cool tea with an unobtrusive pleasant aroma. I fall asleep after it really fast enough. The main thing is not to pick up the phone before bed.
3471,6802,2024-01-10,A different kind of tea,"It's really great, I really recommend it"
3472,6802,2022-11-21,,"I ordered it for my colleague, who has insomnia, but since the ingredients are chamomile, it will definitely be an excellent mehdi"
3473,6802,2022-11-05,,"It is very normal, someone else can benefit from it, but I did not notice any difference"
3474,6802,2023-10-07,,"Delicious tea that contains beneficial ingredients, good taste and good quality"
3475,6802,2023-10-07,,For healthy sleep Promotes a good night's sleep Herbal supplement Certified Organic by the USDA
3476,6802,2023-10-03,,The ingredients are very beautiful and help to relax and sleep. Use daily before bed
3477,6802,2023-09-22,good,"The size is appropriate. I ordered tea occasionally. It is good, but the effect is not bitter"
3478,6802,2023-09-14,,"The quality, ingredients, and taste are very wonderful and delicious, the use is easy, and the size is excellent"
3479,6802,2023-09-09,,"The product may be good, but I have reservations about the high prices"
3480,6802,2023-09-03,,"It's beautiful and I feel it relaxes the nerves, it doesn't make me sleepy, but the taste is acceptable"
3481,6802,2023-08-31,Good,"Delicious tea, suitable for tired nights. I recommend buying it and buying it again, for sure"
3482,6802,2023-08-29,,the quality . well . the components . Excellent. Kind . Taste . sweet . the use . easy . The size is normal.
3483,6802,2023-08-24,,"The taste is the same as the taste of chamomile drink. Use a cup of hot water, then lepton."
3484,6802,2023-08-16,,"Herbal tea tea bags, drink hot, calm down, a medium-sized package"
3485,6802,2023-08-15,,"It's a good time for the days of the period to relieve her pain a little bit, try it and pray for me"
3486,6802,2023-08-04,,Herbal tea to drink in the evening to relax with fruits or roses. Twenty tea bags
3487,6802,2023-08-02,,I bought it for a change in the type of drinks and to be warm during the days of the menstrual cycle
3488,6802,2023-07-30,,It's a good tea to drink at night. I like that there is no caffeine.
3489,6802,2023-07-27,,It is so sweet that I loved it so much that I used it until the day I got really sick
3490,6802,2023-07-07,,"The product arrived quickly, the packaging was well sealed, and the size of the product is appropriate"
3491,6802,2023-07-07,,"The taste is not delicious, but I feel relieved. And I feel a little sleepy."
3492,6802,2023-06-24,,"Its quality is good, and it calms the nerves. Its taste is what I like, and I do not use it a lot"
3493,6802,2023-06-18,,"The quality and ingredients are good, the size is small and the box is caffeine free"
3494,6802,2023-05-28,Good,"Once, it is sweet to calm down and before going to sleep, it relaxes the muscles if you have tension and exhaustion"
3495,6802,2023-05-24,Good,"The quality is great, the packaging is cardboard, it contains envelopes, the smell is refreshing, the taste is delicious, its effect is sweet"
3496,6802,2023-05-23,,Scent Usage Quality Size Age Packaging Benefit Formula Sensation Effective Value Repeat Purchase
3497,6802,2023-05-20,,"The smell does not exist, the use is calming, the quality is excellent, the size is suitable, without caffeine"
3498,6802,2023-05-12,,I liked the quality and the ingredients. It tastes acceptable and frankly useful. It is used with food
3499,6802,2023-05-12,,"So far, I have not tried it, but according to the evaluation and reviews, many people praise it"
3500,6802,2023-05-04,,"Honestly, it tastes good, the quantity is appropriate, and it is used in the same way as tea, but before bed 👍🏻"
3501,6802,2023-04-26,,"It is not true that my mother ran it and did not see any results, unfortunately. I mean, no one thinks of buying it. Spend your money for something else."
3502,6802,2023-04-19,,I gave this as a gift to my sister who has trouble sleeping. They seemed to like it.
3503,6802,2023-04-15,,"The quality and taste are good, without caffeine, and the package size is okay"
3504,6802,2023-04-13,,"Good and useful, an appropriate amount .. and the price is appropriate compared to the quantity .. I recommend it."
3505,6802,2023-03-31,,Sweet and minty flavor with subtle notes of acid and spice.
3506,6802,2023-03-25,,"I asked for my sister, so I don't know if it's good or not. I haven't tried it for honesty"
3507,6802,2023-03-23,,I bought an evening tea. Taking time to relax is important.
3508,6802,2023-03-03,Good,Sweet effect for relaxation and sleep. Unacceptable smell and taste.
3509,6802,2023-02-04,,Natural medicinal herbal tea. High quality. A good composition of herbs. Therapeutic.
3510,6802,2023-01-28,,Acceptable taste and use an hour or two before bed. I asked how many times of it 👍
3511,6802,2022-12-31,,The tea is pleasant with passionflower and decaffeinated. It works very gently and for a short time.
3512,6802,2022-12-25,,One drink after dinner to see if it is effective for sleep. The results are not good.
3513,6802,2022-12-24,,"For me, I liked it a lot. It tastes more like chamomile and helps to relax"
3514,6802,2022-12-05,Good,"The taste is sweet for those who love herbs, but honestly, I didn't sleep with it. Maybe I need an extra!??"
3515,6802,2022-12-03,,A good tea with a healthy composition without caffeine. Passionflower has good soothing properties. I will take it at night for a good sleep.
3516,6802,2022-11-28,,"Wonderful, I bought it by chance, and it will not be the last time. I will repeat the experience"
3517,6802,2022-11-24,,Its taste is close to mint. The use is very easy. The quality is good and without caffeine
3518,6802,2022-11-05,,"I feel crazy, it gives the body relaxation, and so does sleep."
3519,6802,2022-11-04,,For Healthy Sleep Promotes Good Night Sleep Herbal Supplement USDA Organic
3520,6802,2022-10-30,,I bought it to drink it before bed and it really calms the nerves. It is chamomile and lavender
3521,6802,2022-10-24,,"The taste is acceptable, its quality is good, it calms the nerves, but I never sleep, but it relaxes my nerves"
3522,6802,2022-10-23,,"The taste is okay, it can be drunk without adding sugar, the quality and the ingredients are excellent"
3523,6802,2022-09-08,Tea is fine,"Good quality, composition, conscientious developer and good implementation, the West knows how, I give the highest score!"
3524,6802,2022-07-30,,"The quality is excellent, the ingredients are clean, the taste is normal, the use is half an hour to an hour before bed, the size is normal, the box is normal, the benefit is relaxation and deep sleep, it tastes like green tea without caffeine, use it once before bed, repeat the purchase, a sweet mixture, one serving"
3525,6802,2022-02-07,,"Packaging is neat. The taste is pleasant. Mint is the strongest. I drink for four days. I seem to fall asleep faster than usual. I have a problem with sleep. I only drink before bed. But this composition does not suit me. After taking it, there are not pleasant sensations in the esophagus and a strong burp. I will not buy again."
3526,6802,2021-10-17,,"I really love caffeine-free herbal teas. This is my passion. This tea contains passionflower herb, chamomile flowers, linden flowers, catnip, organic hop cones, curly mint leaves, lemon verbena leaves, lemon zest and West Indian lemongrass leaves. The taste of the tea is rich and pleasant, you can feel the taste of mint and citrus. The color of the drink is transparent yellow. This tea helps me to relax, calm down and sleep soundly. Recommend."
3527,6802,2021-10-02,,"The taste is wonderful and calms the nerves, and to be honest, I have not benefited a lot to sleep, but it can benefit others because I basically have a sleep disorder and always get tired, but the effect on the nerves is strange, and if I go back, I ask him to come back"
3528,6802,2021-07-30,,"One of my favorite teas. I take it periodically, as I see the effect. The selected herbs not only soothe and help you fall asleep, but also improve the quality of your sleep. I drink about an hour before bedtime, so that I have time to run to the toilet before bedtime)) To completely improve sleep, you can take a bath with Epsom salt in the evening (the body relaxes and is nourished with magnesium). If it is very difficult to sleep (for example, due to pain), then you can take more melatonin."
3529,6802,2021-06-09,An excellent choice for those who love herbal teas,"I really love not just green tea, but herbal teas, so I always try different options with pleasure. This tea is just 100% my taste! Here is mint, chamomile, and linden! And what I love most is that the amount of herbs in the bag is perfect for one cup. This is the first time in my life when I brew such a bag in accordance with the manufacturer's recommendation - 3-5 minutes, and at the same time the tea turns out to be not too strong, but just the way it should be. I-de-al-nym! I am delighted. I don't know how much it helps to fall asleep in the evening, but nevertheless I drink with great pleasure. The case when both taste and aroma are just at their best. I definitely recommend it."
3530,6802,2021-03-18,,"The tea tastes very good, it has no bitterness, sourness and other unpleasant tastes, aromatic, herbal, it is very pleasant to drink. It has a slight feel of mint, chamomile and linden. If you add a spoonful of honey to your tea, the drink will become even tastier and healthier! I do not have big problems with insomnia, this tea literally ""knocks out"" me after 20 minutes, I immediately want to sleep, my eyes begin to stick together and only one thought haunts me that I must quickly get under a warm blanket)). But I bought tea for my mother, she often has problems falling asleep, and at night she can wake up, and then she does not fall asleep for a long time. According to her mother, he helps her to fall asleep, but acts no earlier than after 40-50 minutes (without tea, she can lie awake for 3 hours), and after drinking this tea, she does not wake up at night, but still gets up early, at 6 am without an alarm clock. This is a very good result for her, so she liked the tea and asked to buy another pack."
3531,6802,2021-03-16,,"I have an overestimated cortisol, as a result of insulin. I bought tea to reduce stress, I drink it at night, there is no swelling, I sleep well. I notice that I used to be annoyed by some things, the behavior of other people, but now I calmly observe. I will continue to drink."
3532,6802,2021-03-08,,"I like this basic version better than Nighty Night Extra. Extras are a little ugly ... I don't feel any particular effect such as ""I can sleep well"", but it has a calming scent and is very good for conditioning when I go to bed (it makes me remember that it is time to fall asleep after drinking tea with this scent)."
3533,6802,2021-02-07,Excellent!,"It is true that it is not enough, but it only works for adults !! You put a tea bag in a hot moya cup from 10-15 d and drink it, it gives you a feeling of relaxation and comfort, of course, with the need for calm around you and the dim lights help a little bit to sleep"
3534,6802,2020-12-09,Deliciousness that makes you addicted,"There are many types of herbal teas in my house, but I always choose this tea with passionflower when I want to relax by drinking something warm before going to bed. I like the fact that it doesn't have a particularly noticeable taste and has a slightly refreshing scent. Repeat buying decision."
3535,6802,2020-12-03,Excellent tea and tastes acceptable!,"I liked this tea. It helped me sleep deeply and was relieved of the slightest insomnia that I was suffering from. I woke up in the middle of my sleep several times and could not sleep again quickly. When I tried this tea, I said the number of times I woke up and started to sleep deeply. Put one tea bag in a cup of boiled water and leave it until it wears off and drink it Half an hour before bed, please like if you like my comment"
3536,6802,2020-11-24,Repeat confirmed for unexpected efficacy!,"I bought it because of insomnia, but I was surprised to find that it has an immediate effect on stomach upset with nausea. When I drank it after being hit by a heavy stomach upset, the stomach discomfort disappeared like a lie. It is a delicious tea with a smooth mint aroma and no habit of taste, so you can relax at night. I would like to repeat it in my next order soon ^ ^"
3537,6802,2020-02-02,Excellent Tea,"I just took it as a supplement to the main order and ... I was pleasantly surprised. Firstly, it is delicious, very homemade and really soothing the composition is excellent, if you have serious sleep problems, then of course you should not hope for a miracle, well, a couple of mugs in the evening are very good"
3538,6802,2018-01-06,⭐️🥇 Very effective!,"To be honest, I do not like tea in bags. For me, tea is a whole ceremony, brew in a beautiful teapot and enjoy a bouquet - this is a real relaxation. This tea was ordered at the request of a friend, but somehow all had no time to meet, so he was lying in the closet. Somehow late, coming home from work, it was absolutely lazy to make something, decided to make this tea) At night, she slept like a ""dead woman"". I advised my daughter, she has exams, nerves. She drank an hour and a half before sleep and also was very pleased. In general it is a super relaxing and lulling mix with a root of valerian and a wonderfully beautiful flower - passionflower, with melissa and peppermint! If you have insomnia, a hard day, then the mug of this phyto tea will take you to the world of Morpheus 😴 for 30 minutes after tea! Has a herbal taste, a slight minty chill. Now I buy this tea constantly, very effective! Yes, and still ☝️ do not try to brew one sachet several times, it is disposable 😉"
3539,6802,2017-11-07,Helps with insomnia,"In our family number 1 of insomnia. I brew if I wake up at night and can not fall asleep. It is very good to take along on the train)) Do not overuse, use if necessary, sleep we try to normalize the sleep with the regime and physical exertion, but there are all - age 50+. I recommend."
3540,6802,2016-12-20,I love this herbal tea!,"I have trouble sleeping, so I buy various herbal teas for fast falling asleep. That it is possible to tell, certainly a dream this business individual for everyone who that will sniff lavender and already sleeps, and who that can not fall asleep and after a sleeping pill, therefore I can not judge efficiency of this tea, but to drink it it is pleasant, grasses are perfectly combined, Tea is fragrant, tasty, but in my sleep it certainly does not affect, a little calms, it's yes) I'll buy it all the same and continue, like the rest of the packs in this brand, I really liked the quality and taste, so of course five stars. The packaging is beautiful, aesthetically pleasing, the only thing was crumpled when delivered, but it's more a question to the packers of orders, and this is naturally insignificant for the quality of the beverage itself, so I recommend all lovers of tasty and healthy drinks and teas!"
3541,6802,2016-08-23,"As his market, this tea is effective and helps to sleep deep and fast","Ok, this tea makes you sleep if you are completely corrected, but if your normal sleep time is near and you drink it, you will probably sleep the same, and the sleep itself is deep and connected, good for me suffering from insomnia and looking for something natural that will help them. They are advised to drink during the day + at least once before sleep, but for myself use it only at bedtime, use two bags for a stronger effect, and most importantly carry out the instructions mentioned, which you cover from five to ten minutes"
3542,6802,2014-06-04,There is relaxing effect!,"Drink when you do not Yasumara mood to slow and limp back at work, if there even when you work with Jiwa', there is also such as when passing Innovation Sue, is very good. Since Horsehead hesitation was felt so clearly effect in the herbal tea, other types were also ordered."
