,product_id,date_posted,review_title,review_text
1483,6802,2024-07-04,,"The quality of this product is simply the best on the market, it’s a big +, the composition is no different from competitors’ products, but I had no questions about it, the packaging is good and reliable, everything arrived intact without any defects or damage, the advantage for me is a good price for such a quality product"
1484,6802,2024-07-03,Sooooooooooooooooooooooooooooooooooooooooooooooooooooooooooooo nice ,"The taste is good and the quality is perfect. I really like it and it brings sleep. The first time I took it, I slept for 10 hours, and after that I felt that not once did it make me sleep lighter than the first time, but it is also bittersweet. "
1485,6802,2024-06-24,,"The quality is good. The ingredients are natural, chamomile and passionflower. The taste is acceptable to use. It helps to relax. The size is appropriate. The box is good. It contains 16 bags, each one separately. It contains beautiful motivational phrases. Benefits. Tea helps to relax and sleep peacefully. A mixture of natural herbs. Free of caffeine. A serving is one to two times. Repeat purchase. If you benefited from me, please rate me as a favor, not a command, thank you 🤍"
1486,6802,2024-06-09,Awesome,"The quality is amazing. The ingredients are a tea that relaxes the nerves. I used it and felt a difference. I slept deeply. The taste is okay. It is nice to use if I feel tired. I fix it. The size. The number of simple envelopes. The box is nice. The benefit is honesty. Comfort. A tea that needs no introduction. A wonderful combination. Caffeine. I don’t know the portion. If I feel tired, I fix it before bed. Of course, repeat, definitely repeat. the demand "
1487,6802,2024-06-05,For a good sleep,"This is my repeat purchase. Delicious and healthy tea. A mixture of aromatic herbs and ingredients. And it really makes falling asleep easier. Each sachet is individually packaged. I recommend to buy. Very high quality tea. Using it gives both pleasure and benefit. Does not contain caffeine. The mixture of ingredients was chosen very well. If you like herbal teas, you will like this tea and will improve your sleep! "
1488,6802,2024-05-23,Really amazing,"The quality is excellent. The ingredients are very nice and effective. The taste is very acceptable to use. I use it for insomnia and my irregular sleep. It helps me. The size is better than once. The box is sealed and I liked the arrangement. Benefits: If I drink a lot of coffee, it does not get quick results. But if I do not take coffee for an hour and I fall asleep, sleeping tea, herbal mixture. Natural, useful, without caffeine. The serving is taken when needed. I do not consume it every day. I will repeat the purchase. I advise you on it for those who suffer from insomnia and difficulty sleeping. "
1489,6802,2024-05-06,,"A friend recommended this to me because I have a sleep disorder. It tastes good and is easy to drink, and I feel like I can fall asleep easily after drinking it every night. I also like Yogi Stress Relief, but this tea is just as easy to drink and I like it. The tag on the tea bag has a word related to a plant on it, which is also fun to look forward to every time."
1490,6802,2024-05-04,awesome,"After trying for two months, the quality is excellent - the ingredients are natural - the box is excellent - the size is excellent - the benefit I noticed is that it helps with sleep and I like to use it during my menstrual cycle. Excellent tea and an excellent blend without caffeine. The taste is acceptable. Use it twice a week is normal."
1491,6802,2024-04-29,Excellent!,"This tea is very excellent, and even if I talk about it a lot, it does not do it justice. This is one of the most wonderful international brands of high quality and natural ingredients. Its taste is very acceptable, and the size of the box is nice. It lasts for a nice period. The tea has very excellent benefits. It is a mixture of tea and herbs, free of harmful chemicals. And caffeine "
1492,6802,2024-04-29,For relaxing at night,"I heard that passion flower is good for relaxation, so I bought this. I like herbal tea and have tried many brands, but this herbal tea is delicious. Some brands have a taste and scent that makes you think it's really herbal, so it can be difficult to find the right one, but the blend of chamomile, passion flower, and mint is just right, and it's refreshing and delicious enough to make you want to drink a lot. It's caffeine-free, so I drink it at night to relax before going to bed.

"
1493,6802,2024-04-26,Like ,The quality is great. The taste is what I don’t know. The ingredients are normal. I expect a chamomile mixture. Use: You drink a cup of tea before bed. The size is excellent. It lasts for a month depending on use. The box is paper and the bags are also paper. The benefit is that it makes you sleep deeply. There is no caffeine.
1494,6802,2024-04-26,Chamomile tea,Quality Ingredients Taste Usage Can Size Serving Replication Quality Ingredients Taste Usage Can Size Serving Replication Quality Ingredients Taste Usage Can Size Serving Replication Quality Ingredients Taste Usage Can Size Serving Replication Quality Ingredients Taste Usage Can Size Serving Replication Quality Ingredients Taste Usage Can Size Serving Replication Quality Ingredients Taste Usage Can Size Serving Repeat Quality Ingredients Taste Usage Can Size Serving Repeat Quality Ingredients Taste Usage Can Size Serving Repeat Quality Ingredients Taste Usage Can Size Serving Replication Quality Ingredients Taste Usage Can Size Serving Benefit Tea Blend Caffeine Serving Repeat Quality Ingredients Taste Usage Package Size Benefit Tea Blend Caffeine Serving Repeat Blend Caffeine Serving Repeat 
1495,6802,2024-04-25,Prominent,"Its quality is very excellent because it is without sugar and its taste is very acceptable, but the plain flavor is better in taste. Its ingredients are excellent, its size is suitable, and its packaging is neat and easy to use. It has a sweet taste and smell as well."
1496,6802,2024-03-31,,"I haven't been able to sleep well lately, so I bought this along with other sleep supplements. It tastes like dandelion tea. About 30 minutes after drinking it, I start to feel light and feel like I should go to bed soon. I use it in combination with other supplements, but eventually I started to think that I might be able to get by with just this tea."
1497,6802,2024-03-26,My experience with Nighty  ,"The quality is excellent, the ingredients are as stated on the package, the taste is very good and I personally prefer to use it without sweeteners, 250 ml of hot water and leave the sachet for approximately 5 to 7 minutes, the size is small and can be used two to three times a week depending on cases of insomnia, the package Small, useful for cases of insomnia or relaxation after a long day. It is a herbal tea mixture without caffeine. One serving is enough for a 350 ml cup. Use can be repeated three times a week or according to health condition."
1498,6802,2024-03-11,Herbal drink to relieve stress and improve sleep,"The components in this package are 16 small paper bags containing natural herbs that relieve stress to obtain a peaceful sleep, God willing. It contains passionflower, chamomile, and other stress relievers. Soak one in boiling water and leave it for a quarter of an hour to soak, covering it. Then it is filtered and drunk in the evening without sweetening. To get the full benefit, I bought it for my mother. I hope she benefits from it and likes it. Good luck to us and you 🌺🌺💯💯👍"
1499,6802,2024-03-10,Excellent for expelling gases from the stomach and bringing sleep,"Excellent, sweet, and relaxes you with sleep. It keeps you sluggish and removes gas from the stomach. Should I try repeating the purchase? I say, yes, it is worth the taste. The smell is nice. It does not smell like an old head. The quality is high. Frankly, the ingredients are soothing. Use. A serving before bed. The size is sufficient for the price. Frankly, I don’t know whether it contains caffeine or not. A mixture of passionflower and chamomile tea. Benefits In short, the box expels gases and brings sleep "
1500,6802,2024-03-06,It rains,"So far, I tried it only once and it did not make me sleep, but when I slept, I did not want to do it. Its effect is similar to the effect of allergy medicines. Sleep becomes deep. It affects those who are insomniacs or those who sleep upside down and they adjust it.. If there is work behind you and he sits up early, I do not advise, and of course the effect differs from one person to another. Age 40."
1501,6802,2024-03-05,"It has been tried, I recommend it, and it was purchased for the second time. Take it with your eyes closed. Thank you, iHerb","It was tried, I recommend it, and it was purchased for the second time. Take it with your eyes closed, and thank you, IHerb. It was tried, I recommend it, and you bought it for the second time. Take it with your eyes closed, and thank you, IHerb. It was tried, I recommend it, and it was purchased for the second time. Take it with your eyes closed, and thank you, IHerb. "
1502,6802,2024-03-03,I like it and I loved it before going to sleep. I opened the bag and divided it into two cups. I felt it was enough ," Before going to sleep, I open the bag and divide it into two cups. I felt that it was enough to please and beautiful, like a daily ritual. It soothes my nerves. It has a herbal taste. I do not add sugar to it. I try to leave it every once in a while so that my body does not get used to it and it does not cause drowsiness. Then I strongly recommend it. "
1503,6802,2024-03-03,Rate the product ,"Wonderful 👌🏻👌🏻👌🏻👌🏻👌🏻 I liked it very much, the taste is sweet, a mixture of herbs without caffeine, the smell is beautiful, the quality is excellent, the use is easy, and the size of the box is small. I wished for more, and I took it with water for the benefit in perfuming the body and helping to Sleep and 1 class per day will be purchased again, God willing "
1504,6802,2024-02-24,quality of sleep,"I feel that the smell and taste are good. In my case, it has only been a short time since I started taking it, but I feel like the quality of my sleep has improved a little and I am sleeping soundly for longer periods of time. Since the steaming time is set for a long time, the waiting time is also a factor that calms your mind."
1505,6802,2024-02-23,,"The quality is excellent. The ingredients are sweet. It has a sweet taste, but I do not feel a clear chamomile taste. I use it before I sleep. It helps with relaxation. The size is nice. The box looks nice. The benefit is useful. Sweet tea. A sweet mixture. Caffeine. Free of caffeine. Serving: Take it once a day before bed. Repeated. Take it once a day."
1506,6802,2024-02-19,,"Very awesome, the quality is high, the ingredients are awesome, and the taste is acceptable. Sometimes I feel that it really soothes and pleases, and sometimes I don’t feel that I don’t know what the problem is with me or with it, but in general, it is not a magic solution, and do not expect it to be hypnotic like dreamwater and things that resemble it, there is nothing in it. Caffeine and I drink it as if it were literally tea and it tastes acceptable "
1507,6802,2024-02-18,👍🏼,It is an organic herbal product from the Traditional Medicinals brand. It is caffeine-free. The box contains 16 tea bags. You can drink 3 cups a day. The method of use is very easy. Just put the tea bag in the cup and pour hot water over it. You wait a few minutes and drink it. Good health. This tea is used half an hour before bed. 
1508,6802,2024-02-06,,"Passionflower is a genus of plants containing many species, but is often used to refer to a specific species, also known as ""passion flower"" or ""passionflower incarnate."" Extracts from passionflower can be used in traditional medicine to relieve stress and anxiety, and are also sometimes used as a natural sedative. However, as with any supplement, it is important to take individual considerations into account and consult your physician."
1509,6802,2024-02-03,Favorite brand,"One of my favorite brands, I always like their herbal teas. Caffeine-free, which is very important, I think. Standard use, good taste. Well-chosen ingredients that have a positive effect on the body, if they suit you, of course. Always consider individual reactions; not all herbs are suitable for everyone. You need to read for which diseases you should not take it so as not to harm the body."
1510,6802,2024-01-29,,"Passionflower is a genus of plants containing many species, but is often used to refer to a specific species, also known as ""passion flower"" or ""passionflower incarnate."" Extracts from passionflower can be used in traditional medicine to relieve stress and anxiety, and are also sometimes used as a natural sedative. However, as with any supplement, it is important to take individual considerations into account and consult with your physician."
1511,6802,2024-01-24,,"The quality is great, the ingredients are organic, the taste is delicious, and it lasts for two weeks of use. The size is suitable for one cup. The serving is once a day and the box is tightly sealed. The benefit is a mixture of herbs that helps you relax without caffeine. I will repeat the purchase. "
1512,6802,2024-01-21,,"The quality is good, the ingredients are written, the taste is good, use it before bed, the size is good. Oh God, make my children in your protection, your shelter, your security, your neighborhood, your shelter, your party, your protection, your kindness, and your protection from every devil, human being, jinn, evildoer, and envious person, and from the evil of everything you take by the forelock. Indeed, you are destined for every evil. Oh God, make them the luckiest of Your servants in this world and the hereafter, and make them among Your friends and special ones, whose light and faith strive before them, and there is no fear for them nor do they grieve."
1513,6802,2024-01-18,Excellent!,"I love it, strong tricks, I love it, strong tricks. I love it, strong tricks. I love it, strong tricks. I love it, strong tricks. I love it, strong tricks. I love it, strong tricks. I love it, strong tricks. Gentle, moisturizing, beneficial, and sweet smelling. The use is good. It has a good size and the package is large enough for more than a month. It does not cause any allergies. I use it repeatedly daily."
1514,6802,2024-01-14,,The quality is excellent. The ingredients are natural. Use for health. The tea has an excellent size and composition. The packaging is suitable. The benefits are many. Diet. Frequently buy the daily portion in moderation. It is used in a food recipe. The benefits are great. The taste is delicious.
1515,6802,2024-01-12,Deep sleep tea,Quality ✔️ Organic ingredients ✔️ The taste is awesome ✔️ Use every night The size is good The price is high.. The benefit is great It improves sleep quality ✔️ For healthy sleep Promotes good sleep at night A herbal supplement certified as an organic product by the US Department of Agriculture Certified organic product by the California Certified Organic Farmers Association Certified as a project Does not use genetically modified ingredients
1516,6802,2024-01-01,relaxation,"A wonderful tea blend for relaxation and the benefit of a deep and comfortable sleep. The quality is excellent, the ingredients are excellent, the taste is palatable. Use it half an hour before bed to enjoy a peaceful and comfortable sleep for the body. The size is excellent, the box is easy to open, the serving of tea is excellent, and it is free of caffeine. I will be sure to repeat it. His request"
1517,6802,2023-12-28,Prominent,"It is very excellent, according to what I read about it, it is considered good quality, but the important thing is that you buy something good, read a lot about it and the description that follows it, and the important thing is that it is from a reliable place and pharmacy like iHerb 💕 and its size is excellent"
1518,6802,2023-12-23,A worthy experience,"The quality of the packaging is high and the ingredients are natural with an excellent taste. It is also used for relationships and its ingredients are natural and it promotes sleep and relaxation. It can also be repeated. It is a caffeine-free tea. It is recommended to take one serving at bedtime. The packaging of the box is excellent and the benefits are great and the mixture is a good combination. The ingredients, size and size are good."
1519,6802,2023-12-22,,"I selected the tea based on reviews because I have problems falling asleep and frequently waking up in the middle of the night. It’s so good that I settled on it, brewed it immediately after receiving the parcel, and lo and behold, at 10 pm, I wanted to sleep, which I haven’t experienced for a long time. And throughout the day I was relaxed and calm. Very pleasant taste of herbal tea. Now he's my favorite"
1520,6802,2023-12-20,Great product,"For Healthy Sleep Promotes a Good Night's Sleep Herbal Supplement USDA Organic Certified Organic by California Certified Organic Farmers Non-GMO Project Verified Kosher Certified B Corporation The power of herbs to help you relax and get a good night's sleep. The taste is sweet and minty with subtle flavors of acid and spice. The Plant's Story Passionflower has been used by generations of indigenous South Americans to calm the nervous system and help relieve occasional insomnia. Our herbalists value its wild beauty and herbal power, blending it with soothing herbs like chamomile and linden flower to help you sleep easier. From field to cup, we ensure that our teas provide the benefits of these wonderful plants. To deliver high-quality harmonious teas, we source organically farmed herbs or organically collected wild herbs from ethical business partnerships, in search of medicinal plants. There is only a small portion of herbs found around the world that meet our high quality standards. The ingredients are natural"
1521,6802,2023-11-07,good,"It is being tested and used. It is easy to boil water and put the tea bag in a cup and let it steep for a while. Then I drink it. The taste is acceptable, close to chamomile, and the quality is good. It is preferable not to repeat the serving more than once a day."
1522,6802,2023-11-06,,"A wonderful tea, a mixture of natural herbs, which helps to relax before going to bed. It is very tasty and is used once before going to bed. The size fits and helps a lot with deep sleep. It is advisable to take it an hour before bedtime. Relaxing tea. Practice once before going to bed."
1523,6802,2023-10-26,Nice tea,"The quality of the product is great, and the taste is very good. I liked the ingredients: lavender, and it tastes so different. Method of use: Put the lipton and hot water in the cup and let it sit for a few minutes. Then drink it. The size of the lipton is enough for one cup. The box contains 16 tea bags. Its benefit is that it puts you in a good mood. Do not miss an amazing tea, a mixture of herbs, and I believe in it. Caffeine after drinking it repeatedly 3 times a week, for example at night, the serving is for one person..."
1524,6802,2024-10-01,Tea for sleeping dies ,"High quality, natural ingredients, normal taste, use before bed, suitable size, suitable box, benefit: calms your nerves, strange but sweet mixture, perfect dose, caffeine, no repetition, of course "
1525,6802,2024-09-16,Herbs that help with relaxation ,"The ingredients and quality are highly praised. Frankly, I haven't tried it yet, but I read that it's a tea that helps you sleep and is caffeine-free. "
1526,6802,2024-09-08,Relaxing tea for sleep ,The quality is fantastic. The ingredients are balanced. The taste is delicious. Use every other day. No. The size is suitable. The box is good. The benefit is wonderful. Healthy tea. A wonderful mixture. Caffeine-free. The serving is once every other day. No. Repeat. Yes. 
1527,6802,2024-09-07,Crazy,Its taste is very relaxing and its smell is wonderful. You feel relaxed and calm before sleeping and it makes you sleep deeply. I recommend it to you. It is very excellent. 
1528,6802,2024-07-28,Sleeping tea,"The quality is excellent, its position is excellent, and the taste is amazing. It is very easy to use. The boxes contain 16 bags. It is very useful. The size is appropriate and without caffeine. Delicious tea. I will repeat the purchase."
1529,6802,2024-06-06,sweet,"The quality is great, the ingredients are natural, it has a nice taste, it is very easy to use, and the size is suitable for a cup"
1530,6802,2024-03-17,sweet ,"It's nice, but I don't know how it feels. It's a diuretic. I couldn't sleep every bit. I smell the bathroom. I expect to use it long before bed.  "
1531,6802,2024-02-12,❤️,Wonderful wonderful wonderful wonderful wonderful wonderful wonderful wonderful wonderful wonderful wonderful wonderful wonderful wonderful wonderful wonderful wonderful wonderful wonderful wonderful wonderful wonderful wonderful wonderful wonderful wonderful wonderful wonderful wonderful wonderful wonderful
1532,6802,2024-02-12,Benefit and quality,"This is a tea blend that helps calm the gold down after a tiring day at work and helps me relax and sleep. The taste contains chamomile and mint flavors, and these ingredients help to relax."
1533,6802,2024-01-29,Great before bed ,"It is great before bed, soothes the nerves, and has an acceptable taste. The quality is great, the use is easy, and the size is acceptable compared to the price "
1534,6802,2024-01-28,Prominent,For healthy sleep Promotes a good night's sleep Caffeine-free herbal supplement USDA Organic Certified Organic by California Certified Organic Farmers Non-GMO Project Verified The power of herbs to help you relax and get a good night's sleep.
1535,6802,2024-01-10,Beautiful,"The quality is good, the ingredients are natural herbs, the size is sweet, the box is medium, there is no caffeine, the serving is one time"
1536,6802,2024-01-07,,"It is beautiful and has a sweet scent. It is useful for care, and the quality is excellent, but the size is a little small and refreshing"
1537,6802,2024-01-07,,"I loved it. I asked for it three times and my sleep becomes more comfortable. My mother suffers from insomnia and it suits her, thank God."
1538,6802,2024-01-06,,The quality is excellent. The ingredients are sweet. The taste is easy to use. The size of the box is large. The benefits are strong. What a tea blend. Caffeine. Serving. Repetition.
1539,6802,2023-12-07,Nighty tea ,"Organic tea that helps sleep and reduces insomnia. I strongly recommend trying it.. The product is wonderful, has a sweet taste, and is free of caffeine. The method of using it is easy and explained on the back of the package, and its ingredients are organic 😴👍🏼"
1540,6802,2023-12-06,,"It's normal, it tastes good to relax, but sleep is beyond my sight 😅😂 Glory be to God and praise be to Him, Glory be to God Almighty"
1541,6802,2023-11-25,Prominent,"The smell is beautiful. How to use: After bathing and wet hair, I put an amount and distribute it, but keep it away from the scalp. The size is excellent and the packaging is easy to use."
1542,6802,2023-11-16,amazing,Excellent and the taste is refreshing. Use it when you want to relax. It is free of caffeine. The package is well wrapped and the size is appropriate
1543,6802,2023-10-28,amazing,"Beautiful and very useful. I recommend buying it. Its taste is mild and not bitter. They bought it for the benefit and excellent quality. The ingredients are useful, all natural. The size is appropriate and the box is good."
1544,6802,2023-10-26,Prominent,"The quality is excellent, the ingredients are excellent, the age is excellent, the cannabis is excellent, the packaging is excellent, and the benefit is excellent"
1545,6802,2023-10-10,Beautiful,"This is the first time I took this tea. It has an acceptable, bitter taste, and the first time you will not accept it, but after a while it is normal. Its benefits are good for stomach bloating and soothing the nerves. The best thing is to take it at night before bed, and it is without sugar, but its bitterness is light. The packaging is for each pill separately, and this is the best thing so that the product is preserved and does not lose its benefits. If you find my response useful, give me a like. May God make you happy and bless you many times what you wish for 💕🤝."
1546,6802,2024-09-18,,"It smells good and improves your mood. You feel relaxed. Drink as written. Put hot water and cover it for 10-15 minutes, then drink it. You can add ice and drink it as cold as you like because it is originally for relaxation, so do whatever relaxes you the most."
1547,6802,2024-09-12,fewer dreams,"This sleeping tea bag is really a good helper to improve sleep quality! I had a drink before bed and could feel my body gradually relaxing, falling asleep easier and dreaming less. The taste of the tea is very refreshing, with a light floral aroma, without being overly strong or bitter. The packaging is beautifully designed and each tea bag is individually sealed to maintain freshness and is very convenient to use. This tea is a great choice for anyone who wants to improve their sleep quality or relax, and I will definitely be repurchasing it!"
1548,6802,2024-09-08,,"The quality is excellent and the ingredients are clean. The important thing is that it contains chamomile, which helps with relaxation and relieving stress and tension. It suited me very well. The taste is good. It is easy to use with hot water and without sugar. The benefit is greater. The size is excellent, the size of any tea as well. Its advantage is that it is caffeine-free. I will definitely try it again. I will drink it an hour before bed and at certain times during the day. 
"
