,product_id,date_posted,review_title,review_text
2357,6802,2023-12-04,,"I didn't notice that it makes me sleepy, but it is pleasant and has a sweet taste. I drink it before I sleep"
2358,6802,2023-12-04,,"An excellent product of excellent quality, the packaging size lasts for a long time. Easy to use."
2359,6802,2023-12-03,,The quality is super! The ingredients are great! The size suited me! Exactly what is needed ! You can feel the effectiveness!
2360,6802,2023-12-03,,The quality is super! The ingredients are great! The size suited me! Exactly what is needed ! You can feel the effectiveness!
2361,6802,2023-12-02,Delicious,"I really liked the tea, the taste is pleasant. Good quality. I'll take more"
2362,6802,2023-12-01,Delicious and relaxing,"Very tasty and high quality tea, good before bed, relaxing and with a good taste"
2363,6802,2023-11-30,,"A delicious and very acceptable tea, organic and caffeine-free, enough for 8 days if used in the morning and evening"
2364,6802,2023-11-30,,"The quality is great, the ingredients are great, the taste is great, the usage is great, the size is great, the box is great."
2365,6802,2023-11-30,,The quality is super! The ingredients are great! The size suited me! Exactly what is needed ! You can feel the effectiveness!
2366,6802,2023-11-30,good quality,"I liked everything, it really has the same composition, the taste is also good and the effect is present. I recommend"
2367,6802,2023-11-30,,The product has benefited my health! The size of the package lasts a long time. Easy to use.
2368,6802,2023-11-30,Prominent,It really helps with sleep. It is beautiful and effective. I recommend it and the taste is nice
2369,6802,2023-11-29,Excellent!,You can find insomnia and sleep. Drink this tea. It helps you sleep greatly
2370,6802,2023-11-29,,"Amazing mirror, useful for postpartum, helps sleep and relaxes the hands. Useful mirror"
2371,6802,2023-11-29,Relaxing tea,Convenient packaging. Delicious taste. daily use Advantages: caffeine free. Herbal mixture for relaxation and anti-stress
2372,6802,2023-11-29,,"The taste is delicious, I liked it very much. The benefit improves the mood and makes you relaxed. The size is great and sufficient"
2373,6802,2023-11-28,Prominent,"It helps improve sleep, especially when traveling. It tastes delicious, one cup is enough"
2374,6802,2023-11-26,Prominent,Wonderful and sufficient quantity. Relaxes the nerves. Wonderful and sufficient quantity. Wonderful and sufficient quantity
2375,6802,2023-11-26,,The quality is super! The ingredients are great! The size suited me! Exactly what is needed ! You can feel the effectiveness!
2376,6802,2023-11-26,the use,Very wonderful. It helps with deep sleep and relaxation. I give it 10/10. It is worth trying
2377,6802,2023-11-25,,The quality is super! The ingredients are great! The size suited me! Exactly what is needed ! You can feel the effectiveness!
2378,6802,2023-11-25,,"Great quality, excellent quantity, easy to use, nice smell, good packaging"
2379,6802,2023-11-25,Sweet before bed,It is sweet for relaxation and relaxation. Take it half an hour before and it tastes good.
2380,6802,2023-11-25,delicious,The taste is delicious and I want to repeat it. Caffeine-free with natural ingredients and no unpleasant scent. It's a relaxing tea.
2381,6802,2023-11-24,,The quality is super! The ingredients are great! The size suited me! Exactly what is needed ! You can feel the effectiveness!
2382,6802,2023-11-24,amazing,"Very nice. I love herbs in general, but everything has its own benefits"
2383,6802,2023-11-24,Sweet experience,"Excellent. It helps with sleep and relaxation. An excellent experience, but of course you must differentiate between helping to relax and sleep, and hypnotic."
2384,6802,2023-11-22,,"I only used it once and was too lazy to use it again, so I cannot give my rating."
2385,6802,2023-11-20,Relaxing tea,"I tried it, it helps to relax and induces drowsiness. Drink it while you are fond of a candle because of the atmosphere"
2386,6802,2023-11-19,,"Beautiful, easy to use, high quality, suitable size, effective composition, gentle on the stomach, delicious taste"
2387,6802,2023-11-18,Tastes good,It tastes good and has a relaxing effect. Whether you can sleep well depends on the individual.
2388,6802,2023-11-17,,The quality is super! The ingredients are great! The size suited me! Exactly what is needed ! You can feel the effectiveness!
2389,6802,2023-11-15,,The quality is super! The ingredients are great! The size suited me! Exactly what is needed ! You can feel the effectiveness!
2390,6802,2023-11-13,,"Buy it and repurchase it many times! Very helpful for improvement, well packaged, delicious, suitable for diet, has many benefits"
2391,6802,2023-11-12,sweet,Care Quality Volume Refreshes Pack Age Benefits Formula Routine Repeat Feel Volume Smell Use
2392,6802,2023-11-12,Tasty tea,With high-quality ingredients for wonderful relaxation. For every evening before going to bed. A delicious taste
2393,6802,2023-11-12,Excellent!,It is bittersweet for relaxation and calms the nerves. Its taste is acceptable and its ingredients are useful herbs
2394,6802,2023-11-12,great ,"Great taste, high quality, reasonable price, and clean ingredients. I recommend it"
2395,6802,2023-11-11,Delicious,"Great tea! Quality natural ingredients. Pleasant smell and taste. Without caffeine, you can take it at night. Quality product."
2396,6802,2023-11-11,Prominent,Mahdi mint scent and delicious taste. Benefits for relaxation. Ingredients: high quality herbs
2397,6802,2023-11-10,A delicious brew,A delicious brew that really helped me relax. I wanted something natural to relax
2398,6802,2023-11-07,amazing!,Quality Ingredients Taste Usage Size Can Benefit Tea Blend Caffeine Serving Frequency
2399,6802,2023-11-07,Class,"The taste is quite neutral. It is convenient to take with you. There is no wow effect, but it is great for sleep support"
2400,6802,2023-11-07,,The quality is super! The ingredients are great! The size suited me! The packaging is great! The additive is irreplaceable!
2401,6802,2023-11-06,Under trial,"The quality of the product is very good, making you buy it again"
2402,6802,2023-11-06,,The quality is super! The ingredients are great! The size suited me! The packaging is great! The additive is irreplaceable!
2403,6802,2023-11-05,Can improve sleep quality,Recommended by a friend and easy to learn after using it
2404,6802,2023-11-04,My opinion,"Great girls, but the box is a little small. Like if you liked my comment"
2405,6802,2023-11-03,,It was a good purchase at a low price. thank you ^__^
2406,6802,2023-11-02,,A wonderful product that has helped improve my health. The effect is noticeable after several uses.
2407,6802,2023-11-02,Prominent,"Through experience, I have tried many types of tea from them, and I expect this to be excellent"
2408,6802,2023-11-02,"Riyadh, Malaz, Al-Dubbat District",Excellent. I ordered from them an amount that I liked and was comfortable with. It became my favorite drink
2409,6802,2023-10-31,,The quality is super! The ingredients are great! The size suited me! The packaging is great! The additive is irreplaceable!
2410,6802,2023-10-30,laugh,Memdakhzmqm mbimbkhdkhn. Welcome to a million years and you are good and well.
2411,6802,2023-10-30,Prominent,For healthy sleep Promotes a good night's sleep Herbal supplement USDA Organic Certified Organic by California Certified Organic Farmers
2412,6802,2023-10-30,for breath,"I took it for praise and the experiment gives it a feeling of relaxation, which is mostly beneficial for them"
2413,6802,2023-10-30,amazing,It helps you relax and eases your menstrual cycle. The taste is normal and the quality is excellent
2414,6802,2023-10-29,Excellent!,It is sweet for those who do not sleep. It tastes and smells good and helps with sleep
2415,6802,2023-10-29,Passionflower tea,"Excellent tea, with a wonderful taste, gives comfort and relaxation, and has a successful effect that will make me buy it again"
2416,6802,2023-10-27,Herbal tea,"The quality is excellent, the size is 16 tablets, and it is okay to use it like Lipton tea"
2417,6802,2023-10-27,royal,"Very high quality tea, which is considered a soothing agent before bedtime and helps to relax 👍🏼"
2418,6802,2023-10-26,,"Herbal tea, original product with passionflower. I have not tried the product. I ordered it alone from my customers"
2419,6802,2023-10-26,Rai,"The quality is excellent and it really helps me sleep and calm down, and its taste is acceptable. I use it before bed"
2420,6802,2023-10-25,Sweet but not enough,"Sweet and tasty, but frankly it didn't give me any sleep or anything 😅"
2421,6802,2023-10-25,Prominent,"I have not used you yet, but it is an excellent experience. I always recommend it. All of their products are excellent"
2422,6802,2023-10-25,My favorite tea,"Very tasty tea, healthier than usual. A mixture of herbs that benefits the body"
2423,6802,2023-10-25,,"Buy it and repurchase it many times! Very helpful for improvement, good packaging, good taste, suitable for diet, many benefits, no skin problems"
2424,6802,2023-10-24,tea,"Excellent, the quality is very good, the taste is wonderful, and the size is appropriate. I highly recommend it"
2425,6802,2023-10-24,Great for relaxing,"The ingredients help the body to relax, its quality is excellent, it is easy to use, and the size of the box is excellent"
2426,6802,2023-10-24,calm down,I'm looking forward to having a relaxing time drinking this when I have tea with my husband in the evening.
2427,6802,2023-10-22,,"It is very nice and relaxes the nerves. I drink it before bed, and the flavor is nice and I liked it"
2428,6802,2023-10-22,amazing,You missed one of the most beautiful products. It's amazing. I honestly recommend it to you
2429,6802,2023-10-19,Gggggggmmmmmmmmmmmmmmmmmmmmmmmmmmmmmmmmmmmmmmmmmmmmmmmmmmmmmmmmmmmmmmmmmmmmmmmmmmmmmmmmmmmmmmmmmm for sleep,"If you want a deep sleep, take it one time at a time, and I will ask for a second and third time."
2430,6802,2023-10-19,sweet,"Girls, take a breath of Panadol, it's amazing, drink it two hours before bed, the taste is acceptable and the smell is nice."
2431,6802,2023-10-16,amazing,"Its ingredients are high-quality, organic, and caffeine-free. The taste is sweet and acceptable. Its benefits are soothing to the nerves and help to relax at night. I recommend it to reduce stress and treat insomnia 👍🏼"
2432,6802,2023-10-08,"Excellent, wonderful","The quality, ingredients, taste, and use are nothing short of amazing, as well as the number in the box. It is a very comfortable combination and is recommended"
2433,6802,2023-10-06,Prominent,This is the first time I ordered it and I bought it 2 times. It has a pleasant taste and good benefits. It brings relaxation. I advise you on it.
2434,6802,2023-09-28,Evening herbal tea,"A packet of caffeine-free herbal blend that helps you sleep peacefully. Relax. The package is suitable and beneficial. The size is suitable for each packet for a cup of tea, and the taste is acceptable."
2435,6802,2023-09-26,amazing,"It is a wonderful tea that calms the body. The ingredients are beneficial to the body. Frankly, it is a wonderful tea that does not contain caffeine"
2436,6802,2023-09-05,,"The ingredients are natural herbs, the taste is delicious, the box contains 16 bags, and the use is easy once. Tea tastes delicious and relaxing for the nerves. There is no caffeine."
2437,6802,2023-08-01,,An effective sedative. I take it before bed to relax. The taste is very acceptable. The quality is excellent. The ingredients are herbs. Easy to use and without caffeine. I liked the phrases on each bag. A different phrase.
2438,6802,2023-07-19,,"I tried it sweet, its quantity is sweet, its smell is normal, and its size is good, and I will order it again, but the second type"
2439,6802,2023-07-18,,"The quality is great, the ingredients are pleasant, the taste is light, the use of hot water is small, the size of the box is small, the benefit is relaxing, useful tea, caffeine, there is no repetition"
2440,6802,2023-07-18,,The quality is excellent and the size is good. The taste is sweet and delicious. The ingredients are lavender. The use is very easy. It is preferable before bedtime. It helps to relax. The box is airtight. Relaxing. Delicious tea that does not contain caffeine.
2441,6802,2023-07-02,,"An organic product, high quality, and original natural ingredients. It contains passion flower. It helps relieve insomnia and healthy, calm sleep. The taste is acceptable. Use at the time of necessity and after consulting a doctor. The size is excellent. Natural and caffeine free"
2442,6802,2023-05-18,Excellent!,"Do not underestimate the moment of seeking forgiveness, even for two seconds.. You do not know ~ how much good you will be provided with!? How many afflictions will be lifted from you!? I ask forgiveness from Allah and repent to Him"
2443,6802,2023-05-17,excellent! very,It helps to relax 👏🏻 and it tastes sweet without sugar and I drink it hot and before bed I was suffering from insomnia and then it eased thank God
2444,6802,2023-05-09,,"Chamomile tea is amazing. By God, the taste of chamomile is clear. Its quality is excellent. The ingredients are easy, but mixed with hot water. Its use relaxes the nerves and calms the tension without caffeine."
2445,6802,2023-04-30,,"It is very beautiful, you feel relaxed, and it calms the nerves. I revive this tea at dinner time, after everything, relaxation and a healthy drink. I recommend it 🥹❤️ I love it"
2446,6802,2023-04-29,,"I took it for my mother as a tea to drink before bedtime, and the benefit was found. The mixture of ingredients is herbal, I think it is caffeine-free."
2447,6802,2023-03-25,,"The quality is excellent, as well as the taste. The use of what I have tried is excellent. The benefit from the comments is excellent"
2448,6802,2023-03-06,,"An excellent sedative and relaxing for the nerves, taken an hour or an hour and a half before bedtime. I like it, it tastes acceptable"
2449,6802,2023-02-11,,"High quality, suitable size, delicious ingredients, excellent taste, easy to use, plastic packaging, high benefit, excellent composition, delicious tea, the box contains 16 sachets, a delicious mixture."
2450,6802,2022-12-27,,"Excellent. I took it for praise. The quality, size, and packaging are sweet. The taste is acceptable. I don’t feel that it is sleeping, but it is sweet as tea"
2451,6802,2022-12-14,,"In the box 15 sachets, an acceptable and sweet taste, a mixture of herbs and flowers, but the most overpowering flavor is chamomile. It makes your sleep deep, but it does not bring sleep."
2452,6802,2022-11-30,,"Very excellent, the quality is very excellent, the size is very suitable, the texture is very good, the benefit is excellent, the smell is very good"
2453,6802,2022-11-27,,"Under the experiment, it tastes sweet and is acceptable to use. The size will continue. A lot of benefit. Helps sleep. The tea is comfortable, beautiful and wonderful. The portion is twice a day."
2454,6802,2022-11-18,,"I tried it for a while, it helps me relax, but it doesn't sleep, but it makes me relax and go to sleep faster."
2455,6802,2022-11-10,Nice,"I swear to God, it is awesome. Relax. I drink it before bed. It helps me sleep. Just cut it and its greed resembles chamomile"
2456,6802,2022-10-27,,"Great tea for the night! Amazing composition! Soothes and relaxes. Pleasant, slightly minty taste. And organic herbs. The most at the end of the day before going to bed) I recommend. 🥰🌹"
2457,6802,2022-10-26,,"The quality is excellent, the ingredients are tea, the taste is sweet, the size is suitable, the portion is 16, it is suitable for its price"
2458,6802,2023-07-05,,"Quality / good ingredients / mint and some herbs taste / I did not put sugar, it may be good with sugar Use / it is said to sleep and relax Size / suitable for the box / like the picture. It is sweet, it comes in an envelope of each bag. The benefit / I did not feel a difference with me. Normal tea / Yes, a mixture / Normal caffeine / No serving / From a cup to 2 per day, repeat / No"
2459,6802,2023-05-10,,"The benefit and use are of high quality, the smell is beautiful, and the size is commensurate with age. The packaging is unparalleled. The benefit is much from it. The quantity is plentiful, the dose of it, and the ingredients give immunity against the sun. The bones of the taste."
2460,6802,2023-03-25,,"The quality and ingredients are good, the taste is very palatable, and it is used to help sleep. The size of the box is excellent. The benefit is medium. Tea is a mixture of herbs that does not contain caffeine. The portion is a sachet an hour before bedtime, and repeat as needed."
2461,6802,2022-10-09,,"SECOND ORDER How to use To enjoy the product pour 8 ounces of freshly boiled water over one tea bag. Cover the cup and leave for 10-15 minutes. The tea bag is pressed to ensure the best concentration of the product. Enjoy 2-3 cups at the end of the day, at least one cup 30 minutes before bedtime. For adults only. The taste is beautiful, the size and the packaging and quality are good"
2462,6802,2022-08-29,,Very beautiful and has strong praise. A customer request is very beautiful I like it 😍😍😍 A customer request that smells like it is very easy to use and its quality is suitable for them The size is suitable and the age is average The shape of the package is beautiful and the benefit is noticeable and the composition is very beautiful and the coverage is also the same The color is suitable and the texture is soft No Concerns Long Lasting Care Refreshes Benefits Routine Relaxes Feel Repeat Quantity Folic Acid Energy Ingredients
2463,6802,2023-09-12,,"The quality and ingredients are organic and excellent. The common passion flower is one of the herbs used in folk medicine since ancient times. The indigenous people of America used the passion flower to treat a variety of conditions, including boils, wounds, earaches, and liver problems. In Europe, people used the passion flower to treat anxiety and anxiety. . The taste is good and it is used as tea"
2464,6802,2023-08-17,,"The request was for a friend. I do not know the quality, the ingredients, the taste, the use, the size, or the box. I do not know the benefit. All I know is that Mix tea does not contain caffeine. The portion does not know and I do not know whether you will repeat the order."
2465,6802,2023-07-27,,"Very beautiful, at times sweet, girls, I advise you about it, it is very beautiful, at times sweet, girls, I advise you about it, it is very beautiful, at times sweet, girls, I advise you about it, it is very beautiful, at times sweet, girls, I advise you about it, it is very beautiful, at times sweet, girls, I advise you about it, it is very beautiful, at times sweet, girls, I advise you about it, it is very beautiful A sweet time, girls, I recommend it to you, it is very beautiful. A sweet time, girls, I recommend it to you"
2466,6802,2023-07-08,,"A calming tea, a mixture of natural ingredients and also organic, the taste is palatable. The size of the bag is small for the price. I wish the box would be more useful. I noticed that it relieves fatigue and tension and helps calm and relax. I took it for praise and it is really good."
2467,6802,2023-06-17,,"This drink I bought during my postmenopausal period because I have some anxiety when I sleep, so I drink it about an hour before my bedtime. It brings you drowsiness and a deep sleep. Dr. Hind praised it. The ingredients are fresh herbs, the taste is acceptable, and it has sweetness to use when needed."
2468,6802,2023-05-27,,"It is good, but I did not feel any drowsiness when I drank it. It tastes nice and easy to use. The box is small, its size is small. It contains sachets inside. The benefit is for relaxation and aiding sleep. Free of caffeine. One sachet per day with a cup of boiled water"
2469,6802,2023-05-24,,"I love teas from this brand. I bought different ones. This tea is my love. The package contains 16 individual sachets. Tea without caffeine. The taste and aroma are wonderful. A cup of tea at night - a calm and deep sleep as a result. The composition contains passionflower, which soothes well."
2470,6802,2023-05-12,,"I tried drinking it in the evening, but there is no direct effect on falling asleep. However, there is no caffeine, and the ingredients are good, so I enjoy drinking it on a regular basis. Because it is individually wrapped, it is easy to carry, and I carry it personally and enjoy well-being."
2471,6802,2023-04-01,,"Every time I order it, is there a clear result? I don’t know, but any herbal tea tastes good. I love it because I like to drink a hot herbal drink before bed."
2472,6802,2023-03-28,,"The quality is excellent, the ingredients are wonderful, the taste is acceptable, the use is easy and smooth, the size is suitable, the box is wonderful, the benefit is relaxation before bed, sleeping deeply, a wonderful tea, an excellent mixture without caffeine, the portion is suitable, I did not repeat the purchase"
2473,6802,2023-03-10,,"The tea has a nice aroma and is very relaxing. Licorice is often blended in teas for good sleep, but I don't like licorice, so I'm very happy with this blend. It is a very easy-to-drink tea with a refreshing aroma and taste."
2474,6802,2022-12-21,,Very excellent. I recommend it and the quality of the packaging is excellent. Thank you for the attention. The ingredients are excellent. The taste is very good and the taste is wonderful. Thank you. Very comfortable. The product is very effective and healthy.
2475,6802,2022-11-03,,Quality / good ingredients / good taste / acceptable to use / easy just add tea leaves to a cup of boiling water and try to close the cup from above the size / normal the box is normal carton The benefit / good tea / its taste is acceptable and helps sleep Repeat / I can repeat it
2476,6802,2024-06-06,,"Good, God bless, it does not cause allergies. I liked it, God willing, and the color is beautiful "
2477,6802,2024-10-12,Good,"It's nice and calms the nerves. I didn't feel that it made me sleep, but it's more of a sedative. "
2478,6802,2024-10-07,,"Quality Good Ingredients Organic Tea Blend Chamomile Flavor Caffeine Free Quantity Size Box 16 Bags Scent & Taste Benefit

"
2479,6802,2024-10-04,,Quality Ingredients Taste Usage Size Packaging Box Benefit Tea Blend Caffeine Serving Frequency
2480,6802,2024-09-24,Mumtaz ,"For the second time, I repurchase chamomile. It is well-known for its ability to calm tension and help with sleep. "
2481,6802,2024-09-18,,Quality Ingredients Taste Usage Size Can Benefit Tea Blend Caffeine Serving 
2482,6802,2024-09-13,,"Excellent herbs for relieving stress, helping you sleep, and it tastes delicious. "
2483,6802,2024-09-03,Good,"Frankly, I decided to take it because my sleep has been very bad lately, so I can't judge it at first. "
2484,6802,2024-09-01,Good,It is a nerve relaxant and a sedative. I cannot do without it because of my busy schedule. May God help me.
2485,6802,2024-08-27,,"Organic ingredients, safe to use, effective in helping you sleep"
2486,6802,2024-08-17,delicious,I think this is the best tasting of the brand.
2487,6802,2024-08-14,Labas to,"The product is okay before bed. O God, bless and grant peace to our Prophet Muhammad. 
"
2488,6802,2024-08-11,,It is sweet and helps you sleep. All the ingredients are really good herbs and it tastes good.
2489,6802,2024-07-31,Before going to bed,I drink it with honey before going to bed. It helps me relax.
2490,6802,2024-07-05,,"A soothing tea that helps you sleep, made of chamomile and caffeine-free. The benefits, taste and size are excellent"
2491,6802,2024-06-17,,"The taste is acceptable, but the sleep aid effect is not much felt"
2492,6802,2024-06-15,,"The quality is excellent Ingredients Tea Taste Usage Relaxing tea The size is appropriate 
"
2493,6802,2024-06-15,,I feel like I can finally sleep. It's delicious.
2494,6802,2024-06-15,,"This taste is not to everyone's taste, but it makes you feel good after drinking it."
2495,6802,2024-06-05,taste ,"It is bitter, the taste is very suitable, and I recommend it. It helps calm the nerves "
2496,6802,2024-06-03,Good,"I used it twice because I suffer from insomnia. Its ingredients are good, but I did not feel that I benefited from it "
2497,6802,2024-05-30,,Helps you relax and get a good night's sleep. It helps people with insomnia improve sleep 
2498,6802,2024-05-26,,"The taste is acceptable, the quality is excellent, and the size is beautiful. Tea ingredients are herbal "
2499,6802,2024-05-25,,A delicious tea that gives you relaxation and calm. Its ingredients are excellent and the box lasts for a long time 
2500,6802,2024-05-19,,"Its taste is delicious and its ingredients are pleasant, and the sleep after it is comfortable. I will buy it again"
2501,6802,2024-05-14,Prominent,Wonderful wonderful wonderful wonderful wonderful wonderful wonderful wonderful wonderful wonderful wonderful wonderful wonderful wonderful wonderful
2502,6802,2024-05-14,,"Awesome for relaxation and sleep. The company is beautiful and I use it all the time, considering its quantity is small for its price "
2503,6802,2024-05-11,,"As an experiment, I read about it in a place and wanted to try it, God willing "
2504,6802,2024-04-28,The pleasant scent of chamomile,It has a nice chamomile scent ♡ I find it very useful as I can drink it before going to bed at night.
2505,6802,2024-04-26,,"The product is wonderful, the quantity is large, and the smell is acceptable. I recommend it for purchase. Thank you"
2506,6802,2024-04-23,"Sweet and calm, you feel sleepy and sometimes sleepy ","It sleeps, but not better than melatonin. This is my opinion"
2507,6802,2024-04-22,,"There is no smell, easy to use, good quality, long-lasting cup "
