,product_id,date_posted,review_title,review_text
0,6802,2023-12-04,Great!,"I have trusted Traditional Medicinals for well over a decade now because they always use high quality ingredients. Taste is great and I always like to have some of these on hand as they are very beneficial, especially when traveling or routine is disrupted. This tea is naturally caffeine free and a lively blend of herbs. "
1,6802,2023-10-19,Nighty night ,I advise all customers to buy especially if you can’t sleep.😴 so good 🥰🥰🥰🥰🥰advice all take this product but you need to buy one more than one because it not enough one packet I try a lot of products but not from I herb this was first time to take this product from them but I satisfied with this product I will buy again 
2,6802,2023-11-12,So Sleepy,This tea tastes great and actually made me sleepy! So many night time teas don’t actually do anything thing but this one put me out like a light. The ingredients are powerful and traditional medicinals makes super quality products. I use this when I’ve had a stressful day and need some help winding down. Definitely report
3,6802,2024-10-15,Great Traditional Medicinals Tea ,"I love this tea and use it approximately 3-5 nights a week. It really does help lull you to sleep, and it tastes great (no sweetener or other additives required, but it is enjoyable with a bit of milk). I gravitated towards this tea primarily for its inclusion of passionflower, which I have heard can enhance dreams. I do find that my dream recall is increased when I use this product, and my dreams do often seem to be more vivid. 10/10 recommend. "
4,6802,2024-09-03,Soothing and Relaxing Herbal Tea for a Good Night’s Sleep,"Traditional Medicinals Organic Nighty Night Tea with Chamomile and Passionflower has become a bedtime favorite for my wife. The blend of chamomile, passionflower, and other calming herbs creates a soothing and pleasant taste that helps her unwind after a long day. It’s caffeine-free, making it perfect for nighttime, and she finds it helps her relax and prepare for a restful sleep. The individually wrapped tea bags keep the tea fresh and aromatic. Highly recommended for anyone looking for a natural way to support relaxation and a good night’s sleep!"
5,6802,2024-08-29,One of My Favortes!  ,"This is a super-nice formula for nights when one does not require the extra impact of Valerian root.  I really enjoy the fragrance of this tea. It is one of the best relaxing and sleep aid herbal formulas i have seen and it has the usual; high quality i expect with teas from this brand! it contains several well know and very effective herbs for promoting relaxation and rest and if that were not delightful enough, it has a propriety blend added that creates a flavor and fragrance that i find really appeals to me! I hope to always keep this one on hand and would certainly buy it again!"
6,6802,2024-08-27,,"Very good product, I recommend to buy it, I ordered a this product from Iherb before, and I was amazed at how quickly it arrived. The packaging was secure, ensuring the item was undamaged. The customer service was exceptional, as they kept me updated throughout the entire process. I had a question about the product, and their support team responded promptly and professionally. Overall, my experience with [Store Name] was outstanding, and I can’t wait for my next purchase"
7,6802,2024-08-26,A great nightime tea,This is a great nighttime tea if you are looking for something calming during the evening. It is made with the best herbs for sleep. It does have some chamomile along with other ingredients. I have been enjoying this cup of tea every other evening lately. I generally add a bit of raw honey to sweeten it before I drink it. I would highly recommend this tea to you.
8,6802,2024-08-13,Smells good and taste great!,"I’m a big fan of Traditional Medicinal herbal teas. Their blends are of good quality, lovely and really love the floral scent of this tea. Caffeine free and you can take it every evening once before bed. One tea bag is good for a mug or small tea pot. "
9,6802,2024-06-26,Tasty herbal tea,"I like this tea, for me the herbs blend is very tasty. I drink it whenever I want to calm down, sometimes before bed - it is caffeine free. Quality ingredients give great taste. Each bag is in separate package and has a small wisdom phrase inside. I love those and this is a great benefit!"
10,6802,2024-06-11,Good,The quality is great the ingredient is perfect the taste is excellent I use it when needed the size is average the package arrived safely and quickly the benefit is fine the tea is acceptable the blend is good the caffeine is average the serving is enough the frequency of use depends on the  sleeping need
11,6802,2024-05-03,Love it!,"The quality of the ingredients is top-notch, featuring chamomile and passionflower, which are both known for their calming properties. The tea blend tastes wonderful—very soothing and perfectly balanced, making it a great choice for winding down at the end of the day. Each tea bag is individually wrapped, which helps maintain freshness and makes it easy to take on the go. The package size is also convenient, containing 16 tea bags. I've found the benefits of drinking this tea before bed to be quite significant; it helps me relax and enjoy a better night's sleep. "
12,6802,2024-04-26,Great tea.,"If herbal tea is not your thing you may not like this one, but I highly recommend it for the herbal tea lovers.
I love the taste and, especially, addition of the passionflower. 
I am not sure but I feel like this tea helps me to calm down before sleep and probably improves my sleep quality. "
13,6802,2024-03-19,"Quality ingredients, great taste","I frequently drink this caffeine-free tea to sleep at night, and you can control the strength by how long you steep it. It's made of a blend of herbs with many health benefits. The only thing I don't like about the product is the cheap tea bags. "
14,6802,2024-02-25,great,"Generations of native South Americans have used passionflower to soothe the nervous system and help relive occasional sleeplessness. Our herbalists appreciate both its wild beauty and its herbal power, blending it with calming herbs like chamomile and linden flower to help you sleep easy. good quality. i like this brand."
15,6802,2024-02-24,,"This is the second time I've ordered this tea. I added it to my evening routine in order to help my body prepare for the nighttime. As someone who's suffered from insomnia for a while, I find this helpful to relax. It also tastes good (if you like herbal taste). "
16,6802,2024-02-23,great,"Recently tried a new tea, and it's become a daily ritual. 

The blend offers a perfect balance of flavors, providing a soothing and aromatic experience. The tea leaves are of high quality, resulting in a smooth and satisfying brew without any bitterness. 
The packaging is practical, ensuring freshness. 
Flavor and taste are unbelievable!
For tea enthusiasts, exploring different blends outside of conventional options can be a delightful and rewarding experience."
17,6802,2024-02-14,Love the brand and feels that it helps,Firstly - I love this brand. I've used a few of their teas and they all seem to benefit in the area that it claims. So when I had difficulty falling asleep I used this for a few nights and always good to know I have it in hand if needed. I really feel that the quality of this product is high.
18,6802,2024-02-09,"Title: ""Traditional Medicinals Organic Nighty Night: Relax and Unwind with Soothing Herbal Tea""","
Review: ""Traditional Medicinals Organic Nighty Night tea is a caffeine-free herbal blend designed to promote relaxation and restful sleep. Each box contains 16 tea bags, providing a comforting and soothing experience before bedtime.

Crafted with the finest organic ingredients, this tea features a blend of chamomile and passionflower. Chamomile has long been known for its calming properties, while passionflower helps to ease tension and promote tranquility.

Traditional Medicinals takes pride in sourcing high-quality organic herbs, ensuring a pure and flavorful tea experience. The tea bags are made from unbleached fibers, preserving the natural integrity of the herbs.

To enjoy a cup of Traditional Medicinals Organic Nighty Night tea, simply steep a tea bag in hot water for 5-10 minutes. Take a moment to savor the gentle floral aroma and sip your way to a peaceful state of mind.

Incorporate Traditional Medicinals Organic Nighty Night tea into your evening routine to unwind and prepare for a restful night's sleep. Experience the soothing effects of chamomile and passionflower, and wake up feeling refreshed and rejuvenated."""
19,6802,2024-01-29,,It is good tea. I love it and it tastes good and it benefits the body. The size is good as well and the packaging is good. I will definitely buy it again and it contains no caffeine so it is good to drink it as night. If arrive early also. 
20,6802,2024-01-06,,So good quality anti age Good moisturizer textured good with out makeup and good for sensitive skin i like how packaging quality good i use every night size very big Good moisturizer textured good with out makeup and good for sensitive skin i like how packaging quality good i use every night size very big age care smell taste yummy good for health improvement helth
21,6802,2023-12-31,Nighty night! ,Great quality of ingredient. Good packaging size. taste is OK. I like that it is organic and caffeine free which makes me less worried about the serving frequency. I had to use this tea blend several times before I can see benefits. I would definitely recommend trying it first before any other pills. 
22,6802,2023-12-01,Tea,this tea helped me with my sleep and stomach i can sleep very well the caffeine in the tea doesnt affect on your sleep i serve it all alone i dont blend it with anything it has great benefits the packaging is great and the size is huge i use it when i have bad stomachache and i cant sleep it tastes very normal to me
23,6802,2023-10-29,Great tea for sleep,"This tea provides a delightful way to conclude the day. It has a calming effect on my mind, and I'm convinced it enhances the quality of my sleep. The taste is both delicious and soothing, devoid of any bitterness and characterized by a herbal-floral blend featuring chamomile, mint, and a subtle hint of lemon."
24,6802,2023-10-22,,"Crafted from meticulously selected organic ingredients, this tea boasts a blend of high-quality components renowned for their soothing and tranquillizing qualities. Each tea bag is thoughtfully wrapped individually, ensuring convenience for brewing a cup at any time. Not only does this tea deliver a delightful taste, but it also effectively aids in promoting restfulness. What's more, its responsible sourcing further enhances its appeal. If you desire a peaceful and rejuvenating sleep, this tea is an excellent choice."
25,6802,2024-06-09,This,Very good product good size used for pigment good package and quality very benefit good feel and composition for sensitive skin gentle and dry quickly no scent used daily gentle care frequent ease personal routine 
26,6802,2024-09-02,,Repurchase a lot of time quality is very good love the ingredients can’t really find from anywhere else size is perfect for every night use benefit is good and taste is very acceptable love this tea blend a lot packaging is fine and serving is just fit no caffeine is my favourite
27,6802,2024-03-23,delicious tea,"Delicious taste and has a nice herbal aroma. No caffeine, natural ingredients, high quality herbal tea. The only downside is that it makes me pee a lot. So make sure to drink a while (2-3 hours) before sleep. It is not as powerful as the valerian one, but good for days when I just want to relax, and don't need a strong blend.  I drink it a few times a week."
28,6802,2024-02-03,Good product,"Traditional Medicinals Organic Nighty Night Tea offers a convenient and caffeine-free herbal blend, with the pleasant addition of passionflower for a calming touch. The individually wrapped tea bags make it easy to incorporate into a nightly routine. While the tea has a delightful flavor and has provided some soothing nights, its effectiveness in promoting sleep was more neutral for me. Results may vary, so it's worth a try to see if it aligns with individual preferences."
29,6802,2024-01-11,Help with good sleep,"This night tea offers a calming blend of herbs, perfect for winding down before bedtime. The soothing aroma and gentle flavor make it a delightful part of any evening routine. Its caffeine-free composition ensures a restful sleep without compromising on taste. A comforting choice for those seeking a peaceful nightcap."
30,6802,2023-12-12,Nice tasting tea for bedtime ,"This is a very smooth, pleasant tasting tea.  It mainly tastes of lavender and chamomile, with some other notes.  I drink this before bed sometimes now that it’s winter.  I can’t say that the ingredients have improved my sleep, but I find the experience of drinking it to be a soothing ritual.  "
31,6802,2023-12-01,Great Tasting tea and it helps with sleep,I enjoy the taste of this tea at night before I go to bed. It helps me relax and go to sleep MOST of the time and the price is right. No caffeine. I will try the same tea next time but with Valerian. This one is the original Nighty Night with passionflower
32,6802,2023-10-28,Good flavor,Love the taste! It does relax me. I don’t drink it every night but does seam to help me fall asleep when I do drink it. I think I need to use it a little longer to determine if it will keep working. But I would drink it regardless because I like it!
33,6802,2024-10-08,AMAZINGLY EFFICIENT AND TASTY! ,"Organic passionflower herb	360 mg	†
Organic chamomile flower	255 mg	†
Organic linden flower	135 mg	†
Organic catnip herb	45 mg	†
Organic hop strobile	30 mg	†
Proprietary Blend:	675 mg	 
Organic spearmint leaf	 	†
Organic lemon verbena leaf	 	†
Organic lemon peel	 	†
Organic West Indian lemongrass leaf"
34,6802,2024-09-28,,"The quality is fine. The ingredients are decent. The size is fine.
The dosage is fine. The benefit is decent. Good for the skin.
The package was fine. It has tocopherol, antioxidant. It tastes decent. I like it in overall. I might buy it again soon."
35,6802,2024-09-27,Great,"All very good thank you Iherb
Use easy
Smell good
Care good
Quality good
Size good
Package good
Benefit good
Composition good
Routine good
Personal good
Feel good
Taste good
Ingredients good
Recipe okay
Diet okay
Serving okay frequency"
36,6802,2024-09-26,,I love it. Ingredients are good. The taste is good. I love drinking this at night. It’s caffeine free so it’s really good.
37,6802,2024-09-20,Taste is amazing ,"I love how it smells when it opens the box, and the taste is amazing! The packaging is intact and easy to use, the quality is high, ingredients seem pure, I would recommend it!"
38,6802,2024-09-11,veey good tea before sleep,"very good quality with clear ingredients and decent size ; sealed package 
instructions and serving is labeled in the back and It has benefits especially before sleep , acceptable taste"
39,6802,2024-09-02,,"I like to use herbs to help with any sleep issues, and this tea is tasty and helps with a quality nights sleep. The ingredients are a good combination. It's caffeine free obviously. I use two tea bags for a stronger flavor."
40,6802,2024-08-26,Favourite!,This tea is one of my favourites and has a double whammy of Chamomile and Passionflower which really helps me to sleep. Its calming and tastes great too.
41,6802,2024-08-13,winding down before bed,This herbal tea is perfect for winding down before bed. The chamomile and passionflower blend helps me relax and fall asleep. The flavor is soothing and mild.
42,6802,2024-08-11,Best gift,"Gave this to my colleague who was going through a challenging week, she said it soothes her stress and sleeps better. She purchased herself and recommended it to her friends as well"
43,6802,2024-08-09,Very calming,It’s a really good tea and it tastes really nice and it makes you sleep well. The sizes great the qualities amazing it has a lot of benefits. The ingredients are very calm calming.
44,6802,2024-08-07,My cup of tea,I love this brand. I bought their spearmint tea before & it really helps my period pain & stomachache. Bought chamomile for better sleep. Hope it works well on me
45,6802,2024-07-31,Wonderful taste and sweet dreams!,"The relaxing swirl of herbs blended in this tea begins to make itself noticed as soon as you add the hot water. I've tried various alternatives, but this one not only tastes great, it also has the desired effect."
46,6802,2024-07-26,Great!,"High-quality organic and natural ingredients! this is very good! 
Very tasty and relaxing, 
many health benefits.
I love all of this company's tea bags."
47,6802,2024-07-15,Soothing Evening Ritual,"The Organic Nighty Night tea blends chamomile and passionflower for a calming experience. Perfect for winding down, this caffeine-free tea is gentle and soothing, making it an excellent choice before bedtime. The 16 individually wrapped tea bags ensure freshness and convenience.
Must have for everyday"
48,6802,2024-06-27,Always ,Love it! I just love it and always buy stock from it! It tastes really good and has good effect due to its ingredients. Good quality and i ues it when I’m sleep deprived 
49,6802,2024-06-25,Nice,‎‏ scent . How to use. Age package composition coverage color texture concern‏ Taste• quality • ingredient size dosage • benefit the smell and ‏ Taste• quality • ingredient size dosage • benefit very nice snack eat diet serving care routine personal feel frequency flavor sensitive moisturize gentle
50,6802,2024-06-24,,"You have to get lysine from food or supplements. Amino acids like lysine are the building blocks of protein. Lysine is important for proper growth, and it plays an essential role in the production of carnitine, a nutrient responsible for converting fatty acids into energy and helping lower cholesterol."
51,6802,2024-06-23,Really amazing,"The scent is excellent, brings relaxation and peaceful sleep. It is preferable to use it at least half an hour before bed. I strongly recommend it."
52,6802,2024-06-17,Amazing ,Good quality very good tea can’t sleep without it. I use it every day. Good packaging good size. I love the green green gradients taste good have a lot of benefits. Good ingredients. I can blend it with lemon. Good frequency no caffeine.
53,6802,2024-06-14,Прекрасно!,"Thank you very much for this product, it suited me, I like the packaging, comfortable and stylish, I will order more of these products, and recommend them to all my friends and relatives! good!!"
54,6802,2024-06-05,Прекрасно!,"Thank you very much for this product, it suited me, I like the packaging, comfortable and stylish, I will order more of these products, and recommend them to all my friends and relatives! good!!
"
55,6802,2024-06-04,Love it,Does not make me as sleepy and the valarian one but tastes much nicer and is really relaxing a and feels good on my digestion. Can get around 3 cups with one bag. Have one every night. Reordering.
56,6802,2024-06-03,Great quality and tasty tea,This is not the first purchase from this brand. It tastes great and though it says nighty night I sometimes serve it during the day when I need to calm down.
57,6802,2024-05-16,Calming,I like having this tea before bed.  Very calming and helps me sleep better.  I just ordered the one with Valerian and Lemon Balm because I liked this one so much.  I don't like sweet teas and this one is not sweet but has a pleasant mild taste.
58,6802,2024-05-14,,great blend of tea for nightly drink before sleep. chamomile and passionflower are quality ingredients for the purpose. the taste is ok. benefit for those who need a soothing tea at night to unwind.
59,6802,2024-05-14,,Wonderful. The quality is excellent. Delivered quickly. The product is just great. I recommend to all my friends. I enjoy shopping on the site. Very well.
60,6802,2024-04-29,Very good.,Tastes good and the quality is also good. I drink it 30-40mins before going to bed and it usually makes me very relaxed and have a nice sleep. 
61,6802,2024-04-04,,I have bought this a few this.I like this taste and helps me sleep. I prefer this to the other one with a valerian blend. 
62,6802,2024-04-03,Sleepy tea,This tea is a soothing blend of herbs that help me drift off to sleep in the evening. I leave the teabag in my cup and the strength intensifies but it’s never bitter or unpleasant. Neatly packaged. 
63,6802,2024-03-30,very good for sleep,"high quality tea and it tastes good 
it helps sleep easily
1 serving prior sleep by 1-2 hour will help you sleep 
great ingredients
get one pack you can't go wrong with traditional medicinals products "
64,6802,2024-03-24,Love ,"Great quality
Good ingredients 
No fillers
Tastes good 
Love the brand 
I feel it helps me to relax and have a good nights sleep. Have and will continue to buy.

 
"
65,6802,2024-03-22,,I saw a lot of positive reviews about this brand.  I used before and equality is really nice.  I will try new tea from this brand future too
66,6802,2024-03-21, Relax and Unwind with Traditional Medicinals Organic Nighty Night Tea,"Traditional Medicinals Organic Nighty Night Tea has become my trusted companion for unwinding after a long day and preparing for a restful night's sleep. Crafted with care using organic chamomile and passionflower, this caffeine-free herbal blend offers a soothing and calming experience that promotes relaxation and tranquility.

What sets this tea apart is its thoughtful combination of herbs, each chosen for its gentle yet effective calming properties. Chamomile has long been celebrated for its ability to promote relaxation and alleviate stress, while passionflower adds a layer of tranquility, helping to quiet the mind and prepare the body for sleep.

The quality of the ingredients is evident from the moment you open the box. The aroma of the herbs is delicate yet invigorating, setting the stage for a truly delightful tea-drinking experience. I appreciate knowing that I'm sipping on a blend that is free from artificial additives or preservatives, allowing me to enjoy the pure and natural flavors of the herbs.

Not only does this tea taste wonderful, but it also delivers on its promise of promoting restful sleep. I've found that brewing a cup of Traditional Medicinals Nighty Night Tea before bedtime helps me unwind and relax, making it easier to drift off into a peaceful slumber. It has become an indispensable part of my nighttime routine, helping me wake up feeling refreshed and rejuvenated each morning.

I also appreciate the convenience of the individually wrapped tea bags, making it easy to enjoy a cup of this calming blend wherever I go. Whether I'm at home or traveling, I can always count on Traditional Medicinals to provide a moment of tranquility whenever I need it most.

In conclusion, I highly recommend Traditional Medicinals Organic Nighty Night Tea to anyone seeking a natural and effective way to promote relaxation and support a restful night's sleep. With its carefully selected blend of organic herbs and soothing aroma, this tea is sure to become a cherished part of your daily wellness routine.




"
67,6802,2024-03-21,Прекрасно!,"Thank you very much for this product, it suited me, I like the packaging, comfortable and stylish, I will order more of these products, and recommend them to all my friends and relatives! good!!
"
68,6802,2024-03-21,Прекрасно!,"Thank you very much for this product, it suited me, I like the packaging, comfortable and stylish, I will order more of these products, and recommend them to all my friends and relatives! good!!
"
69,6802,2024-03-17,Herbal Tea for Health ,"Herbal tea, also known as herbal infusion or tisane, is a beverage made from the infusion of herbs, spices, flowers, or other plant materials in hot water. It has been consumed for centuries for its various health benefits. Some of the key benefits of herbal tea include:

1. Antioxidant Properties: Many herbal teas are rich in antioxidants, which help protect the body from damage caused by harmful molecules known as free radicals. Antioxidants can help reduce the risk of chronic diseases and promote overall health.

2. Relaxation and Stress Relief: Certain herbal teas, such as chamomile and peppermint tea, have calming properties that can help reduce stress and anxiety. These teas are often used to promote relaxation and improve sleep quality.

3. Digestive Health: Herbal teas like ginger tea and peppermint tea are known for their digestive benefits. They can help alleviate symptoms of indigestion, bloating, and nausea by promoting healthy digestion.

4. Immune System Support: Some herbal teas, such as echinacea and elderberry tea, are believed to boost the immune system and help the body fight off infections and illnesses.

5. Hydration: Herbal teas are a great way to stay hydrated, especially for those who prefer non-caffeinated beverages. Staying hydrated is essential for overall health and well-being.

6. Weight Management: Certain herbal teas, like green tea and dandelion tea, may aid in weight management by boosting metabolism and promoting fat burning.

7. Anti-Inflammatory Effects: Many herbs used in herbal teas have anti-inflammatory properties that can help reduce inflammation in the body and alleviate symptoms of conditions like arthritis.

8. Skin Health: Herbal teas rich in antioxidants and anti-inflammatory compounds can contribute to healthy skin by reducing oxidative stress and inflammation.

Incorporating a variety of herbal teas into your daily routine can provide a range of health benefits beyond just hydration and flavor.

"
