,product_id,date_posted,review_title,review_text
1529,70243,2020-01-11,Magic Remedy !!!,"I have frequent sleep problems, I can’t fall asleep, I get up badly and don’t get enough sleep at all. I decided to try it and now I'm praying for this jar !!! The instructions say to take 2 marmalade, but sometimes one is enough for me. After 15-20 minutes it begins to smoothly immerse into sleep. I don’t get addictive, I accept the need. It’s not difficult to get up after it and you feel much better, the dream is continuous and good. Often in the evenings it hurts legs, an unpleasant feeling in the muscles, but after taking it it is not a hindrance. Recommend!!!"
1530,70243,2019-04-15,Great product!,"Great stress, insomnia, nervous strain. I didn’t get enough sleep. I studied Eicherb for a long time, read reviews, compared and settled on this tool. Orange marmalade pills. The can is disproportionately large for content. The tool began to work literally from the second day of admission. The dose is calculated correctly, namely 2 marmalades. I took one somehow and tossed and turned all night. I don’t wake up at night, the dream is deep, calm, the muscles relax, I wake up sleepy and rested. I understand that sleeping pills are not a solution to my problems, but at least I can calmly think and not pour coffee in liters. I highly recommend this tool, it really works. Definitely I will take more. Thank!"
1531,70243,2019-04-11,It is He !!,"Perfect remedy and dosage suitable for us! We tried almost all melatonin brands from this site, but this is the best! Now only him! Not only is it nice to just throw sweet tasty marmalades before going to bed, so also the effect is just super, you fall asleep quickly, you have bad dreams do not dream, and wake up vigorous, cheerful and slept!"
1532,70243,2019-04-08,I'm a DJ. And that's it.,"I think from the title it is clear that you will not regret my schedule and enemies. I speak 5 days a week, 6-10 hours a day. When I lie down, the whole building wakes up. Mask and earplugs help poorly. I almost always fall asleep due to fatigue, (BUT you need at least 3-4 hours of silence after the set), and then someone wakes up and it is impossible to sleep. Never used sleeping pills. This is my discovery! Even if they wake up, I immediately fall asleep. I do not remember this for many years. If they have mastered my stupid schedule, the rest will surely help! By the way, very tasty. Put in the basket a new jar."
1533,70243,2019-03-12,Ticket to the country of dreams,"Very cool work! Often problems with falling asleep in me and the IC. Work, emotional stress, stress, parties ... one marmalade and sleep like babies. Previously, they could try to sleep for hours. Awakening is clear, quality sleep, sleep is mild. I will order more, this is a super help. Sweet Dreams to all!"
1534,70243,2019-01-21,Beautiful dream,"She began to suffer without sleep. My heart beats, tachycardia, I can not sleep and woke up every hour. The complex of melatonin with herbs acts almost immediately, after half an hour I fall asleep, I become less awake; immediately after 3 nights, the effect is there, and sleep improves. To drink first in a smaller dose, and only if it does not act to increase the dose, I take 1 ton. In studies, melatonin proved to be excellent in the treatment of cancer, and as an immune modulator helps with infections. also in the protocol of gray hair in the composition of melatonin and a lot to, Take a month, and try to develop healthy sleep habits. When flying, it is useful to establish a rhythm. Together with GABA it helps to calm down even better, especially hyperactive If it is interesting, continued on my page"
1535,70243,2018-12-23,The facility is like.,"The facility is like. Started to use as recommended for 2 pieces, but the dreams were hard. Moved to 1 marmalade and it became better. I eat marmalade, then 15-20 minutes for brushing your teeth, smearing with kremikami and the like. Then I go to bed and after 15 minutes I fall asleep. For me, this is super, because without a pill for an hour and a half, and sometimes more, I twist in bed. Other means for sleep did not try, there is nothing to compare."
1536,70243,2018-11-26,Very good,"This is really great, eat two before bathing, wash your hair after bathing and brush your teeth. After about 30 minutes, you want to sleep. And I won't wake up in the morning~ Awesome has introduced colleagues to buy back seven bottles! Everyone has troubles that can't sleep... hahaha"
1537,70243,2018-06-12,slept well,"I was worried about my husband's snoring and I tried sleep shortly every day since I tried it. I used it together with equipment that I bought with the white noise, so I can not say that this is the only effect, but it was very good. Although I got up to the bathroom, for me it was a good night's sleep. I ate only one piece about 30 minutes before going to bed. Although it says two, but for the first time, I wonder if only one is enough. I was OK with one piece, whether I am insomnia or not. The taste resembled the orange taste of Bach 's rescue pastel sold also on iherb. Small and light, sweet and less fancy feeling, sweetness It is easier to eat than vitamin c gummy firmly eyes."
1538,70243,2018-05-30,Liked,"Very cool jelly. Very nice smell. Delicious. I miss one marmalade and quietly starts to sleep (I certainly do not have serious problems with sleeping and falling asleep, but sometimes it happens). This effect is very like. Do not cut out overnight. Sleep is strong. In the morning I wake up easily, with a clear head. 5"
1539,70243,2018-05-29,You can get good quality sleep.,"Every day, I eat two at a time. I like the taste and I am getting it in the sense of eating sweets (drinking). I sleep for 30 minutes before going to bed and I am asleep at night. Waking up well, blood glucose level on fasting has gradually declined. Hba 1 c has been steadily decreasing to 7.0 ⇒ 6.8 ⇒ 6.6 in the past two months. Diabetic patients knew for the first time that it is necessary to have good quality sleep. (This information is information on NHK's TV)"
1540,70243,2018-05-29,Can adjust the sleep time,"After 15 minutes of eating, I feel very sleepy. Then I can sleep until I wake up in the morning. I didn't wake up on my way. I feel good in the morning. I have no side effects, but I can't use it for sleep. I can't use it for a long time. ."
1541,70243,2018-04-16,Help sleep,"The taste of fruit jelly is very good. Eat two in half an hour before going to bed. It takes about half an hour or so to sleep. After eating for a period of time, you will not eat if you have a stable sleep. There is basically no dependency."
1542,70243,2018-02-05,Good marmalades for improving the quality of sleep and the failure of the regime of the day,"Hello. Very often she suffered from insomnia. Many will say how can you not sleep? Work more, sleep tight! But that was my problem. Intensive work led to the fact that at night she simply could not fall asleep. In my head thoughts climb, of course twitch. In the end, if it turned out that she could sleep, she would wake up all the time. In general, for 2 years of such a regime, I turned into a walking zombie. I decided to try SleepWell. First of all, because of marmalade) I like delicious additives. Two marmalades before going to bed and voila. I sleep like a bear on a hibernation) In the morning I began to wake up with cheerfulness. Those. not only to fall asleep faster than the beginning. But the quality of the sleep itself has improved. Now there is a floor of a jar somewhere. The regime of the day came back to normal. Take before bedtime stopped. Because everything is so good) Left for possible flights and jet lag."
1543,70243,2018-01-17,Instead of a sleep inducer,"I always slept with medicine but I wanted to reduce medicine.
On the first day, I could not sleep with two grains and after 1 hour of tenacity, I took bedtime as I took medicine as usual.
Because I do not get any benefit on the second day, I ate six grubs and after a while I went to bed. Good awakening without awake.
From the third day I tried eating 3 capsules and decided the policy to take medicine if I could not sleep even after 30 minutes.
Later I have been able to go to bed without medicine. Now two grains of the prescribed amount.
It seems to me that he is definite.
However, it is likely to grow molds as it gets hot, so it may be necessary to store the refrigerator.
"
1544,70243,2023-03-23,,"God willing, it will work"
1545,70243,2021-08-12,,"Excellent time, it does not cause nightmares and helps sleep. I recommend it strongly, and frankly, this is the second time I order it because it comes and goes."
1546,70243,2021-02-27,,"A great tool when you need to sleep well before an important event. It improves the quality of sleep, the sleep becomes deep and it is possible to fully rest and sleep in 5-6 hours."
1547,70243,2020-01-13,I don't know yet,"Difficult to open. I know you can open it while pushing, but it's quite a pain. Eat 2 tablets a little before going to bed. The taste is like mixed juice. Not a bad taste, but a mysterious taste. I don't know the effect yet, but I feel sleepy. Worth trying. That's pretty big. Cheap."
1548,70243,2018-06-17,Really effective,"Trying to eat 2 capsules at the latest really feels sleepy, and it's really effective. I'm going to use the night owl's idea to pour my clock on myself."
1549,70243,2023-02-22,,"It's okay, the taste is good, I like it very much"
1550,70243,2022-10-11,,"I often suffer from insomnia. Take two capsules an hour before going to bed to make it easier to fall asleep. When the sweets are delicious, remember to rinse your mouth after eating because of the sweetness."
1551,70243,2022-09-20,,"First, it's delicious! Chewing 2 capsules 1 hour before bedtime will naturally make you sleepy. I don't feel drowsy the next morning, so it's good to be able to take it easily even on weekdays."
1552,70243,2022-06-13,,"The taste and taste are good. Take it 30-60MINS before going to bed, and then brush your teeth and other sleepiness. It is effective and can be repurchased."
1553,70243,2021-12-19,The initial test results are quite obvious,"After eating for a few days, the quality of sleep has improved significantly, but after a week or two, it may be because the body has adapted, and it is not much different from before."
1554,70243,2021-11-13,,"To be honest, I never felt that it helped me sleep. I tried it more than once, but I wouldn't ask for it again"
1555,70243,2021-03-13,,"Beautiful chewable tablets facilitate a good sleep. Completely free of sugar and gluten, they bring you calm and complete relaxation as well as not something that gives me admiration 💐"
1556,70243,2021-02-07,,These are great delicious gummies! With excellent dosage of melatonin. It is a pity that they are no longer delivered to our country. There is no replacement.
1557,70243,2018-05-28,Melatonin,I was a little insomnia recently. My friends recommended that melatonin can cure insomnia and there are no side effects. Try to buy it because my insomnia is not severe and I eat one. After half an hour it works and I sleep well. )
1558,70243,2018-02-11,Works great,"After a hard day's work, you go to bed and the thoughts spin around in your head. With these sweets everything goes to the background and quietly fall asleep. And what is even more surprising, that you wake up at 5 am and calm, there is no annoyance"
1559,70243,2022-06-03,,"The first time I bought it on trial, but I read great comments about it"
1560,70243,2022-05-28,,"Unlimited repurchase, I have eaten a lot of different brands, which one is the most useful and tastes good"
1561,70243,2023-06-29,,"No sleep effect. It tastes delicious. And light on the stomach. As for the effect on sleep, it is of no use to me. The packaging is appropriate and the quantity is ample."
1562,70243,2022-11-29,,The quality is average. The ingredients are average. The taste is average. The dosage is average. It seems that the average is not very helpful to me. I should not buy it again. It is not very beneficial to me.
1563,70243,2021-12-21,Relax,"I love it because it makes you feel calm and your organs become relaxed, but its only flaw is that sometimes I sleep for two hours, followed by a deep and healthy sleep."
1564,70243,2021-08-24,,"I take medicine from my doctor because of insomnia, but I usually take it when my heart is sick. If you don't sleep, you won't be able to sleep as much as you think that it will hinder your work the next day, so it will be most effective in such cases."
1565,70243,2021-08-12,,"It tastes delicious. I don’t think it’s difficult to eat without the taste of 5mg raisins. If this taste has 5mg, I will definitely choose it. If it’s difficult to fall asleep by accident, this product is the most effective product of its kind on the market."
1566,70243,2021-07-18,I'm happy with sugar free,"I brush my teeth and eat before going to bed, so I'm very happy that it's sugar-free. The taste is very delicious and you can enjoy the firm texture of the gummy candies. Even one can fall asleep. It's so good that it's my second purchase."
1567,70243,2021-04-24,repeat purchase.,"I try to order a stock before the beginning of summer (it disappears from sale due to storage conditions) I use it before going to bed, already lying in bed, since I do not need to drink water. sometimes I combine it with a similar jelly from another company (doubling the dosage of melatonin). falls asleep better, does not affect waking up in the morning. the duration of the action is short, but it would be strange if it lasted for long hours."
1568,70243,2020-12-19,,"It tastes more like fruit juice than peach tea, but it's delicious. At first, I ate two grains, and when I lay down and messed up, I fell asleep, but I think I'm getting used to it. However, if I went to bed without drinking after a long time, it may happen that I slept lightly and woke up many times, so I would like to continue using it even if it is a placebo."
1569,70243,2020-04-25,Good sleep provided,"The sleep is deep and strong. Good. But at home I noticed this: I eat marmalade and starts to sleep about 15 minutes later. If I go to bed and fall asleep, I sleep perfectly and calmly, but if I overdo it and watch a movie or surf the Internet at that time, then I have dreams based on what I saw))) It's funny"
1570,70243,2020-04-21,The effect varies from person to person,"I bought 2 cans and bought them on behalf of 4 friends. I bought 9 cans in total. Two of the friends found it useless, but I and the other two friends found it useful. It is not a sleeping pill. It is more like forcing the brain to relax and it is easier to fall asleep. The effect varies from person to person, you can buy a small amount to try first, or find a friend to get some, useful in buying."
1571,70243,2019-11-26,Effective in some way,"If it ’s a little hard to fall asleep, it ’s effective. 2 capsules before bedtime. You can obviously feel sleepy after half an hour and fall asleep shortly. Both, and this product is dependent, I took a bottle, and after stopping, the difficulty of falling asleep returned to the previous, and it feels more difficult to fall asleep. Other sleep disorders remained largely unchanged. It only represents my personal constitution."
1572,70243,2019-10-25,Can sleep,"Glycine will not work at all and you can sleep if you drink 3 of these. It does n’t work at first, and it ’s good to drink 6 capsules, but it ’s sleepy, sloppy and sweet and stuffy in the stomach. I want 3 heads, so next time I want to make a sweet supplement. Whether you want to be comfortable and not be bothered mentally, you've been chasing yourself and taking melatonin. You don't have to doubt yourself, and you become more confident. It suits me who has strong PTSD."
1573,70243,2019-05-07,"Because it is a supplement to the last, it is better to think about assistance to the introduction of the beginning of the bed even if it works I think the kind of sleeplessness is also good","It is a type of stress sleep disorder that you can not sleep well without going to bed. Even with a herbal supplement containing 3000mg of glycine or valerian passionflower, it does not at all cause a sudden insomnia due to mental aspects such as stress and anxiety, so I eat it just before going to bed in a dark room with two sleep wells. . Do you feel that the percentage of people who have successfully introduced sleep is feeling better than when you don't eat? However, after all the awakening is pounding. If it is a light day with a bad sleep, it looks like you're sleeping."
1574,70243,2019-03-05,Effective,"Because I am insomnia, I purchase it for sleep. When I first drank it was surprisingly drowsy and I was surprised at the high effect of melatonin. However I was sorry that I was able to tolerate (?) By using it twice, three times in a row, or it became impossible to realize the clear effect as the first time. I think that there is no doubt that the effect itself, so why not try it if you are interested"
1575,70243,2018-12-25,Works from 5-6 pieces at a time,"At first I saw 2 things, it didn't help, 3 didn't help, 4 didn't help ... but the benefit of 5-6 things helped)) But I already thought that it was a useless thing. As you understand, the expense is big, so I drink only when I really can't fall asleep. Already drank almost the entire jar in less than a month nonetheless. Do you think it is normal that you have to drink 6 marmalades at a time?"
1576,70243,2018-12-10,I got up as soon as I woke up.,"The reason for sleeping is good, but I went to the toilet in the middle of the night, I could not fall asleep when I awoke, so I bought it. Although it is written as 2 grains per day, I drink one grain each day. I have been eating for about a week, but I can sleep even if I wake up for the first time and there is not much worse when I wake up in the morning, so I am feeling well and I want to continue. I would like to eat one grain at a time every day before going to bed. Since taste is delicious, it is good to be able to continue instead of suffering."
1577,70243,2018-11-22,sleepy marmalades,"Very good right candy :) Bought for her husband, he often sometimes after a hard day of work can not sleep or sleep restlessly. At first they were skeptical. some delicious marmalades ... but they really work. !! after taking it for half an hour, it tends to sleep already, it sleeps soundly, wakes up with a bright head."
1578,70243,2018-07-02,I think it's good.,"I usually sleep well and I am not insomnia, but I heard that melatonin is a dementia prevention, so I decided to buy it on the eve of a holiday etc (eat it). It is 3 mg containing melatonin in 2 grains, but I got sleepy even with 1 grain. I feel it is early to work because it is gummy."
1579,70243,2018-04-04,It's still sweet,"The lid is very bad to open for the first time to play for a long time to open it may be to prevent children from eating this feeling will have some effect, but it is not recommended that you long-term consumption, after all, the side effects of melatonin have not yet clearly defined the jet lag occasionally eat it ^ - ^"
1580,70243,2021-02-03,I liked it.,I don't feel like drinking a lot of pills. I like it this way. It turns out unobtrusively and very tasty. Sleep well. I definitely want to take more.
1581,70243,2021-01-14,,The peach tastes very fragrant. Taking it half an hour before going to bed really improves my sleep. It makes me fall asleep easily and has a good sleep quality.
1582,70243,2020-12-13,Especially recommended for the elderly,"This sugar is cheaper than the melatonin products on the market. It tastes as good as normal fruit jelly. It melts quickly and is easy to swallow. Because her mother had problems with insomnia when she was old, she thought it was helpful. It has been repurchased many times."
1583,70243,2023-10-20,Just so-so,"The effect is decent, but the price is too high; It's burdensome"
1584,70243,2023-09-27,effect,"Unfortunately, it didn't seem to work for me, and I didn't feel any effects."
1585,70243,2023-09-26,It's good,I ordered it for my mother to help her sleep. The quality is good. The box is a suitable size
1586,70243,2023-08-29,,"Doesn't seem to work, but give it a try"
1587,70243,2023-08-21,,"It is easier to use than now, and you can sleep a little more than usual"
1588,70243,2023-07-23,,"Peachy and delicious. I feel like it's helping to induce sleep. However, the case is difficult to open."
1589,70243,2023-06-25,,"I am a mediator, and this request is not for me alone from my clients. Thank you ♥️♥️"
1590,70243,2023-06-07,,"Marmalades are delicious, but the result is zero. Sleep was not affected in any way."
1591,70243,2023-06-03,,"I don't feel like it brought me to sleep. I tried it how many times it passed, not to praise"
1592,70243,2023-05-16,,"It is light on the stomach and its nutritional value is high, but I did not like the large size of the bean"
1593,70243,2023-03-17,,"The product is excellent, the ingredients, the quality, and the benefit. The packaging is full and suitable. God willing, I will get the benefit"
1594,70243,2022-03-12,,"It's really nice, it causes drowsiness and it tastes sweet"
1595,70243,2023-09-04,,Is delicious. Feel free to cheat.
1596,70243,2023-07-12,,Really sleepy after eating! not bad
1597,70243,2023-05-26,,Great help sleep is very important
1598,70243,2023-05-15,,My daughter likes it. It tastes like peach tea.
1599,70243,2023-04-18,,"Helps sleep, normal taste, clean ingredients, good portion"
1600,70243,2022-11-27,,"Tastes good, sleeps deeper after taking it, is useful"
1601,70243,2022-11-26,,"Delicious, effective, eat to help sleep"
1602,70243,2022-11-19,,"Effective for sleep, good quality, suitable for any age"
1603,70243,2022-11-16,,"Melatonin, sleep gummies, has a little effect"
1604,70243,2022-11-10,,Very easy to use and recommended to buy
1605,70243,2022-10-02,,Good product and worth buying Good product and worth buying Good product and worth buying Good product and worth buying Good product and worth buying Good product and worth buying Good product and worth buying
1606,70243,2022-02-21,To improve sleep quality,"I drank it about 30 minutes before going to bed, but the effect was not as remarkable as I expected. It may or may not work."
1607,70243,2021-12-09,Light taste and aroma,"Gummies are too elastic and hard. The taste is light and not particularly delicious or bad. However, it certainly had the effect of making me sleepy."
1608,70243,2021-11-03,,"I bought it for a family who has trouble falling asleep. The taste seems to be delicious. When I eat this, I feel very drowsy and can sleep."
1609,70243,2021-07-19,,"It is difficult for mothers to fall asleep during menopause. But after trying this product, I can fall asleep immediately. A good night's sleep"
1610,70243,2021-07-01,sleep inducer,"By God, the box is finished and I wish I had a dozen of them 😂😂😂 Comfortable and beautiful in stimulating sleep, not like the rest, you wake up and you are tired and tired and you are fighting with all your strength 😂 but beautiful I advise you on them"
1611,70243,2021-06-09,,"Good melatonin, I took it for dad. It acts gently, it is better to drink no later than 21.00. Most importantly, Dad began to get enough sleep, with age, the production of melatonin slows down and sleep is often disturbed. And then there's the gummies doing their job👍🏼"
1612,70243,2021-06-03,,"Drink 2 tablets every night, brush your teeth and then go to bed. I feel a little sleepy after about 30 minutes. It was great that I woke up in the morning and didn't sleep twice! However, after about a month, it's not so effective now, it's the same as before drinking ᐡ ඉ ́ ̫ ඉ ̀ᐡ I sleep twice a day and sleep three times lol"
1613,70243,2021-04-02,,"Came me in terms of sleep. After I eat it, I feel sleepy and sleep, and the thing is fine, and it will not cause a headache"
1614,70243,2021-03-08,Ok,"The best thing is for the sweetness of sleep, and the best thing is that when you wake up, you will be normal, not lazy."
1615,70243,2021-03-04,,"I can't sleep without this anymore. Good points You can sleep gently. It's jelly so it's delicious. If something goes wrong, my head hurts a little. I don't sell much elsewhere. Recommended for these people Anyone who wants to sleep People who have a sleep disorder but can't go to the hospital or don't want to go I tried other medicines but couldn't sleep Personal review I also tried other medicines , I tried some sleep method, but it didn't work. But since I started eating this, I was able to sleep at my favorite time."
1616,70243,2021-02-26,,"I love it very comfortable in times of anxiety, and when I want to have a better sleep, I advise you to get me like please"
1617,70243,2021-01-27,,"I am a person with insomnia for many years. Without it, I really can't sleep~ I have no headache after eating, easy to eat! Repurchase all year round!"
1618,70243,2020-12-30,,Helps to sleep Good for sleep and tastes delicious Eat it an hour or two before bedtime I recommend buying it for those who suffer from sleep problems as it is effective and natural without side effects
1619,70243,2020-12-25,,"It helps sleep, but the contents are clumped together, it's really gummy! It’s a delicious taste, but I don’t eat too much at night and I have to chew candy before going to bed. I am not used to it, so I won’t buy it"
1620,70243,2020-12-16,,"When I ate it for the first time, I was a little scared, and it tasted a bit like plastic. Other sleep gums will make me have nightmares, it won't! ! Will continue to repurchase"
1621,70243,2020-12-10,Excellent!,"The taste is good and the effect is good. After taking two bottles, now it improves the quality of sleep without having to eat all the time?"
