,product_id,date_posted,review_title,review_text
1085,70243,2023-02-16,,"I repeated. I like that no sugar is used. A gummy type that is easy to eat and a good size. I just recently started taking it, so I didn't really understand it, but 3 mg of melatonin is the content of 2 tablets per intake. Other products are also displayed like this. I feel like two are too many, one. I think the quality is good with 1.5mg intake. I believe the ingredients are correct. My family members who are light sleepers take 2 each, but when I feel like I can sleep, I stretch out my hand at night."
1086,70243,2023-01-18,,"Helped me a lot in falling asleep good quality. But you have to be careful with the dosage. It is better to take the whole dose if you have 8 hours of sleep because otherwise you will wake up feeling drowsy and tired. And if there is not 8 hours then take half a dose. After all, everyone and how they react to an ingredient in a nutritional supplement. The taste of the rubber is very delicious!"
1087,70243,2022-10-28,,"There are gummies that make you sleepy! I was surprised and bought it, but it really makes me sleepy! ︎ I always had trouble falling asleep and couldn't sleep until morning, but after eating two of your reviews, sleepiness comes in about 30 minutes to 1 hour. It tastes like peach tea! I'm easy to listen to medicine, so it looks like it's good to have a grain! I'm glad I bought it!"
1088,70243,2022-10-28,Tried several sleep sugars and this one is the best!,"The taste is sweet, it is rare that it is not strawberry flavor XD I usually sleep well, but sometimes when I really can't sleep and have to go to work the next day, I will take two tablets to help sleep, usually less than 10 minutes I will fall asleep."
1089,70243,2024-10-17,OK,"Good quality, natural ingredients, delicious taste, large portion, beautiful packaging, fitness first "
1090,70243,2024-09-26,I fell asleep quickly after eating,"Tastes like regular fruit gummies, delicious and easy to eat, and very effective, quickly fall asleep after eating, and no side effects"
1091,70243,2024-09-21,Helps my sleep,"The ingredients are natural and easy to use, I like it very much"
1092,70243,2024-09-21,,It contains just the right amount of melatonin and also contains herbal ingredients to help you relax.
1093,70243,2024-09-20,,Even the gummy type makes me sleepy. They're just delicious.
1094,70243,2024-09-15,great,"The quality is very good, but unfortunately it can no longer be sent to Taiwan."
1095,70243,2024-09-14,good,"I have been taking it for a while, I hope it works"
1096,70243,2024-08-31,Delicious taste,"Usually one pill is enough and delicious, but unfortunately it is often out of stock."
1097,70243,2024-08-28,Excellent,"Excellent for improving sleep quality, taste is excellent, no smell, quantity is good."
1098,70243,2024-08-22,Very delicious gummies,It tastes very good and can be eaten as a snack before going to bed.
1099,70243,2024-08-21,,"Excellent, it helped me with the taste of peaches. The taste is normal. The package is sealed. The quantity is enough for two months. "
1100,70243,2024-08-09,Pills that help you sleep,Chewable pills help to aid in deep sleep. The taste is acceptable.
1101,70243,2024-08-04,Prominent, It has a quick effect and becomes apparent within a week. Its active ingredients help with endurance
1102,70243,2024-07-31,,"I really like this additive, the quality is excellent, the price is excellent, as well as the result"
1103,70243,2024-07-29,,Excellent excellent excellent excellent excellent excellent excellent excellent excellent excellent 
1104,70243,2024-07-27,Great product ,"A very wonderful product, and I recommend it. It helps with sleep, but they have not used it for a while"
1105,70243,2024-07-26,It tastes delicious!,"Take 2-3 pills can, but be sure not to play with the phone, to close your eyes well to fall asleep quickly"
1106,70243,2024-07-23,Very delicious gummies,"The taste is very good, I can't help eating it 😂 It is effective and easy to fall asleep"
1107,70243,2024-07-23,quality product,Useful ~ It helps with sleep and improves sleep quality. I will recommend it to my friends.
1108,70243,2024-07-21,Excellent ,"Great product, very effective. perfect dosage, good size and good quality "
1109,70243,2024-07-18,Helpful for sleeping at night,"When I take this product, I can sleep well at night."
1110,70243,2024-07-15,amazing,"It helps to relax and sleep, its quality is high, its size is suitable, and it tastes very good"
1111,70243,2024-07-12,sleepwell,A quality product that helps a lot with sleep. The candy is very tasty. Peach flavored
1112,70243,2024-07-07,,Delicious! This is my favorite melatonin gummy. It's chewy and effective.
1113,70243,2024-06-28,Excellent!,Very very very tasty and I will buy it again and it improves sleep after resting better than others. 
1114,70243,2024-06-27,magnificence,"I loved the taste and fell asleep quickly once upon a time, and there was no dizziness when I woke up"
1115,70243,2024-06-23,Fruity,The fruity fragrance is strong and can help you sleep soundly. You can repurchase it.
1116,70243,2024-06-21,One tablet is enough,The taste is good and one pill is enough to make me sleepy.
1117,70243,2024-06-18,Good first try,It’s my first time to eat gummy candies. It tastes great. I’ve learned a lot about the real thing.
1118,70243,2024-06-15,I like your moving eyes and your charming smile. ,I like your moving eyes and your charming smile. I wish you could do it again.
1119,70243,2024-06-09,more than great ,It is one of the best products in terms of ingredients. It tastes very good and works very quickly. The quality is excellent
1120,70243,2024-06-07,useful ,"But use it only when necessary, and nothing more than it out of caution, and I prefer it in times of need "
1121,70243,2024-06-06,good,"It tastes sweet and may have some psychological effects, making it easier to fall asleep~"
1122,70243,2024-05-30,Great product,"Ordering again!! Good quality of sleep, quality ingredients and good size of the product, good taste and very tasty"
1123,70243,2024-05-29,Dream,"I can’t sleep at night and I ordered this because I liked the taste, the effect is good"
1124,70243,2024-05-26,Good taste,"It tastes good and I really feel sleepy after eating it, which has improved my frequent insomnia."
1125,70243,2024-05-23,Sleep better,"The gummy type is easy to eat and seems to slowly soak in. Thanks to it, I can sleep well."
1126,70243,2024-05-22,Helps sleep,"After eating before going to bed, I really had a good meal and didn't have to get up at night."
1127,70243,2024-05-21,,excellent quality. natural ingredients. dosage convenient size. fruity taste. benefits sleep improved 
1128,70243,2024-05-20,Excellent!,"The second time I tried sweets from the same brand, they were excellent and their effect was very fast "
1129,70243,2024-05-19,Awesome,"The best melatonin I have tried so far! Moreover, it is delicious, gives you a deep and comfortable sleep, and works quickly."
1130,70243,2024-05-18,,The gummies taste good and seem to help with sleep.
1131,70243,2024-05-09,,"Great for sleeping and tastes great, just like regular gummies and is chewy."
1132,70243,2024-05-04,ok,"Repurchased many times, cheap price, trustworthy, highly recommended to you, confidence guaranteed"
1133,70243,2024-05-02,Tablets,I haven't tried it before. I hope I like it.............................................Also It tastes very delicious
1134,70243,2024-04-30,,The effect is good and the taste is good. I will buy two more bottles next time.
1135,70243,2024-04-29,It tastes very good and can be eaten as candy. It has no medicinal taste.,It can help you sleep and your spirit will be significantly improved.
1136,70243,2024-04-27,"After I try it, I will try it and write my experience","After I try it, I will try it and write my experience, but my sister thanks me very much for it "
1137,70243,2024-04-27,Helps sleep,"But it is better to leave the mobile phone, close your eyes, and not think too much while asking for forgiveness and praising Him"
1138,70243,2024-04-23,efficient,"The taste and texture are great, not too sweet! Effectively promotes quality sleep!"
1139,70243,2024-04-22,Very good,"Tastes delicious like sweet candy. After using it for about 30 minutes, the feeling of sleepiness comes. "
1140,70243,2024-04-22,Prominent,"It does not have a smell, I use it constantly, its quality is great, and its size is good for its price "
1141,70243,2024-04-20,,"The use is easy, the quality is high, the size is large, and the benefit is great. High composition "
1142,70243,2024-04-16,evaluation,60 tablets help adults sleep. The natural white tea and peach flavor is very excellent 
1143,70243,2024-04-13,good,Very good and wonderful. I can order it again and it is safe to use and repeat as well
1144,70243,2024-04-09,there are no such things,"Perfect product does the job, I order a lot and am very satisfied, excellent"
1145,70243,2024-04-08,Hope it helps with sleep quality,"The taste is easy to drink, but a bit sweet. I hope it will be effective after long-term consumption."
1146,70243,2024-04-05,,"After taking this melatonin, I felt more sleepy. I felt sleepy not long after lying in bed, and my sleep quality improved."
1147,70243,2024-04-05,very good,"I bought it for a friend, I don’t know if it helps."
1148,70243,2024-03-31,Balanced supplement for good sleep,"A balanced supplement for good sleep with a good composition. The quality is good, the price is reasonable for the stated volume. "
1149,70243,2024-03-30,,My first ever melatonin and I am delighted! Excellent quality and pleasant sweet taste. 
1150,70243,2024-03-30,Prominent,I liked taking a pill and going to sleep. It does not cause a headache after waking up 
1151,70243,2024-03-29,,Take two pills every night and you won’t wake up at night! -Jue Xun Tianguang! 
1152,70243,2024-03-19,tasty,The gummies are delicious. I eat two of them 30 minutes before going to bed every night. My sleep quality has improved.
1153,70243,2024-03-19,Good,"Good pack size, excellent dosage, good quality, delicious taste, good benefits, helps to sleep well "
1154,70243,2024-03-16,repurchase,"It’s useful. Although I don’t eat it every day, I still need it occasionally."
1155,70243,2024-03-15,Excellent!,"The pleasant taste of this product, as well as very good properties for improving sleep, high quality "
1156,70243,2024-03-15,Good food,"I don’t know if it works, but it tastes good and delicious. My husband and dad love it very much!"
1157,70243,2024-03-13,very good,"Very useful, I have recommended it to my good friends."
1158,70243,2024-03-10,Delicious and safe,"From half a pill to one pill, people with sensitive constitutions will not feel any discomfort."
1159,70243,2024-03-09,,Purchased at the request of a friend. It doesn't contain sugar and has a taste that even adults like.
1160,70243,2024-03-08,ok,"The price is cheap, trustworthy and highly recommended. I have repurchased it many times."
1161,70243,2024-03-07,Rubber that helps sleep,Without taste old advantages creates a good dose when you need a large size
1162,70243,2024-03-03,Great,Very good melatonin in the form of chewable sweets with peach and tea flavors. 
1163,70243,2024-02-28,Useful for sleeping,"The melatonin content is low, which can help you fall asleep, but not much."
1164,70243,2024-02-23,Nice gummies ,"Good quality ingredient, nice size gummy good taste Advantage rough "
1165,70243,2024-02-23,Easy to enter,I bought it for an elderly person in my family. It is easy to drink and I hope it will help me fall asleep.
1166,70243,2024-02-18,I recommend ,I really liked the taste and I noticed that I sleep more soundly. I recommend. 
1167,70243,2024-02-17,,"The benefits can help you sleep, the quality and ingredients are very good"
1168,70243,2024-02-11,Sleeping tablets ,It helps with sleep. It relaxes and makes the person feel like he is sleeping. Its quantity is 60 tablets. 
1169,70243,2024-02-09,best,"This is the best compliment melatonin I have tested, it is effective."
1170,70243,2024-01-31,,"Sleep aid tablets contain melatonin, a delicious taste, sleep aid for adults, daily use"
1171,70243,2024-01-29,Excellent for sleeping,Melatin is a wonderful formula for sleep. It helps you relax and sleep in a wonderful and very energetic way. I recommend it
1172,70243,2024-01-21,Excellent!,"Excellent medicine. It arrived to me with excellent quality, did not melt in the heat of Jeddah, and had a delicious taste"
1173,70243,2024-01-17,component,Very good at helping sleep. I fall asleep quickly after taking it.
1174,70243,2024-01-16,,"Helps to sleep well, very tasty, no aftertaste, great product, I would buy again"
1175,70243,2024-01-15,Prominent,It is melatonin that helps with sleep. It tastes like peach. The package is large
1176,70243,2024-01-13,"Easy to eat, delicious","Just started trying to eat I don't know if it's effective or not, but it's easy to eat and tastes delicious."
1177,70243,2024-01-12,,"It has a good effect. It helps you sleep easily and the effect lasts for a long time, better than sleeping capsules"
1178,70243,2024-01-07,Excellent,It's both delicious and has the benefits of relaxing and helping with continuous sleep
1179,70243,2024-01-01,Good sleep stuff,People with insomnia can really try it. Two pills before going to bed will really make you wake up.
1180,70243,2023-12-18,Excellent,It tastes great and has no sugar. Take 2 pills when necessary and sleep until dawn.
1181,70243,2023-12-18,it works,I will start eye training about 5-10 minutes after eating. It is really useful. I will keep buying it again.
1182,70243,2023-12-11,Taste very and it works,"The taste is very good, very peach flavor and sugar-free, which suits me very well. sleep well after eating"
1183,70243,2023-12-10,Excellent!,The quality is super! The ingredients are great! The size suited me! Exactly what is needed ! You can feel the effectiveness!
1184,70243,2023-12-05,delicious!,I feel like I can fall asleep easily. The good thing about supplements is that they are easy to take!
1185,70243,2023-12-03,very effective,"When you toss and turn and can't fall asleep, take two pills and you'll feel sleepy in 30 minutes."
1186,70243,2023-12-02,magnificent,Wow good effect good quality taste nothing not tasty at all but tolerable after ten minutes I'm already asleep
1187,70243,2023-12-02,,The quality is super! The ingredients are great! The size suited me! Exactly what is needed ! You can feel the effectiveness!
1188,70243,2023-12-01,improve sleeping,It tastes good. Eat it half an hour before going to bed to improve your sleep quality.
1189,70243,2023-11-25,The taste is nice,It is amazing and helps to relax and sleep significantly. The size of the package and the quantity is sufficient for two months
1190,70243,2023-11-22,great,"I feel sleepy half an hour after eating it, and it feels good without the sweet taste."
1191,70243,2023-11-17,,It's a pretty good gummy. It's convenient not to have to look for water to swallow melatonin in the evening.
1192,70243,2023-11-11,great,"The taste is very fragrant, the portion is sufficient, and the shelf life is very long"
1193,70243,2023-11-06,Super,Very effective and inexpensive for melatonin 3 mg. I highly recommend
1194,70243,2023-11-03,assistant,Dose every night Delicious taste Large size Quality Benefits Helps sleep Ingredient
1195,70243,2023-10-31,,It’s easy to fall asleep after eating it. It tastes great. I will definitely repurchase it.
1196,70243,2023-08-09,,"I bought several kinds of melatonin and sleep aid, and tried it a few times. This bottle is delicious, but I feel a little groggy when I wake up the next morning."
1197,70243,2023-03-15,,"Very excellent. I liked my friend who uses it. She says that it is very excellent and helps to maintain the face, hair and health"
1198,70243,2023-01-03,,"My wife usually takes sleeping pills to fall asleep, but after trying 2 gummies, she can fall asleep until dawn. I don’t believe that the quality of sleep has improved after trying it. I used to only sleep for 4-5 hours. I have bought several bottles"
1199,70243,2022-12-07,,"The taste is palatable, and there is no need for deep and fast sleep. Take two pills. The quantity compared to the price and benefit is excellent"
1200,70243,2024-08-03,Bad,"Your food contains alcohol and pork. It is always better to buy Vietnamese products that are considered vegetarian and not sweets, because they use collagen from them."
1201,70243,2024-07-15,"It is sweet and tastes delicious, but a little tough ","It is nice for those who want to sleep deeply, but it will cause sleep and you cannot sleep. No, honestly, take it and lie down in your bed for at least an hour, then feel lethargic and sleep."
1202,70243,2024-02-21,Fainting,"There is gelatin from pork. Unfortunately, I did not search until after I asked because I contacted the manufacturer and they told me that it contains gelatin from pork. Unfortunately, all Vita Fusion products contain pork gelatin."
1203,70243,2023-12-06,decent,"The smell is beautiful, the use is easy, I have never benefited from it, the texture is soft, the taste is delicious, the box is excellent."
1204,70243,2022-12-12,,Wonderful Very Beautiful Wonderful Very Beautiful Wonderful Very Beautiful Wonderful Very Beautiful Wonderful Wonderful Very Beautiful Wonderful Very Beautiful Wonderful Very Beautiful Wonderful Very Beautiful Wonderful Very Beautiful Wonderful Very Beautiful Wonderful Very Beautiful Wonderful Very Beautiful Wonderful Very Beautiful Wonderful Very Beautiful Wonderful Very wonderful Very beautiful wonderful Very beautiful wonderful Very beautiful wonderful Very beautiful wonderful Very beautiful wonderful Very beautiful wonderful Very beautiful wonderful Beautiful wonderful Very beautiful wonderful Very beautiful wonderful Very beautiful wonderful Very beautiful wonderful very beautiful
1205,70243,2022-10-07,,"Hello world! Winnie about it means honesty at first, I felt you answer the effect! Then it works..Take it if you want to sleep and do not eat or drink after that, so that the effect takes effect..about a quarter of an hour. And you answer sleep, sleep, you see light, not awful, well, you lie 12 hours! No, on the contrary, I liked it.. It tastes delicious, so you can see its sweetness. It is like jelly.. I recommend it for its natural ingredients.. I keep it at bedtime if I can't take it"
1206,70243,2022-04-29,I find it necessary at this time,"The packaging and packaging are excellent, the taste is delicious gelatin sweetness, the quantity is sufficient for a long period of time.. The use is necessary and not routine. The ingredients are among the best among the product’s peers. The amount of melatonin is reasonable. It helps natural sleep and does not cause tightness, headache, or sleep more than necessary (compared to other products) in it chamomile And basil extract,, helps to relax.. I see it from the things that should be in every home in this time full of stress, arrange your sleep, help you get rid of episodes of insomnia, natural sleep is one of the most important psychological treatments, depression and anxiety, and this product helps you 'I have requested it and this is the second time' The first product served me and my husband for a whole year, but we only use it for necessity"
1207,70243,2023-08-05,,"I can say for myself that I did not feel any improvement when falling asleep, it is made like sweets, like small marmalades, they are very tasty because of the peach and white tea ingredients. Small size marmalade, tastes a bit sour! In many reviews I see that people are helped very well, but alas, I don’t!"
1208,70243,2023-02-26,I feel comfortable sleeping,"First, the gummies taste delicious. It's my first time to take this kind of supplement, so I started with one grain, but I didn't feel the effect with just one grain. It became easier to sleep when I made two grains. It is best to take it about an hour before bed."
1209,70243,2022-11-26,,"Excellent, but if you drink a large amount of coffee, it will take longer for the effect of this medicine to start two or three hours before bedtime"
1210,70243,2022-11-13,,"This is the first melatonin supplement I have purchased. I have trouble falling asleep and have been taking sleeping pills for over 20 years. I tried not to worry if I couldn't sleep, but I bought it because I wanted to improve the quality of my sleep. I slept slightly better. I feel like I was dreaming lazily. Waking up was surprisingly refreshing. The taste is so delicious that you will want to eat as many as you want. Maybe I'm hungry for artificial flavors and sweetness... I think I'm addicted to gummy-type supplements. It seems that sucralose is in it (I bought it without looking closely), so I'm not sure if I'll repeat it."
1211,70243,2024-09-28,delicious!,"It was so delicious I was looking forward to it, and I slept well."
1212,70243,2024-09-05,,Good composition of the product. It tastes delicious. They really helped me fall asleep. Mild action in the drug
1213,70243,2024-08-05,Dream,Good quality of the product and with the necessary doses they ensure sweet dreams 
1214,70243,2024-07-17,Eat before bed,"If necessary, take it half an hour to an hour before going to bed. It is recommended not to rely too much on it."
1215,70243,2024-06-25,great,Delicious taste. A dose of 2 candies benefits that helps before bed. helps to fall asleep. 
1216,70243,2024-06-25,Mixed,"I don't like the taste, I can't sleep much, I wake up 2.5 hours after taking the gummies."
1217,70243,2024-06-12,,A good supplement for sleep and relaxation. The taste is very pleasant. Good selection of ingredients 
1218,70243,2024-06-04,Trowel is useful ,I did not benefit from it. Its sweet taste caused me insomnia. I will not order it again and I do not recommend it
1219,70243,2024-06-01,,"The quantity is appropriate, the packaging is excellent, the taste is okay, and delivery is on time"
1220,70243,2024-05-30,,"It's easy to take, but I'm not sure about the effect... It seems that melatonin alone is better for me."
1221,70243,2024-05-23,,The taste is not sweet and effective. I don’t feel tired after getting up the next day.
1222,70243,2024-05-22,Prominent,"The product is good, in the form of a candy, it helps somewhat with falling asleep "
1223,70243,2024-04-13,,"10 points natural, falling asleep naturally without any medicinal ingredients"
1224,70243,2024-04-09,Really got some sleep,I felt really sleepy half an hour after eating. gradually fall asleep
1225,70243,2024-04-08,very good,"The product works for me, improves sleep, and helps me fall asleep faster."
1226,70243,2024-04-07,very good!,It is effective and tastes good. The product is safe so I am willing to try it.
1227,70243,2024-02-29,OK,"I tried it the first night and my stomach hurt. The size is excellent, the taste is fine "
1228,70243,2024-02-09,,"The taste is great. The first time I used it, I found benefit, and the next time it was less beneficial "
1229,70243,2023-12-25,delicious,Effective and delicious. But it is effective if you eat more and with perseverance
1230,70243,2023-12-23,tasty,"Good taste helps sleep, improves sleep quality, and speeds up falling asleep. Moderate portion"
1231,70243,2023-11-20,Helpful for sleep,"It tastes good, has natural ingredients, and helps you fall asleep"
1232,70243,2023-11-02,,"It seems to be of some use, and I feel sleepy soon."
1233,70243,2023-03-28,,"It gives you a feeling of sleepiness and calmness. It is preferable to take it half an hour before bedtime. It tastes delicious, not sour. On the contrary, it tastes delicious."
1234,70243,2023-06-02,Qami,"Honestly, from the beginning, Tahsin fell asleep, but after the first time, it started to affect you more and more, but girls once heard a doctor curse him because he causes addiction, and I was afraid and stopped him, and I said to say it for credibility"
1235,70243,2023-10-10,Melatonin that tastes great,"The best-tasting melatonin in iherb, the peach-flavored gummy can really make you put it in your mouth one after another, be careful not to overdose ;)"
1236,70243,2023-10-09,,"The gummy tablets are small, but I slept soundly after eating 2 gummy tablets. I was skeptical, but it does a great job! I woke up refreshed in the morning. The taste is fruity and delicious."
1237,70243,2023-10-03,,"I love gummy melatonin as a countermeasure for insomnia, so I bought this as well. It has a slightly unusual taste, but it is refreshing and easy to eat."
1238,70243,2023-09-13,,"Excellent quality, the problem is that it is not always available, only in season, the quantity is enough for a month, and its taste is terrible"
1239,70243,2023-09-09,,A beautiful product that has benefited me a lot because I suffer from difficulty sleeping and a lot of insomnia. I tried it and it was one of the best supplements I have tried for this problem. I will return to buy it again.
1240,70243,2023-09-01,,"It is delicious and its effect is fast. It is less than half an hour to sleep, but it is necessary to prepare for bed, so do not eat it only"
1241,70243,2023-08-22,baby sleep,"Just one capsule and I sleep like an angel, I don't wake up again during the night and in the morning I feel better."
1242,70243,2023-08-21,sleep gummies,"It is more like a small snack before going to bed. It tastes delicious and chewy. After using it, it seems that it is easier to dream. I am not sure whether the actual sleep quality is better. It may be different for everyone."
1243,70243,2023-08-19,,"Eating it about 30 minutes before going to bed can help you fall asleep, and you won’t toss and turn and feel sleepy soon. It tastes delicious, but it's a pity that Taiwan can't buy it"
1244,70243,2023-08-11,,"I tried to eat it, but the reaction was not very good. I didn’t eat it all the time, and it had some side effects"
