,product_id,date_posted,review_title,review_text
0,70243,2024-02-04,Great!,"My tavourite for emergency insomnia. I like the taste very light, refreshing. If I have severe insomnia I increase the dosage and take 3 but usually 2 is plenty. quality is good, well made. You usually see benefit and effect within 15minutes. Size is good, I don't use everyday and I am using with my family, lasted for 2months. Just repurchased."
1,70243,2024-04-25,Very effective,I take it occasionally for sleep problems and it works and benefits early sleep. The dosage of a gummy is fab and taste is nice. The size is small. I like the ingredients and quality. My age is mid 30-ties and sometimes I have problems with sleep which can be fixed with this gummy 
2,70243,2024-10-17,"SleepWell, Natural White Tea & Peach","The tea leaves are fragrant and fresh, and you can tell they use high-quality ingredients. The white tea base is delicate and smooth, providing a light and refreshing taste. Each tea bag brews perfectly, releasing a lovely aroma that fills the room. The calming properties of the white tea, combined with the peach flavor, create a perfect bedtime ritual. I’ve noticed a significant improvement in my sleep quality since I started drinking this tea regularly."
3,70243,2024-10-06,SleepWell,The fact that this tea is made from high-quality natural ingredients gives me confidence in what I’m drinking. I appreciate the focus on wellness and the absence of artificial flavors or additives. It feels good to know I’m consuming something wholesome. The combination of natural white tea and peach creates a perfectly balanced taste that is both refreshing and soothing.
4,70243,2024-09-19,Sleep Well,"The Sleep Well Natural White Tea and Peach Gummies are excellent for promoting sleep. The flavor is pleasant—nice and not overly sweet, making them enjoyable to take before bed. After purchasing them several times, I’ve had no issues with digestion, which is a big plus. I do believe they work, but for best results, they should be combined with other sleep-supporting habits, like a good nighttime routine. They're definitely a helpful addition, but not a standalone solution for improving overall sleep quality."
5,70243,2024-09-01,Deliciously Calming and Effective Sleep Aid!,"SleepWell Natural White Tea & Peach is has been a delightful addition to my nightly routine. The flavor is simply amazing—light, refreshing, and perfectly balanced with a hint of peach. It’s a soothing drink that I genuinely enjoy sipping before bed.

But it’s not just about the taste—this tea really works. After a cup, I feel more relaxed, and falling asleep has become easier. I wake up feeling rested and without any grogginess, which is something I’ve struggled with when using other sleep aids.

If you’re looking for a natural, tasty way to wind down in the evening, I highly recommend SleepWell. It’s a delicious way to improve your sleep quality!

This review highlights both the flavor and the effectiveness "
6,70243,2024-07-29,Game changer for my daughter at night,These are amazing & a complete game changer for our daughter who has struggled for a long time with switching off at night. Just x1 gummie 45 mins before bed & she's so much more relaxed & calm & gets to sleep straight away. I'd recommend these to anyone who struggles with switching off at night 🌙 🙂 👌 
7,70243,2024-07-21,Sleep well!,"""I've been struggling with sleep issues for a while, but this sleep supporting pill has been a game-changer for me. I've tried numerous remedies in the past, but none have worked as effectively as this one. The pill helps me relax and fall asleep faster, and I wake up feeling refreshed and well-rested. I appreciate that it contains natural ingredients and doesn't leave me feeling groggy in the morning. It has become an essential part of my bedtime routine, and I no longer have to toss and turn all night. If you're looking for a reliable and effective sleep solution, I highly recommend giving this sleep supporting pill a try. It's been a total lifesaver for me!"""
8,70243,2024-05-15,Love these ,"I’m absolutely loving these. I was showing this flavour by a friend and they taste amazing The of size is really great as well. The dosage says to take two however I have found that even if I just take one so that it’s 3 mg you can still get the benefits and they last longer and I think that’s great for me since taking two would be too much of a dosage. The ingredients are not nasty and there’s no allergens. The quality is also really shown and through all of this brands products, the quality is amazing."
9,70243,2024-05-13,Amazing sleep! ,"Review update after about 4 months. I’ve never waited for something like this. It’s seasonally unavailable and as soon as it’s back in stock, I’m buying it all! I will make sure that I will never be without this ever again. 

Tastes lovely, 1 about 45 minutes before bed is enough. I’ve been having the most comfortable sleep and it doesn’t cause weird dreams like most sleep helpers do. The only bad part is that apparently it’s out of stock/seasonally unavailable for months. "
10,70243,2024-04-29,很好！,I don't know do I have sleeping problem before but I would like to have a better quality sleeping pattern so I give SleepWell a try. I can fall asleep faster after taking it. Will come back to comment again if there is a sufficient result after I finish my first bottle
11,70243,2024-04-26,,"they are a delightful and effective way to support a restful night's sleep. These gummies offer a natural blend of ingredients and a delicious flavor that makes taking them a pleasure.

Each gummy provides a burst of fruity sweetness with a subtle hint of white tea. The taste is pleasant and not overly sugary, making it easy to incorporate into your bedtime routine.

One of the standout features of these gummies is their sleep-supporting formula. They are infused with a blend of botanicals and nutrients that are known for their calming properties. Ingredients like chamomile, passionflower, and lemon balm have traditionally been used to promote relaxation and improve sleep quality. I found that taking the recommended dose of these gummies before bedtime helped me unwind and prepare for a restful night's sleep."
12,70243,2024-02-13,Kinda yummy,They were so good and you can only say that if you finish a bottle.  Just saying.  Also worth mentioning is that it's free from aspartame in its ingredients which causes me extreme migraines.  It is sweetened with Sucralose which I love.  It is a subtle dosage  as I only need a small amount of melatonin to benefit me and it tastes good.  
13,70243,2024-01-10,VitaFusion SleepWell Gummies: Dreamy Slumber in Every Bite,"VitaFusion's SleepWell Gummies in Natural White Tea & Peach flavor are a delightful addition to my nighttime routine. With 60 gummies in each bottle, they offer a tasty and convenient way to support a good night's sleep. The gentle blend of flavors is soothing, and the melatonin aids in a restful sleep without grogginess. If you're looking for a delicious and effective sleep aid, VitaFusion SleepWell Gummies are a dream come true."
14,70243,2023-11-15,Best melatonin supplements! ,"Love how tasty it is & it is sugar free ! I have sleep so much easier & better since I take this gummy ! I have been having insomnia for a long time & this one really does help, unlike other melatonin in the form of pills, I just pop this gummy every night right before bed and my sleeping pattern has improved ever since !"
15,70243,2024-06-29,,"

‎‏good quality .. perfect size .. good package .. good benefits .. use good for skin .. good smell 
I am 30 age 

good quality .. perfect size .. good package..  good benefits .. good taste for diet 
I am 30 age "
16,70243,2024-05-02,Good,"‏One of the products that I order again and again, the price is suitable for the quantity, the 
‏product is great,I recommend buying it
"
17,70243,2024-03-30,Good product ,"exactly what i was looking for, Good product & good price. and the most favorite vitamins, Great product for me ,I am really happy with this product"
18,70243,2024-03-01,,"I love it!!! love how tasty it is,,,it's a sugar free,I have sleep so much  easier and better,,I take 2 gummies after  30 minutes and I feel sleepy,,,,"
19,70243,2024-02-04,Tasty,"quality is really good, and the scent is like candy. It doesn't hurt my teeth. Usually, I can't chew gummies, but this one didn't hurt me at all. Size is perfect also its gorgeous 😍 "
20,70243,2024-09-03,Tasty and Effective Gummies for a Good Night’s Sleep!,"VitaFusion SleepWell Gummies have been a game-changer for my wife’s sleep routine. The natural white tea and peach flavor is delicious, making it easy to take them before bed. She notices a gentle relaxation effect that helps her fall asleep faster and wake up feeling refreshed without any grogginess. The combination of melatonin and natural ingredients works well, and the gummies are easy to chew with no unpleasant aftertaste. Highly recommend these for anyone looking for a tasty and effective way to improve their sleep!"
21,70243,2024-03-04,wonderful taste:-P,"the taste of this gummies is so good that I am tempted to eat the whole bottle at once! l try to stay down to 3 gummies before going to bed and it definitely helps to stay on sleep longer, l do not take it every day so my body doesn't get used to it but l alternate it with other supplements like thryptofan, Gaba etc"
22,70243,2024-01-23,Works as intended,"I got caught out by the dosage - it's 2 gummies, not 1. But I suppose this also is beneficial if you wish to take only 1.5g of melatonin, which I plan to do. They taste great, like peach iced tea. Not sure what benefit the additional herbal ingredients have, but they do the job in helping me sleep. I think they must be good quality, as I went down from 10mg capsule to these without any disturbance to my sleep."
23,70243,2024-08-11,Прекрасно!,"Thank you very much for this product, it suited me, I like the packaging, comfortable and stylish, I will order more of these products, and recommend them to all my friends and relatives! good!!
"
24,70243,2024-07-20,,"It helps me sleep well at night. The gummies are really chewy which makes it feel soft and like easy to  eat. Also, the effects work well after 15 mins of just reading a book and then you'll start to feel drowsy. High recommend. "
25,70243,2024-07-19,Tastes so good and it works,"The size is more than enough and lasts a long time, and it really benefit me to sleep fast without waking up tired, so the quality overall is very great, i recommend "
26,70243,2024-07-04,Best Product,"the ingredient in it is not harmful for our body I had been taken more than 1 years, once taken u will fell asleep around after 1 hour time, good for those not easily to sleep "
27,70243,2024-06-12,Прекрасно!,"Thank you very much for this product, it suited me, I like the packaging, comfortable and stylish, I will order more of these products, and recommend them to all my friends and relatives! good!!
"
28,70243,2024-06-04,Love these!,"They taste like chamomile which was a very nice surprise to me. I really enjoy the texture and I have noticed a change in my sleeping patterns. The dosage could be a bit better, but I just take 4 gummies before going to sleep so no biggie."
29,70243,2024-05-31,Good experience,"First time trying sleeping gummies and was glad that it worked as intended, and I did not feel sleepy after waking up!

Good for ADHD patients as it can relax and calm down your brain before you head to sleep."
30,70243,2024-05-26,Good gummies ,"The product had a good taste and I believe it helped improve my sleep. However, I later switched to pills instead of the gummies, as the gummies contain sugars that required me to brush my teeth afterwards."
31,70243,2024-05-12,Прекрасно!,"Thank you very much for this product, it suited me, I like the packaging, comfortable and stylish, I will order more of these products, and recommend them to all my friends and relatives! good
"
32,70243,2024-05-11,Melatonin,Puts me out fast I only take one but it says to take 2. Take a couple of hours before bed because makes me groggy in the morning 
33,70243,2024-05-05,Can’t live without!,"First of all, I can’t live without melatonin! 
Stimulants growth hormone secretion through pathways other than the growth hormone-releasing hormone during your sleeping. I take it for years!!!
Sugar free and best brand ever"
34,70243,2024-05-01,"Small, yum and effective ","Our 3yo loves them, asking for a gummy each night! We have had much easier putdowns with our daughter falling asleep within 10-15 mins!"
35,70243,2024-04-30,,"effective way to support a restful night's sleep. These gummies offer a natural blend of ingredients and a delicious fruits flavor that makes taking them a pleasure.
Good quality and good taste. "
36,70243,2024-04-16,Great supplement for sleep,"So nice gummies recommended for sleep, exceptionally good taste and remarkably effective.  I have to renew my order, they are very good for inducing sleep! Thank you!"
37,70243,2024-04-09,auntie's fav,"its my aunt's fav, she has been having insomnia for long, it does a VERY VERY great job to her. And its just a gummy~ recommend!"
38,70243,2024-04-03,Works Well,"Tastes great and actually makes me sleepy, unlike other sleeping tablets I've tried. I have been struggling with insomnia, but these gummies seem to have helped. Thank you!"
39,70243,2024-04-01,Good flavour,"I’ve got one kid who likes this flavour (subtle tea flavour with a bit of peach and one who doesn’t. The gummy is good, easy to chew. Child asleep around 30 mins after taking which is amazing, they are now able to get a full night sleep. 
. "
40,70243,2024-03-29,,"This is an awesome product, my daughter of 21 years and i take it every night and we sleep well, and wake up fresh and ready for the next day... we love it"
41,70243,2024-03-18,"great product, must buy","love it. the size is great. love gummies tipe. the dosage just nice, i wont get headaches in the morning. taste great, love the peach. "
42,70243,2024-03-07,Great,"The candy is good in taste and there is no complaint from my child. The effect is good, my child can sleep very soon after taking it. The price is very reasonable when compared with other brand with same effect"
43,70243,2024-03-06,Wonderful things,"Lovely taste gummies, made me feel sleepy within about 20-30 minutes of taking - helped me sleep through the night without the groggy feeling in the morning!"
44,70243,2024-01-30,Very good brand ,I’ve used this sleep well gummies and it helped me to manage my sleeping as it is easy to take and tastes great and the size is convenient and the it was delivered in a good quality and it i have got a great benefit for my case 
45,70243,2024-01-30,fixed my sleep,"loooooove it made me doze off within 30 minutes and fixed my sleeep since i usually wake up every hour or so, made me sleep deeper"
46,70243,2023-12-09,,the gummies taste good. I love to take 2 before sleep and I fell asleep easily. won't feel too tired when woke up. gonna stock up more as this item is always out of stock
47,70243,2023-03-23,,"My favourite for emergency insomnia. I like the taste very light, refreshing. If I have severe insomnia I increase the dosage and take 3 but usually 2 is plenty. quality is good, well made. You usually see benefit and effect within 15minutes. Size is good, I don't use everyday and I am using with my family, lasted for 2months. Just repurchased.
"
48,70243,2024-08-31,unsure,I didn't notice a great difference with my sleeping patterns and circadium rhythm with this product I chose it because of the ingredients they see myI didn't notice a great difference with my sleeping patterns and circadium rhythm with this product I chose it because of the ingredients they see my k
49,70243,2024-04-25,,"Tastes good, but I don't think melatonin is for me. I already have really vivid, long dreams, and this made it a little worse. "
50,70243,2024-04-13,حلو ,"By God, it's nice, but he's plunging, it's numb, it's true to the extent that I feel the same effect of the operations"
51,70243,2024-03-23,Tastes yummy and works,"These taste so good, easy to chew too and works within 30 minutes. Effects last for about 4-5 hours, so not slow release melatonin, but definitely helps with sleep."
52,70243,2024-03-02,I like it ,The quality is good the ingredients are nice smell like an ice tea drink n taste nice too the dosage is 2-4 if you can’t sleep the benefits are so good the size is nice small chewy gummies 
53,70243,2024-02-15,,"Great quality, good taste but I prefer cherry flavours but generally recommended. size is good and dosage may be up to 10 mg for me "
54,70243,2024-01-02,,"It worked like a charm to be honest and it is also tasty, keep in mind it helps you to sleep better but doesn’t get you to actually sleep"
55,70243,2023-11-22,sweet taste and good for sleeping,I've been eating this supplement for at least few years. Every time when I found myself hard to sleep I eat this and it's getting better.
56,70243,2023-06-06,,"It’s very high quality and very good size , is made from different ingredient and the taste from several fruits also it has very good benefits also it’s it’s can use with dosage it make the bady calm and relax and can the person sleep very well and especially it’s super free"
57,70243,2023-01-28,,"the quality is good when it arrive
the ingredients are fine with me
the size is just right
the dosage is just fine
the taste is good. kinda want to chew more

the picture is not related since it isn't with me. i give it to someone. just got the chance to try it for 3 days "
58,70243,2024-07-25,Sleeeeep,Amazing quality supplement comes in cute little stars taste great too like herbs and fruits
59,70243,2024-06-26,Great,Very nice fruity taste since it comes in gummy form. Very helpful with our sleep.  Will definitely order it again
60,70243,2023-11-27,Luar biasa!,"thank you fast response and very Quick recommend 👍🏻
I will order again later,❤"
61,70243,2023-02-21,Чудово!,"These are the best sleeping pills. They act gently and taste pleasant. It should be taken about an hour before bedtime. They prolong sleep and improve its quality. Because I have been under stress for the last year, I use them almost every day, they will help to sleep well even in not very favorable conditions. I also bought it for mom and dad, they also help them get enough sleep. Wonderful!"
62,70243,2022-11-20,," brand works extremely well. I have taken melatonin in pill form off and on over the last several years with mixed results. While it generally helps me to get to sleep, I would often wake up in the middle of the night and have a hard time going back to sleep. That is not the case with these gummies. Within 10 minutes of taking just 2 of these, I'm ready for sleep and I sleep through the night"
63,70243,2022-10-22,Excellent! Sugar-free but great taste,"3 mg of melatonin per dose is just right for a restful night of sleep without feeling groggy the next day. Love the chewy texture and taste of these gummies - sweet but not overly so, even though they are sugar-free. Small size gummies that are good for adults as well as kids!"
64,70243,2023-10-03,The best ,Even when I take them later in the night they always work to send me off to sleep and they don’t make me feel drowsy in the morning. They are a great staple to have in the drawer for those night when you just really struggle to get off to sleep. Also good for my teen if he gets overstimulated before bed. 
65,70243,2023-09-07,Great!!!,"brand works extremely well. I have taken melatonin in pill form off and on over the last several years with mixed results. While it generally helps me to get to sleep, I would often wake up in the middle of the night and have a hard time going back to sleep. That is not the case with these gummies. Within 10 minutes of taking just 2 of these, I'm ready for sleep and I sleep through the night"
66,70243,2023-07-15,,"They're excellent. highly recommend.  the strength is perfect for those restless nights. the 3mg dose is perfect for kids and not too strong. I even cut them in half sometimes and the kids don't mind taking them because they're gummies. we've tried melatonin chewables in the past and they don't like them as much, because who wouldn't rather a gummy, right?? I will definitely be buying these again. 5 stars from us!! they do not cause them to be dizzy. at bedtime they fall asleep faster as they aid alot in routine. "
67,70243,2023-07-15,Sleep like a log!,"I sometimes don’t sleep too well due to my job and shifts, I was looking for something natural to take and these fit the bill. I didn’t expect them to work so well. They are really great tasting and they work. I can fall asleep within minutes with these."
68,70243,2023-07-03,,"great quality product. it really works as intended. Will definitely get more soon! Thank you so much for this. it was made of high qualiy ingredients. Plus the packaging and sizes were perfect. over all good quality. i love the smell and the looks of it. im looking forward to purchasing another one!
"
69,70243,2023-06-27,,"Melatonin is a remarkable hormone that plays a crucial role in regulating sleep-wake cycles and supporting healthy sleep patterns. Produced naturally by the body's pineal gland, melatonin helps promote feelings of relaxation and drowsiness, making it easier to fall asleep and stay asleep throughout the night. Additionally, melatonin is a powerful antioxidant that may have potential benefits for immune function, mental health, and even aging. Melatonin supplements are widely available and can be a safe and effective way to support healthy sleep patterns, particularly for those who struggle with insomnia or jet lag. Overall, melatonin is an important hormone that can have a profound impact on overall health and well-being, making it a valuable addition to any healthy lifestyle."
70,70243,2023-05-28,,"It brings very good sleeping quality.  It tastes very nice and easy to chill. It’s very helpful for sleeping problem and help derp sleeping. I have bought many times already. The ingredient is natural which doesn’t cause addictions or any side effects.  As I have serious sleeping problems, so I usually take 8 pills before sleeping."
71,70243,2023-04-24,Excellent! Tastes great!,"I initially bought this for my son, but I ended up using it myself as well, and I'm impressed! The taste is great, and it works just like regular melatonin. What sets it apart is that I noticed feeling much better the next morning compared to taking regular melatonin. Highly recommended!"
72,70243,2023-04-08,,"Tasty gummies that aid with sleep. I slept better when taking them 20-30 minutes before sleep. I had this weird feeling which I never have without them where my eyelids felt so heavy that my eyes closed on their own, haha. However, it was a more physical reaction, while my brain was still quite awake, but still I fell asleep and slept soundly."
73,70243,2023-04-08,,"I absolutely love SleepWell Natural White Tea & Peach 60 Gummies! These gummies are a game-changer for my nighttime routine. The combination of natural white tea and peach flavor is both delicious and soothing. I find that I fall asleep faster and stay asleep longer when I take these gummies before bed.

Not only do these gummies help me sleep better, but I also wake up feeling refreshed and energized. I appreciate that they are made with natural ingredients and are vegan-friendly, which aligns with my values.

The packaging is also convenient, making it easy to take these gummies with me when I'm traveling or on-the-go. I have recommended SleepWell Natural White Tea & Peach 60 Gummies to my friends and family and will continue to do so."
74,70243,2023-01-16,,great quality product. it really works as intended. Will definitely get more soon! Thank you so much for this. it was made of high qualiy ingredients. Plus the packaging and sizes were perfect. over all good quality. i love the smell and the looks of it. im looking forward to purchasing another one!
75,70243,2024-10-14,Прекрасно!,"excellent product,good and strong packaging , the quality matches the description, I will still recommend ordering to everyone!!! okay"
76,70243,2024-10-08,,Its easy to take and i help me with my sleep
77,70243,2024-10-07,Great quality product,Great quality product with great benefits and also great value for money. 
78,70243,2024-09-28,,"Love this brand, good value for money, I highly recommend it"
79,70243,2024-09-22,,Really good quality try and will buy next time easy to use 
80,70243,2024-09-21,Tasty,Great taste and effective! Definitely recommended and would purchase again. 
81,70243,2024-09-04,,Great package with good quality digestive enzymes for gut and stomach helps with hard training and excellent energy age good size and dosage 
82,70243,2024-08-27,Very good to help to fall asleep,This is the best melatonin sleeping gummies I have ever tried.
83,70243,2024-08-14,tasty,"Good quality, good ingredient, convenient candy size, good dose for boys too, mild taste  "
84,70243,2024-08-10,Ok,"I don’t know if it’s good or not . To be fair, should take a bit longer to see the results "
85,70243,2024-07-30,Wow,"It is a grate product for those who have sleep problems , its just amazing"
86,70243,2024-07-21,I love it,I start using it and i like it i am waiting for the benefit 
87,70243,2024-07-02,Not bad,"Didn’t see the expected benefits, but it has good ingredients. Good taste and good packaging."
88,70243,2024-06-24,brilliant,"daughter has adhd,this is the only product I have found that helps her fast asleep before 1am "
