,product_id,date_posted,review_title,review_text
0,99064,2024-08-05,Still testing,"In my home country, melatonin is not over-the counter available, and so most people order it online. Many brands are out there, and the quality is not always easy to check. I have recommended this brand to patients, as the dosage seemed coherent (5 mg) - added lavender is a nice touch - be however aware that this last ingredient has also recently been found to increase concentration in certain people (from what I got from the study, from people who already have high estrogen and or high chronic stress.)"
1,99064,2024-06-06,Great ,"It does what it supposed to. Smaller dose which I like, next to no headaches from it (only occasionally if tired or had late night etc). No irritation to stomach & easy to swallow capsules. However melatonin supplements do not help with staying as sleep. Only aid for falling asleep though. "
2,99064,2024-03-26,,"Enhance your sleep quality with Nature's Answer Melatonin+, available on iHerb. This bottle contains 60 vegetarian capsules, each packed with 5 mg of melatonin, a hormone naturally produced by the body to regulate sleep-wake cycles. With its convenient size, it's perfect for daily supplementation to promote a restful night's sleep. Formulated with high-quality ingredients, including melatonin, valerian root, and chamomile, Nature's Answer Melatonin+ helps you fall asleep faster and stay asleep longer, supporting overall well-being and vitality. I've noticed improved sleep quality and a more refreshed feeling upon waking since incorporating Nature's Answer Melatonin+ into my nightly routine. Plus, the vegetarian capsules are easy to swallow and suitable for various dietary preferences. Highly recommend for anyone looking to support their sleep naturally. Don't miss out on the benefits of Nature's Answer Melatonin+—order yours today from iHerb!"
3,99064,2024-01-31,Restful Sleep Support in Vegetarian Capsules,"Nature's Answer Melatonin+ offers effective sleep support with 5 mg per 60 vegetarian capsules. The thoughtfully formulated supplement prioritizes natural ingredients and provides a lasting supply. I've experienced improved sleep quality, thanks to the precise melatonin dosage and additional sleep-supporting components. For those seeking a reliable and natural sleep aid, Nature's Answer Melatonin+ is highly recommended."
4,99064,2024-01-01,,"The quality is good! Ingredient list is clean and healthy ! Taste is awesome! Size is just perfect! I love this bar! Package is easy to take it with you! Benefits from GF diet are countless! You can just grab one of these to a fitness, workout, training and have it as a protein!"
5,99064,2023-12-01,Amazing ,"""I recently tried a health product that has positively impacted my overall well-being. Its natural ingredients are a big plus, providing a gentle yet effective approach to health. I've noticed an improvement in my energy levels and general vitality. The product was easy to incorporate into my daily routine, and I appreciated the lack of any harsh chemicals or additives. It’s reassuring to find a product that delivers on its promises without causing any side effects. While individual experiences may vary, for me, this has been a worthwhile addition to my health regimen."""
6,99064,2024-04-29,Great,Melatonin+ is a supplement that combines melatonin with other ingredients to support sleep. It's commonly used to help regulate sleep-wake cycles and promote better sleep quality. Many people take Melatonin+ to aid in falling asleep faster and experiencing more restful sleep.
7,99064,2024-02-12,,"Overview:
Nature's Answer Melatonin+ is a dietary supplement designed to support healthy sleep patterns and promote relaxation. This review evaluates the product based on its ingredients, effectiveness, safety, value for money, and overall quality.

Key Features:

Melatonin Formula: Each capsule of Nature's Answer Melatonin+ contains 5 mg of melatonin, a hormone naturally produced by the body to regulate sleep-wake cycles. Melatonin supplementation may help improve sleep quality, reduce sleep latency, and alleviate symptoms of insomnia and jet lag.

Vegetarian Capsules: The product features vegetarian capsules, making it suitable for individuals following vegetarian or vegan lifestyles. This ensures broader accessibility and meets the preferences of diverse consumer groups.

Additional Ingredients: In addition to melatonin, Nature's Answer Melatonin+ may contain other ingredients such as valerian root, chamomile, or other herbal extracts known for their calming and sleep-promoting properties. These complementary ingredients enhance the product's effectiveness in promoting relaxation and restful sleep.

Ingredients and Benefits:

Melatonin: Melatonin is a hormone synthesized in the pineal gland in response to darkness, signaling the body that it's time to sleep. Supplementing with melatonin may help regulate sleep patterns, especially for individuals with insomnia, jet lag, or shift work-related sleep disturbances.

Valerian Root: Valerian root is a herb commonly used in traditional medicine to promote relaxation and alleviate anxiety and insomnia. It may enhance the sedative effects of melatonin and contribute to better sleep quality and duration.

Chamomile: Chamomile is well-known for its calming properties and is often used as a natural remedy for insomnia and anxiety. It may help reduce stress and promote relaxation, supporting a more restful sleep environment.

Effectiveness and Benefits:

Improved Sleep Quality: Users of Nature's Answer Melatonin+ report experiencing improved sleep quality, including faster sleep onset, reduced nighttime awakenings, and deeper, more restorative sleep. The combination of melatonin and complementary herbal ingredients promotes relaxation and creates conducive conditions for falling asleep and staying asleep throughout the night.

Reduced Sleep Latency: Melatonin supplementation can help reduce sleep latency, the time it takes to fall asleep after going to bed. By initiating the sleep process more efficiently, individuals can enjoy a more seamless transition from wakefulness to sleep, leading to a more satisfying and rejuvenating sleep experience."
8,99064,2024-02-02,,"Thank you very much for this product, it suited me, I like the packaging, comfortable and stylish, I will order more of these products, and recommend them to all my friends and relatives! good!!
"
9,99064,2024-01-13,,"Thank you very much for this product, it suited me, I like the packaging, comfortable and stylish, I will order more of these products, and recommend them to all my friends and relatives! good!!
"
10,99064,2023-12-27,Best Place to PUrchase Melatonin,Use this melatonin for my son who has high energy and this has been useful for when it is time to wind down before bedtime. Althought the 5mg is a bit of a high dosage. I just open the tablet and empty part of the capsule. Good quality ingredients.
11,99064,2023-10-07,Another great sleep aid products and quality is great,you can smell some of the herbs which are in it which means they are actually using herbs and not artificial things. you can trust this brand and this one is expensive usually but I get it when it is on sale. which i love to use for sleep aid...
12,99064,2023-03-06,とても素晴らしい！,The quality and ingredient and size and package and dosage and benefit and taste of this product is very good. It has slight essential oil’s flavor and really improves my insomnia a little. It is a not bad melatonin. The quality is very good. I think I will buy it again.
13,99064,2023-09-01,good,"
检测到中文(简体)
英语
通用领域
AI翻译

Capsules have a herbaceous and fragrant taste, which is better than tablets. Occasionally, I have difficulty falling asleep. If I eat them half an hour to an hour early, they will fall asleep faster and not frequently, so there is no drug resistance. On normal days, my sleep is not affected, and my favorite melatonin will always be repurchased.
"
14,99064,2023-01-24,,"This is perfect supplement with great ingredients. I didn’t need a big amount of melatonin to see any benefit. Taking more of it doesn’t make it work better or faster. Start with a small dose. If you find you need more, you can slowly take more over time. I started with 5 milligrams and ended with 10 milligrams daily. It depends on your body size since I am really tall "
15,99064,2024-09-29,Perfect Dosage !,Perfect dosage for me. I love these quality products which contain only what I need.
16,99064,2024-05-29,good,works good. good dosage size and tastes good. overall benefit to sleep
17,99064,2024-04-06,Best combo for sleep,Melatonin with lavender! This works better than the usual melatonin only formulas you find in other brands.
18,99064,2024-02-24,,great quality for the money. good dosage and ingredients. i like it
19,99064,2024-01-29,很好！,"I like it, it makes me happy. I buy it for my family "
20,99064,2024-01-15,Good quality,"Calming and works well. Good quality, packaging, ingredients. 5mg dose okay. Tasteless. Size/quantity just about right. Will use again."
21,99064,2024-01-10,It works,It works as mentioned in the write up - happy with product.
22,99064,2023-12-21,,This Melatonin it’s good to take it when you need to help your body to go to sleep. It gives a goodnight sleep.
23,99064,2023-12-15,As a parent of a ASD kid,"I recommend this product. As a parent of a kid with ASD, this is helping with a little dose and it is herbal."
24,99064,2023-11-19,,"Works wonders for having a nice sleep overnight, even a half tablet is enough"
25,99064,2022-04-01,Very effective with not much side effect!👍🏻,"Tried many brands b4, lately tried ‘AllergyResearchGroup’ in pump liquid form (2-3pump every time, 1mg per serving/pump), within 30 mins it gives uncomfortable drowsiness for quite some time and not much effect on falling into sleep smoothly but very heavy-head for the first 1-2 hrs in sleep.  Then I wake up in he middle of the nite and don’t fall back into sleep easily.  Wake up the next day with Uncomfortable Drowsiness like cloudy-head and also feeling ‘slow’ during the day. 
Then Decided to try ‘NATURE’S ANSWER’. 
5mg is not a mild dosage I learned b4. 
Only 5mg capsule they have, also take effect within 30mins but with No obvious heavy-head feeling and I fall as sleep smoothly and comfortably. Even after mid-nite toilet break I’d fall back into sleep and wake up the next day without much headache or strong ‘slow-head’ side effect.  I feel I had rested for the nite with a good sleep. 
However, I believe it’s not a long term solution and hope can sleep better naturally in the future!👍🏻"
26,99064,2023-09-01,,The product package is lovely and quality also great! I have to take two of these to aid with falling asleep so I change to a 10mg dose.
27,99064,2023-05-20,,"Quality is food, ingredient is vegetable, size and portion is great. The energy is good and it has great health benefits. It improves my skin. It hs some carotene and tastes good. Antioxidant  the dose of MG is great. "
28,99064,2023-04-11,,"good average melatonin, i don't think it's possible to sleep well without adding some another mix of quite sleep with magnesium, GABA etc"
29,99064,2023-04-08,,I am so glad I have began taking this. It does help me with sleep and takes an hour before I am fully asleep. I have improved sleep patterns. 
30,99064,2023-01-18,ممتاز!,Wonderful ❤️❤️❤️❤️❤️❤️❤️❤️❤️❤️❤️❤️❤️❤️❤️❤️thank you for it i like it ist work it! 👍🏻👍🏻👍🏻
31,99064,2022-11-17,,The capsules are a small size and easy to swallow. I like the lower dosage of melatonin. The essential oil ingredients are a blend of good quality herbs effective for sleeping 
32,99064,2022-11-14,,Love this melatonin. Has other good ingredients list and clean as well. I take one dosage half hour before i sleep works like a charm. I have insomnia so this helps a lot. Great quality as well. 
33,99064,2022-11-02,,I accidentally took this during the day and I was so sleepy during my work! So this definitely works. The mg dosage is quite high so sometimes I get weird dreams but I get great quality sleep. 
34,99064,2022-09-16,Excellent form of Melatonin ,This was my first time using t this brands form of Melatonin and I wasn’t disappointed. I found within 30 minutes I began to feel more relaxed as it helped induce sleep. It brought me an uninterrupted rest I needed through the night without any heaviness in the morning. A high quality supplement that has made my top three ! Definitely recommend it to others 
35,99064,2022-05-03,Fantastic and helped my sleep so much!,"smells amazing and works like a dream. Pun intended! I have had sleep issues since childhood, and despite still having issues this helped me to relax and fall asleep quicker. i still wake in the night but it was lovely to feel mentally more relaxed sleepy after taking this. The quality and ingredients are great, the size is easy to swallow and the dosage worked like a dream for me. "
36,99064,2023-09-29,‏A good experience,‏Quality for the price I recommend buying. Effective. I'll try to buy another mirror.
37,99064,2023-03-24,Ok - Works and then it doesn´t,"It works, until it doesn´t. Did not feel like moving up the dosage so I stopped taking them completely. They worked for about two weeks."
38,99064,2023-09-23,Like it,"I like it includes lavender and other things, to work with the melatonin,"
39,99064,2023-10-12,i feel like a sleeping beauty,"it saved me, it almost dried me crazy because i can't fall into sleep and i am super tired"
40,99064,2023-09-09,,quality is great smells good size is enough doesnt taste though
41,99064,2023-08-20,מצוין!,"I love it 
Got it very fast 
High quality 
Will buy again soon"
42,99064,2023-07-29,,"I'm so satisfied of this product, packed well and great customer service. I love it ,Thank you"
43,99064,2023-05-30,,"Will order again and again, good price and natural. Helps me to sleep well."
44,99064,2023-05-27,,"High quality ingredients,, big size , adult age dosage benefit in 
Sleep disorders , not bad taste"
45,99064,2023-05-14,Melatonin,"I sleep  better after taking this melatonin 
1-2 hours before bed."
46,99064,2023-03-13,,great melatonin and its fast acting giving a good deep sleep
47,99064,2023-01-31,,This is a great product for people who can't sleep helps to relax &  helps with sleep it also helps my stomach 
48,99064,2023-01-17,,Quality ingredients is perfect. Size is ideal as well. Very helpful
49,99064,2023-01-07,,"Most melatonin products give me crazy, stupid dreams.  But this one doesn't.  Great product!
"
50,99064,2023-01-07,מצוין!,Helps my poor night sleep and works great.  It also support the brain. 
51,99064,2022-12-04,,Works well. Good quality and ingredients and size. Taste ok 
52,99064,2022-11-28,,I like that there are added essential oils. This product works for me!
53,99064,2024-08-29,Just okay,This melatonin is just okay. It's hard to tell if it works or not. I will keep trying it.
54,99064,2024-07-17,not that efficient ,"This is supposed to be a 5 mg but it didn't ""work"" on my parents. Kal's is so much better"
55,99064,2024-02-29,Melatonin,ingredients seems to have a negative affect on my testosterone levels. I would not buy again.
56,99064,2022-08-22,,5mg strength matches me. It is always a great quality and let me sleep in peace. Also quick delivery feels confident. Ingredient doesn't have any problem to me.
57,99064,2022-04-22,,Best melatonin brand according to my husband. He is using a different brand before but he preferred this Natures Answer Melatonin better. Been ordering to Iherb since the start of pandemic and Iherb always deliver without fail. Thank you Iherb.  
58,99064,2021-11-21,,The 5 mg melatonin is effective as a sleep aid for me. I have a good night's sleep and am not groggy the next morning..I also find the herbal blend ingredients are the perfect addition to melatonin. 
59,99064,2023-05-16,,"Second purchase.  5mg is quite sufficient.  Size of tablet is small, easy to swallow."
60,99064,2023-03-09,,"Works well, capsules are easy to swallow. Can taste the lavender."
61,99064,2022-12-11,,It works as good as any other melatonin that I have tried. 
62,99064,2021-05-16,,"Best Melatonin I've purchased. Other's work only because you should not use Melatonin daily (it will cause your natural melatonin manufacturing to deplete). This one is 5mg versus 2mg (possibly not effective for elders or 10 mg, seems too much). The bonus is the addition of the oils. I'm getting the best sleep (quality, dreams, time) ever. Note, if using for jet lag I would simply use Dr. Best's 5 mg. melatonin. But for a great night sleep I use this 2 or 3 days a week, at most. And I find after getting a good night sleep on this product the next night  its easier to fall asleep naturally. Note: Melatonin is in abundance in children and youths so... I am not a supporter of the recent rise in Melatonin for children.  Yes, its beneficials if you have Covid-19 but not for prevention."
63,99064,2021-08-19,Excellent melatonin with lavender! ,I have use different brands of melatonin and this one is the one that works for me. It taste lavender (the capsules). Make me sleepy around 30 minutes to 1 hour. Does not make me drowsy the next morning. It's a vege cap so it's suitable for vegetarian. Plus it's melatonin 5 mg with essential oils that is good for sleeping. The only thing I disliked is the tiny bit strong lavender taste and smell. Other than that it's a good melatonin. Proven to work for me. Plus not a lot of fillers and binders in each capsules. Try it especially if you like lavender.
64,99064,2021-06-21,,"This one really works miracles for me!
Reorder on the way. 

Edit
i bought it again, and i cant wait until its time to take it. giving the fact that im chronically ill with 24/7 anxiety plus depression for years,  then for me it is a miracle when something deprived from nature works so well."
65,99064,2020-12-15,Good other ingredients,"I’ve been suffering from awaking 4 hours after falling asleep. I took 1 cap for 10 days so far, and I don’t see any difference from other melatonin such as LifeExtention’s Melatonin 3mg which contains only melatonin or QualityOfLife Melatonin SR. I was hoping the herbs this Melatonin + contains would improve my intermittent sleep. All melatonin products I tried gave me strong drowsiness right after taking them, but unfortunately they don’t lead me to sleep throughout the night. In my experience, less blue light at night, good excise in the sun before breakfast, not eating too much supper with low GI carbs, and meditation will be more helpful for sleeping throughout night. But still I will take melatonin for boosting up my cognitive function and immune system. One thing I like this Melatonin+ is about less harmful other ingredients. No stearate is nice."
66,99064,2020-09-09,So far so good,"Actually helped me sleep earlier. Gave me confusing dreams and i wake up a little irritated in the first two hours but fall back to a deep 9 hour sleep minimum.

A bit difficult to wake up in the morning but no lasting effect throughout the day.

I only tried it for a few days and not sure if it will remain effective or building tolerance "
67,99064,2023-09-21,So So ,Would not buy it again Melatonin helps me fall asleep but I wake up about 3-4 hours later and cant fall back asleep.
68,99064,2021-01-27,,"I like this product a lot because in addition to containing 5 mg of melatonin, it also contains, among other things, passionflower and lavender, which also show a relaxing and calming effect, thus contributing to easier fall a sleep and not waking up during the night.

"
69,99064,2020-12-14,Higher-dose Melatonin,"Good manufacturer.  I originally purchased these at a TJX store and liked the cleaner ingredients, and especially the nice blend of herbs and essential oils, including Lavender, which is a well-known calming herb.  I consider this a higher-dose melatonin that should probably not be taken every single night.  I've always taken 1-2 mg at most, since it is actually a hormone, so being careful not to take too much is advisable.  I take this on occasion when I have the time to get good sleep (which should really be EVERY night!).  It typically seems to work well for me.  "
70,99064,2022-10-17,,I love the inclusion of lavender with this Melatonin.  I love the inclusion of lavender with anything!  Highly recommend.
71,99064,2022-10-15,,"Good ingredients, perfect dosage,good quality and perfect sleep 
Igot its benefits "
72,99064,2022-07-05,,I just had benefits with this high quality mix of ingredients. My nights of sleep improved significantly.
73,99064,2022-05-22,,These work well and the lavender is a great addition helping calm the system and no residual sleepiness the next day.
74,99064,2022-05-05,,I can get to sleep quickly and have  a restful sleep.
75,99064,2022-05-01,,works like magic and love thats its in capsule form
76,99064,2022-03-31,,Best natural Melatonin i found so far and i will purchase it again .
77,99064,2022-01-14,,"it really help me in sleeping, now i can fall a sleep within 10 minutes."
78,99064,2022-01-07,,I love these capsules as a sleep aid. All natural. They work very well.
79,99064,2021-11-16,Good product,"Works, very nice. I purchased because it was a low price at around $8 and it contains actual lavender essential oil."
80,99064,2021-10-02,,"I used to eat it.  Smell good with peaceful sleep.  It’s work well, take for 10 minutes to wait.  Also it is natural product and vegan friendly.  Reasonable price."
81,99064,2021-08-22,," I like this supplement, I tried a few brends, but this one is very good. Also my family members use it, and they feel great as me."
82,99064,2021-02-23,,"This works well without any side effects. it gives me a good night sleep and has a slight taste of lavender.
I take these whenever I feel like I need a good nights sleep.."
83,99064,2021-02-12,Helps me stay asleep! ,"Effects are not immediate but once I started taking these regularly, I was able to fall asleep easier and stay asleep longer. 5mg seems to be the perfect dosage for me, never waking up feeling groggy and instead very well rested. "
84,99064,2020-12-27,,I have tried many different Melatonin products. They have all been doing the trick! This though - feels like a little extra with the natural lavendler in the capaules. Works great 😴
85,99064,2020-05-03,Amazing product! Best night’s sleep in years 😊,"These capsules are amazing! Since I started taking them, I have had the most restful sleep in years. Plus, I am able to wake up feeling refreshed and ready for my day! I highly recommend them to everyone 😊"
86,99064,2022-06-26,,"

These can be help with sleep and are easy to swallow.  I like that they have lavender and that they're vegan."
87,99064,2022-04-30,,I don't sleep well but these do help some.
88,99064,2022-04-23,,The size of The cab so it’s really satisfied.   I thought they would be bigger. 
89,99064,2022-04-22,,Pretty good combination of herbs and melatonin. I will purchase it again. 
90,99064,2023-06-27,,"Nice for relaxation and a deep sleep, and it  tastes delicious"
91,99064,2020-09-14,,"I sometimes take this when I cannot sleep.  Sometimes it helps, and sometimes nothing seems to help.  But I guess sometimes is better than never!  My trouble is menopausal/hormonal related."
92,99064,2022-07-27,,"I personally don't feel it worked for me, I wasn't very sleepy at all which is the main reason I bought this product."
93,99064,2022-05-16,,Works great! Will buy again
94,99064,2022-05-15,Excellent! Service and fast postage,Great experience all round. Fast post 
95,99064,2022-03-14,,"it helped me to sleep well, very good

"
96,99064,2022-02-09,,"absolutely love this product,  I highly recommend"
97,99064,2022-01-29,,Must have any time I need it.
98,99064,2022-01-28,很好！Very good product great I love it ,Very good product great I love it 
99,99064,2021-09-05,,"Very recommended product. I use it often and it definitely helps me fall asleep.

"
100,99064,2021-03-12,,I got so relaxed and slept deeply and couldnt get up to work 
101,99064,2021-02-27,Works well,I have purchased this multiple times for over a year and feel relieved to have discovered it.
102,99064,2021-02-19,,I fall asleep and stay asleep very quickly after taking this 
103,99064,2021-02-10,A promise to sleep well,"Had bought for my Mother, Sister and me. It's working. A quiet mind before sleeping, and good night is really good night!"
104,99064,2020-12-26,,"I love that this product because it not only contains melatonin, but also other natural ingredients to support a healthy night's sleep."
105,99064,2020-12-07,,"I love that this product not only contains melatonin, but also other natural ingredients to support a healthy night's sleep."
106,99064,2020-05-07,Relax,"Helped me with my insomnia, I tried infusions and lavender before but it didn't work. This product does the trick."
107,99064,2022-05-30,,not too much fillers and works good
108,99064,2021-09-25,,Good quality melatonin product. Doesnt taste that good but its not taken for taste!
109,99064,2022-02-01,,Amazing and natural 
110,99064,2020-10-09,,It works when I have difficulties to sleep
111,99064,2021-03-20,Didn't work,Looked like some good ingredients but didn't help with falling asleep or staying asleep. it actually made me a bit sleepy next day some times as well. Would not reorder
112,99064,2021-02-21,,It's working! Good product. 
113,99064,2021-10-06,,Love the ingredients.  Great price and natural.
114,99064,2021-04-18,,Shipped timely. Very good value.
115,99064,2021-04-03,,I sleep very good with these melatonin. 😉
116,99064,2020-12-10,,Very effective. Had deep sleep first day taking it.
