,product_id,date_posted,review_title,review_text
117,99064,2020-06-10,Restful sleep,Restful sleep with no lingering effects in the morning 
118,99064,2020-06-07,Lacto-Bif 100 Calofornia Gold,"It has 100Billion  , the strongest potency  maybe I have yet to find out the difference from the previous probiotic I took."
119,99064,2021-02-13,,good to have one if you not sleep well
120,99064,2021-08-16,,Good
121,99064,2021-08-11,很好！,good
122,99064,2021-08-09,很好！,Pure taste!
123,99064,2021-05-09,,effective
124,99064,2021-04-22,,"Nice 



"
125,99064,2020-12-12,,Good for insomnia 
126,99064,2020-12-10,,helps with sleep issues
127,99064,2020-06-14,Great Product,Great product
128,99064,2021-08-28,لا بأس,Not bad 
129,99064,2020-12-16,,Not helping with insomnia.
130,99064,2024-01-18,They are lavender passionflower chamomile,"I've been an iherb customer for years, I used to buy from Brazil, now I buy from Portugal. They always sent well packaged, quickly, the package was always protected. I choose my supplements from the most trusted brands, gluten-free, lactose-free, I pay close attention to the ingredients and I value vegan ones, because the quality always stands out. I have no problems with capsule size, smell or flavor, I take it calmly, I put the benefits and other values above that. I take it to help reduce the number of times I go to the bathroom in the early hours of the morning, I take the recommended dose before bed. Melatonin also has a powerful antioxidant and anti-inflammatory action, in addition to being able to act as a neuroprotector and participate in actions such as modulating the cardiovascular system, improving memory, glucose metabolism and others. Leave a thumbs up if it helped with your research"
131,99064,2024-01-07,,"This melatonin is an exclusive patented plant-derived melatonin that is much safer than chemical synthesis and animal-derived melatonin. It also contains lavender/organic cedar/chamomile/passionflower, which can also help relax and calm your mood, reduce anxiety, and make you feel better. It is easier for people to fall asleep easily. This is my favorite, kills two birds with one stone."
132,99064,2023-12-11,Nurseling,"I've taken it 4 times already. Working drug. I drink this melatonin with an UltraMaga capsule. And you know what I’ll say? It helps, it really helps. Many of us in Ukraine now need helpers for nerves and healthy sleep. And just helpers against the horror into which Russia has plunged us."
133,99064,2023-12-10,I bought it based on others' experiences,I felt its usefulness was normal. I don’t think I would buy it again. I didn’t feel it was useful to me in sleeping. It’s normal to buy a cheaper type and I can benefit more from a better one.
134,99064,2024-07-13,Sleep better,"When I take this melatonin, I get sleepy within an hour and fall asleep naturally. If the pills are large, they feel like they are stuck in the back of my throat, and I gradually get tired of taking them, so I end up not taking them at all, but these are small, so I can take them without any trouble. I gradually get to sleep naturally without taking them, and it's also nice that I can gradually stop taking them without any dependency."
135,99064,2024-05-20,Melatonin,"For my sleep I take it with magnesium, good dosage, the benefit is felt on my sleep, ingredient and quality of the product generally good, I don't feel the taste because I take it with a large glass of water, the size is correct. I take it when I have trouble sleeping 😴 "
136,99064,2024-02-08,vitamin,"The vitamins are good. Probably suitable for everyone, but you need to get tested and see a nutritionist. Nowadays it’s impossible to live without vitamins! Good quality. I strongly recommend it. There will be benefits. The taste is not for everyone)) Any natural vitamins and dietary supplements with the composition D, D3, B, A, C, E, Omega, Zinc, as well as liquid vitamins, and much more, when used correctly, ultimately have a good effect on the skin, the heart, the cardiovascular system, etc. For children, it is necessary to know the dosage. Take care of your health."
137,99064,2024-01-17,,"Excellent supplement, good value for money, natural ingredients. Nervous system support Easy on the stomach Suitable for vegetarians and vegans Melatonin is essential for the proper functioning of many body systems. It helps maintain normal muscle function, supports the nervous system, promotes tissue formation and energy production. I recommend ordering"
138,99064,2024-01-04,Simple ingredients,"I like it because it has few additives and has a high content of 5mg. When you put it in your mouth, it has a faint herbal scent. I can't taste it, but I heard that melatonin is good for anti-aging, so I'm taking it with high expectations."
139,99064,2023-11-27,When you can't sleep,"I don't drink it every day, but I do drink it before going to bed. I've also heard that it's good to drink it in the evening, but personally, I can't stand the drowsiness after about 2 hours of drinking it, so I choose to drink it at night. I drink it when I can't fall asleep or want to get a good night's sleep."
140,99064,2023-11-21,Quality sleep support!,"I have been buying for several years now for my Dad, who has trouble sleeping. He takes this melatonin in periods. The size of the pills and the taste are comfortable to swallow, the dose is sufficient for a stocky man, the quality is impeccable. The advantage of these pills is that the ingredient contains not only melatonin, but also a collection of calming herbs. I tried to buy similar pills from other manufacturers, but Dad likes these, so my choice for the future is clear. I recommend!"
141,99064,2024-02-27,,"My husband is almost addicted to it and he only sleeps while using it, which does not let anyone sleep without using anything to sleep. "
142,99064,2024-01-05,Good,me siento contenta con estas pastillas me hace dormir mejor ya que yo tenía problemas para dormir las recomiendo mucho me han ayudado mucho ami de verdad funciona me tomo una media hora antes de acostarme okokokokokokol okokokokokokol okokokokokokol okokokokokokokol okokokokokokokol okoko kokokokokol okokokokokokol okokokokokokol okokokokokokol okokokokokokol okokokokokokol okokokokokokol okokokokokokol okokokokokokol okokokokokokol okokokokokokol okokokokokokol okokokokokokol okokokokokokol okokokokokokol okokokokokokol okokokokokokol okokokokokokol okokokokokokol okokokokokokokol okokokokokokokol okokokokokokol okokokokokokol okokokokokokol okokokokokoko kol okokokokokokol okokokokokokol okokokokokokol okokokokokokol okokokokokokol
143,99064,2024-09-30,Excellent!,I used to take another melatonin. I like this one better in terms of quality. Plus it's vegan. I recommend it to anyone who has problems with sleep!
144,99064,2024-09-19,It works,I always had trouble sleeping and now since I started taking these gummies my sleep has improved a lot now I can rest well and the best thing is that it is not addictive.
145,99064,2024-09-17,,"I just fell in love with this product, it is one of my favorite brands, I trust the quality and benefits, the ingredients are the best, packaged securely, very easy to drink, I will wait for the results, I will continue to drink, I recommend it to everyone!"
146,99064,2024-09-17,Melatonin +,"Supplement with natural ingredients in beautiful packaging. Provides quality Sleep. Dosage per capsule is 5 mg. Benefits: sound sleep, cheerful, energetic morning. Neutral taste. No addiction of the product. Medium capsule size "
147,99064,2024-09-10,Melatonin,"I had the impression that this manufacturer mainly deals with herbs, but they also sell melatonin. People with sleep disorders are asked to try different types of melatonin in order."
148,99064,2024-08-23,Melatonin is an essential supplement,I drink it every day. It helps me sleep naturally. The amount of ingredients is just right and it doesn't have a strange taste. I also like that it has antioxidant properties.
149,99064,2024-08-21,the best,I have always looked for melatonins because I have trouble sleeping and so does my husband. I decided to try this one and I was really surprised by the result. I fall asleep faster. Other brands have never done this. It is a very good quality product.
150,99064,2024-07-13,On a calm night,"In addition to the melatonin effect, the subtle floral scent when you put it in your mouth is nice. I think it's lavender, but it's not very herbal, so I'd recommend it to people who don't like lavender."
151,99064,2024-06-27,A quality supplement,"The product in a glass jar..looks invested and serious. I tried several girlfriends, this one seems to suit me the best. Pills are easy to swallow."
152,99064,2024-06-22,Excellent.,"Melatonin+ provides 5 mg of melatonin and a proprietary blend of lavender and cedarwood essential oils. It has excellent ingredient composition. It also provides a Phytotherapeutic Complex, including chamomile flower, passion flower and linseed. This brand is of excellent quality."
153,99064,2024-04-26,,"It is nice for those who do not want sweetness, whether for its taste or texture. The beautiful thing about sweetness is that you eat the amount you want (control the dose more), but this is also good. "
154,99064,2024-04-04,,"It has a natural lavender flavor. Just taking one pill will make you feel very sleepy. You will sleep deeply and comfortably. There are no side effects when taking it, which makes you feel relieved."
155,99064,2024-03-28,,"great quality and size. ideal ingredients and dose, the benefits are excellent, sleep quality really improves a lot. I no longer have insomnia problems since I started taking this supplement. "
156,99064,2024-03-21,enhanced melatonin,Helps to fall asleep faster and comes in handy when you need to adjust the sleep mode. It has an improved effect due to auxiliary components.
157,99064,2024-03-03,Melatonin,"melatonin is the “sleep hormone”. It acts on our body gently and quickly. In this case, taking melatonin helps improve the duration and quality of daytime sleep, which has to replace nighttime sleep. Unlike many sleeping pills, after taking melatonin we wake up alert and active."
158,99064,2024-02-04,Fit,"I ordered a variety of melatonin plus herbs, but this one works for me. I think the herbs are probably mixed perfectly. I would actually like to try something similar that's just herbs. If you found this review helpful, please click the like button."
159,99064,2024-01-09,high quality melatonin,"I've been using melatonin for about 10 years. I try out various types and repeat what I like, and this is one of them. It's 5mg so I wouldn't recommend it for beginners, but it works for me. I think it's high quality melatonin."
160,99064,2023-12-20,,Quality 👍 Ingredients 👍 Quantity 👍 Minerals 👍 The packaging is of great benefit Rich composition Immune deficiency A wonderful nutritional supplement Side effects are not good Repeated once a day Taste none
161,99064,2023-11-20,The best I've had so far,"I had never experienced the relaxing feeling before taking melatonin, but it invites you to sleep from the moment you open the bottle! The soft aroma of lavender fills the environment, giving a moment of relaxation and well-being. I recommend it."
162,99064,2024-08-12,"Second place, I guess.",I have tried many different melatonin products but have not been able to find one that works for me. This product was the second most effective of all the ones I have purchased.
163,99064,2024-02-10,Prominent,"It is excellent, consisting of melatonin and lavender, and it calms the nerves, but I did not feel its effect. It is very strong for sleep, but it helps you calm down, clear the mind, and enter sleep."
164,99064,2024-01-25,I can't let go,"When you're alert when you should be sleeping, you can't let go of it. I also like that my head feels refreshed the next day.
"
165,99064,2023-03-06,,"When I purchased this supplement because I was worried about insomnia due to menopause (waking up in the middle of the day and waking up early in the morning), this supplement was the best. (I've tried most of the other iHerb products, but this is the only one that led to repeat) I use a sleep app, but the graph on the day I drank this clearly shows non-REM sleep."
166,99064,2023-12-22,,Quality Ingredients Quantity Dosage Benefit Skin Package Hair Effect Tocopherol Antioxidant Taste Dosage Sun Immunity Bone Absorption
167,99064,2023-06-06,,"It is part of the B complex vitamins that provide support for healthy hair, skin and nails. It is an essential nutrient for the normal metabolism of carbohydrates, proteins, and fats. The quality of the ingredients, the quantity, the skin, the packaging, the benefit, the nails, the collagen, the dermatitis, the improvement of the taste."
168,99064,2023-05-28,I feel that the effect time is long,"I have tried several melatonin supplements, including sustained release ones, but this product seems to work the best. I take melatonin every other day on days when I don't take melatonin, and on days when I don't take melatonin, and days when I take this product + 3mg of the sustained-release product for a total of 8mg. ."
169,99064,2023-01-26,Excellent!,"The taste of the capsule and the smell of lavender in it is wonderful and refreshing..but it does not last long, as soon as the capsule is swallowed, the taste and smell disappear..what I noticed in this supplement with the rest of the melatonin supplements is that it makes me get up from sleep after 3 hours, and I wonder how I can go back to sleep, not everyone gets it So, but I am among the members of my family who go through this thing with melatonin, as for the packaging, it comes in a tinted glass, and this is good for me. Great lavender taste"
170,99064,2023-07-28,,"I bought this for my elderly father who tends to reverse day and night. I chose this because the melatonin supplement that I regularly purchase was sold out. It's a capsule so the contents can be taken out which is especially good for my dad who has trouble swallowing! As for the quality, I think it's a good thing because I'm sleeping soundly (but not too much sleep)! A feeling of size is just right without being big, too."
171,99064,2023-03-11,,"Mashallah, excellent, wonderful, very beautiful, I loved it, Glory be to God, and praise be to God, and there is no god but God. Mashallah, excellent, wonderful, very beautiful."
172,99064,2023-10-04,very good,"The quality and quantity are sufficient. The packaging is very complete. Use it 20 minutes before going to bed to help you fall asleep. I personally feel that the size is just right. Use it daily and the effect is good. It is recommended for personal health. If my review is helpful to you, please click ""Like""🧡"
173,99064,2023-09-09,,Now I can declare that I can really rest thanks to melatonin because of its chosen quality ingredients I have liked the dose excellently I repeated it as indicated and I get up with impressive energy the taste is not unpleasant and I like the size of the dose without I certainly recommend it for its benefits.
174,99064,2023-07-27,good,"For a while, I was taking NOW FOOS melatonin 3mg. I bought this product as a trial. There is a feeling that this one has a higher degree of sleep. It contains herbs and essential oils, but you can hardly smell the scent even after taking the capsule. So I don't think it's a problem if you don't like herbs or essential oils. The size is smaller than NOW FOOS 3mg."
175,99064,2023-06-23,,"I bought it for a relative and it turned out well with the daily dose, its ingredients are natural and of high quality. There are benefits to being able to sleep well. The capsule size is normal and there is no unpleasant taste after taking it. Everything turned out for a better sleep and when waking up without difficulty, it does not create dependency."
176,99064,2023-01-08,,"The natures answer brand uses good quality ingredients, since the results are felt within a short time of consumption. Melatonin does not have the same reactions in all people, so it is better to take into account the time you have to consume it if it is to sleep. It can be from 2 hours, 1 hour or immediately that it takes effect. The capsules are flavorless and the glass container is a good size."
177,99064,2022-11-10,It smells good and it's easy to fall asleep,"I've tried many things with iherb, but this one seems to work for me. I ordered Solaray's Sleep Blend SP-17 because it was out of stock, but this one has a nice scent and is surprisingly relaxing. Frequent sending in the middle of the night has also decreased. However, I feel more sleepy during the day than with melatonin 10mg."
178,99064,2024-09-28,,"Excellent quality, suitable size, easy to use, suitable packaging and high benefit"
179,99064,2024-09-22,Melatonin,Excellent product. Good packaging quality. Rich composition and ingredients. I definitely recommend it to everyone.
180,99064,2024-09-19,Melatonin,The quality of the packaging is excellent. The taste is neutral. I take it daily. I am very happy with the order.
181,99064,2024-09-17,Melatonin,The quality is excellent. The family is delighted. There are many benefits. I recommend and advise everyone. Cool
182,99064,2024-09-17,Melatonin,"The quality of the packaging is excellent. I always pay attention to this. The ingredients are natural, the composition is excellent, rich. "
183,99064,2024-09-16,,Received in excellent condition. Packaging is not damaged. No smell. The jar contains 60 vegetarian capsules. 
184,99064,2024-09-16,,Received in excellent condition. Packaging is not damaged. No smell. The jar contains 60 vegetarian capsules. 
185,99064,2024-09-01,,"I usually use 10mm, but maybe 5mm or 10mm would make little difference."
186,99064,2024-08-27,excellent,"the perfectly measured dose, melatonin being an antioxidant for the brain! And with plants to support falling asleep"
187,99064,2024-07-31,I recommend,"At first, I bought another company, but when it ran out of stock, I bought this one. Not worse than anything. I recommend"
188,99064,2024-04-23,A dream,"The effectiveness of this melatonin is 5+. In combination with other extracts, it works 100%, I fall asleep very quickly. I recommend "
189,99064,2024-04-22,,"Excellent quality and size, 100% natural, flavorless ingredients and very good value for money "
190,99064,2024-04-20,,The ingredients are safe and the effect is very good
191,99064,2024-04-06,I can feel the effect.,I was able to fall asleep within 30 minutes of taking it.
192,99064,2024-04-05,Prominent,"It is excellent for sleeping. It relaxes the nerves and does not cause headaches. On the contrary, you wake up and are active"
193,99064,2024-04-04,,"I am very proud of the fast delivery and quality products, melatonin with herbs will help you sleep well)"
194,99064,2024-03-26,On a sleepless night,I bought it for my family. It seems to fall asleep naturally.
195,99064,2024-03-22,,It’s really effective and tastes great. I recommend buying it.
196,99064,2024-02-05,good product," quality products, helps you sleep, the dosage is well balanced with other plants, no special taste "
197,99064,2024-01-23,,supplements made from quality ingredients with appropriate sizes and dosages to help improve sleep quality in order to improve body health
198,99064,2023-12-29,Excellent,"Very good ingredients with essential oils, perfect dosage, allows better sleep"
199,99064,2023-12-11,good,"Very useful, effective, highly recommended! Good quality, large portions, safe ingredients"
200,99064,2023-11-10,excellent,"An excellent product, a natural solution when there is difficulty falling asleep, I take a pill half an hour before bed"
201,99064,2023-11-05,lavender scent,"I've tried various melatonin products, but this is the first time I've used one with a lavender scent. You can sleep peacefully."
202,99064,2023-09-02,,"Among the melatonin products, I feel that the content of this product is very high. I hope that if you insist on taking it, it will have a good effect."
203,99064,2022-09-01,,"After two weeks and a little of taking it, it really improves sleep once and helps to enter deep sleep. Insomnia is relieved. Its ingredients are very gentle and a large amount does not harm. The price is excellent. Really great quality. I strongly recommend it. I went back and bought a second package. I finished the first and used melatonin from the pharmacy. The result was unfortunate: headaches, uncomfortable sleep, nightmares, and lethargy. Actually, this has very nice results. I recommend excellent melatonin. I have repeated the purchase"
204,99064,2023-08-13,,"I don't really drink much. The quality seems to be good, and I have no worries about it, but when I'm insomnia, I can't sleep right away, but I have to take it in advance. This is a capsule with a good flavor and you can drink it comfortably. I think 5mg of melatonin is just right. The size is easy to drink, and it is a stress-free supplement."
205,99064,2023-01-13,,"Lavender is useful for relaxation and sleep, so I asked for it and it works well (Glory be to God and praise be to Him, Glory be to God the Great)"
206,99064,2024-04-29,OK,"good company, large selection of quality vitamins and minerals. I'm happy with the purchase"
207,99064,2023-11-12,,"The product will be used and re-evaluated later, God willing"
208,99064,2023-10-06,Excellent!,Melatonin is a great way to improve sleep quality and fight insomnia. This product from Nature's Answer contains melatonin and other natural ingredients to help you relax and fall asleep faster. I feel more rested and alert after using this product.
209,99064,2023-10-02,Very good dosage,"Melatonin is our main “sleep hormone.” It speeds up falling asleep, reduces the frequency of night awakenings, and improves well-being after waking up in the morning."
210,99064,2023-09-05,,"The natural herbal ingredients in this Melatonin product make it even more convincing for me to use it for a long time, especially since the composition of the ingredients is balanced."
211,99064,2023-09-01,Helps to sleep,"I didn’t think that I would have a problem with sleep, but it happened in the spring, I drank the course and it became easier, I began to sleep all night, my anxiety went away"
212,99064,2023-07-07,,"Natural melatonin. You tear out one pill and after 15-20 minutes you have to go to sleep. If you see through this moment, there will be no effect)))"
213,99064,2023-06-27,,"A while ago, I couldn’t sleep well at night, and it was difficult to fall asleep. I bought it with the mentality of trying it out, and it worked for me. I didn’t feel groggy after waking up. I would like to try other brands again."
214,99064,2023-05-15,,"My son is prescribed at the hospital, but I can't get it, so I bought it here. When I drink it, I feel like my head is quiet. Also, I learned that it has anti-inflammatory effects, so I appreciate that effect."
215,99064,2023-05-06,,"A high quality. The size is not large, comfortable. The taste is a little grass. I began to fall asleep faster and sleep better. I believe that this complex is very covered, well-chosen ingredients. The dose is good, drink only at night. I will buy more."
216,99064,2023-04-18,,"The mixture of herbs with melatonin are the ingredients that help me relax before bed, in the morning I can already feel the benefits of the product"
217,99064,2023-04-04,,"I've been taking sleeping pills for about two years, but I tried sleeping with only supplements without sleeping pills. How can I say that! Isn't this better! You can wake up refreshed without feeling sluggish. It's sad that you can only buy one bottle."
218,99064,2023-03-25,,"Sleep becomes more restful, stress levels decrease drastically. Sleep peacefully and wake up refreshed. The benefits are felt after using 1 month, the body is fitter"
219,99064,2023-03-16,,"Melatonin for a good, calm, good quality sleep 👍🏻 I take it for the first time. I need to drink the whole bottle and I’ll definitely write an honest review"
220,99064,2023-02-13,good,"The capsule size is small. I don't really notice any taste. It's a supplement, so it's just a placebo effect, but sometimes I can sleep properly."
221,99064,2023-01-23,,Very high-quality non-synthetic drug. It's not the first time I take it and I trust it. I advise you to start with 2.5-3 mg. This is already for people 65-70 +
222,99064,2023-01-04,Excellent!,"Regulates the sleep-wake cycle, daily changes in locomotor activity and body temperature, positively affects the intellectual and mnestic functions of the brain, and the emotional and personal sphere. Promotes the organization of the biological rhythm and the normalization of night sleep."
223,99064,2022-11-14,,"I sleep like a baby, I have been drinking for about 2 weeks. The dosage is optimal, the taste is neutral, the size is excellent. Herbal ingredients are what you need. I liked the quality."
224,99064,2022-10-23,,Melatonin regulates sleep by acting on the body's biological clock (sleep and wake cycles). Melatonin is produced naturally in our body by the pineal gland in the brain.
225,99064,2023-02-19,,"For those who suffer from difficulty sleeping and insomnia at night, melatonin helps them solve this problem"
226,99064,2024-08-29,,"The size of the capsule is average, the quality is good, but the potency is low. It may have a cumulative effect."
227,99064,2024-07-11,,It was just an ordinary night. It was an ordinary night.
228,99064,2023-06-29,Melatonin + herbs are good,"It's not just a melatonin tablet, it's a capsule containing melatonin and several herbs. Taking these herbs and melatonin together made me feel even better"
