,product_id,date_posted,review_title,review_text,scores,compound,sentiment
1187,101873,2023-06-24,,"Mommy's Bliss Kids Liquid Melatonin Sleep Aid for Kids 3+ Grape Flavored 120ml is a beneficial supplement designed to help children sleep better. Each serving contains melatonin, a natural hormone that regulates the sleep-wake cycle. It helps the child to relax and fall asleep more easily. The 120 ml pack provides enough product for a long time, and the grape flavor makes it more appealing to children. Mommy's Bliss is a renowned brand specializing in children's health and wellness products. They adhere to high standards for the quality and safety of their products. It is important to note that each child is unique and the response to melatonin may vary. It is recommended to consult a pediatrician or pediatrician before use, especially if your child has special needs or health conditions.","{'neg': 0.0, 'neu': 0.744, 'pos': 0.256, 'compound': 0.9878}",0.9878,pos
1188,101873,2023-06-11,,"I give it to my 4 year old. I usually sleep well, but on holidays when I fall asleep in the evening, I am full of energy even after 22:00. However, if you give this to him, he will sleep again in about 30 minutes. Once, I wanted to put him to sleep immediately after taking a bath, so I gave him a drink before taking a bath, but it didn't work at all.","{'neg': 0.0, 'neu': 0.889, 'pos': 0.111, 'compound': 0.765}",0.765,pos
1189,101873,2023-05-14,,"It tastes good. I give it to my son from the age of one and a half years, but I do not adhere to the written quota. I give him 0.2 ml, significantly improving sleep quality. Big enough for months, I have repeated the purchase several times due to its benefit in regulating sleep.","{'neg': 0.0, 'neu': 0.827, 'pos': 0.173, 'compound': 0.8641}",0.8641,pos
1190,101873,2023-04-19,,"It is helpful when your child has trouble falling asleep or when traveling by plane. It's syrupy, so you can put a drop in juice or just lick it with a spoon. I don't use it often, but it's a supplement that I want to repeat when it runs out. When I licked the taste a little, it was sweet and delicious!","{'neg': 0.072, 'neu': 0.739, 'pos': 0.189, 'compound': 0.8623}",0.8623,pos
1191,101873,2023-03-20,,"My 3-year-old autistic son has trouble falling asleep, so I'm using this. Even though I used only half of the prescribed amount, I was able to sleep straight. I'm planning to repeat it because I use up one bottle, but recently I have trouble falling asleep with half the amount, so I'm thinking of doing it with the prescribed amount. Since it is for children, it can be used safely.","{'neg': 0.116, 'neu': 0.807, 'pos': 0.077, 'compound': -0.2144}",-0.2144,neg
1192,101873,2023-03-18,,"Melatonin - supports the sleep process in children. My son was 10 months old. The child had a problem with falling asleep from birth. He lay in bed for a long time, tossed and turned, gets up and lies down again. Then I learned about this miracle melanin. I gave it an hour before bedtime, then at the appointed time the child falls asleep in 5 minutes. The child himself likes the Taste. Of course, we cannot do without a pediatrician, he approved and prescribed the Dosage. A high-quality and mild sleeping pill, it helped us a lot with overexcitation.","{'neg': 0.091, 'neu': 0.814, 'pos': 0.095, 'compound': 0.3331}",0.3331,pos
1193,101873,2022-12-01,FOR THOSE CHILDREN WHO HAVE SLEEPING PROBLEMS,"Melatonin is a salvation, not only for adults, but also for children. It works great, it helps, it improves sleep. _____________________________ The ingredients are chamomile, lemon balm, passionflower, and most importantly melatonin - that is, the mixture is aimed at helping to sleep soundly. _____________________________ Packing for 120 ml - enough for a long time, because this remedy is not taken on an ongoing basis, even adults. The dosage in 2 ml is 0.5 mg of melatonin. For children, the initial dosage, if the child is already an adult or the weight is large, the dosage can be increased. Best taken 30-60 minutes before bedtime. We remove all gadgets, turn off the light and fall asleep.","{'neg': 0.0, 'neu': 0.781, 'pos': 0.219, 'compound': 0.9832}",0.9832,pos
1194,101873,2024-06-11,The best sleeping fluid for children,"It helps to arrange sleep and put the child into a deep and safe sleep, and its composition is natural and safe","{'neg': 0.0, 'neu': 0.609, 'pos': 0.391, 'compound': 0.872}",0.872,pos
1195,101873,2023-08-09,,"Excellent, it comforted me, and God used it for my daughters, the age of two and 8 years. They do not exceed half an hour, but they do not sleep, and it does not cause addiction. Excellent quality. Its aroma and taste are grapes. A wonderful product. I recommend it","{'neg': 0.0, 'neu': 0.682, 'pos': 0.318, 'compound': 0.9593}",0.9593,pos
1196,101873,2023-01-30,,"I bought this syrup for myself, because I can no longer fall asleep on my own due to the baby's frequent awakenings, so I decided to try this syrup. the taste is a bit sweet, you need to drink it later, the ingredients are good and safe, the use is simple - you only need to take it half an hour before going to bed, the size is not large. As soon as I finish the bottle, I will see if there will be an improvement after stopping the drug, and I will add a review.","{'neg': 0.039, 'neu': 0.839, 'pos': 0.122, 'compound': 0.8402}",0.8402,pos
1197,101873,2022-09-21,,"For me, this melatonin is just a salvation🙏 My son is 3.6 and he is a hyperactive child both during the day and at night, he used to fall asleep for a long time if he sleeps during the day, and often woke up at night and called me to walk around the apartment with him🤦🏻‍♀️ in general, I don’t slept with him. Now we take melatonin 2 ml for two weeks, there is a convenient syringe in the box, and I can already see that he sleeps much calmer, does not wake up at all at night or wakes up to go to the toilet. This syrup has a good composition, since before using, I consulted with a pediatrician and a neurologist, the doctors approved, and I finally get enough sleep😁 If my review was helpful, please like it 👍🏻👍🏻","{'neg': 0.0, 'neu': 0.886, 'pos': 0.114, 'compound': 0.93}",0.93,pos
1198,101873,2024-08-13,Children sleeping soundly,"I give it to my baby about 30 minutes before he goes to sleep. It comes with a dropper, so it's a bit of a pain to have to suck it up and wash it every time. But it helps him sleep soundly.","{'neg': 0.094, 'neu': 0.828, 'pos': 0.078, 'compound': 0.0772}",0.0772,pos
1199,101873,2024-04-25,normal,"It can be effective for children, but not for adults. The size and price are appropriate. The taste is unacceptable to me, causing what looks like sourness in the throat.","{'neg': 0.11, 'neu': 0.744, 'pos': 0.146, 'compound': 0.0772}",0.0772,pos
1200,101873,2024-04-17,Liquid for good sleep,"I bought it for my son who had trouble sleeping, woke up full at night. Can't say it helped, we didn't see a change","{'neg': 0.114, 'neu': 0.886, 'pos': 0.0, 'compound': -0.4019}",-0.4019,neg
1201,101873,2024-03-03,popular,"Sometimes it sleeps and sometimes it doesn't make any difference. I don't know why, but it's fine. This is the fourth time I've bought it","{'neg': 0.0, 'neu': 0.913, 'pos': 0.087, 'compound': 0.296}",0.296,pos
1202,101873,2024-01-29,good product,"I received the product, I will update my review. I bought this for my child and it is the size and package in good condition.","{'neg': 0.0, 'neu': 0.879, 'pos': 0.121, 'compound': 0.4404}",0.4404,pos
1203,101873,2024-01-02,good,"To be honest, when I used it, my son felt lethargic on the second day. I don’t know if it was from him or if he didn’t get enough sleep.","{'neg': 0.07, 'neu': 0.825, 'pos': 0.105, 'compound': 0.2732}",0.2732,pos
1204,101873,2023-10-19,,"We have been using it since May, as prescribed by a doctor. My 3.5-year-old daughter’s sleep has improved, she sleeps peacefully until the morning, she wakes up in good spirits, her general condition has improved, she has become calmer, more cheerful, and the kindergarten teachers have also noticed improvements in behavior. I give less than a full teaspoon half an hour before bedtime. This is really my salvation 👌! ","{'neg': 0.013, 'neu': 0.721, 'pos': 0.266, 'compound': 0.9653}",0.9653,pos
1205,101873,2023-10-19,Helped,"I have no doubts about the quality of the supplements from this company, so I boldly ordered it for my child, no extra ingredients, easy to use, the dosage is not large, I took it to build a schedule for the child. It lasts for a long time, after the course there is half a bottle left, the taste has a slight taste of grapes. He helped us","{'neg': 0.096, 'neu': 0.815, 'pos': 0.089, 'compound': 0.1384}",0.1384,pos
1206,101873,2023-10-18,works,"I love the products from Mommy Bliss, they really work! it tastes like grape juice, in liquid form it is of course more convenient to use than in tablet form, the dosage must be selected individually, they write that it is possible from 3 years old, I use it only sometimes when it is difficult for a child to fall asleep on his own, I do not recommend giving it on a regular basis","{'neg': 0.084, 'neu': 0.781, 'pos': 0.135, 'compound': 0.7224}",0.7224,pos
1207,101873,2023-10-15,Even for my elderly mother,"I myself have delayed sleep phase syndrome and am using a product from another company that has the lowest content, but it was out of stock so I decided to buy this one, which also has a low content. I'm not used to using a syringe, so I use an empty dropper. After my mother was discharged from the hospital, she seemed to be having trouble sleeping, so I asked her to take it, and it worked really well, and now she takes the initiative to take it herself. My mother doesn't like medicine, but supplements seem to be OK, and the grape flavor seems to get used to her as well. The fact that a small amount of 6 drops is enough for the effect makes it safe to continue taking it. However, the dropper type is convenient.","{'neg': 0.099, 'neu': 0.807, 'pos': 0.094, 'compound': 0.3}",0.3,pos
1208,101873,2023-10-12,Great for kids.,"Very good quality. Delicious, grape flavor, the kids love it. I mainly give it to my oldest son, age over 9. Comes with a special syringe that is very convenient to use. Packaging size like a Norofen bottle. in daily use. There is an improvement in sleep from time to time. Dose according to age.","{'neg': 0.0, 'neu': 0.702, 'pos': 0.298, 'compound': 0.9615}",0.9615,pos
1209,101873,2023-10-12,I recommend,Great syrup! Quality at a height. Children fall asleep quickly. Pleasant taste. The ingredient is soothing herbs. Use every day. Large bottle size. Advantage has a syringe to prevent spillage and an adapter. Frequency of daily use. Syrup to improve sleep. The child's age is 2.6 and liked the syrup. The portion is conveniently taken with a syringe.,"{'neg': 0.0, 'neu': 0.719, 'pos': 0.281, 'compound': 0.9501}",0.9501,pos
1210,101873,2023-10-06,Melatonin,"Melatonin that really works. I gave the child another before that, but there was no such effect. Excellent quality and selected ingredients. Grape flavor that my son likes. The advantage of this melatonin over others is that the child falls asleep quickly. This is the third package we have taken. Age from 3 years. A supplement that I recommend","{'neg': 0.042, 'neu': 0.743, 'pos': 0.215, 'compound': 0.9136}",0.9136,pos
1211,101873,2023-10-05,Too effective,"I gave this to my 3 year old 13kg child. I usually have trouble falling asleep and get excited when I get sleepy, so I was giving her a different melatonin-only liquid supplement, but this one was more cost-effective and had good reviews, so I bought it to try it out. As for the taste, they don't seem to like it, so they have no choice but to drink it. The 3-year-old was told to drink 2 ml, so I gave him exactly that, and he fell asleep within 30 minutes. Even if I reduce the dose to 1ml, it still works.","{'neg': 0.089, 'neu': 0.838, 'pos': 0.073, 'compound': -0.1584}",-0.1584,neg
1212,101873,2023-10-02,For a 4 year old child...,"Before I bought it, I was going to bed late and waking up late in the morning, but since I started using this before bed, I've gotten into the habit of going to bed early and getting up early. Even on days when I have taken a nap, when I use this, I end up wanting to sleep.","{'neg': 0.0, 'neu': 1.0, 'pos': 0.0, 'compound': 0.0}",0.0,neu
1213,101873,2023-09-27,Very effective,"The quality is amazing, it is similar to juice on the heaviest level, the taste is wonderful. The ingredients, God willing, are safe. The package comes with a needle to withdraw it per ml. Of course, I repeat, I used to take the sweetness, but this is better in effect and faster, and even adults get it with them. The effect of the size is nice, but if you have more than one child, it will not last long. Like if possible.","{'neg': 0.029, 'neu': 0.775, 'pos': 0.195, 'compound': 0.9222}",0.9222,pos
1214,101873,2023-09-26,,"Kids Sleep Liquid contains a proprietary blend of melatonin, organic chamomile, lemon balm and passionflower to support restful sleep and a calm state before bed. Non-Addictive Drug Free No Artificial Flavors or Colors Mommy's Bliss Bedtime Calming Bliss: A calming blend of chamomile, lemon balm, and passionflower to promote calm. No 8 major allergens","{'neg': 0.062, 'neu': 0.503, 'pos': 0.435, 'compound': 0.9741}",0.9741,pos
1215,101873,2023-09-21,,"This liquid elixir is my salvation. My child is very weather dependent, there are periods when he does not sleep, literally at all. A total dose of 2 ml is enough for us, and the child immediately falls asleep. Of course not on an ongoing basis, help in order to complete sleep. There was no shelf. I will definitely order more.","{'neg': 0.035, 'neu': 0.879, 'pos': 0.086, 'compound': 0.4939}",0.4939,pos
1216,101873,2023-09-19,The taste is delicious!,"Since this is my first time using melatonin, I thought I would try the kids type and purchased it! The taste is so sweet and delicious! It makes me want to gulp it down! The first time I drank it, I felt very sleepy. I didn't notice much of an effect after the second day, so I'll buy the adult version next time. I think children will find it easy to drink.","{'neg': 0.0, 'neu': 0.828, 'pos': 0.172, 'compound': 0.917}",0.917,pos
1217,101873,2023-09-16,,The quality is excellent. The ingredients are good and natural. The taste is very good and the quality is excellent. The quantity is large and easy to use. The size is large. The box is well packaged. The benefit is excellent. The taste is excellent. The mixture of servings has a wonderful taste. The purchase will be repeated. It is beneficial and the composition is good. The package is well sealed. Of course. Superfood recommendation. Age. Antioxidants. Preserves Health improves in everything,"{'neg': 0.0, 'neu': 0.592, 'pos': 0.408, 'compound': 0.992}",0.992,pos
1218,101873,2023-09-15,Good,"I have no doubts about the quality of the supplements from this company, so I boldly ordered it for my child, no extra ingredients, easy to use, the dosage is not large, I took it to build a schedule for the child. It lasts for a long time, after the course there is half a bottle left, the taste has a slight taste of grapes. He helped us","{'neg': 0.096, 'neu': 0.815, 'pos': 0.089, 'compound': 0.1384}",0.1384,pos
1219,101873,2023-09-10,Prominent,"The quality is excellent. Its ingredients are natural. It has a delicious taste. It should not be preferred with juice. It is easy to use. Its size is large and its packaging is suitable. It is 100% useful for sleeping. I use it for my children aged 3-6 years only out of necessity, especially on school nights after vacation. It is not considered a nutritional supplement. The serving or quantity is small. I will repeat the purchase because of sleep. My children are doing better after that, thank God","{'neg': 0.0, 'neu': 0.768, 'pos': 0.232, 'compound': 0.969}",0.969,pos
1220,101873,2023-09-05,,"Great quality and pure ingredient. This supplement has a good taste. Improved form is preferred. Melatonin is a sleep hormone that is involved in the regulation of sleep and wake cycles in the human body. Its production in the pineal gland (the pineal gland of the brain) increases with the onset of darkness, which promotes healthy sleep and helps orient our circadian rhythm to rest.","{'neg': 0.026, 'neu': 0.739, 'pos': 0.235, 'compound': 0.9413}",0.9413,pos
1221,101873,2023-09-04,,The quality is excellent in the packaging and the ingredients are very safe for children. The taste is acceptable. The size is suitable with use. You find the difference and benefit in one serving. I will repeat the experience and purchase again. It improves sleep and the benefit of the ingredients. It is a nutritional supplement suitable for young age.,"{'neg': 0.0, 'neu': 0.743, 'pos': 0.257, 'compound': 0.9516}",0.9516,pos
1222,101873,2023-09-03,,"The quality is excellent, the ingredients are natural, the taste is palatable for children, the use is easy with a syringe, it comes with it, the packaging is tight, the benefit is excellent for regulating the child’s sleep and the age is suitable for over 3 years. A good food supplement.","{'neg': 0.0, 'neu': 0.658, 'pos': 0.342, 'compound': 0.9652}",0.9652,pos
1223,101873,2023-09-01,,"I bought a gummy type one for my daughter before, but she didn't like it because she was picky about the taste. So I decided to try the liquid version this time. I took a sip and said it tasted bad, but I won! I fell asleep after 30 minutes! The next time I give it to her, she won't take it as is, but if I mix it with juice or yogurt, it won't be a problem. By the way, I licked it a little too, and it tasted like a dark grape. I'm not good at drinking alcohol, but when I drank a little alcohol, I felt my body soften. Maybe it's similar to the feeling when you get drunk and sleepy. I'm planning to travel on an airplane next month with my daughter who can't sit still, so I'm going to bring her so she can sleep.","{'neg': 0.111, 'neu': 0.826, 'pos': 0.063, 'compound': -0.8012}",-0.8012,neg
1224,101873,2023-08-19,Excellent!,"Support me and I will come back to make an adjustment, God willing, but I will finish the box. I want to regulate my daughter’s sleep. Oh Lord, it works. I bought something for adults and a lot, so bring me and set my biological clock. I will go back and write to you how it helped with sleep","{'neg': 0.0, 'neu': 0.912, 'pos': 0.088, 'compound': 0.431}",0.431,pos
1225,101873,2023-07-26,,"Ordered for a 3-year-old child. She slept very badly, cried at night, woke up 5 times, tossed and turned. With meletonin, I fell asleep in 20 minutes and slept soundly all night. I gave it for a month, then a break, and again. Everything seems to be fine now.","{'neg': 0.13, 'neu': 0.832, 'pos': 0.037, 'compound': -0.6674}",-0.6674,neg
1226,101873,2023-07-24,,"Mommy's Bliss liquid sleep aid is a real help for parents and their children. The combination of melatonin and grape flavor makes it pleasant and safe for use by children aged 3+. This product helps to calm and relax babies before bed, providing them with a calm and deep rest.","{'neg': 0.0, 'neu': 0.638, 'pos': 0.362, 'compound': 0.967}",0.967,pos
1227,101873,2023-07-22,,"Excellent, excellent quality, and natural ingredients according to the description. The taste is acceptable for use, indicated on the packaging. The benefit helps with deep sleep, because it is the sleep hormone. Age from +3. Repeat purchase. Yes, it is not considered a dietary supplement, but helps sleep. It is not taken daily only for cases of insomnia or need to adjust sleep","{'neg': 0.0, 'neu': 0.759, 'pos': 0.241, 'compound': 0.9209}",0.9209,pos
1228,101873,2023-07-10,,"excellent quality, for healthy immunity, convenient capsule size, everything is written in mg, retains acidity, convenient packaging, there really is a result from the application, the stomach responded well. I got a good result, it works as an antioxidant, I like everything about this product, I will definitely recommend it. I like the packaging, capsules, taste, the result that I got. can be used with confidence by everyone","{'neg': 0.0, 'neu': 0.676, 'pos': 0.324, 'compound': 0.9716}",0.9716,pos
1229,101873,2023-07-02,,"Kids Sleep Liquid contains a proprietary blend of melatonin, organic chamomile, lemon balm and passionflower to support restful sleep and a peaceful state of mind before bed. Non-addictive Drug-Free Free of Artificial Flavors and Colors Mommy's Bliss Bedtime Soothing Blend: A soothing blend of Chamomile, Lemon Balm and Passionflower Extracts to promote calmness","{'neg': 0.0, 'neu': 0.583, 'pos': 0.417, 'compound': 0.9747}",0.9747,pos
1230,101873,2023-07-01,,"Melatonin is a salvation, not only for adults, but also for children. It works great, it helps, it improves sleep. _____________________________ The ingredients are chamomile, lemon balm, passionflower, and most importantly melatonin - that is, the mixture is aimed at helping you sleep soundly. _____________________________ Packing for 120 ml - enough for a long time, because this remedy is not taken on an ongoing basis, even adults. The dosage in 2 ml is 0.5 mg of melatonin. For children, the initial dosage, if the child is already an adult or the weight is large, the dosage can be increased. It is better to take 30-60 minutes before bedtime. We remove all gadgets, turn off the light and fall asleep.","{'neg': 0.0, 'neu': 0.798, 'pos': 0.202, 'compound': 0.9796}",0.9796,pos
1231,101873,2023-06-20,,"Peace, mercy and blessings of God be upon you. Honestly, I benefited a lot from it. My son and daughter do not sleep. They can sleep for two or three hours, after which they wake up. I once suffered for this reason. I bought this product and it is effective within an hour. I sleep with them","{'neg': 0.049, 'neu': 0.683, 'pos': 0.269, 'compound': 0.926}",0.926,pos
1232,101873,2023-05-31,,"I took it for my 4-year-old son. I gave him 2 ml. It is made of grapes, and it tastes delicious. I used it when necessary, not every day. Honestly, the quality is very excellent, and the product is very wonderful. I like that it makes his sleep very natural.","{'neg': 0.042, 'neu': 0.664, 'pos': 0.294, 'compound': 0.9411}",0.9411,pos
1233,101873,2023-05-31,,"For me, this melatonin is just a salvation🙏 My son is 3.6 and he is a hyperactive child both during the day and at night, he used to fall asleep for a long time if he sleeps during the day, and often woke up at night and called me to walk around the apartment with him🤦🏻‍♀️ in general, I don’t slept with him. Now we take melatonin 2 ml for two weeks, there is a convenient syringe in the box, and I can already see that he sleeps much calmer, does not wake up at all at night or wakes up to go to the toilet. This syrup has a good composition, since before using, I consulted with a pediatrician and a neurologist, the doctors approved, and I finally get enough sleep","{'neg': 0.0, 'neu': 0.935, 'pos': 0.065, 'compound': 0.802}",0.802,pos
1234,101873,2023-05-30,MOVEMENT IS A NECESSARY CONDITION FOR A HEALTHY LIFE,"Movement - physical activity is necessary for health. Movement is life. There are two types of motor activity — ordinary movement and sports. All types of activity are useful, but during everyday movements, not all muscles work, some are overstressed and others do not get a load. To be healthy, you need to strain all your muscles, that's why there are simulators and gyms. However, visiting them is not necessary at all, if you choose a complex of exercises with the help of a trainer, it adds stress to those muscles that ""rested"" during the day","{'neg': 0.05, 'neu': 0.86, 'pos': 0.09, 'compound': 0.6187}",0.6187,pos
1235,101873,2023-05-27,,"Spirulina is a blue-green algae with powerful antioxidant properties. California Gold Nutrition Spirulina combines the beneficial properties of Spirulina (Arthrospira platensis) with Astaxanthin (from Heamatococcus pluvialis) and Phycocyanin (from Spirulina [Arthrospira platensis]) to promote antioxidant activity in the body, which may provide multiple health benefits. *. Benefits of Spirulina Blue green algae contain many antioxidant compounds such as phycocyanin, chlorophyll and astaxanthin. Studies have shown that the antioxidants in Spirulina and Astaxanthin help repair free radical damage, support detoxification and a healthy immune response, and help support eye health and overall healthy aging*.","{'neg': 0.028, 'neu': 0.667, 'pos': 0.305, 'compound': 0.9818}",0.9818,pos
1236,101873,2023-05-26,,"High-quality and really effective syrup, I give it to my daughter when she is overexcited, has a lot of emotions and has difficulty falling asleep. In addition to natural herbs, the composition contains melatonin in a small dosage, this should be kept in mind. I use it approximately 1-5 times a month at most, if you need to use it every day, then in small doses.","{'neg': 0.06, 'neu': 0.852, 'pos': 0.088, 'compound': 0.4391}",0.4391,pos
1237,101873,2023-05-18,good,"The ingredients are excellent, and the ingredients are known. It guides the child and comforts him. The packaging is excellent. It is easy to use, and its packaging is closed. The size is in the middle of the package. It is tightly closed. The benefit relaxes the child’s body to prepare for sleep. I gave it to my three-year-old.","{'neg': 0.0, 'neu': 0.733, 'pos': 0.267, 'compound': 0.9578}",0.9578,pos
