,product_id,date_posted,review_title,review_text,scores,compound,sentiment
1815,101873,2022-11-24,,Bought for my daughter as I couldn't sleep at night. Super quality. The taste is pleasant. I immediately gave it at night until 40 minutes after I put it to bed. Fell asleep. Ingredients are normal. The packaging is slick. There is a benefit. Improvement is immediately visible,"{'neg': 0.0, 'neu': 0.752, 'pos': 0.248, 'compound': 0.9217}",0.9217,pos
1816,101873,2022-11-14,,Good quality. The ingredients have arrived. Improved the sleep of a child at the age of 2.5 years. Pleasant taste. The dosage is convenient.,"{'neg': 0.0, 'neu': 0.683, 'pos': 0.317, 'compound': 0.8519}",0.8519,pos
1817,101873,2022-11-12,,Excellent .. it is possible to use only 1 mm is enough. My daughter is 4 years old and has used it before. I always order from her,"{'neg': 0.0, 'neu': 0.866, 'pos': 0.134, 'compound': 0.5719}",0.5719,pos
1818,101873,2022-11-12,,"Excellent, its taste is acceptable, and its results exceeded expectations and achieved the desired purpose, and I did not notice any negative effects from eating it","{'neg': 0.0, 'neu': 0.654, 'pos': 0.346, 'compound': 0.8778}",0.8778,pos
1819,101873,2022-11-11,,"If melatonin synthesis is disturbed, sleep is also disturbed. And there is no normal sleep - efficiency decreases, there may be drowsiness during the day, or irritability. If this lasts long enough, it is difficult to concentrate, mental abilities are reduced.","{'neg': 0.247, 'neu': 0.663, 'pos': 0.09, 'compound': -0.7783}",-0.7783,neg
1820,101873,2022-11-10,,"This is a good product. I love everything about it and it really helps my son sleep. Works fast and most importantly, no terrible side effects.","{'neg': 0.16, 'neu': 0.494, 'pos': 0.346, 'compound': 0.7746}",0.7746,pos
1821,101873,2022-11-09,,Great children's melatonin with herbs. I give it to my son (he is 4 years old) 30 minutes before bedtime. He falls asleep and sleeps peacefully all night. I recommend,"{'neg': 0.0, 'neu': 0.706, 'pos': 0.294, 'compound': 0.875}",0.875,pos
1822,101873,2022-11-06,,"Excellent, I give it to my daughter, because she takes medication for convulsions and affects her sleep, and this particular type comforts us a lot","{'neg': 0.0, 'neu': 0.755, 'pos': 0.245, 'compound': 0.7783}",0.7783,pos
1823,101873,2022-11-05,,"The word crazy is a little bit. I have the type who has no problem. He sits for two days and resists shouting. But from the day I gave him a quarter of an hour, he came to me and told me I wanted to.","{'neg': 0.122, 'neu': 0.878, 'pos': 0.0, 'compound': -0.4854}",-0.4854,neg
1824,101873,2022-10-27,,"It is very wonderful for children to put them to sleep within half an hour of a deep sleep, and it is nice that there are no complications, but of course it is necessary","{'neg': 0.044, 'neu': 0.833, 'pos': 0.122, 'compound': 0.4208}",0.4208,pos
1825,101873,2022-10-23,,"It is a nice time and I advise you on it for the safety of course, I do not use it daily, but when I need it, it is good. Give me a like ❤️","{'neg': 0.0, 'neu': 0.705, 'pos': 0.295, 'compound': 0.872}",0.872,pos
1826,101873,2022-10-22,,I use it for my son who is two years and ten months old once a week and the result was amazing and its quality from the first use of his sleep regimen and there are no side effects and it tastes like the sweetness of grapes. small,"{'neg': 0.041, 'neu': 0.782, 'pos': 0.177, 'compound': 0.8074}",0.8074,pos
1827,101873,2024-10-08,,"Very high price Click 👍 to return to evaluate the product based on customer opinions after trying the products. Products with. Good quality, acceptable smell, easy to use, suitable package size, organic ingredients, and I like the taste. I will repeat the purchase","{'neg': 0.0, 'neu': 0.773, 'pos': 0.227, 'compound': 0.8625}",0.8625,pos
1828,101873,2024-10-08,,"High quality products, safe and organic ingredients, acceptable smell, easy to use, size and organic formula, good quantity and tightly sealed package but not enough, please reduce the price because it is very high
","{'neg': 0.063, 'neu': 0.745, 'pos': 0.193, 'compound': 0.4691}",0.4691,pos
1829,101873,2022-12-24,,"An excellent tool. Copes well with the task, the baby likes it. I recommend. Calm baby, calm mother. ","{'neg': 0.0, 'neu': 0.412, 'pos': 0.588, 'compound': 0.9287}",0.9287,pos
1830,101873,2023-09-03,,"The child quickly falls asleep after taking it. This is where the drug works. Sleeps for about 2 hours without waking up, and then still gets up and screams. In our case, only falling asleep made it easier. The taste is very sweet, grapey. I will not order again. But it was worth a try.","{'neg': 0.052, 'neu': 0.835, 'pos': 0.114, 'compound': 0.5418}",0.5418,pos
1831,101873,2023-07-03,,"I bought it for myself, I always take it. Before that, I took it in the form of picolinate, for the last time I decided to take it in the form of these lozenges and did not regret it at all (although zinc itself is here in a different form)! Very pleasant taste, softens the throat when resorbed. Sometimes after taking zinc (I noticed it on pharmaceutical preparations) it can make me feel nauseous, after these lozenges I didn’t observe anything like that. If suddenly you have it - try not to take it on an empty stomach. I see the effect, I also take it with the beginning of a sore throat according to the instructions every 2 hours, it greatly alleviates the discomfort. I recommend!","{'neg': 0.058, 'neu': 0.851, 'pos': 0.091, 'compound': 0.6304}",0.6304,pos
1832,101873,2023-03-02,,"Its size is average for two months or more in terms of use. I give it to my son once a week to adjust his sleep. The benefit is to improve the child’s sleep and not stay up late, but not to break it by increasing the frequency. Its intensity is once a week. Its taste is crazy. I take from it the ingredients, all natural. hour and sleep","{'neg': 0.043, 'neu': 0.856, 'pos': 0.101, 'compound': 0.4767}",0.4767,pos
1833,101873,2023-02-23,,"My daughter has problems with sleep, and I have already tried a lot of different options, after reading the reviews, I really hoped that this would help us, but unfortunately there was no expected result, I don’t want to say that this is not a good drug, we just probably like usually all the rest, did not help (","{'neg': 0.162, 'neu': 0.658, 'pos': 0.18, 'compound': 0.0484}",0.0484,neu
1834,101873,2022-11-12,,"Mashallah, I like it and it is useful for my son. Praise be to God. My son sleeps only a little a day. I have mercy on him. I started giving him sleep. Praise be to God. I don’t give him every day. I fear that it will harm him. He is 3 years old.","{'neg': 0.103, 'neu': 0.568, 'pos': 0.329, 'compound': 0.9142}",0.9142,pos
1835,101873,2022-11-02,Prominent!,"It tastes and smells nice. It helps with sleep. It has no side effects. It is used half an hour to an hour before bed. Its quality is great. I used it for my daughter. It helped her adjust sleep and rest. Her body improved from a night’s sleep, thank God.","{'neg': 0.036, 'neu': 0.684, 'pos': 0.28, 'compound': 0.9325}",0.9325,pos
1836,101873,2022-10-19,improved sleep,"There was a dramatic improvement in sleep. A 3-year-old child with ASD should sleep at 21:00, but it's 23:00, and even if he goes to bed early, he wakes up after 12:00 and hasn't been able to get enough sleep, so it's been a year since I started using Shigi. Now, I go to bed around 19:00 and wake up at 5:00 in the morning. I got good habits, and I didn't have a word, but I started to speak a lot. Over the past year, it's become unrecognizable. I tried using a different manufacturer, so I can't say which one, but I think I improved by taking melatonin.It was a year from 3 to 4 years old.","{'neg': 0.0, 'neu': 0.907, 'pos': 0.093, 'compound': 0.875}",0.875,pos
1837,101873,2022-08-16,effective product,"A more than wonderful product, I give my children only 2 ml in the morning before bed. The result is fast, they sleep quietly and wake up energized and have no symptoms. I use it on my five children of different ages and I did not notice any side effects, thank God.","{'neg': 0.039, 'neu': 0.749, 'pos': 0.212, 'compound': 0.8651}",0.8651,pos
1838,101873,2022-07-16,A 3-year-old child who was excited by play fell asleep smoothly.,"There is always a 3-year-old child who falls asleep around 8 o'clock at night. However, sometimes I can't sleep because I'm excited about playing and what I experienced that day. If you give it a drink at such times, it will sleep comfortably. Use only when you really need it.","{'neg': 0.0, 'neu': 0.857, 'pos': 0.143, 'compound': 0.7184}",0.7184,pos
1839,101873,2022-07-04,,"It works perfectly. My children have Autism and it takes a long time to fall asleep. With this product you fall asleep in 20min after ingesting it. The quality is very good, the taste is excellent, the size is perfect since I only give 2ml per serving and there are 120 in the package","{'neg': 0.0, 'neu': 0.764, 'pos': 0.236, 'compound': 0.9412}",0.9412,pos
1840,101873,2022-07-01,,"it was advised to me by the mother of an autistic child, they were advised by their neurologist, they use it for quite a long time, the child sleeps normally, their sleep situation is much worse than ours. so I thought to give it to her once on the plane. just maybe someone else used it, how this drug affected their children.","{'neg': 0.075, 'neu': 0.925, 'pos': 0.0, 'compound': -0.5719}",-0.5719,neg
1841,101873,2022-06-30,,"I really love this tool. if the child is overexcited, you can give it at bedtime and within 10 minutes the baby will fall asleep. but there is one BUT! my children fall asleep unless there is no TV, etc. , if the telly or gadget, the baby wants to sleep from the drug, but cannot fall asleep and is even more naughty. very pleasant sweet taste.very convenient package size.easy to take with you. as this brand, I'm sure, I take it not for the first time","{'neg': 0.029, 'neu': 0.81, 'pos': 0.161, 'compound': 0.9312}",0.9312,pos
1842,101873,2022-06-17,,"Just a bomb! Half an hour before bedtime, I give a 3.5-year-old child 2 ml each and no more tantrums before bedtime and no more nightmares at night! Sleep well until the morning! The taste is very pleasant! Especially pleased with the measuring syringe! Super fast and convenient! And the composition is just perfect!","{'neg': 0.15, 'neu': 0.592, 'pos': 0.259, 'compound': 0.8599}",0.8599,pos
1843,101873,2022-04-17,,"This melatonin is simply an indispensable thing for children with neurological problems, our son sleeps very badly, falls asleep with difficulty, and wakes up after a couple of minutes. We have cerebral palsy, brain damage. at the beginning we bought pharmacy melatonin. after a week of using melatonin, the child began to have panic attacks, he began to wake up screaming. we stopped giving and the baby stopped crying. after that I ordered a liquid version with iHerb, these are the ones. the bottle is very bad, for some reason all the liquid flows out endlessly, even when it is exactly on the table. it is better to immediately pour into another bottle. this melatonin works very well, my son falls asleep easily, there are no panic attacks. grape taste, sugary sweet, diluted with water. very high quality melotonin! Already ordered a second bottle. this is just a godsend for children with sleep disorders!","{'neg': 0.217, 'neu': 0.692, 'pos': 0.091, 'compound': -0.9693}",-0.9693,neg
1844,101873,2022-04-14,Beautiful,"The most convenient form of melatonin for children with autism is in syrup! My child didn't like candy. The syrup is working, after 15 to 45 minutes it works and the child falls asleep soundly, all the chips so that the main thing is that he lies after taking)","{'neg': 0.1, 'neu': 0.9, 'pos': 0.0, 'compound': -0.6372}",-0.6372,neg
1845,101873,2022-04-11,Melatonin for good sleep in children 👍🏻,"Bought for my 3 year old daughter. It's been over 2-3 months now. sleep problems, or rather it was very difficult to put to sleep, I had to force it, my daughter could resist for a long time and on average it took 1-1.5 to make the child fall asleep. After taking this drug, this problem was solved, there are no problems with going to bed, we drink for more than a week. I like the result very much! I also like that it contains natural plant ingredients.","{'neg': 0.142, 'neu': 0.753, 'pos': 0.104, 'compound': -0.5694}",-0.5694,neg
1846,101873,2022-04-05,Excellent!,"This is what I call the savior frankly 😂 It is always available to me in case I want to organize my children’s sleep.. But to be honest I don’t stick to the exact dose.. I give them about a quarter of a teaspoon of tea, a small amount, and I repeat it and it is two hours before bedtime so that the effect will start gradually because I once gave them the same dose and they slept during 10 minutes 😢 I felt the dose increased on them","{'neg': 0.0, 'neu': 0.884, 'pos': 0.116, 'compound': 0.8201}",0.8201,pos
1847,101873,2022-03-27,,"I haven't tried this company for a while, but in general melatonin solves crises to adjust children's sleep after vacation and back to school, but be careful what is used a lot because in the long run it may have an effect on them, God forbid, the taste is palatable, the size is large, it takes a long time with me, and sometimes it spoils, and the rest of it has a large amount","{'neg': 0.038, 'neu': 0.825, 'pos': 0.137, 'compound': 0.7684}",0.7684,pos
1848,101873,2022-02-08,Excellent!,"Bought so that the eldest son fell asleep faster, because he has trouble sleeping for 1.30-2.00 hours skiing in bed and could not sleep. Now he falls asleep faster, but after 5 hours he gets up and still comes to my room. I add a pleasant taste to compote or water. Next time I'll try another pill.","{'neg': 0.032, 'neu': 0.892, 'pos': 0.076, 'compound': 0.5574}",0.5574,pos
1849,101873,2022-02-06,,"Talk about it frankly. I took it in order to use it at times when my daughters had trouble sleeping, or if a line caught it and was traveling, they would sleep most of the time, and when I came to the hotel, I found them clinics. My daughters are only 1 year and 8 months old and the second is 2 years and 9 months old. In fact, it is not recommended for infants or those who are not yet 3 years old. But as I told you, use it when necessary, and the dose is reduced, and the effect is long, that is, a quarter of an hour, even though it is written by two writers, and it starts to take effect after one to two hours..","{'neg': 0.026, 'neu': 0.974, 'pos': 0.0, 'compound': -0.2837}",-0.2837,neg
1850,101873,2022-02-01,,"I took a child 2.4 years old. Sleeps badly at night, wakes up constantly (almost every day), turns around, restless, cries. I give 1 ml, since they can be given from the age of 3, I give less than the norm one hour before bedtime. He began to fall asleep more calmly, he wakes up as before at night, but somehow the tantrums do not drag on for so long as usual.","{'neg': 0.118, 'neu': 0.83, 'pos': 0.052, 'compound': -0.6}",-0.6,neg
1851,101873,2021-11-23,To my son with autism.,"I am giving it to my son with autism in kindergarten. I often wake up in the middle of the night, and as a parent I had a hard time physically and mentally, but it has improved since I started drinking this syrup. It's a terrible unbalanced diet, so chewing-type supplements and other flavored syrups won't drink. This syrup is helpful because it will be drunk. The amount for one dose is not large, it is only 2 ml, so it seems easy to drink. Additives do not contain sugar and are natural, such as herbs, so it is convenient because you can drink it even after you accidentally brush your teeth. (Basically, I drink it before brushing my teeth.) It's a pity that the attached syringe can't be used up to the end and I can only order one bottle at a time, but my son's sleep disorder is completely improved. I would like to continue purchasing until.","{'neg': 0.102, 'neu': 0.757, 'pos': 0.141, 'compound': 0.8377}",0.8377,pos
1852,101873,2024-08-18,,"The taste is palatable, suitable for children, sleeps within half an hour, comfortable, and the size is relatively small.","{'neg': 0.0, 'neu': 0.742, 'pos': 0.258, 'compound': 0.7096}",0.7096,pos
1853,101873,2024-07-20,I don't know,"For children, but I didn't take it for my niece. I don't know what it's good for. Honestly, thank you 
","{'neg': 0.0, 'neu': 0.575, 'pos': 0.425, 'compound': 0.9022}",0.9022,pos
1854,101873,2024-07-18,,I don’t know from him or het. But the child fell asleep quickly after drinking,"{'neg': 0.0, 'neu': 1.0, 'pos': 0.0, 'compound': 0.0}",0.0,neu
1855,101873,2024-07-18,Ok,"Good quality, natural ingredients, delicious taste, easy use, good size ","{'neg': 0.0, 'neu': 0.251, 'pos': 0.749, 'compound': 0.9313}",0.9313,pos
1856,101873,2024-06-13,,Quality good ingredients fresh size medium packaging beautiful benefits available size medium,"{'neg': 0.0, 'neu': 0.406, 'pos': 0.594, 'compound': 0.8934}",0.8934,pos
1857,101873,2024-04-28,My name,My son suffers from insomnia. I give him a dose before bed and he gets four hours of sleep. Continue ,"{'neg': 0.154, 'neu': 0.846, 'pos': 0.0, 'compound': -0.4767}",-0.4767,neg
1858,101873,2024-04-13,Sleep,"My child does fall asleep, but sometimes he won't eat, so the liquid type is more reliable.","{'neg': 0.0, 'neu': 1.0, 'pos': 0.0, 'compound': 0.0}",0.0,neu
1859,101873,2024-02-29,,"Good smell, good quality, good size, good benefit and nourishing for the hair","{'neg': 0.0, 'neu': 0.354, 'pos': 0.646, 'compound': 0.9274}",0.9274,pos
1860,101873,2023-04-15,,"Honestly, it is not a good time. I used a second type, which gives a faster effect and tastes better than this treatment, but it gives a good effect.","{'neg': 0.167, 'neu': 0.695, 'pos': 0.137, 'compound': -0.2173}",-0.2173,neg
1861,101873,2022-09-19,,"A chic remedy, my son falls asleep without tantrums and no longer for 2 hours. Would recommend to anyone with hyperactive or sleep-deprived kids.","{'neg': 0.0, 'neu': 0.677, 'pos': 0.323, 'compound': 0.7648}",0.7648,pos
1862,101873,2022-08-06,,Quality is super Sleeps like a baby Natural ingredients Taste is pleasant Use is convenient Portion size is easy to adjust Dosage Packaging is convenient Age from 3 years old Supplement helps to sleep Frequency of use once a day Improvements are felt Benefits are tangible,"{'neg': 0.0, 'neu': 0.608, 'pos': 0.392, 'compound': 0.9666}",0.9666,pos
1863,101873,2022-06-23,,Great liquid product for kids. We liked the quality. The taste of grapes is very pleasant. The child sleeps calmly and wakes up with a good mood. Melatonin contains soothing herbs to support baby's natural sleep patterns.,"{'neg': 0.0, 'neu': 0.547, 'pos': 0.453, 'compound': 0.969}",0.969,pos
1864,101873,2021-10-13,Healthy sleep - Harmony in the family!,"I found a successful remedy, this is Melatonin Kids. Now my children fall asleep smoothly, sleep well. The elder son drinks pills, and the younger daughter drinks syrup. Most importantly, they are not allergic to this drug, although children are allergic. There was even time and inspiration to compose a poem: Melatonin is necessary for someone who sleeps badly. Useful for those who are annoyed, freaked out and screaming. It will speed up sleep, it will improve Harmony in the family! And the children are asleep, sweetly watching their dreams magically ... In the morning everyone woke up cheerfully, slept and smiled! We wrote down the iHerb review: how my children took Melatonin Kids, admired the taste of the grape, surprised at the convenient syringe with the bottle !!!","{'neg': 0.065, 'neu': 0.667, 'pos': 0.268, 'compound': 0.9841}",0.9841,pos
1865,101873,2023-09-03,,"An excellent sleep aid. The child immediately fell asleep, the liquid form is better, before he took it in tablets, but the baby did not take the tablets at all.","{'neg': 0.0, 'neu': 0.867, 'pos': 0.133, 'compound': 0.5106}",0.5106,pos
1866,101873,2023-07-26,,It helps children who are hyperactive to relax and sleep and makes them calm during the evening. I recommend it to those who have children who have difficulty sleeping,"{'neg': 0.067, 'neu': 0.644, 'pos': 0.289, 'compound': 0.7845}",0.7845,pos
1867,101873,2023-06-18,,"I bought it for a colleague. She said that she saw other parents on the Internet saying that it was effective, so she wanted to buy it for her children to try. I tried it once or twice, and it seemed that I slept better.","{'neg': 0.0, 'neu': 0.867, 'pos': 0.133, 'compound': 0.7184}",0.7184,pos
1868,101873,2023-05-16,,"Taste is palatable to use a few times if it disturbs my children's sleep. The size is small, but it is sufficient because it is not a continuous use","{'neg': 0.068, 'neu': 0.87, 'pos': 0.063, 'compound': -0.0387}",-0.0387,neu
1869,101873,2023-04-29,,"Honestly, I did not try it. I asked it for my client only, but put a like, may God make you happy and provide you. I need likes.","{'neg': 0.0, 'neu': 0.533, 'pos': 0.467, 'compound': 0.9489}",0.9489,pos
1870,101873,2023-04-21,,"Good quality, easy to absorb, suitable ingredients, suitable for children's age, beautiful packaging, the advantage is that it is reasonably priced. After rubbing it on, it can improve children's sleep problems. No allergies, good taste.","{'neg': 0.099, 'neu': 0.547, 'pos': 0.354, 'compound': 0.9118}",0.9118,pos
1871,101873,2023-04-06,,"The quality is good, the ingredients are safe, adults and children can eat it, the taste is acceptable to children, and the benefits improve sleep","{'neg': 0.0, 'neu': 0.595, 'pos': 0.405, 'compound': 0.9118}",0.9118,pos
1872,101873,2023-04-04,,"Its result is good. It relaxes and helps children sleep. Within about half an hour to an hour, the child will be asleep..but use it for necessity because there are studies that warn against its frequent use","{'neg': 0.033, 'neu': 0.778, 'pos': 0.189, 'compound': 0.765}",0.765,pos
1873,101873,2023-02-12,,"sometimes it is difficult for a child to fall asleep after a busy day, so I resort to melatonin. it helps to fall asleep quickly and sleep soundly until morning. liked the quality of the supplement","{'neg': 0.066, 'neu': 0.792, 'pos': 0.142, 'compound': 0.4404}",0.4404,pos
1874,101873,2023-01-16,,"Kids Sleep Liquid contains a proprietary blend of melatonin, organic chamomile, lemon balm and passionflower to support restful sleep and a peaceful state of mind before bed.","{'neg': 0.0, 'neu': 0.684, 'pos': 0.316, 'compound': 0.8271}",0.8271,pos
1875,101873,2023-01-01,,"A good sedative for children, especially if the child is sick. Calming herbs combined with melatonin are great! If it's not difficult for you and my review is useful to you, please put it 👍🏻","{'neg': 0.069, 'neu': 0.567, 'pos': 0.363, 'compound': 0.9186}",0.9186,pos
1876,101873,2022-12-12,,"I am purchasing this product for the first time, I hope to update my review with positive emotions and feelings soon. The quality of the drug is completely satisfied","{'neg': 0.0, 'neu': 0.714, 'pos': 0.286, 'compound': 0.8622}",0.8622,pos
1877,101873,2022-11-22,,"Quality, Ingredients, Age, Taste, Usage, Larger Size, Package, Benefit, Improvement Formula, Dietary Supplement, Portion, Frequency, Honestly, Under Experimentation, but based on the praise of the comment, I took it","{'neg': 0.0, 'neu': 0.688, 'pos': 0.312, 'compound': 0.872}",0.872,pos
1878,101873,2022-11-11,,"The quality is very excellent, the ingredients are excellent, the taste is acceptable, the use is little, the time of need is only the size is large","{'neg': 0.0, 'neu': 0.7, 'pos': 0.3, 'compound': 0.883}",0.883,pos
1879,101873,2022-05-30,,"The quality is very good! Natural ingredients! Packaging and size are suitable for convenient use! The composition is precisely selected for the right reception! The taste is pleasant, neutral! Thank you!","{'neg': 0.0, 'neu': 0.676, 'pos': 0.324, 'compound': 0.9176}",0.9176,pos
1880,101873,2024-09-07,👍🏻👍🏻👍🏻👍🏻👍🏻,Melatonin is very useful for sleepless children,"{'neg': 0.0, 'neu': 0.653, 'pos': 0.347, 'compound': 0.4927}",0.4927,pos
1881,101873,2024-03-24,,"excellent sleep aid, quality manufacturer, good dosage, good brand","{'neg': 0.0, 'neu': 0.387, 'pos': 0.613, 'compound': 0.8591}",0.8591,pos
1882,101873,2023-10-13,,Very excellent for children and they fall asleep quickly. The taste is berries and the size is suitable. A small cover is enough,"{'neg': 0.0, 'neu': 0.84, 'pos': 0.16, 'compound': 0.6115}",0.6115,pos
1883,101873,2023-08-07,Excellent thing!,"Helped us a lot! The child began to fall asleep perfectly, without any problems. Just a godsend for parents.","{'neg': 0.0, 'neu': 0.57, 'pos': 0.43, 'compound': 0.8898}",0.8898,pos
1884,101873,2023-06-29,,"Quality, ingredients, taste, use, size, packaging and benefit are good","{'neg': 0.0, 'neu': 0.576, 'pos': 0.424, 'compound': 0.7096}",0.7096,pos
1885,101873,2023-03-12,,"It is very distinguished. Within half an hour, its effect begins by asking it again, very impressive","{'neg': 0.0, 'neu': 0.817, 'pos': 0.183, 'compound': 0.5563}",0.5563,pos
1886,101873,2023-02-11,,"The girl sleeps really well. I take it once a day, half an hour before bed. The cap is really convenient to use.","{'neg': 0.0, 'neu': 0.893, 'pos': 0.107, 'compound': 0.3384}",0.3384,pos
1887,101873,2023-01-21,,"The high quality, ingredients and taste are okay, as a nutritional supplement, and a child sleeps peacefully and wakes up sound and full","{'neg': 0.0, 'neu': 0.782, 'pos': 0.218, 'compound': 0.6486}",0.6486,pos
1888,101873,2022-11-10,,"The child accepts without disgust, he likes the taste. Works in just half an hour. The quality is excellent.","{'neg': 0.088, 'neu': 0.567, 'pos': 0.345, 'compound': 0.7791}",0.7791,pos
