,product_id,date_posted,review_title,review_text,scores,compound,sentiment
700,101873,2021-09-29,,The kids are asleep in 10 mins flat.  Excellent product.,"{'neg': 0.0, 'neu': 0.709, 'pos': 0.291, 'compound': 0.5719}",0.5719,pos
701,101873,2021-09-26,,It is a good product. If they can make with lemon flavor would be excellent.,"{'neg': 0.0, 'neu': 0.645, 'pos': 0.355, 'compound': 0.765}",0.765,pos
702,101873,2021-09-12,,"they work really well and the kids get a good night's sleep 
","{'neg': 0.0, 'neu': 0.63, 'pos': 0.37, 'compound': 0.6478}",0.6478,pos
703,101873,2021-09-08,,These are amazing. Definitely helped my girls get to sleep. ,"{'neg': 0.0, 'neu': 0.552, 'pos': 0.448, 'compound': 0.7579}",0.7579,pos
704,101873,2021-09-01,works,my daughter loves the flavour works easy to give the price is good ,"{'neg': 0.0, 'neu': 0.513, 'pos': 0.487, 'compound': 0.8591}",0.8591,pos
705,101873,2021-08-14,,I was apprehensive about trying this but it works fantastic on my never wants to sleep toddler.,"{'neg': 0.0, 'neu': 0.754, 'pos': 0.246, 'compound': 0.7096}",0.7096,pos
706,101873,2021-08-08,,I liked it very much! it really have a good effect,"{'neg': 0.0, 'neu': 0.527, 'pos': 0.473, 'compound': 0.7407}",0.7407,pos
707,101873,2021-08-07,,works amazing for my 4yo she has had other ones and haven't worked but this helps her sleep all night now ,"{'neg': 0.0, 'neu': 0.748, 'pos': 0.252, 'compound': 0.7506}",0.7506,pos
708,101873,2021-08-01,,Working wonderfully for our child. After being suggested by our paediatrician to try melatonin this a good product to try.,"{'neg': 0.0, 'neu': 0.7, 'pos': 0.3, 'compound': 0.8061}",0.8061,pos
709,101873,2021-07-29,excellent,has really help my kids settle and go to sleep at night ,"{'neg': 0.0, 'neu': 0.786, 'pos': 0.214, 'compound': 0.4576}",0.4576,pos
710,101873,2021-07-22,good brand,"Havent try this liquid but tried the gummy, same brand which is very effective. I believe this liquid works the same.","{'neg': 0.0, 'neu': 0.805, 'pos': 0.195, 'compound': 0.6798}",0.6798,pos
711,101873,2021-07-17,,This product worked wonders for my daughter to help regulate her sleep during a regression. ,"{'neg': 0.0, 'neu': 0.828, 'pos': 0.172, 'compound': 0.4019}",0.4019,pos
712,101873,2021-07-17,,"It works on my child, so far issue, it helped him to go sleep. It’s easier too since it’s liquid. ","{'neg': 0.0, 'neu': 0.872, 'pos': 0.128, 'compound': 0.4215}",0.4215,pos
713,101873,2021-07-02,,"best ever, little boy sleeps like a log. everyone happy.","{'neg': 0.0, 'neu': 0.372, 'pos': 0.628, 'compound': 0.8789}",0.8789,pos
714,101873,2021-06-22,,It helps put our son to sleep when nothing else works ,"{'neg': 0.0, 'neu': 0.794, 'pos': 0.206, 'compound': 0.3818}",0.3818,pos
715,101873,2021-06-09,Helpful ,I found this helped my little guy get the rest he needed for his little body ,"{'neg': 0.0, 'neu': 1.0, 'pos': 0.0, 'compound': 0.0}",0.0,neu
716,101873,2021-06-02,Excellent,"The product i feel is great and i used for last nine months for my newborn baby. I am truly satisfied.
","{'neg': 0.0, 'neu': 0.605, 'pos': 0.395, 'compound': 0.8689}",0.8689,pos
717,101873,2021-05-25,,i would recommand everyone to buy this it wirks wonders ,"{'neg': 0.0, 'neu': 1.0, 'pos': 0.0, 'compound': 0.0}",0.0,neu
718,101873,2021-05-18,,Excellent for kids and I totally trust this brand as I used their gripe water too,"{'neg': 0.0, 'neu': 0.622, 'pos': 0.378, 'compound': 0.807}",0.807,pos
719,101873,2021-05-12,,Works amazing for my 3 year old. Instant relief and finally have my bed back!!! ,"{'neg': 0.0, 'neu': 0.607, 'pos': 0.393, 'compound': 0.8306}",0.8306,pos
720,101873,2021-05-12,,Kids love it and it is quick release! Love that it is also natural :) Easy to use! ,"{'neg': 0.0, 'neu': 0.428, 'pos': 0.572, 'compound': 0.9544}",0.9544,pos
721,101873,2021-05-06,,great taste for kids & small dosage. would recommend this for your little one who finds it a little hard to fall asleep.,"{'neg': 0.043, 'neu': 0.7, 'pos': 0.257, 'compound': 0.7574}",0.7574,pos
722,101873,2021-05-05,Excellent product,Very effective for my daughter she slept the whole night. ,"{'neg': 0.0, 'neu': 0.726, 'pos': 0.274, 'compound': 0.5256}",0.5256,pos
723,101873,2021-04-24,Superb!,"Great product , pretty fast working. Essential helper in times of need . Love it! My son falls asleep in 40 minutes Max. ","{'neg': 0.0, 'neu': 0.545, 'pos': 0.455, 'compound': 0.9348}",0.9348,pos
724,101873,2021-04-07,Love It!,My child loves the taste and falls asleep quickly and stays asleep all night!,"{'neg': 0.0, 'neu': 0.765, 'pos': 0.235, 'compound': 0.6114}",0.6114,pos
725,101873,2021-04-06,,"Children take it without problem, works a treat to help them sleep.","{'neg': 0.148, 'neu': 0.526, 'pos': 0.326, 'compound': 0.4019}",0.4019,pos
726,101873,2021-04-04,For overactive toddler,Trust me some nights you will need this to calm down overactive toddler after a big day. Nice package too!,"{'neg': 0.0, 'neu': 0.648, 'pos': 0.352, 'compound': 0.8268}",0.8268,pos
727,101873,2021-03-27,,Great product easy for the kids to digest. Tastes nice. ,"{'neg': 0.0, 'neu': 0.417, 'pos': 0.583, 'compound': 0.8689}",0.8689,pos
728,101873,2021-03-27,,"Baby girl (3) with autism.
Works well getting her to relax and settled for the night.","{'neg': 0.0, 'neu': 0.737, 'pos': 0.263, 'compound': 0.6124}",0.6124,pos
729,101873,2021-02-26,,My son loves his little “treat” after dinner and it helps to give him a good night sleep. ,"{'neg': 0.0, 'neu': 0.603, 'pos': 0.397, 'compound': 0.8481}",0.8481,pos
730,101873,2021-02-26,MELATONIN,"I got theses products for my little nieces who were having trouble sleeping, but this came to solve their lives. Well recommended.","{'neg': 0.071, 'neu': 0.656, 'pos': 0.272, 'compound': 0.6369}",0.6369,pos
731,101873,2021-02-20,,I love this and so does my daughter. She sleeps so great at night and wakes up so happy ,"{'neg': 0.0, 'neu': 0.514, 'pos': 0.486, 'compound': 0.9449}",0.9449,pos
732,101873,2021-01-18,,Helps to relax my little one which then gives a better night sleep everyone is happy in the morning then ,"{'neg': 0.0, 'neu': 0.554, 'pos': 0.446, 'compound': 0.9022}",0.9022,pos
733,101873,2020-12-27,Great product !,"Toddler used to fight sleep at every opportunity, now he goes to bed, lays down and closes his eyes. Brilliant! ","{'neg': 0.098, 'neu': 0.642, 'pos': 0.26, 'compound': 0.6476}",0.6476,pos
734,101873,2020-12-14,,"Product is very hard to find, so I was pleased to find it here and for a reasonable price.","{'neg': 0.085, 'neu': 0.755, 'pos': 0.16, 'compound': 0.3581}",0.3581,pos
735,101873,2020-12-12,,Worked really well and tasted goo according to my kid! ,"{'neg': 0.0, 'neu': 0.77, 'pos': 0.23, 'compound': 0.3989}",0.3989,pos
736,101873,2020-12-06,,It works for my 4 year old within half an hour of taking it. He loves the taste too which helps!,"{'neg': 0.0, 'neu': 0.732, 'pos': 0.268, 'compound': 0.7644}",0.7644,pos
737,101873,2020-12-06,,"Great product, my daughter falls asleep a lot quicker now. ","{'neg': 0.0, 'neu': 0.661, 'pos': 0.339, 'compound': 0.6249}",0.6249,pos
738,101873,2020-11-23,,This stuff is great! The first thing I have found that works for my son to help him get a restful sleep! ,"{'neg': 0.0, 'neu': 0.632, 'pos': 0.368, 'compound': 0.8715}",0.8715,pos
739,101873,2022-09-04,,Worked well purchased for someone and they liked it ,"{'neg': 0.0, 'neu': 0.588, 'pos': 0.412, 'compound': 0.5994}",0.5994,pos
740,101873,2022-05-31,,Great product! A must have. ,"{'neg': 0.0, 'neu': 0.406, 'pos': 0.594, 'compound': 0.6588}",0.6588,pos
741,101873,2022-04-24,,"Works a treat, falls asleep much easier.","{'neg': 0.0, 'neu': 0.421, 'pos': 0.579, 'compound': 0.6705}",0.6705,pos
742,101873,2022-01-24,Stronger flavour,Not as easy to disguise in drinks!,"{'neg': 0.484, 'neu': 0.516, 'pos': 0.0, 'compound': -0.5716}",-0.5716,neg
743,101873,2021-10-09,,Does help my 4 year old son drift off to sleep easier ,"{'neg': 0.0, 'neu': 0.621, 'pos': 0.379, 'compound': 0.6705}",0.6705,pos
744,101873,2021-09-28,,It works but my so goes a bit out of control before he eventually crashes!,"{'neg': 0.0, 'neu': 1.0, 'pos': 0.0, 'compound': 0.0}",0.0,neu
745,101873,2021-07-27,Great taste,"A great flavor for my son. 
Took easily and supported his nightly sleep routine.","{'neg': 0.0, 'neu': 0.532, 'pos': 0.468, 'compound': 0.8316}",0.8316,pos
746,101873,2021-04-03,,it's quite good. Puts my kid to sleep. Doesn't taste as bad as I thought it would. ,"{'neg': 0.0, 'neu': 0.698, 'pos': 0.302, 'compound': 0.7221}",0.7221,pos
747,101873,2021-02-15,,"pomogayet.
It fits well, I give it an hour before bedtime - it helps.","{'neg': 0.0, 'neu': 0.68, 'pos': 0.32, 'compound': 0.5719}",0.5719,pos
748,101873,2022-05-20,,didn't work for my baby i think because he is less than 3 years,"{'neg': 0.0, 'neu': 1.0, 'pos': 0.0, 'compound': 0.0}",0.0,neu
749,101873,2022-04-12,,Great for kids.,"{'neg': 0.0, 'neu': 0.328, 'pos': 0.672, 'compound': 0.6249}",0.6249,pos
750,101873,2022-03-28,,definitely would recommend!,"{'neg': 0.0, 'neu': 0.154, 'pos': 0.846, 'compound': 0.6696}",0.6696,pos
751,101873,2022-03-25,,Unfortunately this didnt work as well as the kids plain melatonin as this has herbs in it which i think affected my childs medication.,"{'neg': 0.225, 'neu': 0.775, 'pos': 0.0, 'compound': -0.5878}",-0.5878,neg
752,101873,2022-03-03,,Awsome product ,"{'neg': 0.0, 'neu': 1.0, 'pos': 0.0, 'compound': 0.0}",0.0,neu
753,101873,2022-03-01,,Good melatonin ,"{'neg': 0.0, 'neu': 0.256, 'pos': 0.744, 'compound': 0.4404}",0.4404,pos
754,101873,2022-01-13,,great product ,"{'neg': 0.0, 'neu': 0.196, 'pos': 0.804, 'compound': 0.6249}",0.6249,pos
755,101873,2021-11-08,Works ,Works well ,"{'neg': 0.0, 'neu': 0.323, 'pos': 0.677, 'compound': 0.2732}",0.2732,pos
756,101873,2022-04-02,,its ok  but not the best products,"{'neg': 0.408, 'neu': 0.448, 'pos': 0.143, 'compound': -0.6062}",-0.6062,neg
757,101873,2021-04-15,Great,Absorb faster than gummies.. recommended,"{'neg': 0.0, 'neu': 0.69, 'pos': 0.31, 'compound': 0.2023}",0.2023,pos
758,101873,2022-02-23,Verygood,It’s worth ,"{'neg': 0.0, 'neu': 0.345, 'pos': 0.655, 'compound': 0.2263}",0.2263,pos
759,101873,2022-01-09,,Good 👍🏻 👍🏻,"{'neg': 0.0, 'neu': 0.408, 'pos': 0.592, 'compound': 0.4404}",0.4404,pos
760,101873,2021-04-22,,"Not fast acting as others i have used before
Overall ok , bounce star for the no spill cap
","{'neg': 0.113, 'neu': 0.773, 'pos': 0.113, 'compound': 0.0}",0.0,neu
761,101873,2021-10-18,,"Good for my kid, its work","{'neg': 0.0, 'neu': 0.633, 'pos': 0.367, 'compound': 0.4404}",0.4404,pos
762,101873,2021-10-02,Great natural product for children!,Great natural product for children with only wonderful ingredients!,"{'neg': 0.0, 'neu': 0.362, 'pos': 0.638, 'compound': 0.8908}",0.8908,pos
763,101873,2021-09-02,,Works within half hour great stuff,"{'neg': 0.0, 'neu': 0.549, 'pos': 0.451, 'compound': 0.6249}",0.6249,pos
764,101873,2021-07-18,,"Great flavour! 
A great product that works.","{'neg': 0.0, 'neu': 0.32, 'pos': 0.68, 'compound': 0.8588}",0.8588,pos
765,101873,2021-06-23,,"
Pleasant rest, moms is wonderful!","{'neg': 0.0, 'neu': 0.291, 'pos': 0.709, 'compound': 0.807}",0.807,pos
766,101873,2021-06-11,,Easy to fall asleep for kids,"{'neg': 0.0, 'neu': 0.633, 'pos': 0.367, 'compound': 0.4404}",0.4404,pos
767,101873,2021-05-31,,Helps our hyperactive boy settle down for sleep,"{'neg': 0.0, 'neu': 0.729, 'pos': 0.271, 'compound': 0.3818}",0.3818,pos
768,101873,2021-05-30,,I like it so much for my kids ,"{'neg': 0.0, 'neu': 0.706, 'pos': 0.294, 'compound': 0.3612}",0.3612,pos
769,101873,2021-05-19,,works great for my ADHD child,"{'neg': 0.0, 'neu': 0.549, 'pos': 0.451, 'compound': 0.6249}",0.6249,pos
770,101873,2021-01-30,,Works every time. Gives mommy peace!,"{'neg': 0.0, 'neu': 0.569, 'pos': 0.431, 'compound': 0.5848}",0.5848,pos
771,101873,2020-11-13,,This product really works for my son. Great!!!,"{'neg': 0.0, 'neu': 0.585, 'pos': 0.415, 'compound': 0.7163}",0.7163,pos
772,101873,2021-08-11,,"Works well, kids like the taste and definitely recommend","{'neg': 0.0, 'neu': 0.338, 'pos': 0.662, 'compound': 0.8316}",0.8316,pos
773,101873,2020-12-05,,Came as requested,"{'neg': 0.0, 'neu': 1.0, 'pos': 0.0, 'compound': 0.0}",0.0,neu
774,101873,2020-11-21,,It just did not work for us. Awake as an owl ,"{'neg': 0.0, 'neu': 1.0, 'pos': 0.0, 'compound': 0.0}",0.0,neu
775,101873,2020-11-16,,Carmed my child for sleep time.,"{'neg': 0.0, 'neu': 1.0, 'pos': 0.0, 'compound': 0.0}",0.0,neu
776,101873,2022-07-16,,unfortunately didn't help at all,"{'neg': 0.608, 'neu': 0.392, 'pos': 0.0, 'compound': -0.5659}",-0.5659,neg
777,101873,2022-04-23,,First time used will review later,"{'neg': 0.0, 'neu': 1.0, 'pos': 0.0, 'compound': 0.0}",0.0,neu
778,101873,2020-10-17,,"Awful. Gave my child nightmares and was up screaming half the night. When she did eventually calm down and go back to sleep she woke in the morning furious, cranky and exhausted. Rubbish.","{'neg': 0.28, 'neu': 0.665, 'pos': 0.055, 'compound': -0.8591}",-0.8591,neg
779,101873,2021-09-19,,Works well - tastes great,"{'neg': 0.0, 'neu': 0.244, 'pos': 0.756, 'compound': 0.7351}",0.7351,pos
780,101873,2021-09-12,,it's really good ,"{'neg': 0.0, 'neu': 0.385, 'pos': 0.615, 'compound': 0.4927}",0.4927,pos
781,101873,2021-09-08,,Wonderful!!,"{'neg': 0.0, 'neu': 0.0, 'pos': 1.0, 'compound': 0.6467}",0.6467,pos
782,101873,2021-09-01,,Great product,"{'neg': 0.0, 'neu': 0.196, 'pos': 0.804, 'compound': 0.6249}",0.6249,pos
783,101873,2021-08-28,,Excellent,"{'neg': 0.0, 'neu': 0.0, 'pos': 1.0, 'compound': 0.5719}",0.5719,pos
784,101873,2021-08-18,,We love it,"{'neg': 0.0, 'neu': 0.323, 'pos': 0.677, 'compound': 0.6369}",0.6369,pos
785,101873,2021-07-27,,highly recommended ,"{'neg': 0.0, 'neu': 0.323, 'pos': 0.677, 'compound': 0.2716}",0.2716,pos
786,101873,2021-07-05,,Very quick delivery ,"{'neg': 0.0, 'neu': 1.0, 'pos': 0.0, 'compound': 0.0}",0.0,neu
787,101873,2021-05-16,,Good for my kids ,"{'neg': 0.0, 'neu': 0.508, 'pos': 0.492, 'compound': 0.4404}",0.4404,pos
788,101873,2021-05-15,,great,"{'neg': 0.0, 'neu': 0.0, 'pos': 1.0, 'compound': 0.6249}",0.6249,pos
789,101873,2021-04-21,,LOVE IT!!! Works wonders!!!!,"{'neg': 0.0, 'neu': 0.33, 'pos': 0.67, 'compound': 0.7964}",0.7964,pos
790,101873,2021-04-12,kids melatonin,great results..thanks,"{'neg': 0.0, 'neu': 0.196, 'pos': 0.804, 'compound': 0.6249}",0.6249,pos
791,101873,2021-04-02,great ,I love this product ,"{'neg': 0.0, 'neu': 0.323, 'pos': 0.677, 'compound': 0.6369}",0.6369,pos
792,101873,2021-03-15,Works a treat and great taste ,"Great product, works great. ","{'neg': 0.0, 'neu': 0.196, 'pos': 0.804, 'compound': 0.8481}",0.8481,pos
793,101873,2021-03-09,,Good 👍🏻👍🏻👍🏻,"{'neg': 0.0, 'neu': 0.256, 'pos': 0.744, 'compound': 0.4404}",0.4404,pos
794,101873,2021-03-01,,Great product. ,"{'neg': 0.0, 'neu': 0.196, 'pos': 0.804, 'compound': 0.6249}",0.6249,pos
795,101873,2021-02-13,,Love this product! ,"{'neg': 0.0, 'neu': 0.308, 'pos': 0.692, 'compound': 0.6696}",0.6696,pos
796,101873,2021-02-10,,my kids love flavour ,"{'neg': 0.0, 'neu': 0.417, 'pos': 0.583, 'compound': 0.6369}",0.6369,pos
797,101873,2021-02-09,,Good taste ,"{'neg': 0.0, 'neu': 0.256, 'pos': 0.744, 'compound': 0.4404}",0.4404,pos
798,101873,2021-02-09,,Effective,"{'neg': 0.0, 'neu': 0.0, 'pos': 1.0, 'compound': 0.4767}",0.4767,pos
799,101873,2021-02-07,,soooo helpful,"{'neg': 0.0, 'neu': 0.263, 'pos': 0.737, 'compound': 0.4215}",0.4215,pos
800,101873,2021-02-06,,Trusted product. ,"{'neg': 0.0, 'neu': 0.244, 'pos': 0.756, 'compound': 0.4767}",0.4767,pos
801,101873,2021-01-21,Прекрасно!,👍,"{'neg': 0.0, 'neu': 0.0, 'pos': 0.0, 'compound': 0.0}",0.0,neu
802,101873,2020-12-10,,Works great 👍 ,"{'neg': 0.0, 'neu': 0.196, 'pos': 0.804, 'compound': 0.6249}",0.6249,pos
803,101873,2020-12-10,,Works lovely ,"{'neg': 0.0, 'neu': 0.208, 'pos': 0.792, 'compound': 0.5859}",0.5859,pos
804,101873,2021-08-08,,the kids loved the taste but preferred the chewables,"{'neg': 0.0, 'neu': 0.766, 'pos': 0.234, 'compound': 0.3506}",0.3506,pos
805,101873,2021-06-28,,"Daughter used this first on our 2 year old Grandson, didn't seem to have any effect","{'neg': 0.0, 'neu': 1.0, 'pos': 0.0, 'compound': 0.0}",0.0,neu
806,101873,2021-08-31,,Ok,"{'neg': 0.0, 'neu': 0.0, 'pos': 1.0, 'compound': 0.296}",0.296,pos
807,101873,2021-08-08,melatonin,"working well

","{'neg': 0.0, 'neu': 0.323, 'pos': 0.677, 'compound': 0.2732}",0.2732,pos
808,101873,2021-04-24,,قيد التجربة وانتظر النتيجة,"{'neg': 0.0, 'neu': 1.0, 'pos': 0.0, 'compound': 0.0}",0.0,neu
809,101873,2021-02-24,,Has a good taste,"{'neg': 0.0, 'neu': 0.408, 'pos': 0.592, 'compound': 0.4404}",0.4404,pos
810,101873,2021-02-14,A,I didn’t use ,"{'neg': 0.0, 'neu': 1.0, 'pos': 0.0, 'compound': 0.0}",0.0,neu
811,101873,2020-12-21,,Not using it frequently ,"{'neg': 0.0, 'neu': 1.0, 'pos': 0.0, 'compound': 0.0}",0.0,neu
812,101873,2020-12-13,,Does not work at all. A waste of money,"{'neg': 0.286, 'neu': 0.714, 'pos': 0.0, 'compound': -0.4215}",-0.4215,neg
813,101873,2021-04-19,,Worked for us!,"{'neg': 0.0, 'neu': 1.0, 'pos': 0.0, 'compound': 0.0}",0.0,neu
814,101873,2024-09-08,Mumtaz ,"First of all, I am not responsible for any woman who reads my words and brings them to her child. My son is two years old. After consulting a doctor, I took him. My son, may God protect him, has very interrupted sleep and no matter how much I try to organize his sleep, it is of no use. My condition is the same with him. I used only 1 ml half an hour before bedtime and, praise be to God, I found results. Of course, I will not use it every day. No! Only once or twice a week. The important thing is that the child is full + clean + the place he is sitting in is prepared for sleeping, meaning no toys or TV, it is very important. I like to turn on the TV to the Quran channel and thank God, since he was little, he has been used to me playing the Quran at bedtime. This, after God, helped me a lot in organizing his sleep, thank God, and I am starting to do without it 🙏🏻","{'neg': 0.068, 'neu': 0.748, 'pos': 0.184, 'compound': 0.956}",0.956,pos
815,101873,2024-02-08,Good remedy,"I won’t write much, I think it’s not difficult to copy and paste the information as a review. Mine is very hyperactive and we have trouble falling asleep. We either have too little time or too much time. Even if the child is very tired, it is impossible to put him to bed. Perhaps it’s a coincidence, or maybe it really helps - when I give melatonin, it’s as if it somehow became easier and I started falling asleep faster. Even the family noticed. Although my friend took it in tablet form, she says she didn’t see any effect. It tastes good. Bliss is a famous brand. There is for colic. So I think the quality is definitely good. The bottle size is also good. I give mine according to age. ","{'neg': 0.064, 'neu': 0.754, 'pos': 0.182, 'compound': 0.9517}",0.9517,pos
816,101873,2024-05-16,Prominent ,"Quality. Original ingredients.. Natural and safe, God willing, for children. The taste is beautiful and my child loves it. Use it every day, an hour before his sleep. An ounce and an hour. The size is a nice quantity, enough for a month. The packaging is great. The benefit is beautiful and I sleep regularly. My six-year-old son is a safe food supplement, God willing. The serving is once every day. Repeat each. Good day, I slept well, thank God 

","{'neg': 0.0, 'neu': 0.563, 'pos': 0.437, 'compound': 0.9917}",0.9917,pos
817,101873,2024-04-25,melatonin syrup,"For small children who have disturbances in night sleep, who often wake up at night, are restless - syrup with melatonin. A good suggestion to solve these problems. The syrup has a pleasant taste of grapes. After taking melatonin, the child sleeps, is not so irritable, has become calmer. They were given according to the recommendations of the instructions. For children from 3 years old.","{'neg': 0.097, 'neu': 0.717, 'pos': 0.186, 'compound': 0.7589}",0.7589,pos
818,101873,2024-09-06,Excellent for kids and even adults.,This is the third time I buy it. It tastes good. I use it for my children when needed. Only a quarter of the suggested dose is enough (half a ml only) for ages 5 and 8. It works within half an hour. It's better than the candy that sticks to the teeth and its taste doesn't change over time. I use it for myself. The sweetness in it is that it doesn't cause nightmares like the adult types. ,"{'neg': 0.026, 'neu': 0.861, 'pos': 0.112, 'compound': 0.7839}",0.7839,pos
819,101873,2024-07-24,,"For my 3-year-old daughter who is a short sleeper★ Normally it takes several hours to get her to sleep, but with this she was able to fall asleep within 30 minutes. It depends on whether she takes a nap or not, but I'm worried about her lack of sleep, so I'm glad I bought it. I switched to the gummies for ease of use😊","{'neg': 0.043, 'neu': 0.812, 'pos': 0.145, 'compound': 0.7935}",0.7935,pos
820,101873,2024-05-01,The effect is amazing!!,"It's been hard to get my child to sleep since he was a baby. As he grew older, he started to sleep less and less, and at age 2, he would take long naps at daycare, sometimes even past midnight. Now that he's 3, he's gotten stronger and less able to sleep, so after seeing this review, I decided to give it a try. Then, 30 minutes after drinking it, he started rubbing his eyes, and when we went to bed, he would quietly close his eyes and start snoring after about 5 minutes, even though he used to thrash around on the mattress! To be honest, I was surprised because I thought it wouldn't work on my child.","{'neg': 0.012, 'neu': 0.92, 'pos': 0.068, 'compound': 0.7712}",0.7712,pos
821,101873,2024-04-14,My name,"I would like to give it a hundred star stars. If they are full in half an hour, they become dizzy, if not in 40 minutes, they become sleepy. Excellent, and I will take it again. To be honest, I advise you about it. My daughter has autism, and sometimes I cannot control it. They helped me a lot. The quality is great. The ingredients are excellent. The taste is delicious. It is often used when there is excessive anxiety and staying up late. The size means a month and a half for two children. The package is Tightly sealed, dark, and heavy plastic. The usefulness is great. Excellent. It is three years old. It is likely to be repeated, of course, and improving it is of benefit. Enough like. I make a living for my daughter and spend on her 🙏","{'neg': 0.023, 'neu': 0.732, 'pos': 0.246, 'compound': 0.9888}",0.9888,pos
822,101873,2024-04-04,First time trying it for my child ,"The quality is excellent. The ingredients are natural. The taste is good. Use once a day when necessary or to adjust the sleep cycle. The size is excellent. The package is well sealed. The benefit is that it works in 20 minutes. Age is 3 years. A dietary supplement. The serving is 2 ml. But I give him one and a half ml. Improvement in sleep. Repeat order in the future.
","{'neg': 0.0, 'neu': 0.784, 'pos': 0.216, 'compound': 0.9178}",0.9178,pos
823,101873,2024-02-08,It's a repeat.,"The taste is delicious even for adults. I often buy this because I want my child to sleep well and grow up healthy and healthy. The bottle shape is safe. I don't buy many supplements, but this one has no side effects and is safe. About 3ml per day is sufficient. The frequency is every night. Lack of sleep is not good, so I use it to maintain my health. The size is small, the taste is natural, the grape flavor is loved by children, it is suitable for all ages, and the quality is high.","{'neg': 0.079, 'neu': 0.714, 'pos': 0.207, 'compound': 0.906}",0.906,pos
824,101873,2024-02-07,When I can't seem to sleep,"I don't drink it as is, so I mix it with orange juice. I give it to her when she takes a nap or when she's so excited that she can't sleep even though she's sleepy. I was able to sleep properly and have a regular lifestyle. I no longer have tantrums for no reason due to lack of sleep. I was saved when I was about to collapse.","{'neg': 0.174, 'neu': 0.743, 'pos': 0.083, 'compound': -0.6688}",-0.6688,neg
825,101873,2024-09-29,Melatonin,Quality is excellent Ingredients Melatonin Taste is regular Use to regulate sleep for children over two years old Size is large Dark package to store the medicine Benefit Regulating sleep Age 2 years and above Not a food supplement The serving is written on the back Avoid repeating the medicine for the child Helps improve sleep ,"{'neg': 0.035, 'neu': 0.773, 'pos': 0.192, 'compound': 0.875}",0.875,pos
826,101873,2024-04-24,Great ,"It helps my child very well. He has ADHD and can't fall asleep in the evenings. I liked this product because the composition is natural. The instructions say 2 ml, but I give 0.5 and it's enough. In general, I recommend it. Please like it.","{'neg': 0.0, 'neu': 0.672, 'pos': 0.328, 'compound': 0.9273}",0.9273,pos
827,101873,2023-12-18,,"Tips for Bedtime Bliss As a mom, I know that some things can happen that disturb a baby's sleep, even if they are the best sleepers. When used occasionally, along with a sleep routine, our sleep products may help get things back on track. I've compiled a bedtime routine checklist so your little one can regain comfort and happiness at bedtime. Daily sunlight and physical activity Belly full of nutritious foods (low in sugar) 1-2 hours before bedtime A warm, soothing bath Time to listen to a story, not to watch TV or look at a cell phone Maintain bedroom temperature at 65-68°F Plan to wake up mid Night commitment to routine! Wishing you and your baby a good night Yasmine Qadirli - Mum & Manager","{'neg': 0.02, 'neu': 0.769, 'pos': 0.211, 'compound': 0.9747}",0.9747,pos
