,Unnamed: 0,product_id,date_posted,review_title,review_text,scores,compound,sentiment
189,189,107065,2023-10-18,Acts as a sedative,"After 10-15 minutes, the child calms down and falls asleep easier, his sleep has become deeper. The taste is neutral, I use it when the baby is hyperactive.","{'neg': 0.0, 'neu': 0.831, 'pos': 0.169, 'compound': 0.6249}",0.6249,pos
190,190,107065,2023-09-23,Didn't understand,"I can’t give an objective review, because... The remedy coincided with the end of the guard and the child began to sleep. But I noticed that when I gave it, my son began to behave calmer.","{'neg': 0.0, 'neu': 0.908, 'pos': 0.092, 'compound': 0.5023}",0.5023,pos
191,191,107065,2023-02-23,,This homeopathic remedy helped to improve my son's sleep. I began to fall asleep faster and be less nervous. Bought another one to take another course.,"{'neg': 0.065, 'neu': 0.83, 'pos': 0.105, 'compound': 0.2716}",0.2716,pos
192,192,107065,2022-12-28,,Great manufacturer! Recognized brand! Lots of good reviews. The highest quality. Effect after 3-4 applications. Rich composition. One of the best supplements in its segment. Suits us. Bright packaging. I advise everyone!,"{'neg': 0.0, 'neu': 0.583, 'pos': 0.417, 'compound': 0.9616}",0.9616,pos
193,193,107065,2024-10-10,,"I bought this product for my daughter, she has a hard time falling asleep, unfortunately I didn’t see any results, I had to order another medicine.","{'neg': 0.221, 'neu': 0.779, 'pos': 0.0, 'compound': -0.5267}",-0.5267,neg
194,194,107065,2024-01-08,👎,"It doesn’t help at all, she gave it to the child before bed and instead of a restful sleep, she awoke wakefulness that could not be stopped","{'neg': 0.0, 'neu': 0.77, 'pos': 0.23, 'compound': 0.7065}",0.7065,pos
195,195,107065,2022-05-08,,"I took for a girl of 9 years old, who is very picky about tastes. This is water, just a lifesaver: no color, no smell, no taste. Daughter agrees to drink only it. Marmalades are sweet, other syrups are bitter ... The only minus is not enough in the package, I immediately dropped 2. Now I repeat the purchase, I have already taken 3 packages))) if the review was useful, like it! Sweet dreams","{'neg': 0.111, 'neu': 0.652, 'pos': 0.237, 'compound': 0.8908}",0.8908,pos
196,196,107065,2024-04-28,It didn't work ,I bought it for my son to sleep in and it didn't work for us. ,"{'neg': 0.0, 'neu': 1.0, 'pos': 0.0, 'compound': 0.0}",0.0,neu
197,197,107065,2024-02-05,Light effect ,I can’t say that the baby began to sleep better. The composition is good but there is no effect,"{'neg': 0.129, 'neu': 0.691, 'pos': 0.18, 'compound': 0.0258}",0.0258,neu
198,198,107065,2023-06-30,,"It works every other time, but when it works, the child sleeps really well, relaxed, but it happens that it lasts half the night, the child is 10 months old, teeth periodically climb, I use it with Camilla for better calm))","{'neg': 0.0, 'neu': 0.76, 'pos': 0.24, 'compound': 0.9128}",0.9128,pos
199,199,107065,2022-12-05,,"Quality brand with natural ingredients, without flavor, homeopathic product, I am giving a dose at 9 pm to my son aged 3 years and 4 months, and for the time being he has not started to sleep earlier but he has been sleeping straight and in a deeper sleep.","{'neg': 0.0, 'neu': 0.873, 'pos': 0.127, 'compound': 0.5859}",0.5859,pos
200,200,107065,2024-09-20,good,Children’s sleep quality has been significantly improved,"{'neg': 0.0, 'neu': 0.659, 'pos': 0.341, 'compound': 0.4767}",0.4767,pos
201,201,107065,2024-08-19,sleep,I bought it for sleep recovery,"{'neg': 0.0, 'neu': 1.0, 'pos': 0.0, 'compound': 0.0}",0.0,neu
202,202,107065,2023-05-07,,"A food supplement for children, the taste is excellent, improving digestion, fast absorption, soothing for the child","{'neg': 0.0, 'neu': 0.596, 'pos': 0.404, 'compound': 0.8316}",0.8316,pos
203,203,107065,2023-01-13,,Thank you so much I really like it ……………….. Thank you very nice product,"{'neg': 0.0, 'neu': 0.447, 'pos': 0.553, 'compound': 0.8793}",0.8793,pos
204,204,107065,2022-05-08,,"The friend constantly orders to the kid for the best falling asleep according to the appointment of the neurologist or this complex, or liquid from Mammy Bliss. Alternate so that there is no habituation, but habituation does not occur, both effective soft-acting with a good safe for children composition.","{'neg': 0.102, 'neu': 0.656, 'pos': 0.242, 'compound': 0.8597}",0.8597,pos
205,205,107065,2023-05-02,,"Useful for children, comfortable on the plane, light, which causes severe drowsiness, just relax","{'neg': 0.12, 'neu': 0.461, 'pos': 0.419, 'compound': 0.7579}",0.7579,pos
206,206,107065,2023-09-06,,"Good, the child accepts its taste. It does not cause sleep directly, but it improves the quality of my child’s sleep, so he does not get up during the night","{'neg': 0.0, 'neu': 0.787, 'pos': 0.213, 'compound': 0.743}",0.743,pos
207,207,107065,2023-03-09,,I bought this product because this brand usually offers good quality products with natural ingredients. The small individual packs are very convenient and my son has no problem with the taste. Unfortunately for the moment I do not see any results...,"{'neg': 0.156, 'neu': 0.728, 'pos': 0.116, 'compound': -0.2263}",-0.2263,neg
208,208,107065,2022-09-09,,"Very good, it helps my son to be calmer for the night's sleep, he woke up less often. Easy to give to children and has no taste.","{'neg': 0.062, 'neu': 0.622, 'pos': 0.316, 'compound': 0.8393}",0.8393,pos
209,209,107065,2023-09-25,Very very useful,Its effect is very fast. My baby was instantly relieved. I loved it and have ordered it more than once,"{'neg': 0.0, 'neu': 0.723, 'pos': 0.277, 'compound': 0.7579}",0.7579,pos
210,210,107065,2023-08-13,,"Good quality. I like the ingredients, delicious. The dosage of the supplement is small. Improvement noticed","{'neg': 0.0, 'neu': 0.476, 'pos': 0.524, 'compound': 0.9022}",0.9022,pos
211,211,107065,2023-07-24,,Good product of excellent quality! With great content! The size of the package is enough for a long time.,"{'neg': 0.0, 'neu': 0.571, 'pos': 0.429, 'compound': 0.9059}",0.9059,pos
212,212,107065,2023-07-15,Great product,"Fadni product with my three-and-a-half-year-old daughter, I advise you","{'neg': 0.0, 'neu': 1.0, 'pos': 0.0, 'compound': 0.0}",0.0,neu
213,213,107065,2023-07-10,,The best time-tested manufacturer and the quality and price suits me,"{'neg': 0.0, 'neu': 0.704, 'pos': 0.296, 'compound': 0.6369}",0.6369,pos
214,214,107065,2023-06-05,,"My child does not sleep well and always has difficulty falling asleep. After taking this, he can fall asleep immediately","{'neg': 0.255, 'neu': 0.745, 'pos': 0.0, 'compound': -0.5878}",-0.5878,neg
215,215,107065,2023-05-17,,"The second purchase, if the children can't sleep, it is very effective","{'neg': 0.0, 'neu': 0.764, 'pos': 0.236, 'compound': 0.5256}",0.5256,pos
216,216,107065,2023-05-17,,"The quality is excellent, the ingredients are natural, the taste is acceptable, and it is easy to use","{'neg': 0.0, 'neu': 0.551, 'pos': 0.449, 'compound': 0.886}",0.886,pos
217,217,107065,2023-05-14,,"soothes before going to bed, sleeps longer without waking up. Daughter loves that there are no odors.","{'neg': 0.105, 'neu': 0.718, 'pos': 0.177, 'compound': 0.3612}",0.3612,pos
218,218,107065,2023-05-06,,"Great product, excellent quality, the size of the package is enough for a long time. Easy to use.","{'neg': 0.0, 'neu': 0.567, 'pos': 0.433, 'compound': 0.8934}",0.8934,pos
219,219,107065,2023-04-15,,"Calm for little toddlers. Pleasant to the taste. High quality, natural composition.","{'neg': 0.0, 'neu': 0.535, 'pos': 0.465, 'compound': 0.7796}",0.7796,pos
220,220,107065,2023-03-10,,"Excellent drops for sleep, the child, after being busy, did not fall asleep well, after taking 20 minutes, he falls asleep until the morning","{'neg': 0.066, 'neu': 0.8, 'pos': 0.134, 'compound': 0.4378}",0.4378,pos
221,221,107065,2023-01-06,,"quality, ingredients, taste, use, content, packaging, supplements, and presentation 👌 good for health improvement","{'neg': 0.0, 'neu': 0.651, 'pos': 0.349, 'compound': 0.7096}",0.7096,pos
222,222,107065,2022-11-14,,Wonderful. I bought it for my daughter. Love the products of this company.,"{'neg': 0.0, 'neu': 0.559, 'pos': 0.441, 'compound': 0.836}",0.836,pos
223,223,107065,2024-09-10,,"The truth is that it had no effect on my daughter. On the contrary, it made her more active. ","{'neg': 0.094, 'neu': 0.681, 'pos': 0.225, 'compound': 0.4754}",0.4754,pos
224,224,107065,2024-08-19,,"I don't know if it's working. At least, it doesn't keep me up at night.","{'neg': 0.0, 'neu': 1.0, 'pos': 0.0, 'compound': 0.0}",0.0,neu
225,225,107065,2024-03-20,Useless,It didn't help at all! Wasted money. Neither falling asleep nor the sleep itself became calmer or more serene. ,"{'neg': 0.202, 'neu': 0.519, 'pos': 0.279, 'compound': 0.2665}",0.2665,pos
226,226,107065,2024-02-26,,"Didn't affect us at all, no taste, use only at night before bed, liked the packaging, use for a 3 year old child","{'neg': 0.092, 'neu': 0.792, 'pos': 0.117, 'compound': 0.1531}",0.1531,pos
227,227,107065,2022-09-13,,"Helps to fall asleep faster, no diuretic effect like magnesium. I don't know if I'll take it again","{'neg': 0.103, 'neu': 0.657, 'pos': 0.239, 'compound': 0.4404}",0.4404,pos
228,228,107065,2023-08-29,,Bought for a child. But still haven't tried it. I hope for an effect.,"{'neg': 0.22, 'neu': 0.78, 'pos': 0.0, 'compound': -0.4782}",-0.4782,neg
229,229,107065,2023-07-27,,"I think even adults can listen to it. It wasn't clear until sleep, but it seemed to be calm.","{'neg': 0.077, 'neu': 0.779, 'pos': 0.144, 'compound': 0.3309}",0.3309,pos
230,230,107065,2023-01-04,,"Not appreciated, the child drank all the nebulas. We drank according to the instructions, the problems with sleep did not go away. Sleep is just as restless.","{'neg': 0.238, 'neu': 0.762, 'pos': 0.0, 'compound': -0.7581}",-0.7581,neg
231,231,107065,2023-09-18,No effect,"We’ve been taking it for the 5th day now. There’s absolutely no difference, unfortunately. I had problems with sleep and still have them. Now I'll just hope that the child outgrows it","{'neg': 0.208, 'neu': 0.715, 'pos': 0.077, 'compound': -0.6068}",-0.6068,neg
232,232,107065,2023-08-01,,"I took it for my son over 2 years old, it didn’t help) these herbs don’t work without melatonin) there is no taste as such, the ingredients seem to be natural, the packaging and size are optimal at first glance","{'neg': 0.052, 'neu': 0.829, 'pos': 0.118, 'compound': 0.4215}",0.4215,pos
233,233,107065,2023-10-08,,"The ingredients are safe for children, but it is still difficult for children to fall asleep","{'neg': 0.169, 'neu': 0.729, 'pos': 0.102, 'compound': -0.3182}",-0.3182,neg
234,234,107065,2023-02-09,,Bought for the first time. Haven't tried it yet. Read reviews everywhere. Not bad. We decided to try.,"{'neg': 0.0, 'neu': 0.856, 'pos': 0.144, 'compound': 0.431}",0.431,pos
235,235,107065,2022-09-23,,"The child has poor sleep, often wakes up, sleeps restlessly One hope for this remedy","{'neg': 0.27, 'neu': 0.588, 'pos': 0.142, 'compound': -0.3818}",-0.3818,neg
236,236,107065,2023-09-15,,"Very useful, no taste, just like drinking water","{'neg': 0.188, 'neu': 0.38, 'pos': 0.432, 'compound': 0.4964}",0.4964,pos
237,237,107065,2022-10-02,,Very good I liked it!!!!!my son slept and woke up on time.,"{'neg': 0.0, 'neu': 0.547, 'pos': 0.453, 'compound': 0.8146}",0.8146,pos
238,238,107065,2022-09-13,,"calms well. Excellent Quality Supplement, Natural Ingredients. I recommend to buy.","{'neg': 0.0, 'neu': 0.276, 'pos': 0.724, 'compound': 0.9022}",0.9022,pos
239,239,107065,2022-06-03,,I advise all mothers it helps a lot with insomnia of the child!,"{'neg': 0.0, 'neu': 0.776, 'pos': 0.224, 'compound': 0.4389}",0.4389,pos
240,240,107065,2022-05-31,,I give it to my son before sleeping. Easy to drink. I can't say much about the results. Maybe long term,"{'neg': 0.0, 'neu': 0.861, 'pos': 0.139, 'compound': 0.4404}",0.4404,pos
241,241,107065,2022-05-30,,"Zouwen, but I don't feel it, and I want to be honest, as a result","{'neg': 0.0, 'neu': 0.629, 'pos': 0.371, 'compound': 0.7096}",0.7096,pos
242,242,107065,2022-03-24,,Sucking pills with exceptional sleep quality and no side effects,"{'neg': 0.196, 'neu': 0.804, 'pos': 0.0, 'compound': -0.296}",-0.296,neg
243,243,107065,2022-07-22,,I've been eating it for a day and I'm looking forward to it. It's easy to feed.,"{'neg': 0.0, 'neu': 0.838, 'pos': 0.162, 'compound': 0.4404}",0.4404,pos
244,244,107065,2022-07-13,,"The child is upset because of sleep problems, so it seems to be listening well by boiling it.","{'neg': 0.237, 'neu': 0.67, 'pos': 0.094, 'compound': -0.4939}",-0.4939,neg
245,245,107065,2022-03-16,,"More than excellent shipping and fast delivery, suitable for children under 15 years old","{'neg': 0.0, 'neu': 0.766, 'pos': 0.234, 'compound': 0.6096}",0.6096,pos
246,246,107065,2023-05-30,,It doesn't seem to have much effect ㅠㅠ It must be the fault of my sensitive child...,"{'neg': 0.144, 'neu': 0.856, 'pos': 0.0, 'compound': -0.4019}",-0.4019,neg
247,247,107065,2022-12-31,I give zero stars it caused skin allergies to my two daughters,caused skin allergies to my two daughters. I will not buy this product again,"{'neg': 0.0, 'neu': 1.0, 'pos': 0.0, 'compound': 0.0}",0.0,neu
248,248,107065,2022-12-21,,"In general, it did not affect either falling asleep or sleeping, I will not buy again","{'neg': 0.0, 'neu': 0.907, 'pos': 0.093, 'compound': 0.1139}",0.1139,pos
249,249,107065,2022-08-27,Ok,A homeopathic product that is supposed to calm toddlers before bed. The toddlers absolutely love it. Is it relaxing? Opinions differ on that...,"{'neg': 0.0, 'neu': 0.655, 'pos': 0.345, 'compound': 0.8748}",0.8748,pos
250,250,107065,2021-12-18,,"I give according to the instructions, I do not see the difference","{'neg': 0.0, 'neu': 1.0, 'pos': 0.0, 'compound': 0.0}",0.0,neu
251,251,107065,2022-05-15,,excellent! helps the child calm down,"{'neg': 0.0, 'neu': 0.252, 'pos': 0.748, 'compound': 0.8356}",0.8356,pos
252,252,107065,2022-04-21,,It really helped my daughter sleep.,"{'neg': 0.0, 'neu': 1.0, 'pos': 0.0, 'compound': 0.0}",0.0,neu
253,253,107065,2021-12-12,,Ergonomic format in single dose. Easy to use,"{'neg': 0.0, 'neu': 0.707, 'pos': 0.293, 'compound': 0.4404}",0.4404,pos
254,254,107065,2022-08-22,,I tried to give these drops to a child of 3.5 - she sleeps even worse at night than without them,"{'neg': 0.154, 'neu': 0.846, 'pos': 0.0, 'compound': -0.4767}",-0.4767,neg
255,255,107065,2022-02-01,,Very convenient to use,"{'neg': 0.0, 'neu': 1.0, 'pos': 0.0, 'compound': 0.0}",0.0,neu
256,256,107065,2021-12-26,,Very practical format,"{'neg': 0.0, 'neu': 1.0, 'pos': 0.0, 'compound': 0.0}",0.0,neu
257,257,107065,2021-12-13,,Very easy to use,"{'neg': 0.0, 'neu': 0.484, 'pos': 0.516, 'compound': 0.4927}",0.4927,pos
258,258,107065,2021-12-13,,Good product,"{'neg': 0.0, 'neu': 0.256, 'pos': 0.744, 'compound': 0.4404}",0.4404,pos
259,259,107065,2021-12-06,,"Highlighted the composition of the product, quite natural","{'neg': 0.0, 'neu': 0.715, 'pos': 0.285, 'compound': 0.4201}",0.4201,pos
260,260,107065,2022-03-23,,good product,"{'neg': 0.0, 'neu': 0.256, 'pos': 0.744, 'compound': 0.4404}",0.4404,pos
261,261,107065,2021-12-12,,Practical size,"{'neg': 0.0, 'neu': 1.0, 'pos': 0.0, 'compound': 0.0}",0.0,neu
262,262,107065,2022-04-15,,no use,"{'neg': 0.688, 'neu': 0.312, 'pos': 0.0, 'compound': -0.296}",-0.296,neg
