,product_id,date_posted,review_title,review_text,scores,compound,sentiment
86,10998,2023-12-15,OK,"At first, the effect was not obvious if I took one straw, but I changed it to two straws before going to bed, and it showed an effect. sleep improved","{'neg': 0.0, 'neu': 0.867, 'pos': 0.133, 'compound': 0.631}",0.631,pos
87,10998,2023-08-23,,"excellent remedy for health, for calming, falling asleep. the herb is not limited by age, the improvement in sleep is obvious. the problem of falling asleep is quickly resolved. no addiction to the supplement. undoubtedly, it is better to take natural things, there are more benefits from them and there are no side effects. like drugs. highly recommend.","{'neg': 0.129, 'neu': 0.54, 'pos': 0.331, 'compound': 0.9437}",0.9437,pos
88,10998,2024-09-25,,"It has the effect of helping sleep and mood, and the taste is easy to drink.","{'neg': 0.0, 'neu': 0.733, 'pos': 0.267, 'compound': 0.6249}",0.6249,pos
89,10998,2024-09-16,good quality,The quality and taste are great and the portions are generous,"{'neg': 0.0, 'neu': 0.549, 'pos': 0.451, 'compound': 0.8126}",0.8126,pos
90,10998,2024-08-09,,Excellent quality. An ingredient that helps to relax. Convenient size benefits for stressed people to relax.,"{'neg': 0.089, 'neu': 0.369, 'pos': 0.542, 'compound': 0.9062}",0.9062,pos
91,10998,2024-05-25,Great,Super dietary supplement based on herbal ingredients really calms down 👍👍👍 I noticed the effect right away ,"{'neg': 0.0, 'neu': 0.683, 'pos': 0.317, 'compound': 0.7574}",0.7574,pos
92,10998,2024-01-25,The taste...,"It didn't suit me and was too tasteless. The alcohol-like taste also makes my throat feel strange. I bought it to help with insomnia, but it tasted so bad that I woke up.The aftertaste was so bad that I couldn't sleep. Well, that's just my opinion based on my taste.","{'neg': 0.268, 'neu': 0.701, 'pos': 0.031, 'compound': -0.9455}",-0.9455,neg
93,10998,2024-01-21,Excellent!,"Good drops for calming. I began to sleep better. The quality is excellent. The taste is neutral,","{'neg': 0.0, 'neu': 0.496, 'pos': 0.504, 'compound': 0.9042}",0.9042,pos
94,10998,2023-12-27,Great,"This product is of plant origin. It has a sedative effect and helps improve sleep. Indicated for neurasthenia, sleep disorders, anxiety, and tension.","{'neg': 0.145, 'neu': 0.655, 'pos': 0.2, 'compound': 0.3612}",0.3612,pos
95,10998,2023-12-06,Good drug,"Passionflower is recommended as a sedative for various problems of the nervous system, as well as autonomic failures.","{'neg': 0.325, 'neu': 0.458, 'pos': 0.217, 'compound': -0.5574}",-0.5574,neg
96,10998,2023-09-18,,A wonderful herbal remedy for calmness and anxiety. The most important thing is not to take it with alcohol against a background of stress. The consequences can be unpredictable.,"{'neg': 0.129, 'neu': 0.629, 'pos': 0.243, 'compound': 0.6115}",0.6115,pos
97,10998,2023-05-24,To calm the nervous system,"My husband drank to maintain the body after covid (he stopped sleeping completely). Passiflora was, as one of the supplements in the whole course. Therefore, it is difficult to say anything specifically about her. But she was discharged for a mandatory appointment to calm the nervous system.","{'neg': 0.114, 'neu': 0.8, 'pos': 0.086, 'compound': -0.1154}",-0.1154,neg
98,10998,2023-04-05,,"Top quality. safe ingredients. I always wake up in the middle of the night every day, and I couldn't sleep for hours after that, and I was dizzy every day, but the effect of falling asleep is high.","{'neg': 0.089, 'neu': 0.822, 'pos': 0.089, 'compound': 0.0}",0.0,neu
99,10998,2022-10-20,,"My permanent purchase. Pharmacy passionflower tablets do not give such a good sedative effect. It does not tend to sleep, although it is not recommended to drive a car when taking it.","{'neg': 0.124, 'neu': 0.836, 'pos': 0.04, 'compound': -0.4015}",-0.4015,neg
100,10998,2022-02-06,,"Passionflower is one of the most effective herbal sedatives. No side effects. Very good for relieving stress and anxiety. It works especially effectively in a mixture with valerian hops and St. John's wort. Contraindicated in myocardial infarction, angina pectoris. Better in this case motherwort. It also cannot be combined with antidepressants. Be careful. All health!","{'neg': 0.097, 'neu': 0.635, 'pos': 0.269, 'compound': 0.8987}",0.8987,pos
101,10998,2024-04-12,,I bought it for insomnia and it was just that.,"{'neg': 0.0, 'neu': 1.0, 'pos': 0.0, 'compound': 0.0}",0.0,neu
102,10998,2023-09-16,,"It's a mixture of alcohol and passionflower, and it's bitter. However, it does have a relaxing effect. It induces natural sleepiness and helps you sleep better. If it's organic, even better.","{'neg': 0.07, 'neu': 0.547, 'pos': 0.383, 'compound': 0.891}",0.891,pos
103,10998,2023-02-07,,Holy supplement to rest and get rid of black label medications. ♥️,"{'neg': 0.0, 'neu': 1.0, 'pos': 0.0, 'compound': 0.0}",0.0,neu
104,10998,2022-11-06,,"The quality of the product is beautiful. The first time I took it, I felt lethargic and sleep. The taste is very acceptable","{'neg': 0.082, 'neu': 0.674, 'pos': 0.243, 'compound': 0.6478}",0.6478,pos
105,10998,2023-07-27,,"This is a product I buy every time. It's a trusted brand, well packaged and fast delivery.","{'neg': 0.0, 'neu': 0.698, 'pos': 0.302, 'compound': 0.6369}",0.6369,pos
106,10998,2023-04-23,,a very easy and effective way to take these herbs - it helps me with less stress,"{'neg': 0.111, 'neu': 0.485, 'pos': 0.404, 'compound': 0.7684}",0.7684,pos
107,10998,2023-05-13,Excellent!,What is indispensable for a,"{'neg': 0.0, 'neu': 1.0, 'pos': 0.0, 'compound': 0.0}",0.0,neu
108,10998,2022-02-06,Excellent!,"Soothes, I give the child on the recommendation of a neurologist","{'neg': 0.0, 'neu': 1.0, 'pos': 0.0, 'compound': 0.0}",0.0,neu
109,10998,2023-09-23,,"It’s very spicy and hard to drink, probably because it contains alcohol.","{'neg': 0.131, 'neu': 0.869, 'pos': 0.0, 'compound': -0.1689}",-0.1689,neg
110,10998,2017-09-11, Excellent action,"Good effect on the nervous system. After 1 pipet fall asleep, for a few days of use sleep normalizes.","{'neg': 0.105, 'neu': 0.75, 'pos': 0.145, 'compound': 0.2023}",0.2023,pos
111,10998,2022-05-30,,"Uses regularly, it relaxes and allows for better sleep","{'neg': 0.0, 'neu': 0.565, 'pos': 0.435, 'compound': 0.6597}",0.6597,pos
112,10998,2022-03-13,,Feel calm after drinking and help sleep,"{'neg': 0.0, 'neu': 0.5, 'pos': 0.5, 'compound': 0.6124}",0.6124,pos
113,10998,2020-11-24,I did not get that,I didn’t feel the effect from 1 flyer. Perhaps it takes a long time. The jar does not last long (,"{'neg': 0.0, 'neu': 1.0, 'pos': 0.0, 'compound': 0.0}",0.0,neu
114,10998,2021-04-13,,I bought it for my mom. Hope it helps,"{'neg': 0.0, 'neu': 0.522, 'pos': 0.478, 'compound': 0.6705}",0.6705,pos
115,10998,2020-08-20,I LOVE,I LOVE,"{'neg': 0.0, 'neu': 0.0, 'pos': 1.0, 'compound': 0.6369}",0.6369,pos
