,Unnamed: 0,product_id,date_posted,review_title,review_text,scores,compound,sentiment
69,69,114587,2023-07-25,,"My boyfriend and I have a hard time falling asleep as we are both entrepreneurs and once we started taking these, we are out immediately. Highly recommend ","{'neg': 0.108, 'neu': 0.792, 'pos': 0.1, 'compound': 0.2006}",0.2006,pos
70,70,114587,2023-06-02,No Funny After Taste!,Love these gummies and so does my son! They are just the right MG they dont leave you drowsy and there is not gritty texture!,"{'neg': 0.0, 'neu': 0.795, 'pos': 0.205, 'compound': 0.7124}",0.7124,pos
71,71,114587,2023-05-30,Amazing product ,Tried this for the first time and loved it. Actually helped me have a good night sleep. Sleeping was easy after taking this.. The gummy is easy to chew too and tastes ok. ,"{'neg': 0.0, 'neu': 0.646, 'pos': 0.354, 'compound': 0.93}",0.93,pos
72,72,114587,2023-05-30,,"These melatonin gummies taste great and they work! If I have trouble sleeping, I take these and I’m always able to fall asleep quickly. They don’t give me the groggy feeling in the morning that some melatonin products do. ","{'neg': 0.063, 'neu': 0.798, 'pos': 0.138, 'compound': 0.4926}",0.4926,pos
73,73,114587,2023-05-30,,This is my second bottle of this gummies. I love it so much because it helps me fall to sleep. The taste is so yummy. All natural ingredients and very soft. I highly recommend it if you need a sleep aid.,"{'neg': 0.0, 'neu': 0.66, 'pos': 0.34, 'compound': 0.9516}",0.9516,pos
74,74,114587,2023-05-29,,This supplement helps me drift into a restful nights sleep without geeling groggy in the morning. I noticed I dintntoss and turn or wake up as often.,"{'neg': 0.0, 'neu': 0.812, 'pos': 0.188, 'compound': 0.6249}",0.6249,pos
75,75,114587,2023-05-16,,im shocked how this works fast! i suffer from insomnia forever and getting this one is the best decision i've ever made in my life! it really helps me to sleep immediately for long times like 9 hours and i usually sleep for 5 hours! ,"{'neg': 0.111, 'neu': 0.689, 'pos': 0.2, 'compound': 0.6877}",0.6877,pos
76,76,114587,2023-05-15,Great sleep supplement,"These melatonin gummies are great for helping you fall asleep without drowsiness the next day.
The dosage is low, which is great because it gives you the opportunity to start small.","{'neg': 0.051, 'neu': 0.63, 'pos': 0.32, 'compound': 0.9022}",0.9022,pos
77,77,114587,2023-05-08,,"Very good flavor, good effect. Just keep on mind that this is not a permanent solution for your sleep problems. Eventually you create resistance so it is good to have a break from any kind of melatonin, not just this brand :)","{'neg': 0.089, 'neu': 0.63, 'pos': 0.28, 'compound': 0.8755}",0.8755,pos
78,78,114587,2023-03-05,,"Sleep quality has improved tremendously, this going to be part of my night time routine. Well also be recommending this to family and friends. Ingredients, taste, size, dosage, are perfect. I have benefited from taking this product.","{'neg': 0.0, 'neu': 0.727, 'pos': 0.273, 'compound': 0.9001}",0.9001,pos
79,79,114587,2022-12-09,,I absolutely love this product. It works well for adults and on my children. My kids love them and feel like they are getting a special treat when I give them these at bedtime. The ingredients are clean and natural too. I will be repurchasing this! ,"{'neg': 0.0, 'neu': 0.581, 'pos': 0.419, 'compound': 0.9735}",0.9735,pos
80,80,114587,2022-11-23,,"I love these gummies! Not only do they taste delicious, but they ACTUALLY WORK! I fell asleep within 30 mins from taking 2 of them whenever I was struggling to fall asleep. ","{'neg': 0.108, 'neu': 0.73, 'pos': 0.162, 'compound': 0.2105}",0.2105,pos
81,81,114587,2022-11-12,,These work like a charm. My sons use them nearly every night and they help him sleep. They aren’t habit forming and they have a nice flavor. I will continue to use them when they come back in stock.,"{'neg': 0.0, 'neu': 0.749, 'pos': 0.251, 'compound': 0.8658}",0.8658,pos
82,82,114587,2022-10-27,,"This work wonders, I’m so glad I was able to try this product. You get sleepy in less then 20 minutes and get great night rest. I love it! ","{'neg': 0.0, 'neu': 0.658, 'pos': 0.342, 'compound': 0.9254}",0.9254,pos
83,83,114587,2023-05-28,Best tasting sleep gummy,Love the natural berry taste and chewy texture of this gummy. 2 gummies at 3 mg of melatonin give the perfect amount of sleep (6.5 hours for me) without drowsiness in the morning after you wake up. So far they have stood up well against HK’s tropical heat!,"{'neg': 0.0, 'neu': 0.767, 'pos': 0.233, 'compound': 0.9151}",0.9151,pos
84,84,114587,2023-08-13,,good asleep candy before bed time feel fall asleep before time bed 60 gummy,"{'neg': 0.0, 'neu': 0.818, 'pos': 0.182, 'compound': 0.4404}",0.4404,pos
85,85,114587,2023-05-22,Tastes great and works well! ,Surprisingly these taste great! I normally take melatonin but have switched over to these and they work well! Highly recommend! ,"{'neg': 0.0, 'neu': 0.569, 'pos': 0.431, 'compound': 0.8851}",0.8851,pos
86,86,114587,2023-05-16,,I love the sleep product made with all natural ingredients. It’s great quality and really has benefited my sleep. ,"{'neg': 0.0, 'neu': 0.581, 'pos': 0.419, 'compound': 0.8957}",0.8957,pos
87,87,114587,2023-04-24,,Great tasting gummies! We love this brand and love yet another great product!,"{'neg': 0.0, 'neu': 0.344, 'pos': 0.656, 'compound': 0.9595}",0.9595,pos
88,88,114587,2022-09-27,Best sleep!!,"I have always had trouble falling asleep. But I do have to admit, these made it so much easier. I didn’t even wake up all throughout the night like I normally do!!! The taste isn’t bad at all. And it worked fairly quickly. They aren’t hard like most gummy sleep aids are. And you get quite a good amount for your buck. I highly recommend!!!!","{'neg': 0.122, 'neu': 0.643, 'pos': 0.235, 'compound': 0.8951}",0.8951,pos
89,89,114587,2022-09-26,Easy to consume and works ,"I like that this one is made of gummy form, taste is good and easy to consume. I’m taking this 30mins before bed and this gave me a restful night without feeling groggy the next day unlike the other brand that I’ve had.
Quality is good plus I love the natural ingredients.","{'neg': 0.022, 'neu': 0.653, 'pos': 0.325, 'compound': 0.9586}",0.9586,pos
90,90,114587,2022-09-24,Effective and easy to take,"I have always had trouble with falling asleep and staying asleep, and this supplement helps me to wake up less during the night, and go back to sleep easily, if I do.  Love that they contain Chamomile and Lavender, and I also like the taste.  It’s texture is just right, as they are not to hard to chew and digest. Recommend it!","{'neg': 0.06, 'neu': 0.717, 'pos': 0.222, 'compound': 0.8882}",0.8882,pos
91,91,114587,2022-09-19,Great sleep aid!,I’ve been waiting months on my cpap and my sleep has been horrible 😭. I usually can fall asleep easily but wake up several times during the night. These gummies have been a lifesaver. Im finally able to stay asleep all night and I love that I don’t wake up feeling groggy. Def going to make sure I keep these stocked all the time. ,"{'neg': 0.031, 'neu': 0.73, 'pos': 0.24, 'compound': 0.9446}",0.9446,pos
92,92,114587,2022-09-06,Must buy!!!,"I can't even begin to say how grateful I am for these gummies. I am a full-time SAHM...so as you can imagine, sleep has been a myth!!! But HEAR ME WHEN I SAY, these gummies are life changing!!! THEY WORK!! For myself, my toddlers and my husband. 10 stars from me! ","{'neg': 0.0, 'neu': 0.933, 'pos': 0.067, 'compound': 0.4885}",0.4885,pos
93,93,114587,2022-08-30,He likes it,The quality of this gummies is very excellent I bought this for my father in law who has trouble in sleeping at night and he said from now on he won’t be sleeping wo it and I love also the ingredient and his dosage he take two gummies every night ,"{'neg': 0.048, 'neu': 0.805, 'pos': 0.147, 'compound': 0.7574}",0.7574,pos
94,94,114587,2022-08-30,the product that every mom needs,"i was refusing to take something to help me sleep, and when i finally gave up and try this gummies they were magic, didn't make feel bad at all, didnt keep me sleepy the next day. they were perfect, i was able to sleep and rest the whole night.","{'neg': 0.05, 'neu': 0.778, 'pos': 0.171, 'compound': 0.7615}",0.7615,pos
95,95,114587,2022-10-12,,I love this product. it has good quality and the dosage is enough for me to sleep well. the taste is super good too. I love that the product it is not just melatonin there is a lot of other good stuff in this package.,"{'neg': 0.0, 'neu': 0.602, 'pos': 0.398, 'compound': 0.9723}",0.9723,pos
96,96,114587,2022-10-11,,I love these sleep gummies! I have trouble falling asleep at night and these gummies help me sleep all night. I get really excited about taking my sleep gummies at night to help me sleep because they taste amazing! Lol ,"{'neg': 0.081, 'neu': 0.549, 'pos': 0.369, 'compound': 0.9449}",0.9449,pos
97,97,114587,2022-10-11,Good product with room for improvement ,"It was tough to wake up with two gummies but when I reduced the dosage to two intermittently on different days, i had a better experience. 

I like the flavor but wish they would drop the high fructose corn syrup and use honey or natural fruit sugars","{'neg': 0.071, 'neu': 0.675, 'pos': 0.254, 'compound': 0.9001}",0.9001,pos
98,98,114587,2022-10-03,,I love this melatonin it helps me to fall asleep fast and give me relax and wake up fresh and rest well. The ingredient are good for vegan and the quality is good! Taste so good and have alot of benefits ,"{'neg': 0.0, 'neu': 0.547, 'pos': 0.453, 'compound': 0.9741}",0.9741,pos
99,99,114587,2022-09-26,,This is a great sleep time funny. Helps me get some sleep on the nights I can’t shut off my brain. They have a great taste and great ingredients. ,"{'neg': 0.0, 'neu': 0.541, 'pos': 0.459, 'compound': 0.9571}",0.9571,pos
100,100,114587,2022-09-24,,works perfectly and taste great too! this was a gift and I'm glad that I received it. I think the difference in shapes of the nutrachamps products is really fun too!,"{'neg': 0.0, 'neu': 0.556, 'pos': 0.444, 'compound': 0.9606}",0.9606,pos
101,101,114587,2022-09-20,Awesome melatonin supplement!,"I love it, it has a nice quality and good ingredients. It is vegan with natural flavoring. It taste really good, just like a candy treat and it really helped me and my husband sleep earlier than usual and have more energy the next day. It is awesome.","{'neg': 0.0, 'neu': 0.569, 'pos': 0.431, 'compound': 0.9782}",0.9782,pos
102,102,114587,2022-09-18,Just what I need to help me sleep,I really like these because they are gummies so they are fast acting and they taste good!!  Plus it is a natural sleep aid no drugs and non habit forming.,"{'neg': 0.063, 'neu': 0.686, 'pos': 0.251, 'compound': 0.7634}",0.7634,pos
103,103,114587,2022-09-01,work very well,"high quality product , boost your relaxation with a g yummy gummies   the dosage of ingredients are just right , no headache the day after , and you feel sleepy right after 'benefit' , the size is very convenient  and it taste so good .I recommend it ","{'neg': 0.041, 'neu': 0.658, 'pos': 0.301, 'compound': 0.9301}",0.9301,pos
104,104,114587,2022-08-31,Sleepy sleepy ,Quality is impressive. It's a berry medley flavor and the gummy tastes great. It has been a benefit to me on nights I can't sleep. The gummies have helped give me a better nights sleep. ,"{'neg': 0.0, 'neu': 0.67, 'pos': 0.33, 'compound': 0.9231}",0.9231,pos
105,105,114587,2022-08-23,,"I really like this. It’s veré effective, I just love the quality of sleep I get by taking them when I can’t sleep. ","{'neg': 0.0, 'neu': 0.613, 'pos': 0.387, 'compound': 0.8777}",0.8777,pos
106,106,114587,2023-08-18,Tastes good but not effective,These gummies are yummy but 2 each night seems to not have much effect on my sleep. I haven't try upping the dosage though.,"{'neg': 0.0, 'neu': 0.905, 'pos': 0.095, 'compound': 0.296}",0.296,pos
107,107,114587,2022-10-05,Works great! ,"I bought these to help my husband sleep.. he wakes up frequently in the middle of the night but lately he’s been sleeping all the way through so I think it’s safe to say these have been working. So far so good! He says they taste pretty good and although the dosage calls for 2 gummies, at times he eat 3 or more (he’s a pretty big guy) so whatever works for him so long as he’s getting his rest! 😄","{'neg': 0.0, 'neu': 0.723, 'pos': 0.277, 'compound': 0.9826}",0.9826,pos
108,108,114587,2022-09-30,,"Took a few tries to really see the difference in my sons sleep. However, in the occasional times we use it, it’s done a great job! He goes to sleep within 15min! I do wish that the dosage would be 1mg per star though instead of 1.5! Overall- little man LOVES his “stars” toddler approved. ","{'neg': 0.0, 'neu': 0.766, 'pos': 0.234, 'compound': 0.9396}",0.9396,pos
109,109,114587,2022-08-19,Pretty effective,I'm actually quite shocked at how well these work and they taste pretty good. My child look forward to taking these every night and so do I. We fall asleep in no time!,"{'neg': 0.116, 'neu': 0.678, 'pos': 0.206, 'compound': 0.5717}",0.5717,pos
110,110,114587,2023-08-04,,"I was sceptical about this at the beginning, but the effect of this turn out great","{'neg': 0.079, 'neu': 0.642, 'pos': 0.279, 'compound': 0.7227}",0.7227,pos
111,111,114587,2023-07-12,Прекрасно!,"Excellent additive, liked the quality, liked the price and packaging, I advise you to buy!)","{'neg': 0.0, 'neu': 0.534, 'pos': 0.466, 'compound': 0.8622}",0.8622,pos
112,112,114587,2023-05-19,,"These gummies taste so good and work well to help me fall asleep and stay asleep, but not wake up groggy.   ","{'neg': 0.0, 'neu': 0.757, 'pos': 0.243, 'compound': 0.5818}",0.5818,pos
113,113,114587,2023-05-16,,Great quality sleep gummies. They work great. I also like how it's a no-habit forming sleep aid and a vegan product. ,"{'neg': 0.0, 'neu': 0.584, 'pos': 0.416, 'compound': 0.8934}",0.8934,pos
114,114,114587,2023-05-12,,"Great product! In love with nutrachamps gummies, all taste delicious!!! ","{'neg': 0.0, 'neu': 0.347, 'pos': 0.653, 'compound': 0.9345}",0.9345,pos
115,115,114587,2023-03-19,,my kids love these as well as I do they taste great and keep you asleep,"{'neg': 0.0, 'neu': 0.536, 'pos': 0.464, 'compound': 0.886}",0.886,pos
116,116,114587,2023-03-10,,"Very efficient! Taste is great! Sleep comes quite quickly, Very satisfied!","{'neg': 0.0, 'neu': 0.412, 'pos': 0.588, 'compound': 0.9086}",0.9086,pos
117,117,114587,2023-02-25,,"Nice taste and helps sleeping, good quality used it for 1 week ","{'neg': 0.0, 'neu': 0.491, 'pos': 0.509, 'compound': 0.8074}",0.8074,pos
118,118,114587,2023-02-20,One of the best natural sleeping aids in gummy form,"Great tasting gummies, pleasant sleep, not too groggy in the morning.","{'neg': 0.0, 'neu': 0.549, 'pos': 0.451, 'compound': 0.8126}",0.8126,pos
119,119,114587,2023-02-19,,"Effective , taste is good and I like that’s it’s vegan . ","{'neg': 0.0, 'neu': 0.414, 'pos': 0.586, 'compound': 0.8176}",0.8176,pos
120,120,114587,2022-10-23,,"Amazing quality! better than all the other melatonin gummies i had before, i definitely recommend!","{'neg': 0.0, 'neu': 0.419, 'pos': 0.581, 'compound': 0.9097}",0.9097,pos
121,121,114587,2022-10-21,,This is natural and beneficial for good sleep ..check the allergic components before taking this ..it works for me ..,"{'neg': 0.083, 'neu': 0.604, 'pos': 0.313, 'compound': 0.7269}",0.7269,pos
122,122,114587,2024-06-12,Didn’t really did it for me,I didn’t feel like the gummy made me sleep better. Has a nice taste though. ,"{'neg': 0.0, 'neu': 0.549, 'pos': 0.451, 'compound': 0.802}",0.802,pos
123,123,114587,2022-10-13,,"Love this sleep gel it helps me sleep and I did sleep well too , been looking for sleeping gel so long I’m glad I found this one . ","{'neg': 0.0, 'neu': 0.633, 'pos': 0.367, 'compound': 0.9035}",0.9035,pos
124,124,114587,2022-10-07,Help me sleep much better!!!,"These gummies have changed my life! I am not a fan of regular melatonin, but these gummies are much tastier and help me get a refreshed sleep!! Love it!!","{'neg': 0.042, 'neu': 0.657, 'pos': 0.301, 'compound': 0.9009}",0.9009,pos
125,125,114587,2022-10-04,,Loved these they work amazing ! Within a few minutes you are able to have a great nights rest and no side affects 10/10 recommend ! ,"{'neg': 0.065, 'neu': 0.499, 'pos': 0.437, 'compound': 0.9285}",0.9285,pos
126,126,114587,2022-10-03,A must buy!,"These gummies are by far my favorite. They help me sleep better at night and relax my mind. They come in the cutest star form, and I love the flavor and texture.","{'neg': 0.0, 'neu': 0.562, 'pos': 0.438, 'compound': 0.9612}",0.9612,pos
127,127,114587,2022-10-01,Instant sleep. ,These actually work. Put me right to sleep with out the next day grogginess. They taste great. Ingredients are quality. Good value for the price. ,"{'neg': 0.0, 'neu': 0.701, 'pos': 0.299, 'compound': 0.8555}",0.8555,pos
128,128,114587,2022-09-27,Works! ,"Purchased these to help myself & my husband to sleep. We have issues waking through out the night & not staying asleep but these bunnies definitely did the trick & had me sleeping through the night.
","{'neg': 0.035, 'neu': 0.817, 'pos': 0.147, 'compound': 0.6249}",0.6249,pos
129,129,114587,2022-09-20,Just reordered! Love these!,"Taste great and do what they need to do. Usually I take 2 gummies about 30 minutes before bed and stay asleep all night. Also vegan, for anyone who likes to avoid gelatin. ","{'neg': 0.059, 'neu': 0.755, 'pos': 0.186, 'compound': 0.6908}",0.6908,pos
130,130,114587,2022-09-15,Works perfect!,Tastes yummy and love that its vegan. Is good for kids over 2 so I gave to my kids before bed to get them on a routine for school. Worked perfectly! Cute packaging too.,"{'neg': 0.0, 'neu': 0.591, 'pos': 0.409, 'compound': 0.9583}",0.9583,pos
131,131,114587,2022-09-14,Best melatonin ever!!,"I will purchase theses gummies, great item, best taste and I love that they are shaped like stars ⭐️  They work great and are definitely a quality item. ","{'neg': 0.0, 'neu': 0.466, 'pos': 0.534, 'compound': 0.9712}",0.9712,pos
132,132,114587,2022-09-07,,"These gummies are delicious and perfect for those nights where sleep is missing. They are the perfect size and taste delicious, with the added benefit of a great nights sleep. The quality of these gummmies is top notch and I love that they are vegan ingredients. ","{'neg': 0.034, 'neu': 0.538, 'pos': 0.429, 'compound': 0.9792}",0.9792,pos
133,133,114587,2022-09-01,,My daughter and I love these gummies they are very yummy and we look forward to eating them every night before bed! We highly recommend the vegan gummies ,"{'neg': 0.0, 'neu': 0.686, 'pos': 0.314, 'compound': 0.8996}",0.8996,pos
134,134,114587,2022-08-31,Great nights sleep!,I've been using this product for a week now and am feeling energized in the morning after a great night's sleep. I appreciate the herb blend as an adjuvant to the melatonin. Overall impressed with this company and their products!,"{'neg': 0.0, 'neu': 0.681, 'pos': 0.319, 'compound': 0.9324}",0.9324,pos
135,135,114587,2022-08-29,,These are great! They help you get to sleep but don’t leave you groggy or gross feeling. The taste is great and they’re perfect for the whole family! ,"{'neg': 0.124, 'neu': 0.479, 'pos': 0.397, 'compound': 0.9183}",0.9183,pos
136,136,114587,2023-10-17,حللللوه,"Quality good ingredient 
Size good dosage very will 
Benefits great taste good ","{'neg': 0.0, 'neu': 0.305, 'pos': 0.695, 'compound': 0.9427}",0.9427,pos
137,137,114587,2023-07-25,,"These taste great & seem to be effective as a gentle sleep aid.
Parcel arrived quickly.","{'neg': 0.0, 'neu': 0.521, 'pos': 0.479, 'compound': 0.8779}",0.8779,pos
138,138,114587,2022-09-29,¡Excelente!,Great natural product ! Help me a lot 🙌 100 % recommended. Me encanto!,"{'neg': 0.0, 'neu': 0.339, 'pos': 0.661, 'compound': 0.893}",0.893,pos
139,139,114587,2022-08-28,,"I enjoyed the flavor and texture of these. Effective, as I felt naturally rested during the night. ","{'neg': 0.0, 'neu': 0.67, 'pos': 0.33, 'compound': 0.7506}",0.7506,pos
140,140,114587,2023-07-29,,"I believe it is a good product if you're not experiencing chronic sleep deprivation as I am, so I need something stronger ","{'neg': 0.119, 'neu': 0.637, 'pos': 0.245, 'compound': 0.4522}",0.4522,pos
141,141,114587,2022-10-17,,"Love these gummies, I can sleep for 10 hours straight, like a baby , I wake up super energetic and they taste amazing ","{'neg': 0.0, 'neu': 0.404, 'pos': 0.596, 'compound': 0.9595}",0.9595,pos
142,142,114587,2022-10-17,,These help me sleep so good at night! Love them!!,"{'neg': 0.0, 'neu': 0.378, 'pos': 0.622, 'compound': 0.9103}",0.9103,pos
143,143,114587,2022-10-04,,I love that these come in gummy form. These really help to relax you before bed. They also taste great as well.,"{'neg': 0.0, 'neu': 0.491, 'pos': 0.509, 'compound': 0.9482}",0.9482,pos
144,144,114587,2022-10-03,,These gummies put me to sleep fast they work so good i get so much more rest also they have a great taste ,"{'neg': 0.0, 'neu': 0.708, 'pos': 0.292, 'compound': 0.8334}",0.8334,pos
145,145,114587,2022-09-23,,So excited I got these because I’ve been having trouble sleeping so this is perfect! It taste great which is also a plus!! ,"{'neg': 0.086, 'neu': 0.543, 'pos': 0.371, 'compound': 0.873}",0.873,pos
146,146,114587,2022-09-20,,Love this blend of ingredients for relaxation and good sleep !highly recommend,"{'neg': 0.0, 'neu': 0.371, 'pos': 0.629, 'compound': 0.9272}",0.9272,pos
147,147,114587,2022-09-19,,So good for getting me to calm down at the end of the day. I use them when I have trouble relaxing. ,"{'neg': 0.099, 'neu': 0.584, 'pos': 0.317, 'compound': 0.7178}",0.7178,pos
148,148,114587,2022-09-16,Excellent sleep product! Amazing taste,Absolutely love this melatonin sleep product. Tastes so good- made with various herbs like passionflower! Love the cute star shapes :),"{'neg': 0.0, 'neu': 0.383, 'pos': 0.617, 'compound': 0.9703}",0.9703,pos
149,149,114587,2022-09-15,,These are a great addition to my daily vitamins and needing some extra sleep! And they taste great. ,"{'neg': 0.0, 'neu': 0.639, 'pos': 0.361, 'compound': 0.8588}",0.8588,pos
150,150,114587,2022-09-14,,These work well and taste great! The ingredients are natural and I like taking them.,"{'neg': 0.0, 'neu': 0.465, 'pos': 0.535, 'compound': 0.8883}",0.8883,pos
151,151,114587,2022-09-09,,this one really help my sleep quality and engredient is all vegan. highly recommended and the benefits was good too..thanks to this product ,"{'neg': 0.0, 'neu': 0.642, 'pos': 0.358, 'compound': 0.862}",0.862,pos
152,152,114587,2022-08-29,,"Perfect for those sleepless nights, just take 1 to 2 gummies and you are ready for a good night sleep !","{'neg': 0.0, 'neu': 0.598, 'pos': 0.402, 'compound': 0.8553}",0.8553,pos
153,153,114587,2022-08-28,,"I love the taste of these gummies!! They work so well too, fell asleep much faster.","{'neg': 0.0, 'neu': 0.633, 'pos': 0.367, 'compound': 0.8189}",0.8189,pos
154,154,114587,2022-08-25,Gentle and tasty ,These gummies are great taken about 30 minutes before going to sleep. They helped me doze off naturally and have a great flowery flavor.,"{'neg': 0.0, 'neu': 0.719, 'pos': 0.281, 'compound': 0.8481}",0.8481,pos
155,155,114587,2022-10-03,,"The packaging is great, taste is a bit weird, the quality is good and worthy of money. ","{'neg': 0.072, 'neu': 0.508, 'pos': 0.419, 'compound': 0.8481}",0.8481,pos
156,156,114587,2022-08-31,,I sleep like a baby. I love these gummies.,"{'neg': 0.0, 'neu': 0.374, 'pos': 0.626, 'compound': 0.7717}",0.7717,pos
157,157,114587,2024-01-11,,"I ordered it for my husband to improve sleep. He has a problem falling asleep at night, tossing and turning for a long time and cannot stop thinking about everything. With these chewing gum, he sleeps perfectly, says that the sleep is calm and deep, in the morning he feels rested, he has no problems with morning drowsiness. Pleasant berry taste. Advantage in composition and price, good quality. Its dose is 2 chews at bedtime. I will order again.","{'neg': 0.1, 'neu': 0.687, 'pos': 0.213, 'compound': 0.8831}",0.8831,pos
158,158,114587,2023-11-12,taste good,"It is no different from ordinary gummy candies. It is edible for vegetarians, so I chose to try it. It tastes very good and has a very citron flavor. I feel relaxed after eating it. It is a supplement. I sleep well after eating it and do not wake up in the middle. But it cannot be used for a long time. Eating, if you have to switch to eating during work, it will be helpful.","{'neg': 0.021, 'neu': 0.855, 'pos': 0.124, 'compound': 0.7812}",0.7812,pos
159,159,114587,2024-10-18,Excellent!,"The quality, size, packaging, ingredients and required quantity are all excellent and enough for two people. It is used to help with sleep, relax the body and relieve psychological stress. ","{'neg': 0.071, 'neu': 0.631, 'pos': 0.298, 'compound': 0.8402}",0.8402,pos
160,160,114587,2024-07-12,Beautiful,"It is sweet, it improves sleep, but it differs from person to person. Its texture is like a jelly with a raspberry taste. I have had it for a while, but it is sweet","{'neg': 0.0, 'neu': 0.7, 'pos': 0.3, 'compound': 0.8793}",0.8793,pos
161,161,114587,2024-06-28,Aa,It is nice and makes you fall asleep quickly. Take it half an hour before bed. It is nice and I recommend it. Its size is suitable and very strong. It is nice. I advise you.,"{'neg': 0.0, 'neu': 0.667, 'pos': 0.333, 'compound': 0.9259}",0.9259,pos
162,162,114587,2024-06-04,good ,"I used it for a while, and its taste was acceptable, but I did not feel that it benefited me once. This is my experience with it ","{'neg': 0.0, 'neu': 0.933, 'pos': 0.067, 'compound': 0.1655}",0.1655,pos
