,Unnamed: 0,product_id,date_posted,review_title,review_text,scores,compound,sentiment
163,163,114587,2024-04-19,Great product at a fair price.,"Great quality, clearly broken down ingredients. Fair size, dosage and price. Pleasant taste. All advantages, no disadvantages. Very effective without any unpleasant side effects. Highly recommended.","{'neg': 0.174, 'neu': 0.327, 'pos': 0.499, 'compound': 0.9318}",0.9318,pos
164,164,114587,2024-02-07,I can sleep,"My sleep quality has improved. The first night I drank it, I was able to sleep without waking up for the first time in a while.","{'neg': 0.0, 'neu': 0.876, 'pos': 0.124, 'compound': 0.4767}",0.4767,pos
165,165,114587,2023-12-23,Prominent,"I have not tried it to be honest, but when it arrives and I see the result, I will inform you, God willing.. Like, no, I have many obligations, and my source of livelihood is herb.","{'neg': 0.07, 'neu': 0.674, 'pos': 0.256, 'compound': 0.7543}",0.7543,pos
166,166,114587,2023-12-11,Helps sleep,Sweets that help you sleep peacefully and make you feel energetic and sweet in the morning. Thank you for the wonderful products from IHOP. Please provide them again as soon as possible. ,"{'neg': 0.0, 'neu': 0.503, 'pos': 0.497, 'compound': 0.9709}",0.9709,pos
167,167,114587,2023-11-26,All,"The quantity is good, enough for a month, because two pills per day, but it does not bring sleep quickly. Otherwise, if your sleep is interrupted, it will not come back again, so the effect is a little mild.","{'neg': 0.07, 'neu': 0.881, 'pos': 0.049, 'compound': -0.2144}",-0.2144,neg
168,168,114587,2023-11-10,Very excellent for sleep,"The taste is wonderful and the quantity is excellent, especially for people who suffer from sleep problems and insomnia gives a feeling of relaxation and deep sleep. I highly recommend it.","{'neg': 0.143, 'neu': 0.508, 'pos': 0.349, 'compound': 0.8357}",0.8357,pos
169,169,114587,2024-06-12,,"I am a person who has a hard time falling asleep, but I feel that it helped me a little, not too much, but it did help. It came in a practical box that kept the candies excellent for multiple use. The taste was really nice. You don't feel that there is an addition to the candy. It's just delicious and the size is really enough for a long time.","{'neg': 0.032, 'neu': 0.737, 'pos': 0.23, 'compound': 0.9601}",0.9601,pos
170,170,114587,2023-12-05,It works but taste needs improvement,"I tried giving them to my children: the two older children take it with a bit of reluctance, while the little one really doesn't want to hear about it. The taste is not very pleasant (I tried it) and the consistency is also not like gummy bears but a little drier.","{'neg': 0.126, 'neu': 0.84, 'pos': 0.033, 'compound': -0.4146}",-0.4146,neg
171,171,114587,2024-08-26,good,"It will make it easier for me to fall asleep, but it does not work at the beginning. Taking it for two more days will have more effects!","{'neg': 0.0, 'neu': 0.925, 'pos': 0.075, 'compound': 0.2942}",0.2942,pos
172,172,114587,2023-11-29,,"Good composition, there is L-theanine, melatonin is not stated in the description, but the packaging states that it contains 3 mg in two jellies.","{'neg': 0.0, 'neu': 0.919, 'pos': 0.081, 'compound': 0.2382}",0.2382,pos
173,173,114587,2024-01-20,A good remedy for those who suffer from insomnia,"I order jellies for the second time. Nice taste, good dose of melatonin. After them you want to sleep.","{'neg': 0.0, 'neu': 0.682, 'pos': 0.318, 'compound': 0.7184}",0.7184,pos
174,174,114587,2023-04-07,,The ingredients of this product are excellent. I took it to my son. He has sleep disorders. I feel its effect is better than melatonin in his spirit.,"{'neg': 0.0, 'neu': 0.735, 'pos': 0.265, 'compound': 0.8074}",0.8074,pos
175,175,114587,2024-04-05,The dream will return ,We drink along with magnesium. I feel great and recommend it to you! Cool drug. Price and quality!,"{'neg': 0.0, 'neu': 0.596, 'pos': 0.404, 'compound': 0.8585}",0.8585,pos
176,176,114587,2024-09-06,Ok,"It tastes sweet and delicious, but for sleeping I don’t think it is strong. I noticed that it disrupts my dreams if I eat it.","{'neg': 0.0, 'neu': 0.593, 'pos': 0.407, 'compound': 0.9072}",0.9072,pos
177,177,114587,2023-10-13,Regular user,"Excellent quality! The taste is delicious, just like candy. The size is a little small. I would be happy if there were more according to the packaging. The dosage is 2 units each time. The advantages are that it puts you to sleep really quickly and helps you sleep well.","{'neg': 0.0, 'neu': 0.652, 'pos': 0.348, 'compound': 0.9655}",0.9655,pos
178,178,114587,2023-09-05,,"Very soft and pleasant. I want to normalize my sleep schedule and go to bed earlier, and these stars help me. The ingredients are good, quite natural. The taste is pleasant, they smell of indefinite berries. The dosage is suitable for an adult. I think you can start with one pad, and add a second one if the effect seems weak. It should be remembered that melatonin is a natural remedy, but doctors do not recommend taking it for more than 2 months in a row, so that the body does not forget how to produce it on its own. So in a long reception, you will have to divide the breaks. I recommend to buy!","{'neg': 0.061, 'neu': 0.809, 'pos': 0.13, 'compound': 0.6506}",0.6506,pos
179,179,114587,2024-10-19,,Quality product. Convenient size. Suitable and useful for any age.,"{'neg': 0.0, 'neu': 0.756, 'pos': 0.244, 'compound': 0.4404}",0.4404,pos
180,180,114587,2024-05-02,Great sleep,"Chewable tablets with a slightly sweet taste. Excellent help with falling asleep, sleep without interruption","{'neg': 0.074, 'neu': 0.418, 'pos': 0.508, 'compound': 0.8539}",0.8539,pos
181,181,114587,2024-02-26,,Wonderful I will order more Wonderful I will order more Wonderful I will order more,"{'neg': 0.0, 'neu': 0.448, 'pos': 0.552, 'compound': 0.9022}",0.9022,pos
182,182,114587,2024-01-20,,High quality and effective product. Natural ingredients suitable for any age. I recommend for shopping.,"{'neg': 0.0, 'neu': 0.576, 'pos': 0.424, 'compound': 0.7964}",0.7964,pos
183,183,114587,2023-12-03,,You can fall asleep quickly after eating it and it tastes very good👍,"{'neg': 0.0, 'neu': 1.0, 'pos': 0.0, 'compound': 0.0}",0.0,neu
184,184,114587,2023-11-08,Great,"The quality of the ingredients, the health and the composition of the packaging suited me! I also liked the taste","{'neg': 0.0, 'neu': 0.853, 'pos': 0.147, 'compound': 0.4753}",0.4753,pos
185,185,114587,2023-10-25,,"One time, the taste is amazing. I recommend it, the quantity is large, and the taste of berries is amazing","{'neg': 0.0, 'neu': 0.613, 'pos': 0.387, 'compound': 0.8779}",0.8779,pos
186,186,114587,2023-06-10,,"It is easy to eat with a gummy that tastes like blueberries. I wear a smartwatch to collect sleep quality data every day, and on the third day after starting to take the supplement, I saw an improvement in quality. I would like to continue this way.","{'neg': 0.0, 'neu': 0.777, 'pos': 0.223, 'compound': 0.872}",0.872,pos
187,187,114587,2023-02-16,,"I just received the product yesterday. I have endless insomnia. And you know, miracles happen, I didn’t even notice how I fell asleep. delicious stars.","{'neg': 0.0, 'neu': 0.844, 'pos': 0.156, 'compound': 0.5719}",0.5719,pos
188,188,114587,2022-11-24,,"I made it small and let my child drink a little. It helped me fall asleep and helped me live a regular life. It was great for me to fall asleep. However, it was not 100 points for sound sleep. After all, I woke up and was sound until morning! I didn't go. However, since it is a product with a sense of security, I thought that I would like to repeat it again.","{'neg': 0.0, 'neu': 0.87, 'pos': 0.13, 'compound': 0.8516}",0.8516,pos
189,189,114587,2023-11-08,Average taste,"The taste is average, but the effect is not bad. I should switch to other flavors.","{'neg': 0.0, 'neu': 0.788, 'pos': 0.212, 'compound': 0.5824}",0.5824,pos
190,190,114587,2023-09-23,Lalnaum - Lalkabar,"The idea is that the body contains a hormone or substance called melatonin, which is responsible for sleep and the quality of sleep. Sometimes, due to depression, anxiety, stress, or other things, the body gets tired and the body secretes this substance in a small amount, so the person does not sleep. This product consists of melatonin and herbs that help with sleep, so you can take Take two pills to increase the secretion of the substance and give you sleep and make your sleep quality good. This is not a sedative and does not cause addiction, but take it only when necessary so that your body does not depend on it. Give it six out of ten.","{'neg': 0.062, 'neu': 0.88, 'pos': 0.058, 'compound': -0.1154}",-0.1154,neg
191,191,114587,2023-09-14,sleep naturally,"I fell asleep naturally after an hour, and I feel like my sleep habits have gotten better. The taste is also delicious. The only thing that bothers me is that if I don't brush my teeth again before going to bed, I'll probably get cavities.","{'neg': 0.037, 'neu': 0.777, 'pos': 0.186, 'compound': 0.8074}",0.8074,pos
192,192,114587,2023-08-24,,"The smell is good, the use is great, the quality is good, the size is good, the quality is very excellent, it is worth using, and its effect is very strong. The ingredients are good. Magnesium is excellent. The quantity is large. The benefit is good.","{'neg': 0.0, 'neu': 0.499, 'pos': 0.501, 'compound': 0.9873}",0.9873,pos
193,193,114587,2023-05-28,Excellent!,"The product is delicious, its size is good, and it is more than excellent. After chewing two pills for about 20 minutes, I go into a comfortable sleep and wake up comfortably as well.","{'neg': 0.0, 'neu': 0.581, 'pos': 0.419, 'compound': 0.957}",0.957,pos
194,194,114587,2023-03-05,,"I used to sleep lightly, but since I started using this, I've been able to get good quality sleep. It is non-toxic and safe to take.","{'neg': 0.0, 'neu': 0.741, 'pos': 0.259, 'compound': 0.8271}",0.8271,pos
195,195,114587,2024-10-12,"Ok, but I won't ask for it again ","I did not feel any results and I took it because my sleep is interrupted, but I did not see any results.","{'neg': 0.082, 'neu': 0.918, 'pos': 0.0, 'compound': -0.1531}",-0.1531,neg
196,196,114587,2024-09-11,,Aroma Quality Ingredients Taste Flavour Usage Size Package Benefit Composition Description Diet Serving Age Very pleasant feeling ✅✅,"{'neg': 0.0, 'neu': 0.642, 'pos': 0.358, 'compound': 0.8111}",0.8111,pos
197,197,114587,2023-12-15,I didn't feel any difference!!,"I tried it for a while and did not feel any results. Maybe if I continue, the situation will change, I don’t know!!","{'neg': 0.0, 'neu': 1.0, 'pos': 0.0, 'compound': 0.0}",0.0,neu
198,198,114587,2022-10-07,,"Quality is good Ingredients shouldn't be too bad Size is good but could last 2 months minimum. The dose is 2 slugs but they are easy to ingest Benefits is for sleeping, let's see if I can sleep well and get rid of tiredness. Taste is a little sweet…but, not horrible…","{'neg': 0.0, 'neu': 0.723, 'pos': 0.277, 'compound': 0.929}",0.929,pos
199,199,114587,2023-03-23,,Melatonin is something you can't do without because you're a light sleeper. This is a package purchase. Because it's better to be a little cute. I hope I can fall asleep.,"{'neg': 0.0, 'neu': 0.737, 'pos': 0.263, 'compound': 0.8036}",0.8036,pos
200,200,114587,2024-07-10,,"Very good, it always works! Recommend it🤍","{'neg': 0.0, 'neu': 0.455, 'pos': 0.545, 'compound': 0.7171}",0.7171,pos
201,201,114587,2023-09-01,,"A natural chewing gum made from soothing herbs that helps to fall asleep faster, longer and deeper","{'neg': 0.0, 'neu': 0.637, 'pos': 0.363, 'compound': 0.7506}",0.7506,pos
202,202,114587,2023-04-07,,A very wonderful and effective product that is the savior if you mess up sleep,"{'neg': 0.12, 'neu': 0.527, 'pos': 0.353, 'compound': 0.7056}",0.7056,pos
203,203,114587,2022-09-10,,Pleasant-tasting marmalades really have the effect declared by the manufacturer. Helps to fall asleep gently in half an hour after taking and have a good night's sleep,"{'neg': 0.0, 'neu': 0.73, 'pos': 0.27, 'compound': 0.8176}",0.8176,pos
204,204,114587,2023-10-14,,These gummies have excellent composition and give very good results.,"{'neg': 0.0, 'neu': 0.537, 'pos': 0.463, 'compound': 0.7841}",0.7841,pos
205,205,114587,2023-10-13,,Quality goods. Natural ingredients. Suitable for any age. Arrived quickly.,"{'neg': 0.0, 'neu': 0.783, 'pos': 0.217, 'compound': 0.3612}",0.3612,pos
206,206,114587,2023-09-10,excellent,"Great product, really helps, excellent ingredient, good dose, very pleasant taste, going to order again in the next order","{'neg': 0.0, 'neu': 0.445, 'pos': 0.555, 'compound': 0.955}",0.955,pos
207,207,114587,2023-08-22,,"One of the best I've tried, excellent, excellent, excellent, sleeps deeply, improves sleep quality, and wakes up while you're relaxed","{'neg': 0.0, 'neu': 0.393, 'pos': 0.607, 'compound': 0.9705}",0.9705,pos
208,208,114587,2023-08-19,,"Excellent quality, natural ingredient, pleasant taste. The size is great. Active Dose as directed.","{'neg': 0.0, 'neu': 0.356, 'pos': 0.644, 'compound': 0.946}",0.946,pos
209,209,114587,2023-07-23,excellent! and amazing,"An excellent product that helps you fall asleep at night, relieves tension and stress, and has a wonderful, non-addictive taste","{'neg': 0.167, 'neu': 0.425, 'pos': 0.408, 'compound': 0.8126}",0.8126,pos
210,210,114587,2023-07-10,Excellent!,Excellent product! Fully complies with the described criteria and qualities indicated on the label!,"{'neg': 0.0, 'neu': 0.752, 'pos': 0.248, 'compound': 0.6467}",0.6467,pos
211,211,114587,2023-06-11,OK,"Benefits: After eating, it improves insomnia and can be trained patiently","{'neg': 0.0, 'neu': 0.625, 'pos': 0.375, 'compound': 0.6597}",0.6597,pos
212,212,114587,2023-06-01,,"I bought my mother instead of sleeping pills that she used to take on a daily basis. Excellent taste, helps sleep. Really recommended","{'neg': 0.0, 'neu': 0.682, 'pos': 0.318, 'compound': 0.8122}",0.8122,pos
213,213,114587,2023-05-16,,"This product was recommended by a friend, and it worked well after trying it, and I will continue to buy it in the future!","{'neg': 0.0, 'neu': 0.72, 'pos': 0.28, 'compound': 0.75}",0.75,pos
214,214,114587,2023-03-21,"Excellent, by God, for me, I took it from here for half an hour while I was asleep, praise be to God","Excellent, by God, for me, I took it from here for half an hour while I was asleep, praise be to God","{'neg': 0.0, 'neu': 0.582, 'pos': 0.418, 'compound': 0.8885}",0.8885,pos
215,215,114587,2023-03-15,,My husband suffers a lot from insomnia I bought him to try and he says it works very well,"{'neg': 0.151, 'neu': 0.732, 'pos': 0.117, 'compound': -0.1796}",-0.1796,neg
216,216,114587,2023-09-15,,"A little too sweet taste, portion size - 2 pieces, relatively with a lot of sugar, dosage - suitable for inducing sleep","{'neg': 0.0, 'neu': 0.855, 'pos': 0.145, 'compound': 0.4062}",0.4062,pos
217,217,114587,2023-07-11,Below average,"Its taste is sweet, but its effect is very light. It means that if you are drowsy, it will make you sleepy, but if there is no sleep, it will not bring it.","{'neg': 0.078, 'neu': 0.866, 'pos': 0.056, 'compound': -0.2023}",-0.2023,neg
218,218,114587,2023-04-01,,It is really sweet for those who have insomnia and their sleep is intermittent.,"{'neg': 0.0, 'neu': 0.798, 'pos': 0.202, 'compound': 0.5095}",0.5095,pos
219,219,114587,2022-10-05,Good,"Excellent, useful, helps sleep, comfortable to use, and the company is great","{'neg': 0.0, 'neu': 0.297, 'pos': 0.703, 'compound': 0.9485}",0.9485,pos
220,220,114587,2023-10-14,assistant,"As someone who takes a long time to sleep, this product helped me, but at this price there are better products","{'neg': 0.0, 'neu': 0.832, 'pos': 0.168, 'compound': 0.5927}",0.5927,pos
221,221,114587,2023-05-19,,"Good, the use tastes delicious and sleeps, but you have to be in the bed directly after taking it","{'neg': 0.0, 'neu': 0.798, 'pos': 0.202, 'compound': 0.5106}",0.5106,pos
222,222,114587,2023-05-13,,good taste. I don't know how much it helped me personally.,"{'neg': 0.0, 'neu': 0.756, 'pos': 0.244, 'compound': 0.4404}",0.4404,pos
223,223,114587,2022-12-20,,"Good in terms of ingredients, the quantity is appropriate, and the package is well closed. I hope to get the desired benefit, thank you","{'neg': 0.0, 'neu': 0.523, 'pos': 0.477, 'compound': 0.926}",0.926,pos
224,224,114587,2023-08-21,Below average,It is not clear how the effect after 3 days of chewing the gum currently did not help sleep,"{'neg': 0.217, 'neu': 0.783, 'pos': 0.0, 'compound': -0.5334}",-0.5334,neg
225,225,114587,2022-09-20,,I can sleep surprisingly quickly.,"{'neg': 0.0, 'neu': 0.577, 'pos': 0.423, 'compound': 0.296}",0.296,pos
