,Unnamed: 0,product_id,date_posted,review_title,review_text,scores,compound,sentiment
91,91,115403,2023-04-18,,"The size is good and the quantity is very reasonable. A company that offers quality products, and I will update the evaluation as soon as the experiment is completed, God willing.","{'neg': 0.0, 'neu': 0.844, 'pos': 0.156, 'compound': 0.6124}",0.6124,pos
92,92,115403,2024-08-18,C ,"Very bad, it is useless and has no benefit. It causes me increased insomnia. I do not recommend buying it. I did not like it at all.","{'neg': 0.36, 'neu': 0.498, 'pos': 0.141, 'compound': -0.7853}",-0.7853,neg
93,93,115403,2024-06-09,,The product did not suit me. The smell was annoying and caused me stomach pain and diarrhea. I would like to return it immediately. Thank you,"{'neg': 0.188, 'neu': 0.656, 'pos': 0.156, 'compound': -0.25}",-0.25,neg
94,94,115403,2024-08-31,Well,"It helps you fall asleep, it's good, it brings back pastries ","{'neg': 0.0, 'neu': 0.621, 'pos': 0.379, 'compound': 0.6705}",0.6705,pos
95,95,115403,2024-06-09,I like the ingredients ,It has good ingredients but I honestly didn't feel like it helped me sleep better. ,"{'neg': 0.119, 'neu': 0.445, 'pos': 0.436, 'compound': 0.7984}",0.7984,pos
96,96,115403,2024-02-12,,"I try the product for the first time, and after completing the first package, I re-evaluate and update it","{'neg': 0.0, 'neu': 1.0, 'pos': 0.0, 'compound': 0.0}",0.0,neu
97,97,115403,2024-09-08,,"Quality, ingredients, taste, portion, dosage, everything is just right.","{'neg': 0.0, 'neu': 1.0, 'pos': 0.0, 'compound': 0.0}",0.0,neu
98,98,115403,2023-04-25,,"It is one of the best supplements, and I highly recommend it for honesty, so I have a lot to do","{'neg': 0.0, 'neu': 0.595, 'pos': 0.405, 'compound': 0.8805}",0.8805,pos
99,99,115403,2024-02-17,The smell is a bit unpleasant,"It smells bad, but it is effective.","{'neg': 0.197, 'neu': 0.439, 'pos': 0.364, 'compound': 0.4404}",0.4404,pos
100,100,115403,2023-09-25,,"It is nice for sleeping, but if you take it for a long time, it will make you sleep very well","{'neg': 0.0, 'neu': 0.783, 'pos': 0.217, 'compound': 0.611}",0.611,pos
101,101,115403,2023-08-03,,"A good box, a good storage, helps me sleep and wake up, but it does not solve depression problems for me. results","{'neg': 0.066, 'neu': 0.492, 'pos': 0.442, 'compound': 0.8656}",0.8656,pos
102,102,115403,2023-07-27,,I ordered the product because it is vegan! I hope Iharb only sells vegan products!,"{'neg': 0.0, 'neu': 0.775, 'pos': 0.225, 'compound': 0.5399}",0.5399,pos
103,103,115403,2023-05-30,I don't know where the 5mg of melatonin is.,The truth is that I bought it because it offered 5mg of melatonin and many other properties. But one of 3mg that they sell here in Chile is stronger than the 5mg. Probably the difference is that this one is in a capsule and the other one is a coated pill. To support therapy for sleep disorders or de-escalation of drugs such as Zolpidem I do not recommend it.,"{'neg': 0.037, 'neu': 0.844, 'pos': 0.119, 'compound': 0.7127}",0.7127,pos
104,104,115403,2023-05-12,,"There are all ingredients to help sleep, the price is reasonable, and you can take it for 2 months.","{'neg': 0.0, 'neu': 0.863, 'pos': 0.137, 'compound': 0.4019}",0.4019,pos
105,105,115403,2023-03-05,,"very good product, I recommend it to everyone, you won't regret it","{'neg': 0.0, 'neu': 0.491, 'pos': 0.509, 'compound': 0.8068}",0.8068,pos
106,106,115403,2022-11-16,,"A very effective drug for calming, relaxation, restful sleep. Many ingredients in the composition, excellent quality, neutral taste.","{'neg': 0.0, 'neu': 0.433, 'pos': 0.567, 'compound': 0.9402}",0.9402,pos
107,107,115403,2022-10-24,,"Compared with other brands, it is flat and easy to use, will repurchase","{'neg': 0.0, 'neu': 0.805, 'pos': 0.195, 'compound': 0.4404}",0.4404,pos
108,108,115403,2023-07-16,good,"The product will be used and re-evaluated later, God willing. Update: A good product, but sometimes it doesn't work for me.","{'neg': 0.0, 'neu': 0.837, 'pos': 0.163, 'compound': 0.3612}",0.3612,pos
109,109,115403,2023-02-16,have a certain sleeping effect,"Contains a small amount of black-fading ingredients, which is generally safe and healthy","{'neg': 0.0, 'neu': 0.641, 'pos': 0.359, 'compound': 0.6808}",0.6808,pos
110,110,115403,2022-10-15,,very good drug I advise everyone directly you will not regret it direct I advise everyone directly,"{'neg': 0.0, 'neu': 0.702, 'pos': 0.298, 'compound': 0.6731}",0.6731,pos
111,111,115403,2023-10-25,I had palpitations due to the side effects.,I didn't get any improvement,"{'neg': 0.453, 'neu': 0.547, 'pos': 0.0, 'compound': -0.357}",-0.357,neg
112,112,115403,2023-05-20,under trial,Still under trial Still under trial Still under trial Still under trial,"{'neg': 0.0, 'neu': 1.0, 'pos': 0.0, 'compound': 0.0}",0.0,neu
113,113,115403,2023-08-01,,"Good product, you can eat, the effect is there","{'neg': 0.0, 'neu': 0.734, 'pos': 0.266, 'compound': 0.4404}",0.4404,pos
114,114,115403,2023-09-03,,"This product is not good, and I regretted that I bought it, as it is below average and did not help me sleep","{'neg': 0.188, 'neu': 0.724, 'pos': 0.088, 'compound': -0.357}",-0.357,neg
115,115,115403,2022-11-28,,I didn't like the smell,"{'neg': 0.413, 'neu': 0.587, 'pos': 0.0, 'compound': -0.2755}",-0.2755,neg
