,product_id,date_posted,review_title,review_text,scores,compound,sentiment
174,115904,2024-07-12,perfectly,"Description Overnight Immune Support Melatonin Free Certified USDA Organic Spill Proof Syringe and Adapter Dietary Supplement Mom Founded and Owned Non-GMO: NSF Certified All Packaging Free of BPA, PVC and Phthalates Certified Organic by Quality Assurance International Promotes restful sleep thanks to natural herbs, supports immunity thanks to elderberry and vitamin C.

","{'neg': 0.0, 'neu': 0.557, 'pos': 0.443, 'compound': 0.9814}",0.9814,pos
175,115904,2024-06-20,,"Supports Digestive Health With Lactase, Protease, Papain and Bromelain Non-GMO Dietary Supplement Suitable for Vegetarians and Vegans Kosher Manufactured in a GMP Registered Facility For Digestive Support Family Owned Founded in 1968 Plant Based Enzymes NOW® is a complete enzyme blend , which helps maintain proper digestion. The combination of enzymes in this product helps break down fats, fiber, proteins and carbohydrates, thereby optimizing the availability of nutrients in the food you eat. NOW® Plant Enzymes also contain lactase to support dairy digestion for lactose-sensitive people

","{'neg': 0.0, 'neu': 0.827, 'pos': 0.173, 'compound': 0.9337}",0.9337,pos
176,115904,2024-06-06,Sleeping drops ,"Quality: Good, this company is Mara. Ingredients: Good. Taste: Accepted by the child. Use: Using a needle. Size: Small. Package: Small. Suitable for outings. Benefit: Peaceful sleep. Under trial. Honestly, I look forward to a peaceful sleep. Age: 4 months and above. Dietary supplement: I don’t know. Serving: 5 ml. Repetition: only from 1 to 4 years of age. Improvement: sleep quality ","{'neg': 0.0, 'neu': 0.664, 'pos': 0.336, 'compound': 0.9694}",0.9694,pos
177,115904,2024-05-27,,This is a great herb. I have benefited from it a lot. I advise you to buy it. The quality is high. The composition is mentioned in the description. The ingredients are mentioned in the description. The benefit is high. The packaging is large. The smell. Use. Size. Age. 25. Essential oils. Sensitive. There is no sensitivity. High hydration. Nutrition. Look at the information in the description from the list. The most important thing is that it is not in it. Of pork products,"{'neg': 0.025, 'neu': 0.87, 'pos': 0.105, 'compound': 0.7902}",0.7902,pos
178,115904,2024-05-12,For children ,"Our family-owned company was founded by my mother, who raised three children while working as a nurse and certified midwife. Empathizing with other moms, she created Mommy's Bliss, which promotes family wellness in a safe and natural way. Having become a mom myself, I understand how important it is to choose products that I trust to work effectively, safely, and keep my little ones happy! — Yasmin Kederali, Mom, Daughter, and CEO Organic toddler bedtime supplements support immunity, carefully crafted with our Bedtime Bliss Blend™. They are very soft. Here are some tips to help you relax before bed:","{'neg': 0.0, 'neu': 0.632, 'pos': 0.368, 'compound': 0.9911}",0.9911,pos
179,115904,2024-05-07,Good drops,"Delicious, the child drank with pleasure, I didn’t have to force it. The portion given was less than what was indicated on the package. It really helped a child with dermatitis sleep because he slept deeper and did not scratch the skin. A little expensive per serving, but I’ll buy more if I need help falling asleep and staying asleep because it’s too convenient to give such drops. ","{'neg': 0.027, 'neu': 0.851, 'pos': 0.123, 'compound': 0.7747}",0.7747,pos
180,115904,2024-04-12,Great,"Our family-owned company was founded by my mother, who raised three children while working as a nurse and certified midwife. Empathizing with other moms, she created Mommy's Bliss, which promotes family wellness in a safe and natural way. Having become a mom myself, I understand how important it is to choose products that I trust to work effectively, safely, and keep my little ones happy!","{'neg': 0.0, 'neu': 0.61, 'pos': 0.39, 'compound': 0.9823}",0.9823,pos
181,115904,2024-04-06,,"Organic drops for children from Mommy's Bliss are a real lifesaver for my baby! The quality of this product is at the highest level, I am confident in its safety and effectiveness. The bottle is a convenient size, easy to take on the go or use at home. The taste of the drops is pleasant, which is important for children, as they are sensitive to new tastes. The ingredients are natural and organic, which is very important to me as I prefer to use only safe products for my baby. Very pleased with this product","{'neg': 0.0, 'neu': 0.713, 'pos': 0.287, 'compound': 0.9837}",0.9837,pos
182,115904,2024-03-17,,I really like a good product. The quality is good and comfortable. I recommend everyone to buy it for themselves and for their family. The size is good. There are benefits. The packaging is intact. Health helped. The ingredients are the best. The result is good. My stomach doesn't hurt. Good antioxidant. The result is the best. Immunity has improved. ,"{'neg': 0.028, 'neu': 0.504, 'pos': 0.468, 'compound': 0.9887}",0.9887,pos
183,115904,2024-02-27,vitamin,"The vitamins are good. Probably suitable for everyone, but you need to get tested and see a nutritionist. Nowadays it’s impossible to live without vitamins! Good quality. I strongly recommend it. There will be benefits. The taste is not for everyone)) Any natural vitamins and dietary supplements with the composition D, D3, B, A, C, E, Omega, Zinc, as well as liquid vitamins, and much more, when used correctly, ultimately have a good effect on the skin, the heart, the cardiovascular system, etc. For children, it is necessary to know the dosage. Take care of your health.","{'neg': 0.027, 'neu': 0.748, 'pos': 0.225, 'compound': 0.9701}",0.9701,pos
184,115904,2024-02-26,,"Ingredients: Mommy's Bliss offers organic drops that are safe for children 4 months and older. The composition includes natural ingredients such as olive oil and vitamin D. Form and dosage: The drops have a convenient form for administration, and the dosage is easily adjusted. Recommended as directed on package or as recommended by your pediatrician. Packaging: 60 ml bottle provides enough product for a long time. Effectiveness: Mommy's Bliss Organic Drops have been shown to be effective in relieving infant discomfort and supporting their digestion. I noticed positive changes in the child’s behavior and comfort. Product Quality: Mommy's Bliss is known for its focus on product safety and quality. Organic ingredients highlight this approach. Additional Benefits: Contains vitamin D, which is important for bone and immune development in infants. Overall Impression: Mommy's Bliss Organic Baby Drops are a great solution for parents looking for natural relief for infant discomfort. Recommended for everyday use","{'neg': 0.028, 'neu': 0.603, 'pos': 0.368, 'compound': 0.9958}",0.9958,pos
185,115904,2023-12-14,"Even though it is shipped overseas, the delivery is fast and only genuine products are delivered, so I always purchase with confidence.","This is an international shipment from the United States, and the shipment to Korea arrived quickly and safely packaged. We handle genuine products and always purchase with confidence in quality, ingredients, and efficacy. We recommend that you check the product size according to the dosage before purchasing. I would repurchase and recommend it.","{'neg': 0.0, 'neu': 0.767, 'pos': 0.233, 'compound': 0.9231}",0.9231,pos
186,115904,2024-08-29,Excellent,It is very wonderful and the quality is good. The ingredients are amazing. The taste is beautiful. The size is very large. The box is big. The benefit is good. The taste of the tea is suitable for the age. The box is big. ,"{'neg': 0.0, 'neu': 0.65, 'pos': 0.35, 'compound': 0.9661}",0.9661,pos
187,115904,2024-08-25,Mumtaz ,"The quality is great and helps with sleep. Some children may have colic, so be careful. It's good for travel or near school to adjust sleep. ♥️ I used it for my two-year-old son. 👍🏻 Give me a like ♥️","{'neg': 0.0, 'neu': 0.702, 'pos': 0.298, 'compound': 0.9182}",0.9182,pos
188,115904,2024-05-15,Mommy's Place,"High quality, excellent ingredients, easy to use, excellent size, sufficient quantity, superior benefit, suitable for age, excellent nutritional supplement. Excellent portion, provides high energy, suitable for repetition, excellent for improving the body’s physical condition, excellent smell, useful for stress, mood and taste. Tasty. ","{'neg': 0.039, 'neu': 0.416, 'pos': 0.546, 'compound': 0.9887}",0.9887,pos
189,115904,2024-01-03,Useful things,"I bought it for my daughter, I really liked it, she falls asleep peacefully and at the same time strengthens the immune system, and by the way, the taste too 👍","{'neg': 0.0, 'neu': 0.672, 'pos': 0.328, 'compound': 0.8932}",0.8932,pos
190,115904,2023-10-24,Prominent,Its effectiveness is great and its quality is very excellent. It smells nice and its size is suitable for its price. It is very easy to use. Suitable for young people. The appearance of the packaging is wonderful. The benefit is a lot. Its formula is suitable for skin with high hydration in the winter and summer. The taste is delicious. The ingredients are natural. It feels great on the skin and is suitable for sensitive skin.,"{'neg': 0.0, 'neu': 0.683, 'pos': 0.317, 'compound': 0.985}",0.985,pos
191,115904,2024-05-27,Prominent ,"Quality, ingredients, and taste: Elderberry berries I took because I have intermittent sleep, and today is the third day after use. Thank God, there has been an improvement in the quality of sleep, and his sleep has become excellent, God willing. ","{'neg': 0.0, 'neu': 0.717, 'pos': 0.283, 'compound': 0.9081}",0.9081,pos
192,115904,2024-05-20,,Excellent organic drops for a peaceful sleep for your baby. I use 5 ml at night before bed. absolutely harmless and reliable. I love all the dietary supplements from this brand and recommend them to everyone ,"{'neg': 0.0, 'neu': 0.629, 'pos': 0.371, 'compound': 0.9422}",0.9422,pos
193,115904,2024-05-10,satisfied,"The quality is incredible, the ingredients it has are excellent for relaxing the little ones, its flavor is sweet and the use will depend on your comfort when using this product, this product is not going to put the baby to sleep, read well, it is a support to help you reconcile baby's sleep should have an established routine ","{'neg': 0.0, 'neu': 0.719, 'pos': 0.281, 'compound': 0.9578}",0.9578,pos
194,115904,2024-04-23,,I took it for my son Masot and nothing happened and every time I gave it to him he returned everything in his stomach and I tried all methods but it was of no use because it causes his diarrhea. ,"{'neg': 0.072, 'neu': 0.928, 'pos': 0.0, 'compound': -0.4215}",-0.4215,neg
195,115904,2024-01-23,Age,"I really love the different products of this brand and this time I decided to order this product because the quality always justifies the price, the packaging is convenient, small, good natural ingredients, the taste is also very pleasant, the benefits for everyone are individual, I really love the different products of this brand and very often I order for my kids, always making excuses good quality easy to use","{'neg': 0.0, 'neu': 0.685, 'pos': 0.315, 'compound': 0.9791}",0.9791,pos
196,115904,2024-03-06,,"Quality, ingredients, taste, size, the entire package is excellent. Used from 6 months old. I will repeat the purchase. I did not notice a difference ","{'neg': 0.0, 'neu': 0.844, 'pos': 0.156, 'compound': 0.5719}",0.5719,pos
197,115904,2024-10-17,,They helped a lot. The quality is super. The gas has passed. I recommend it to all parents whose child suffers from colic and excessive gas formation. ,"{'neg': 0.098, 'neu': 0.698, 'pos': 0.203, 'compound': 0.5106}",0.5106,pos
198,115904,2024-10-13,,"Organic Baby Bedtime Supplements support immunity, carefully crafted with our Bedtime Bliss Blend™. They are super gentle. Here are some tips to help you unwind before bed: A warm, soothing bath A gentle massage","{'neg': 0.0, 'neu': 0.484, 'pos': 0.516, 'compound': 0.9702}",0.9702,pos
199,115904,2024-10-10,,"My daughter really likes the taste, the product is of high quality and is easy to use thanks to the measuring syringe in the package. ","{'neg': 0.0, 'neu': 0.712, 'pos': 0.288, 'compound': 0.8357}",0.8357,pos
200,115904,2024-10-09,the best sleep 😴 for baby,"The taste is pleasant. The quality and composition of the product are very natural and organic. It does not last long, but there is definitely a benefit. The baby becomes calm and sleeps 😴 soundly. I recommend buying 💯 ","{'neg': 0.0, 'neu': 0.62, 'pos': 0.38, 'compound': 0.9501}",0.9501,pos
201,115904,2024-10-05,Mumtaz,"Melatonin Free USDA Organic Syringe/Drip Stopper Included Dietary Supplement Founded by Mom + Lead Certified Non-GMO by NSF All Packaging Materials are BPA, PVC, and Phthalate Free","{'neg': 0.0, 'neu': 0.784, 'pos': 0.216, 'compound': 0.765}",0.765,pos
202,115904,2024-10-03,Excellent!,"I am happy with the purchase, what else can I say. I recommend it to all my friends, I see a positive effect from using it
","{'neg': 0.0, 'neu': 0.569, 'pos': 0.431, 'compound': 0.9169}",0.9169,pos
203,115904,2024-10-02,children's drops to improve sleep,"I really liked the composition and the fact that the baby can be used from 4 months. it's great that there is a syringe dispenser, the baby takes it with pleasure, sleep has improved.","{'neg': 0.0, 'neu': 0.659, 'pos': 0.341, 'compound': 0.9324}",0.9324,pos
204,115904,2024-09-30,hello,"I use it when I want to improve my children’s sleep, and God willing, it will not cause any harm because its ingredients are herbal and natural.  ","{'neg': 0.0, 'neu': 0.632, 'pos': 0.368, 'compound': 0.8641}",0.8641,pos
205,115904,2024-09-30,Children's drops ,Super quality Natural ingredient Neutral taste Easy to use Large size Convenient packaging One advantage Age from 4 months Organic supplement Immediately measured portion Frequency of intake once/day To improve sleep,"{'neg': 0.0, 'neu': 0.638, 'pos': 0.362, 'compound': 0.9217}",0.9217,pos
206,115904,2024-09-30,,"Honestly, I'm afraid to use it a lot. I only use it if I have something important or a hospital appointment for my daughter. I give it to her so she can sleep early. Other than that, no. ","{'neg': 0.059, 'neu': 0.811, 'pos': 0.13, 'compound': 0.3818}",0.3818,pos
207,115904,2024-09-29,Sweet and sour taste,"The taste is sweet and sour, and children like it after diluting it with water. Have a drink before going to bed and your child will still wake up in the middle of the night","{'neg': 0.0, 'neu': 0.853, 'pos': 0.147, 'compound': 0.6705}",0.6705,pos
208,115904,2024-09-29,Must praise,"Works great for my 2 year old who suffers from sleep regression! She can sleep well after eating. I did not give her 10ml according to the instructions, only 5ml each time.","{'neg': 0.085, 'neu': 0.738, 'pos': 0.177, 'compound': 0.5255}",0.5255,pos
209,115904,2024-09-28,Very good ,"Good taste, good use, excellent quality, large size, tight package, cleans deeply, distinctive formula, gentle on sensitive teeth, good ingredients, fish is good for the heart ","{'neg': 0.0, 'neu': 0.52, 'pos': 0.48, 'compound': 0.955}",0.955,pos
210,115904,2024-09-27,artist,The quality is excellent. The ingredients are lavender and natural. The taste is current. It is used to accustom the child to sleep. The size is good and the packaging is good. It is useful for accustoming the child. Age: newborns. It will definitely be purchased again.,"{'neg': 0.0, 'neu': 0.7, 'pos': 0.3, 'compound': 0.9485}",0.9485,pos
211,115904,2024-09-27,,"excellent supplement friends, quality checked by me personally, in a short time I noticed the result, with iHerb everything is always very high quality thank you for the opportunity to always order from you ","{'neg': 0.0, 'neu': 0.694, 'pos': 0.306, 'compound': 0.9074}",0.9074,pos
212,115904,2024-09-21,Rrrrrrrrrrrrrrrrrrrrrrrrrrrrrrrrr,"Overnight Immune Support Melatonin Free USDA Organic Syringe/Drip Stopper Included Dietary Supplement Founded by Mom + Lead Certified Non-GMO by NSF All Packaging is BPA, PVC, and Phthalate Free Certified Organic by: Quality Assurance International Promotes Restful Sleep with Natural Herbs and Supporting Ingredients Promotes Sleep","{'neg': 0.0, 'neu': 0.568, 'pos': 0.432, 'compound': 0.9738}",0.9738,pos
213,115904,2024-09-21,Fine,"Excellent supplement, arrived on time. Ingredients are natural, happy with the dosage. Quality is good. Packaging is well sealed. I will definitely recommend it because the result is real. 
","{'neg': 0.0, 'neu': 0.511, 'pos': 0.489, 'compound': 0.959}",0.959,pos
214,115904,2024-09-20,Delicious and effective,"The child always has nightmares or cries at night. After drinking this, he becomes calmer and sleeps better, and he can finally sleep until dawn.","{'neg': 0.09, 'neu': 0.731, 'pos': 0.179, 'compound': 0.4019}",0.4019,pos
215,115904,2024-09-19,,"They are also a suitable support for babies and toddlers who are at different stages of development, are introduced to new foods, have digestive disorders, or may suffer from environmental allergies that can affect sleep.","{'neg': 0.092, 'neu': 0.838, 'pos': 0.071, 'compound': -0.2023}",-0.2023,neg
216,115904,2024-09-19,Baby drops for infants ,"This product is useful for babies who have problems with sleep. There is no melatonin here. The composition is ideal. My child falls asleep when I give it to him. And most importantly, a reliable brand that specializes in children's vitamins. ","{'neg': 0.103, 'neu': 0.711, 'pos': 0.186, 'compound': 0.6115}",0.6115,pos
217,115904,2024-09-16,The product is very beautiful ,The product is very beautiful and real. My child is 4 months old. The dose I gave him was 3 ml. The taste is nice. I use it at bedtime after breastfeeding. The package is very practical. ,"{'neg': 0.0, 'neu': 0.816, 'pos': 0.184, 'compound': 0.7902}",0.7902,pos
218,115904,2024-09-09,Very beautiful,"It tastes like berries and is delicious. My son loves it. I use it if he doesn’t sleep well for more than a day. My son is 8 months old. I give him 5 ml. I was afraid to give him more.
","{'neg': 0.0, 'neu': 0.727, 'pos': 0.273, 'compound': 0.9001}",0.9001,pos
219,115904,2024-09-03,Good,"Excellent supplement, arrived on time. Ingredients are natural, happy with the dosage. Quality is good. Packaging is well sealed. I will definitely recommend it because the result is real. 
","{'neg': 0.0, 'neu': 0.511, 'pos': 0.489, 'compound': 0.959}",0.959,pos
220,115904,2024-08-30,,"Organic elderberry drops are a natural immune support. Black elderberry extract is a powerful immunomodulator. Its action is enhanced by vitamins, zinc and echinacea root. This is a very effective preventive measure against colds in the autumn-winter period.","{'neg': 0.0, 'neu': 0.688, 'pos': 0.312, 'compound': 0.9117}",0.9117,pos
221,115904,2024-08-24,Mumtaz,"Honestly, this is the first time I’ve tried it on my children, one year old. To use it, we sometimes wait to use it.","{'neg': 0.0, 'neu': 0.885, 'pos': 0.115, 'compound': 0.4588}",0.4588,pos
222,115904,2024-08-19,drops,"I took it for a newborn, I haven't given it to him yet because we are only 2 months old, I hope it will help us, I take everything from this company for gas and colic, and a lot of other things, my favorite company","{'neg': 0.0, 'neu': 0.803, 'pos': 0.197, 'compound': 0.8225}",0.8225,pos
223,115904,2024-08-16,Helping mom.,"Excellent quality and taste. Helped my granddaughter fall asleep faster. But for 2 years old you need a larger dose. We managed to use half the norm. For our age, we will look for another option. The composition is very good and safe for babies.","{'neg': 0.0, 'neu': 0.786, 'pos': 0.214, 'compound': 0.8976}",0.8976,pos
224,115904,2024-08-13,,"I give it to my child on the recommendation of a nutritionist, the quality is good, the ingredients are top-notch, the price is affordable, the size is convenient ","{'neg': 0.0, 'neu': 0.896, 'pos': 0.104, 'compound': 0.4404}",0.4404,pos
225,115904,2024-08-10,To calm down,"The company's quality is high and famous. The age is more than four months. The benefit, in my opinion, is for calming down. Improving sleep is possible, but it must be repeated every day at the same time. ","{'neg': 0.0, 'neu': 0.859, 'pos': 0.141, 'compound': 0.5789}",0.5789,pos
226,115904,2024-08-03,,"Frankly, I did not continue with it because I did not see any results with my son and I was afraid for him because of the medications","{'neg': 0.0, 'neu': 1.0, 'pos': 0.0, 'compound': 0.0}",0.0,neu
227,115904,2024-08-01,,"Overnight Immune Support Melatonin Free USDA Certified Organic Sealed Syringe/Tip Dietary Supplement Mom + Led Base Non-GMO - NSF Certified All packaging materials are BPA, PVC and Phthalate Free QAI Certified Organic","{'neg': 0.0, 'neu': 0.693, 'pos': 0.307, 'compound': 0.8885}",0.8885,pos
228,115904,2024-08-01,,"Quality, excellent for bedtime and relaxing. Ingredients: berries. The taste is strawberry, delicious, use, small size points, small package, useful for sleep, from the age of one month, as a dietary supplement ","{'neg': 0.0, 'neu': 0.667, 'pos': 0.333, 'compound': 0.926}",0.926,pos
229,115904,2024-07-30,Good remedy ,"I restored the baby’s sleep, he didn’t sleep well during the day, a couple of days of taking it was enough for recovery ","{'neg': 0.0, 'neu': 0.809, 'pos': 0.191, 'compound': 0.5423}",0.5423,pos
230,115904,2024-07-28,,"I give it to a child on the recommendation of a pediatrician, I liked the quality, the brand is good - produce high-quality natural products","{'neg': 0.0, 'neu': 0.675, 'pos': 0.325, 'compound': 0.802}",0.802,pos
231,115904,2024-07-27,Great,"Excellent supplement, arrived on time. The ingredients are natural, I’m happy with the dosage. Good quality. The packaging is well sealed. The benefits are invaluable to the body. ","{'neg': 0.0, 'neu': 0.557, 'pos': 0.443, 'compound': 0.9477}",0.9477,pos
232,115904,2024-07-20,Good drops,Good quality and safe ingredients. The taste is pleasant. Easy to use. I give it to my baby before bed because he is restless and wants to rest. The action is soft and delicate. I recommend ,"{'neg': 0.047, 'neu': 0.603, 'pos': 0.35, 'compound': 0.9118}",0.9118,pos
233,115904,2024-07-10,,"The smell is beautiful, easy to use, high quality, large size, suitable for everyone. The packaging is suitable. The benefit is great. A beautiful composition that moisturizes the lips. High hydration. High SPF. Beautiful for dry lips. ","{'neg': 0.0, 'neu': 0.58, 'pos': 0.42, 'compound': 0.9709}",0.9709,pos
234,115904,2024-07-10,Really liked the product,I bought it for my nephew. I began to sleep better. The composition and ingredients are very good. And it tastes good. I recommend it to everyone ,"{'neg': 0.0, 'neu': 0.629, 'pos': 0.371, 'compound': 0.8953}",0.8953,pos
235,115904,2024-07-10,,"I was delighted, it has a good flavor and no problem taking it, it takes about half an hour to take effect and make you sleepy, the size is perfect for the price and quality ","{'neg': 0.114, 'neu': 0.654, 'pos': 0.231, 'compound': 0.7184}",0.7184,pos
236,115904,2024-07-10,Super drops,"I thank you for the quality and taste of this drug, very easy to use drops. The dosage in the instructions is correct, I was able to change the regimen for my child. I recommend to all. ","{'neg': 0.0, 'neu': 0.791, 'pos': 0.209, 'compound': 0.8016}",0.8016,pos
237,115904,2024-06-24,,"Overnight Immune Support Melatonin Free USDA Organic Certified Sealed Syringe/Tip Dietary Supplement Mom + Led Base Non-GMO - NSF Certified All packaging materials are BPA, PVC and Phthalate Free Certified Organic by QAI Ensures restful sleep with natural herbs and supports immunity with elderberry and vitamin C","{'neg': 0.0, 'neu': 0.629, 'pos': 0.371, 'compound': 0.9595}",0.9595,pos
238,115904,2024-06-18,Children's drops,"Children's drops, excellent quality, ingredients, children's vitamin, delicious taste, daily use, large size, large package, benefit, speed of sleep, suitable for all ages, benefit, vitamin and nutritional supplement, serving daily frequency, improvement for children ","{'neg': 0.0, 'neu': 0.565, 'pos': 0.435, 'compound': 0.9628}",0.9628,pos
239,115904,2024-06-06,THE WAY TO A HEALTHY BODY AND MIND,"1. Cook simple and quick dishes in a slow cooker. Use this useful household appliance to save your time, energy and the number of calories in your diet. Often we do not want to cook because we are very tired after work, so we order food home or go to a restaurant. Well, just learn how to cook fast food. Now there are many simple and tasty recipes in which you just need to mix all the ingredients and put them in a pan. 2. Apply sunscreen to your skin every day. So your skin will age much more slowly. 3. If you simply cannot do without fast food from time to time, order children's sets or small portions. So you will be full, and you will not feel guilty for the calories eaten. 4. Rule of two bites. If you want to eat something harmful, use the rule of two bites. Take a glass of cold water. Take a bite of your choice. Drink a glass of water. Wait 1-2 minutes and take a second bite. 5. If you are not sure that your diet is properly balanced, then a high-quality multivitamin complex is the cheapest way to insure your health. 6. Do 10 squats and 10 push-ups every morning. Later, you can increase the load and thus wake up much faster.","{'neg': 0.033, 'neu': 0.894, 'pos': 0.073, 'compound': 0.8445}",0.8445,pos
240,115904,2024-04-29,Effectively helps babies fall asleep,My sons started drinking it every other night when they were 5 months old. They didn’t get sick after drinking it for a month. They can also drink it when they can’t sleep. Very good product.,"{'neg': 0.086, 'neu': 0.831, 'pos': 0.083, 'compound': -0.0276}",-0.0276,neu
