,Unnamed: 0,product_id,date_posted,review_title,review_text,scores,compound,sentiment
0,0,120042,2024-10-03,Sleep bettet,"This product is quiet helpul
for me in sleep condition","{'neg': 0.0, 'neu': 1.0, 'pos': 0.0, 'compound': 0.0}",0.0,neu
1,1,120042,2024-01-06,great,"The quality is good and in terms of efficacy, it's the best sleep formula I've ever tried. It's tasteless and I was worried about whether it would really work, but I ate it and woke up and it was the best, but it was sold out again right after I bought it.","{'neg': 0.028, 'neu': 0.79, 'pos': 0.182, 'compound': 0.8674}",0.8674,pos
2,2,120042,2024-01-16,5htp,"I was looking for a nutritional supplement that contained 5htp other than theanine, and I ordered this product because it seemed to have the highest capacity. They say to take it before going to bed, but I take it with water about 2 hours before going to bed. I feel like two pills is too much, so I take one pill a day. I think it definitely works. The quality is good, but it seems to be sold out often. If I had known this would be the case, I would have bought another bottle.","{'neg': 0.0, 'neu': 0.884, 'pos': 0.116, 'compound': 0.8922}",0.8922,pos
3,3,120042,2024-10-08,excellent,"Excellent ingredient quality. I let my daughter help her sleep. It is very difficult for her to fall asleep at night. Some days it works quickly and some days it has no effect. Overall, I feel good. ","{'neg': 0.113, 'neu': 0.677, 'pos': 0.21, 'compound': 0.6494}",0.6494,pos
4,4,120042,2024-07-29,,"Great product just works! My daughter has trouble sleeping and less than 2 hours just works. Excellent quality and also the product ingredient, one capsule dose before bed is definitely enough ","{'neg': 0.068, 'neu': 0.658, 'pos': 0.273, 'compound': 0.8439}",0.8439,pos
5,5,120042,2024-05-24,It seems to help me fall asleep.,"I have difficulty sleeping and wake up early in the morning, but I feel slightly drowsy 30 minutes after taking it. It is difficult to say that it is 100% effective alone as it is used in combination with several products, but I personally believe it is effective.
","{'neg': 0.134, 'neu': 0.717, 'pos': 0.149, 'compound': 0.431}",0.431,pos
6,6,120042,2024-04-26,,I am satisfied with this product as it helps me sleep comfortably.,"{'neg': 0.0, 'neu': 0.494, 'pos': 0.506, 'compound': 0.802}",0.802,pos
7,7,120042,2023-08-28,,"Helps with insomnia. The effect of 2 pills is good, but it seems that it is too strong or sleeps too much. It's when you want to sleep without wanting or when you're scared. Eating just one pill worked. I think I want to sleep about an hour after eating. The downside is you need to drink a lot of water.","{'neg': 0.094, 'neu': 0.741, 'pos': 0.165, 'compound': 0.4118}",0.4118,pos
8,8,120042,2023-08-24,,Performance is very good. Good,"{'neg': 0.0, 'neu': 0.32, 'pos': 0.68, 'compound': 0.7485}",0.7485,pos
