,Unnamed: 0,product_id,date_posted,review_title,review_text,scores,compound,sentiment
86,86,1236,2024-05-26,All components in the composition help improve well-being during stress,"During stress, B vitamins, vitamin C, magnesium and others are actively consumed. This complex will help fill the deficiency of essential nutrients. I noticed that after taking the course I began to feel calmer and began to sleep more soundly","{'neg': 0.063, 'neu': 0.719, 'pos': 0.218, 'compound': 0.7096}",0.7096,pos
87,87,1236,2024-04-16,,"a good product. It really helps me to relate and cope with stressful situations more easily. there is a cumulative effect. The tablets are large and smell like herbs. not nasty. there is an effect.
","{'neg': 0.075, 'neu': 0.611, 'pos': 0.315, 'compound': 0.8628}",0.8628,pos
88,88,1236,2024-01-13,great,"I like the quality of additives from this manufacturer. I take vitamins of group B in courses, several times a year. The tool does not cause negative effects","{'neg': 0.0, 'neu': 0.8, 'pos': 0.2, 'compound': 0.6703}",0.6703,pos
89,89,1236,2023-12-25,,"the best complex for combating stress and its consequences. contains not only all the necessary trace elements that support the work of the nervous system, but also soothing components and amino acids, precursors of serotonin","{'neg': 0.084, 'neu': 0.734, 'pos': 0.181, 'compound': 0.6059}",0.6059,pos
90,90,1236,2023-11-25,,"Periods of increased stress can deplete the body's supply of nutrients. This exhaustion can interfere with the body's system's ability to function normally. Hi-Stress B&C™ helps restore nutrient levels during times of stress, allowing the body to return to its normal balance.","{'neg': 0.155, 'neu': 0.669, 'pos': 0.176, 'compound': 0.0258}",0.0258,neu
91,91,1236,2023-11-15,Perfectly,"A good supplement for relaxation, promotes good sleep. The size of the tablets is quite large. The quality is excellent. The composition is effective for combating stress.","{'neg': 0.07, 'neu': 0.473, 'pos': 0.458, 'compound': 0.9393}",0.9393,pos
92,92,1236,2024-08-19,This is a really good product for stress relief.,"I have seen the effects of taking this product. First of all, I recommend this product to those who are under a lot of mental stress. ","{'neg': 0.106, 'neu': 0.798, 'pos': 0.095, 'compound': -0.0772}",-0.0772,neg
93,93,1236,2024-08-13,Taken due to stress,"I took it because I'm sensitive to stress, but my urine comes out yellow. The pills are big, so it's a bit hard to swallow.","{'neg': 0.156, 'neu': 0.844, 'pos': 0.0, 'compound': -0.4396}",-0.4396,neg
94,94,1236,2024-06-01,The effect of walking is the case,"Frankly speaking, its effect is not strong. Some people take it and imagine that it is good. The issue is psychological, nothing more or less.","{'neg': 0.094, 'neu': 0.804, 'pos': 0.101, 'compound': 0.0511}",0.0511,pos
95,95,1236,2024-05-13,There is a positive effect,"Since we now live in conditions of constant stress in Ukraine, I decided to try this supplement, but in fact, it is still difficult to evaluate its effect... Perhaps over time I will add to my review, but now, from what I have noticed, I have become better sleep...","{'neg': 0.101, 'neu': 0.824, 'pos': 0.075, 'compound': -0.0772}",-0.0772,neg
96,96,1236,2024-04-12,Works good,"I can’t say that I became a monster after taking these supplements, but they definitely had an effect. The ingredients indicated on the packaging are felt by the body to be replenished over time, i.e. effectiveness is evident. But they are a little weak. 4/5","{'neg': 0.074, 'neu': 0.849, 'pos': 0.077, 'compound': 0.036}",0.036,neu
97,97,1236,2024-03-24,Great ,One of the best used complexes during times of stress The composition is simply gorgeous Their effects are noticeably calmer and more balanced I sleep I recommend ,"{'neg': 0.077, 'neu': 0.552, 'pos': 0.371, 'compound': 0.8925}",0.8925,pos
98,98,1236,2023-05-17,,"We are glad that Hi-Stress is back on sale and will again help reduce the effects of daily stress. An excellent composition of ingredients helps to calm the nervous system. It is good to drink a course of 2 tablets per day, the package is enough for 2 months. The tablets are large but easy to swallow.","{'neg': 0.054, 'neu': 0.704, 'pos': 0.242, 'compound': 0.875}",0.875,pos
99,99,1236,2024-08-25,,"It really helps. The composition is natural, high-quality ingredients and a great price, I recommend it.","{'neg': 0.0, 'neu': 0.455, 'pos': 0.545, 'compound': 0.8999}",0.8999,pos
100,100,1236,2024-07-10,Excellent!,The supplement fights stress very well. I use it all the time. I buy regularly. ,"{'neg': 0.307, 'neu': 0.559, 'pos': 0.134, 'compound': -0.4779}",-0.4779,neg
101,101,1236,2024-05-09,,"Really great drug for stress, my husband and I use it and many colleagues at work, I sleep better, I recommend it!","{'neg': 0.1, 'neu': 0.538, 'pos': 0.362, 'compound': 0.8066}",0.8066,pos
102,102,1236,2024-04-19,Antistress,"The brand produces very high quality and working supplements. The best herbs are collected here in large dosages, super!","{'neg': 0.0, 'neu': 0.67, 'pos': 0.33, 'compound': 0.8553}",0.8553,pos
103,103,1236,2024-03-02,Excellent!,"Vitamin B & C for stress relief with herbs - excellent quality, pleasant taste, improves the nervous system ","{'neg': 0.181, 'neu': 0.259, 'pos': 0.559, 'compound': 0.8807}",0.8807,pos
104,104,1236,2024-01-12,,"Hi-Stress B&C™ is designed to help the body restore nutrient levels during times of stress, bringing it back into balance.","{'neg': 0.113, 'neu': 0.688, 'pos': 0.198, 'compound': 0.2732}",0.2732,pos
105,105,1236,2024-01-10,,"I have been using for several years following the recommendation of the Naturomat and I am healthy, my tests are always good","{'neg': 0.0, 'neu': 0.763, 'pos': 0.237, 'compound': 0.6808}",0.6808,pos
106,106,1236,2023-12-19,Excellent!,I bought it to normalize sleep and nervous activity. The composition is very good. I will try,"{'neg': 0.115, 'neu': 0.711, 'pos': 0.175, 'compound': 0.2716}",0.2716,pos
107,107,1236,2023-01-23,,It seems to have ingredients to relieve stress. I bought it after a review said that the quality was good even though the size was a bit big. uploading it late.,"{'neg': 0.084, 'neu': 0.753, 'pos': 0.163, 'compound': 0.3818}",0.3818,pos
108,108,1236,2023-10-03,Great,"From time to time I order my family products for the normal functioning of the nervous and cardiovascular systems. This is one of them. I can say that it works very well. Performs all declared functions. Relaxes, improves mood, normalizes sleep, eliminates cramps.","{'neg': 0.045, 'neu': 0.791, 'pos': 0.164, 'compound': 0.6801}",0.6801,pos
109,109,1236,2023-07-09,,"good quality, advantage for energy, influx of niacin, ingredient folic acid for nervous system, good metabolism, effect and strength of action pleasant taste, advantage for my age, package size is good","{'neg': 0.046, 'neu': 0.485, 'pos': 0.469, 'compound': 0.9531}",0.9531,pos
110,110,1236,2023-01-03,,A more than wonderful supplement for calm and relaxation. I recommend it to every person who has tension or is looking for a natural cradle,"{'neg': 0.07, 'neu': 0.485, 'pos': 0.445, 'compound': 0.9077}",0.9077,pos
111,111,1236,2024-09-20,The capsule is relatively large,The capsules are relatively large and contain a lot of herbal extracts. They are large and complete. The portion is a bit large.,"{'neg': 0.0, 'neu': 1.0, 'pos': 0.0, 'compound': 0.0}",0.0,neu
112,112,1236,2023-05-19,,"2 - 4 tablets as needed for stress. you can not drink the whole course, but just drink in stressful situations. if the nerves are completely loosened, then you can drink for 10 days.","{'neg': 0.221, 'neu': 0.779, 'pos': 0.0, 'compound': -0.7876}",-0.7876,neg
113,113,1236,2023-04-16,,"A good supplement for calming, promotes good sleep. The size of the tablets is large enough to be taken into account. who have problems swallowing","{'neg': 0.083, 'neu': 0.583, 'pos': 0.334, 'compound': 0.802}",0.802,pos
114,114,1236,2023-03-17,,"Excellent drug. Contains niacin and folic acid. For the nervous system, a good result. The quality is top notch. I really like this company. The ingredients are natural. No taste. The result is good.","{'neg': 0.096, 'neu': 0.535, 'pos': 0.37, 'compound': 0.9061}",0.9061,pos
115,115,1236,2023-10-26,Complete,"They are said to be beneficial for psychological stress, tension, and anxiety. They are tested with quality and natural ingredients","{'neg': 0.25, 'neu': 0.551, 'pos': 0.199, 'compound': -0.1027}",-0.1027,neg
116,116,1236,2023-09-22,Great,"Vitamins of the highest quality The size of the tablet itself is too large, it may cause difficulties for some All forms are excellent, the composition is pleasing I recommend","{'neg': 0.06, 'neu': 0.679, 'pos': 0.261, 'compound': 0.8126}",0.8126,pos
117,117,1236,2022-08-02,Excellent!,"Cool capsules. Very good packaging. The size is perfect. The quality is just superb. Arrived quickly, perfect packaging. I recommend, friends ask where to buy.","{'neg': 0.0, 'neu': 0.429, 'pos': 0.571, 'compound': 0.9705}",0.9705,pos
118,118,1236,2024-09-18,great,I think it helps..before going to bed,"{'neg': 0.0, 'neu': 1.0, 'pos': 0.0, 'compound': 0.0}",0.0,neu
119,119,1236,2023-10-30,,"good complex, high quality. excellent composition and natural ingredients.","{'neg': 0.0, 'neu': 0.397, 'pos': 0.603, 'compound': 0.8442}",0.8442,pos
120,120,1236,2022-12-14,Ok,"I don't know why, but I don't like this brand. the quality may be normal, but in my opinion, the price is overpriced. iHerb has enough other quality brands with a more affordable price. Thanks for the like! Glory to Ukraine!","{'neg': 0.109, 'neu': 0.695, 'pos': 0.196, 'compound': 0.7391}",0.7391,pos
121,121,1236,2023-06-29,,"I'm glad I snatched it up! I love this brand, all effective supplements","{'neg': 0.0, 'neu': 0.43, 'pos': 0.57, 'compound': 0.8908}",0.8908,pos
122,122,1236,2018-04-21,VITAMINS WORK.,"Ordered these vitamins to reduce nervousness in a stressful period. I took one capsule a day. About a week later he noticed that he became calmer. They work gently - no drowsiness, no pressure on the brain. Now I sometimes use as usual multivitamins weekly courses of one capsule per day, regardless of food intake. Overall satisfied. If the feedback is useful, click YES.","{'neg': 0.162, 'neu': 0.642, 'pos': 0.196, 'compound': 0.5473}",0.5473,pos
123,123,1236,2023-10-08,,"The composition is excellent, the quality is high. I really love this brand. natural ingredients","{'neg': 0.0, 'neu': 0.507, 'pos': 0.493, 'compound': 0.8932}",0.8932,pos
124,124,1236,2023-10-06,good,"Good quantity, good use, good quality, normal size, good packaging","{'neg': 0.0, 'neu': 0.341, 'pos': 0.659, 'compound': 0.891}",0.891,pos
125,125,1236,2023-08-07,,Very good like all source natural supplements suitable for daily intake soothes and allows better use of cognitive abilities,"{'neg': 0.0, 'neu': 0.511, 'pos': 0.489, 'compound': 0.9076}",0.9076,pos
126,126,1236,2023-08-04,,"b plus c is needed by everyone every day, it can strengthen the resistance and antioxidant capacity.","{'neg': 0.0, 'neu': 0.859, 'pos': 0.141, 'compound': 0.3182}",0.3182,pos
127,127,1236,2023-07-02,,"If you drink it when you are stressed, you can feel the effect. It would be helpful if there was a little more capacity.","{'neg': 0.092, 'neu': 0.802, 'pos': 0.107, 'compound': 0.1027}",0.1027,pos
128,128,1236,2023-06-03,,"An excellent complex for calmness, calms nerves and improves health! Cool and cool, I will take more","{'neg': 0.052, 'neu': 0.336, 'pos': 0.612, 'compound': 0.9324}",0.9324,pos
129,129,1236,2023-05-10,,"The packaging is good, the ingredients are good, the dosage is suitable, the size is good ordered received","{'neg': 0.0, 'neu': 0.633, 'pos': 0.367, 'compound': 0.8271}",0.8271,pos
130,130,1236,2022-12-04,Excellent!,The quality is excellent. The composition is effective for combating stress. Improves the work of the nervous system.,"{'neg': 0.178, 'neu': 0.473, 'pos': 0.349, 'compound': 0.6908}",0.6908,pos
131,131,1236,2023-09-13,,One of the best vitamins on the site Helps cope well with stress Improves overall condition Good price I recommend,"{'neg': 0.088, 'neu': 0.376, 'pos': 0.536, 'compound': 0.9231}",0.9231,pos
132,132,1236,2023-07-05,Good,"I like such supplements. I periodically take these vitamins, especially at the beginning of a depressive autumn","{'neg': 0.152, 'neu': 0.702, 'pos': 0.146, 'compound': -0.0258}",-0.0258,neu
133,133,1236,2021-07-20,Good bought.,"I have been looking for vitamins for a long time that can only bring benefits and no harm. Source Naturals, Hi-Stress B & C - suited me very much, no one has ever seen me so energetic, these vitamins add strength, improve metabolism, normalize stool. No cons were found. 120 tablets were enough for a month of use, I will take a break and drink them again. The composition is very interesting, whoever reads it will understand, nothing superfluous, only natural ingredients, herbs. I am very pleased.","{'neg': 0.126, 'neu': 0.682, 'pos': 0.192, 'compound': 0.8135}",0.8135,pos
134,134,1236,2021-06-14,,"This is a godsend for me! I will definitely order more! With the current stress level, this is my peace of mind)) Excellent composition, dosage, proven brand. The effect is felt immediately! 2-4 things a day, depending on your emotional state. I drink 2 after breakfast and 2 at night, it does not cause drowsiness, it just becomes calm and external stimuli do not make me lose my temper.","{'neg': 0.07, 'neu': 0.672, 'pos': 0.258, 'compound': 0.9341}",0.9341,pos
135,135,1236,2021-05-04,,"I bought it for my husband to restore the nervous system and sleep. Sleep was disturbed due to stress. He drinks 3 times a day. Less nervous. The composition is cool! Helps to be less nervous. Sleep has not yet returned to normal, but so far it takes only a week, continues to take. Then I'll write","{'neg': 0.147, 'neu': 0.767, 'pos': 0.086, 'compound': -0.3802}",-0.3802,neg
136,136,1236,2019-03-06,Excellent between periods,Use it at the end of the day after the stress makes you very calm and continue to impact until the next day with clarity in the vision and lack of desire to do something .. Men may affect the erection I do not know .. Do not use it on a daily basis may give a result is not good .. The size of the big love This is not Drink lots of water.,"{'neg': 0.088, 'neu': 0.747, 'pos': 0.166, 'compound': 0.7709}",0.7709,pos
137,137,1236,2014-05-06,"It helped, and how!","I often have headaches which are not removed analgesics. We had to drink 2-3 tablets, and it almost every day. The doctor advised to go to yoga. She brought me temporary relief. And that's when I really lost hope that my headaches will pass, opened the fridge and saw the jar. I ordered it for my husband from the stress at work, but she had, for some reason did not go. I)), lo! After drinking the recommended dose of 4 tablets, let me go)) probably my pain was intense pain. And when relaxed muscles and the brain, head and passed)) for me it is a great happiness!","{'neg': 0.099, 'neu': 0.718, 'pos': 0.183, 'compound': 0.8916}",0.8916,pos
138,138,1236,2014-03-23,Look for those who need B vitamins,"In composition, balanced product, adding a little bit of vitamin A, C and D. Plus minerals every day, too, not much, just a part of her herbs and valerian tablets reek. For me as 4 tablets a day is a lot here at the most 2 times (morning and evening), the amount of B vitamins in one tablet optimized, more and not have to because they are rapidly cleared. I replaced the multivitamin complex. Separately ordered selenium, alpha-lipoic acid and Q10. I recommend to try this combination have problems with the liver and pressure!","{'neg': 0.088, 'neu': 0.815, 'pos': 0.097, 'compound': -0.1915}",-0.1915,neg
139,139,1236,2021-12-02,,"A convenient blend of soothing herbs and vitamins for irritability. But with nervous work, for example, it should be taken regularly. Unfortunately, there is no cumulative effect. Does not cause drowsiness.","{'neg': 0.278, 'neu': 0.678, 'pos': 0.045, 'compound': -0.8225}",-0.8225,neg
140,140,1236,2021-05-30,,"Good composition. Everything is balanced here. Everything to strengthen the body during stress. Each person has their own stress level, so it helps everyone in different ways. One tablet is enough for me in the morning after meals and in the afternoon for three weeks. Sometimes, according to health, one tablet in the morning is enough. I don’t take these pills at night because it can cheer me up. Then a break, tk. the body must produce some of the components of these pills by itself, otherwise it will completely lose the habit.","{'neg': 0.083, 'neu': 0.808, 'pos': 0.109, 'compound': 0.4186}",0.4186,pos
141,141,1236,2012-09-13,stress....,"Daughter of the college entrance examination preparation'm good because when we've looked at four in mind just in case my daughter ... taking medication to the test in the morning and get stressed at home, go to school there was a second pill do I ate effect Constant Heart the light was good ... Map containing ingredients and have more confidence and reduces the heart is also an affordable price .... ^^","{'neg': 0.031, 'neu': 0.848, 'pos': 0.121, 'compound': 0.7902}",0.7902,pos
142,142,1236,2019-09-24,"Whenever we see iHerb products, we are quick to buy our trust in the company's credibility,","IHerb's credibility drives us to buy, especially as it provides us with a lot, but we should not take any supplements on our own.","{'neg': 0.0, 'neu': 1.0, 'pos': 0.0, 'compound': 0.0}",0.0,neu
143,143,1236,2021-07-27,Super composition!,"For the first time I meet a complex with everything necessary for the nervous system and sleep. A combination of herbs, magnesium and vitamins. Great product. Drink as needed.","{'neg': 0.07, 'neu': 0.795, 'pos': 0.136, 'compound': 0.4588}",0.4588,pos
144,144,1236,2021-04-11,Helps Deal With Stress!,"A very good supplement to combat stress. In addition to important vitamins of group B and others, it contains useful herbs that have a beneficial effect on the nervous system.","{'neg': 0.192, 'neu': 0.525, 'pos': 0.283, 'compound': 0.5413}",0.5413,pos
145,145,1236,2021-03-02,,"A very good preparation for the nervous system. It really works, but since there is a large amount of vitamins in the composition, I noticed that I was gaining weight.","{'neg': 0.051, 'neu': 0.758, 'pos': 0.191, 'compound': 0.6424}",0.6424,pos
146,146,1236,2021-01-23,Bomb!,"This is a really bomb-like stress reliever! Excellent working complex, quality product, reliable manufacturer! Recommend! I would be grateful if you click ""yes"".","{'neg': 0.096, 'neu': 0.501, 'pos': 0.402, 'compound': 0.8677}",0.8677,pos
147,147,1236,2021-01-21,Helps Fall Asleep Quickly!),"Usually I do not sleep well, and I fall asleep for a long time, and I also sleep lightly all night. I decided to fight this and bought these vitamins, they help me fall asleep very quickly, and worry less throughout the day.","{'neg': 0.171, 'neu': 0.768, 'pos': 0.061, 'compound': -0.5964}",-0.5964,neg
148,148,1236,2020-10-05,,"I really love this product. Under stress I drink two pills at once, with prolonged stress I start with 4 pills a day and gradually reduce the number of pills a day to 1. So I drink for about a month. The disadvantages are the size and taste of the tablets, but this is not a problem for those who can swallow them, as the taste is not felt. For those who do not have serious illnesses, half a stress pill is enough, which literally brings relief in half an hour.","{'neg': 0.097, 'neu': 0.739, 'pos': 0.164, 'compound': 0.7475}",0.7475,pos
149,149,1236,2019-05-12,Good soothing,"I often have anxiety attacks. And so far these are the best pills that I drank to move away from this state. There are also some problems with sleep, saw at night and a healthy, sound sleep you provide.","{'neg': 0.162, 'neu': 0.686, 'pos': 0.153, 'compound': 0.1531}",0.1531,pos
150,150,1236,2018-05-22,Hi-Stress,"A wonderful product. Corresponds to the description. I drink 2 months to restore the work of the nervous system. During this period, there are no stressful situations. I will order more. I really liked it. I recommend.","{'neg': 0.174, 'neu': 0.55, 'pos': 0.276, 'compound': 0.6635}",0.6635,pos
151,151,1236,2024-10-13,,I bought this medicine after reading reviews. ,"{'neg': 0.0, 'neu': 1.0, 'pos': 0.0, 'compound': 0.0}",0.0,neu
152,152,1236,2022-05-09,,"Excellent complex to improve the state of the nervous system Has soothing properties, due to the various herbs in the composition I recommend!","{'neg': 0.068, 'neu': 0.552, 'pos': 0.38, 'compound': 0.8622}",0.8622,pos
153,153,1236,2022-04-05,,Very helpful and improves mood Why is it missing in stock?,"{'neg': 0.135, 'neu': 0.489, 'pos': 0.376, 'compound': 0.6068}",0.6068,pos
154,154,1236,2021-11-29,,"Works great, after 2-3 days of taking you feel the result of taking the drug","{'neg': 0.0, 'neu': 0.773, 'pos': 0.227, 'compound': 0.6249}",0.6249,pos
155,155,1236,2021-04-07,Quite,"I've been trying various multi-minerals, but I started to think that it would be good to use the main vitamin B group, so I bought this one this time. No change in physical condition for 2 weeks in a row, good or bad. I prefer B12 to be methylcobalamin and more biotin, so it's delicate to repeat.","{'neg': 0.117, 'neu': 0.695, 'pos': 0.189, 'compound': 0.5672}",0.5672,pos
156,156,1236,2021-01-19,,"I ordered this supplement in the hope that it will help me to put my nerves in order a little during times of stress and nervous tension. But I didn't see much of a result. The pills are huge, they swallow with difficulty, I won't take any more","{'neg': 0.184, 'neu': 0.684, 'pos': 0.132, 'compound': -0.1655}",-0.1655,neg
157,157,1236,2019-01-23,"Complex B and C, but did not help with stress","Rich composition: vitamins B, C and valerian. The pills are large and worst of all are long (is it really difficult to make small round pills in the 21st century ???), and due to the fact that it is long, I was unlucky once and the tablet got stuck in the esophagus near the throat, stood across and didn’t want to go in any way, I wouldn’t wish anyone to get into such a situation. After several minutes of torment, in the end everything worked out thanks to the gag reflex. So I advise you to chew. But all this would not be so important if the tablets solved the problem for which they were bought, but alas, I do not feel any reduction in stress (anxiety). I drank 4 at first after eating - I did not feel the effect, continued to drink further 2 at a time 2 times a day - also nothing. I can advise only as a pure vitamin complex.","{'neg': 0.108, 'neu': 0.798, 'pos': 0.094, 'compound': -0.5167}",-0.5167,neg
158,158,1236,2021-08-26,,"I already buy the 2nd can, I drink in cases when I need to calm down, sometimes after the gym I can't fall asleep for a long time, an excellent remedy.","{'neg': 0.0, 'neu': 0.8, 'pos': 0.2, 'compound': 0.7184}",0.7184,pos
159,159,1236,2021-07-14,comprehend zen,"after giving birth, my nervous system just flew off the coils, unless the foam came from my mouth 😄. helped me a lot to put things right, life takes on colors. I drink with omega","{'neg': 0.059, 'neu': 0.873, 'pos': 0.068, 'compound': 0.0772}",0.0772,pos
160,160,1236,2021-06-13,,"Literally from the second day of administration, the effect of the drug was felt. I took from 1 to 2 a day, depending on the stressful situation.","{'neg': 0.13, 'neu': 0.87, 'pos': 0.0, 'compound': -0.5106}",-0.5106,neg
161,161,1236,2021-04-10,,"I liked this vitamin. I have been drinking for less than a month, but the result appeared very quickly. I drink 3 tablets a day after meals. I wash it down with a glass of water. If you take less water, it can hurt your stomach.","{'neg': 0.107, 'neu': 0.812, 'pos': 0.081, 'compound': -0.4767}",-0.4767,neg
162,162,1236,2021-04-06,Good remedy.,"It helped a lot in a very stressful situation. Already in a week of admission, the twitching of the eyelid has been removed and sleep has slightly improved. I will take it further. I recommend.","{'neg': 0.1, 'neu': 0.752, 'pos': 0.148, 'compound': 0.1813}",0.1813,pos
163,163,1236,2019-11-11,"It works, but","Too tired when you eat one or two grains are a little ... The novelty, but the smell is beyond imagination ..... The size is too big .... Sensitive people may get stressed while eating","{'neg': 0.136, 'neu': 0.864, 'pos': 0.0, 'compound': -0.6187}",-0.6187,neg
164,164,1236,2021-10-20,"The taste, smell and size were not good","The theme of the supplement, which is to supplement the nutrients that are deficient due to stress, was very good, but I gave up because the tablets were quite large, smelly and unpleasant. I was drinking a fairly large tablet now, and I thought it was about that, but it was even thicker than that. I got caught in my throat and coughed up. It's very painful and painful, the taste melts away, it makes me feel uncomfortable, and I failed it several times, so I'm sorry to give up. I would like to have a non-herb product on this theme.","{'neg': 0.214, 'neu': 0.739, 'pos': 0.047, 'compound': -0.9638}",-0.9638,neg
165,165,1236,2018-12-26,Larger (over 2 cm × 1 cm),"One more than 2 cm × 1 cm, it was too big for me. As I drank it, I was bitterly torn apart for a while, so I drink it. There are a few smells, but it is not enough to make you feel uncomfortable. Since I started drinking, I still do not know the effect, but I am expecting that it contains VB and VC and various others.","{'neg': 0.111, 'neu': 0.889, 'pos': 0.0, 'compound': -0.7096}",-0.7096,neg
