,Unnamed: 0,product_id,date_posted,review_title,review_text,scores,compound,sentiment
166,166,1236,2021-09-28,"Not an anti-stress, but a sleeping pill","I didn’t get any less nervous, but I didn’t count on such an effect. 2-3 tablets before bedtime help to fall asleep quickly and not wake up at night. The vaunted melatonin doesn't work that way. The size is, of course, gigantic.","{'neg': 0.033, 'neu': 0.885, 'pos': 0.083, 'compound': 0.4848}",0.4848,pos
167,167,1236,2023-04-23,,"Honestly, I haven't noticed any effects. I do not advise anyone","{'neg': 0.0, 'neu': 0.727, 'pos': 0.273, 'compound': 0.4588}",0.4588,pos
168,168,1236,2021-05-18,,"So far, I can not write anything about this drug. I took it to my sister, as she complained of stress and fatigue. I will definitely update my review.","{'neg': 0.233, 'neu': 0.683, 'pos': 0.084, 'compound': -0.5859}",-0.5859,neg
169,169,1236,2023-02-25,,"Unfortunately, no significant effect was seen.","{'neg': 0.489, 'neu': 0.319, 'pos': 0.191, 'compound': -0.4215}",-0.4215,neg
170,170,1236,2021-06-18,,"It's just something magical, an amazing composition. Everything you need to calm down. If you have depression, anxiety, this is for you.","{'neg': 0.183, 'neu': 0.61, 'pos': 0.207, 'compound': 0.1779}",0.1779,pos
171,171,1236,2021-06-01,,"The only pills that work as expected. The mood improved, the cases of panic disappeared, 2 tablets a day. No lethargy, no side effects.","{'neg': 0.386, 'neu': 0.514, 'pos': 0.1, 'compound': -0.7845}",-0.7845,neg
172,172,1236,2021-02-24,,The drug was prescribed by a doctor and met all expectations!,"{'neg': 0.0, 'neu': 1.0, 'pos': 0.0, 'compound': 0.0}",0.0,neu
173,173,1236,2021-02-04,,"an excellent complex, it is a pity that they quickly disassemble! it suited me very much","{'neg': 0.115, 'neu': 0.677, 'pos': 0.208, 'compound': 0.4199}",0.4199,pos
174,174,1236,2021-01-29,,"Found this remedy in search of the perfect sedative. They fit perfectly for me, I drink a course in a stressful period","{'neg': 0.115, 'neu': 0.523, 'pos': 0.362, 'compound': 0.7964}",0.7964,pos
175,175,1236,2021-01-27,,"Herbal preparation with a rich composition to normalize sleep, relieve tension and nervousness, to support the nervous system.","{'neg': 0.25, 'neu': 0.417, 'pos': 0.333, 'compound': 0.4939}",0.4939,pos
176,176,1236,2021-01-26,,Great complex. Relieves anxiety immediately. I drink myself and give to my daughter (10 years old) in stressful situations,"{'neg': 0.195, 'neu': 0.547, 'pos': 0.258, 'compound': 0.3818}",0.3818,pos
177,177,1236,2021-01-25,Excellent,Very cool natural vitamins for stress. Life becomes much easier. Better than any antidepressant,"{'neg': 0.122, 'neu': 0.394, 'pos': 0.484, 'compound': 0.8059}",0.8059,pos
178,178,1236,2021-01-25,,One of the most effective supplements my husband tried due to stressful work. No side effects were noticed.,"{'neg': 0.23, 'neu': 0.628, 'pos': 0.142, 'compound': -0.2748}",-0.2748,neg
179,179,1236,2021-01-22,Fine,"A very good work complex for stress. Rich composition, good group B. Take courses.","{'neg': 0.129, 'neu': 0.413, 'pos': 0.458, 'compound': 0.8012}",0.8012,pos
180,180,1236,2021-01-20,,"Very large pills, I had to bite through to pay. They have a good composition of vitamins and calm the nerves.","{'neg': 0.122, 'neu': 0.652, 'pos': 0.226, 'compound': 0.5267}",0.5267,pos
181,181,1236,2021-01-20,Helps,"I took it for my husband, there is an effect! Sleep improved, anxiety decreased. I recommend those who have nervous work and fatigue.","{'neg': 0.22, 'neu': 0.578, 'pos': 0.202, 'compound': 0.2714}",0.2714,pos
182,182,1236,2020-02-25,Unable to swallow capsule,"I put 1 star because of the size of the capsules. It is impossible to swallow. You can easily choke. You can chew, but I'm not sure that this is the right method of reception. Tart when chewed. I threw half the can, realizing that I can no longer suffer so. No more ordering.","{'neg': 0.26, 'neu': 0.713, 'pos': 0.028, 'compound': -0.9365}",-0.9365,neg
183,183,1236,2018-03-14,A great tool to stay in harmony with yourself and others.,"Perfectly helps to be calm, erases anxiety and sad thoughts. I recommend.","{'neg': 0.224, 'neu': 0.234, 'pos': 0.542, 'compound': 0.7783}",0.7783,pos
184,184,1236,2018-03-06,Relax,"The cumulative system, noticed that it became calmer after a week of intake","{'neg': 0.0, 'neu': 0.815, 'pos': 0.185, 'compound': 0.3612}",0.3612,pos
185,185,1236,2016-08-01,good,"Whenever I feel stress, I eat one at a time.","{'neg': 0.318, 'neu': 0.682, 'pos': 0.0, 'compound': -0.4215}",-0.4215,neg
186,186,1236,2015-10-25,Works great,A perfectly balanced hi-stress tablet. Helps with stresses. Perfectly balanced composition of tablets. An excellent product that helps manage stress. L.,"{'neg': 0.161, 'neu': 0.36, 'pos': 0.479, 'compound': 0.91}",0.91,pos
187,187,1236,2022-06-19,,A good natural stress reliever,"{'neg': 0.262, 'neu': 0.0, 'pos': 0.738, 'compound': 0.6249}",0.6249,pos
188,188,1236,2022-02-21,,Copes with stress and bad mood,"{'neg': 0.612, 'neu': 0.388, 'pos': 0.0, 'compound': -0.743}",-0.743,neg
189,189,1236,2021-10-14,,"An excellent complex for dealing with stress, I bought it for my husband, the result became noticeable after a week of taking","{'neg': 0.114, 'neu': 0.735, 'pos': 0.151, 'compound': 0.2263}",0.2263,pos
190,190,1236,2021-09-21,Excellent!,"Good ones. Calm down. I don't feel sleepy after taking it, but I sleep better at night.","{'neg': 0.0, 'neu': 0.617, 'pos': 0.383, 'compound': 0.7543}",0.7543,pos
191,191,1236,2021-08-13,,"After eating, the spirit is good, the inflammation is reduced, and the complexion is bright.","{'neg': 0.0, 'neu': 0.615, 'pos': 0.385, 'compound': 0.7579}",0.7579,pos
192,192,1236,2021-08-05,,"Working drug! Good composition, helps to calm down, relax, look at everything from the positive side) vitamins necessary for the body!","{'neg': 0.0, 'neu': 0.518, 'pos': 0.482, 'compound': 0.9311}",0.9311,pos
193,193,1236,2021-08-03,A rare combination!,"I liked the composition very much. Includes vitamins, magnesium, and herbs to calm the nervous system. Satisfied!","{'neg': 0.094, 'neu': 0.538, 'pos': 0.367, 'compound': 0.7263}",0.7263,pos
194,194,1236,2021-06-26,,"An excellent preparation for peace of mind, we drink with the whole family !!! 1 tablet an hour before bedtime and no problem falling asleep","{'neg': 0.194, 'neu': 0.566, 'pos': 0.241, 'compound': 0.5538}",0.5538,pos
195,195,1236,2021-06-12,,Began to take after stress .. take at night. While it seems to help,"{'neg': 0.16, 'neu': 0.686, 'pos': 0.154, 'compound': -0.0258}",-0.0258,neu
196,196,1236,2021-06-04,,"A good pleasant product, there is a result., It is necessary to take for a long time.","{'neg': 0.0, 'neu': 0.659, 'pos': 0.341, 'compound': 0.7351}",0.7351,pos
197,197,1236,2021-06-01,,"The product is excellent, very satisfied! I began to feel much better. The nervous system slowly began to recover. Night sleep improved. Recommend.","{'neg': 0.062, 'neu': 0.475, 'pos': 0.463, 'compound': 0.9258}",0.9258,pos
198,198,1236,2021-05-26,Excellent!,A good complex of B vitamins to restore vitality and the nervous system!,"{'neg': 0.125, 'neu': 0.417, 'pos': 0.458, 'compound': 0.68}",0.68,pos
199,199,1236,2021-05-12,,"I drink 1 tablet an hour before bedtime, it helps to fall asleep quickly. Previously, she slept anxiously, often woke up.","{'neg': 0.088, 'neu': 0.791, 'pos': 0.121, 'compound': 0.1779}",0.1779,pos
200,200,1236,2021-04-21,Excellent,Good anti-anxiety pills. The only negative is they are big. Inconvenient to drink!,"{'neg': 0.331, 'neu': 0.518, 'pos': 0.15, 'compound': -0.5411}",-0.5411,neg
201,201,1236,2021-04-10,,"I like it. I will not say that it directly tends to sleep, but it became easier to fall asleep.","{'neg': 0.0, 'neu': 0.746, 'pos': 0.254, 'compound': 0.6652}",0.6652,pos
202,202,1236,2021-04-08,Excellent!,"I ordered this complex for a nervous husband on the advice of a doctor of preventive medicine)) very rich composition, the effect is noticeable 👏","{'neg': 0.084, 'neu': 0.76, 'pos': 0.156, 'compound': 0.4201}",0.4201,pos
203,203,1236,2021-04-06,A bomb,I drink 2 tabs in the morning and I can't get through. Really became calmer and more balanced,"{'neg': 0.0, 'neu': 0.834, 'pos': 0.166, 'compound': 0.4173}",0.4173,pos
204,204,1236,2021-04-02,,Nice complex. The soothing effect is mild. The effect is noticeable only after a week.,"{'neg': 0.0, 'neu': 0.702, 'pos': 0.298, 'compound': 0.6249}",0.6249,pos
205,205,1236,2021-03-23,,The drug that helped to cope with stress and fatigue. I'm happy with the result.,"{'neg': 0.234, 'neu': 0.585, 'pos': 0.18, 'compound': -0.0258}",-0.0258,neu
206,206,1236,2021-03-07,Fine,A good anti-stress supplement! The composition is just a bomb! Many things that have a positive effect on the nervous system,"{'neg': 0.201, 'neu': 0.531, 'pos': 0.268, 'compound': 0.4184}",0.4184,pos
207,207,1236,2021-03-01,,"drank and calm, I advise everyone whose nerves are not in order","{'neg': 0.11, 'neu': 0.709, 'pos': 0.181, 'compound': 0.2263}",0.2263,pos
208,208,1236,2021-01-25,,A good complex of B vitamins plus vitamin C. Recommend,"{'neg': 0.0, 'neu': 0.397, 'pos': 0.603, 'compound': 0.765}",0.765,pos
209,209,1236,2021-01-24,,I really like these pills. They have a cumulative effect. We take a course twice a year.,"{'neg': 0.0, 'neu': 0.811, 'pos': 0.189, 'compound': 0.4201}",0.4201,pos
210,210,1236,2021-01-21,,"did not understand the action, but I hope that everything that is needed, the body has learned","{'neg': 0.0, 'neu': 0.796, 'pos': 0.204, 'compound': 0.5927}",0.5927,pos
211,211,1236,2021-01-19,Good nutritional supplements,I chose it for myself because of high stress. A nutritional supplement that supports me. Energy is created by vitamin B. Thank you.,"{'neg': 0.096, 'neu': 0.515, 'pos': 0.388, 'compound': 0.7579}",0.7579,pos
212,212,1236,2021-01-01,,"The taste of valerian is strong. Whether they help or not, I can't say with certainty, it's individual for everyone.","{'neg': 0.073, 'neu': 0.674, 'pos': 0.253, 'compound': 0.644}",0.644,pos
213,213,1236,2020-10-27,,only with these pills I save myself during reports and in very stressful situations,"{'neg': 0.202, 'neu': 0.618, 'pos': 0.18, 'compound': -0.101}",-0.101,neg
214,214,1236,2016-10-22,Is there an effect,I bought it when I heard that it would lower the stress level.,"{'neg': 0.357, 'neu': 0.643, 'pos': 0.0, 'compound': -0.6124}",-0.6124,neg
215,215,1236,2022-01-11,,It is good because it contains herbs.,"{'neg': 0.0, 'neu': 0.674, 'pos': 0.326, 'compound': 0.4404}",0.4404,pos
216,216,1236,2021-06-17,"it's okay, but…","The ingredients probably matched. But the grains were so big that I couldn't drink unless I chewed them. When I chew it, I really don't like the unique taste, so I give up on it ...","{'neg': 0.093, 'neu': 0.907, 'pos': 0.0, 'compound': -0.4736}",-0.4736,neg
217,217,1236,2021-04-25,,"It is a very good product, but it has a long-term effect. Say I stay tired the next day","{'neg': 0.193, 'neu': 0.702, 'pos': 0.105, 'compound': -0.4124}",-0.4124,neg
218,218,1236,2021-04-16,,"I take it only during stress, dulls a little, it seems ...","{'neg': 0.375, 'neu': 0.625, 'pos': 0.0, 'compound': -0.5859}",-0.5859,neg
219,219,1236,2020-12-10,,"A good selection of B vitamins and an anti-stress complex. Working version, I recommend.","{'neg': 0.0, 'neu': 0.625, 'pos': 0.375, 'compound': 0.6597}",0.6597,pos
220,220,1236,2022-08-22,,good when stressed,"{'neg': 0.381, 'neu': 0.159, 'pos': 0.46, 'compound': 0.128}",0.128,pos
221,221,1236,2021-12-05,,Relieve stress,"{'neg': 0.528, 'neu': 0.0, 'pos': 0.472, 'compound': -0.0772}",-0.0772,neg
222,222,1236,2021-01-19,,"I bought it because it is a lot of stress. It contains vitamins B and C, so you can eat it casually.","{'neg': 0.13, 'neu': 0.791, 'pos': 0.079, 'compound': -0.2732}",-0.2732,neg
223,223,1236,2022-01-11,,I don't know the effect right now.,"{'neg': 0.0, 'neu': 1.0, 'pos': 0.0, 'compound': 0.0}",0.0,neu
224,224,1236,2021-06-03,,"Excellent complex of vitamins with herbs, really liked","{'neg': 0.0, 'neu': 0.469, 'pos': 0.531, 'compound': 0.7778}",0.7778,pos
225,225,1236,2021-02-14,Sedative,"Relieves stress, the composition is gorgeous!","{'neg': 0.222, 'neu': 0.238, 'pos': 0.539, 'compound': 0.6114}",0.6114,pos
226,226,1236,2021-01-26,,"Very effective remedy, works great, I sincerely recommend it!","{'neg': 0.0, 'neu': 0.23, 'pos': 0.77, 'compound': 0.9244}",0.9244,pos
227,227,1236,2021-01-21,,"Sleep sound quality, decent composition.","{'neg': 0.0, 'neu': 1.0, 'pos': 0.0, 'compound': 0.0}",0.0,neu
228,228,1236,2019-01-01,The smell is really nasty.,"When I eat it, it smells bad enough to get out of my mouth. Even if I pick it up for a while, I smell it in my hand. And no effect on stress. No repurchase.","{'neg': 0.262, 'neu': 0.66, 'pos': 0.078, 'compound': -0.7579}",-0.7579,neg
229,229,1236,2019-11-12,I did not notice the effect,"She had too high hopes for this drug. Its action is too overestimated by users, or simply not suitable for everyone.","{'neg': 0.0, 'neu': 0.877, 'pos': 0.123, 'compound': 0.4215}",0.4215,pos
230,230,1236,2021-05-03,,Great stress reliever. I take it before bed.,"{'neg': 0.209, 'neu': 0.299, 'pos': 0.493, 'compound': 0.5859}",0.5859,pos
231,231,1236,2021-04-12,,The best non-addictive stress reliever for me,"{'neg': 0.207, 'neu': 0.296, 'pos': 0.496, 'compound': 0.5994}",0.5994,pos
232,232,1236,2021-02-13,,"Super complex, everything is profitable and works","{'neg': 0.0, 'neu': 0.424, 'pos': 0.576, 'compound': 0.7783}",0.7783,pos
233,233,1236,2021-02-11,,excellent supplement for stress relief.,"{'neg': 0.241, 'neu': 0.172, 'pos': 0.586, 'compound': 0.6124}",0.6124,pos
234,234,1236,2021-01-23,,Eating it seems to soften my mind a little.,"{'neg': 0.0, 'neu': 1.0, 'pos': 0.0, 'compound': 0.0}",0.0,neu
235,235,1236,2020-12-10,Excellent!,They really calm down and treat insomnia.,"{'neg': 0.0, 'neu': 0.486, 'pos': 0.514, 'compound': 0.6478}",0.6478,pos
236,236,1236,2017-09-02,Excellent,"Use it from time to time
Relieves nerves","{'neg': 0.141, 'neu': 0.606, 'pos': 0.253, 'compound': 0.2732}",0.2732,pos
237,237,1236,2021-06-25,Super,Very soothing,"{'neg': 0.0, 'neu': 0.278, 'pos': 0.722, 'compound': 0.3804}",0.3804,pos
238,238,1236,2021-06-16,,good stress complex,"{'neg': 0.418, 'neu': 0.149, 'pos': 0.433, 'compound': 0.0258}",0.0258,neu
239,239,1236,2021-05-10,,"Works great, good sleep","{'neg': 0.0, 'neu': 0.222, 'pos': 0.778, 'compound': 0.7906}",0.7906,pos
240,240,1236,2021-04-17,,Recommend!!!,"{'neg': 0.0, 'neu': 0.0, 'pos': 1.0, 'compound': 0.5229}",0.5229,pos
241,241,1236,2021-01-31,Good Composition,Husband drank at work,"{'neg': 0.0, 'neu': 1.0, 'pos': 0.0, 'compound': 0.0}",0.0,neu
242,242,1236,2021-01-27,,Quality product.,"{'neg': 0.0, 'neu': 1.0, 'pos': 0.0, 'compound': 0.0}",0.0,neu
243,243,1236,2021-01-21,Herbal Composition,Helps with stress!,"{'neg': 0.462, 'neu': 0.149, 'pos': 0.389, 'compound': -0.126}",-0.126,neg
244,244,1236,2020-03-18,No feeling,The particles are too big and not suitable for Asians to swallow,"{'neg': 0.0, 'neu': 1.0, 'pos': 0.0, 'compound': 0.0}",0.0,neu
245,245,1236,2021-08-27,,Not that much... it's a rip off.,"{'neg': 0.0, 'neu': 1.0, 'pos': 0.0, 'compound': 0.0}",0.0,neu
246,246,1236,2021-04-20,,Contains a lot of herbs,"{'neg': 0.0, 'neu': 1.0, 'pos': 0.0, 'compound': 0.0}",0.0,neu
