,Unnamed: 0,product_id,date_posted,review_title,review_text,scores,compound,sentiment
162,162,143354,2013-12-28,really helps ,"i've been suffering from lack of sleep for years couldnt sleep more then 4-5 hours and it took me at leasr an hour of tossing and turning to fall asleep and i always woke up with a head that is about to expload 
deep sleep solved the problem from the second night 
take one about 45 minutes before bed and another one at bed works like magic 
and if you have a really bad night and you wake up take another one
it defiantly works","{'neg': 0.129, 'neu': 0.822, 'pos': 0.05, 'compound': -0.807}",-0.807,neg
163,163,143354,2009-09-25,deep sleep herbal medicine,"It use to take me anywhere from 20 minutes to an hour to fall asleep, and sometimes it would be a couple of hours. I would toss and turn and watch the clock. Now with deep sleep herbal medicine, I fall asleep so quickly, within minutes. If I wake up during the night I quickly go back to sleep. This has been the best rested sleep I have ever had.  I will continue to take then and reorder when out.","{'neg': 0.0, 'neu': 0.945, 'pos': 0.055, 'compound': 0.6369}",0.6369,pos
164,164,143354,2009-09-07,Deep Sleep,"After not sleeping past 3:00 a.m. for a good six months, my daughter recommended that I try this product.  The second night, I slept until 5:00 a.m. and have done so ever since.  I have to think it is the Deep Sleep that did it for me.","{'neg': 0.0, 'neu': 0.897, 'pos': 0.103, 'compound': 0.5719}",0.5719,pos
165,165,143354,2009-06-26,Sleeping well at long last--after 20 years of insomnia!,"Deep Sleep worked like a charm from night#1.  I take 2 caps at bedtime and they last for up to six-eight hours.  If I wake up again and cannot go back to sleep, which happens from time to time, I take one more cap & read a bit--then I am good for another 2-4 hours rest or more.  I am obese, so taking the larger dose works for me with no side effects.","{'neg': 0.031, 'neu': 0.853, 'pos': 0.115, 'compound': 0.7096}",0.7096,pos
166,166,143354,2022-09-13,,"ordered from Australia shipping was done on the day order was placed my wife has been taking for a week great results will be doing a repeat order in a month's time
Terry","{'neg': 0.0, 'neu': 0.876, 'pos': 0.124, 'compound': 0.6249}",0.6249,pos
167,167,143354,2021-11-20,,My husband and me we have insomnia hard to sleep and this helps us some days others no but now our sleep is more  regulate. We combined with walking and melisa tee everyday. Now we sleep longer and better.,"{'neg': 0.064, 'neu': 0.802, 'pos': 0.134, 'compound': 0.6187}",0.6187,pos
168,168,143354,2023-07-20,,"It had no effect on me.  Plus, my stomach hurts every time I take it.  I gave it to my wife to try and it burned her stomach.  I definitely do not recommend.","{'neg': 0.205, 'neu': 0.72, 'pos': 0.075, 'compound': -0.5733}",-0.5733,neg
169,169,143354,2023-06-02,,These did not do anything for me. Made me feel a tiny bit heavy/drowsy for a little bit but did not help me fall asleep or stay asleep.  ,"{'neg': 0.104, 'neu': 0.896, 'pos': 0.0, 'compound': -0.438}",-0.438,neg
170,170,143354,2022-10-20,,Deep Sleep seemed to work best the first month and as time went on it has become less effective.  I continue to take it as directed and hope it will work,"{'neg': 0.0, 'neu': 0.732, 'pos': 0.268, 'compound': 0.8722}",0.8722,pos
171,171,143354,2021-10-12,Works really well,"This helps me sleep better than most sleep supplements, I've tried. I can't do melatonin which is in so many sleep supplements. I do feel a bit more drowsy during the day if I take this, so it does have lingering effects unlike what the label says. But it's better than not getting sleep!","{'neg': 0.0, 'neu': 0.856, 'pos': 0.144, 'compound': 0.784}",0.784,pos
172,172,143354,2021-06-23,Großartig!,"I have started taking these soft gels after having used a trusted brand of powdered capsules, and find Deep Sleep superior. The directions are to take one gel an hour before bed, and a second at bedtime. The results for me have been very positive. I fall to sleep faster and have a more sound sleep during the night. And the following day I feel fresher, with more balanced energy from what must be better quality sleep.","{'neg': 0.0, 'neu': 0.807, 'pos': 0.193, 'compound': 0.941}",0.941,pos
173,173,143354,2021-05-30,,"FOR ME this product is MORE THAN 5 stars. I have ordered it plenty of times and it works as a GREAT SLEEP AID. As an herbal product I knew what I was ordering and not comparing it to over the counter sleep aids. I LOVE THIS PRODUCT, and it's formulation of herbs used.  Will be ordering 120 quantity soon. ","{'neg': 0.0, 'neu': 0.842, 'pos': 0.158, 'compound': 0.8949}",0.8949,pos
174,174,143354,2012-01-11,It Works!,"I have had difficulty going to sleep for awhile & have tried many 'remedies', so, I decided to give this a try based in the reviews I read, and - IT WORKS !@!  I was surprised & was ready to see my Dr. regarding 'no sleep', but this product REALLY helps me go to sleep & stay asleep.  .  I 'heartily' recommend it!","{'neg': 0.054, 'neu': 0.747, 'pos': 0.199, 'compound': 0.874}",0.874,pos
175,175,143354,2010-10-05,Rockin Deep Sleep,"We've been using this product for a while now and it's great.  I was gone on a trip this last week and left without it and noticed a difference in the amount of time it takes to fall asleep, so I will try to remember it next time.  Nice to know that I didn't experience any withdrawal symptoms either.  ","{'neg': 0.019, 'neu': 0.862, 'pos': 0.119, 'compound': 0.7799}",0.7799,pos
176,176,143354,2010-05-18,From A toZZZZZZZZZZZ......,I am a Type A person who is always on the go. Come bedtime its tough to wind down and get to sleep. But since taking Deep Sleep I have been experienced the best sleep in a long time. I used to rely on diphenhydramine which long term effects cause chaos in the body. But now with the Deep Sleep natural products doing their thing. I will never resort to anything but Deep Sleep again.,"{'neg': 0.079, 'neu': 0.807, 'pos': 0.114, 'compound': 0.5789}",0.5789,pos
177,177,143354,2010-02-22,Good stuff,"I love this product. All-natural herbs, and most important to me is theres no Melatonin. Melatonin I find puts me in a funk the next day. I got my order speedy and at the lowest price. Its none habit forming, and helps you obtain/maintain a healthy sleep cycle. I would definately refer iHerb and this product.","{'neg': 0.079, 'neu': 0.729, 'pos': 0.192, 'compound': 0.7778}",0.7778,pos
178,178,143354,2009-11-13,Seems to be working so far,"I've been taking deep sleep for the past couple of days. I first started taking just one tablet at night which I noticed had an affect, but last night I took the recommended two tablets and it seemed to work even better.
I thought at first maybe it was just a placebo effect and that's why I was sleeping better. But by reading some of the other reviews here and by my own experience, it definately seems to be working.","{'neg': 0.0, 'neu': 0.878, 'pos': 0.122, 'compound': 0.872}",0.872,pos
179,179,143354,2023-09-08,,My husband use it as a melatonin for good sleep with herbal ingredients ,"{'neg': 0.0, 'neu': 0.791, 'pos': 0.209, 'compound': 0.4404}",0.4404,pos
180,180,143354,2023-07-23,لا بأس,like to use the size nicr quality please like my com,"{'neg': 0.0, 'neu': 0.523, 'pos': 0.477, 'compound': 0.743}",0.743,pos
181,181,143354,2023-04-09,,I haven't noticed a difference yet but I'm going to keep taking it until the bottle is empty.,"{'neg': 0.128, 'neu': 0.872, 'pos': 0.0, 'compound': -0.296}",-0.296,neg
182,182,143354,2023-03-10,,Did not work great for me. Will not buy again.,"{'neg': 0.268, 'neu': 0.732, 'pos': 0.0, 'compound': -0.5096}",-0.5096,neg
183,183,143354,2023-03-06,,I was hoping for a deeper sleep with this product.... but it did not work for me unfortunately. ,"{'neg': 0.163, 'neu': 0.737, 'pos': 0.1, 'compound': -0.296}",-0.296,neg
184,184,143354,2022-09-19, super sleep aide!,This product really works. It helps you relax and fall asleep  and if you wake to go to the bathroom  you can go back to sleep much easier. ,"{'neg': 0.0, 'neu': 0.745, 'pos': 0.255, 'compound': 0.8207}",0.8207,pos
185,185,143354,2021-04-02,,"This is one of the very few supplements that work for me to help me sleep. I was skeptical after trying so many others, but my Dad said it worked for him and voila! It did. I recommend it and the ingredients are wholesome and no toxic additives.","{'neg': 0.086, 'neu': 0.81, 'pos': 0.104, 'compound': 0.2363}",0.2363,pos
186,186,143354,2021-01-22,"Great product, really help me with insomnia","I have been dealing with a very bad bout of anxiety/insomnia cycle. Other herbal sleep aids didn't do much (valerian, passionflower) but this product cut my time to fall asleep in half (a manageable level) and gives me a mellow sedation feeling which allows me to sleep deeply until waking.  Please keep carrying this product! ","{'neg': 0.086, 'neu': 0.821, 'pos': 0.092, 'compound': 0.0877}",0.0877,pos
187,187,143354,2021-01-03,,"I don't really know if this product is what helping me sleep, but it may be the reason why my sleep has been much better over the last couple of weeks. I need to know if I have to take it every night, or whether I only take it during times of stress when I am not sleeping well.","{'neg': 0.096, 'neu': 0.815, 'pos': 0.089, 'compound': -0.1207}",-0.1207,neg
188,188,143354,2020-12-08,,"The product is great because it doesnt have any of the usual iffy things like melatonin and trytophan.  It really works. The only down side is the difficulty in getting this product in Canada, and the price.  I will still get it as long as I can afford to, though.","{'neg': 0.044, 'neu': 0.833, 'pos': 0.122, 'compound': 0.6369}",0.6369,pos
189,189,143354,2020-09-27,Works when softgel is crushed,they didnt work for me until I crushed them in the mouth . Now I cant sleep without them and I have literally tried everything under the sun for insomnia.,"{'neg': 0.101, 'neu': 0.899, 'pos': 0.0, 'compound': -0.4215}",-0.4215,neg
190,190,143354,2020-08-17,Great product for me!,Have been using this for a while now and it really seems to help get me to sleep and keep me there. I also use a little melatonin.,"{'neg': 0.0, 'neu': 0.89, 'pos': 0.11, 'compound': 0.4522}",0.4522,pos
191,191,143354,2020-06-19,Herbal Sleep Aid,The combination of various herbs is effective in this products. Also drinking some Chamommile tea before taking the pills helps with falling asleep. Good product!,"{'neg': 0.051, 'neu': 0.667, 'pos': 0.282, 'compound': 0.807}",0.807,pos
192,192,143354,2018-04-03,this Product is the best in my Life.,"having lots of trouble falling a sleep,getting of Sleeping Tablets,This Product lets you feel calm and gives you a good Night sleep.tried many different ones,but been taking this one for a Year and very happy about it.xxx","{'neg': 0.101, 'neu': 0.682, 'pos': 0.216, 'compound': 0.7089}",0.7089,pos
193,193,143354,2018-02-11,great product,"I do not awake in the middle of the night anymore.  Yet I'm not groggy in the morning either.  I rate this product ""thumbs up!""","{'neg': 0.0, 'neu': 1.0, 'pos': 0.0, 'compound': 0.0}",0.0,neu
194,194,143354,2017-12-19,Deep Sleep really works,I've never had success with herbal sleep products - until I tried Sleep Herbs.  I fall asleep easily so easily now and wake up with no residue grogginess. Highly recommended!,"{'neg': 0.151, 'neu': 0.64, 'pos': 0.209, 'compound': 0.2469}",0.2469,pos
195,195,143354,2017-05-01,Sleep,"This product is an essential part of my regemin to help me sleep. Sleeping has been a real problem for many years, due to my MS. But this product helps tremendously. It is essential. Than k you.","{'neg': 0.047, 'neu': 0.818, 'pos': 0.134, 'compound': 0.5267}",0.5267,pos
196,196,143354,2015-06-04,Deep Sleep,"This is the best product on the market. I even shared my info with my doctor (who is holistic,along with medical) he has shared the info with another patient and they love it also. I cannot rave enough on how well this product works ","{'neg': 0.0, 'neu': 0.707, 'pos': 0.293, 'compound': 0.936}",0.936,pos
197,197,143354,2013-10-11,Getting Sleep,I have found Deep Sleep helpful in falling asleep  and staying asleep. I wake up alert-no grogginess.  My only concern is that my two sister cats do very crazy things to wake me up in the morning!,"{'neg': 0.116, 'neu': 0.812, 'pos': 0.071, 'compound': -0.1986}",-0.1986,neg
198,198,143354,2011-02-08,"Herbs, ETC, Deep Sleep",I've used this product for a few years now.  I like it because there are no side effects.  They just calm me down and relax me so that I can go to sleep.,"{'neg': 0.061, 'neu': 0.724, 'pos': 0.214, 'compound': 0.6705}",0.6705,pos
199,199,143354,2011-01-14,Sleep tite each night,Deep Sleep has helped me tremendously to get a good nights sleep without any ill effects come morning that prescription drugs have a tendency to do.  Really great product.  I highly recommend it.,"{'neg': 0.0, 'neu': 0.672, 'pos': 0.328, 'compound': 0.9132}",0.9132,pos
200,200,143354,2010-10-06,Deep sleep...still hoping,"After discovering Deep Sleep at a local co-op grocer, and trying the overly expensive five-six day ""travel"" package, I was hopeful.  Purchased a couple of  ""bottles"" from iHerb and am now well into my second week of daily usage.  I'm a hard case - tried everything.  Fall asleep without any problem but wake sometimes as soon as one hour later.  Deep Sleep seems to help and do give it some time - I believe I am sleeping better as time goes on.  We'll see...","{'neg': 0.014, 'neu': 0.834, 'pos': 0.152, 'compound': 0.8892}",0.8892,pos
201,201,143354,2022-10-05,,It helps me sleep better at night. I have been using this for years.,"{'neg': 0.0, 'neu': 0.667, 'pos': 0.333, 'compound': 0.6705}",0.6705,pos
202,202,143354,2022-09-13,,"Better sleep than ever , i take it 1 hour before going to bed. Deep sleep.","{'neg': 0.0, 'neu': 0.805, 'pos': 0.195, 'compound': 0.4404}",0.4404,pos
203,203,143354,2022-09-13,,"After taking it for one hour, I fell asleep right away. The result is very good.","{'neg': 0.0, 'neu': 0.814, 'pos': 0.186, 'compound': 0.4927}",0.4927,pos
204,204,143354,2022-07-22,,"It's a great herbal supplement. I highly recommend this product. Thank you, iherb.","{'neg': 0.0, 'neu': 0.46, 'pos': 0.54, 'compound': 0.8553}",0.8553,pos
205,205,143354,2022-07-16,,I have finally found the right product to help with my insomnia!,"{'neg': 0.0, 'neu': 0.77, 'pos': 0.23, 'compound': 0.4574}",0.4574,pos
206,206,143354,2022-05-16,,Been using this for years but I only take one pill before bedtime. Also buying for the elderly who prefer this than sleeping pills ,"{'neg': 0.0, 'neu': 1.0, 'pos': 0.0, 'compound': 0.0}",0.0,neu
207,207,143354,2022-02-21,Deep Sleep,Have been using it for years. Dosage varies based on personal stress levels. Always solid quality. Well balanced herbal ingredients. Reliable sleep aid.,"{'neg': 0.106, 'neu': 0.755, 'pos': 0.14, 'compound': -0.0258}",-0.0258,neu
208,208,143354,2021-12-06,,The ingredients and dosage are benefit to fall asleep quick. ,"{'neg': 0.0, 'neu': 0.75, 'pos': 0.25, 'compound': 0.4588}",0.4588,pos
209,209,143354,2021-09-02,,I've been using it for the past few days and it works like a charm. Puts you off like a light. No grogginess in the morning .    ,"{'neg': 0.074, 'neu': 0.669, 'pos': 0.258, 'compound': 0.6705}",0.6705,pos
210,210,143354,2021-03-19,Works!,"My husband and I love Deep Sleep, whether travelling or to get a sound night’s sleep at home. The best formula we have tried!","{'neg': 0.0, 'neu': 0.697, 'pos': 0.303, 'compound': 0.8655}",0.8655,pos
211,211,143354,2019-08-27,Best product I have tried so far,"Love this product. It is highly efficient. I take 2 pills 30 minutes before bed and practice good sleep habit (low lights, phone and computer off) and it works perfectly for me. I strongly recommend.","{'neg': 0.0, 'neu': 0.578, 'pos': 0.422, 'compound': 0.9583}",0.9583,pos
212,212,143354,2017-05-24,Good sleep,I take it as the instruction told for my European trip. Because of time zone  difference. Good to have deep sleep during my trip. Better than Jarrow formula . ,"{'neg': 0.0, 'neu': 0.812, 'pos': 0.188, 'compound': 0.7003}",0.7003,pos
213,213,143354,2013-01-09,awesome,great product. really helps you get to sleep and stay asleep. wake refreshed. rather expensive though but worth it. i'm ordering my second bottle.,"{'neg': 0.0, 'neu': 0.754, 'pos': 0.246, 'compound': 0.7047}",0.7047,pos
214,214,143354,2010-11-29,sleep aide,"This product does what it says.  Both my husband and I ordered this and started taking it a few weeks ago and are pleased with the results.  I have difficulty staying asleep, my husband with falling asleep - both of us are sleeping much better now!","{'neg': 0.083, 'neu': 0.79, 'pos': 0.127, 'compound': 0.4753}",0.4753,pos
215,215,143354,2010-08-04,Works,This stuff works pretty well. Its not a narcotic though. It won't put you to sleep. But if you use it regularly it helps immensely. But you do have to use it every night. No groggy morning side effects. It just helps you sleep. ,"{'neg': 0.055, 'neu': 0.741, 'pos': 0.204, 'compound': 0.7684}",0.7684,pos
216,216,143354,2009-12-14,Sleep Problems,I found this to be a great product. It makes me drowsy and puts me to sleep without having to use all those prescription pills which are so bad for you and your wallet.  I think I will stick to Deep Sleep.  It works and it's economical. ,"{'neg': 0.091, 'neu': 0.827, 'pos': 0.083, 'compound': -0.1005}",-0.1005,neg
217,217,143354,2009-11-17,Really works....zzzzzzzzzzzzzzzzz,I have been under a great deal of stress at work. Your Deep Sleep herbs work better than a prescription given to me by my doctor.,"{'neg': 0.094, 'neu': 0.671, 'pos': 0.235, 'compound': 0.6369}",0.6369,pos
218,218,143354,2009-11-10,A great product,"I have been taking Deep Sleep for over two years now. A realy great, safe sleep aid. Wake up well rested and alert.
Thank you.","{'neg': 0.0, 'neu': 0.566, 'pos': 0.434, 'compound': 0.9153}",0.9153,pos
219,219,143354,2009-09-23,Deep Sleep gels,"It is perhaps more potent than I would wish, and lasts into the next day, as a feeling of drowsiness or being less alert than I wish.
If I use it intermittently it doesn't have that effect.
","{'neg': 0.0, 'neu': 0.767, 'pos': 0.233, 'compound': 0.7787}",0.7787,pos
220,220,143354,2009-06-01,excellent sleep aid,"My husband has always complained about his inability to sleep.  Deep Sleep has changed that.  He now gets a great night sleep with no ""hangover"".","{'neg': 0.24, 'neu': 0.631, 'pos': 0.129, 'compound': -0.3612}",-0.3612,neg
221,221,143354,2022-06-17,,"Very helpful, good combination of ingredients. Works better that many other similar products.","{'neg': 0.0, 'neu': 0.522, 'pos': 0.478, 'compound': 0.847}",0.847,pos
222,222,143354,2022-01-28,,"Takes a while for them to kick in.
Still worth the time, good sound sleep.","{'neg': 0.0, 'neu': 0.714, 'pos': 0.286, 'compound': 0.5859}",0.5859,pos
223,223,143354,2021-10-21,,"It didn't do a lot for me but that's just me, it seems like it's a good purchase.","{'neg': 0.0, 'neu': 0.664, 'pos': 0.336, 'compound': 0.7964}",0.7964,pos
224,224,143354,2021-01-24,Not perfect,"Desperate move to try & get some sleep after months of sleeplessness (might drift for an hour or two).  Tried Deep Sleep ... Not perfect, will send me off to sleep for an our or two, then I wake & try again ... Not difficult to return to sleep ... Wake again after a couple of hours.  After that no luck.  Usually I'm up having breakfast at 4.30 a.m. & that's it.  But at least I get some sleep!","{'neg': 0.094, 'neu': 0.86, 'pos': 0.046, 'compound': -0.4188}",-0.4188,neg
225,225,143354,2012-05-09,Amazing !!!!,"I had sleeping problem 15 years. 
I think I had try almost every product. Herb, Chinese
Herb, pill.... But  didn't work.
So I'm very suprise does work very well this "" DEEP SLEEP"" please try it. You can understand, what I talking about. You can get just like kids time sleep..","{'neg': 0.035, 'neu': 0.79, 'pos': 0.175, 'compound': 0.8146}",0.8146,pos
226,226,143354,2023-09-03,,It’s really smelly and didn’t help me very much ,"{'neg': 0.0, 'neu': 0.748, 'pos': 0.252, 'compound': 0.4019}",0.4019,pos
227,227,143354,2023-06-18,,Doesn’t work for me.  I feel more awake after taking it. ,"{'neg': 0.0, 'neu': 1.0, 'pos': 0.0, 'compound': 0.0}",0.0,neu
228,228,143354,2023-03-29,,Did not notice any special effect and it didn't improve my sleep sadly.,"{'neg': 0.427, 'neu': 0.573, 'pos': 0.0, 'compound': -0.7553}",-0.7553,neg
229,229,143354,2023-03-23,,I was disappointed in this product. Experienced headaches for 3 days straight and it was not effective at all. ,"{'neg': 0.262, 'neu': 0.65, 'pos': 0.088, 'compound': -0.5795}",-0.5795,neg
230,230,143354,2021-02-04,,"I always trust iherb due to its fast delivery and high quality products. I purchase grocery and supplements in iherb almost every 2 weeks in average. This product is not as effective as melatonin, but more natural.","{'neg': 0.046, 'neu': 0.803, 'pos': 0.151, 'compound': 0.6203}",0.6203,pos
231,231,143354,2011-11-27,Improved sleep,"I have many health issues that interfere with sound sleep so I may not be typical of the average person in need of a sleep aid. This product has improved my ability to sleep, but it has not been as effective as I'd hoped.","{'neg': 0.07, 'neu': 0.78, 'pos': 0.15, 'compound': 0.4155}",0.4155,pos
232,232,143354,2011-11-04,effective,Definite relaxing and sleep-inducing effects. I leave out the 5th star because I still hope for something that delivers a more refreshing and long-lasting sleep. But still one of the best products I've experienced. Combines well with phenibut.,"{'neg': 0.025, 'neu': 0.657, 'pos': 0.318, 'compound': 0.9178}",0.9178,pos
233,233,143354,2021-11-07,,"after taking the first night i an sleep but the whole of the following week, my heart keeps on beating fast and i cannot sleep so i stop","{'neg': 0.253, 'neu': 0.747, 'pos': 0.0, 'compound': -0.8316}",-0.8316,neg
234,234,143354,2010-02-02,Deepsleep,"This product relaxes me, helps me get back to sleep after awakening, but does not put me to sleep or keep me from waking up frequently.  The good news is it doesn't make me groggy or have any adverse side effects.","{'neg': 0.068, 'neu': 0.776, 'pos': 0.155, 'compound': 0.4854}",0.4854,pos
235,235,143354,2021-04-05,,"Ive been an insomniac for 20 years, worked w many drs trying to manage it and nothing helped consistently.   This does!","{'neg': 0.0, 'neu': 1.0, 'pos': 0.0, 'compound': 0.0}",0.0,neu
236,236,143354,2020-05-14,Deep Sleep,I have been using Deep Sleep for a few years. It helps my mind shut down and I can get a restful nights sleep. ,"{'neg': 0.0, 'neu': 0.779, 'pos': 0.221, 'compound': 0.6249}",0.6249,pos
237,237,143354,2019-11-05,Sleep finally,"After years of searching for something to help me sleep I finally found this amazing product. 
I just love it. ","{'neg': 0.0, 'neu': 0.568, 'pos': 0.432, 'compound': 0.9081}",0.9081,pos
238,238,143354,2019-07-22,I would definitely recommend ,"I have been taking this in combination with magnesium glycinate, potent B complex and it does make a difference and helps !","{'neg': 0.0, 'neu': 0.855, 'pos': 0.145, 'compound': 0.4389}",0.4389,pos
239,239,143354,2017-08-14,deep sleep ,I looked forward to this product to arrive; but it just doesn't work for me. I am awake more than asleep. It seems to have an opposite affect on me as many over-the-counter sleep aids do. No Deep Sleep for me! I am pleased with other products I've ordered.,"{'neg': 0.055, 'neu': 0.864, 'pos': 0.081, 'compound': 0.3274}",0.3274,pos
240,240,143354,2017-03-20,Helps with sleep,I've been using deep sleep for a couple of years now. It definitely helps my quality of sleep. I recommend it. ,"{'neg': 0.0, 'neu': 0.672, 'pos': 0.328, 'compound': 0.7783}",0.7783,pos
241,241,143354,2015-12-16,Deep Sleep NOT,I have used this product according to the label as well as taking 2 gels together prior to sleeping for the past week to no avail. I really wanted it to work but I cannot notice any benefit from it as I am still waking up two times per night and am unable to sleep deeply throughout the night.,"{'neg': 0.084, 'neu': 0.889, 'pos': 0.027, 'compound': -0.5057}",-0.5057,neg
242,242,143354,2009-04-27,Review,This is a fantastic sleep aid and also for reducing my muscle spasms. (I am paraplegic),"{'neg': 0.0, 'neu': 0.795, 'pos': 0.205, 'compound': 0.5574}",0.5574,pos
243,243,143354,2022-03-26,,"Been using for years, one does the trick.","{'neg': 0.146, 'neu': 0.854, 'pos': 0.0, 'compound': -0.0516}",-0.0516,neg
244,244,143354,2022-03-09,,"Great product, works well for me.","{'neg': 0.0, 'neu': 0.392, 'pos': 0.608, 'compound': 0.7351}",0.7351,pos
245,245,143354,2022-01-20,DeepSleep,great product.  I slept so much better,"{'neg': 0.0, 'neu': 0.355, 'pos': 0.645, 'compound': 0.8062}",0.8062,pos
246,246,143354,2021-12-09,,"love deep sleep, it works really well!","{'neg': 0.0, 'neu': 0.421, 'pos': 0.579, 'compound': 0.7836}",0.7836,pos
247,247,143354,2010-11-20,Allergy,"I have used this product very happily for a couple of years.  I recently opened a new bottle and began experiencing an allergic reaction.  I wonder if the formulation has recently changed.  Unfortunately, I can no longer use Deep Sleep.  ","{'neg': 0.167, 'neu': 0.737, 'pos': 0.096, 'compound': -0.228}",-0.228,neg
248,248,143354,2021-05-22,,This stuff really works .  Nothing much else works.  I go out like a light and no aftereffects the next morning.,"{'neg': 0.106, 'neu': 0.773, 'pos': 0.121, 'compound': 0.0772}",0.0772,pos
249,249,143354,2021-05-17,,using them since quite a while. no dissiness and no bad mornings...,"{'neg': 0.514, 'neu': 0.486, 'pos': 0.0, 'compound': -0.8155}",-0.8155,neg
