,Unnamed: 0,product_id,date_posted,review_title,review_text,scores,compound,sentiment
360,360,143354,2024-03-04,,Quality product at an affordable price. Suitable for any age. An effective formula.,"{'neg': 0.0, 'neu': 0.795, 'pos': 0.205, 'compound': 0.4767}",0.4767,pos
361,361,143354,2024-03-04,,Quality product at an affordable price. Suitable for any age. An effective formula.,"{'neg': 0.0, 'neu': 0.795, 'pos': 0.205, 'compound': 0.4767}",0.4767,pos
362,362,143354,2024-02-13,very good,"My family trusts me very much, the quality is good, the brand is big and trustworthy.","{'neg': 0.0, 'neu': 0.575, 'pos': 0.425, 'compound': 0.8625}",0.8625,pos
363,363,143354,2024-01-17,Excellent!,Take one pill before going to bed and you will be able to sleep deeply.,"{'neg': 0.0, 'neu': 1.0, 'pos': 0.0, 'compound': 0.0}",0.0,neu
364,364,143354,2024-01-09,,very good drug I really recommend it to everyone very good drug I recommend it to everyone,"{'neg': 0.0, 'neu': 0.479, 'pos': 0.521, 'compound': 0.8995}",0.8995,pos
365,365,143354,2023-12-20,nice,"good hypnotic, 1 tablet 30-40 minutes before bedtime is enough. bought on the recommendation of a family doctor","{'neg': 0.0, 'neu': 0.838, 'pos': 0.162, 'compound': 0.4404}",0.4404,pos
366,366,143354,2023-12-18,Favors for light sleepers,"The quality is very good. I often wake up easily throughout the night. When this happens, taking one pill will make me feel better!","{'neg': 0.0, 'neu': 0.695, 'pos': 0.305, 'compound': 0.831}",0.831,pos
367,367,143354,2023-12-08,,High quality popular product. Natural ingredients and good composition. Suitable for any age. Reliable packaging. I recommend to all.,"{'neg': 0.0, 'neu': 0.567, 'pos': 0.433, 'compound': 0.8658}",0.8658,pos
368,368,143354,2023-11-18,,"I’ve only been using it for a few days, but I think I’m already seeing good results.","{'neg': 0.0, 'neu': 0.784, 'pos': 0.216, 'compound': 0.5927}",0.5927,pos
369,369,143354,2023-11-11,I fall asleep differently,Very good for me. I can sleep better now. Repeat is confirmed.,"{'neg': 0.0, 'neu': 0.596, 'pos': 0.404, 'compound': 0.7264}",0.7264,pos
370,370,143354,2023-11-02,It works,This product has helped me fall asleep in two moments in my life when I have had very bad insomnia.,"{'neg': 0.174, 'neu': 0.826, 'pos': 0.0, 'compound': -0.5849}",-0.5849,neg
371,371,143354,2023-07-15,,"I have suffered from severe insomnia recently, and I have not fallen asleep for more than 48 hours. After taking it for two days, it will be effective, and I can finally sleep💤","{'neg': 0.157, 'neu': 0.703, 'pos': 0.141, 'compound': -0.1506}",-0.1506,neg
372,372,143354,2023-05-17,,"Do not expect miracles that will act instantly or for all 7-8 hours. but it has a mild effect and a smooth, somewhat faster falling asleep","{'neg': 0.061, 'neu': 0.939, 'pos': 0.0, 'compound': -0.1236}",-0.1236,neg
373,373,143354,2023-05-02,improve sleep quality,"The first impression is that it stinks! was. I thought it was okay, but from the first day, I could see that the quality of my sleep had improved. Waking up to the bathroom in the middle of the night is the same as sleeping time, but the feeling when you wake up in the morning is different. The smell is still the same, but there is no particular hindrance to drinking. I will continue drinking for a while.","{'neg': 0.092, 'neu': 0.801, 'pos': 0.107, 'compound': -0.088}",-0.088,neg
374,374,143354,2024-09-05,,"Light herbal sleeping pill. Calms, normalizes sleep. Not a bad composition. The next day you do not feel sleepy and tired. ","{'neg': 0.116, 'neu': 0.679, 'pos': 0.206, 'compound': 0.3071}",0.3071,pos
375,375,143354,2023-10-19,Good,"After eating it for 2 times, there is no special hope for a good reaction.","{'neg': 0.112, 'neu': 0.457, 'pos': 0.431, 'compound': 0.743}",0.743,pos
376,376,143354,2023-10-07,I liked it,"High quality, natural ingredients, suitable for ages 18 and up, high-quality packaging, advantage - bioavailability, composition - natural, bought to improve the functionality of the body, as well as as a supplement to the diet. Medium size, for skin and hair problems, for better heart function","{'neg': 0.05, 'neu': 0.672, 'pos': 0.278, 'compound': 0.8807}",0.8807,pos
377,377,143354,2023-10-04,works great,"This is not the first time I order for my husband, it helps him. sleeps well at night, even if he wakes up in the middle of the night, then falls back to sleep easily","{'neg': 0.0, 'neu': 0.814, 'pos': 0.186, 'compound': 0.7269}",0.7269,pos
378,378,143354,2023-07-25,Great! Great!,"very good capsules! easy to swallow, easy to fall asleep, sound sleep, but no drowsiness in the morning. I take it not for the first time. For those who have insomnia, I recommend it.","{'neg': 0.071, 'neu': 0.682, 'pos': 0.248, 'compound': 0.7186}",0.7186,pos
379,379,143354,2023-07-05,,"I ordered it for my daughter because she suffers from sleep problems, and I had asked her for many products to no avail, but since I used it, she fell asleep easily","{'neg': 0.164, 'neu': 0.744, 'pos': 0.092, 'compound': -0.1027}",-0.1027,neg
380,380,143354,2023-06-24,,"Great quality, ingredients that really work, the dose is great, benefit to get back my quality of sleep, tasteless and size easy to swallow, I recommend!","{'neg': 0.0, 'neu': 0.542, 'pos': 0.458, 'compound': 0.9508}",0.9508,pos
381,381,143354,2023-01-10,,"Very wonderful to use, easy to smell, suitable size, suitable quality, great packaging, excellent age, suitable for all, unique formula, awesome benefit, non-sensitive, proper hydration, suitable nutrition, very cheap and suitable for the effect","{'neg': 0.0, 'neu': 0.562, 'pos': 0.438, 'compound': 0.9712}",0.9712,pos
382,382,143354,2023-01-02,,"A beautiful and useful product for the health and the skin. I recommend it to you, so I asked a lot of it and asked it so many times, and it is very good for the hair, and a good quantity that lasts a long time","{'neg': 0.0, 'neu': 0.691, 'pos': 0.309, 'compound': 0.9402}",0.9402,pos
383,383,143354,2022-11-22,Excellent!,"Very good for insomnia. Excellent composition. Without melatonin. Only a mixture of herbs, including valerian in a large dosage. Small capsule size. Comfortable to swallow.","{'neg': 0.0, 'neu': 0.662, 'pos': 0.338, 'compound': 0.8805}",0.8805,pos
384,384,143354,2024-09-02,,"It is good for sleeping. For those who cannot sleep and have difficulty sleeping, take a pill before bed and you will sleep comfortably.","{'neg': 0.085, 'neu': 0.712, 'pos': 0.203, 'compound': 0.5106}",0.5106,pos
385,385,143354,2024-06-24,Likely,It didn't help me sleep well. Until now I fell asleep with melatonin which was more effective than this product,"{'neg': 0.095, 'neu': 0.674, 'pos': 0.231, 'compound': 0.4998}",0.4998,pos
386,386,143354,2024-04-08,,"I have been taking it for more than ten days and have not found any help yet, so please continue to observe.","{'neg': 0.095, 'neu': 0.797, 'pos': 0.109, 'compound': 0.0862}",0.0862,pos
387,387,143354,2024-09-25,good choice,"High cost performance, very good product!","{'neg': 0.0, 'neu': 0.589, 'pos': 0.411, 'compound': 0.54}",0.54,pos
388,388,143354,2024-05-08,,Helps you fall asleep better and maintain deep sleep.,"{'neg': 0.0, 'neu': 0.56, 'pos': 0.44, 'compound': 0.6705}",0.6705,pos
389,389,143354,2024-04-17,Good ,Really helps you fall asleep. Fast delivery.,"{'neg': 0.0, 'neu': 0.675, 'pos': 0.325, 'compound': 0.4391}",0.4391,pos
390,390,143354,2022-12-27,,"Worth trying very much, helps deep sleep, its ingredients are harmless and reassuring 👏🏻","{'neg': 0.0, 'neu': 0.513, 'pos': 0.487, 'compound': 0.8166}",0.8166,pos
391,391,143354,2022-12-06,Excellent!,"Super, I will definitely order again. Super, I will definitely order again. Super, I will definitely order again","{'neg': 0.0, 'neu': 0.313, 'pos': 0.688, 'compound': 0.9628}",0.9628,pos
392,392,143354,2024-10-16,,This packaging is very cost-effective,"{'neg': 0.0, 'neu': 1.0, 'pos': 0.0, 'compound': 0.0}",0.0,neu
393,393,143354,2020-10-17,An excellent herbal sleeping pill for over 50s!,"These are the second sleeping pills, without melatonin, exclusively based on herbs that fit me. One capsule an hour before bedtime is enough for me (well, and the magnesium that I drink every evening) in order to start falling asleep. And in the morning I wake up easily, there is no heaviness in my body and headaches, which I have almost every morning. I will alternate with others, about which I have already written in reviews. I also really like that these sleeping pills are gel, I have not tried to bite through, but I love gel capsules. They are very small, but just do not start doing business - go to bed immediately .. At my climacteric age, when you often turn around midnight and cannot fall asleep, there was another help. I recommend to women over 55 years old, and in general to those who suffer from insomnia to try. Moreover, the sleeping pill is completely based on herbs. I wish you all good health!","{'neg': 0.043, 'neu': 0.813, 'pos': 0.144, 'compound': 0.9583}",0.9583,pos
394,394,143354,2023-09-01,,"I order a second time, take one pill in the evening and the other after an hour or two, it helps","{'neg': 0.0, 'neu': 0.874, 'pos': 0.126, 'compound': 0.3818}",0.3818,pos
395,395,143354,2023-08-28,,"Helps to sleep and also lulls you to sleep when you wake up, take 2 pills with an hour difference between them","{'neg': 0.0, 'neu': 0.885, 'pos': 0.115, 'compound': 0.3818}",0.3818,pos
396,396,143354,2023-08-03,,The product is very neutral and the quality is good. I am an intermediary for iHerb in Jordan,"{'neg': 0.0, 'neu': 0.847, 'pos': 0.153, 'compound': 0.4404}",0.4404,pos
397,397,143354,2023-07-15,Great! Great!,"Very good drug! An adult son had problems sleeping, Deep Sleep helped, asked to order more","{'neg': 0.134, 'neu': 0.694, 'pos': 0.173, 'compound': 0.1986}",0.1986,pos
398,398,143354,2023-06-22,,"I bought it for a friend, she says that it helps her a lot in the fight against insomnia","{'neg': 0.121, 'neu': 0.607, 'pos': 0.271, 'compound': 0.4939}",0.4939,pos
399,399,143354,2023-05-20,,"Excellent vitamins, no side effects, good effect, very convenient packaging","{'neg': 0.139, 'neu': 0.443, 'pos': 0.418, 'compound': 0.6597}",0.6597,pos
400,400,143354,2023-05-15,Excellent!,The quality of the goods and services is excellent ❤️❤️❤️ Will definitely repurchase next time ❤️❤️❤️,"{'neg': 0.0, 'neu': 0.686, 'pos': 0.314, 'compound': 0.7506}",0.7506,pos
401,401,143354,2023-05-09,,"I order all the time for my mom. She liked it, sleeps better, and the next day feels cheerful. I recommend","{'neg': 0.0, 'neu': 0.562, 'pos': 0.438, 'compound': 0.8934}",0.8934,pos
402,402,143354,2023-05-01,,Quality supplement for sound healthy sleep. Natural composition. Nice smell. The ingredients are suitable for all ages.,"{'neg': 0.0, 'neu': 0.636, 'pos': 0.364, 'compound': 0.7906}",0.7906,pos
403,403,143354,2023-04-26,,I ordered the supplement to improve sleep. maximum effect from use,"{'neg': 0.0, 'neu': 0.756, 'pos': 0.244, 'compound': 0.4404}",0.4404,pos
404,404,143354,2023-04-18,,Really very good product! It seems that the combination of ingredients worked. I have the feeling of having a prolonged and restful sleep.,"{'neg': 0.0, 'neu': 0.699, 'pos': 0.301, 'compound': 0.7759}",0.7759,pos
405,405,143354,2023-04-05,,A unique combination of the most important herbs to support and improve sleep health and quality,"{'neg': 0.0, 'neu': 0.609, 'pos': 0.391, 'compound': 0.7713}",0.7713,pos
406,406,143354,2023-04-05,Prominent,"Fast acting, very natural, safe to use, and a good quantity","{'neg': 0.0, 'neu': 0.441, 'pos': 0.559, 'compound': 0.8347}",0.8347,pos
407,407,143354,2023-03-30,Excellent!,"The product is of high quality, very useful for sleep, and its taste is palatable and acceptable","{'neg': 0.0, 'neu': 0.634, 'pos': 0.366, 'compound': 0.796}",0.796,pos
408,408,143354,2023-02-26,,"I take two capsules, empty the contents and drink, after 20 minutes I fall asleep","{'neg': 0.13, 'neu': 0.87, 'pos': 0.0, 'compound': -0.2023}",-0.2023,neg
409,409,143354,2022-10-17,drowsiness does not remain,"I've tried other herbal products, but this definitely woke me up refreshed. However, the time to get up in the morning seems to be earlier. It may not be suitable for those who want to sleep soundly in the morning.","{'neg': 0.0, 'neu': 0.871, 'pos': 0.129, 'compound': 0.6846}",0.6846,pos
410,410,143354,2024-06-19,Easy to drink,The capsules are small and easy to swallow.,"{'neg': 0.0, 'neu': 0.707, 'pos': 0.293, 'compound': 0.4404}",0.4404,pos
411,411,143354,2023-07-14,,"The quality is excellent, the size is medium, it helps sleep, the ingredients are natural, and it does not contain addictive substances","{'neg': 0.0, 'neu': 0.683, 'pos': 0.317, 'compound': 0.8316}",0.8316,pos
412,412,143354,2023-06-19,,Helps regulate sleep Excellent quality Excellent size No odor Effective body formula,"{'neg': 0.099, 'neu': 0.314, 'pos': 0.587, 'compound': 0.8979}",0.8979,pos
413,413,143354,2023-05-29,,"Helps deep sleep and relax the body. The packaging is appropriate, the ingredients are excellent, the benefit is great","{'neg': 0.0, 'neu': 0.462, 'pos': 0.538, 'compound': 0.946}",0.946,pos
414,414,143354,2023-04-27,,A mixture of plants that helps sleep better both in the depth of sleep and the length of sleep,"{'neg': 0.0, 'neu': 0.744, 'pos': 0.256, 'compound': 0.6705}",0.6705,pos
415,415,143354,2023-04-05,Good,I tried it for the first time. Not very close. Maybe too little dose. The price is good.,"{'neg': 0.0, 'neu': 0.847, 'pos': 0.153, 'compound': 0.4404}",0.4404,pos
416,416,143354,2020-11-27,Working drug !!!,"The combination of ingredients really helps you sleep. Herbal capsules, very good composition !!! California poppy, which is part of the drug, is highly valued for its gentle antispasmodic, potent sedative, valerian has always been considered the best sedative, passionflower improves mood in depressive conditions, reduces anxiety and mental stress, has a hypnotic effect without a symptom of depression upon awakening, has anticonvulsant properties, mint has a sedative effect, therefore it is characterized by a calming effect and helps to cope with depression, psycho-emotional problems. At the same time, it does not cause addiction or drowsiness, the person remains vigorous and active. Peppermint helps in the fight against insomnia and the desire to quickly and soundly fall asleep, chamomile has a sedative effect, oats are an effective sedative. The composition is very good, natural, and promotes excellent sleep. Recommend!!!!","{'neg': 0.069, 'neu': 0.614, 'pos': 0.317, 'compound': 0.9919}",0.9919,pos
417,417,143354,2018-02-06,Read the instructions,"On each tiny black capsule - a white branded inscription. Inside - a cloudy thick liquid, similar to coffee with a small amount of milk. Aroma herbal, very pleasant. The taste is also pleasant, soft, without bitterness, sharpness or salinity. I confess I did not read the instruction carefully, where it is written that the effect starts from the second to the third day, and tried to use these capsules once. If you take the capsule once a week or once every ten days, or even a month, then you will fall asleep immediately and without any problems, but in the middle of the night you will wake up several times. One-time reception absolutely exactly leads to night awakenings. Tried many times. I tried to take even two capsules (""to be sure""), and not one by one, as the manufacturer recommends. I fall asleep clearly 15-20 minutes after the reception, but at night you suddenly wake up, stare at the clock and then fall asleep again. And so it can happen 2-3 times a night. If you take these capsules REGULARLY ONE ONE DAY, then really, on the fourth day with them you start to fall asleep quickly, sleep peacefully all night, and in the morning without problems it is possible to wake up completely rested, fresh and vigorous. At the same time, smooth slow dreams are dreamed without fuss and sharp scenes. At first I thought that the main drawback of this sleeping pill was its inhuman value. But if you find that it is enough for a three-month course, it turns out that for this money we arrange a whole season of rest in a dream - a whole spring of quality sleep! And in recalculation for each day the price does not reach and 20 rubles for a dream. It begins to seem that this pleasure is immeasurably cheap. The benefits we receive are much greater than it costs. For this money we buy ourselves a full reset, a good state of health and a great mood.

","{'neg': 0.003, 'neu': 0.83, 'pos': 0.167, 'compound': 0.9955}",0.9955,pos
418,418,143354,2021-04-14,,"I take it at night with magnesium (in the form of taurate) and hawthorn, all together reduces the noise in the head and soothes well, the pressure releases and the sleep is not interrupted until the morning. The composition is good, but I hoped that the effect would be stronger. I bought it for a promotion with a good discount, but without it I’ll hardly take it again, it’s a little expensive.","{'neg': 0.021, 'neu': 0.774, 'pos': 0.205, 'compound': 0.9185}",0.9185,pos
419,419,143354,2016-05-07,Deep sleep capsules,"This is through a friend to buy, every day before going to sleep to take a, I was relatively sleepy, especially after the night was awakened after the difficulty of falling asleep, now taking the capsule after the feeling of sleep quality improved! Get up every morning are very spiritual, half-way also tried to stop taking, would like to try to have no dependency, ok, can also fall asleep, this time through the iherb online to buy, very convenient, SF Express also Fast, the packaging is also very careful, follow-up will also patronize! Has been introduced in a friend to buy!","{'neg': 0.074, 'neu': 0.764, 'pos': 0.162, 'compound': 0.877}",0.877,pos
420,420,143354,2023-10-04,,"I've been taking it for a week, but it hasn't worked yet.","{'neg': 0.0, 'neu': 1.0, 'pos': 0.0, 'compound': 0.0}",0.0,neu
421,421,143354,2023-08-05,"Generally, no effect",I have constant insomnia problem and this product doesn't work for me,"{'neg': 0.213, 'neu': 0.787, 'pos': 0.0, 'compound': -0.4019}",-0.4019,neg
422,422,143354,2023-06-10,,Didn't do the job exceptionally well for me. There is a situation where I need to do something else to sleep better.,"{'neg': 0.0, 'neu': 0.773, 'pos': 0.227, 'compound': 0.6478}",0.6478,pos
423,423,143354,2023-05-14,,Not very useful for me may vary from person to person,"{'neg': 0.208, 'neu': 0.792, 'pos': 0.0, 'compound': -0.3865}",-0.3865,neg
424,424,143354,2022-11-08,,Can't say to have a deep sleep after taking pills,"{'neg': 0.0, 'neu': 1.0, 'pos': 0.0, 'compound': 0.0}",0.0,neu
425,425,143354,2023-05-20,,I can't sleep with this alone. Feelings matter.,"{'neg': 0.269, 'neu': 0.599, 'pos': 0.132, 'compound': -0.2846}",-0.2846,neg
426,426,143354,2023-04-29,,"Looks good, bought 2 times","{'neg': 0.0, 'neu': 0.508, 'pos': 0.492, 'compound': 0.4404}",0.4404,pos
427,427,143354,2023-04-03,,"Deep Sleep has quality ingredients, benefits, no bad taste","{'neg': 0.399, 'neu': 0.42, 'pos': 0.182, 'compound': -0.4767}",-0.4767,neg
428,428,143354,2020-01-27,Light sleep.,"They were sedative 3 members of my family. Everyone liked it. You fall asleep with ease, wake up as well. The head is fresh in the morning, there is no feeling of heaviness and the desire to sleep during the day.","{'neg': 0.045, 'neu': 0.672, 'pos': 0.283, 'compound': 0.8658}",0.8658,pos
429,429,143354,2017-02-19,Very mild sleeping pills,"I'm ordering a third jar, the tool is not something to knock down, but it helps to fall asleep and not wake up in the middle of the night.","{'neg': 0.0, 'neu': 0.888, 'pos': 0.112, 'compound': 0.5267}",0.5267,pos
430,430,143354,2016-09-21,"Really effective, easy to sleep, improve the quality of sleep","Such as the title, after eating about an hour after the trapped, these days obviously improved the quality of sleep, the more spiritual during the day.","{'neg': 0.111, 'neu': 0.787, 'pos': 0.102, 'compound': -0.0772}",-0.0772,neg
431,431,143354,2022-10-16,,"I only ate it for a few days, I don't know how it will work!","{'neg': 0.0, 'neu': 1.0, 'pos': 0.0, 'compound': 0.0}",0.0,neu
432,432,143354,2022-10-09,,"Excellent company, good dosage, ease of use due to the release form, easy to drink","{'neg': 0.0, 'neu': 0.478, 'pos': 0.522, 'compound': 0.9001}",0.9001,pos
433,433,143354,2022-08-25,,Amazing product. I highly recommend in addition to combining with a GABA supplement it encourages deep and comfortable sleep.,"{'neg': 0.0, 'neu': 0.504, 'pos': 0.496, 'compound': 0.9152}",0.9152,pos
434,434,143354,2022-06-16,,"Very excellent, helps to sleep, the packaging is excellent, the size is beautiful","{'neg': 0.0, 'neu': 0.379, 'pos': 0.621, 'compound': 0.9409}",0.9409,pos
435,435,143354,2022-04-01,,"Husband has sleep problems, use it instead of sleeping pills, hope it works","{'neg': 0.163, 'neu': 0.663, 'pos': 0.175, 'compound': 0.0516}",0.0516,pos
436,436,143354,2022-01-02,,Excellent herbal sleeping pill! What a pity that it is not being delivered to Russia now ...,"{'neg': 0.109, 'neu': 0.693, 'pos': 0.198, 'compound': 0.4199}",0.4199,pos
437,437,143354,2019-04-04,Fine.,"Took in trying to help my mother to establish a dream. Then we didn’t have a good doctor yet and I didn’t know that it was necessary to take a very comprehensive approach, especially at the age, I didn’t know that there are many kinds of insomnia, there are different approaches to them. In general, this did not solve the mother's problem, but sleeps with him better. During the reception, Mom woke up as often as usual, but was more sluggish and fell asleep a little faster. But it didn’t give a good night’s sleep. What I think is not surprising, it is weed, in fact, as homeopathy, I think, is suitable for those who do not have serious problems with sleep. If insomnia is neglected, then an integrated approach and a good doctor are needed. Melatonin, magnesium, progesterone if menopause, tryptophan and a number of supplements on an ongoing basis will be more effective.","{'neg': 0.082, 'neu': 0.75, 'pos': 0.168, 'compound': 0.9153}",0.9153,pos
438,438,143354,2021-09-23,Very Good!,"Works well, not intended for extreme cases. A job of calm and serenity no more. At first I took the instructions and it was too much for me. Take one before bed and not two.","{'neg': 0.06, 'neu': 0.82, 'pos': 0.12, 'compound': 0.296}",0.296,pos
439,439,143354,2020-11-19,,"I suffer from chronic insomnia !!! This is not the first time! Copes with its task !!! I am very pleased!!! True, the price is biting, but it's worth it !!! Recommend!!!","{'neg': 0.059, 'neu': 0.655, 'pos': 0.286, 'compound': 0.825}",0.825,pos
440,440,143354,2019-02-25,Good remedy,"Sleeping pills coped with a bang, As soon as I got it right away and tried it, I drank it and fell asleep in half an hour. This is by far the best. By the way, only one pill.","{'neg': 0.0, 'neu': 0.893, 'pos': 0.107, 'compound': 0.6369}",0.6369,pos
441,441,143354,2016-05-26,In effect,"When you go to bed after taking a while, all of your body's tension is released and the switch is turned off. However, since the head does not sleep immediately, the body does not move, and the head must experience a momentary distant state.","{'neg': 0.053, 'neu': 0.947, 'pos': 0.0, 'compound': -0.3182}",-0.3182,neg
442,442,143354,2015-07-16,Deep sleep okay,Currently used once slept for six hours on the trip I was 25 years old. . Good old insomnia tangled hope that this drug is not dependent,"{'neg': 0.0, 'neu': 0.799, 'pos': 0.201, 'compound': 0.7003}",0.7003,pos
443,443,143354,2018-06-05,Sleep well,"Has not been used, watching the United States to buy the first to buy, the same boring oil effect, usually are often staying up late, the quality of sleep has been poor","{'neg': 0.145, 'neu': 0.78, 'pos': 0.075, 'compound': -0.3818}",-0.3818,neg
444,444,143354,2023-08-15,sleeping pills,It was not lost on me. Continues to use prescription sleeping pills.,"{'neg': 0.0, 'neu': 0.849, 'pos': 0.151, 'compound': 0.2411}",0.2411,pos
445,445,143354,2023-05-19,Below average,"It didn't help me to see better, I thought it would help but it didn't","{'neg': 0.201, 'neu': 0.679, 'pos': 0.12, 'compound': -0.0793}",-0.0793,neg
446,446,143354,2021-07-30,,"This product helped me fall asleep easily and improved my sleep quality. When I fell asleep the next day, I felt refreshed and not tired of eyes. It is worth recommending.","{'neg': 0.0, 'neu': 0.718, 'pos': 0.282, 'compound': 0.8319}",0.8319,pos
447,447,143354,2016-06-01,Use after the effect,"After use is effective, the most obvious is the morning wake up the difficulties, I am going to get up at 6 o'clock in the morning, after taking the obvious feeling of trouble, eyes can not open, it is effective.","{'neg': 0.107, 'neu': 0.724, 'pos': 0.169, 'compound': 0.4215}",0.4215,pos
448,448,143354,2022-08-09,Not satisfied,"It hasn't had any effect on me so far, I've been taking two gel capsules at night for a fortnight. I hope it works in the next few days.","{'neg': 0.0, 'neu': 0.9, 'pos': 0.1, 'compound': 0.4404}",0.4404,pos
449,449,143354,2021-11-15,Ok,"I fell for the plant composition, but the price for chamomile and valerian is high. Sleeping has become a little better.","{'neg': 0.0, 'neu': 0.841, 'pos': 0.159, 'compound': 0.5284}",0.5284,pos
450,450,143354,2022-01-24,,Great for improving sleep! But it needs regular intake.,"{'neg': 0.0, 'neu': 0.596, 'pos': 0.404, 'compound': 0.5778}",0.5778,pos
451,451,143354,2017-11-19,I bought my mother because she was sleeping poorly.,"I got a prescription and I have a weak sleep inducer. I bought it because I want to stop it, but I do not know yet.
I feel a little calm, but when I go to bed,
","{'neg': 0.118, 'neu': 0.761, 'pos': 0.121, 'compound': 0.0285}",0.0285,neu
