,product_id,date_posted,review_title,review_text,scores,compound,sentiment
91,2992,2018-09-10,It can be relieved in natural way.,"First impression is weak label sticking. After opening the exterior film, I pasted it with a stick and so glue it paste. This maker has no additives and it is very appreciated as it is only a thing that confines freeze-dried herbs with capsules. I tried to purchase valerian ingredients from other companies for relaxation but here it seems easy to drink because the distinctive smell of Valerian is poorly diverted. Like when you sniffed a wormwood ginger tube. I will write the feeling of use again at a later date.","{'neg': 0.038, 'neu': 0.806, 'pos': 0.157, 'compound': 0.8819}",0.8819,pos
92,2992,2013-08-28,GOOD,"It is in use in medicine cut off. If you drink at night, I feel like can sleep. It is more than imagine the power of herbs. And repeater.","{'neg': 0.069, 'neu': 0.85, 'pos': 0.082, 'compound': 0.1027}",0.1027,pos
93,2992,2022-07-30,great sleep aid,Helps to fall asleep very well and gives a good quality of sleep. I take not the first time.,"{'neg': 0.0, 'neu': 0.639, 'pos': 0.361, 'compound': 0.7841}",0.7841,pos
94,2992,2022-07-28,,Not bad but maybe not enough of each plant in the capsule to be very effective taken alone!,"{'neg': 0.117, 'neu': 0.607, 'pos': 0.276, 'compound': 0.6008}",0.6008,pos
95,2992,2022-01-16,,"I took it for the first time, I drink one capsule at night, I really like it!","{'neg': 0.0, 'neu': 0.808, 'pos': 0.192, 'compound': 0.474}",0.474,pos
96,2992,2023-02-20,,"When I drink this, I feel good until morning.","{'neg': 0.0, 'neu': 0.674, 'pos': 0.326, 'compound': 0.4404}",0.4404,pos
97,2992,2021-12-26,,"The scent is unique, but if you don't mind it, you will feel it.","{'neg': 0.0, 'neu': 1.0, 'pos': 0.0, 'compound': 0.0}",0.0,neu
98,2992,2021-07-08,,"A good remedy for the nervous system, quickly helps to calm down, promotes good sleep)","{'neg': 0.091, 'neu': 0.345, 'pos': 0.565, 'compound': 0.875}",0.875,pos
99,2992,2022-07-15,,"Great supplement, I liked it. Good composition, neutral taste","{'neg': 0.0, 'neu': 0.338, 'pos': 0.662, 'compound': 0.8689}",0.8689,pos
100,2992,2022-05-09,,"Good composition, adequate price, there is an effect","{'neg': 0.0, 'neu': 0.556, 'pos': 0.444, 'compound': 0.5859}",0.5859,pos
101,2992,2022-05-07,,"We drink for sleep, there is a slight improvement","{'neg': 0.0, 'neu': 0.7, 'pos': 0.3, 'compound': 0.4588}",0.4588,pos
102,2992,2022-04-21,Excellent!,Prominent,"{'neg': 0.0, 'neu': 0.0, 'pos': 1.0, 'compound': 0.3182}",0.3182,pos
103,2992,2021-12-01,,Good Valerian !!!,"{'neg': 0.0, 'neu': 0.346, 'pos': 0.654, 'compound': 0.5826}",0.5826,pos
104,2992,2021-09-25,,good supplement. Natural composition. Improves sleep,"{'neg': 0.0, 'neu': 0.268, 'pos': 0.732, 'compound': 0.802}",0.802,pos
105,2992,2020-12-12,,Very good,"{'neg': 0.0, 'neu': 0.238, 'pos': 0.762, 'compound': 0.4927}",0.4927,pos
