,Unnamed: 0,product_id,date_posted,review_title,review_text,scores,compound,sentiment
0,0,88572,2024-03-09,Unwinding tea,"My new go to tea before bed. I love drinking yummy caffeine-free teas in the evenings, this one has a lovely taste. The tea bags are packaged individually for convenience. The blend of apple, cinnamon and vanilla make a perfect cozy drink to have while reading in bed. New favorite! ","{'neg': 0.0, 'neu': 0.676, 'pos': 0.324, 'compound': 0.9622}",0.9622,pos
1,1,88572,2024-08-17,The Best!,"Twinings Unwinding Passionflower Herbal Tea is a fantastic choice for relaxation. The flavor is delicate and soothing, with a hint of floral notes that make it perfect for winding down in the evening. I've found it helps calm my mind and prepare me for a restful night’s sleep. The tea is well-crafted with high-quality ingredients, and it steeps nicely without any bitterness. If you're looking for a gentle, calming tea to help manage stress or improve sleep, Twinings Unwinding Passionflower Herbal Tea is a great option.","{'neg': 0.025, 'neu': 0.57, 'pos': 0.404, 'compound': 0.989}",0.989,pos
2,2,88572,2024-04-05,Lovely blend!,"I love these tea blends. They gently help you relax. Of course they’re mostly caffeine free. And oftentimes you can make more than one mug full from a teabag serving. I’m a fan of Twinnings as they made unique blends with quality ingredients that work well together. Not to mention, it tastes so aromatic!","{'neg': 0.0, 'neu': 0.679, 'pos': 0.321, 'compound': 0.9628}",0.9628,pos
3,3,88572,2024-04-03,Yummy,"I first tasted this tea in London and to my surprise,I found it on I Herb as well. It tastes amazing and there isno need to add sugar or honey. tbe smell is like you are drinking the best dessert. great quality blend. caffeine free . which , for me, is a benefit","{'neg': 0.0, 'neu': 0.641, 'pos': 0.359, 'compound': 0.9719}",0.9719,pos
4,4,88572,2023-11-20,,i love the smell and the looks of it. im looking forward to purchasing another one! .Excellent! great quality product. it really works as intended. Will definitely get more soon! Thank you so much for this. it was made of high qualiy ingredients. Plus the packaging and sizes were perfect. over all good quality.,"{'neg': 0.0, 'neu': 0.689, 'pos': 0.311, 'compound': 0.9692}",0.9692,pos
5,5,88572,2023-11-19,Unwinding Passionflower Spiced Apple Vanilla TEA,"It's my first time using tea blend and I have sensitive taste buds so when I use with correct serving frequency, I believe this ingredient is high quality and benefits me at my age with enough size and package which is good for 3 weeks. I will recommend this product for people who want natural composition tea. ","{'neg': 0.0, 'neu': 0.799, 'pos': 0.201, 'compound': 0.8689}",0.8689,pos
6,6,88572,2023-11-08,The Ultimate Comfort,"I find this cuppa so comforting, and benefits me at any time of the day or evening. It's a very smooth caffeine-free blend. An easy drinking, nice quality tea. If you appreciate apple cinnamon flavour, I think you'd really enjoy this. It's not otherwise available in Australia, so I'm very thankful to have access to it through iHerb.","{'neg': 0.0, 'neu': 0.681, 'pos': 0.319, 'compound': 0.9702}",0.9702,pos
7,7,88572,2024-04-01,Delicious but did not help with insomnia,"I have been on a tea kick for some time now and was intrigued by the flavor of this tea and its claim to help with sleep. Taste: 10/10. Delicious - and that alone made this purchase worth it. However, did it help me sleep? Nope, and I had a particularly rough night after drinking it too.","{'neg': 0.033, 'neu': 0.783, 'pos': 0.183, 'compound': 0.8402}",0.8402,pos
8,8,88572,2024-09-07,Delicious ,"Very pleased with the twining apple and vanilla. Mild but, tasty with a lovely aroma. I like that it has no caffeine so I can have it before bed. ","{'neg': 0.079, 'neu': 0.622, 'pos': 0.298, 'compound': 0.8292}",0.8292,pos
9,9,88572,2024-08-25,So delicious for bedtime ,"I love the gentle flavor of this tea, which is perfect to sip while getting ready for bed. It has only the mild sweetness of the apples, without any bitter ingredients or having to cover up those ingredients with mint or stevia. ","{'neg': 0.0, 'neu': 0.65, 'pos': 0.35, 'compound': 0.9573}",0.9573,pos
10,10,88572,2024-08-21,Love the taste ,"Taste sweet ,nice aroma 
Very good quality ingredients tea
Package serving size is 👍🏼 use before bed specially for calming and helping with sleep 
Definitely will buy it again ","{'neg': 0.0, 'neu': 0.581, 'pos': 0.419, 'compound': 0.9392}",0.9392,pos
11,11,88572,2024-07-29,,Good quality tea blend . No caffeine suitable to drink before sleeping. Ingredients are good quality spiced apple and vanilla flavour. Taste is pleasant. Overall a good buy,"{'neg': 0.062, 'neu': 0.597, 'pos': 0.341, 'compound': 0.8689}",0.8689,pos
12,12,88572,2024-07-06,Прекрасно!,"Herbal Tea delivers a soothing, high-quality blend with a pleasant taste. The size of the tea bags is perfect, and it’s available at a good price for such premium quality.","{'neg': 0.0, 'neu': 0.653, 'pos': 0.347, 'compound': 0.9042}",0.9042,pos
13,13,88572,2024-06-25,,"Good quality tea blend with ingredients including passionflower and apple and vanilla. Taste is great. No caffeine so good option for a night brew , or make iced to drink on hot summer days ","{'neg': 0.054, 'neu': 0.664, 'pos': 0.282, 'compound': 0.8516}",0.8516,pos
14,14,88572,2024-06-23,Love it ,"Quality is good
Ingredient are good
Taste so good
Use it when i want to relax 
Size is average 
Package is good 
Really good tea ","{'neg': 0.0, 'neu': 0.476, 'pos': 0.524, 'compound': 0.9493}",0.9493,pos
15,15,88572,2024-04-29,Love this tea ,It never last in our house and it’s morning go to tea. If you are trying to find something to curve that sweet tooth this is it ,"{'neg': 0.0, 'neu': 0.897, 'pos': 0.103, 'compound': 0.4588}",0.4588,pos
16,16,88572,2024-04-25,love this,"great sleepy time tea alternative to chamomile just to shake things up. passion flower is supposed to be great for relaxing. a bit heavy on the cinnamon side, leading to a slight after taste - do recommend. ","{'neg': 0.036, 'neu': 0.601, 'pos': 0.363, 'compound': 0.9451}",0.9451,pos
17,17,88572,2024-04-13,Pleasing  Flavor,This tea has an excellent tropical passion fruit flavor. It tastes good stand along as hot or cold on ice.  I like to make it with my morning black tea for an upgraded flavorful cup of tea.,"{'neg': 0.0, 'neu': 0.726, 'pos': 0.274, 'compound': 0.9022}",0.9022,pos
18,18,88572,2024-03-20,מצוין!,"Just great! The best tea in the world, each flavor is better than the other. Not a single one turned out to be unsuccessful. Just a pleasure to drink every day full of good flavors","{'neg': 0.053, 'neu': 0.567, 'pos': 0.38, 'compound': 0.9485}",0.9485,pos
19,19,88572,2024-02-28,A Serene Escape in a Cup,"There's something special about Twinings Unwind Passionflower Herbal Tea with its Spiced Apple & Vanilla blend that just resonates with me. Each evening, as I seek a moment of tranquility after the day's chaos, this tea has become my go-to comfort. The way the spiced apple flavor gently intertwines with the soft, sweet notes of vanilla feels like a warm hug in a mug, perfect for easing into relaxation.

The passionflower ingredient caught my eye as I was looking for something to help me unwind, and it hasn't disappointed. There's a subtle magic in how this blend lulls me into a state of calm, making it easier to let go of the day's stress. It's caffeine-free, which is a big plus for my nighttime routine, ensuring that my journey to dreamland remains undisturbed.

I've come to cherish this tea as part of my evening ritual. It's not just a beverage; it's an experience that wraps up my day with warmth and serenity. The fact that I'm excited to share about it here speaks volumes of its place in my life. If you're on the lookout for a tea that's more than just a drink but a pathway to peace, I highly recommend giving this Twinings blend a try. It's my little nightly indulgence that I look forward to, a perfect closure to any day.","{'neg': 0.018, 'neu': 0.748, 'pos': 0.234, 'compound': 0.9904}",0.9904,pos
20,20,88572,2024-02-22,Definitely buying again,The flavor and aroma are subtle yet delicious.  I usually like my tea bold but this was had such nice balance I really enjoyed it.  It help me have a better night’s sleep. Make sure to brew it for as long as it’s instructed!,"{'neg': 0.0, 'neu': 0.568, 'pos': 0.432, 'compound': 0.9754}",0.9754,pos
21,21,88572,2024-02-13,nice,"The taste is quite nice, a bit sweet.
I like to drink it in the evening, chamomile helps for sleep.

Probably will order again.

Twinning always has good quality. ","{'neg': 0.0, 'neu': 0.605, 'pos': 0.395, 'compound': 0.924}",0.924,pos
22,22,88572,2024-02-06,很好！,"Tea offers numerous health benefits – it's a relaxing drink that helps increase our attention and focus, is heart-friendly, good for the gut and may help manage blood sugar. Tea makes a useful option if you are looking for a flavourful, low-calorie, unsweetened hot drink.","{'neg': 0.0, 'neu': 0.639, 'pos': 0.361, 'compound': 0.9531}",0.9531,pos
23,23,88572,2024-01-18,,"Thank you for the wonderful service and quick shipping. Seller packed the item well. And what you ordered is exactly what you received and on time. I highly recommend them.
","{'neg': 0.0, 'neu': 0.693, 'pos': 0.307, 'compound': 0.8777}",0.8777,pos
24,24,88572,2023-11-21,Cinnamon apple relaxation in a mug!,This tea smells like cinnamon and a little apple. Flavor is mild and pleasant. Great evening tea for relaxing. It does not make me sleepy like some evening teas but more relaxed. ,"{'neg': 0.0, 'neu': 0.597, 'pos': 0.403, 'compound': 0.9215}",0.9215,pos
25,25,88572,2024-07-08,,Good tea to take at night. No caffeine. I'm not a fan of chamomile taste but  I can take it for its benefits. With a a hint of fruit taste makes it easier for me to drink. ,"{'neg': 0.077, 'neu': 0.698, 'pos': 0.226, 'compound': 0.7887}",0.7887,pos
26,26,88572,2023-12-25,love it,i love this tea. It's not really helping me  sleep faster.  but it tastes nice and smells good and caffeine free. gonna buy more.,"{'neg': 0.045, 'neu': 0.527, 'pos': 0.427, 'compound': 0.9331}",0.9331,pos
27,27,88572,2023-12-17,Yummy,"Such good blend of flavors and ingredients. 
Calming and great before bed.
Love that its caffeine free.","{'neg': 0.0, 'neu': 0.411, 'pos': 0.589, 'compound': 0.9531}",0.9531,pos
28,28,88572,2022-10-25,,"I was pleasantly surprised by this tea! I’ve ordered a lot of different teas that profess to help you get to sleep better. I’ve found very few that actually work. This is one of those few! Of course no caffeine, but flavor is really quite nice with the blend of vanilla. It’s a nice relaxing cup to have right before bed. Tastes great, smells great, and works wonders. What more can I ask for? ","{'neg': 0.017, 'neu': 0.625, 'pos': 0.358, 'compound': 0.9863}",0.9863,pos
29,29,88572,2024-07-05,The spiced apple tasted a bit artificial to me,"Other than the artificial apple flavor (which may be to the liking of another), I think the product is fine. The cinnamon and vanilla flavor to it is soothing.","{'neg': 0.0, 'neu': 0.786, 'pos': 0.214, 'compound': 0.7003}",0.7003,pos
30,30,88572,2023-06-11,Tastes great!,"This stuff tastes amazing! I followed the directions I read online, and used milk instead of water. If you do it that way, and add a little honey it tastes like pie almost. I enjoyed the flavor. I just wish that ""bedtime"" tea didn't wake me up instead of helping me to sleep! Because this tea tastes awesome!","{'neg': 0.0, 'neu': 0.71, 'pos': 0.29, 'compound': 0.9595}",0.9595,pos
31,31,88572,2023-03-26,,"Probably my favorite flavor. It keeps me calm before going to bed. The taste isn't too strong nor too weak, and is perfect for people who like apple cider (though in a softer version, which is perfect for me!).
The quality is really good, it is caffeine free, perfect to drink all day long - especially after meals or before going to sleep. I highly recommend!","{'neg': 0.031, 'neu': 0.606, 'pos': 0.363, 'compound': 0.9808}",0.9808,pos
32,32,88572,2023-03-23,,My mom Loves this tea blend! She likes to use it to relax  and at bedtime.  She says the taste is great and it’s caffeine free so I’d doesn’t interfere with sleeping.   It has natural ingredients people have trusted for benefits centuries at a good price.  Try it!,"{'neg': 0.0, 'neu': 0.572, 'pos': 0.428, 'compound': 0.9808}",0.9808,pos
33,33,88572,2024-10-11,love it,great tea without caffeine. sweet but not too sweet. I like it,"{'neg': 0.444, 'neu': 0.408, 'pos': 0.148, 'compound': -0.6218}",-0.6218,neg
34,34,88572,2024-10-08,,First time purchase & I love the subtle flavours in the tea ,"{'neg': 0.0, 'neu': 0.682, 'pos': 0.318, 'compound': 0.6369}",0.6369,pos
35,35,88572,2024-10-05,Deeper sleep,I drink this 3 hours before sleep. Taste good. Deeper and longer sleep. ,"{'neg': 0.0, 'neu': 0.775, 'pos': 0.225, 'compound': 0.4404}",0.4404,pos
36,36,88572,2024-10-04,Love this tea!,"Such nice smell and taste, and the teabags looks so nice as well in the package. ","{'neg': 0.0, 'neu': 0.62, 'pos': 0.38, 'compound': 0.7884}",0.7884,pos
37,37,88572,2024-09-15,Value for money. Good quality. Good alternative to supplements or medicine.,Value for money. Good quality. Good alternative to supplements or medicine.,"{'neg': 0.0, 'neu': 0.494, 'pos': 0.506, 'compound': 0.802}",0.802,pos
38,38,88572,2024-08-15,,Great tea! I like the blend and the smell of it. It tastes great and all my family likes it ,"{'neg': 0.0, 'neu': 0.521, 'pos': 0.479, 'compound': 0.9299}",0.9299,pos
39,39,88572,2024-08-05,,Twinning is winning in the tea department for me love the taste is just chef’s kiss,"{'neg': 0.0, 'neu': 0.556, 'pos': 0.444, 'compound': 0.886}",0.886,pos
40,40,88572,2024-08-05,Kayla B,I use this tea to relax and sleep. It works great. ,"{'neg': 0.0, 'neu': 0.533, 'pos': 0.467, 'compound': 0.7906}",0.7906,pos
41,41,88572,2024-08-01,,I love the taste of this tea and I see results for drinking it at night,"{'neg': 0.0, 'neu': 0.756, 'pos': 0.244, 'compound': 0.6369}",0.6369,pos
42,42,88572,2024-06-24,,"I adore this tea blend, tastes great and it's very comforting. the only downside is that it's a little expensive though.","{'neg': 0.072, 'neu': 0.542, 'pos': 0.386, 'compound': 0.8655}",0.8655,pos
43,43,88572,2024-06-23,Great!,"The taste is fresh.  Caffeine free, I can have good sleep even drink it at night.","{'neg': 0.0, 'neu': 0.585, 'pos': 0.415, 'compound': 0.8176}",0.8176,pos
44,44,88572,2024-05-24,delicious,"Excellent tea, delicious as a bedtime treat. Mild flavor, good ingredients. Tastes good with a slice of lemon.","{'neg': 0.0, 'neu': 0.409, 'pos': 0.591, 'compound': 0.9423}",0.9423,pos
45,45,88572,2024-05-05,Very tasty and definitely planning to order again,"Very tasty and definitely planning to order again. It's also delicious cold
","{'neg': 0.0, 'neu': 0.6, 'pos': 0.4, 'compound': 0.7693}",0.7693,pos
46,46,88572,2024-04-18,Great taste,"The taste is wonderful, i felt relaxed as I drank it. Didn’t add milk, only honey. Thankyou","{'neg': 0.0, 'neu': 0.653, 'pos': 0.347, 'compound': 0.7845}",0.7845,pos
47,47,88572,2024-04-14,it´s my favorite of this tea´s brand,"These teas taste great, I highly recommend them if you don't know which one to buy","{'neg': 0.0, 'neu': 0.594, 'pos': 0.406, 'compound': 0.8016}",0.8016,pos
48,48,88572,2024-04-13,review,Great taste and smell good. Nice ingredients and easy to use,"{'neg': 0.0, 'neu': 0.355, 'pos': 0.645, 'compound': 0.9136}",0.9136,pos
49,49,88572,2024-04-10,delicious,"apple and vanilla. Not too artificial, very tasty and relaxing","{'neg': 0.0, 'neu': 0.722, 'pos': 0.278, 'compound': 0.5367}",0.5367,pos
50,50,88572,2024-04-03,很好！,"Great scent of apple and cinnamon, as if we are having an apple pie as night food. ","{'neg': 0.0, 'neu': 0.796, 'pos': 0.204, 'compound': 0.6249}",0.6249,pos
51,51,88572,2024-03-29,Good and nice ,Taste is good and very nice ingredients and it is good for gifting too ,"{'neg': 0.0, 'neu': 0.553, 'pos': 0.447, 'compound': 0.8357}",0.8357,pos
52,52,88572,2024-02-25,Good one,I feel sleepy shorty after drink it and sleep better. ,"{'neg': 0.0, 'neu': 0.734, 'pos': 0.266, 'compound': 0.4404}",0.4404,pos
53,53,88572,2024-02-13,,good quality and taste. relaxing apple blend taste tea. good package size,"{'neg': 0.0, 'neu': 0.5, 'pos': 0.5, 'compound': 0.8402}",0.8402,pos
54,54,88572,2024-02-08,Delicious ,This is a winner you dont even need to add sugar ad it helps sleep ,"{'neg': 0.0, 'neu': 0.652, 'pos': 0.348, 'compound': 0.7506}",0.7506,pos
55,55,88572,2024-01-30,,"Use is easy
Quality is perfect and good size 
The package is perfect 
Benefit is perfect 
Color and texture are so good","{'neg': 0.0, 'neu': 0.397, 'pos': 0.603, 'compound': 0.9712}",0.9712,pos
56,56,88572,2024-01-10,Delicious!,"Deliciously smooth, helps with relaxation, smells delightful - what more could you want in a tea?","{'neg': 0.0, 'neu': 0.387, 'pos': 0.613, 'compound': 0.9226}",0.9226,pos
57,57,88572,2023-12-21,Great taste,Great taste and adds to the health benefits list. A little pricey though ,"{'neg': 0.0, 'neu': 0.599, 'pos': 0.401, 'compound': 0.7717}",0.7717,pos
58,58,88572,2023-12-02,,"The brand of the tea is excellent!  Good and high quality.  High quality tea bags.  The tea is delicious, excellent!  and healthy","{'neg': 0.0, 'neu': 0.496, 'pos': 0.504, 'compound': 0.9537}",0.9537,pos
59,59,88572,2023-11-26,My favorite tea,"I love this tea at night relaxing . It has a great flavor, and aroma.","{'neg': 0.0, 'neu': 0.439, 'pos': 0.561, 'compound': 0.91}",0.91,pos
60,60,88572,2023-11-11,Tastes special!,"I love fruity tea. It is sweet but not too sweet and helps me relax at bedtime.
","{'neg': 0.0, 'neu': 0.41, 'pos': 0.59, 'compound': 0.9418}",0.9418,pos
61,61,88572,2023-10-31,Wonderful flavor,I like twinings and this tea has a wonderful flavor plus a calming effect ,"{'neg': 0.0, 'neu': 0.473, 'pos': 0.527, 'compound': 0.836}",0.836,pos
62,62,88572,2023-03-07,,Good quality tea.. wish it was organic but atleast it has natural ingredients.. my father uses it to unwind before sleep.. he likes the taste and has really benefited from it since he started drinking it.. the size for the price is good and it's hard to find this blend in stores..,"{'neg': 0.026, 'neu': 0.74, 'pos': 0.235, 'compound': 0.9186}",0.9186,pos
63,63,88572,2024-10-15,好的,It's in good quality. Taste fruity tea. A bag can serve one to two cup,"{'neg': 0.0, 'neu': 0.818, 'pos': 0.182, 'compound': 0.4404}",0.4404,pos
64,64,88572,2024-09-17,good,"it's good, but i dont like sweetness hitting in the back of the throat..","{'neg': 0.338, 'neu': 0.554, 'pos': 0.108, 'compound': -0.6318}",-0.6318,neg
65,65,88572,2024-01-21,High quality tea bags,Very high quality ingredients easy to use and nice package ,"{'neg': 0.0, 'neu': 0.584, 'pos': 0.416, 'compound': 0.6908}",0.6908,pos
66,66,88572,2023-11-25,Ok tea,Something about the flavour of this tea I find strange.,"{'neg': 0.184, 'neu': 0.816, 'pos': 0.0, 'compound': -0.2023}",-0.2023,neg
67,67,88572,2023-10-17,,"Thank you very much for this product, it suited me, I like the packaging, comfortable and stylish, I will order more of these products, and recommend them to all my friends and relatives! good!!
","{'neg': 0.0, 'neu': 0.595, 'pos': 0.405, 'compound': 0.9491}",0.9491,pos
68,68,88572,2023-10-05,Great with honey ,"I love this tea at night with a bit of honey. It is truly relaxing and has such a cozy scent, I love having this before bed to wind down. I love all teas by this brand.","{'neg': 0.0, 'neu': 0.565, 'pos': 0.435, 'compound': 0.9638}",0.9638,pos
69,69,88572,2023-08-28,Great flavor,"One of our favorites. 
You can feel the cinnamon and the combination with the chamomile and vanilla.
It's caffein free!!! TWININGS really knows to make TEA :)","{'neg': 0.0, 'neu': 0.706, 'pos': 0.294, 'compound': 0.8743}",0.8743,pos
70,70,88572,2023-08-26,Good sleep,"Recently can't sleep well, before bedtime I will drink a cup of apple tea before sleep. I felt much better,. I have a good sleep on bed ","{'neg': 0.073, 'neu': 0.809, 'pos': 0.117, 'compound': 0.27}",0.27,pos
71,71,88572,2023-08-24,,"If you're looking for a really yummy bedtime tea, this one is for. It doesn't have caffeine and a combination of Apple and vanilla is so good. ","{'neg': 0.0, 'neu': 0.756, 'pos': 0.244, 'compound': 0.8143}",0.8143,pos
72,72,88572,2023-08-02,Works well,"I gave a cup of this to my step-dad after dinner, and he started falling asleep on the couch so I guess it was quite effective.","{'neg': 0.062, 'neu': 0.808, 'pos': 0.131, 'compound': 0.4201}",0.4201,pos
73,73,88572,2023-07-24,Must have tea to unwind,This is a must have tea for those who want to unwind before sleep or to help with falling asleep. It has one of the higher passion flower content compared to most teas out there and I also enjoy the taste very much - highly recommended ,"{'neg': 0.031, 'neu': 0.696, 'pos': 0.273, 'compound': 0.8898}",0.8898,pos
74,74,88572,2023-05-30,,My sister is addicted to this tea. She says it helps her body relax when she drinks it at night. It b came part of her routine. It’s naturally caffeine free and the taste is very warm and autumnal. ,"{'neg': 0.0, 'neu': 0.756, 'pos': 0.244, 'compound': 0.8748}",0.8748,pos
75,75,88572,2023-05-03,very soothing for sleep,"When I can't sleep this is what I go to. It has a pleasant aroma and taste and calms the body, works for me.","{'neg': 0.0, 'neu': 0.772, 'pos': 0.228, 'compound': 0.6808}",0.6808,pos
76,76,88572,2023-04-27,,"Great taste and of high quality. Caffeine free tea excellent blend beneficial for relaxation and promotes sleep. I use it for relaxing and sleep. Package catches the eye with a picture of all ingredients. 
","{'neg': 0.0, 'neu': 0.521, 'pos': 0.479, 'compound': 0.9719}",0.9719,pos
77,77,88572,2022-12-20,최고!,"I received the product well. Thank you for the fast and accurate delivery. I will promote a lot around cheap and high-quality products. thank you
","{'neg': 0.0, 'neu': 0.65, 'pos': 0.35, 'compound': 0.8271}",0.8271,pos
78,78,88572,2022-12-18,최고!,"I received the product well. Thank you for the fast and accurate delivery. I will promote a lot around cheap and high-quality products. thank you
","{'neg': 0.0, 'neu': 0.65, 'pos': 0.35, 'compound': 0.8271}",0.8271,pos
79,79,88572,2022-05-04,I LOVE this tea,"Love love LOVE this. This is a great quality amazing blend tea. I keep repurchasing it. Fragrance has strong notes of vanilla and spiced apple, the passionflower and chamomile are faint scents. Tastes like sweet apple/chamomile tea. Some might only like it in winter as it is more of a warm smell/taste tea, but i love it and use it throughout the year. So relaxing and soothing. I usually have a cup while watching TV before getting into bed. Each tea bag gives you one serving (1 cup) of tea, though it can be used again by pouring hot water though wont be as tasty or fragrant. Definitely recommend this.","{'neg': 0.0, 'neu': 0.666, 'pos': 0.334, 'compound': 0.9907}",0.9907,pos
80,80,88572,2024-03-13,Weak brew,"Bought it to hopefully help with sleep, the brew is a little weak though, but quite fragrant nevertheless.","{'neg': 0.092, 'neu': 0.718, 'pos': 0.19, 'compound': 0.2255}",0.2255,pos
81,81,88572,2023-06-23,Excellent!,I was looking for teas without caffein and this one suits the need. Delicate aroma with slight apple and cinamone frangrance. Can be used also for cold tea decanter to serve during the summer. As a fan of tea I am always looking for new ones. ,"{'neg': 0.0, 'neu': 0.893, 'pos': 0.107, 'compound': 0.4215}",0.4215,pos
82,82,88572,2023-05-04,,"Apple and cinnamon is a magical combo for a winter time, however the scent of spices was kind of mild. the taste of passionflower was quite strong though. it's said to be rich in antioxidants. ","{'neg': 0.0, 'neu': 0.779, 'pos': 0.221, 'compound': 0.8173}",0.8173,pos
83,83,88572,2023-04-22,,"I like this tea. 
You can taste the chamomile, vanilla, and cinnamon, but the apples not so much. 
I don’t mind that as I love these ingredients. 
It is very enjoyable to unwind with. ","{'neg': 0.0, 'neu': 0.703, 'pos': 0.297, 'compound': 0.9159}",0.9159,pos
84,84,88572,2023-03-09,,"Twining is my favourite brand of quality tea. The size is just right even for first time buyers. I usually buy the cold-infuse line, this time I opted for one to be infused in hot water. One word, it smells & tastes amazing!","{'neg': 0.0, 'neu': 0.905, 'pos': 0.095, 'compound': 0.6239}",0.6239,pos
85,85,88572,2022-04-15,,Excellent taste and aroma. 1 bag per mug is a good balance to create the result. Also tastes cold. Creates nice aroma mix with loose teas such as chamomile or ginger lemon. Add 2 bags for a can of 8-12 cups + the loose tea at 1 teaspoon per 2 cups.,"{'neg': 0.083, 'neu': 0.628, 'pos': 0.289, 'compound': 0.8591}",0.8591,pos
86,86,88572,2022-01-30,"Aromatic, blended and lovely","I recently came across this product online and thought to take a chance and buy it. I am happy it paid off because this tea blend has no caffeine and is a perfect nighttime drink. The taste ranges from sweet from the passionflower and vanilla to a spiced apple flavour that is not over powering as it simply hints to warm apple. To me, each sip brings an array of the flavours that all seem to be distinct yet blend nicely. If you enjoy Twinings teas, this is simply another signature of their ability to blend some truly  lovely tea. I make one cup a night and I find that is filling and it helps me relax as I like to take in the aroma as well as it seems to help me unwind. ","{'neg': 0.014, 'neu': 0.695, 'pos': 0.291, 'compound': 0.9896}",0.9896,pos
