,product_id,date_posted,review_title,review_text
0,101961,2023-11-09,love it. ,"
MegaFood's Herbal Sleep in 60 capsules is a sleep game-changer. The subtle herbal scent adds a calming element to my bedtime routine. Its effectiveness in promoting restful sleep has made it a must-have in my nightly regimen."
1,101961,2024-01-19,,"I have difficulty falling asleep. Herbal sleep has helped me fall asleep at night and stop the overthinking. All ingredients are natural. the size of the pills is big, but could be swallowed with enough water. "
2,101961,2024-01-01,,"I can highly recommend iHerb to anyone looking for high-quality supplements at reasonable prices. You can always benefit from their extensive range of products available, wonderful quality, and reliable shipping."
3,101961,2024-05-08,Herbal Sleep ,"These work good to help me get to sleep.  However, I feel they wear off after a few hours & I am awake again.  I do like this brand in other products that I have tried.  Easy to swallow. "
4,101961,2024-02-10,Helpful,This is one of the few things that has helped me fall into a deep sleep. After years of tossing and turning I’m finally able to dream and have a refreshing sleep.
5,101961,2024-02-19,,Give you good sleep quality but expensive. Has nice ingredients.
6,101961,2022-11-11,Good buy,"I've been using herbal formulas similar to this one for years to fall asleep, and the ingredients as well as dosage in this quality product have been of benefit. The capsule size is a bit larger than I am used to, but the taste isn't bad when downing with water.  "
7,101961,2023-11-25,it's very hard to digest but helps deeper sleep,I've tried it 3 times so far and every time it causes a massive reflux and heartburn 
8,101961,2023-08-18,,"Suggested use

Take 1 capsule 1, 2 hours before bedtime with a beverage. May be taken on an empty stomach. Recommended to take for at least one week for best results.

Warnings"
9,101961,2022-07-11,,"It did help me to fall asleep deeply and with no dry mouth or foggy brain in the morning. Most importantly I did not wake up at 4am as I always do since my divorce. I am using it every Sunday when my anxiety is at its highest and on Friday evening when o know I will be able to sleep until late in the morning so I have a good rest. 
It worked for me. "
10,101961,2024-07-29,,I haven’t tried it yet but I hope it benefits me
11,101961,2023-12-09,Average,"Sometimes, it's working, but Something is not. Personal opinion melatonin is better "
12,101961,2023-09-11,,"good quality ingredients, helps with falling asleep easily, good size bottle "
13,101961,2023-10-04,Sleep support,Very good quality suppliment. Mega food is a brand i trust. 
14,101961,2023-09-19,,Very good quality good price I like iherb products they are trusted website 
15,101961,2023-08-30,,Works great and I love that everything in it is natural 
16,101961,2023-02-08,,"organic and reliable.
It helped me relaxed and easier falling asleep."
17,101961,2023-07-07,,Still testing them. But no dizzy head the second day. No flavor and easy to swallow. 
18,101961,2023-01-15,,Nice natural ingredients. But the dosage should be increased. Expected more
19,101961,2022-03-23,,I find it helpful for me to have a good sleep. Its herb ingredient make me having confidence to take it constantly without worrying side effects of other sleeping pills. Its quality undoubtedly good.
20,101961,2023-01-20,OK,"dosent work that good, but better than nothing I guess"
21,101961,2022-06-04,,High quality easy to digest perfect benefit to enjoy deep sleep in addition natural ingredients 
22,101961,2022-05-31,,Have tried other sleep aids. This one by far is one of the best.
23,101961,2022-01-25,Great experience!,"Wonderful product, best prices and fast shipping and delivery. Great experience!"
24,101961,2022-03-18,,It really help with insomnia 
25,101961,2021-09-03,,Really helps to fall asleep. I take it together with Melatonin 15mg
26,101961,2022-07-12,Excellent product.  Very calming and totally herbal.  ,"Great product, quality herbal mongmo ingredients 
"
27,101961,2022-04-11,,Good effect for me! I like the value too!
28,101961,2020-12-16,,"Works,but it took time"
29,101961,2024-07-14,,"The quality of this product is simply the best on the market, it’s a big +, the composition is no different from competitors’ products, but I had no questions about it, the packaging is good and reliable, everything arrived intact without any defects or damage, the advantage for me is a good price for such a quality product"
30,101961,2024-06-08,,"Quality, package size and ingredients are important when choosing products. When purchasing, you should pay attention to the transparency of the packaging to assess the condition of the product. Reading the ingredients will help you avoid unwanted ingredients. The size of the package depends on needs and preferences, and whether the product will last after opening. It is important to take your own dietary requirements and goals into account when choosing foods."
31,101961,2024-01-27,,"the quality is excellent, the ingredients are clean, the size is convenient, the packaging is glass, the result is there, the energy is there, the taste is neutral, the benefits are there"
32,101961,2023-12-26,Sleep aid,"Pure natural herbal ingredients, with a slight smell. Take it before going to bed. The effect has not been seen yet. It should be taken for a long time before it will take effect."
33,101961,2023-12-19,Herbal sleep,Pure plant formula. I bought this for my relative. She has poor sleep quality due to high work pressure. I haven’t consulted her about the effect of taking it.
34,101961,2023-03-25,,"The ingredients are simple and the effect is very good. Occasionally, I suffer from insomnia, and my friend introduced it to use. It is really effective and can increase the time of deep sleep. The price of buying on iHerb is much more reasonable. I am happy to use it and recommend it to everyone"
35,101961,2024-08-22,efficient,It’s very relaxing and helps you sleep before going to bed at night.
36,101961,2024-06-27,excellent dose ,"Excellent quality, good ingredient, convenient size, good packaging, advantage in the price of the product, taste, I definitely recommend it!"
37,101961,2023-10-31,,"quality product with natural ingredients, capsule size is normal. the packaging is correct, no unpleasant taste. this food supplement has a lot of benefits"
38,101961,2023-10-08,ME sleep,"The quality of the ingredients and the dosage of each plant provides a sleep benefit. Despite a slight taste and the size of the lozenges, I do not see any problem in being able to swallow one with only a glass of water. This product allows you to regain normal sleep if you were to have slight sleep disorders"
39,101961,2022-11-30,Improve mother's sleep quality,"My mother can only sleep intermittently for three or four hours every night when she is getting older. Now, she takes one pill an hour before, and can sleep for four hours continuously in about half a month. to sleep"
40,101961,2024-10-07,,"It seems to be effective, it contains valerian, a plant ingredient"
41,101961,2024-07-26,thank you,I definitely feel like I'm sleeping well
42,101961,2023-03-29,,"I haven’t been sleeping well enough, and I wake up easily in the middle of the day. I made some herbal adjustments. I hope it will be useful."
43,101961,2023-01-14,,"MegaFood Herbal Sleep Formula provides a sense of relaxation and restorative sleep. Valerian and Hops are used to promote restful sleep for those with occasional insomnia, while Passion Flower and Sensoril® Ashwagandha calm the mind and body to help release tension."
44,101961,2023-08-30,,"The smell is very, very beautiful. It is good and wonderful. Its quality is excellent. The size is suitable"
45,101961,2023-07-23,Excellent!,Excellent product! Fully complies with the described criteria and qualities indicated on the label!
46,101961,2023-07-18,,Additive with a natural composition. Helps to fall asleep faster and relieve nervous tension.
47,101961,2023-02-27,,"I have a sleep disorder. I eat it sometimes when I feel bad. Any help. It's not dramatic, though."
48,101961,2023-01-20,,"Herbal Sleep natural ingredients, comfortable dosage, pleasant taste, brings many benefits"
49,101961,2022-12-12,Excellent!,Very good product. I am really satisfied. I recommand it
50,101961,2022-11-05,,I am happy to purchase this product. Very helpful and recommended.
51,101961,2023-05-31,,"Organic herbs are very useful for falling asleep, falling asleep, and deep sleep. I liked it, but its percentage is light, and it needs two or three pills"
52,101961,2022-09-19,,"I used it for 4 days, and I didn't see a strong result, but it says at least a week on it. Also, this is not for severe insomnia. I advise for insomnia and depression the legal ruqyah and the Quran"
53,101961,2023-07-06,"Poor sleep, hope it works",Sleep doesn't seem to improve much after taking it
54,101961,2022-09-18,,"It's really good to eat and sleep, it's very convenient to buy here"
55,101961,2023-06-05,,Thank you always for quick delivery and convenient ordering. I am eating well. Looking forward to the effect.
56,101961,2021-02-10,,Recently my husband and I have been ill. Now we are suffering from insomnia. I took it as recommended to calm down and improve the quality of sleep.
57,101961,2022-09-17,,"Bought it for my son, I have repurchased it many times"
58,101961,2023-05-05,,"It works, sleep better"
59,101961,2023-03-19,,"The smell is very smelly, the effect is average, and it is not obvious for alleviating sleep disorders"
60,101961,2023-09-22,First purchase,I felt that melatonin was more effective.
61,101961,2021-08-23,,The supplement is not for very severe problems and insomnia.
62,101961,2022-10-13,,Sleep quality is really good after use👍👍👍😌
63,101961,2022-05-20,,recommend. good supplement. good composition.
64,101961,2021-02-09,,as a sedative is wonderful. and the firm I trust
65,101961,2021-02-01,Soothes well!,"I don't really want to sleep with them, I have no problems with sleep. I took more as a sedative - it works! )"
66,101961,2021-01-14,,"It contains all the soothing herbs, my husband really liked the result. Sleep is deeper and more restful."
67,101961,2022-03-26,,"Wonderful improves sleep, calms and wakes up without disturbance"
68,101961,2021-08-11,,"He can't put me to sleep right away, it may take longer to observe. But i like his ingredients"
69,101961,2021-06-24,,"a good option for a natural sleeping pill. does not work instantly, but with a cumulative effect"
70,101961,2021-02-24,Difficulty expecting effects,"I ate because of insomnia, but I am unsatisfied. The ingredients are good, but it is difficult to expect a great effect for people with severe insomnia."
71,101961,2022-06-28,,improves mood
72,101961,2021-09-05,,I recommend it
73,101961,2021-06-01,very nice!!,Natural herbal ingredients make people feel at ease!!
74,101961,2021-05-02,,"Helps with insomnia, but wakes up often at dawn"
75,101961,2021-03-05,,"An excellent product with a good composition, works great"
76,101961,2021-03-03,,Did help me sleep more deeply
77,101961,2021-02-21,Help deep sleep,"Help deep sleep, less dreams, sleep soundly"
78,101961,2021-01-22,,Works great! I fall asleep quickly.
79,101961,2021-05-14,,It didn't suit me and it smelled bad
80,101961,2021-03-05,,I have been drinking for about 1.5 weeks. The effect is not really felt :(
81,101961,2021-01-27,,good drug
82,101961,2021-01-09,Gradually induces deep sleep,I really liked it!
