,product_id,date_posted,review_title,review_text
0,103318,2024-05-20,,"I like this product because it's melatonin free and you can take it without any water it just melts and the size and taste are fine. 1 pill every other night helped me relax and fall asleep on those rare occasions when I can't sleep. And it didn't make me groggy the next morning. What i love mos is the natural ingredients and the quality that follows. It is soft though, so not for rough insomnia episodes."
1,103318,2024-05-14,SleepCalm,"The tabs dissolve quickly under the tongue.  They are a little sweet but not unpleasant taste.  Boiron products are good quality without added junky ingredients.  2 tabs before bed help me drift off to sleep on nights when my mind is too active.  I like that this product does not cause drowsiness the next day, "
2,103318,2024-10-15,SleepCalm,"SleepCalm Meltaway Tablets are an excellent product designed for those seeking natural sleep support. The quality of the ingredients is apparent, and I appreciate that the formulation is free from artificial additives and preservatives. The compact box is easy to store, and the label provides clear information on the dosage and ingredients."
3,103318,2024-10-13,"SleepCalm, Unflavore","I highly recommend SleepCalm, Unflavored Meltaway Tablets for anyone looking to improve their sleep quality and establish a more peaceful nighttime routine. Its effectiveness, high-quality ingredients, and convenience make it a standout product in the realm of sleep aids. The meltaway tablets are easy to take and have a pleasant, subtle taste that doesn’t leave any aftertaste."
4,103318,2024-10-11,Work well,This works well in conjunction with coffee cruda. I never used the tablets on their own so I can’t speak on their efficiency just on their own. I take only 2 tablets an hour before bedtime and then take coffee cruda (6 pellets) and then a magnesium pill (only 50mg) and this regime works!
5,103318,2024-09-30,WOW,"so surprised to see soemthing that can help me sleep but doesnt cause drousiness,
i have an 8 month old so i have to get up in the middle of the night allot.
this helps me stay calm, sleep easy without enxiety but still get up tp the baby safely"
6,103318,2024-09-25,Boiron SleepCalm,I’ve been taking them for a few weeks now and they seem to help me sleep all night. I do have to take 3 and it took a few nights before they started working. I like the melt in the month tablets instead of taking a pill with water before bed. 
7,103318,2024-09-24,,"Boiron SleepCalm offers a natural, homeopathic option for those seeking help with occasional sleeplessness, and the meltaway tablets are convenient to take without water. The unflavored formula is especially nice for those who prefer a tasteless supplement, and it's non-habit forming, making it a gentle choice for winding down before bed. Users often appreciate the subtle yet effective support it provides for relaxation and a more restful night’s sleep, without the grogginess that can come from stronger sleep aids. However, since it’s a homeopathic product, the effects may be mild and vary from person to person, making it less effective for t




"
8,103318,2024-09-09,,"Boiron SleepCalm Unflavored Meltaway Tablets offer a convenient and gentle solution for those struggling with occasional sleeplessness or restless nights. The unflavored tablets dissolve quickly under the tongue, making them easy to take without any lingering taste or aftertaste. With 60 tablets per bottle, it provides a reliable supply for ongoing support, aiming to promote a restful night's sleep without the grogginess associated with some sleep aids. It’s a great choice for anyone seeking a natural, homeopathic remedy for improving sleep quality and overall relaxation.







"
9,103318,2024-09-05,Nighty Night,"I switched from a liquid drops brand of sleep aid to this one. I like it much better. Since I am a petite person, I find that one tablet is sufficient to bring on dreamland.  If I wake in the middle of the night, I reach for another one.  There's no ""drug hangover"" either that one experiences with commercial sleep aids. Additionally, Boiron is melatonin free which I prefer. "
10,103318,2024-08-27,Great product! ,"I am very happy with SleepCalm. It helps putting me asleep, keeps me asleep during the night and doesn’t make me feel groggy in the morning as the melatonin does. I have recommended it to my mom who is 80 yrs old and she finally found a relief with her aged related lack of sleep. I would recommend warmly.  "
11,103318,2024-08-20,Very helpful!,"I suffer with pretty severe post-menopausal symptoms at night, and tried many products to help with better sleep, with no success.  I love Boiron products in general, so had high hopes for this one, and was not disappointed.  Although it doesn’t prevent me having ‘episodes’ completely through the night, it does help with getting to sleep and staying asleep for much longer periods of time, which is a game-changer for me.   I love that it’s easy to take and is a natural product!  Thank you, Boiron, for this product, and  iHerb, for carrying it at a very reasonable price!"
12,103318,2024-07-08,Sleep ,"Find relief wherever you go with SleepCalm On the Go by Boiron. This over-the-counter sleep aid is powered by plants to relieve occasional sleeplessness and restless sleep.* Formulated to calm a restless mind, this non-habit forming medicine helps restore a healthy sleep pattern disrupted by nervousness, worries, exhaustion, jet lag, or night shift work.* The melatonin-free meltaway pellets are convenient to take without water at bedtime, and can be taken on an empty stomach. SleepCalm On the Go pellets are offered in convenient, portable tubes for relief that travels with you. Non-habit forming meltaway pellets help you fall asleep and stay asleep.
Melatonin-free, plant-powered active ingredients relieve occasional sleeplessness, restless sleep, and intermittent awakening.*
No known drug interactions.
No artificial sweeteners, flavors, colors, or preservatives.
Recommended for adults and children ages 12 and up.
Box contains two compact and portable tubes of pellets ideal for travel.
HSA & FSA eligible.
Boiron’s sleep relief line also includes SleepCalm Meltaway Tablets, SleepCalm Kids Meltaway Pellets, and SleepCalm Kids Pre-Measured Liquid Doses.
Also try StressCalm® for daytime symptoms of stress. Size and dosage are also on a high quality"
13,103318,2024-04-30,Great!,"I love products from Boiron. I was using melatonin, but that made me feel very groggy when I woke up the next morning.
These are terrific - they get you to fall asleep, stay asleep, and I feel good the next morning. I like that the ingredients are melatonin-free and homeopathic. Very easy to take."
14,103318,2024-04-26,,"excellent quality for those who can't sleep. after work, fatigue and stress also affect. then I couldn't sleep for a long time. I took 2 tablets, they dissolve very quickly. then another one, just in case you don't wake up in the middle of the night. and in the morning I got up fresh and cheerful. I slept fine all night. My head doesn't hurt."
15,103318,2024-04-16,Definitely helps!,Another quality product from Boiron! Helps calm you to sleep. No taste. I put under my tongue to absorb in. Great to use in the middle of the night too if you wake up & cant go back to sleep. Does not make you drowsy if you take at 3am & get up at 6am. 
16,103318,2024-04-13,Restful Sleep,"Boiron is an excellent Brand and this 
Item has been helpful to me in a time of anxiety and poor sleep.
It gently lulls you to sleep and although I may wake up earlier than I would like I do get restful sleep.
You can manage your dosage. There are no negative after effects."
17,103318,2024-03-09, Baby sleep,"I use sllep calm, when i have troubles with hormones and sleeping. It is high quality and tablets have good taste. Dosage and size are optimal. I sleep better when taking this tablets. Benefit is great. I like them, becouse they don’t ingredients, so i reccomend them to all."
18,103318,2024-03-04,These really help me stay asleep.,"Easy to use, I keep them on my bedside table. They taste good, dissolve quickly and I have been able to sleep better and most importantly stay asleep longer. No more waking up every couple of hours because of a restless mind.  I've known this brand for a long time and I know their products are high quality. It is homeopathic, so the ingredients are safe to use."
19,103318,2024-02-09,Good natural alternative ,"I used these to help with jet lag going to and from Australia, but also during menopause if awake half the night. They are a very good natural alternative that sends you off to sleep with half and hour, and give a good 5-7 hours of peaceful sleep. I have gifted them to a friend who is an insomniac. "
20,103318,2024-01-19,Good for Occasional Insomnia  ,"Boiron products are always great quality. This homeopathic blend has 4 ingredients to help with falling asleep and staying asleep. The taste is slightly sweet, place under tongue and let them dissolve. My insomnia is quite terrible and requires rx. Even with 2 tablets I had some mid night waking but falling asleep was easier. "
21,103318,2024-01-12,A fantastic sleep aid for me.,"I had unwittingly become addicted to Ambien.  I was on a medication that gave me insomnia and doctors prescribed Ambien.  I took those for about 6 weeks and when I quit the culprit medication I experienced severe rebound insomnia.  It was an awful time.  I tried everything from GABA, melatonin, Valerian root - nothing helped.  Then I thought I’d make a final attempt and started taking Sleep Calm, and it was fantastic.  Now after 2 months I don’t even need any sleep aid anymore, but have Sleep Calm in my cupboard, just in case.  A great product for me."
22,103318,2023-12-19,Great addidtion to my sleep routine,"I have been experiencing insomnia lately to do some medications that I am taking that induce insomnia and restless sleep. I discovered SleepCalm not long ago and I am finally happy to say that I am sleeping better now. I am coupling SleepCalm with Mason Natural Sleep and Mason Natual Melatonin 5mg. I can garantee you will not wake up at night with this combination. Finally, something that works for me."
23,103318,2023-12-06,,"I tried these tablets once, and it took quite a while to fall asleep, but they helped in the end. Maybe it takes some time to feel the benefits. I will try them again. The taste is delicate so you don't feel something strong  in your mouth when you try to fall asleep."
24,103318,2023-10-25,,This is one of my favorite brands. I bought similar products in the past. I find them useful though you can't see the effect straightaway.  I bought it persuaded by the reviews of other buyers. Can't wait to try this one as well. I trust it will work too.
25,103318,2023-10-23,Another homeopathic winner,It works for me and I take it mostly when I’ve fallen asleep in front of the tv to keep myself from waking up and not falling back to sleep right away. I never feel drugged by it. As with all homeopathic remedies it never has the side effects that Rx meds do. 
26,103318,2024-09-26,Good sleep aide,"This is a great alternative to taking melatonin.  You get  a lot for the price, and it's homeopathic, which is gentle but effective.  Easy to take, they dissolve quickly, and they are easy to take with you when travelling.  Sometimes, when I have a particularly difficult time falling asleep, I take this as well as taking a melatonin supplemement, and it works.  No groggy, foggy or drugged feeling in the morning."
27,103318,2024-09-14,helps,I take  2 of these if I'm having trouble getting to sleep . Sometimes I have to take  2 more after a few minutes but they seem to do the trick for me .
28,103318,2024-05-16,These really helped ,I’m surprised and delighted that these homeopathic calming pills actually work. I’d been on sleeping aids for approximately 25 years without any knowledge of their long term side effects. I’ve tapered them down to a forth but it hasn’t been an easy task. These helped me taper off that last 1/4 and I’m thrilled to be off of the sleepinv pills for good! I hope this helps anyone who has trouble falling asleep over waking up several times a night as I’m the former type 
29,103318,2024-03-12,maybe it helps?,"At first I did not think this was at all effective, but actually it sometimes works and sometimes not. On the plus side, it leaves no aftertaste or morning grogginess and if/when I do sleep after taking this I feel like I am more deeply rested, though I still have to wake many times to go to the bathroom etc.  Could be a placebo effect, in which case it is an expensive one. On balance I think the benefit is marginal but still I am reordering out of desperation because I have not found anything else that suits me better."
30,103318,2023-11-30,Does seem to help me sleep.,"I use this as I wake 3 or 4 times per night just to urinate. I find if I'm having trouble getting back to sleep, these really do help. They are a bit expensive, though, so I only use sparingly. Easy to dissolve & taste is fine, they do help! "
31,103318,2023-11-10,Restful Nights with Sleep Calm Capsules - Naturally Effective!,"I've been using Sleep Calm capsules with natural ingredients for a while now, and I can't help but share my positive experience. These capsules have become my go-to solution for achieving restful and rejuvenating sleep.

What sets Sleep Calm apart is its commitment to natural ingredients. Knowing that I'm not putting any harsh chemicals or synthetic compounds into my body is reassuring. The blend of natural ingredients, such as herbal extracts and essential nutrients, is thoughtfully designed to promote relaxation and support a peaceful night's sleep."
32,103318,2024-10-19,Recommend ,I was surprised at how well this worked . Helps me to wind down and fall asleep . As it is all natural I am never anxious in having to take another dose if I wake up at 3 am . 
33,103318,2024-10-13,Works as Advertised ,Boiron makes quality products and this one is no exception. Tried it for the first time last night and I had a great nights sleep. I relaxed and no tossing or turning. It worked for me. 
34,103318,2024-10-11,Excellent homeopathic sleep aid ,"
SleepCalm offers a natural approach to improving sleep quality. This Boiron product may help reduce sleeplessness and promote more restful sleep without the potential side effects of traditional sleep medications.​​​​​​​​​​​​​​​​"
35,103318,2024-10-07,Awesome,I have terrible sleep issues and was skeptical about whether this could help but these tablets are amazing for falling asleep and staying asleep. I highly recommend them to anyone having sleep issues
36,103318,2024-09-18,sleep,If I awake during the night this product helps me get back to sleep quickly and no grogginess in the morning.  Tablets are fast dissolving.
37,103318,2024-09-18,,"Thank you very much for this product, it suited me, I like the packaging, comfortable and stylish, I will order more of these products, and recommend them to all my friends and relatives! good!!
"
38,103318,2024-09-13,great product,I love this product! Have been using it for several years and it is consistent in getting a good deep night's sleep. I fall asleep quickly and sleep through the night.
39,103318,2024-09-12,Great,The quality is good it tastes sweet under my tongue it helps me relax and fall asleep I use it with melatonin gummies because I’ve suffered from insomnia for a long time now and these tablets have benefit me to fix my sleep 👍🏻
40,103318,2024-08-30,This actually works,I used to suffer from waking up in the middle of the night and I feel like this is the only product that works for me.   I've tried just about everything.  I'm so happy I found this!  Hopefully it works for you too!
41,103318,2024-08-26,Love this product!,"Sleep Calm is gentle and works well. Also, there is no after effect in the morning. I use 2 tabs at bedtime and as needed 2 tabs in the middle of the night. Probably my all time favorite sleep supplement!"
42,103318,2024-07-28,It Works! ,"I came back for a second buy. It does works, specially in those nights where you wake up in the middle of the night and finding it hard to go back to sleep."
43,103318,2024-07-27,Good,I have found all of the Boiron Meltaway Tablets to be very easy to use and handy to carry along.  This one contains good ingredients to aid in relaxation.
44,103318,2024-07-26,Tablets melts easily under tongue,I take on nights where I have trouble falling asleep. Works about 20-30 minutes after taking. Your mind somehow slows down a bit and will have the urge to go & sleep.
45,103318,2024-07-23,Great ,I use it for when i can’t sleep i even give my mom some and she like it too it doesn’t have any taste and work good
46,103318,2024-07-11,Great in the right dosage and good taste,"Great use of, good quality, right size , age appropriate, package arrived safely immense benefits . Gentle on the system.. you feel good.. package was dry.. sensitive to skin.. compostion is great"
47,103318,2024-07-09,wonderful and natural,"Taking this sleep tablet when in need, about 30 mins then i could fall asleep naturally, and woke up without drowsy. No habit taken. Great to use."
48,103318,2024-06-24,perfect,box and tablets were in good quality and the ingredients just what I like tablets were small ish size easy to melt on tongue the dosage I'd use is 1 or 2 tablets at night helps with sleep.
49,103318,2024-06-23,,"Scent ✔️
Use ✔️
Quality ✔️
Size ✔️
Age ✔️
Package ✔️
Benefit ✔️
Composition ✔️
Hair ✔️
Scalp ✔️
Sensitive ✔️
Moisturizer ✔️
Very good product and very clean cent I like it and I will buy it again and again and again 
"
50,103318,2024-06-07,Works great!,"Finally a sleeping aid that does not makes you drowsy in the morning.
I even took it on a long flight and help me catch some sleep."
51,103318,2024-06-02,ok,"very like this taste use ingredient quality 
must buy this and taste. package its ok. size ok. supplement age benefit serving very good. frequency and improvement all its okay. can buy "
52,103318,2024-05-29,sleep without effort,These work well to summon sleep without having to try too hard. They do not leave me drowsy in the morning. I also don't feel like I've been knocked unconscious in order to sleep well. 
53,103318,2024-05-16,"Gentle, yet effective.","Is safe enough for anyone who is sensitive for any reason even me with my kidney disease.  There are no negative side effects, dissolves quickly, doesn't taste bitter and works."
54,103318,2024-05-02,Sleep aid ,These are good for bed time when littles aren’t tired enough to fall asleep! These just dissolve and so they don’t need to rebrush their teeth! 
55,103318,2024-05-01,Great product,"I've been taking these supplements for a few weeks now, and I'm incredibly impressed with the results. Not only have I noticed a significant improvement in my overall mood, but I've also experienced nice sleep. "
56,103318,2024-04-28,Good for getting back to sleep,This is nice to take when you wake up in the middle of the night to help you fall back to sleep and no water necessary.
57,103318,2024-04-27,Natural and it works,I can depend on this supplement to help me get the rest I need. I never go without this supplement because they really do work.
58,103318,2024-04-25,Boiron Sleep Calm,"I like this product very much due to it's natural homeopathic compounds, I fall asleep much faster and wake up very refreshed after having a good deep regenerating sleep.  If you are a ""tosser and turner"" you need to try this product!!!"
59,103318,2024-04-22,Great,"This product is good because it is made of high-quality materials. This product will meet your needs and exceed your expectations. You will not regret buying this product because it is reliable, and affordable. I love this brand! "
60,103318,2024-04-14,Прекрасно!,"Thank you very much for this product, it suited me, I like the packaging, comfortable and stylish, I will order more of these products, and recommend them to all my friends and relatives! good!!
"
61,103318,2024-04-12,Game changer ,"I trust everything this brand puts out! Clean high quality ingredients, perfect dosage, generous size, no flavor so no bitter taste. If you can’t sleep, this would be a huge benefit for you to purchase "
62,103318,2024-03-22,,"I have been a loyal customer of iHerb Company for quite some time now. Finding products of high quality and variety is a pleasant experience. 
Their attention to detail is evident in the packaging of the merchandise. The products are delivered quickly and with care."
63,103318,2024-03-22,It works.,I use it every night and it is helpful and it brings relief from wakefulness; when I lie down I fall asleep very quickly. It is a great supplement. It has a good taste and is easy to use. I have always appreciated the quality of these products.
64,103318,2024-03-13,,Sleep Calm is a great alternative to melatonin. They have helped me relax and fall asleep. They do not make you drowsy and I like that they are homeopathic. 
65,103318,2024-02-29,Great,"The efficacy of the remedy is very good and the delivery is fast, so I often purchase it here. Iherb is a highly trusted platform."
66,103318,2024-02-13,Best sleep in ages!,"Have tried a few natural alternatives on the market and found this the best! Easy to take, I’ve found half doses work well for me.  Have fallen asleep swiftly and had good quality sleep. "
67,103318,2024-02-11,Helps keep me calm ,This product helps to ease my anxiety and keeps me calm around bedtime so that I benefit from a good night’s sleep. It tastes like nothing so it’s easy to take. 
68,103318,2024-02-07,These work!,"I’ve had good experience with this sleep aid. It does help me to fall asleep, sleep well, and not be tired or have any groggy side effects in the morning that I would sometimes experience when I took melatonin. "
69,103318,2024-01-27,Yes works,"The quality of this supplement product is so good. My age is 20. The package came in good condition. The ingredient is good, got benefits right away. Took this while on a diet. No taste. And no concern "
70,103318,2024-01-26,Really helps me fall asleep at night,I take two of these at bedtime and it really helps me relax and fall asleep. No weird grogginess in the morning. It's also a great remedy for waking in the middle of the night and difficulty getting back to sleep.
71,103318,2024-01-25,Great for gentle sleep aide,My husband used these as a nice gentle sleep aide. We love that it isn’t habit forming but gives you the sleep help when you need it. 
72,103318,2024-01-25,Easy to take,This is gentle and easy to take at night to help me sleep. I take one or two and it helps me fall asleep more easily.
73,103318,2023-12-17,A good nights sleep.,"I use this when I can’t get to sleep or when I can’t stay asleep.  It is a combo I keep on hand.  Another winner from Boiron.
One little tablet dissolved under the tongue makes such a difference."
74,103318,2023-12-16,Give to my teenage daughter,We really like these. Melatonin didn't work that well for her. This does though. She does have a very active mind so I do believe these do a great job at quietening her mind. We have bought them a few times now. 
75,103318,2023-12-01,OMg it works!,After Years and Years if insomnia and pharmacy. This one knocks you down in 20 minutes and it keeps you asleep whole night! Now buying second dose Because it helps. 
76,103318,2023-11-30,excellent,"It helped my overwhelmed teen to fall asleep. She took it for a couple of nights and after that, she was back to normal sleep pattern.  It is great to have on hand ""as needed"" "
77,103318,2023-11-26,Great for Falling Asleep at Night!,"SleepCalm helps me go to sleep pretty quickly. I take 2 tablets at bedtime. I still wake up once or twice during the night, but I fall back to sleep quickly too. As someone who suffers from insomnia occasionally, I find this product to be very effective."
78,103318,2023-11-13,,"Thank you very much for this product, it suited me, I like the packaging, comfortable and stylish, I will order more of these products, and recommend them to all my friends and relatives! good!!
"
79,103318,2023-11-09,Good homeopathic option to aid sleep,Boiron is a trusted quality French brand using best quality ingredients. Small size tablets with no taste are easy to place under the tongue. I feel it helped me to not wake up so many times in the night. Happy to have a homeopathic option to help me. 
80,103318,2023-11-06,Great sleep support!,"It definitely helps me sleep better.
Even if I do wake up during sleep, it helps me to get back to sleep quicker. I have successfully replaced Melatonin with this product and I'll continue to use it for sure!"
81,103318,2023-10-26,Best sleep aid ,I’ve tried OTC sedatives like panadol night and antihistamines as well as melatonin etc but nothing works as well as this (and magnolia bark/ Relora) it’s such a natural feeling to fall asleep and wake up 
82,103318,2023-03-25,,"Quality, ingredient and size is excellent for me, dosage is to drink two tabs which is effective for me, it benefit me a lot since sleep is sometimes a struggle although i tried to take only one at first, it also works somehow but two is more recommended. No after taste i can say,it is unflavored. And most of all you will not feel like you wanted to sleep again or groggy upon waking up from a nice long sleep."
