,product_id,date_posted,review_title,review_text
678,103318,2021-01-28,,I only take one tablet at night and I wake up naturally 8 hours later. 2 tablets made me a little groggy.
679,103318,2022-07-09,,Sleep much better after it.
680,103318,2022-07-08,,Hope it will work for me
681,103318,2022-06-22,,"Good product, aids in sleeping"
682,103318,2022-06-14,,didnt use it yet. will report when i will.
683,103318,2022-05-26,,"good for people who face problems, with sleeping"
684,103318,2022-05-19,,"Effective, but also gives a dry mouth, which wakes me up to drink water, so in other words it's not effective. "
685,103318,2022-04-01,,my friend tried it and she said it good
686,103318,2021-10-17,,"It didn’t work for me, I let someone else try. They will from melatonin to this brand. "
687,103318,2021-10-05,,"They are delicious and dissolve well, and work 9/10 times!  Quite happy."
688,103318,2021-08-19,really works,"it is really working, i use 2 , about 1 or 2 hours of sleeping time .. and i go to sleep no matter what .. "
689,103318,2021-07-06,It works!,It is natural and makes the sleepy more tight and less times waking in the night. 
690,103318,2021-06-23,,Allowed me some sleep but not much. Will continue use with hope it will eventually allow me more sleep. 
691,103318,2021-04-25,Useless,"Did not make me drowsy in the least.  I waited an hour for it to work, but to no avail.  I had to take a ativan to put me to sleep."
692,103318,2022-10-20,Not satisfied,"It didn’t work for me, I used it as per the instructions but still didn’t get sleepy."
693,103318,2022-10-20,,it was not effective for maybe for others but not for me 
694,103318,2022-09-25,,"Didn’t help my insomnia, but it helps you get an uninterrupted sleep "
695,103318,2022-08-14,,unfortunately no effect on me. I didn't sleep better with this.
696,103318,2022-06-13,,"they are not working, taste is good but not sure what dosage or active ingredient they use, would not buy again"
697,103318,2022-05-09,,I tried it but it didn't make me sleep it is very light 
698,103318,2022-04-10,Great!,"help me so much
"
699,103318,2022-03-04,,Love it
700,103318,2022-01-18,,Helps to sleep 
701,103318,2022-01-08,,good quality
702,103318,2022-01-07,,Love the Boiron remedies! 
703,103318,2021-11-03,,Good. 
704,103318,2021-11-01,,Didn't work for me. Too high melatonin levels cause adverse effect. 
705,103318,2021-10-28,,Perfect 
706,103318,2021-07-01,,"the first time i used it, definitely made me want to sleep. Tried it again and it did not have the same effect."
707,103318,2021-05-31,,Ok - wish they would bring back the stress relief tablets. Much superior. Probably won’t order these again 
708,103318,2021-04-04,,"Have used it for a week, but haven’t noticed any improvement. 
"
709,103318,2022-05-10,,not sure if these work or not
710,103318,2022-03-30,,didn't really have effect on me
711,103318,2021-03-20,低於平均值,did not feel sleepy the first time i take it but will try a few more time to see is it going to help me sleep ! 
712,103318,2022-04-04,,It’s good. 
713,103318,2022-02-18,,Help for sleeping 
714,103318,2021-12-24,,Helps me relaxing .
715,103318,2021-12-24,,effective 
716,103318,2021-10-14,,No improvement is sleep pattern in the night. Still wake up in the night
717,103318,2021-09-19,easy to consume sleep tablets,not very effective for my son who still stay awake late at night or wake up in the middle
718,103318,2021-09-09,,i didnt see much effect with helping me to sleep
719,103318,2021-09-02,一般,This one does it job but not as good as another brand I found in Iherb. Will stay with the other brand instead 
720,103318,2021-10-04,Прекрасно!,"very nice, I love it"
721,103318,2021-10-03,,Helpful at bedtime and after waking up at night.
722,103318,2021-09-25,,Nice item and very well packaged
723,103318,2021-09-18,,"For me works  well ! :-)  
Will buy again "
724,103318,2021-08-30,Works,For me personally it works. 
725,103318,2021-08-21,,nice product and packed well too
726,103318,2021-08-09,puts you to a great night of sleep,you sleep deeply and soundly with just 2 pills!
727,103318,2021-07-29,,"Finally, I found myself working stuff!"
728,103318,2021-07-14,,a great product to help with sleep
729,103318,2021-04-01,,This is quality homepathic formula!
730,103318,2021-01-25,,I'll try something else 
731,103318,2021-10-04,,Relaxing and sleepful night 
732,103318,2021-05-20,,bought it to fix my sleep issues but havent tried it yet . Will take it from time to time 
733,103318,2022-02-19,,It didn’t work
734,103318,2021-10-13,,A very good product for sleep!
735,103318,2021-10-03,,"i tried once, i had a good sleep."
736,103318,2021-05-31,Great product,Relaxes the body and helps to get asleep
737,103318,2021-05-24,,Doesn’t work. Didn’t help me sleep at all. 
738,103318,2021-05-17,,Some nights it helps some nights not as much
739,103318,2022-08-25,,Its not working for me 
740,103318,2022-07-19,,"Unfortunately, it didn't work on me."
741,103318,2022-07-12,,Didn’t work for me 
742,103318,2022-06-23,,Didn´t see results for my kid. 
743,103318,2022-06-01,,"Did not work at all, wouldn't buy again"
744,103318,2022-03-07,Not enough strong  to calm anxiety and sleep relaxed,Not effective as standard herbal form such passionflower 
745,103318,2022-03-01,,Every night I took two tab but no effect 
746,103318,2021-08-25,,Does not work for me. Melatonin is the right choice.
747,103318,2021-08-15,很好！,Just right for me
748,103318,2021-08-10,,Bought it and it hasn’t affected me at all. Took 2 pills of melatonin after 
749,103318,2021-07-28,,GOOD PRODUCTS
750,103318,2021-07-13,,Excellent!
751,103318,2021-06-04,,These work very well!
752,103318,2021-06-04,,works good
753,103318,2021-05-27,exelletn,best for sleep supplemeny
754,103318,2021-05-14,,it works
755,103318,2021-05-09,,Good quality
756,103318,2021-04-29,很好！,good
757,103318,2021-04-28,,Эффекта мама не ощутила ..
758,103318,2021-04-09,很好！,Good
759,103318,2021-04-07,,my insomnias best friend.
760,103318,2021-02-21,,Very good 
761,103318,2021-03-07,Sleep calm,Didnt do much as far as helping with sleep..
762,103318,2021-08-27,,I LIKE IT
763,103318,2021-06-18,,I guess it works
764,103318,2021-03-10,,It’s great..
765,103318,2022-06-03,,Low effect and slow
766,103318,2021-05-26,,Didn't work for me
767,103318,2021-06-06,لا بأس,Good 
768,103318,2021-05-26,,Helps me to sleep
769,103318,2021-05-05,,Буду пробовать вместо мелатонина
770,103318,2021-03-05,,not very effective
771,103318,2021-09-10,,Do not work for me 
772,103318,2021-05-01,,Useless! I wish I got melatonin instead...
773,103318,2024-09-15,"I'm not sure about the effect, but","It is tasteless and odorless, and it dissolves well, making it easy to eat. I tried it once, and I don't know if it was thanks to it, but I was able to sleep comfortably. It doesn't seem to have any bad ingredients, so I think it's okay to eat it occasionally."
774,103318,2024-05-28,First purchase,"My autistic child has trouble falling asleep at night, so I had been giving him a different supplement, but I switched to this one, which has less of a burden on the child. He still falls asleep easily, so I think this is fine. The size is easy to take. There is no particular taste."
775,103318,2023-11-29,,"Haven't tried it yet. But it's probably better than sleeping pills. All because it's natural. And safe to use. Size: 60 tablets. Take 2 tablets per day before bed. Small tablets, easy to take, easy to carry. After taking them, you still won't feel better sleep. You'll have to take it for a while. The price is reasonable. Quantity: 60 tablets. Can be taken for about 1 month. No taste, no smell. You can suck it or swallow it with water."
776,103318,2024-08-17,I feel lethargic.,"After eating, you will feel drowsy and yawn. If you put 2 tablets under your tongue and let them dissolve slowly, it will have the effect of making you feel drowsy like when you are sleepy and will eliminate the state of arousal. The ingredients are also natural, so I am looking forward to it. I ordered 3 more, so I will write an additional review."
777,103318,2024-08-03,Brand recommendation,"I bought it purely out of trust in this brand and tried it to see if it can help. I have no obvious impression of the exact effect because I bought it for my son. However, I believe that it will bring benefits and the weight of it. The quality of its ingredients is reassuring."
778,103318,2024-07-23,Looking forward to the above!,"I have tried many homeopathic remedies, but I felt that this one was relatively fast acting and effective. I take prescription medicine for insomnia, but I still use it when I can't sleep or when I want to get a good night's sleep. It doesn't interact with any other medicines, so it's a supplement I want to keep on hand. I recommend it."
779,103318,2024-05-26,It's the mildest sleep aid I've ever tried.,"I eat it occasionally, and I've tried many different products, but I feel like this product causes the least strain on my body the next day. L-theanine and valerian root make me feel a bit drowsy the next day, but this product actually helps me recover from fatigue, so I like it because it puts less strain on my body. However, as it says in the manual, it is not for long-term use."
780,103318,2024-05-25,It works!,"I tried so many things from natural ingredients, herbs, almost no effect. Surprisingly, it works! Dosage: sometimes 1 tablet is enough for me, sometimes I need 3. The effect is quick, there is no doubt about the quality and benefits of the product. I would like the tablet size to be smaller. The taste is fine. "
781,103318,2024-02-14,For sleep support,"The homeopathic remedy contains four types of remedies, Hyoscyamus, Passiflora, Nux moschata, and Stramonium, which are combined in effective potencies. Good points: When you can't sleep due to worries or stress, dissolve one pill under your tongue. It dissolves quickly in your mouth, so it's easy to use even before going to bed. There are no side effects, and it helps you sleep even when it's hot and tiring, so it's of good quality. One pill costs about 30 yen, so it's reasonably priced."
782,103318,2024-10-15,Sharrrrrr fall asleep,"The dosage is 2 tablets. Put 2 tablets under your tongue and let them dissolve gently. You will fall asleep easily. However, it is better to lie down comfortably and relax your whole body. Since they are small, they will dissolve immediately when placed under your tongue. Anyway, they are effective, so I recommend them to people who have trouble sleeping."
783,103318,2024-10-12,,"Meltaway tablets for a restful sleep have become a real find for me. I often had problems with falling asleep and the quality of sleep, and I tried many products, but none of them gave such an effect. The first thing I liked about Meltaway was their convenient form - the tablets quickly dissolve in the mouth, which is very convenient. You do not need to drink water, and the effect comes quite quickly. I noticed that after taking it, I become relaxed, without a feeling of drowsiness and lethargy, which sometimes happens with other products. I will also note that the tablets do not cause side effects such as dizziness or fatigue in the morning. I woke up fresh and ready for a new day. The price-quality ratio is also pleasing: for reasonable money I got a really effective product. I would recommend Meltaway to those who are looking for a natural solution to improve sleep, excellent. the size is small. you need to dissolve. there is a benefit I recommend "
784,103318,2024-09-30,Excellent!," I'm taking it not for the first time. Excellent quality. I drink it myself when I have stressful weeks, really calm falling asleep and easy waking up in the morning! Pleasant to taste, small in size. There are several parameters by which I chose it: Price, Product quality, Excellent result, Presence of a large number of useful substances, Convenient packaging and useful composition, Great Health Benefit, Natural Ingredients. I recommend this wonderful product to everyone, it fully corresponds to the description and expectations. No problems were found! I recommend it to everyone!"
785,103318,2024-09-06,great,"I take this instead of melatonin. First of all, I sleep refreshed and well, and since it is a homeopathic treatment, I have less mental burden. I don't know exactly when I fell asleep, but I wake up after a light sleep and it helps me sleep well when I usually have a lot of thoughts or am a little stressed. "
786,103318,2024-09-04,"Honestly, it's nice","I used it and took two pills and slept a very long sleep and it went away on the job. Maybe two pills were too much for me, but next time I will use one pill and God willing it will be beneficial for me. Honestly, these sleeping pills do not cause me headaches or nightmares, and I do not wake up feeling exhausted. It is a thousand times better than Panadol Night. I recommend it for those who suffer from lack of sleep. "
787,103318,2024-08-10,,"Great product, works 100%%%% ""I recently started taking sleeping pills and I have to admit that they really helped me regulate my sleep rhythm. Before, I suffered from insomnia for a long time, I often tossed and turned and couldn't fall asleep, even when I was very tired. Thanks to these pills, the process of falling asleep has become much easier - I fall asleep faster and deeper. Advantages: 1. **Effectiveness** - they really help you fall asleep without struggling for a long time. 2. **No feeling of ""heavyness"" in the morning** - I wake up fresh and rested. 3. **Gentle action** - there is no feeling of ""sudden"" effect, sleep comes gradually and naturally. Disadvantages: 1. **I do not recommend using them permanently** - it is better to take them in cycles to avoid getting used to them. 2. **Possible individual reactions** - the first few times I felt a slight drowsiness during the day, but it passed quickly. Overall, I am pleased with the results. The pills helped me improved sleep quality and significantly increased overall daytime productivity."""
788,103318,2024-07-29,,"There are several parameters based on which I chose it: Price, Quality of the product, Excellent Results, Availability of a large number of useful substances, Convenient Packaging and useful Ingredients, Great Health Benefits, Natural Ingredients. I recommend this wonderful product to everyone, it fully corresponds to the description and expectation. No problems identified!"
789,103318,2024-07-13,It works for me,"I have problems sleeping and if I take it for a while before going to bed along with another one from Boiron, the one for Stress works for me most of the nights. I have been taking it for a long time and I like that it does not cause unpleasant side effects and in general It has worked better for me than melatonin. I think that everyone reacts differently to supplements, but in my case I prefer to use products from recognized brands that do not cause side effects and dependency."
790,103318,2024-07-05,"The taste is not so good, but it works!","It has almost no taste, and when you put it under your tongue it sticks to your tongue and feels disgusting. It feels like hardened potato starch, and maybe because I'm used to taking remedies with sugar granules, the size seems large. I don't like the taste and the dry feeling, but it seems to be very effective. I can tell that it makes me sleepy right away, and I'm asleep before I know it. Of course, there are no side effects that linger the next day, and I think it's very high quality."
791,103318,2024-06-22,Good tablets,"Seems to be good quality, contains only natural ingredients, relatively large size, dose of 2 tablets that melt in the mouth before going to bed, benefits that help you sleep, such a neutral taste, I have yet to see one that has an effect, but I will continue to try, I liked that it melts in the mouth and you don't have to swallow it as a pill, the ingredients are natural, so I recommend trying it, Right now I'm already sleeping a little better."
792,103318,2024-06-15,Good effect,"The quality is very good. It has all-natural ingredients and no smell. It is packaged in portions. Taking two pills before going to bed every day has a good effect. The quality of sleep is improved, and I have dreams. I wake up very energetic the next day. It is really good."
793,103318,2024-06-11,Great product for the money ,"The quality is one of the best on the market, the use is simple and, most importantly, clear, the packaging is reliable and stylish, everything arrived intact and undamaged, the composition did not cause me any complaints or any questions, clearly +, and the size is convenient both for storage at home and for use in any time, the advantage is a good price for this product."
794,103318,2024-03-28,mid-awakening,"I can fall asleep easily, but I wake up in the middle of the night every 3 hours, which makes me tired. I tried several types of melatonin to somehow improve it, but it didn't improve at all. I bought this because I use homeopathy on a regular basis and feel it's effective, but unfortunately there was no improvement at all, but it just didn't work for me, so I think it's a very good product."
795,103318,2024-03-22,good sleep,"It melts right in your mouth. Although it is an easy-to-swallow size, it should be swallowed with 1 to 2 sips of water, and as per other reviews, drink it right before going to bed. This is because you will feel sleepy as soon as you lie down. It's great for a supplement to be so effective with natural ingredients. I wake up in the morning better than before."
796,103318,2024-03-06,It was good for children,"My child wakes up every 2-3 hours, is not tall, and had a hard time with fatigue in the morning. After taking the liquid type for 10 days straight, he hardly ever wakes up, so I am very satisfied. I don't take the medicine anymore, but I am enough to buy it as an extra. When I told this, my father-in-law asked me to get him some medicine as he was having a hard time with insomnia in his old age. I hope it works for adults too!!! I will continue the review later."
797,103318,2024-01-30,"You fall asleep easily. It’s convenient to take, it calms your nerves. You wake up easily.","You fall asleep very well. Excellent composition. Calms, relaxes. Convenient dosage. The size of the tablets is normal. The quality is excellent. I will take it constantly. The taste is amazing. I recommend it to those who have trouble falling asleep. It is beneficial. The ingredients are excellent. Helped me fall asleep.
"
798,103318,2024-01-16,homeopathy,"I have trouble falling asleep, and it seems like I'm not getting a good night's sleep, so I'm sleepy no matter how much I sleep. This combination remedy helps me fall asleep easily, so it's essential. Homeopathy is non-addictive and has no side effects, so it's safe to continue taking it (^▽^)/"
799,103318,2023-12-08,good dream!,"This is not the first time I have taken it. Excellent quality. I drink it myself when there are stressful weeks, I really have a peaceful sleep and an easy wake up in the morning! I also give it to my mother, she sleeps better. Pleasant to taste, small in size. I recommend it to everyone!"
800,103318,2024-09-23,,"Helps support sleep To help you fall asleep and stay asleep, calms sleep Helps your body in a natural way Plant-based ingredients Excellent quality Taste is average I recommend it to everyone 
"
801,103318,2024-05-30,Sleeping pills,Excellent for sleep. The quality is excellent. It does not cause insomnia. A good quantity. I take it an hour before I go to sleep………….. 
802,103318,2024-03-08,Suuuper!!!,"Very high quality product. Good composition. Quickly soluble. Result in 30 minutes. Sleep without waking up for 7-8 hours. For those suffering from insomnia, this is just a godsend! I recommend before buying!"
803,103318,2024-02-01,Nice,"I drink together with Melatonin 30 minutes before going to bed on the recommendation of an endocrinologist. The drug acts quite mildly. The next day, the head is fresh, it is easy to wake up. At night, the body rests. Pleasant taste, quickly melts in the mouth. "
804,103318,2024-10-09,Under trial,"Melatonin-Free Sleep Support Helps You Fall Asleep, Stay Asleep, and Soothe Restless Sleep Helps Your Body the Natural Way Homeopathic Pharmaceutical Formula Botanical Active Ingredients No Daytime Grogginess No Known Drug Interactions No Artificial Colors, Flavors or Sweeteners A Better Way At Boiron we believe there's a better way to feel better. Since 1932, the Boiron family has been committed to providing pure medicines through sustainable practices. As the world's leading homeopathic medicines brand, our passion has always been to provide quality products and our goal is to keep you healthy."
805,103318,2024-08-31,Regular melatonin,"I am 51 years old and I regularly take melatonin in chewable gummies. I bought these tablets for my husband, but they did not suit him, unfortunately he is on sleeping pills. Since my gummies ran out and I have not received new ones yet, I decided to try these tablets. If the effect of the gummies occurs in an hour or an hour and a half, then the tablets began to work only after 2-2.5 hours. The next morning my head was a little heavy, although I took the same 10 mg as always. I was not completely satisfied, perhaps this is my individual body feature. But I will not buy this product again."
806,103318,2024-07-29,It has an effect on the face,"It took a long time to fall asleep and it was difficult to fall asleep again if I woke up in the middle of the night, but taking one before going to bed and one when I woke up in the middle of the night definitely helped because it was good. I think it has almost no effect on causing deep sleep. "
807,103318,2024-06-21,It seems good,"I gave this to my father who can't sleep. I don't know what's working, but it seems to help him sleep better. It doesn't contain any chemicals, so it's safe for the body, and I'm thinking of buying more when it runs out."
808,103318,2024-05-08,I am eating before going to bed.,"I bought Boylon's product because it seems to be very effective. I take 2 tablets every day. I melt it in my mouth before going to bed and it is small so it melts quickly. There is no special taste. I have severe insomnia, so I haven't seen much of an effect, but I think it makes me feel more at ease. Voyron's products have good ingredients, so I am trusting them and using them."
809,103318,2024-04-25,I think it's working,"It's hard to swallow the pill, but it dissolves quickly when you put it in your mouth, so it's easy to take and the taste isn't weird. I've been taking it for about 15 days, and at first I wasn't sure if it was effective, but I felt like I was sleeping quite well the day before yesterday. It seemed to be effective, so I repurchased it. "
810,103318,2024-04-11,I saw the effect,"I usually toss and turn for 1-2 hours while lying down, but since melatonin is a hormone, I was afraid to take it long-term, so I looked for homeopathy. It quickly melts in your mouth and you fall asleep before you know it. I intend to purchase again!"
811,103318,2024-01-27,Homeopathy,"For some unpleasant reasons in the country, I have problems sleeping, but the beauty of homeopathy is that I sleep well, and there is no addiction, I take melatonin periodically."
812,103318,2023-12-04,substitute for amulet,"I bought this as a charm when I can't sleep. When I drank it, I felt a little light-headed, stopped thinking, and found it easier to fall asleep. I think it's a gentle prescription for people who need a sleeping pill, so I think it would be a good idea to take it with other supplements."
813,103318,2023-11-26,Quality brand and without undesirable side effects,"It helps me sleep, not always but most of the time I feel like I'm going to have difficulty falling asleep if, for example, I wake up in the early morning and it has the great advantage that I don't feel groggy when I wake up. It also doesn't give me nightmares. The brand is very reliable."
814,103318,2023-11-10,I was able to sleep,"I was using melatonin, but I tried this tablet, which has fewer side effects. It feels like I can sleep deeply rather than sleep for a long time. I was able to wake up feeling refreshed."
815,103318,2023-10-31,Great,"To be honest, I didn’t see the effect of taking this drug. I have insomnia after having children and I can’t sleep well."
816,103318,2023-10-30,Great,"This is a godsend for Me! One tablet is enough for me, the effect comes in 30 minutes. Such relaxation in the arms and legs. I love. In general, I really love this brand."
817,103318,2023-11-25,I can't sleep almost every day,"I prepared this for my mother, but she's having trouble sleeping well. Sometimes, when I can't sleep, I take it and it seems to be slightly effective."
818,103318,2024-02-12,Easy to use without water!,"I think it absorbs better under the tongue, but it's delicious and dissolves quickly, so I just end up eating it normally. What is the effect...? ? Compared to melatonin and CBD, it's more effective! In my case, that's not the case. But is it somehow effective? The other day, when I took 3mg of melatonin extended-release type at night to prevent high blood pressure, I went to sleep and had nightmares! ! Is it really a nightmare side effect? That's right...! For example, what happens if you take this Sleep Calm at the same time? ? I would like to try various things and see the effects."
