,product_id,date_posted,review_title,review_text
196,103318,2024-04-17,Love ,"Best homeopathy, easy to use, suitable for any age, Convinient package "
197,103318,2024-04-14,very calming,These little melts taste great and are a good size. They work quite quickly and you can really feel the benefit. 
198,103318,2024-04-07,sleep aid,"I have tried several different natural sleep aids. I find these to be very helpful. In addition, they have no taste and dissolve easily. "
199,103318,2024-04-05,Very good,Good quality and calm to sleep. I took it with melatonin every night.
200,103318,2024-03-31,Sleep help,This has helped me get a decent night’s sleep! Could see improvement after 2 nights!
201,103318,2024-03-30,,"Temporarily Relieves:

Occasional Sleeplessness
Restless Sleep
Intermittent Awakening
Helps Reduce Difficulty Falling Asleep Due To:

Nervousness
Worries"
202,103318,2024-03-30,They seem to help me sleep. ,"I bought this as a replacement for the no-longer available Hyland Calm Forte. So far, they seem to help me doze off. "
203,103318,2024-03-23,,helps with quality of sleep more than falling asleep but would repurchase
204,103318,2024-03-20,Nice ,Perfect product for sleeping well and calming. Taste good. I recommend using it
205,103318,2024-03-18,Great stuff,It has helped reduce my hot flashes by over half at night.
206,103318,2024-03-15,great,"it works for my special need child, I am very happy "
207,103318,2024-03-13,Really makes a difference ,Started taking these when looking to wean off sleeping tablets and they’re working really well for me. Now completely off medication 
208,103318,2024-03-03,It is the sleep relief!,I take this sleep calm every night and have the effect every time. 
209,103318,2024-02-28,calming,i wouldnt say this knocks u out but it definetly helps you calm down and relax to be able fall asleep faster
210,103318,2024-02-28,,Good and clean ingredients and and size is big enough
211,103318,2024-02-16,Helps my insomnia,I sleep better since I added this supplement to my diet. My sleep is longer and deeper now. Thanks. 
212,103318,2024-02-12,Really Works,This works!  I find myself drifting off to sleep much quicker than usual.
213,103318,2024-02-06,Very good,"I use it if I have difficulty with sleeping, a little bit sweet taste, very light"
214,103318,2024-01-28,,Helps to fall asleep. I like the homeopatic ingredients. The taste is nice.
215,103318,2024-01-28,Прекрасно!,"Amazing quality and ingredients, Easty to use package and good benefits "
216,103318,2024-01-26,,"recommended to buy, high quality product, size is good, good ingredients"
217,103318,2024-01-25,Superb,If you don’t like taking Melatonin this product is for you! Super good night sleep! First good sleep in years!
218,103318,2024-01-24,calm,quality ingredients homeopathic remedy it sets you calm for sleep good melt away tablet 
219,103318,2024-01-23,GENTLE! ,Works gently to help sleep.  Iherb has the best price and FAST delivery.  
220,103318,2024-01-13,didnt tried,but the company is good quality and my friend said good taste and dosage is medium
221,103318,2024-01-08,Amazing ,I’ve felt so much better since I started taking these. 
222,103318,2024-01-07,Prefer homeopathics where possible ,I always prefer to purchase homeopathics where possible for any sleep or allergy issues. 
223,103318,2023-12-27,sound sleep,"works very well, even after getting up in middle of night, "
224,103318,2023-12-22,Calms me to sleep,This is a good tablet to help you calm your brain and sleep faster. 
225,103318,2023-12-15,,"good quality product, works quickly and puts you to sleep smoothly. no side effects, the following morning normally feels fresh and good "
226,103318,2023-12-09,,It taste good and have a benefit helping sleeping it’s come in a good size 
227,103318,2023-12-09,,It is useful when l feel stressful. l take 1 before sleeping. 
228,103318,2023-12-04,Good,Good quality and ingredients i use and i get benefits no taste for sleep  the size is acceptable nice packaging 
229,103318,2023-11-29,Love these,I have had insomnia for 3 years! This works and doesn’t make you feel groggy 
230,103318,2023-11-27,Sleep ,I not sure if it helped with my sleep quality but overall good 
231,103318,2023-11-26,Helps me sleep,For those nights you cannt sleep. Love that it is natural
232,103318,2023-11-24,,I bought this for calmness and relaxation after work.anyway it is safe so i try it.it works better for me.
233,103318,2023-11-22,Great for anxiety at night,My husband uses these when he is anxious and unable to calm his mind before bed.  We will purchase again.
234,103318,2023-11-20,Works wonders,Gave these to my relative who had bad insomnia. She said it worked and she actually fell asleep and slept well! 
235,103318,2023-11-13,Qatar,Conforms to specifications and is of high quality very good
236,103318,2023-11-12,Great sleep aid!,Always travel with these tablets. Helps with adjusting to time changes .
237,103318,2023-11-09,,amazing effect of this product I like the convenient size of the packaging
238,103318,2023-11-09,Boiron Sleep Calm,"I haven't tried them yet, but I feel sure they will help me in getting to sleep in a timely manner. "
239,103318,2023-11-05,It works!,Great 👍 product 👌.  Very helpful.  No side effects.  Healthy ingredients. I will suggest it to people  who  straggling with 😴 sleep.
240,103318,2023-11-01,,"excellent product,good and strong packaging , the quality matches the description, I will still recommend ordering to everyone!!! okay
"
241,103318,2023-11-01,Прекрасно!,"Excellent additive, liked the quality, liked the price and packaging, advise you to buy"
242,103318,2023-10-25,Good sleep,Gentle no drowsiness and the occasional sate is good the size and the ingredients is suitable for mild insomnia 
243,103318,2023-10-22,Great for jet lag!,Helped my husband fall asleep easily and sleep through the night during his travels to the East. 
244,103318,2023-10-21,,"iHerb offers various health and wellness products that people may use to supplement their diet, fitness, and general lifestyles. "
245,103318,2023-03-13,,"I like this product especially because of the natural ingredients. This plant was used for ages to calm and help to sleep. It helped me certainly a tad with my anxiety. But as with the Melatonin, I suffer from insomnia for over a decade and didn't expect any miracle. It would benefit people who have to problems taking pills, since they melt on your tongue. Again, I believe the quality is great, and people should try it. I might try it again."
246,103318,2022-04-08,,"I suffered from intermittent sleep. I would wake up fr pee at night and then it would be difficult to fall back yo sleep.
but after trying sleep calm, I'm amazingly able to sleep peacfull thru the night and also fall back into deep sleep after a pee break.
also really important  to mention there is no groginess the next day.the cute tabs melt on the tongue and they are effect immediately.  I begin to feel calm n sleepy with in 15 min.
I loved it and have ordered it again. "
247,103318,2023-07-22,Good for staying asleep,"My problem was waking up at night and not able to fall back asleep - this supplement remedied that!  To fall asleep I use breathing meditation.  After taking this I wake up refreshed, no aftereffect at all, no sleepiness or grogginess in the morning.  Tastes mildly sweet.  I trust Boiron, used few of their products in the past with great results."
248,103318,2023-04-26,,"The quality of this item is soo good. It really helped me to sleep instantly. I only used half tablet but still makes me sleep. The size is small and it dissolves under my tongue in few minutes. There is a bit of sweet taste in it   However, it makes my throat sore in the morning. So better drink water after it dissolves completely. "
249,103318,2023-02-23,Helps with waking up in the night,"I cannot tolerate heavy sleep aids and this one is very mild. If I am having trouble going to sleep, it helps. But the best thing about Sleepcalm is you can take it if you wake in the middle of the night - 3am, 4am, 5am - and it doesn't make you feel hungover when you have to get up. This has become a staple in my medicine cabinet!"
250,103318,2023-02-13,,"I like these because they are easy to take, however the only thing I don't like about them is the added ingredient of 'magnesium stearate'.  I try to avoid this in any supplement, as it's only got a GRAS rating ... i.e. toxicity not studied enough.  For those nights when I awaken during the night, I usually take one of these along with a magnesium glycinate supplement (120 mg) and it usually helps me go back to sleep."
251,103318,2023-01-18,This helps me sleep sometimes,"I trust the quality and ingredients of Boiron products, so thought I would give this a try. First I tried one tablet a couple times, that didn't do it for me, so then I tried the recommended two tablet dosage. The product was of some benefit sometimes, as it seemed to help me fall asleep and maybe not wake as many times as I usually do.
I like that the product isn't addictive and doesn't leave me drowsy the next day, so I guess it's worth a try.  The size and taste are both fine."
252,103318,2024-10-19,,"Borion, SleepCalm is a good quality homeopathic complex supplement that helps sleep cycle"
253,103318,2024-09-20,Seems to work,Bought for a friend with insomnia. She says it helps her to sleep. Good packaging. Like Boiron products 
254,103318,2024-09-13,Good not great,I like these but can’t say they are super effective. I notice a small difference 
255,103318,2024-09-06,,Doesn't help to sleep dramatically. But help feel more relaxed that's something leads to sleep. 
256,103318,2024-08-07,sleep aid,I liked the size and used it for sleep issues. to be taken at night ..good set of ingredients. tastes good. 
257,103318,2024-08-03,,"
SleepCalm, Unflavored , 60 Meltaway Tablets, is a good product, would buy it again"
258,103318,2024-07-27,Sleep,It helps to fall back asleep after waking up in  the night. 
259,103318,2024-07-26,,"Good product. The quality is super. Delivery is great. Ordered for friends. They are delighted. Fast and reliable. I recommend.
"
260,103318,2024-07-14,It works but…,"Just like melatonin, it made me have weird dreams. And I felt a bit drowsy when waking up."
261,103318,2024-06-06,Good product,Improving sleep quality .so far no side effect .my kid likes it
262,103318,2024-03-22,Great Product,"I've always had problems with sleeping, but since using this product my sleeping has improved"
263,103318,2024-03-06,Good product," Not sure if it helps sleeping but anyway the composition is great, "
264,103318,2024-02-05,not bad,its overall a goood quality. seems like natural ingredients. size wise is ok. dosage easy. taste is ok
265,103318,2024-02-05,sleep help,This medicine has helped us sleep. Not every time but it has helped some. The ingredients are good and I appreciate that.
266,103318,2023-11-13,好的,"it works sometimes. good to hv it at home
remember to put them under the tongue"
267,103318,2023-11-10,,"Boiron, SleepCalm, Unflavored , 60 Meltaway Tablets seems to help with repetitive thoughts."
268,103318,2023-10-24,Good product,Taken alone helps me relax before bedtime but combined with melatonin helps me sleep like a baby.
269,103318,2023-08-07,,"I use it to help me fall asleep. it contains plant based actives , and is a homeopathic medicine. it helps me unwind and relax before bedtime. easy to dissolve, just pop under your tongue. taste is very mild, not strong at all. pleasant experience overall."
270,103318,2023-02-25,,"Good quality alternative to help sleep better as benefits. Ingredients are herbal extracts, size is perfect. I take it from time to time when needed.
Alternative to Melatonin also."
271,103318,2023-10-06,Great supplement!,"In addition to 5HTP which I also take, Boiron's Sleep Relief helps me calm down for a good night's sleep. I take the recommended two tablets under the tongue. Nice flavor, too."
272,103318,2023-10-03,,"Thank you very much for this product, it suited me, I like the packaging, comfortable and stylish, I will order more of these products, and recommend them to all my friends and relatives! good!!
"
273,103318,2023-09-26,Sleep Calm,"these are the best thing I have found, if you wake up and can not fall back to sleep! really work for me, love the meltaway tabs"
274,103318,2023-09-21,In love with it,I take only 1 tablet under the tongue and after 15 minutes my whole body and mind feel relaxed and sleepy. It insures quicker falling to sleep and deeper  sleep throughout the night.
275,103318,2023-09-02,,I use this when I can’t get sleep but I have to get enough sleep because of working or event next day. I fall asleep in 15-20 minutes.
276,103318,2023-08-14,,"calm day will solve the disorder groggy, u will fall asleep faster , deep sleep and i didnt actually find any negative effects i always feel fresh u use it under tongue 2 wait till it dissolve"
277,103318,2023-08-06,,or this. it was made of high qualiy ingredients. Plus the packaging and sizes were perfect. over all good quality. i love the smell and the looks of it. im looking forward to purchasing another one!
278,103318,2023-08-06,good,"at first i thought it tasted weird. but i quickly got used to it. it melts under the tongue fast and does seem to work, and i usually have trouble falling asleep. i wake up fine, not groggy as with melatonin. "
279,103318,2023-07-18,Gentle but quite surprisingly effective! ,"My dear friend had recommended this for sleep and it actually surprisingly works! I'm a longtime insomniac since childhood and I dont want to take any sleeping pills. This works well, gently and I am reordering later today!!! Recommend. But I really respond to homeopathic meds. "
280,103318,2023-07-14,Very good,Helps me to fall asleep in the evening. I also tried it many times when I woke up in the middle of the night and couldn't fall asleep again. Works within 30-40 minutes. 
281,103318,2023-07-08,,I find Boiron SleepCalm so effective! it helps me fall asleep in a relaxed way. And doesn't make me groggy when I wake up. 😊
282,103318,2023-07-06,,Relaxing! I haven't found a sustainable sleep aide I can trust until now. It's calming on the nervous system and gentle enough that it feels like it's genuinely working with your organism.
283,103318,2023-06-29,Relaxing,"Gives a nice relaxing feeling so you want to drop off to sleep.  For me, though, it takes up to 1 1/2 hours to work. "
284,103318,2023-06-29,,Great for jet lag!! I take these when I travel and it helps me get to sleep more easily when I’m in different time zones! 
285,103318,2023-06-15,,Pills are very effective before bed Of course you have to wait 30 minutes before going to bed to use under the tongue and dissolve 
286,103318,2023-06-03,,"I maybe bought this product about 5 times now!
It is helpful to make you sleep and sleep deeper. I use 1-2 tabs depends how tired i feel. "
287,103318,2023-05-12,,High quality product with natural ingredients. The dosage of 2 tablets is highly effective. The benefits are clear as  you fall asleep faster and stay asleep longer. The tablets easily melt in your mouth. 
288,103318,2023-05-04,최고!,"I received the product well. Thank you for the fast and accurate delivery. I will promote a lot around cheap and high-quality products. thank you
"
289,103318,2023-05-03,Helps when you can't sleep,I will use this on those nights I can't sleep. Does help calm the mind and I do experience a good sleep once it kicks in. I keep this on hand when I wake up and need help back to sleep. 2 tablets do the trick.
290,103318,2023-04-13,I think it works,"it works. i didn't use it too long to say, maybe its placebo effect, but as it doesnt have nasties i am happy to try."
291,103318,2023-04-08,,This is a good quality product that  helps with difficulty falling asleep and staying asleep. I like that it is plant based and no side effects next day.  The dosage is only 2 tablets to dissolve under the tongue at bedtime. Will definitely order again.
292,103318,2023-03-27,,This high quality product really helps me calm my nerves before bedtime. The pills don't have any taste and they melt really quickly below tongue. The pills are really small in size and the dosage is two before bedtime.
293,103318,2023-03-22,,"I bought this wrong, should have get the kids option. In the end I have to my mother who replaced her melatonin for 2 tablets of these every night. She approved"
294,103318,2023-03-16,,"i can use it from time to time, though it's mild dosage. small size too. good quality ingredients overall. i used vit A which most forgotten and B for calming as well."
295,103318,2023-03-13,surprisingly great,"I only took 1/2 the recommended dose and it was a nice subtle sleep, not as groggy as taking melatonin pills.  My 14 year old daughter took one as well and said it worked great too. don't need often, I only take when I'm restless."
296,103318,2023-03-11,,"It's my second purchase and I really love it. No side effects, easy to use, no taste, works fast. 
Good help for minor sleep problems. "
297,103318,2023-03-09,,"As a happy customer of this brand, sleep calm didnt disappoint.  Fell asleep quickly and no hang over in the morning. Easy to take. I would recommend!"
298,103318,2023-03-03,Helps my pup get little restful sleep,Homeopathy is safe for our canine companions. This one has helped my young pup get better restful sleep than he did before it. Doesnt make him groggy.
299,103318,2023-02-26,,These melt away tablets worked very well. I was able most nights to go right to sleep. I love using homeopathic ingredients. Boiron is consistently a quality product.
300,103318,2023-02-26,Großartig!, I am able to get to sleep more quickly and stay asleep longer without being groggy in the morning. Very mild and relaxing natural product. 
301,103318,2023-02-10,Calms quickly,"Dissolving a couple in my mouth after waking up during the night sends me back to sleep fairly quickly. Restful sleep but not groggy in the morning. Natural ingredients, quality product. Recommend for those with mild sleep problems."
302,103318,2023-01-26,,"I was skeptical about trying this. Once I did I was happy I tried it, works fast and I get a good night’s sleep."
303,103318,2023-01-14,,"Easy to take and they work well, especially after a busy day. I like how they dissolve under tongue, no big tablet to swallow! This is my second pack and I ordered a spare too. Would be happy to buy more!"
304,103318,2022-12-31,,great quality product. it really works as intended. Will definitely get more soon! Thank you so much for this. it was made of high qualiy ingredients. Plus the packaging and sizes were perfect. over all good quality. i love the smell and the looks of it. 
305,103318,2022-11-29,,I am so glad i found this product. It works better than any I suffer from occasional sleepiness nights due to busy mind. I have decided to try this as it is homeopathy formula and hormone-free. So far...
306,103318,2022-11-23,,Maybe this is the first one that actually affects my sleep and it doesn’t have melatonin and no harsh drugs I actually slept good because of it
307,103318,2022-11-20,," I never experienced such e result this product really works well with no side effects. Usually with other products I used to feel lazy and inactive next day, but with this one u wake up fresh and active after goodnight sleep 
 This product really works  I recommend "
308,103318,2022-11-17,,"I got it for my husband as we were looking for something that was melatonin free due to him working night shifts, unfortunately hasn't seen any benefits from it at all. Will not buy again."
309,103318,2022-10-21,,"Since Hyland's Sleep tabs are no longer available after over 20 years of a great product, I was looking for something of comparable quality. I've been using them for about a week now and they seem to have about the same results as the Hyland's sleep. "
310,103318,2024-09-14,,"I don’t know if it’s working, but the taste is not the best. It feels like chalk the way it melts is very uncomfortable and I wouldn’t purchase again. I find the pill are way better but the effects is kind of the same"
311,103318,2024-08-11,It is least effective,"I have been using  it now for some time but did not find any benefit so far. So google search is correct, homeopathic medication or products are useless and expensive with no  benefits."
312,103318,2024-02-29,Didn’t work for me,I wanted to get something that doesn’t have melatonin but this doesn’t work as much as melatonin which is what i kind of expected but it’s ok
313,103318,2023-06-11,,"Good quality , perfect size , good taste , sleep well , fall a sleep quick"
314,103318,2023-08-08,sometimes helps,"I have a lot of long term sleep problems.  Some nights this helps a little to fall asleep, other nights not so much.  It does not help me stay asleep any longer than I usually do.  Since every body is different and reacts differently to things, I suggest trying one box to see if it helps you.  The ingredients are good ones."
315,103318,2023-07-14,,I tried taking these at bedtime hoping they would calm me down and help me fall asleep. Unfortunately they had no effect and I continued to lay awake and felt that these did not help me fall asleep faster at all. Only good thing is they did not make me groggy the next day. 
316,103318,2023-07-10,it helps to calm but not to sleep ,I have anxiety so am always looking for natural stuff to help me relax. i also have had chronic insomnia since i was a child . My sister had introduced me to homeopathy and Boiron for my allergy and cough. it was amazing. so I decided to try it for sleep and anxiety. I take it during the day when needed as it doesn't help with sleep. I tried it several times before bedtime and ... nothing! but it did help me be more relaxed during the day . it didn't cause any discomfort or grogginess 
317,103318,2023-06-18,,"I have used this SleepCalm before going to bed at night and did not notice that it helped me fall asleep . Also, I've used it for wakefulness during the night and have not noticed an improved difference. I do however like to avoid giving my children melatonin at night if they are acting hyper and SleepCalm is a good alternative, even if only for the placebo affect. "
318,103318,2023-04-17,kinda meh,"as i feel like they don't do anything despite the dosage i take. i like that it's small and easily dissolvable and that they taste like nothing, which is perfect because i gag when i have to take any bitter pills. but these don't work for me personally and i'll be on the looking for other options to help with my sleep."
319,103318,2023-01-03,,"It seems to have some mild effect of making one relaxed and calm, thereby getting you closer to falling asleep.  But for me, using it alone does not really do all that I need to help me get back to sleep after I get up to urinate.  So I use it in addition to  several other herbal sleep products."
320,103318,2022-11-17,I’m on the fence about this product ,"I usually love Boiron products but I’m not so sure how effective SleepCalm really is. I’ve tried it for a couple of weeks now but don’t feel any major change or improvement. The size and taste are fine like all Boiron melt-away tablets, but not sure about its benefit. Will continue trying until I finish this dosage. "
321,103318,2022-10-18,,I have used Sleep Relief for years with my 2 young children to help them go to sleep whenever they have been restless at night due to teething pain or congestion from a cold or flu type illness. Works every time to help them fall asleep quicker and stay asleep longer than they would have without it. 
322,103318,2022-10-09,UNFLAVORED SLEEP CALM METAWAY 60 TABLETS ,"This has a nice variety of homeopathic active ingredients with minimal inactive ingredients. The tablets are bigger than pellets, but easy to take, especially if you do not want to, or cannot swallow tablets. Used as directed, this product does what it says: relieves sleeplessness & restless sleep & awakening intermittently. This is a good addition to other natural substances that could be used for sleep – like Chamomile tea {which can sometimes cause more urination that could possibly awaken your sleep} & Lavender Epsom salt baths {not everyone likes this, or has a bathtub}. The fact that this is unflavored is even more of a bonus as not only is it less ingredients, but flavor choices have a lot to be desired sometimes. It is nice to have this on hand in times of need knowing the product is reliable & safe. Everyone is different, but this does not leave daytime grogginess like other non-Homeopathic medicines do from my experience. I highly recommend this product."
323,103318,2022-09-18,,"I am so glad i found this product. It works better than any I suffer from occasional sleepiness nights due to busy mind. I have decided to try this as it is homeopathy formula and hormone-free. So far, it works on my sleepiness night. It helps to calm my busy mind and stay relax. I recommend everyone to buy "
324,103318,2022-05-16,,"I have been pleasantly surprised that this works. It not only works but much better than herbs and melatonin I've tried. I am pleased with the non toxic ingredients. I don’t wake up feeling groggy and it gets me to sleep within 20 min of taking it. I let 2 melt under tongue. Will buy again. 
"
325,103318,2022-01-25,,"Sleepcalm has helped improve the quality of my childrens sleep. Whenever they are having a tough time falling asleep, I give them one or two and within ten minutes they have calmed enough to fall asleep. The ingredients are all safe and effective. The size of the tablets is perfect for young kids too."
326,103318,2024-10-19,Not sure it helped ,I’m not sure it helped as I haven’t felt the difference. 
