,product_id,date_posted,review_title,review_text
0,114587,2024-09-13,Finally slept peacefully.,The quality of this product is amazing. The ingredients don't make me dizzy during the day like sleeping pills that their effect lasted much longer and made me fatigued still. These gummys are a nice size too and very nice berry flavour. They taste very good! The dosage is 2 per night and 30 minutes before sleep. They benefit you if you chew them good before swallowing. 
1,114587,2024-01-27,Great Tasting Melatonin for Sleep Support! ,"I've taken melatonin off and on for years to aid with sleep support, and they are the best-tasting gummies I've had. They also have high-quality ingredients. The dosage is to take two gummies. I take them close to bedtime, and I drift off to sleep easily and don't wake up feeling groggy.  They are a nice size and very easy to chew.  If you are looking to try melatonin, definitely give these a try; you will not be disappointed. "
2,114587,2024-01-24,Works For Me,"I am one of those people who cannot take sleep meds.  They have the opposite effect on me.  But I have found melatonin to be a great option that not only does it work, but that I can take with effectiveness. When I happened on this melatonin, I had to try it.  I only use when it's a must, and with consistent stress lately - it's a must.  These naturally berry flavored gummies are absolutely delicious. If you're looking for a natural sleep remedy, this is it.  Nutra Champs makes the best high quality supplements I've ever used. I'm a lifer 🙂"
3,114587,2024-01-24,Great quality!,"I always had a hard time getting back to sleep in the middle of night, but since i started taking these gummies i felt an improvement. I can sleep much better and through the night. The size and taste is very good. Also, the gummies are so soft. The ingredients in it definitely is helping.👍"
4,114587,2024-01-14,Love the gummies! ,"These gummies taste delicious and it works great. The soothing herbs and nutrients help me to naturally drifting off into a deep, restful sleep even after a crazy busy day. It’s very beneficial especially during traveling when I don’t get to sleep on my own bed. The dosage of melatonin is very low too so I don’t feel drowsy in the morning. It works great for me. "
5,114587,2024-01-09,Best Sleep Aid,I absolutely love this product! It provides amazing benefits to promote a better sleep cycle. I also like the amazing quality and packaging of the sleep gummies; perfect size and dosage. The sleep gummies have excellent taste and no odor. I like that this product helps me wake up more refreshed and well rested. 
6,114587,2024-06-06,,"This is really good I am buying this product again! My husband likes the taste. The dosage is also just right for him. Some melatonin products are so strong, you can wake up with a headache the next day. He says he sleeps well with this. Bonus is that it's a gummy as well!"
7,114587,2024-02-17,Work,"I am one of those people who cannot take sleep meds. They have the opposite effect on me. But I have found melatonin to be a great option that not only does it work, but that I can take with effectiveness. When I happened on this melatonin, I had to try it. I only use when it's a must, and with consistent stress lately - it's a must. These naturally berry flavored gummies are absolutely delicious. If you're looking for a natural sleep remedy, this is it. Nutra Champs makes the best high quality supplements I've ever used. I'm a lifer 🙂"
8,114587,2024-02-14,Best Sleep I have had in years!,"This is fantastic!  I always have problems sleeping and I wanted to try something different.  I have used other  NutraChamps products, so I decided to give this one a try.  It is Melatonin and are vegan gummies.  Easy to take and I was out like a light.  I highly recommend this.  "
9,114587,2024-01-30,Really really nice!,"These gummies taste delicious and contain an effective dose of melatonin, but that’s not the only beneficial ingredient: there are some really nice soothing herbs in it as well, like L-theanine and Lemon Balm. Great quality for a price that is just as friendly as the design of the bottle. Will definitely buy again!"
10,114587,2024-01-28,Wow - one of the best night time gummy ,"Excellent product. Sometimes melatonin gives me night sweats, this has a great balance of herbs and melatonin and I get a full rest and usually within 20 min I am ready for lights out. 
Deep rest, my watch shows great HRV and solid scores for deep rest and stuff.
Tastes good too, benefit of a deep sleep with no negative"
11,114587,2024-01-29,,"I like the purple packaging, it’s my favorite color. The size amount for the price is great. This is a great quality product as well. I love the gummy flavor and taste. It comes with great ingredients that anyone can try. The benefits of peaceful sleep is lovely. "
12,114587,2024-01-18,Amazing Sleep Aid ,"Nutra Champs Sleep Gummies offer a non-GMO formula with a delightful taste. The natural ingredients provide a promising sleep aid, making it a potentially effective choice for those seeking a restful night.
Shar




"
13,114587,2024-06-21,Amazing benefits!!,"I love the taste of these gummies! So easy to take! The size is good, and the quality and potency of the ingredients are great since they have chamomile and melatonin! My kids have taken these and slept great. Totally recommend them to others."
14,114587,2024-04-30,,Love these gummies fron NutraChamps. It makes you sleepy within a few minutes and makes a have a deep sleep. Without feeling groggy in the morning.
15,114587,2024-04-19,اشجع عليه جايز,"Scent nice , easy,use quality’s high, big size,  age not specified, package nice, full of  benefit,  composition i don’t know, hair hair,  scalp slap,  sensitive non, moisturizer full ingredient dosage taste"
16,114587,2024-04-16,excellent,"The most effective supplement as a sleep aid, it helps me a lot to fall asleep, not so much to stay asleep, but it is ok."
17,114587,2024-03-08,Awesome,I really feel my eyes get heavy about 20 to 30 minutes after eating these. It really helps establish a sleep routine when I fall into an odd sleeping schedule.
18,114587,2024-02-13,Gets you to sleep!,Not only does it taste like a post-dinner treat but it also promotes better and deeper sleep! I take these gummies every other night. 
19,114587,2024-02-12,Best Sleep Ever!,I have been having a hard time falling asleep at night. Ever since I have been taking these gummies been having the best sleep of my life. Waking up fully rested and ready to start the day. I love the cute star shapes and yummy taste .
20,114587,2024-02-03,Love these gummies!,These have great flavor! I never like taking a strong sleeping supplement but these gummies are just the right bit of something that will put me fast to sleep. I don’t struggle going to sleep anymore which is great
21,114587,2024-01-30,Great sleep aid!!,Listen….these melatonin gummies are the absolute best! Usually when i take the pill ones i get a nasty headache but somehow these gummies makes me relax and i wake up feeling energized! 10/10!!!!
22,114587,2024-01-29,"The best slipping ""pil""","I can't wait for the evening to comfort myself with this tasty and pleasant gum. I works gently, alleviating mind worries and stress away, sleeping gets better and waking up more restful. Fantastic high quality product."
23,114587,2024-01-22,"Not groggy gummies at all, so rested!","Wow these are great! When I take melatonin gummies I usually wake up very groggy and still tired but these are actually amazing. Sleep is great and wake up feeling so rested! Made with great ingredients, this brand is worth trusting! Very much so recommend!! "
24,114587,2024-01-12,Easy to chew,Taste good and really help my sleep! It’s my second time order this its just so good to take this easier to relax and sleep ! Gummies are easy to chew 
25,114587,2023-12-02,10/10 ,"really helped me to sleep like a baby,tho i don't recommend using it daily cuz it can get u too sleepy even at daylight"
26,114587,2024-08-11,tastes good,"I like the taste but I think the liquid melatonin works better, and I wish they would kake a liquid version of this product as well"
27,114587,2023-11-17,great texture,"Nice taste, texture. Quality is great and it works well. However I found better alternatives for bedtime as this can be quite expensive in the long run
"
28,114587,2023-07-08,It helped me fight stress and insomnia.,"Even though I have been taking Sleep by NutraChamps for about ten days, I already see the first positive results. It is a natural supplement made with ingredients based on melatonin, magnesium, chamomile, valerian and other herbs that promote relaxation and sleep. The product is vegan and does not create addiction. Even though it is a supplement made with natural ingredients, the taste is not bad at all. I started taking two gummy candies (they are easy to chew and swallow) every night before going to bed and I noticed the difference right away. I fall asleep more easily and sleep more deeply throughout the night. I wake up rested and ready to face the day. Sleep by NutraChamps has improved the quality of my life and helped me fight stress and insomnia. I highly recommend it to anyone looking for a natural and effective remedy for sleeping well. The product arrived quickly at home with the package in perfect condition."
29,114587,2023-06-02,Efficient & delicious,"I take these gummies on nights where have a big day ahead & need a quality ingredient sleep aid. The taste is nice, the gummies size is easy to chew and swallow & I like that the dosage isn't too high. It's just enough to get me sleeping and stay asleep. Truly Can’t beta these benefits!"
30,114587,2023-05-25,"Great nights, sleep!","I take 2 gummies 30 minutes before I want to get to sleep.

First of all, these taste so good, I love the berry flavor. Easy to chew, and can we talk about how adorable the star shape of these gummies are?

Okay, back to the review. These help me to gently fall asleep and stay asleep all night long.

When I wake up, I'm not groggy. I feel refreshed and well rested. 

Great quality product and ingredients.

So if you have trouble sleeping. I highly recommend giving these a try!"
31,114587,2023-05-21,,"great quality for the price.  Natural sustainable ingredients (herbs),small bite sized, soft gummies that actually promote a more beneficial rest. Taste is a mild elderberry, with no nasty aftertaste.  I like that i woke up without feeling groggy. Beneficial for a good night's rest & for a calming effect. "
32,114587,2023-05-18,Efficient ,"I love that these gummies are made with non GMO ingredients and that they are tested lab verified. I love the amazing taste, shape, size and texture of these gummies, they taste great and they doesn’t stick on your teeth. They are very efficient and make you fell as sleep in a naturally feeling way, they don’t make you feel dizzy or sick. The next day I wake up full of energy and in a good mood. "
33,114587,2024-07-29,Love these,"Nice gummies very tasty 
Really helps me sleep and has high quality ingredients package is enough for the dosage"
34,114587,2023-08-21,The BEST,"I have had insomnia for my whole life. I've tried tons of different sleep aids and other sleep dummies. So far, this is the best sleep aid I have ever tried. I take them an hour before bed and chew thoroughly. I then set up an audiobook to automatically shut off after 30 mins. Normally it takes me over an hour to fall asleep, but with these I'm out within 15 minutes. I do find I am groggy the next morning if I take it too late or don't sleep long enough so keep that in mind. "
35,114587,2023-07-11,BUYING THESE AGAIN!,"I have the WORST time sleeping,  between adhd. And carpal tunnel.. but with just ½of one of these,  I'm out! And wake up rested! But not so out that I can't hear my 1 year old.  Highly recommend! I've had really bad experiences with melatonin but these don't do that. "
36,114587,2023-07-03,They do the job,"I have been using NutraChamps Sleep gummies for about a few weeks now, and I am really happy with them. I have always had trouble falling asleep, but since I started taking these gummies, I have been able to fall asleep much faster and sleep more soundly throughout the night. I also wake up feeling more refreshed and alert in the morning.

I like that these gummies are made with natural ingredients, including melatonin, L-theanine, and passionflower. They are also vegan and non-GMO, which is important to me. The gummies taste great, too. They are a delicious natural berry flavor.

I would definitely recommend NutraChamps Sleep gummies to anyone who is having trouble sleeping. They are a safe and effective way to help you get a good night's sleep."
37,114587,2023-06-10,Get ready for Excellent sleep ,"Need to get soothing sleep?  Well this nutrachamps product is just for you! My son loves the natural berry flavor and star shape. The best part is the quality for the price 👌 and the natural, vegan ingredients that are non habit forming and drug free. For these reasons pick up a bottle today and you will be sleeping in no time tonight!! "
38,114587,2023-05-26,,"Love these gummies! It’s a more fun way to have melatonin and the ingredients are great quality. The taste is mild and not overly sweet. And the size is perfect, shaped in a little star, which was a surprise for me when I first opened the bottle! I definitely recommend it!"
39,114587,2023-05-25,Excellent and delicious!,"The nutra champs sleep melatonin and soothing gummies are delicious, the taste of berry's is great.
I love the benefits of melatonin and the quality ingredients on this bottle.
They work great and i did sleep faster than normal since i started using it the first night and the next morning i was ready go.
Good price for the quantity and quality of this product, i recommend it!!"
40,114587,2022-12-01,,I love melatonin gummies but these are by far my favorite. Every once and while I have troubles falling asleep so I’ll take 2 of these and be out in 5-15 minutes! The ingredients are my favorite part. They taste amazing and low sugar = no teeth aches! The size and quality is worth the value and I think these little guys could benefit anybody. :)
41,114587,2024-07-10,I like it,great product quality with great taste and perfect dosage also give me a lot of benefits and come in great size for easy chew
42,114587,2024-06-06,很好！,amazing. the taste is good. i tried some brands of similar products. this one seems making me more rest deeply.
43,114587,2024-06-01,Really like it,"Great taste, helps me relax. My son also uses it and helps him as well."
44,114587,2024-04-23,Great,Great flavour and balance of sleep-encouraging ingredients. Lovely packaging and good value. 
45,114587,2024-04-02,great,"helped me fall asleep and stay asleep better, and wake up feeling less tired."
46,114587,2024-03-14,great,Taste yummy. Help for occasional insomnia and for travel. ingredients is good
47,114587,2024-02-09,yummy!,These taste yummy and are effective. I don't wake up groggy which is also nice! 
48,114587,2024-02-06,excellent,"I really love this sleep supplement, helps me a lot to go to sleep faster. Highly recommended!"
49,114587,2024-01-23,The best,Good for sleep if you overtrain. It really helps in my train camp. 
50,114587,2024-01-23,Excellent ,Help me do much in sleeping and relaxing at night
51,114587,2024-01-22,Great,Highly recommend amazing quality and really solid ingredients. I loved the scent and the size is actually super
52,114587,2024-01-22,,Love that the melatonin is a low-dose! Helps to keep my sleep schedule on track without the grogginess. Plus they taste good!
53,114587,2024-01-03,excellent,"I am taking it every single night, and it helps a lot. Recomended!"
54,114587,2023-12-26,Tasty !,These are like candy gummies which isn’t a bad thing . I do think they help to put me to sleep .
55,114587,2023-11-26,Yummy and they work!,"Tasty flavour and they definitely work. Feel refreshed the next day. 

"
56,114587,2023-07-25,Sleepy gummy’s ,"I love that the gummy’s are stars , the container shipped sealed and fast , I didn’t feel groggy the next day , I love that I feel more rested and ready for bed "
57,114587,2023-05-24,sweet sleep,These Melatonin gummies from Nutrachamps are terrific. They are gentle and come in 3 MG size. They are sweet and tasty. The gummies help me get to sleep naturally and easily. I really love this brand. They are made with quality ingredients I know I can trust.
58,114587,2022-12-20,,These are awesome! I have insomnia so this definitely helps me to get well rest! So thankful. The taste is amazing 👌🏼as well as the size of the bottle !
59,114587,2022-10-13,I love the taste of these gummies,"These melatonin gummies taste amazing. It’s like eating candy, they don’t taste nasty or medicine-like. The first time I tried them they helped me sleep. I’m a person who sleeps past midnight and I am trying to go to bed earlier so I been taking these around 9:30pm and by 11pm I’m already in bed ready to fall asleep. So glad I purchased these. The best thing about these gummies is that they are drug-free. "
60,114587,2022-10-12,,"Not only does this work it's also adorable! They are shaped like purple stars!

I take these whenever I need help falling asleep. I just take it about a half hour before I want to go to bed and I end up yawning and not able to keep my eyes open.  I highly recommend."
61,114587,2023-09-20,Works for me,"The taste wasn’t bad but I don’t like that it contains a relatively high amount of sugar and the gummy is quite big. Still, it does what it says. I took 2 and it took about 30mins for me to feel sleepy and I had an ok sleep. I was on a plane so couldn’t really complain. "
62,114587,2023-08-25,TASTES Great & Nice design,"NutraChamps made a good choice with the flavor & style and the ingredients are very good.  It is very hard for me to get a good nights sleep - so I may be asking too much for this gummy, ha.  Overall, I would say it is a great product and recommend it. "
63,114587,2023-06-05,Amazing sleep!,"I have been taking melatonin gummies for a while now, and always need to switch them up. 
I love the taste, size and smell! 

I typically do take 5 or 10mg dosages rather then 3mg since I need a bit more then the average person. 

Once take them, it took me about 20 to kick in, which is record braking for me."
64,114587,2022-10-06,SWEET DREAMS!,"These are amazing. I’m very sensitive to pills and things like edibles, the dosage suggests taking two gummies but I just took one and that was more than enough for me. I found that I slowly fell asleep in about 20 minutes, didn’t feel weird or anything, no dizziness, no extreme drowsiness, just a nice easy transition into sleeping. I found that I woke up less during the night, and I woke feeling very rested. Also they taste super good, I sleep with my dog in the bed and when I chew them he will come out from under a blanket just to sniff my mouth, so get ready for your dog to be obsessed with the smell of these too lol "
65,114587,2022-09-26,Work very well,the taste and smell is very good they are vegan with natural ingredients. The size and consistency is good.  You should use 2 gummies 20 to 30 minutes before going to sleep.  the truth is that they are working for me to sleep more since I woke up many times at night and it makes me sleepy earlier. so the benefits are very good and it is not addictive won of very good quality I recommend them
66,114587,2022-09-25,,I’m breastfeeding and my dr said they were safe but ask your dr first!! I take 2 an hour before ping bed and put me out but I don’t wake up all sleepy and zombie feeling! Also they let me keep me alert for the baby! My husband takes 3 most likely 2 hours before going bed but he is a tough one! And work perfect! 
67,114587,2022-09-22,Good,I like to go the natural route when I’m having a hard time going to sleep. Melatonin is perfect and this brand gets it right. The quality is very good. I’m happy it’s in a gummy form. It makes it easier to consume. It doesn’t taste bad which is a plus. It is now the one I go to when I need a good night sleep.
68,114587,2023-10-03,Melatonin Gummies,"These are a life saver, I will definitely be purchasing a second bottle! One is enough, two is if you have severe insomnia. And I love how you wake up feeling refreshed!"
69,114587,2023-07-25,,"My boyfriend and I have a hard time falling asleep as we are both entrepreneurs and once we started taking these, we are out immediately. Highly recommend "
70,114587,2023-06-02,No Funny After Taste!,Love these gummies and so does my son! They are just the right MG they dont leave you drowsy and there is not gritty texture!
71,114587,2023-05-30,Amazing product ,Tried this for the first time and loved it. Actually helped me have a good night sleep. Sleeping was easy after taking this.. The gummy is easy to chew too and tastes ok. 
72,114587,2023-05-30,,"These melatonin gummies taste great and they work! If I have trouble sleeping, I take these and I’m always able to fall asleep quickly. They don’t give me the groggy feeling in the morning that some melatonin products do. "
73,114587,2023-05-30,,This is my second bottle of this gummies. I love it so much because it helps me fall to sleep. The taste is so yummy. All natural ingredients and very soft. I highly recommend it if you need a sleep aid.
74,114587,2023-05-29,,This supplement helps me drift into a restful nights sleep without geeling groggy in the morning. I noticed I dintntoss and turn or wake up as often.
75,114587,2023-05-16,,im shocked how this works fast! i suffer from insomnia forever and getting this one is the best decision i've ever made in my life! it really helps me to sleep immediately for long times like 9 hours and i usually sleep for 5 hours! 
76,114587,2023-05-15,Great sleep supplement,"These melatonin gummies are great for helping you fall asleep without drowsiness the next day.
The dosage is low, which is great because it gives you the opportunity to start small."
77,114587,2023-05-08,,"Very good flavor, good effect. Just keep on mind that this is not a permanent solution for your sleep problems. Eventually you create resistance so it is good to have a break from any kind of melatonin, not just this brand :)"
78,114587,2023-03-05,,"Sleep quality has improved tremendously, this going to be part of my night time routine. Well also be recommending this to family and friends. Ingredients, taste, size, dosage, are perfect. I have benefited from taking this product."
79,114587,2022-12-09,,I absolutely love this product. It works well for adults and on my children. My kids love them and feel like they are getting a special treat when I give them these at bedtime. The ingredients are clean and natural too. I will be repurchasing this! 
80,114587,2022-11-23,,"I love these gummies! Not only do they taste delicious, but they ACTUALLY WORK! I fell asleep within 30 mins from taking 2 of them whenever I was struggling to fall asleep. "
81,114587,2022-11-12,,These work like a charm. My sons use them nearly every night and they help him sleep. They aren’t habit forming and they have a nice flavor. I will continue to use them when they come back in stock.
82,114587,2022-10-27,,"This work wonders, I’m so glad I was able to try this product. You get sleepy in less then 20 minutes and get great night rest. I love it! "
83,114587,2023-05-28,Best tasting sleep gummy,Love the natural berry taste and chewy texture of this gummy. 2 gummies at 3 mg of melatonin give the perfect amount of sleep (6.5 hours for me) without drowsiness in the morning after you wake up. So far they have stood up well against HK’s tropical heat!
84,114587,2023-08-13,,good asleep candy before bed time feel fall asleep before time bed 60 gummy
85,114587,2023-05-22,Tastes great and works well! ,Surprisingly these taste great! I normally take melatonin but have switched over to these and they work well! Highly recommend! 
86,114587,2023-05-16,,I love the sleep product made with all natural ingredients. It’s great quality and really has benefited my sleep. 
87,114587,2023-04-24,,Great tasting gummies! We love this brand and love yet another great product!
88,114587,2022-09-27,Best sleep!!,"I have always had trouble falling asleep. But I do have to admit, these made it so much easier. I didn’t even wake up all throughout the night like I normally do!!! The taste isn’t bad at all. And it worked fairly quickly. They aren’t hard like most gummy sleep aids are. And you get quite a good amount for your buck. I highly recommend!!!!"
89,114587,2022-09-26,Easy to consume and works ,"I like that this one is made of gummy form, taste is good and easy to consume. I’m taking this 30mins before bed and this gave me a restful night without feeling groggy the next day unlike the other brand that I’ve had.
Quality is good plus I love the natural ingredients."
90,114587,2022-09-24,Effective and easy to take,"I have always had trouble with falling asleep and staying asleep, and this supplement helps me to wake up less during the night, and go back to sleep easily, if I do.  Love that they contain Chamomile and Lavender, and I also like the taste.  It’s texture is just right, as they are not to hard to chew and digest. Recommend it!"
91,114587,2022-09-19,Great sleep aid!,I’ve been waiting months on my cpap and my sleep has been horrible 😭. I usually can fall asleep easily but wake up several times during the night. These gummies have been a lifesaver. Im finally able to stay asleep all night and I love that I don’t wake up feeling groggy. Def going to make sure I keep these stocked all the time. 
