,product_id,date_posted,review_title,review_text
92,114587,2022-09-06,Must buy!!!,"I can't even begin to say how grateful I am for these gummies. I am a full-time SAHM...so as you can imagine, sleep has been a myth!!! But HEAR ME WHEN I SAY, these gummies are life changing!!! THEY WORK!! For myself, my toddlers and my husband. 10 stars from me! "
93,114587,2022-08-30,He likes it,The quality of this gummies is very excellent I bought this for my father in law who has trouble in sleeping at night and he said from now on he won’t be sleeping wo it and I love also the ingredient and his dosage he take two gummies every night 
94,114587,2022-08-30,the product that every mom needs,"i was refusing to take something to help me sleep, and when i finally gave up and try this gummies they were magic, didn't make feel bad at all, didnt keep me sleepy the next day. they were perfect, i was able to sleep and rest the whole night."
95,114587,2022-10-12,,I love this product. it has good quality and the dosage is enough for me to sleep well. the taste is super good too. I love that the product it is not just melatonin there is a lot of other good stuff in this package.
96,114587,2022-10-11,,I love these sleep gummies! I have trouble falling asleep at night and these gummies help me sleep all night. I get really excited about taking my sleep gummies at night to help me sleep because they taste amazing! Lol 
97,114587,2022-10-11,Good product with room for improvement ,"It was tough to wake up with two gummies but when I reduced the dosage to two intermittently on different days, i had a better experience. 

I like the flavor but wish they would drop the high fructose corn syrup and use honey or natural fruit sugars"
98,114587,2022-10-03,,I love this melatonin it helps me to fall asleep fast and give me relax and wake up fresh and rest well. The ingredient are good for vegan and the quality is good! Taste so good and have alot of benefits 
99,114587,2022-09-26,,This is a great sleep time funny. Helps me get some sleep on the nights I can’t shut off my brain. They have a great taste and great ingredients. 
100,114587,2022-09-24,,works perfectly and taste great too! this was a gift and I'm glad that I received it. I think the difference in shapes of the nutrachamps products is really fun too!
101,114587,2022-09-20,Awesome melatonin supplement!,"I love it, it has a nice quality and good ingredients. It is vegan with natural flavoring. It taste really good, just like a candy treat and it really helped me and my husband sleep earlier than usual and have more energy the next day. It is awesome."
102,114587,2022-09-18,Just what I need to help me sleep,I really like these because they are gummies so they are fast acting and they taste good!!  Plus it is a natural sleep aid no drugs and non habit forming.
103,114587,2022-09-01,work very well,"high quality product , boost your relaxation with a g yummy gummies   the dosage of ingredients are just right , no headache the day after , and you feel sleepy right after 'benefit' , the size is very convenient  and it taste so good .I recommend it "
104,114587,2022-08-31,Sleepy sleepy ,Quality is impressive. It's a berry medley flavor and the gummy tastes great. It has been a benefit to me on nights I can't sleep. The gummies have helped give me a better nights sleep. 
105,114587,2022-08-23,,"I really like this. It’s veré effective, I just love the quality of sleep I get by taking them when I can’t sleep. "
106,114587,2023-08-18,Tastes good but not effective,These gummies are yummy but 2 each night seems to not have much effect on my sleep. I haven't try upping the dosage though.
107,114587,2022-10-05,Works great! ,"I bought these to help my husband sleep.. he wakes up frequently in the middle of the night but lately he’s been sleeping all the way through so I think it’s safe to say these have been working. So far so good! He says they taste pretty good and although the dosage calls for 2 gummies, at times he eat 3 or more (he’s a pretty big guy) so whatever works for him so long as he’s getting his rest! 😄"
108,114587,2022-09-30,,"Took a few tries to really see the difference in my sons sleep. However, in the occasional times we use it, it’s done a great job! He goes to sleep within 15min! I do wish that the dosage would be 1mg per star though instead of 1.5! Overall- little man LOVES his “stars” toddler approved. "
109,114587,2022-08-19,Pretty effective,I'm actually quite shocked at how well these work and they taste pretty good. My child look forward to taking these every night and so do I. We fall asleep in no time!
110,114587,2023-08-04,,"I was sceptical about this at the beginning, but the effect of this turn out great"
111,114587,2023-07-12,Прекрасно!,"Excellent additive, liked the quality, liked the price and packaging, I advise you to buy!)"
112,114587,2023-05-19,,"These gummies taste so good and work well to help me fall asleep and stay asleep, but not wake up groggy.   "
113,114587,2023-05-16,,Great quality sleep gummies. They work great. I also like how it's a no-habit forming sleep aid and a vegan product. 
114,114587,2023-05-12,,"Great product! In love with nutrachamps gummies, all taste delicious!!! "
115,114587,2023-03-19,,my kids love these as well as I do they taste great and keep you asleep
116,114587,2023-03-10,,"Very efficient! Taste is great! Sleep comes quite quickly, Very satisfied!"
117,114587,2023-02-25,,"Nice taste and helps sleeping, good quality used it for 1 week "
118,114587,2023-02-20,One of the best natural sleeping aids in gummy form,"Great tasting gummies, pleasant sleep, not too groggy in the morning."
119,114587,2023-02-19,,"Effective , taste is good and I like that’s it’s vegan . "
120,114587,2022-10-23,,"Amazing quality! better than all the other melatonin gummies i had before, i definitely recommend!"
121,114587,2022-10-21,,This is natural and beneficial for good sleep ..check the allergic components before taking this ..it works for me ..
122,114587,2024-06-12,Didn’t really did it for me,I didn’t feel like the gummy made me sleep better. Has a nice taste though. 
123,114587,2022-10-13,,"Love this sleep gel it helps me sleep and I did sleep well too , been looking for sleeping gel so long I’m glad I found this one . "
124,114587,2022-10-07,Help me sleep much better!!!,"These gummies have changed my life! I am not a fan of regular melatonin, but these gummies are much tastier and help me get a refreshed sleep!! Love it!!"
125,114587,2022-10-04,,Loved these they work amazing ! Within a few minutes you are able to have a great nights rest and no side affects 10/10 recommend ! 
126,114587,2022-10-03,A must buy!,"These gummies are by far my favorite. They help me sleep better at night and relax my mind. They come in the cutest star form, and I love the flavor and texture."
127,114587,2022-10-01,Instant sleep. ,These actually work. Put me right to sleep with out the next day grogginess. They taste great. Ingredients are quality. Good value for the price. 
128,114587,2022-09-27,Works! ,"Purchased these to help myself & my husband to sleep. We have issues waking through out the night & not staying asleep but these bunnies definitely did the trick & had me sleeping through the night.
"
129,114587,2022-09-20,Just reordered! Love these!,"Taste great and do what they need to do. Usually I take 2 gummies about 30 minutes before bed and stay asleep all night. Also vegan, for anyone who likes to avoid gelatin. "
130,114587,2022-09-15,Works perfect!,Tastes yummy and love that its vegan. Is good for kids over 2 so I gave to my kids before bed to get them on a routine for school. Worked perfectly! Cute packaging too.
131,114587,2022-09-14,Best melatonin ever!!,"I will purchase theses gummies, great item, best taste and I love that they are shaped like stars ⭐️  They work great and are definitely a quality item. "
132,114587,2022-09-07,,"These gummies are delicious and perfect for those nights where sleep is missing. They are the perfect size and taste delicious, with the added benefit of a great nights sleep. The quality of these gummmies is top notch and I love that they are vegan ingredients. "
133,114587,2022-09-01,,My daughter and I love these gummies they are very yummy and we look forward to eating them every night before bed! We highly recommend the vegan gummies 
134,114587,2022-08-31,Great nights sleep!,I've been using this product for a week now and am feeling energized in the morning after a great night's sleep. I appreciate the herb blend as an adjuvant to the melatonin. Overall impressed with this company and their products!
135,114587,2022-08-29,,These are great! They help you get to sleep but don’t leave you groggy or gross feeling. The taste is great and they’re perfect for the whole family! 
136,114587,2023-10-17,حللللوه,"Quality good ingredient 
Size good dosage very will 
Benefits great taste good "
137,114587,2023-07-25,,"These taste great & seem to be effective as a gentle sleep aid.
Parcel arrived quickly."
138,114587,2022-09-29,¡Excelente!,Great natural product ! Help me a lot 🙌 100 % recommended. Me encanto!
139,114587,2022-08-28,,"I enjoyed the flavor and texture of these. Effective, as I felt naturally rested during the night. "
140,114587,2023-07-29,,"I believe it is a good product if you're not experiencing chronic sleep deprivation as I am, so I need something stronger "
141,114587,2022-10-17,,"Love these gummies, I can sleep for 10 hours straight, like a baby , I wake up super energetic and they taste amazing "
142,114587,2022-10-17,,These help me sleep so good at night! Love them!!
143,114587,2022-10-04,,I love that these come in gummy form. These really help to relax you before bed. They also taste great as well.
144,114587,2022-10-03,,These gummies put me to sleep fast they work so good i get so much more rest also they have a great taste 
145,114587,2022-09-23,,So excited I got these because I’ve been having trouble sleeping so this is perfect! It taste great which is also a plus!! 
146,114587,2022-09-20,,Love this blend of ingredients for relaxation and good sleep !highly recommend
147,114587,2022-09-19,,So good for getting me to calm down at the end of the day. I use them when I have trouble relaxing. 
148,114587,2022-09-16,Excellent sleep product! Amazing taste,Absolutely love this melatonin sleep product. Tastes so good- made with various herbs like passionflower! Love the cute star shapes :)
149,114587,2022-09-15,,These are a great addition to my daily vitamins and needing some extra sleep! And they taste great. 
150,114587,2022-09-14,,These work well and taste great! The ingredients are natural and I like taking them.
151,114587,2022-09-09,,this one really help my sleep quality and engredient is all vegan. highly recommended and the benefits was good too..thanks to this product 
152,114587,2022-08-29,,"Perfect for those sleepless nights, just take 1 to 2 gummies and you are ready for a good night sleep !"
153,114587,2022-08-28,,"I love the taste of these gummies!! They work so well too, fell asleep much faster."
154,114587,2022-08-25,Gentle and tasty ,These gummies are great taken about 30 minutes before going to sleep. They helped me doze off naturally and have a great flowery flavor.
155,114587,2022-10-03,,"The packaging is great, taste is a bit weird, the quality is good and worthy of money. "
156,114587,2022-08-31,,I sleep like a baby. I love these gummies.
157,114587,2024-01-11,,"I ordered it for my husband to improve sleep. He has a problem falling asleep at night, tossing and turning for a long time and cannot stop thinking about everything. With these chewing gum, he sleeps perfectly, says that the sleep is calm and deep, in the morning he feels rested, he has no problems with morning drowsiness. Pleasant berry taste. Advantage in composition and price, good quality. Its dose is 2 chews at bedtime. I will order again."
158,114587,2023-11-12,taste good,"It is no different from ordinary gummy candies. It is edible for vegetarians, so I chose to try it. It tastes very good and has a very citron flavor. I feel relaxed after eating it. It is a supplement. I sleep well after eating it and do not wake up in the middle. But it cannot be used for a long time. Eating, if you have to switch to eating during work, it will be helpful."
159,114587,2024-10-18,Excellent!,"The quality, size, packaging, ingredients and required quantity are all excellent and enough for two people. It is used to help with sleep, relax the body and relieve psychological stress. "
160,114587,2024-07-12,Beautiful,"It is sweet, it improves sleep, but it differs from person to person. Its texture is like a jelly with a raspberry taste. I have had it for a while, but it is sweet"
161,114587,2024-06-28,Aa,It is nice and makes you fall asleep quickly. Take it half an hour before bed. It is nice and I recommend it. Its size is suitable and very strong. It is nice. I advise you.
162,114587,2024-06-04,good ,"I used it for a while, and its taste was acceptable, but I did not feel that it benefited me once. This is my experience with it "
163,114587,2024-04-19,Great product at a fair price.,"Great quality, clearly broken down ingredients. Fair size, dosage and price. Pleasant taste. All advantages, no disadvantages. Very effective without any unpleasant side effects. Highly recommended."
164,114587,2024-02-07,I can sleep,"My sleep quality has improved. The first night I drank it, I was able to sleep without waking up for the first time in a while."
165,114587,2023-12-23,Prominent,"I have not tried it to be honest, but when it arrives and I see the result, I will inform you, God willing.. Like, no, I have many obligations, and my source of livelihood is herb."
166,114587,2023-12-11,Helps sleep,Sweets that help you sleep peacefully and make you feel energetic and sweet in the morning. Thank you for the wonderful products from IHOP. Please provide them again as soon as possible. 
167,114587,2023-11-26,All,"The quantity is good, enough for a month, because two pills per day, but it does not bring sleep quickly. Otherwise, if your sleep is interrupted, it will not come back again, so the effect is a little mild."
168,114587,2023-11-10,Very excellent for sleep,"The taste is wonderful and the quantity is excellent, especially for people who suffer from sleep problems and insomnia gives a feeling of relaxation and deep sleep. I highly recommend it."
169,114587,2024-06-12,,"I am a person who has a hard time falling asleep, but I feel that it helped me a little, not too much, but it did help. It came in a practical box that kept the candies excellent for multiple use. The taste was really nice. You don't feel that there is an addition to the candy. It's just delicious and the size is really enough for a long time."
170,114587,2023-12-05,It works but taste needs improvement,"I tried giving them to my children: the two older children take it with a bit of reluctance, while the little one really doesn't want to hear about it. The taste is not very pleasant (I tried it) and the consistency is also not like gummy bears but a little drier."
171,114587,2024-08-26,good,"It will make it easier for me to fall asleep, but it does not work at the beginning. Taking it for two more days will have more effects!"
172,114587,2023-11-29,,"Good composition, there is L-theanine, melatonin is not stated in the description, but the packaging states that it contains 3 mg in two jellies."
173,114587,2024-01-20,A good remedy for those who suffer from insomnia,"I order jellies for the second time. Nice taste, good dose of melatonin. After them you want to sleep."
174,114587,2023-04-07,,The ingredients of this product are excellent. I took it to my son. He has sleep disorders. I feel its effect is better than melatonin in his spirit.
175,114587,2024-04-05,The dream will return ,We drink along with magnesium. I feel great and recommend it to you! Cool drug. Price and quality!
176,114587,2024-09-06,Ok,"It tastes sweet and delicious, but for sleeping I don’t think it is strong. I noticed that it disrupts my dreams if I eat it."
177,114587,2023-10-13,Regular user,"Excellent quality! The taste is delicious, just like candy. The size is a little small. I would be happy if there were more according to the packaging. The dosage is 2 units each time. The advantages are that it puts you to sleep really quickly and helps you sleep well."
178,114587,2023-09-05,,"Very soft and pleasant. I want to normalize my sleep schedule and go to bed earlier, and these stars help me. The ingredients are good, quite natural. The taste is pleasant, they smell of indefinite berries. The dosage is suitable for an adult. I think you can start with one pad, and add a second one if the effect seems weak. It should be remembered that melatonin is a natural remedy, but doctors do not recommend taking it for more than 2 months in a row, so that the body does not forget how to produce it on its own. So in a long reception, you will have to divide the breaks. I recommend to buy!"
179,114587,2024-10-19,,Quality product. Convenient size. Suitable and useful for any age.
180,114587,2024-05-02,Great sleep,"Chewable tablets with a slightly sweet taste. Excellent help with falling asleep, sleep without interruption"
181,114587,2024-02-26,,Wonderful I will order more Wonderful I will order more Wonderful I will order more
182,114587,2024-01-20,,High quality and effective product. Natural ingredients suitable for any age. I recommend for shopping.
183,114587,2023-12-03,,You can fall asleep quickly after eating it and it tastes very good👍
184,114587,2023-11-08,Great,"The quality of the ingredients, the health and the composition of the packaging suited me! I also liked the taste"
185,114587,2023-10-25,,"One time, the taste is amazing. I recommend it, the quantity is large, and the taste of berries is amazing"
186,114587,2023-06-10,,"It is easy to eat with a gummy that tastes like blueberries. I wear a smartwatch to collect sleep quality data every day, and on the third day after starting to take the supplement, I saw an improvement in quality. I would like to continue this way."
187,114587,2023-02-16,,"I just received the product yesterday. I have endless insomnia. And you know, miracles happen, I didn’t even notice how I fell asleep. delicious stars."
188,114587,2022-11-24,,"I made it small and let my child drink a little. It helped me fall asleep and helped me live a regular life. It was great for me to fall asleep. However, it was not 100 points for sound sleep. After all, I woke up and was sound until morning! I didn't go. However, since it is a product with a sense of security, I thought that I would like to repeat it again."
189,114587,2023-11-08,Average taste,"The taste is average, but the effect is not bad. I should switch to other flavors."
190,114587,2023-09-23,Lalnaum - Lalkabar,"The idea is that the body contains a hormone or substance called melatonin, which is responsible for sleep and the quality of sleep. Sometimes, due to depression, anxiety, stress, or other things, the body gets tired and the body secretes this substance in a small amount, so the person does not sleep. This product consists of melatonin and herbs that help with sleep, so you can take Take two pills to increase the secretion of the substance and give you sleep and make your sleep quality good. This is not a sedative and does not cause addiction, but take it only when necessary so that your body does not depend on it. Give it six out of ten."
191,114587,2023-09-14,sleep naturally,"I fell asleep naturally after an hour, and I feel like my sleep habits have gotten better. The taste is also delicious. The only thing that bothers me is that if I don't brush my teeth again before going to bed, I'll probably get cavities."
192,114587,2023-08-24,,"The smell is good, the use is great, the quality is good, the size is good, the quality is very excellent, it is worth using, and its effect is very strong. The ingredients are good. Magnesium is excellent. The quantity is large. The benefit is good."
193,114587,2023-05-28,Excellent!,"The product is delicious, its size is good, and it is more than excellent. After chewing two pills for about 20 minutes, I go into a comfortable sleep and wake up comfortably as well."
194,114587,2023-03-05,,"I used to sleep lightly, but since I started using this, I've been able to get good quality sleep. It is non-toxic and safe to take."
195,114587,2024-10-12,"Ok, but I won't ask for it again ","I did not feel any results and I took it because my sleep is interrupted, but I did not see any results."
196,114587,2024-09-11,,Aroma Quality Ingredients Taste Flavour Usage Size Package Benefit Composition Description Diet Serving Age Very pleasant feeling ✅✅
197,114587,2023-12-15,I didn't feel any difference!!,"I tried it for a while and did not feel any results. Maybe if I continue, the situation will change, I don’t know!!"
198,114587,2022-10-07,,"Quality is good Ingredients shouldn't be too bad Size is good but could last 2 months minimum. The dose is 2 slugs but they are easy to ingest Benefits is for sleeping, let's see if I can sleep well and get rid of tiredness. Taste is a little sweet…but, not horrible…"
199,114587,2023-03-23,,Melatonin is something you can't do without because you're a light sleeper. This is a package purchase. Because it's better to be a little cute. I hope I can fall asleep.
200,114587,2024-07-10,,"Very good, it always works! Recommend it🤍"
201,114587,2023-09-01,,"A natural chewing gum made from soothing herbs that helps to fall asleep faster, longer and deeper"
202,114587,2023-04-07,,A very wonderful and effective product that is the savior if you mess up sleep
203,114587,2022-09-10,,Pleasant-tasting marmalades really have the effect declared by the manufacturer. Helps to fall asleep gently in half an hour after taking and have a good night's sleep
204,114587,2023-10-14,,These gummies have excellent composition and give very good results.
205,114587,2023-10-13,,Quality goods. Natural ingredients. Suitable for any age. Arrived quickly.
206,114587,2023-09-10,excellent,"Great product, really helps, excellent ingredient, good dose, very pleasant taste, going to order again in the next order"
207,114587,2023-08-22,,"One of the best I've tried, excellent, excellent, excellent, sleeps deeply, improves sleep quality, and wakes up while you're relaxed"
208,114587,2023-08-19,,"Excellent quality, natural ingredient, pleasant taste. The size is great. Active Dose as directed."
209,114587,2023-07-23,excellent! and amazing,"An excellent product that helps you fall asleep at night, relieves tension and stress, and has a wonderful, non-addictive taste"
210,114587,2023-07-10,Excellent!,Excellent product! Fully complies with the described criteria and qualities indicated on the label!
211,114587,2023-06-11,OK,"Benefits: After eating, it improves insomnia and can be trained patiently"
212,114587,2023-06-01,,"I bought my mother instead of sleeping pills that she used to take on a daily basis. Excellent taste, helps sleep. Really recommended"
213,114587,2023-05-16,,"This product was recommended by a friend, and it worked well after trying it, and I will continue to buy it in the future!"
214,114587,2023-03-21,"Excellent, by God, for me, I took it from here for half an hour while I was asleep, praise be to God","Excellent, by God, for me, I took it from here for half an hour while I was asleep, praise be to God"
215,114587,2023-03-15,,My husband suffers a lot from insomnia I bought him to try and he says it works very well
216,114587,2023-09-15,,"A little too sweet taste, portion size - 2 pieces, relatively with a lot of sugar, dosage - suitable for inducing sleep"
217,114587,2023-07-11,Below average,"Its taste is sweet, but its effect is very light. It means that if you are drowsy, it will make you sleepy, but if there is no sleep, it will not bring it."
218,114587,2023-04-01,,It is really sweet for those who have insomnia and their sleep is intermittent.
219,114587,2022-10-05,Good,"Excellent, useful, helps sleep, comfortable to use, and the company is great"
220,114587,2023-10-14,assistant,"As someone who takes a long time to sleep, this product helped me, but at this price there are better products"
221,114587,2023-05-19,,"Good, the use tastes delicious and sleeps, but you have to be in the bed directly after taking it"
222,114587,2023-05-13,,good taste. I don't know how much it helped me personally.
223,114587,2022-12-20,,"Good in terms of ingredients, the quantity is appropriate, and the package is well closed. I hope to get the desired benefit, thank you"
224,114587,2023-08-21,Below average,It is not clear how the effect after 3 days of chewing the gum currently did not help sleep
225,114587,2022-09-20,,I can sleep surprisingly quickly.
