,product_id,date_posted,review_title,review_text
128,56089,2021-05-08,It has flavor!,The product just arrived… I just didn't like it because it tastes like lavender! It is not pleasant to take .. I hope the result is favorable.
129,56089,2021-01-24,,"Pure natural composition. I am a nutritionist, if it was helpful to you, please click 👍Please🤗Thanks💚"
130,56089,2019-07-28,Where alcohol is a big alert (disgusting),"On the basis of the positive evaluation, what is a division of God used the whole camel, and taste disgusting Yarby you praise but the result nausea, and pay attention to alcohol Madrit only two dimensions if Valadk assessment Ht Yes."
131,56089,2022-01-15,very strong taste of lavender,I didn't think it worked and it tastes very strong like lavender. too bad!
132,56089,2021-05-02,,used during a difficult exam. Super remedy !!
133,56089,2021-01-25,Below average,"It really tastes like chemistry But this is not the most important thing One could endure if there was an effect, but it is not particularly visible"
134,56089,2016-07-03,working,Really helps to calm the mind
135,56089,2020-09-15,Horror!,"It tastes creepy! It's just creepy. Chemical extract from some extracts. The water becomes cloudy. I drank it for peace and it worked just the opposite! I almost fell into hysterics, burst into tears. Don't mess with the nervous system! Better to drink herbal tea, go in for sports and get a good sleep."
136,56089,2021-01-21,,An effective tool that works.
137,56089,2020-08-16,"calm, only calm)","buy, buy and will buy, working product"
138,56089,2020-12-17,Good,
139,56089,2017-12-10,A little better,Complex and uneasy symptoms seem to be more relaxed
140,56089,2021-01-21,Great for stress relief!,Great for stress relief!
141,56089,2020-11-30,,Helps
142,56089,2018-08-05,Not bad,Soft soothing.
143,56089,2018-07-21,Grandmother,Calm down simple
144,56089,2018-07-01,His majesty,God helps
