,product_id,date_posted,review_title,review_text
120,66284,2023-07-09,,"Good product but our cats are bad with powders, we were able to mix it together with the dry food and some agreed to eat that way"
121,66284,2024-01-23,,"Cats are willing to eat, useful, and relaxed."
122,66284,2022-12-29,Use in the last week,"Easy to use packaging, the dog takes the ball happily. After a week you still don't feel any change, let's hope that later on."
123,66284,2022-10-05,Good to have at home especially in our country.,"The materials from which the supplement is made are excellent. I have faith in this company. My dog is emotional by nature and I bought the supplement to make him less stressed. But he - who usually likes different supplements and snacks too - did not want to eat this supplement. I cut in half and wrap in a piece of bread or pasta. Last Purim, in the playground in front of our house, children threw firecrackers. The dog got under a lot of stress and this drug, although not his favorite, helped really quickly. Works pretty fast but no duration. Good to have such a product at home. I haven't tried giving it to a cat yet."
124,66284,2022-08-07,,"second time I buy for my dog, he is already old and sometimes he gets nervous about being alone. it worked great for him! he eats the pill very well"
125,66284,2022-01-21,Great for calming the dog!,"I have bought this product several times for my dog. The best out of everything I've tried. It is especially good to give before the road or on the eve of departure, so that the dog does not get nervous. She sleeps beautifully and very calmly after it!"
126,66284,2023-09-23,,Quality goods. Suitable for any age. Convenient use according to instructions.
127,66284,2023-08-24,,Good product and very simple explanation. My boys really like the balls
128,66284,2023-07-05,,Quality product at an affordable price. Natural and safe composition. Suitable for any age. I recommend shopping.
129,66284,2023-01-07,,I hope the dogs will be loved and that this will really help them. Arrived quickly and well packaged
130,66284,2022-12-04,,"Wow, amazing quality, ingredients at the highest level, Hawaii, Hawaii, real goods from the shores of Hawaii"
131,66284,2024-01-03,Only my dog ate them,"My cat didn't want them, neither did my dog, only my dog ate them. It smells too bad."
132,66284,2022-10-06,Good,"The dog does not like it very much, but it has stopped scratching. The result is the main thing! That's why I recommend it!!"
133,66284,2022-09-30,,"my dog likes the taste, the packaging is convenient to use, good quality and composition, have a slight calming effect, be sure to take it regularly"
134,66284,2022-06-22,,"I can leave my dog at home for a few hours alone, I don't know if it really works but he thinks it's delicious!"
135,66284,2022-01-11,,"I began to give medications to the cat as prescribed by the veterinarian, the animal is clearly better, I'm not sure that only from them, so I give it in combination with medications, but definitely better."
136,66284,2023-08-09,,"To mix food, the effect is not easy to see, hope to improve"
137,66284,2017-02-02,Tablets work,"Very helpful when moving. Our cats calmed down after taking half the pill. One cat chewed with pleasure, the second had to be thrown forcibly. Animals remained adequate, slept well in a new place. One of the cats was a little messed up, but it's good for him, he usually has stool delays."
138,66284,2023-07-28,,Does not work. My dog didn't like the taste. Waste of money if you liked my review please like me 👍🏼👍🏼👍🏼👍🏼
139,66284,2022-10-18,,The taste is not appealing and the dog does not like it very much. But it seems to work a little bit after eating it. Give it when you need it.
140,66284,2023-05-29,,"Dogs love to eat it, but it doesn't seem to have a soothing effect"
141,66284,2022-03-22,,"The puppy will tremble when it rains and thunderstorms, and it will calm down a lot after eating this for half an hour"
142,66284,2021-10-31,,"Excellent product, it helped my dog a lot to get used to his new home and to be able to fall asleep at night"
143,66284,2023-06-23,,"Very good, refreshing after eating, will repurchase"
144,66284,2022-04-24,,I did not feel it calmed her down after taking the drug. We have experience with drug-based drugs that have had a huge impact
145,66284,2019-12-24,Very good,My dog's orthopedist praised this supplement a lot and I have been giving it to her for some time now and she looks great
146,66284,2022-10-18,,"The use is excellent, the quality and the size are suitable, the smell is the packaging, the benefit is the size combination"
147,66284,2022-09-08,,arrived very fast! I'm going to start giving it to my pet yet!
148,66284,2022-08-09,,"Excellent product from a quality company. Excellent for stressful situations for pets, for example a visit to the vet"
149,66284,2022-07-25,Nice,"The dog seems to be relaxed, but it doesn't like to eat, so it needs to be mixed with the food."
150,66284,2023-05-14,,"It's useless, it's already eaten into a bottle, it can't help the dog relax at all, so don't buy it!"
151,66284,2021-12-11,Ok,I didn't eat it because I had to eat it
152,66284,2021-01-16,,My cat wants to grab it as soon as it smells it feels delicious
153,66284,2021-01-30,,I bought it for a dog who is anxious when thunder strikes. I hope it works
154,66284,2021-01-27,,"It’s a big bottle, it’s mixed with cat food every day, but after eating, the effect is not obvious"
155,66284,2019-11-02,No obvious changes have been seen,"No obvious changes have been seen, dogs will not take the initiative to eat"
156,66284,2019-08-14,NOT COMPLIANCE WITH THE DECLARED ACTION!,"The tablet size is very large for cats with a diameter of 1.2 cm and a + convex shape ... even by dividing the table. 1/2 animal has difficulty swallowing. THERE IS NO SLEEPING ACTION ... The remedy gives easy relaxation in a stressful situation, as indicated by its composition. It is necessary to grind it into powder and put it into a “dummy” capsule ... None of the cats had the desire to eat - even a street cat treated it. .. - refused. Conclusion - suitable only for dogs (due to size). The manufacturer is misleading by positioning these tabs. as a LIABILITY ... DO NOT RECOMMEND to purchase to improve the intestinal motility of the animal. Money thrown away!"
157,66284,2019-12-18,Approved,Very good Approved
158,66284,2019-11-20,Very bad,"First, the smell is unbearable. Second, the grain is too big for cats."
159,66284,2019-11-13,Good,I recommend
160,66284,2019-01-09,Stinky,Very stinky dog can’t smell it once at the table.
161,66284,2019-01-03,"Special smell, cats also like to eat","Special smell, cats also like to eat"
162,66284,2021-09-14,,Excellent product!
163,66284,2021-01-26,Not satisfied,My dog doesn’t like the taste and refuses to eat
164,66284,2021-01-06,,So-so. Kitty was not impressed. It is also difficult to gnaw
165,66284,2021-09-19,,The master didn't like it.
166,66284,2021-01-24,Ok,Not very effective
167,66284,2021-01-24,,I do not know
