,product_id,date_posted,review_title,review_text
135,99634,2023-11-08,Great,"A good complex of herbal ingredients. Natural composition. The supplement is effective and useful for various stress, depression and anxiety conditions. Calms, helps improve sleep, relieves anxiety. The capsules are relatively small, but not small either."
136,99634,2023-10-24,excellent,I do not praise any product or lie for the sake of rewards. This has an effect for those who suffer from stress and anxiety at a rate of 30% or less.
137,99634,2024-10-09,really calming and sleepy,"I have had problems with sleep for a long time, the doctor prescribed to drink 2 pills a day after dinner. 2 turned out to be a lot for me, the next day I felt sleepy in the morning, so I drank 1. but! it is precisely the quality and depth of sleep that the drug does not greatly affect. that is, it gives sleepiness, but the sleep itself does not improve much. 

"
138,99634,2023-09-24,A stable nervous system and sound sleep,"I'm in Ukraine, in Kyiv Constant ""arrivals"" and explosions, aerial alarm. All this led to a severe disruption of the sleep regime and overall exhaustion. The first dose, she immediately drank 2 pills. She slept like a child. She became much calmer and more competent, despite all the troubles"
139,99634,2022-03-09,"Total calm, instead of disturbing and obsessive thoughts, sound sleep, you can easily react to stress!!","One of the best drugs that relieve feelings of anxiety. I was prescribed by a naturopathic endocrinologist, due to the fact that I often scrolled thoughts in my head, if bad things happened, I scrolled them many times, respectively, no sleep. I liked the drug because the composition is completely vegetable, vegan. I apply the course, this is my second jar. Started with 3 capsules, then switched to two. The capsules are in a soft shell, the preparation is liquid inside, it is easy to drink, besides, a very pleasant aroma emanates from the capsules, it even becomes calmer even from the smell. I noticed a stable, good, deep sleep at night, a state of complete relaxation, I don’t even hear extraneous noise. I have become more responsive to stress. If you have a condition - your head is spinning from different questions, a constant feeling of anxiety, imposing thoughts, an acute reaction to stress - this drug is definitely for you! I recommend from the bottom of my heart!"
140,99634,2023-10-12,Ambiguous opinion,"I really love Gaia supplements, their compositions are great, but from this drug I noticed that I feel a little dizzy, it even feels heavy, strange thoughts may appear, I don’t know how this is connected, I’ll keep an eye on it, perhaps from the multi-component composition. Something like this"
141,99634,2023-09-21,,"I have high hopes that it will help overcome constant, obsessive anxiety. Many natural ingredients are a definite plus. As it solves my problem, I will add a review. I want to return to a feeling of carelessness. Additive of a good brand, quality proved by other drugs as well."
142,99634,2024-10-12,,Effective product at a reasonable price. Suitable for any age. Fast delivery.
143,99634,2024-10-07,,Quality product at an affordable price. Fast delivery and high efficiency. Use according to instructions.
144,99634,2024-09-23,soothing,A good supplement without additives I hope it works it has good ingredients
145,99634,2024-09-20,Class ,Very high quality product. Bioavailability of components is good due to liquid form. 
146,99634,2024-09-19,for stress recovery,"The doctor prescribed it to normalize sleep, improve overall well-being and recover from stress."
147,99634,2024-09-17,Calms well ,"I use it in the second half of the day, it soothes well and is suitable for sleep, I sleep better "
148,99634,2024-09-16,,Support in stressful conditions Support a calm response to stress Suitable for children
149,99634,2024-09-02,Great!,"Excellent product! It fits me perfectly, I am absolutely delighted! I recommend it!"
150,99634,2024-08-09,Great,"The quality, ingredients and health benefits are undeniable! The taste, dosage, size are all appropriate in this brand! "
151,99634,2024-07-27,,"Beautiful, healthy and useful. A sufficient quantity strengthens the muscles and helps with sleep"
152,99634,2024-07-15,super,"great product, superior quality, great perfume, great composition, thank you iherb"
153,99634,2024-06-05,,"Helps to calmly respond to stress, helps get rid of anxiety, support for stress"
154,99634,2024-05-15,,Quality product at an affordable price. Suitable for any age. Fast delivery. Recommend to everyone.
155,99634,2024-05-13,,"Wonderfully calms, relieves anxiety, and when taken at night - peaceful sleep. I have already ordered three times."
156,99634,2024-04-05,,"An excellent complex for stress, it actually has a fast effect, I take two capsules before important events and feel less stressed"
157,99634,2024-02-15,,"It helps me a lot with panic attacks, in stressful situations. I take both 1 and 3 capsules, depending on the level of anxiety. "
158,99634,2023-09-24,Great for relaxation,"I bought it for children aged 6 and 9 years old in connection with the start of school, so that they could more easily bear the load and stress. I really liked the effect, children are less irritable and control their emotions, they sleep better at night."
159,99634,2023-07-31,Effectively relieve anxiety,"When I have sudden anxiety and stress, I will take 2-3 tablets, which can effectively relieve anxiety and have no side effects, which is great!"
160,99634,2023-01-09,Excellent!,"It helps, but the main thing is to drink according to the instructions. Three at once, or if 1 then the thickness is 1 per day. Do not divide doses into 1 capsule three times a day."
161,99634,2024-03-20,,"The effect is not very obvious, and the taste of the medicine is a bit strong"
162,99634,2022-12-12,,"In terms of quality, good ingredients are natural, the package is sufficient for 20 days, a good food supplement, and the price is very high"
163,99634,2023-09-18,Excellent!,"Excellent supplement with a composition of natural plants, flavorless and being soft makes it easy to swallow. It also improves the quality of sleep, makes me restless, and benefits and calms my nerves. Highly recommended!"
164,99634,2023-07-14,,I'm buying it for my wife. I take it 5 times. Healthy ingredients. Helps well. It's worth spending money on. Effective. Qualitatively. For any age. I recommend it with all my heart. 
165,99634,2023-04-18,,"My mother is in her 90s and suffers from dementia and anxiety. When she has anxiety, she can be relieved by taking 1-2 capsules. It is a very good supplement!"
166,99634,2022-11-26,A good remedy for peace of mind.,"I drink 2 pcs. once a day after breakfast. The composition is natural. There are benefits, although you need to drink at least 2 months to feel the cumulative effect. The packaging is dark glass, as always with this brand. I recommend."
167,99634,2023-07-07,,"Gaia's supplements have good contents and you can rest assured, but I didn't have any experience with this product. I'm not sure. Unfortunately, it's expensive, so I don't feel like looking at it in the long run until I can feel the effects, especially since the yen has weakened."
168,99634,2022-04-26,Great drug!,"The quality of the company is super, I bought a lot of products from this company. Ingredients , Herbs in general The composition is very good. The supplement is really good. Sleep improvement guaranteed. The problem of poor sleep goes away in combination with magnesium I take. The taste is pleasant."
169,99634,2022-02-14,,"I have been in love with this brand for a long time. At first I bought an extract of Rhodiola rosea in capsules, now - when they are not sent to Russia - I found this supplement. For me, it also turned out to be quite effective in stressful periods, in the complex prevention of depression. I take it on a regular basis. The body perceives this remedy well - there are no undesirable reactions. Regarding the desired action - the effect is soft, cumulative. I take 2 capsules in the evening."
170,99634,2022-02-09,,"I drink this drug on the recommendation of a nutritionist, I take 1 capsule in the evening, and 2 capsules at night. Excellent drug, I walk calmly, my sleep improved. Previously, there were constant mood swings + stress, now after using the drug, everything is fine! I drink it in combination with magnesium."
171,99634,2022-01-30,,"I drank this complex on the recommendation of a naturopath. It has a cumulative effect, at the beginning I drank according to the recommendation on the bank, then 1-2 at a time, depending on the emotional state. What I noted during the reception: fast falling asleep, stable emotional state (which was unstable after covid). There was a situation: I went to bed with heavy thoughts, woke up in the middle of the night and could not fall asleep for a couple of hours, I decided to drink 2 capsules, I didn’t even notice how I fell asleep. Please note that in-kind payments recommend changing such drugs so that there is no addiction and the effect is maintained."
172,99634,2021-11-01,,"With age and constant stress, mood swings and problems with sleep appeared. On the recommendation of a doctor, I purchased this dietary supplement and did not regret it. It really magically soothes and evens out the mood, there is an even positive attitude without any differences. In the instructions, it is recommended to take 3 capsules, but for myself I chose 1-2 capsules, supplementing with other dietary supplements and getting the desired effect. I fall asleep perfectly, the tone is deep and uninterrupted. The capsule itself is transparent, filled with dark herbaceous contents, and has a corresponding odor."
173,99634,2023-01-29,,"I like Gaia's capsules very much, but the effect of the used ones is not obvious. After taking this, there is a lingering fragrance of lavender in the mouth, like drinking flower tea."
174,99634,2023-09-21,Great,The best tool on the site for peace and balance! It works like a bomb even from 1 capsule
175,99634,2023-09-23,Excellent!,Excellent product! Fully complies with the described criteria and qualities indicated on the label!
176,99634,2023-09-04,,"I take this supplement when I have a bad mood, stress, fatigue. He helps me a lot."
177,99634,2023-09-04,,"I haven't tried it many times to recommend, but overall it meets what I was looking for"
178,99634,2023-06-16,Excellent!,I liked it very much. The quality is top notch. The only downside is that it's not much of a price.
179,99634,2023-03-14,Excellent!,"Good day! Super product, I recommend it to everyone for use, I take it all the time"
180,99634,2023-01-31,The scent alone is soothing.,Feel the relaxing effect. I feel like I can breathe better. I thought it was a great supplement.
181,99634,2022-12-13,,"Plant formula, good quality and safe ingredients. Help stabilize mood."
182,99634,2022-11-25,,works pretty fast and efficiently. I drink mainly during stress and at night
183,99634,2022-09-23,Excellent!,"I really like these capsules. True, I can’t understand how some here drink only one at a time and at night, or during the day. Personally, my sleep deteriorates, it becomes very disturbing. It is ideal to drink capsules in the morning, one two three at will."
184,99634,2022-09-04,,CALM is great. I hope there will be a result. I've been taking it for a few days and so far I haven't had any side effects.
185,99634,2022-08-24,Relaxes well,"I keep this complex in case of stressful situations, of which we have a lot in our country now. It really works, quickly relaxes. Worth the money, like all other Gaia Herbs products"
186,99634,2022-07-21,,"Total calm, instead of disturbing and obsessive thoughts, sound sleep, you can easily react to stress!!"
187,99634,2022-01-10,,"I can't really praise this remedy, but I'm still crazy. The brand love this one of course. But their drops with lemon balm, with a similar composition, helped me to calm down more."
188,99634,2021-12-11,,"I drank this complex on 1 capsule 2 times a day. Result: excellent sleep, great mood, calm. Minus the price and volume for such a price. Like"
189,99634,2021-12-12,Excellent!,"Improves sleep, worry less during the day, no complaints about portability)"
190,99634,2021-05-06,Sumptuously!!!,"I drank this complex on 1 capsule 2 times a day. Result: excellent sleep, great mood, calm like a boa constrictor :). I wanted to save some money and bought a cheaper complex. The result is ZERO !. Returning to this complex. Recommend."
191,99634,2021-01-22,Soothes well,"Saw before bedtime, it helps to fall asleep well. The only inconvenience is to drink about 3 pieces at a time and there are not enough capsules, enough for less than a month. The capsules are black, a rather strong herbal taste remains."
192,99634,2020-11-17,Recommend!,"Great remedy from a trustworthy brand. I take it when necessary, when it is necessary to calm down. I'm happy with the result!"
193,99634,2020-06-22,A great!!!,"The first thing that pleases me pleasantly is the light smell of lavender. I love the smell of lavender and it already calms me))) Seriously, good and I hope a safe sedative. Recommend"
194,99634,2022-09-24,,great supplement. drink courses. There were no allergies when taking. which I am very happy
195,99634,2022-05-19,,I bought it because it was so stressful. I like the ingredients.
196,99634,2022-01-12,,"I liked the product, it gives a relaxing effect. As for ASAP, perhaps the manufacturer got excited, but, in general, there is an effect)"
197,99634,2022-01-07,,"perfectly relieves anxiety, soothes, but does not pull you to sleep"
198,99634,2022-01-04,,"I take for a better sleep. Warning: best taken before bedtime, as it reduces concentration"
199,99634,2021-12-09,,"It soothes well, but for me personally, it does not affect the quality of sleep. I will continue to search)"
200,99634,2021-11-09,,The brand always has high quality supplements. Soothing herbs are always available. I try to alternate them. This complex has good sedative properties.
201,99634,2020-10-26,Good stuff,"Someone writes - ""I took 1 capsule. Doesn't help."" My friends, it also says ""3 capsules each""."
202,99634,2022-03-24,Good,"I would not say that this formula helps to cope with stress quickly. After the course, maybe. But not ASAP."
203,99634,2021-01-23,,"Helps to calm me down in tense and stressful situations, but makes me somewhat groggy even with 2 capsules. I can only have them before bed"
204,99634,2022-09-04,,"CALM is awesome. really liked it, high quality"
205,99634,2022-07-02,Excellent!,Very well . Good value for money
206,99634,2022-04-27,,excellent soothing. sound sleep. from stress number 1
207,99634,2021-11-26,,I sleep better and feel calmer throughout the day.
208,99634,2021-10-26,,Peace and relaxation in the big city
209,99634,2021-07-07,,With him my sleep became much stronger and it pleases
210,99634,2021-04-18,,"It soothes well, but the effect is cumulative, I take it at night."
211,99634,2021-04-09,,Mom drinks at night to restore the adrenal glands! We hope for the result
212,99634,2021-01-21,,"A good sedative, it really works quite quickly, helps to calm the hysterics a little, reduces anxiety. I did not notice the hypnotic effect"
213,99634,2021-10-27,,"A touch of lavender, the price is high"
214,99634,2020-11-20,,"Dear capsules, I took one month a day, I did not feel any effect. There is still half the package left, I will try to take two at a time and, according to the situation, there may be an action."
215,99634,2021-08-09,,Good delivery for peace of mind and quality sleep The nervousness went away 2 weeks after the start of PMS was much calmer
216,99634,2022-02-17,,Excellent quality!
217,99634,2022-01-03,,"Good sedative, improves sleep."
218,99634,2022-01-01,,Working
219,99634,2021-12-20,,I didn't feel much effect with 2 tablets. ..
220,99634,2021-08-31,Excellent!,"I take it as directed by a doctor before bedtime, cumulative effect (this is the main thing). I sleep well"
221,99634,2021-09-21,,Helps Provide Relief From Occasional Anxiety Gluten Free
222,99634,2021-01-26,,"I like the effect, I will buy more."
223,99634,2021-04-26,Ok,
224,99634,2021-05-25,,"Wonderfully calming, straight nirvana"
225,99634,2020-12-14,,The drug did not help me at all. Doesn't soothe.
226,99634,2020-12-19,I did not get that,I did not feel the effect
